CUTLASS/cutlassgemm-benchmark/cutlass_roller_half_cudacore_performance.gemm.csv
Problem,Provider,OperationKind,Operation,Disposition,Status,gemm_kind,split_k_mode,m,n,k,A,B,C,alpha,beta,split_k_slices,batch_count,op_class,accum,cta_m,cta_n,cta_k,stages,warps_m,warps_n,warps_k,inst_m,inst_n,inst_k,min_cc,max_cc,Bytes,Flops,Flops/Byte,Runtime,GB/s,GFLOPs
1,CUTLASS,gemm,cutlass_simt_hgemm_256x128_8x2_nn_align1,passed,success,universal,serial,65536,1000,2,f16:column,f16:column,f16:column,1,0,1,1,simt,f16,256,128,8,2,4,2,1,1,1,1,50,1024,131338144,393216000,2,0.228454,535.416,1721.2
1,CUTLASS,gemm,cutlass_simt_hgemm_256x128_8x2_nt_align1,passed,success,universal,serial,65536,1000,2,f16:column,f16:row,f16:column,1,0,1,1,simt,f16,256,128,8,2,4,2,1,1,1,1,50,1024,131338144,393216000,2,0.22743,537.827,1728.95
1,CUTLASS,gemm,cutlass_simt_hgemm_256x128_8x2_tn_align1,passed,success,universal,serial,65536,1000,2,f16:row,f16:column,f16:column,1,0,1,1,simt,f16,256,128,8,2,4,2,1,1,1,1,50,1024,131338144,393216000,2,0.227123,538.554,1731.29
1,CUTLASS,gemm,cutlass_simt_hgemm_256x128_8x2_tt_align1,passed,success,universal,serial,65536,1000,2,f16:row,f16:row,f16:column,1,0,1,1,simt,f16,256,128,8,2,4,2,1,1,1,1,50,1024,131338144,393216000,2,0.22784,536.86,1725.84
2,CUTLASS,gemm,cutlass_simt_hgemm_256x128_8x2_nn_align1,passed,success,universal,serial,128,1000,2,f16:column,f16:column,f16:column,1,0,1,1,simt,f16,256,128,8,2,4,2,1,1,1,1,50,1024,260512,768000,2,0.0106496,22.7821,72.1154
2,CUTLASS,gemm,cutlass_simt_hgemm_256x128_8x2_nt_align1,passed,success,universal,serial,128,1000,2,f16:column,f16:row,f16:column,1,0,1,1,simt,f16,256,128,8,2,4,2,1,1,1,1,50,1024,260512,768000,2,0.010752,22.5652,71.4286
2,CUTLASS,gemm,cutlass_simt_hgemm_256x128_8x2_tn_align1,passed,success,universal,serial,128,1000,2,f16:row,f16:column,f16:column,1,0,1,1,simt,f16,256,128,8,2,4,2,1,1,1,1,50,1024,260512,768000,2,0.010752,22.5652,71.4286
2,CUTLASS,gemm,cutlass_simt_hgemm_256x128_8x2_tt_align1,passed,success,universal,serial,128,1000,2,f16:row,f16:row,f16:column,1,0,1,1,simt,f16,256,128,8,2,4,2,1,1,1,1,50,1024,260512,768000,2,0.0106496,22.7821,72.1154
3,CUTLASS,gemm,cutlass_simt_hgemm_256x128_8x2_nn_align1,passed,success,universal,serial,65536,1024,2,f16:column,f16:column,f16:column,1,0,1,1,simt,f16,256,128,8,2,4,2,1,1,1,1,50,1024,134483968,402653184,2,0.229376,546.038,1755.43
3,CUTLASS,gemm,cutlass_simt_hgemm_256x128_8x2_nt_align1,passed,success,universal,serial,65536,1024,2,f16:column,f16:row,f16:column,1,0,1,1,simt,f16,256,128,8,2,4,2,1,1,1,1,50,1024,134483968,402653184,2,0.23081,542.646,1744.53
3,CUTLASS,gemm,cutlass_simt_hgemm_256x128_8x2_tn_align1,passed,success,universal,serial,65536,1024,2,f16:row,f16:column,f16:column,1,0,1,1,simt,f16,256,128,8,2,4,2,1,1,1,1,50,1024,134483968,402653184,2,0.229069,546.77,1757.78
3,CUTLASS,gemm,cutlass_simt_hgemm_256x128_8x2_tt_align1,passed,success,universal,serial,65536,1024,2,f16:row,f16:row,f16:column,1,0,1,1,simt,f16,256,128,8,2,4,2,1,1,1,1,50,1024,134483968,402653184,2,0.229069,546.77,1757.78
4,CUTLASS,gemm,cutlass_simt_hgemm_256x128_8x2_nn_align1,passed,success,universal,serial,128,1024,2,f16:column,f16:column,f16:column,1,0,1,1,simt,f16,256,128,8,2,4,2,1,1,1,1,50,1024,266752,786432,2,0.0108544,22.8877,72.4528
4,CUTLASS,gemm,cutlass_simt_hgemm_256x128_8x2_nt_align1,passed,success,universal,serial,128,1024,2,f16:column,f16:row,f16:column,1,0,1,1,simt,f16,256,128,8,2,4,2,1,1,1,1,50,1024,266752,786432,2,0.0106496,23.3278,73.8462
4,CUTLASS,gemm,cutlass_simt_hgemm_256x128_8x2_tn_align1,passed,success,universal,serial,128,1024,2,f16:row,f16:column,f16:column,1,0,1,1,simt,f16,256,128,8,2,4,2,1,1,1,1,50,1024,266752,786432,2,0.0106496,23.3278,73.8462
4,CUTLASS,gemm,cutlass_simt_hgemm_256x128_8x2_tt_align1,passed,success,universal,serial,128,1024,2,f16:row,f16:row,f16:column,1,0,1,1,simt,f16,256,128,8,2,4,2,1,1,1,1,50,1024,266752,786432,2,0.0106496,23.3278,73.8462
5,CUTLASS,gemm,cutlass_simt_hgemm_256x128_8x2_nn_align1,passed,success,universal,serial,65536,4096,2,f16:column,f16:column,f16:column,1,0,1,1,simt,f16,256,128,8,2,4,2,1,1,1,1,50,1024,537149440,1610612736,2,0.90112,555.153,1787.35
5,CUTLASS,gemm,cutlass_simt_hgemm_256x128_8x2_nt_align1,passed,success,universal,serial,65536,4096,2,f16:column,f16:row,f16:column,1,0,1,1,simt,f16,256,128,8,2,4,2,1,1,1,1,50,1024,537149440,1610612736,2,0.899482,556.164,1790.6
5,CUTLASS,gemm,cutlass_simt_hgemm_256x128_8x2_tn_align1,passed,success,universal,serial,65536,4096,2,f16:row,f16:column,f16:column,1,0,1,1,simt,f16,256,128,8,2,4,2,1,1,1,1,50,1024,537149440,1610612736,2,0.901734,554.775,1786.13
5,CUTLASS,gemm,cutlass_simt_hgemm_256x128_8x2_tt_align1,passed,success,universal,serial,65536,4096,2,f16:row,f16:row,f16:column,1,0,1,1,simt,f16,256,128,8,2,4,2,1,1,1,1,50,1024,537149440,1610612736,2,0.901939,554.649,1785.72
6,CUTLASS,gemm,cutlass_simt_hgemm_256x128_8x2_nn_align1,passed,success,universal,serial,128,4096,2,f16:column,f16:column,f16:column,1,0,1,1,simt,f16,256,128,8,2,4,2,1,1,1,1,50,1024,1065472,3145728,2,0.010752,92.2896,292.571
6,CUTLASS,gemm,cutlass_simt_hgemm_256x128_8x2_nt_align1,passed,success,universal,serial,128,4096,2,f16:column,f16:row,f16:column,1,0,1,1,simt,f16,256,128,8,2,4,2,1,1,1,1,50,1024,1065472,3145728,2,0.010752,92.2896,292.571
6,CUTLASS,gemm,cutlass_simt_hgemm_256x128_8x2_tn_align1,passed,success,universal,serial,128,4096,2,f16:row,f16:column,f16:column,1,0,1,1,simt,f16,256,128,8,2,4,2,1,1,1,1,50,1024,1065472,3145728,2,0.010752,92.2896,292.571
6,CUTLASS,gemm,cutlass_simt_hgemm_256x128_8x2_tt_align1,passed,success,universal,serial,128,4096,2,f16:row,f16:row,f16:column,1,0,1,1,simt,f16,256,128,8,2,4,2,1,1,1,1,50,1024,1065472,3145728,2,0.0106496,93.177,295.385
7,CUTLASS,gemm,cutlass_simt_hgemm_256x128_8x2_nn_align1,passed,success,universal,serial,65536,1000,4032,f16:column,f16:column,f16:column,1,0,1,1,simt,f16,256,128,8,2,4,2,1,1,1,1,50,1024,667618304,528613376000,791,22.4,27.7575,23598.8
7,CUTLASS,gemm,cutlass_simt_hgemm_256x128_8x2_nt_align1,passed,success,universal,serial,65536,1000,4032,f16:column,f16:row,f16:column,1,0,1,1,simt,f16,256,128,8,2,4,2,1,1,1,1,50,1024,667618304,528613376000,791,21.8161,28.5004,24230.4
7,CUTLASS,gemm,cutlass_simt_hgemm_256x128_8x2_tn_align1,incorrect,success,universal,serial,65536,1000,4032,f16:row,f16:column,f16:column,1,0,1,1,simt,f16,256,128,8,2,4,2,1,1,1,1,50,1024,667618304,528613376000,791,23.7702,26.1574,22238.5
7,CUTLASS,gemm,cutlass_simt_hgemm_256x128_8x2_tt_align1,passed,success,universal,serial,65536,1000,4032,f16:row,f16:row,f16:column,1,0,1,1,simt,f16,256,128,8,2,4,2,1,1,1,1,50,1024,667618304,528613376000,791,22.7395,27.3431,23246.5
8,CUTLASS,gemm,cutlass_simt_hgemm_256x128_8x2_nn_align1,passed,success,universal,serial,128,1000,4032,f16:column,f16:column,f16:column,1,0,1,1,simt,f16,256,128,8,2,4,2,1,1,1,1,50,1024,9352192,1032448000,110,0.863744,10.0839,1195.32
8,CUTLASS,gemm,cutlass_simt_hgemm_256x128_8x2_nt_align1,passed,success,universal,serial,128,1000,4032,f16:column,f16:row,f16:column,1,0,1,1,simt,f16,256,128,8,2,4,2,1,1,1,1,50,1024,9352192,1032448000,110,0.838656,10.3856,1231.07
8,CUTLASS,gemm,cutlass_simt_hgemm_256x128_8x2_tn_align1,incorrect,success,universal,serial,128,1000,4032,f16:row,f16:column,f16:column,1,0,1,1,simt,f16,256,128,8,2,4,2,1,1,1,1,50,1024,9352192,1032448000,110,0.91689,9.49941,1126.03
8,CUTLASS,gemm,cutlass_simt_hgemm_256x128_8x2_tt_align1,passed,success,universal,serial,128,1000,4032,f16:row,f16:row,f16:column,1,0,1,1,simt,f16,256,128,8,2,4,2,1,1,1,1,50,1024,9352192,1032448000,110,0.875418,9.94943,1179.38
9,CUTLASS,gemm,cutlass_simt_hgemm_256x128_8x2_nn_align1,passed,success,universal,serial,65536,1024,4032,f16:column,f16:column,f16:column,1,0,1,1,simt,f16,256,128,8,2,4,2,1,1,1,1,50,1024,670957568,541300097024,806,22.4052,27.8898,24159.5
9,CUTLASS,gemm,cutlass_simt_hgemm_256x128_8x2_nt_align1,passed,success,universal,serial,65536,1024,4032,f16:column,f16:row,f16:column,1,0,1,1,simt,f16,256,128,8,2,4,2,1,1,1,1,50,1024,670957568,541300097024,806,21.8035,28.6595,24826.3
9,CUTLASS,gemm,cutlass_simt_hgemm_256x128_8x2_tn_align1,incorrect,success,universal,serial,65536,1024,4032,f16:row,f16:column,f16:column,1,0,1,1,simt,f16,256,128,8,2,4,2,1,1,1,1,50,1024,670957568,541300097024,806,23.7897,26.2668,22753.6
9,CUTLASS,gemm,cutlass_simt_hgemm_256x128_8x2_tt_align1,passed,success,universal,serial,65536,1024,4032,f16:row,f16:row,f16:column,1,0,1,1,simt,f16,256,128,8,2,4,2,1,1,1,1,50,1024,670957568,541300097024,806,22.7309,27.4903,23813.5
10,CUTLASS,gemm,cutlass_simt_hgemm_256x128_8x2_nn_align1,passed,success,universal,serial,128,1024,4032,f16:column,f16:column,f16:column,1,0,1,1,simt,f16,256,128,8,2,4,2,1,1,1,1,50,1024,9551872,1057226752,110,0.863539,10.3016,1224.3
10,CUTLASS,gemm,cutlass_simt_hgemm_256x128_8x2_nt_align1,passed,success,universal,serial,128,1024,4032,f16:column,f16:row,f16:column,1,0,1,1,simt,f16,256,128,8,2,4,2,1,1,1,1,50,1024,9551872,1057226752,110,0.837939,10.6164,1261.7
10,CUTLASS,gemm,cutlass_simt_hgemm_256x128_8x2_tn_align1,incorrect,success,universal,serial,128,1024,4032,f16:row,f16:column,f16:column,1,0,1,1,simt,f16,256,128,8,2,4,2,1,1,1,1,50,1024,9551872,1057226752,110,0.915661,9.71525,1154.61
10,CUTLASS,gemm,cutlass_simt_hgemm_256x128_8x2_tt_align1,passed,success,universal,serial,128,1024,4032,f16:row,f16:row,f16:column,1,0,1,1,simt,f16,256,128,8,2,4,2,1,1,1,1,50,1024,9551872,1057226752,110,0.874803,10.169,1208.53
11,CUTLASS,gemm,cutlass_simt_hgemm_256x128_8x2_nn_align1,passed,success,universal,serial,65536,4096,4032,f16:column,f16:column,f16:column,1,0,1,1,simt,f16,256,128,8,2,4,2,1,1,1,1,50,1024,1098383360,2165200388096,1971,88.7001,11.5327,24410.3
11,CUTLASS,gemm,cutlass_simt_hgemm_256x128_8x2_nt_align1,passed,success,universal,serial,65536,4096,4032,f16:column,f16:row,f16:column,1,0,1,1,simt,f16,256,128,8,2,4,2,1,1,1,1,50,1024,1098383360,2165200388096,1971,86.328,11.8496,25081.1
11,CUTLASS,gemm,cutlass_simt_hgemm_256x128_8x2_tn_align1,incorrect,success,universal,serial,65536,4096,4032,f16:row,f16:column,f16:column,1,0,1,1,simt,f16,256,128,8,2,4,2,1,1,1,1,50,1024,1098383360,2165200388096,1971,94.1498,10.8651,22997.4
11,CUTLASS,gemm,cutlass_simt_hgemm_256x128_8x2_tt_align1,passed,success,universal,serial,65536,4096,4032,f16:row,f16:row,f16:column,1,0,1,1,simt,f16,256,128,8,2,4,2,1,1,1,1,50,1024,1098383360,2165200388096,1971,90.0064,11.3653,24056.1
12,CUTLASS,gemm,cutlass_simt_hgemm_256x128_8x2_nn_align1,passed,success,universal,serial,128,4096,4032,f16:column,f16:column,f16:column,1,0,1,1,simt,f16,256,128,8,2,4,2,1,1,1,1,50,1024,35110912,4228907008,120,0.864256,37.8355,4893.12
12,CUTLASS,gemm,cutlass_simt_hgemm_256x128_8x2_nt_align1,passed,success,universal,serial,128,4096,4032,f16:column,f16:row,f16:column,1,0,1,1,simt,f16,256,128,8,2,4,2,1,1,1,1,50,1024,35110912,4228907008,120,0.83927,38.9619,5038.79
12,CUTLASS,gemm,cutlass_simt_hgemm_256x128_8x2_tn_align1,incorrect,success,universal,serial,128,4096,4032,f16:row,f16:column,f16:column,1,0,1,1,simt,f16,256,128,8,2,4,2,1,1,1,1,50,1024,35110912,4228907008,120,0.917709,35.6318,4608.11
12,CUTLASS,gemm,cutlass_simt_hgemm_256x128_8x2_tt_align1,passed,success,universal,serial,128,4096,4032,f16:row,f16:row,f16:column,1,0,1,1,simt,f16,256,128,8,2,4,2,1,1,1,1,50,1024,35110912,4228907008,120,0.875725,37.34,4829.04
13,CUTLASS,gemm,cutlass_simt_hgemm_256x128_8x2_nn_align1,passed,success,universal,serial,65536,1000,1024,f16:column,f16:column,f16:column,1,0,1,1,simt,f16,256,128,8,2,4,2,1,1,1,1,50,1024,267337728,134348800000,502,5.67316,43.8869,23681.5
13,CUTLASS,gemm,cutlass_simt_hgemm_256x128_8x2_nt_align1,passed,success,universal,serial,65536,1000,1024,f16:column,f16:row,f16:column,1,0,1,1,simt,f16,256,128,8,2,4,2,1,1,1,1,50,1024,267337728,134348800000,502,5.68709,43.7794,23623.5
13,CUTLASS,gemm,cutlass_simt_hgemm_256x128_8x2_tn_align1,passed,success,universal,serial,65536,1000,1024,f16:row,f16:column,f16:column,1,0,1,1,simt,f16,256,128,8,2,4,2,1,1,1,1,50,1024,267337728,134348800000,502,6.07037,41.0152,22131.9
13,CUTLASS,gemm,cutlass_simt_hgemm_256x128_8x2_tt_align1,passed,success,universal,serial,65536,1000,1024,f16:row,f16:row,f16:column,1,0,1,1,simt,f16,256,128,8,2,4,2,1,1,1,1,50,1024,267337728,134348800000,502,5.85411,42.5304,22949.5
14,CUTLASS,gemm,cutlass_simt_hgemm_256x128_8x2_nn_align1,passed,success,universal,serial,128,1000,1024,f16:column,f16:column,f16:column,1,0,1,1,simt,f16,256,128,8,2,4,2,1,1,1,1,50,1024,2566144,262400000,102,0.219648,10.8806,1194.64
14,CUTLASS,gemm,cutlass_simt_hgemm_256x128_8x2_nt_align1,passed,success,universal,serial,128,1000,1024,f16:column,f16:row,f16:column,1,0,1,1,simt,f16,256,128,8,2,4,2,1,1,1,1,50,1024,2566144,262400000,102,0.219853,10.8705,1193.53
14,CUTLASS,gemm,cutlass_simt_hgemm_256x128_8x2_tn_align1,passed,success,universal,serial,128,1000,1024,f16:row,f16:column,f16:column,1,0,1,1,simt,f16,256,128,8,2,4,2,1,1,1,1,50,1024,2566144,262400000,102,0.235213,10.1606,1115.59
14,CUTLASS,gemm,cutlass_simt_hgemm_256x128_8x2_tt_align1,passed,success,universal,serial,128,1000,1024,f16:row,f16:row,f16:column,1,0,1,1,simt,f16,256,128,8,2,4,2,1,1,1,1,50,1024,2566144,262400000,102,0.226714,10.5415,1157.41
15,CUTLASS,gemm,cutlass_simt_hgemm_256x128_8x2_nn_align1,passed,success,universal,serial,65536,1024,1024,f16:column,f16:column,f16:column,1,0,1,1,simt,f16,256,128,8,2,4,2,1,1,1,1,50,1024,270532608,137573171200,508,5.67357,44.4082,24248.1
15,CUTLASS,gemm,cutlass_simt_hgemm_256x128_8x2_nt_align1,passed,success,universal,serial,65536,1024,1024,f16:column,f16:row,f16:column,1,0,1,1,simt,f16,256,128,8,2,4,2,1,1,1,1,50,1024,270532608,137573171200,508,5.67941,44.3625,24223.1
15,CUTLASS,gemm,cutlass_simt_hgemm_256x128_8x2_tn_align1,passed,success,universal,serial,65536,1024,1024,f16:row,f16:column,f16:column,1,0,1,1,simt,f16,256,128,8,2,4,2,1,1,1,1,50,1024,270532608,137573171200,508,6.08348,41.4159,22614.2
15,CUTLASS,gemm,cutlass_simt_hgemm_256x128_8x2_tt_align1,passed,success,universal,serial,65536,1024,1024,f16:row,f16:row,f16:column,1,0,1,1,simt,f16,256,128,8,2,4,2,1,1,1,1,50,1024,270532608,137573171200,508,5.85482,43.0334,23497.4
16,CUTLASS,gemm,cutlass_simt_hgemm_256x128_8x2_nn_align1,passed,success,universal,serial,128,1024,1024,f16:column,f16:column,f16:column,1,0,1,1,simt,f16,256,128,8,2,4,2,1,1,1,1,50,1024,2621440,268697600,102,0.219546,11.1203,1223.88
16,CUTLASS,gemm,cutlass_simt_hgemm_256x128_8x2_nt_align1,passed,success,universal,serial,128,1024,1024,f16:column,f16:row,f16:column,1,0,1,1,simt,f16,256,128,8,2,4,2,1,1,1,1,50,1024,2621440,268697600,102,0.219648,11.1151,1223.31
16,CUTLASS,gemm,cutlass_simt_hgemm_256x128_8x2_tn_align1,passed,success,universal,serial,128,1024,1024,f16:row,f16:column,f16:column,1,0,1,1,simt,f16,256,128,8,2,4,2,1,1,1,1,50,1024,2621440,268697600,102,0.235213,10.3796,1142.36
16,CUTLASS,gemm,cutlass_simt_hgemm_256x128_8x2_tt_align1,passed,success,universal,serial,128,1024,1024,f16:row,f16:row,f16:column,1,0,1,1,simt,f16,256,128,8,2,4,2,1,1,1,1,50,1024,2621440,268697600,102,0.226406,10.7833,1186.79
17,CUTLASS,gemm,cutlass_simt_hgemm_256x128_8x2_nn_align1,passed,success,universal,serial,65536,4096,1024,f16:column,f16:column,f16:column,1,0,1,1,simt,f16,256,128,8,2,4,2,1,1,1,1,50,1024,679477248,550292684800,809,22.4524,28.1846,24509.3
17,CUTLASS,gemm,cutlass_simt_hgemm_256x128_8x2_nt_align1,passed,success,universal,serial,65536,4096,1024,f16:column,f16:row,f16:column,1,0,1,1,simt,f16,256,128,8,2,4,2,1,1,1,1,50,1024,679477248,550292684800,809,22.4663,28.1672,24494.2
17,CUTLASS,gemm,cutlass_simt_hgemm_256x128_8x2_tn_align1,passed,success,universal,serial,65536,4096,1024,f16:row,f16:column,f16:column,1,0,1,1,simt,f16,256,128,8,2,4,2,1,1,1,1,50,1024,679477248,550292684800,809,24.0791,26.2806,22853.6
17,CUTLASS,gemm,cutlass_simt_hgemm_256x128_8x2_tt_align1,passed,success,universal,serial,65536,4096,1024,f16:row,f16:row,f16:column,1,0,1,1,simt,f16,256,128,8,2,4,2,1,1,1,1,50,1024,679477248,550292684800,809,23.1569,27.3271,23763.6
18,CUTLASS,gemm,cutlass_simt_hgemm_256x128_8x2_nn_align1,passed,success,universal,serial,128,4096,1024,f16:column,f16:column,f16:column,1,0,1,1,simt,f16,256,128,8,2,4,2,1,1,1,1,50,1024,9699328,1074790400,110,0.22057,40.954,4872.79
18,CUTLASS,gemm,cutlass_simt_hgemm_256x128_8x2_nt_align1,passed,success,universal,serial,128,4096,1024,f16:column,f16:row,f16:column,1,0,1,1,simt,f16,256,128,8,2,4,2,1,1,1,1,50,1024,9699328,1074790400,110,0.220467,40.973,4875.06
18,CUTLASS,gemm,cutlass_simt_hgemm_256x128_8x2_tn_align1,passed,success,universal,serial,128,4096,1024,f16:row,f16:column,f16:column,1,0,1,1,simt,f16,256,128,8,2,4,2,1,1,1,1,50,1024,9699328,1074790400,110,0.236134,38.2545,4551.6
18,CUTLASS,gemm,cutlass_simt_hgemm_256x128_8x2_tt_align1,passed,success,universal,serial,128,4096,1024,f16:row,f16:row,f16:column,1,0,1,1,simt,f16,256,128,8,2,4,2,1,1,1,1,50,1024,9699328,1074790400,110,0.227226,39.7543,4730.06
19,CUTLASS,gemm,cutlass_simt_hgemm_256x128_8x2_nn_align1,passed,success,universal,serial,65536,1000,2048,f16:column,f16:column,f16:column,1,0,1,1,simt,f16,256,128,8,2,4,2,1,1,1,1,50,1024,403603456,268566528000,665,11.1469,33.7212,24093.5
19,CUTLASS,gemm,cutlass_simt_hgemm_256x128_8x2_nt_align1,passed,success,universal,serial,65536,1000,2048,f16:column,f16:row,f16:column,1,0,1,1,simt,f16,256,128,8,2,4,2,1,1,1,1,50,1024,403603456,268566528000,665,11.1807,33.6189,24020.4
19,CUTLASS,gemm,cutlass_simt_hgemm_256x128_8x2_tn_align1,passed,success,universal,serial,65536,1000,2048,f16:row,f16:column,f16:column,1,0,1,1,simt,f16,256,128,8,2,4,2,1,1,1,1,50,1024,403603456,268566528000,665,11.9389,31.484,22495
19,CUTLASS,gemm,cutlass_simt_hgemm_256x128_8x2_tt_align1,passed,success,universal,serial,65536,1000,2048,f16:row,f16:row,f16:column,1,0,1,1,simt,f16,256,128,8,2,4,2,1,1,1,1,50,1024,403603456,268566528000,665,11.5168,32.6379,23319.5
20,CUTLASS,gemm,cutlass_simt_hgemm_256x128_8x2_nn_align1,passed,success,universal,serial,128,1000,2048,f16:column,f16:column,f16:column,1,0,1,1,simt,f16,256,128,8,2,4,2,1,1,1,1,50,1024,4876288,524544000,107,0.429875,10.5645,1220.22
20,CUTLASS,gemm,cutlass_simt_hgemm_256x128_8x2_nt_align1,passed,success,universal,serial,128,1000,2048,f16:column,f16:row,f16:column,1,0,1,1,simt,f16,256,128,8,2,4,2,1,1,1,1,50,1024,4876288,524544000,107,0.430285,10.5544,1219.06
20,CUTLASS,gemm,cutlass_simt_hgemm_256x128_8x2_tn_align1,passed,success,universal,serial,128,1000,2048,f16:row,f16:column,f16:column,1,0,1,1,simt,f16,256,128,8,2,4,2,1,1,1,1,50,1024,4876288,524544000,107,0.461005,9.85108,1137.83
20,CUTLASS,gemm,cutlass_simt_hgemm_256x128_8x2_tt_align1,passed,success,universal,serial,128,1000,2048,f16:row,f16:row,f16:column,1,0,1,1,simt,f16,256,128,8,2,4,2,1,1,1,1,50,1024,4876288,524544000,107,0.444518,10.2164,1180.03
21,CUTLASS,gemm,cutlass_simt_hgemm_256x128_8x2_nn_align1,passed,success,universal,serial,65536,1024,2048,f16:column,f16:column,f16:column,1,0,1,1,simt,f16,256,128,8,2,4,2,1,1,1,1,50,1024,406847488,275012124672,675,11.1452,33.9972,24675.4
21,CUTLASS,gemm,cutlass_simt_hgemm_256x128_8x2_nt_align1,passed,success,universal,serial,65536,1024,2048,f16:column,f16:row,f16:column,1,0,1,1,simt,f16,256,128,8,2,4,2,1,1,1,1,50,1024,406847488,275012124672,675,11.166,33.9339,24629.4
21,CUTLASS,gemm,cutlass_simt_hgemm_256x128_8x2_tn_align1,passed,success,universal,serial,65536,1024,2048,f16:row,f16:column,f16:column,1,0,1,1,simt,f16,256,128,8,2,4,2,1,1,1,1,50,1024,406847488,275012124672,675,11.9639,31.6708,22986.8
21,CUTLASS,gemm,cutlass_simt_hgemm_256x128_8x2_tt_align1,passed,success,universal,serial,65536,1024,2048,f16:row,f16:row,f16:column,1,0,1,1,simt,f16,256,128,8,2,4,2,1,1,1,1,50,1024,406847488,275012124672,675,11.5162,32.902,23880.4
22,CUTLASS,gemm,cutlass_simt_hgemm_256x128_8x2_nn_align1,passed,success,universal,serial,128,1024,2048,f16:column,f16:column,f16:column,1,0,1,1,simt,f16,256,128,8,2,4,2,1,1,1,1,50,1024,4980736,537133056,107,0.429875,10.7907,1249.51
22,CUTLASS,gemm,cutlass_simt_hgemm_256x128_8x2_nt_align1,passed,success,universal,serial,128,1024,2048,f16:column,f16:row,f16:column,1,0,1,1,simt,f16,256,128,8,2,4,2,1,1,1,1,50,1024,4980736,537133056,107,0.429875,10.7907,1249.51
22,CUTLASS,gemm,cutlass_simt_hgemm_256x128_8x2_tn_align1,passed,success,universal,serial,128,1024,2048,f16:row,f16:column,f16:column,1,0,1,1,simt,f16,256,128,8,2,4,2,1,1,1,1,50,1024,4980736,537133056,107,0.46121,10.0576,1164.62
22,CUTLASS,gemm,cutlass_simt_hgemm_256x128_8x2_tt_align1,passed,success,universal,serial,128,1024,2048,f16:row,f16:row,f16:column,1,0,1,1,simt,f16,256,128,8,2,4,2,1,1,1,1,50,1024,4980736,537133056,107,0.443699,10.4545,1210.58
23,CUTLASS,gemm,cutlass_simt_hgemm_256x128_8x2_nn_align1,passed,success,universal,serial,65536,4096,2048,f16:column,f16:column,f16:column,1,0,1,1,simt,f16,256,128,8,2,4,2,1,1,1,1,50,1024,822083584,1100048498688,1338,44.1346,17.3475,24924.9
23,CUTLASS,gemm,cutlass_simt_hgemm_256x128_8x2_nt_align1,passed,success,universal,serial,65536,4096,2048,f16:column,f16:row,f16:column,1,0,1,1,simt,f16,256,128,8,2,4,2,1,1,1,1,50,1024,822083584,1100048498688,1338,44.2008,17.3215,24887.6
23,CUTLASS,gemm,cutlass_simt_hgemm_256x128_8x2_tn_align1,passed,success,universal,serial,65536,4096,2048,f16:row,f16:column,f16:column,1,0,1,1,simt,f16,256,128,8,2,4,2,1,1,1,1,50,1024,822083584,1100048498688,1338,47.3752,16.1609,23219.9
23,CUTLASS,gemm,cutlass_simt_hgemm_256x128_8x2_tt_align1,passed,success,universal,serial,65536,4096,2048,f16:row,f16:row,f16:column,1,0,1,1,simt,f16,256,128,8,2,4,2,1,1,1,1,50,1024,822083584,1100048498688,1338,45.5771,16.7985,24136
24,CUTLASS,gemm,cutlass_simt_hgemm_256x128_8x2_nn_align1,passed,success,universal,serial,128,4096,2048,f16:column,f16:column,f16:column,1,0,1,1,simt,f16,256,128,8,2,4,2,1,1,1,1,50,1024,18350080,2148532224,117,0.431002,39.6515,4984.97
24,CUTLASS,gemm,cutlass_simt_hgemm_256x128_8x2_nt_align1,passed,success,universal,serial,128,4096,2048,f16:column,f16:row,f16:column,1,0,1,1,simt,f16,256,128,8,2,4,2,1,1,1,1,50,1024,18350080,2148532224,117,0.431002,39.6515,4984.97
24,CUTLASS,gemm,cutlass_simt_hgemm_256x128_8x2_tn_align1,passed,success,universal,serial,128,4096,2048,f16:row,f16:column,f16:column,1,0,1,1,simt,f16,256,128,8,2,4,2,1,1,1,1,50,1024,18350080,2148532224,117,0.462131,36.9805,4649.18
24,CUTLASS,gemm,cutlass_simt_hgemm_256x128_8x2_tt_align1,passed,success,universal,serial,128,4096,2048,f16:row,f16:row,f16:column,1,0,1,1,simt,f16,256,128,8,2,4,2,1,1,1,1,50,1024,18350080,2148532224,117,0.444826,38.4192,4830.06
25,CUTLASS,gemm,cutlass_simt_hgemm_256x128_8x2_nn_align1,passed,success,universal,serial,65536,1000,4096,f16:column,f16:column,f16:column,1,0,1,1,simt,f16,256,128,8,2,4,2,1,1,1,1,50,1024,676134912,537001984000,794,22.0897,28.5064,24310
25,CUTLASS,gemm,cutlass_simt_hgemm_256x128_8x2_nt_align1,passed,success,universal,serial,65536,1000,4096,f16:column,f16:row,f16:column,1,0,1,1,simt,f16,256,128,8,2,4,2,1,1,1,1,50,1024,676134912,537001984000,794,22.1628,28.4124,24229.8
25,CUTLASS,gemm,cutlass_simt_hgemm_256x128_8x2_tn_align1,incorrect,success,universal,serial,65536,1000,4096,f16:row,f16:column,f16:column,1,0,1,1,simt,f16,256,128,8,2,4,2,1,1,1,1,50,1024,676134912,537001984000,794,23.692,26.5786,22666
25,CUTLASS,gemm,cutlass_simt_hgemm_256x128_8x2_tt_align1,passed,success,universal,serial,65536,1000,4096,f16:row,f16:row,f16:column,1,0,1,1,simt,f16,256,128,8,2,4,2,1,1,1,1,50,1024,676134912,537001984000,794,22.8439,27.5653,23507.5
26,CUTLASS,gemm,cutlass_simt_hgemm_256x128_8x2_nn_align1,passed,success,universal,serial,128,1000,4096,f16:column,f16:column,f16:column,1,0,1,1,simt,f16,256,128,8,2,4,2,1,1,1,1,50,1024,9496576,1048832000,110,0.850842,10.3949,1232.7
26,CUTLASS,gemm,cutlass_simt_hgemm_256x128_8x2_nt_align1,passed,success,universal,serial,128,1000,4096,f16:column,f16:row,f16:column,1,0,1,1,simt,f16,256,128,8,2,4,2,1,1,1,1,50,1024,9496576,1048832000,110,0.851661,10.3849,1231.51
26,CUTLASS,gemm,cutlass_simt_hgemm_256x128_8x2_tn_align1,incorrect,success,universal,serial,128,1000,4096,f16:row,f16:column,f16:column,1,0,1,1,simt,f16,256,128,8,2,4,2,1,1,1,1,50,1024,9496576,1048832000,110,0.913306,9.68392,1148.39
26,CUTLASS,gemm,cutlass_simt_hgemm_256x128_8x2_tt_align1,passed,success,universal,serial,128,1000,4096,f16:row,f16:row,f16:column,1,0,1,1,simt,f16,256,128,8,2,4,2,1,1,1,1,50,1024,9496576,1048832000,110,0.88023,10.0478,1191.54
27,CUTLASS,gemm,cutlass_simt_hgemm_256x128_8x2_nn_align1,passed,success,universal,serial,65536,1024,4096,f16:column,f16:column,f16:column,1,0,1,1,simt,f16,256,128,8,2,4,2,1,1,1,1,50,1024,679477248,549890031616,809,22.0885,28.649,24894.9
27,CUTLASS,gemm,cutlass_simt_hgemm_256x128_8x2_nt_align1,passed,success,universal,serial,65536,1024,4096,f16:column,f16:row,f16:column,1,0,1,1,simt,f16,256,128,8,2,4,2,1,1,1,1,50,1024,679477248,549890031616,809,22.1486,28.5712,24827.3
27,CUTLASS,gemm,cutlass_simt_hgemm_256x128_8x2_tn_align1,incorrect,success,universal,serial,65536,1024,4096,f16:row,f16:column,f16:column,1,0,1,1,simt,f16,256,128,8,2,4,2,1,1,1,1,50,1024,679477248,549890031616,809,23.7223,26.6759,23180.3
27,CUTLASS,gemm,cutlass_simt_hgemm_256x128_8x2_tt_align1,passed,success,universal,serial,65536,1024,4096,f16:row,f16:row,f16:column,1,0,1,1,simt,f16,256,128,8,2,4,2,1,1,1,1,50,1024,679477248,549890031616,809,22.8387,27.7079,24077.1
28,CUTLASS,gemm,cutlass_simt_hgemm_256x128_8x2_nn_align1,passed,success,universal,serial,128,1024,4096,f16:column,f16:column,f16:column,1,0,1,1,simt,f16,256,128,8,2,4,2,1,1,1,1,50,1024,9699328,1074003968,110,0.850637,10.6193,1262.59
28,CUTLASS,gemm,cutlass_simt_hgemm_256x128_8x2_nt_align1,passed,success,universal,serial,128,1024,4096,f16:column,f16:row,f16:column,1,0,1,1,simt,f16,256,128,8,2,4,2,1,1,1,1,50,1024,9699328,1074003968,110,0.851149,10.613,1261.83
28,CUTLASS,gemm,cutlass_simt_hgemm_256x128_8x2_tn_align1,incorrect,success,universal,serial,128,1024,4096,f16:row,f16:column,f16:column,1,0,1,1,simt,f16,256,128,8,2,4,2,1,1,1,1,50,1024,9699328,1074003968,110,0.913101,9.89289,1176.22
28,CUTLASS,gemm,cutlass_simt_hgemm_256x128_8x2_tt_align1,passed,success,universal,serial,128,1024,4096,f16:row,f16:row,f16:column,1,0,1,1,simt,f16,256,128,8,2,4,2,1,1,1,1,50,1024,9699328,1074003968,110,0.878387,10.2839,1222.7
29,CUTLASS,gemm,cutlass_simt_hgemm_256x128_8x2_nn_align1,passed,success,universal,serial,65536,4096,4096,f16:column,f16:column,f16:column,1,0,1,1,simt,f16,256,128,8,2,4,2,1,1,1,1,50,1024,1107296256,2199560126464,1986,87.4891,11.7872,25141
29,CUTLASS,gemm,cutlass_simt_hgemm_256x128_8x2_nt_align1,passed,success,universal,serial,65536,4096,4096,f16:column,f16:row,f16:column,1,0,1,1,simt,f16,256,128,8,2,4,2,1,1,1,1,50,1024,1107296256,2199560126464,1986,87.6899,11.7602,25083.4
29,CUTLASS,gemm,cutlass_simt_hgemm_256x128_8x2_tn_align1,incorrect,success,universal,serial,65536,4096,4096,f16:row,f16:column,f16:column,1,0,1,1,simt,f16,256,128,8,2,4,2,1,1,1,1,50,1024,1107296256,2199560126464,1986,93.9525,10.9763,23411.4
29,CUTLASS,gemm,cutlass_simt_hgemm_256x128_8x2_tt_align1,passed,success,universal,serial,65536,4096,4096,f16:row,f16:row,f16:column,1,0,1,1,simt,f16,256,128,8,2,4,2,1,1,1,1,50,1024,1107296256,2199560126464,1986,90.4327,11.4035,24322.6
30,CUTLASS,gemm,cutlass_simt_hgemm_256x128_8x2_nn_align1,passed,success,universal,serial,128,4096,4096,f16:column,f16:column,f16:column,1,0,1,1,simt,f16,256,128,8,2,4,2,1,1,1,1,50,1024,35651584,4296015872,120,0.851866,38.977,5043.07
30,CUTLASS,gemm,cutlass_simt_hgemm_256x128_8x2_nt_align1,passed,success,universal,serial,128,4096,4096,f16:column,f16:row,f16:column,1,0,1,1,simt,f16,256,128,8,2,4,2,1,1,1,1,50,1024,35651584,4296015872,120,0.85207,38.9676,5041.86
30,CUTLASS,gemm,cutlass_simt_hgemm_256x128_8x2_tn_align1,incorrect,success,universal,serial,128,4096,4096,f16:row,f16:column,f16:column,1,0,1,1,simt,f16,256,128,8,2,4,2,1,1,1,1,50,1024,35651584,4296015872,120,0.91433,36.3142,4698.54
30,CUTLASS,gemm,cutlass_simt_hgemm_256x128_8x2_tt_align1,passed,success,universal,serial,128,4096,4096,f16:row,f16:row,f16:column,1,0,1,1,simt,f16,256,128,8,2,4,2,1,1,1,1,50,1024,35651584,4296015872,120,0.879616,37.7473,4883.97
31,CUTLASS,gemm,cutlass_simt_hgemm_256x128_8x2_nn_align1,incorrect,success,universal,serial,65536,1000,30522,f16:column,f16:column,f16:column,1,0,1,1,simt,f16,256,128,8,2,4,2,1,1,1,1,50,1024,4192695584,4000710656000,954,167.681,23.2867,23859
31,CUTLASS,gemm,cutlass_simt_hgemm_256x128_8x2_nt_align1,incorrect,success,universal,serial,65536,1000,30522,f16:column,f16:row,f16:column,1,0,1,1,simt,f16,256,128,8,2,4,2,1,1,1,1,50,1024,4192695584,4000710656000,954,163.923,23.8206,24406
31,CUTLASS,gemm,cutlass_simt_hgemm_256x128_8x2_tn_align1,incorrect,success,universal,serial,65536,1000,30522,f16:row,f16:column,f16:column,1,0,1,1,simt,f16,256,128,8,2,4,2,1,1,1,1,50,1024,4192695584,4000710656000,954,175.263,22.2794,22826.9
31,CUTLASS,gemm,cutlass_simt_hgemm_256x128_8x2_tt_align1,incorrect,success,universal,serial,65536,1000,30522,f16:row,f16:row,f16:column,1,0,1,1,simt,f16,256,128,8,2,4,2,1,1,1,1,50,1024,4192695584,4000710656000,954,170.456,22.9077,23470.7
32,CUTLASS,gemm,cutlass_simt_hgemm_256x128_8x2_nn_align1,passed,success,universal,serial,128,1000,30522,f16:column,f16:column,f16:column,1,0,1,1,simt,f16,256,128,8,2,4,2,1,1,1,1,50,1024,69113632,7813888000,113,6.4511,9.97769,1211.25
32,CUTLASS,gemm,cutlass_simt_hgemm_256x128_8x2_nt_align1,passed,success,universal,serial,128,1000,30522,f16:column,f16:row,f16:column,1,0,1,1,simt,f16,256,128,8,2,4,2,1,1,1,1,50,1024,69113632,7813888000,113,6.2892,10.2345,1242.43
32,CUTLASS,gemm,cutlass_simt_hgemm_256x128_8x2_tn_align1,incorrect,success,universal,serial,128,1000,30522,f16:row,f16:column,f16:column,1,0,1,1,simt,f16,256,128,8,2,4,2,1,1,1,1,50,1024,69113632,7813888000,113,6.72942,9.56503,1161.15
32,CUTLASS,gemm,cutlass_simt_hgemm_256x128_8x2_tt_align1,incorrect,success,universal,serial,128,1000,30522,f16:row,f16:row,f16:column,1,0,1,1,simt,f16,256,128,8,2,4,2,1,1,1,1,50,1024,69113632,7813888000,113,6.55657,9.81719,1191.76
33,CUTLASS,gemm,cutlass_simt_hgemm_256x128_8x2_nn_align1,incorrect,success,universal,serial,65536,1024,30522,f16:column,f16:column,f16:column,1,0,1,1,simt,f16,256,128,8,2,4,2,1,1,1,1,50,1024,4197306368,4096727711744,976,167.721,23.3068,24425.8
33,CUTLASS,gemm,cutlass_simt_hgemm_256x128_8x2_nt_align1,incorrect,success,universal,serial,65536,1024,30522,f16:column,f16:row,f16:column,1,0,1,1,simt,f16,256,128,8,2,4,2,1,1,1,1,50,1024,4197306368,4096727711744,976,163.882,23.8527,24998
33,CUTLASS,gemm,cutlass_simt_hgemm_256x128_8x2_tn_align1,incorrect,success,universal,serial,65536,1024,30522,f16:row,f16:column,f16:column,1,0,1,1,simt,f16,256,128,8,2,4,2,1,1,1,1,50,1024,4197306368,4096727711744,976,175.42,22.2839,23353.8
33,CUTLASS,gemm,cutlass_simt_hgemm_256x128_8x2_tt_align1,incorrect,success,universal,serial,65536,1024,30522,f16:row,f16:row,f16:column,1,0,1,1,simt,f16,256,128,8,2,4,2,1,1,1,1,50,1024,4197306368,4096727711744,976,170.466,22.9315,24032.5
34,CUTLASS,gemm,cutlass_simt_hgemm_256x128_8x2_nn_align1,passed,success,universal,serial,128,1024,30522,f16:column,f16:column,f16:column,1,0,1,1,simt,f16,256,128,8,2,4,2,1,1,1,1,50,1024,70584832,8001421312,113,6.45089,10.1904,1240.36
34,CUTLASS,gemm,cutlass_simt_hgemm_256x128_8x2_nt_align1,passed,success,universal,serial,128,1024,30522,f16:column,f16:row,f16:column,1,0,1,1,simt,f16,256,128,8,2,4,2,1,1,1,1,50,1024,70584832,8001421312,113,6.27948,10.4686,1274.22
34,CUTLASS,gemm,cutlass_simt_hgemm_256x128_8x2_tn_align1,incorrect,success,universal,serial,128,1024,30522,f16:row,f16:column,f16:column,1,0,1,1,simt,f16,256,128,8,2,4,2,1,1,1,1,50,1024,70584832,8001421312,113,6.72942,9.76863,1189.02
34,CUTLASS,gemm,cutlass_simt_hgemm_256x128_8x2_tt_align1,passed,success,universal,serial,128,1024,30522,f16:row,f16:row,f16:column,1,0,1,1,simt,f16,256,128,8,2,4,2,1,1,1,1,50,1024,70584832,8001421312,113,6.5535,10.0309,1220.94
35,CUTLASS,gemm,cutlass_simt_hgemm_256x128_8x2_nn_align1,incorrect,success,universal,serial,65536,4096,30522,f16:column,f16:column,f16:column,1,0,1,1,simt,f16,256,128,8,2,4,2,1,1,1,1,50,1024,4787486720,16386910846976,3422,664.328,6.71158,24666.9
35,CUTLASS,gemm,cutlass_simt_hgemm_256x128_8x2_nt_align1,incorrect,success,universal,serial,65536,4096,30522,f16:column,f16:row,f16:column,1,0,1,1,simt,f16,256,128,8,2,4,2,1,1,1,1,50,1024,4787486720,16386910846976,3422,648.375,6.87672,25273.8
35,CUTLASS,gemm,cutlass_simt_hgemm_256x128_8x2_tn_align1,incorrect,success,universal,serial,65536,4096,30522,f16:row,f16:column,f16:column,1,0,1,1,simt,f16,256,128,8,2,4,2,1,1,1,1,50,1024,4787486720,16386910846976,3422,693.763,6.42683,23620.3
35,CUTLASS,gemm,cutlass_simt_hgemm_256x128_8x2_tt_align1,incorrect,success,universal,serial,65536,4096,30522,f16:row,f16:row,f16:column,1,0,1,1,simt,f16,256,128,8,2,4,2,1,1,1,1,50,1024,4787486720,16386910846976,3422,674.949,6.60598,24278.8
36,CUTLASS,gemm,cutlass_simt_hgemm_256x128_8x2_nn_align1,passed,success,universal,serial,128,4096,30522,f16:column,f16:column,f16:column,1,0,1,1,simt,f16,256,128,8,2,4,2,1,1,1,1,50,1024,258898432,32005685248,123,6.45386,37.3603,4959.15
36,CUTLASS,gemm,cutlass_simt_hgemm_256x128_8x2_nt_align1,incorrect,success,universal,serial,128,4096,30522,f16:column,f16:row,f16:column,1,0,1,1,simt,f16,256,128,8,2,4,2,1,1,1,1,50,1024,258898432,32005685248,123,6.28142,38.3859,5095.29
36,CUTLASS,gemm,cutlass_simt_hgemm_256x128_8x2_tn_align1,incorrect,success,universal,serial,128,4096,30522,f16:row,f16:column,f16:column,1,0,1,1,simt,f16,256,128,8,2,4,2,1,1,1,1,50,1024,258898432,32005685248,123,6.73311,35.8108,4753.48
36,CUTLASS,gemm,cutlass_simt_hgemm_256x128_8x2_tt_align1,incorrect,success,universal,serial,128,4096,30522,f16:row,f16:row,f16:column,1,0,1,1,simt,f16,256,128,8,2,4,2,1,1,1,1,50,1024,258898432,32005685248,123,6.55524,36.7825,4882.46
