CUTLASS/cutlassgemm-benchmark/cutlass_half_performance.gemm.csv
Problem,Provider,OperationKind,Operation,Disposition,Status,gemm_kind,split_k_mode,m,n,k,A,B,C,alpha,beta,split_k_slices,batch_count,op_class,accum,cta_m,cta_n,cta_k,stages,warps_m,warps_n,warps_k,inst_m,inst_n,inst_k,min_cc,max_cc,Bytes,Flops,Flops/Byte,Runtime,GB/s,GFLOPs
1,CUTLASS,gemm,cutlass_simt_hgemm_256x128_8x2_nn_align1,passed,success,universal,serial,2,2,2,f16:column,f16:column,f16:column,1,0,1,1,simt,f16,256,128,8,2,4,2,1,1,1,1,50,1024,24,24,1,0.0101376,0.00220484,0.00236742
1,CUTLASS,gemm,cutlass_simt_hgemm_256x128_8x2_nt_align1,passed,success,universal,serial,2,2,2,f16:column,f16:row,f16:column,1,0,1,1,simt,f16,256,128,8,2,4,2,1,1,1,1,50,1024,24,24,1,0.0101376,0.00220484,0.00236742
1,CUTLASS,gemm,cutlass_simt_hgemm_256x128_8x2_tn_align1,passed,success,universal,serial,2,2,2,f16:row,f16:column,f16:column,1,0,1,1,simt,f16,256,128,8,2,4,2,1,1,1,1,50,1024,24,24,1,0.0099328,0.0022503,0.00241624
1,CUTLASS,gemm,cutlass_simt_hgemm_256x128_8x2_tt_align1,passed,success,universal,serial,2,2,2,f16:row,f16:row,f16:column,1,0,1,1,simt,f16,256,128,8,2,4,2,1,1,1,1,50,1024,24,24,1,0.0100352,0.00222733,0.00239158
2,CUTLASS,gemm,cutlass_simt_hgemm_256x128_8x2_nn_align1,passed,success,universal,serial,4,2,2,f16:column,f16:column,f16:column,1,0,1,1,simt,f16,256,128,8,2,4,2,1,1,1,1,50,1024,40,48,1,0.0101376,0.00367473,0.00473485
2,CUTLASS,gemm,cutlass_simt_hgemm_256x128_8x2_nt_align1,passed,success,universal,serial,4,2,2,f16:column,f16:row,f16:column,1,0,1,1,simt,f16,256,128,8,2,4,2,1,1,1,1,50,1024,40,48,1,0.0101376,0.00367473,0.00473485
2,CUTLASS,gemm,cutlass_simt_hgemm_256x128_8x2_tn_align1,passed,success,universal,serial,4,2,2,f16:row,f16:column,f16:column,1,0,1,1,simt,f16,256,128,8,2,4,2,1,1,1,1,50,1024,40,48,1,0.0098304,0.00378956,0.00488281
2,CUTLASS,gemm,cutlass_simt_hgemm_256x128_8x2_tt_align1,passed,success,universal,serial,4,2,2,f16:row,f16:row,f16:column,1,0,1,1,simt,f16,256,128,8,2,4,2,1,1,1,1,50,1024,40,48,1,0.0099328,0.00375049,0.00483247
3,CUTLASS,gemm,cutlass_simt_hgemm_256x128_8x2_nn_align1,passed,success,universal,serial,8,2,2,f16:column,f16:column,f16:column,1,0,1,1,simt,f16,256,128,8,2,4,2,1,1,1,1,50,1024,72,96,1,0.0101376,0.00661451,0.0094697
3,CUTLASS,gemm,cutlass_simt_hgemm_256x128_8x2_nt_align1,passed,success,universal,serial,8,2,2,f16:column,f16:row,f16:column,1,0,1,1,simt,f16,256,128,8,2,4,2,1,1,1,1,50,1024,72,96,1,0.0101376,0.00661451,0.0094697
3,CUTLASS,gemm,cutlass_simt_hgemm_256x128_8x2_tn_align1,passed,success,universal,serial,8,2,2,f16:row,f16:column,f16:column,1,0,1,1,simt,f16,256,128,8,2,4,2,1,1,1,1,50,1024,72,96,1,0.0099328,0.00675089,0.00966495
3,CUTLASS,gemm,cutlass_simt_hgemm_256x128_8x2_tt_align1,passed,success,universal,serial,8,2,2,f16:row,f16:row,f16:column,1,0,1,1,simt,f16,256,128,8,2,4,2,1,1,1,1,50,1024,72,96,1,0.0099328,0.00675089,0.00966495
4,CUTLASS,gemm,cutlass_simt_hgemm_256x128_8x2_nn_align1,passed,success,universal,serial,16,2,2,f16:column,f16:column,f16:column,1,0,1,1,simt,f16,256,128,8,2,4,2,1,1,1,1,50,1024,136,192,1,0.0100352,0.0126216,0.0191327
4,CUTLASS,gemm,cutlass_simt_hgemm_256x128_8x2_nt_align1,passed,success,universal,serial,16,2,2,f16:column,f16:row,f16:column,1,0,1,1,simt,f16,256,128,8,2,4,2,1,1,1,1,50,1024,136,192,1,0.0101376,0.0124941,0.0189394
4,CUTLASS,gemm,cutlass_simt_hgemm_256x128_8x2_tn_align1,passed,success,universal,serial,16,2,2,f16:row,f16:column,f16:column,1,0,1,1,simt,f16,256,128,8,2,4,2,1,1,1,1,50,1024,136,192,1,0.0098304,0.0128845,0.0195312
4,CUTLASS,gemm,cutlass_simt_hgemm_256x128_8x2_tt_align1,passed,success,universal,serial,16,2,2,f16:row,f16:row,f16:column,1,0,1,1,simt,f16,256,128,8,2,4,2,1,1,1,1,50,1024,136,192,1,0.0099328,0.0127517,0.0193299
5,CUTLASS,gemm,cutlass_simt_hgemm_256x128_8x2_nn_align1,passed,success,universal,serial,32,2,2,f16:column,f16:column,f16:column,1,0,1,1,simt,f16,256,128,8,2,4,2,1,1,1,1,50,1024,264,384,1,0.0101376,0.0242532,0.0378788
5,CUTLASS,gemm,cutlass_simt_hgemm_256x128_8x2_nt_align1,passed,success,universal,serial,32,2,2,f16:column,f16:row,f16:column,1,0,1,1,simt,f16,256,128,8,2,4,2,1,1,1,1,50,1024,264,384,1,0.0101376,0.0242532,0.0378788
5,CUTLASS,gemm,cutlass_simt_hgemm_256x128_8x2_tn_align1,passed,success,universal,serial,32,2,2,f16:row,f16:column,f16:column,1,0,1,1,simt,f16,256,128,8,2,4,2,1,1,1,1,50,1024,264,384,1,0.0099328,0.0247533,0.0386598
5,CUTLASS,gemm,cutlass_simt_hgemm_256x128_8x2_tt_align1,passed,success,universal,serial,32,2,2,f16:row,f16:row,f16:column,1,0,1,1,simt,f16,256,128,8,2,4,2,1,1,1,1,50,1024,264,384,1,0.0099328,0.0247533,0.0386598
6,CUTLASS,gemm,cutlass_simt_hgemm_256x128_8x2_nn_align1,passed,success,universal,serial,64,2,2,f16:column,f16:column,f16:column,1,0,1,1,simt,f16,256,128,8,2,4,2,1,1,1,1,50,1024,520,768,1,0.0099328,0.0487564,0.0773196
6,CUTLASS,gemm,cutlass_simt_hgemm_256x128_8x2_nt_align1,passed,success,universal,serial,64,2,2,f16:column,f16:row,f16:column,1,0,1,1,simt,f16,256,128,8,2,4,2,1,1,1,1,50,1024,520,768,1,0.0101376,0.0477714,0.0757576
6,CUTLASS,gemm,cutlass_simt_hgemm_256x128_8x2_tn_align1,passed,success,universal,serial,64,2,2,f16:row,f16:column,f16:column,1,0,1,1,simt,f16,256,128,8,2,4,2,1,1,1,1,50,1024,520,768,1,0.0098304,0.0492643,0.078125
6,CUTLASS,gemm,cutlass_simt_hgemm_256x128_8x2_tt_align1,passed,success,universal,serial,64,2,2,f16:row,f16:row,f16:column,1,0,1,1,simt,f16,256,128,8,2,4,2,1,1,1,1,50,1024,520,768,1,0.0099328,0.0487564,0.0773196
7,CUTLASS,gemm,cutlass_simt_hgemm_256x128_8x2_nn_align1,passed,success,universal,serial,128,2,2,f16:column,f16:column,f16:column,1,0,1,1,simt,f16,256,128,8,2,4,2,1,1,1,1,50,1024,1032,1536,1,0.0099328,0.0967627,0.154639
7,CUTLASS,gemm,cutlass_simt_hgemm_256x128_8x2_nt_align1,passed,success,universal,serial,128,2,2,f16:column,f16:row,f16:column,1,0,1,1,simt,f16,256,128,8,2,4,2,1,1,1,1,50,1024,1032,1536,1,0.0101376,0.0948079,0.151515
7,CUTLASS,gemm,cutlass_simt_hgemm_256x128_8x2_tn_align1,passed,success,universal,serial,128,2,2,f16:row,f16:column,f16:column,1,0,1,1,simt,f16,256,128,8,2,4,2,1,1,1,1,50,1024,1032,1536,1,0.0099328,0.0967627,0.154639
7,CUTLASS,gemm,cutlass_simt_hgemm_256x128_8x2_tt_align1,passed,success,universal,serial,128,2,2,f16:row,f16:row,f16:column,1,0,1,1,simt,f16,256,128,8,2,4,2,1,1,1,1,50,1024,1032,1536,1,0.0099328,0.0967627,0.154639
8,CUTLASS,gemm,cutlass_simt_hgemm_256x128_8x2_nn_align1,passed,success,universal,serial,256,2,2,f16:column,f16:column,f16:column,1,0,1,1,simt,f16,256,128,8,2,4,2,1,1,1,1,50,1024,2056,3072,1,0.0100352,0.190808,0.306122
8,CUTLASS,gemm,cutlass_simt_hgemm_256x128_8x2_nt_align1,passed,success,universal,serial,256,2,2,f16:column,f16:row,f16:column,1,0,1,1,simt,f16,256,128,8,2,4,2,1,1,1,1,50,1024,2056,3072,1,0.0101376,0.188881,0.30303
8,CUTLASS,gemm,cutlass_simt_hgemm_256x128_8x2_tn_align1,passed,success,universal,serial,256,2,2,f16:row,f16:column,f16:column,1,0,1,1,simt,f16,256,128,8,2,4,2,1,1,1,1,50,1024,2056,3072,1,0.0100352,0.190808,0.306122
8,CUTLASS,gemm,cutlass_simt_hgemm_256x128_8x2_tt_align1,passed,success,universal,serial,256,2,2,f16:row,f16:row,f16:column,1,0,1,1,simt,f16,256,128,8,2,4,2,1,1,1,1,50,1024,2056,3072,1,0.0100352,0.190808,0.306122
9,CUTLASS,gemm,cutlass_simt_hgemm_256x128_8x2_nn_align1,passed,success,universal,serial,512,2,2,f16:column,f16:column,f16:column,1,0,1,1,simt,f16,256,128,8,2,4,2,1,1,1,1,50,1024,4104,6144,1,0.0101376,0.377027,0.606061
9,CUTLASS,gemm,cutlass_simt_hgemm_256x128_8x2_nt_align1,passed,success,universal,serial,512,2,2,f16:column,f16:row,f16:column,1,0,1,1,simt,f16,256,128,8,2,4,2,1,1,1,1,50,1024,4104,6144,1,0.01024,0.373257,0.6
9,CUTLASS,gemm,cutlass_simt_hgemm_256x128_8x2_tn_align1,passed,success,universal,serial,512,2,2,f16:row,f16:column,f16:column,1,0,1,1,simt,f16,256,128,8,2,4,2,1,1,1,1,50,1024,4104,6144,1,0.0101376,0.377027,0.606061
9,CUTLASS,gemm,cutlass_simt_hgemm_256x128_8x2_tt_align1,passed,success,universal,serial,512,2,2,f16:row,f16:row,f16:column,1,0,1,1,simt,f16,256,128,8,2,4,2,1,1,1,1,50,1024,4104,6144,1,0.0101376,0.377027,0.606061
10,CUTLASS,gemm,cutlass_simt_hgemm_256x128_8x2_nn_align1,passed,success,universal,serial,1024,2,2,f16:column,f16:column,f16:column,1,0,1,1,simt,f16,256,128,8,2,4,2,1,1,1,1,50,1024,8200,12288,1,0.01024,0.745786,1.2
10,CUTLASS,gemm,cutlass_simt_hgemm_256x128_8x2_nt_align1,passed,success,universal,serial,1024,2,2,f16:column,f16:row,f16:column,1,0,1,1,simt,f16,256,128,8,2,4,2,1,1,1,1,50,1024,8200,12288,1,0.0114688,0.66588,1.07143
10,CUTLASS,gemm,cutlass_simt_hgemm_256x128_8x2_tn_align1,passed,success,universal,serial,1024,2,2,f16:row,f16:column,f16:column,1,0,1,1,simt,f16,256,128,8,2,4,2,1,1,1,1,50,1024,8200,12288,1,0.0113664,0.671879,1.08108
10,CUTLASS,gemm,cutlass_simt_hgemm_256x128_8x2_tt_align1,passed,success,universal,serial,1024,2,2,f16:row,f16:row,f16:column,1,0,1,1,simt,f16,256,128,8,2,4,2,1,1,1,1,50,1024,8200,12288,1,0.011264,0.677987,1.09091
11,CUTLASS,gemm,cutlass_simt_hgemm_256x128_8x2_nn_align1,passed,success,universal,serial,2048,2,2,f16:column,f16:column,f16:column,1,0,1,1,simt,f16,256,128,8,2,4,2,1,1,1,1,50,1024,16392,24576,1,0.0111584,1.36814,2.20247
11,CUTLASS,gemm,cutlass_simt_hgemm_256x128_8x2_nt_align1,passed,success,universal,serial,2048,2,2,f16:column,f16:row,f16:column,1,0,1,1,simt,f16,256,128,8,2,4,2,1,1,1,1,50,1024,16392,24576,1,0.0111648,1.36735,2.2012
11,CUTLASS,gemm,cutlass_simt_hgemm_256x128_8x2_tn_align1,passed,success,universal,serial,2048,2,2,f16:row,f16:column,f16:column,1,0,1,1,simt,f16,256,128,8,2,4,2,1,1,1,1,50,1024,16392,24576,1,0.0111584,1.36814,2.20247
11,CUTLASS,gemm,cutlass_simt_hgemm_256x128_8x2_tt_align1,passed,success,universal,serial,2048,2,2,f16:row,f16:row,f16:column,1,0,1,1,simt,f16,256,128,8,2,4,2,1,1,1,1,50,1024,16392,24576,1,0.0111584,1.36814,2.20247
12,CUTLASS,gemm,cutlass_simt_hgemm_256x128_8x2_nn_align1,passed,success,universal,serial,4096,2,2,f16:column,f16:column,f16:column,1,0,1,1,simt,f16,256,128,8,2,4,2,1,1,1,1,50,1024,32776,49152,1,0.0111616,2.73483,4.40367
12,CUTLASS,gemm,cutlass_simt_hgemm_256x128_8x2_nt_align1,passed,success,universal,serial,4096,2,2,f16:column,f16:row,f16:column,1,0,1,1,simt,f16,256,128,8,2,4,2,1,1,1,1,50,1024,32776,49152,1,0.0111616,2.73483,4.40367
12,CUTLASS,gemm,cutlass_simt_hgemm_256x128_8x2_tn_align1,passed,success,universal,serial,4096,2,2,f16:row,f16:column,f16:column,1,0,1,1,simt,f16,256,128,8,2,4,2,1,1,1,1,50,1024,32776,49152,1,0.0112608,2.71073,4.36488
12,CUTLASS,gemm,cutlass_simt_hgemm_256x128_8x2_tt_align1,passed,success,universal,serial,4096,2,2,f16:row,f16:row,f16:column,1,0,1,1,simt,f16,256,128,8,2,4,2,1,1,1,1,50,1024,32776,49152,1,0.0111616,2.73483,4.40367
13,CUTLASS,gemm,cutlass_simt_hgemm_256x128_8x2_nn_align1,passed,success,universal,serial,8192,2,2,f16:column,f16:column,f16:column,1,0,1,1,simt,f16,256,128,8,2,4,2,1,1,1,1,50,1024,65544,98304,1,0.0111584,5.47055,8.80987
13,CUTLASS,gemm,cutlass_simt_hgemm_256x128_8x2_nt_align1,passed,success,universal,serial,8192,2,2,f16:column,f16:row,f16:column,1,0,1,1,simt,f16,256,128,8,2,4,2,1,1,1,1,50,1024,65544,98304,1,0.0113664,5.37044,8.64865
13,CUTLASS,gemm,cutlass_simt_hgemm_256x128_8x2_tn_align1,passed,success,universal,serial,8192,2,2,f16:row,f16:column,f16:column,1,0,1,1,simt,f16,256,128,8,2,4,2,1,1,1,1,50,1024,65544,98304,1,0.0112672,5.41773,8.72479
13,CUTLASS,gemm,cutlass_simt_hgemm_256x128_8x2_tt_align1,passed,success,universal,serial,8192,2,2,f16:row,f16:row,f16:column,1,0,1,1,simt,f16,256,128,8,2,4,2,1,1,1,1,50,1024,65544,98304,1,0.011264,5.41927,8.72727
14,CUTLASS,gemm,cutlass_simt_hgemm_256x128_8x2_nn_align1,passed,success,universal,serial,16384,2,2,f16:column,f16:column,f16:column,1,0,1,1,simt,f16,256,128,8,2,4,2,1,1,1,1,50,1024,131080,196608,1,0.0197632,6.17702,9.94819
14,CUTLASS,gemm,cutlass_simt_hgemm_256x128_8x2_nt_align1,passed,success,universal,serial,16384,2,2,f16:column,f16:row,f16:column,1,0,1,1,simt,f16,256,128,8,2,4,2,1,1,1,1,50,1024,131080,196608,1,0.0197632,6.17702,9.94819
14,CUTLASS,gemm,cutlass_simt_hgemm_256x128_8x2_tn_align1,passed,success,universal,serial,16384,2,2,f16:row,f16:column,f16:column,1,0,1,1,simt,f16,256,128,8,2,4,2,1,1,1,1,50,1024,131080,196608,1,0.0198624,6.14617,9.8985
14,CUTLASS,gemm,cutlass_simt_hgemm_256x128_8x2_tt_align1,passed,success,universal,serial,16384,2,2,f16:row,f16:row,f16:column,1,0,1,1,simt,f16,256,128,8,2,4,2,1,1,1,1,50,1024,131080,196608,1,0.0198656,6.14518,9.89691
15,CUTLASS,gemm,cutlass_simt_hgemm_256x128_8x2_nn_align1,passed,success,universal,serial,2,4,2,f16:column,f16:column,f16:column,1,0,1,1,simt,f16,256,128,8,2,4,2,1,1,1,1,50,1024,40,48,1,0.0111616,0.0033376,0.00430046
15,CUTLASS,gemm,cutlass_simt_hgemm_256x128_8x2_nt_align1,passed,success,universal,serial,2,4,2,f16:column,f16:row,f16:column,1,0,1,1,simt,f16,256,128,8,2,4,2,1,1,1,1,50,1024,40,48,1,0.011056,0.00336947,0.00434153
15,CUTLASS,gemm,cutlass_simt_hgemm_256x128_8x2_tn_align1,passed,success,universal,serial,2,4,2,f16:row,f16:column,f16:column,1,0,1,1,simt,f16,256,128,8,2,4,2,1,1,1,1,50,1024,40,48,1,0.011056,0.00336947,0.00434153
15,CUTLASS,gemm,cutlass_simt_hgemm_256x128_8x2_tt_align1,passed,success,universal,serial,2,4,2,f16:row,f16:row,f16:column,1,0,1,1,simt,f16,256,128,8,2,4,2,1,1,1,1,50,1024,40,48,1,0.0110624,0.00336752,0.00433902
16,CUTLASS,gemm,cutlass_simt_hgemm_256x128_8x2_nn_align1,passed,success,universal,serial,4,4,2,f16:column,f16:column,f16:column,1,0,1,1,simt,f16,256,128,8,2,4,2,1,1,1,1,50,1024,64,96,1,0.0110592,0.0053896,0.00868056
16,CUTLASS,gemm,cutlass_simt_hgemm_256x128_8x2_nt_align1,passed,success,universal,serial,4,4,2,f16:column,f16:row,f16:column,1,0,1,1,simt,f16,256,128,8,2,4,2,1,1,1,1,50,1024,64,96,1,0.0111616,0.00534015,0.00860092
16,CUTLASS,gemm,cutlass_simt_hgemm_256x128_8x2_tn_align1,passed,success,universal,serial,4,4,2,f16:row,f16:column,f16:column,1,0,1,1,simt,f16,256,128,8,2,4,2,1,1,1,1,50,1024,64,96,1,0.0110592,0.0053896,0.00868056
16,CUTLASS,gemm,cutlass_simt_hgemm_256x128_8x2_tt_align1,passed,success,universal,serial,4,4,2,f16:row,f16:row,f16:column,1,0,1,1,simt,f16,256,128,8,2,4,2,1,1,1,1,50,1024,64,96,1,0.0111648,0.00533862,0.00859845
17,CUTLASS,gemm,cutlass_simt_hgemm_256x128_8x2_nn_align1,passed,success,universal,serial,8,4,2,f16:column,f16:column,f16:column,1,0,1,1,simt,f16,256,128,8,2,4,2,1,1,1,1,50,1024,112,192,1,0.0111584,0.00934795,0.0172068
17,CUTLASS,gemm,cutlass_simt_hgemm_256x128_8x2_nt_align1,passed,success,universal,serial,8,4,2,f16:column,f16:row,f16:column,1,0,1,1,simt,f16,256,128,8,2,4,2,1,1,1,1,50,1024,112,192,1,0.0110592,0.0094318,0.0173611
17,CUTLASS,gemm,cutlass_simt_hgemm_256x128_8x2_tn_align1,passed,success,universal,serial,8,4,2,f16:row,f16:column,f16:column,1,0,1,1,simt,f16,256,128,8,2,4,2,1,1,1,1,50,1024,112,192,1,0.0111648,0.00934259,0.0171969
17,CUTLASS,gemm,cutlass_simt_hgemm_256x128_8x2_tt_align1,passed,success,universal,serial,8,4,2,f16:row,f16:row,f16:column,1,0,1,1,simt,f16,256,128,8,2,4,2,1,1,1,1,50,1024,112,192,1,0.0110592,0.0094318,0.0173611
18,CUTLASS,gemm,cutlass_simt_hgemm_256x128_8x2_nn_align1,passed,success,universal,serial,16,4,2,f16:column,f16:column,f16:column,1,0,1,1,simt,f16,256,128,8,2,4,2,1,1,1,1,50,1024,208,384,1,0.0111584,0.0173605,0.0344135
18,CUTLASS,gemm,cutlass_simt_hgemm_256x128_8x2_nt_align1,passed,success,universal,serial,16,4,2,f16:column,f16:row,f16:column,1,0,1,1,simt,f16,256,128,8,2,4,2,1,1,1,1,50,1024,208,384,1,0.011056,0.0175213,0.0347323
18,CUTLASS,gemm,cutlass_simt_hgemm_256x128_8x2_tn_align1,passed,success,universal,serial,16,4,2,f16:row,f16:column,f16:column,1,0,1,1,simt,f16,256,128,8,2,4,2,1,1,1,1,50,1024,208,384,1,0.0111648,0.0173505,0.0343938
18,CUTLASS,gemm,cutlass_simt_hgemm_256x128_8x2_tt_align1,passed,success,universal,serial,16,4,2,f16:row,f16:row,f16:column,1,0,1,1,simt,f16,256,128,8,2,4,2,1,1,1,1,50,1024,208,384,1,0.0110592,0.0175162,0.0347222
19,CUTLASS,gemm,cutlass_simt_hgemm_256x128_8x2_nn_align1,passed,success,universal,serial,32,4,2,f16:column,f16:column,f16:column,1,0,1,1,simt,f16,256,128,8,2,4,2,1,1,1,1,50,1024,400,768,1,0.0110624,0.0336752,0.0694244
19,CUTLASS,gemm,cutlass_simt_hgemm_256x128_8x2_nt_align1,passed,success,universal,serial,32,4,2,f16:column,f16:row,f16:column,1,0,1,1,simt,f16,256,128,8,2,4,2,1,1,1,1,50,1024,400,768,1,0.0111616,0.033376,0.0688073
19,CUTLASS,gemm,cutlass_simt_hgemm_256x128_8x2_tn_align1,passed,success,universal,serial,32,4,2,f16:row,f16:column,f16:column,1,0,1,1,simt,f16,256,128,8,2,4,2,1,1,1,1,50,1024,400,768,1,0.0111584,0.0333855,0.0688271
19,CUTLASS,gemm,cutlass_simt_hgemm_256x128_8x2_tt_align1,passed,success,universal,serial,32,4,2,f16:row,f16:row,f16:column,1,0,1,1,simt,f16,256,128,8,2,4,2,1,1,1,1,50,1024,400,768,1,0.0111616,0.033376,0.0688073
20,CUTLASS,gemm,cutlass_simt_hgemm_256x128_8x2_nn_align1,passed,success,universal,serial,64,4,2,f16:column,f16:column,f16:column,1,0,1,1,simt,f16,256,128,8,2,4,2,1,1,1,1,50,1024,784,1536,1,0.0111616,0.0654169,0.137615
20,CUTLASS,gemm,cutlass_simt_hgemm_256x128_8x2_nt_align1,passed,success,universal,serial,64,4,2,f16:column,f16:row,f16:column,1,0,1,1,simt,f16,256,128,8,2,4,2,1,1,1,1,50,1024,784,1536,1,0.0111584,0.0654356,0.137654
20,CUTLASS,gemm,cutlass_simt_hgemm_256x128_8x2_tn_align1,passed,success,universal,serial,64,4,2,f16:row,f16:column,f16:column,1,0,1,1,simt,f16,256,128,8,2,4,2,1,1,1,1,50,1024,784,1536,1,0.0110624,0.0660035,0.138849
20,CUTLASS,gemm,cutlass_simt_hgemm_256x128_8x2_tt_align1,passed,success,universal,serial,64,4,2,f16:row,f16:row,f16:column,1,0,1,1,simt,f16,256,128,8,2,4,2,1,1,1,1,50,1024,784,1536,1,0.0111616,0.0654169,0.137615
21,CUTLASS,gemm,cutlass_simt_hgemm_256x128_8x2_nn_align1,passed,success,universal,serial,128,4,2,f16:column,f16:column,f16:column,1,0,1,1,simt,f16,256,128,8,2,4,2,1,1,1,1,50,1024,1552,3072,1,0.0111648,0.129462,0.27515
21,CUTLASS,gemm,cutlass_simt_hgemm_256x128_8x2_nt_align1,passed,success,universal,serial,128,4,2,f16:column,f16:row,f16:column,1,0,1,1,simt,f16,256,128,8,2,4,2,1,1,1,1,50,1024,1552,3072,1,0.0111616,0.129499,0.275229
21,CUTLASS,gemm,cutlass_simt_hgemm_256x128_8x2_tn_align1,passed,success,universal,serial,128,4,2,f16:row,f16:column,f16:column,1,0,1,1,simt,f16,256,128,8,2,4,2,1,1,1,1,50,1024,1552,3072,1,0.0110592,0.130698,0.277778
21,CUTLASS,gemm,cutlass_simt_hgemm_256x128_8x2_tt_align1,passed,success,universal,serial,128,4,2,f16:row,f16:row,f16:column,1,0,1,1,simt,f16,256,128,8,2,4,2,1,1,1,1,50,1024,1552,3072,1,0.0111616,0.129499,0.275229
22,CUTLASS,gemm,cutlass_simt_hgemm_256x128_8x2_nn_align1,passed,success,universal,serial,256,4,2,f16:column,f16:column,f16:column,1,0,1,1,simt,f16,256,128,8,2,4,2,1,1,1,1,50,1024,3088,6144,1,0.0111616,0.257662,0.550459
22,CUTLASS,gemm,cutlass_simt_hgemm_256x128_8x2_nt_align1,passed,success,universal,serial,256,4,2,f16:column,f16:row,f16:column,1,0,1,1,simt,f16,256,128,8,2,4,2,1,1,1,1,50,1024,3088,6144,1,0.0110592,0.260048,0.555556
22,CUTLASS,gemm,cutlass_simt_hgemm_256x128_8x2_tn_align1,passed,success,universal,serial,256,4,2,f16:row,f16:column,f16:column,1,0,1,1,simt,f16,256,128,8,2,4,2,1,1,1,1,50,1024,3088,6144,1,0.0111584,0.257736,0.550617
22,CUTLASS,gemm,cutlass_simt_hgemm_256x128_8x2_tt_align1,passed,success,universal,serial,256,4,2,f16:row,f16:row,f16:column,1,0,1,1,simt,f16,256,128,8,2,4,2,1,1,1,1,50,1024,3088,6144,1,0.0110592,0.260048,0.555556
23,CUTLASS,gemm,cutlass_simt_hgemm_256x128_8x2_nn_align1,passed,success,universal,serial,512,4,2,f16:column,f16:column,f16:column,1,0,1,1,simt,f16,256,128,8,2,4,2,1,1,1,1,50,1024,6160,12288,1,0.011056,0.518899,1.11143
23,CUTLASS,gemm,cutlass_simt_hgemm_256x128_8x2_nt_align1,passed,success,universal,serial,512,4,2,f16:column,f16:row,f16:column,1,0,1,1,simt,f16,256,128,8,2,4,2,1,1,1,1,50,1024,6160,12288,1,0.0111616,0.51399,1.10092
23,CUTLASS,gemm,cutlass_simt_hgemm_256x128_8x2_tn_align1,passed,success,universal,serial,512,4,2,f16:row,f16:column,f16:column,1,0,1,1,simt,f16,256,128,8,2,4,2,1,1,1,1,50,1024,6160,12288,1,0.0111648,0.513842,1.1006
23,CUTLASS,gemm,cutlass_simt_hgemm_256x128_8x2_tt_align1,passed,success,universal,serial,512,4,2,f16:row,f16:row,f16:column,1,0,1,1,simt,f16,256,128,8,2,4,2,1,1,1,1,50,1024,6160,12288,1,0.0111616,0.51399,1.10092
24,CUTLASS,gemm,cutlass_simt_hgemm_256x128_8x2_nn_align1,passed,success,universal,serial,1024,4,2,f16:column,f16:column,f16:column,1,0,1,1,simt,f16,256,128,8,2,4,2,1,1,1,1,50,1024,12304,24576,1,0.0110592,1.03615,2.22222
24,CUTLASS,gemm,cutlass_simt_hgemm_256x128_8x2_nt_align1,passed,success,universal,serial,1024,4,2,f16:column,f16:row,f16:column,1,0,1,1,simt,f16,256,128,8,2,4,2,1,1,1,1,50,1024,12304,24576,1,0.0111648,1.02635,2.2012
24,CUTLASS,gemm,cutlass_simt_hgemm_256x128_8x2_tn_align1,passed,success,universal,serial,1024,4,2,f16:row,f16:column,f16:column,1,0,1,1,simt,f16,256,128,8,2,4,2,1,1,1,1,50,1024,12304,24576,1,0.0111584,1.02694,2.20247
24,CUTLASS,gemm,cutlass_simt_hgemm_256x128_8x2_tt_align1,passed,success,universal,serial,1024,4,2,f16:row,f16:row,f16:column,1,0,1,1,simt,f16,256,128,8,2,4,2,1,1,1,1,50,1024,12304,24576,1,0.0111616,1.02664,2.20183
25,CUTLASS,gemm,cutlass_simt_hgemm_256x128_8x2_nn_align1,passed,success,universal,serial,2048,4,2,f16:column,f16:column,f16:column,1,0,1,1,simt,f16,256,128,8,2,4,2,1,1,1,1,50,1024,24592,49152,1,0.0110624,2.07035,4.44316
25,CUTLASS,gemm,cutlass_simt_hgemm_256x128_8x2_nt_align1,passed,success,universal,serial,2048,4,2,f16:column,f16:row,f16:column,1,0,1,1,simt,f16,256,128,8,2,4,2,1,1,1,1,50,1024,24592,49152,1,0.0111584,2.05254,4.40493
25,CUTLASS,gemm,cutlass_simt_hgemm_256x128_8x2_tn_align1,passed,success,universal,serial,2048,4,2,f16:row,f16:column,f16:column,1,0,1,1,simt,f16,256,128,8,2,4,2,1,1,1,1,50,1024,24592,49152,1,0.0111648,2.05137,4.40241
25,CUTLASS,gemm,cutlass_simt_hgemm_256x128_8x2_tt_align1,passed,success,universal,serial,2048,4,2,f16:row,f16:row,f16:column,1,0,1,1,simt,f16,256,128,8,2,4,2,1,1,1,1,50,1024,24592,49152,1,0.0111616,2.05195,4.40367
26,CUTLASS,gemm,cutlass_simt_hgemm_256x128_8x2_nn_align1,passed,success,universal,serial,4096,4,2,f16:column,f16:column,f16:column,1,0,1,1,simt,f16,256,128,8,2,4,2,1,1,1,1,50,1024,49168,98304,1,0.0111616,4.10257,8.80734
26,CUTLASS,gemm,cutlass_simt_hgemm_256x128_8x2_nt_align1,passed,success,universal,serial,4096,4,2,f16:column,f16:row,f16:column,1,0,1,1,simt,f16,256,128,8,2,4,2,1,1,1,1,50,1024,49168,98304,1,0.0111616,4.10257,8.80734
26,CUTLASS,gemm,cutlass_simt_hgemm_256x128_8x2_tn_align1,passed,success,universal,serial,4096,4,2,f16:row,f16:column,f16:column,1,0,1,1,simt,f16,256,128,8,2,4,2,1,1,1,1,50,1024,49168,98304,1,0.011264,4.06528,8.72727
26,CUTLASS,gemm,cutlass_simt_hgemm_256x128_8x2_tt_align1,passed,success,universal,serial,4096,4,2,f16:row,f16:row,f16:column,1,0,1,1,simt,f16,256,128,8,2,4,2,1,1,1,1,50,1024,49168,98304,1,0.0111616,4.10257,8.80734
27,CUTLASS,gemm,cutlass_simt_hgemm_256x128_8x2_nn_align1,passed,success,universal,serial,8192,4,2,f16:column,f16:column,f16:column,1,0,1,1,simt,f16,256,128,8,2,4,2,1,1,1,1,50,1024,98320,196608,1,0.011264,8.12923,17.4545
27,CUTLASS,gemm,cutlass_simt_hgemm_256x128_8x2_nt_align1,passed,success,universal,serial,8192,4,2,f16:column,f16:row,f16:column,1,0,1,1,simt,f16,256,128,8,2,4,2,1,1,1,1,50,1024,98320,196608,1,0.011264,8.12923,17.4545
27,CUTLASS,gemm,cutlass_simt_hgemm_256x128_8x2_tn_align1,passed,success,universal,serial,8192,4,2,f16:row,f16:column,f16:column,1,0,1,1,simt,f16,256,128,8,2,4,2,1,1,1,1,50,1024,98320,196608,1,0.011264,8.12923,17.4545
27,CUTLASS,gemm,cutlass_simt_hgemm_256x128_8x2_tt_align1,passed,success,universal,serial,8192,4,2,f16:row,f16:row,f16:column,1,0,1,1,simt,f16,256,128,8,2,4,2,1,1,1,1,50,1024,98320,196608,1,0.0111616,8.20381,17.6147
28,CUTLASS,gemm,cutlass_simt_hgemm_256x128_8x2_nn_align1,passed,success,universal,serial,16384,4,2,f16:column,f16:column,f16:column,1,0,1,1,simt,f16,256,128,8,2,4,2,1,1,1,1,50,1024,196624,393216,1,0.0197664,9.26422,19.8932
28,CUTLASS,gemm,cutlass_simt_hgemm_256x128_8x2_nt_align1,passed,success,universal,serial,16384,4,2,f16:column,f16:row,f16:column,1,0,1,1,simt,f16,256,128,8,2,4,2,1,1,1,1,50,1024,196624,393216,1,0.019968,9.17069,19.6923
28,CUTLASS,gemm,cutlass_simt_hgemm_256x128_8x2_tn_align1,passed,success,universal,serial,16384,4,2,f16:row,f16:column,f16:column,1,0,1,1,simt,f16,256,128,8,2,4,2,1,1,1,1,50,1024,196624,393216,1,0.01976,9.26722,19.8996
28,CUTLASS,gemm,cutlass_simt_hgemm_256x128_8x2_tt_align1,passed,success,universal,serial,16384,4,2,f16:row,f16:row,f16:column,1,0,1,1,simt,f16,256,128,8,2,4,2,1,1,1,1,50,1024,196624,393216,1,0.0197632,9.26572,19.8964
29,CUTLASS,gemm,cutlass_simt_hgemm_256x128_8x2_nn_align1,passed,success,universal,serial,2,8,2,f16:column,f16:column,f16:column,1,0,1,1,simt,f16,256,128,8,2,4,2,1,1,1,1,50,1024,72,96,1,0.0111616,0.00600767,0.00860092
29,CUTLASS,gemm,cutlass_simt_hgemm_256x128_8x2_nt_align1,passed,success,universal,serial,2,8,2,f16:column,f16:row,f16:column,1,0,1,1,simt,f16,256,128,8,2,4,2,1,1,1,1,50,1024,72,96,1,0.0111584,0.00600939,0.00860338
29,CUTLASS,gemm,cutlass_simt_hgemm_256x128_8x2_tn_align1,passed,success,universal,serial,2,8,2,f16:row,f16:column,f16:column,1,0,1,1,simt,f16,256,128,8,2,4,2,1,1,1,1,50,1024,72,96,1,0.0110592,0.0060633,0.00868056
29,CUTLASS,gemm,cutlass_simt_hgemm_256x128_8x2_tt_align1,passed,success,universal,serial,2,8,2,f16:row,f16:row,f16:column,1,0,1,1,simt,f16,256,128,8,2,4,2,1,1,1,1,50,1024,72,96,1,0.0111616,0.00600767,0.00860092
30,CUTLASS,gemm,cutlass_simt_hgemm_256x128_8x2_nn_align1,passed,success,universal,serial,4,8,2,f16:column,f16:column,f16:column,1,0,1,1,simt,f16,256,128,8,2,4,2,1,1,1,1,50,1024,112,192,1,0.0111616,0.00934527,0.0172018
30,CUTLASS,gemm,cutlass_simt_hgemm_256x128_8x2_nt_align1,passed,success,universal,serial,4,8,2,f16:column,f16:row,f16:column,1,0,1,1,simt,f16,256,128,8,2,4,2,1,1,1,1,50,1024,112,192,1,0.0111648,0.00934259,0.0171969
30,CUTLASS,gemm,cutlass_simt_hgemm_256x128_8x2_tn_align1,passed,success,universal,serial,4,8,2,f16:row,f16:column,f16:column,1,0,1,1,simt,f16,256,128,8,2,4,2,1,1,1,1,50,1024,112,192,1,0.0110592,0.0094318,0.0173611
30,CUTLASS,gemm,cutlass_simt_hgemm_256x128_8x2_tt_align1,passed,success,universal,serial,4,8,2,f16:row,f16:row,f16:column,1,0,1,1,simt,f16,256,128,8,2,4,2,1,1,1,1,50,1024,112,192,1,0.0111648,0.00934259,0.0171969
31,CUTLASS,gemm,cutlass_simt_hgemm_256x128_8x2_nn_align1,passed,success,universal,serial,8,8,2,f16:column,f16:column,f16:column,1,0,1,1,simt,f16,256,128,8,2,4,2,1,1,1,1,50,1024,192,384,2,0.0111584,0.0160251,0.0344135
31,CUTLASS,gemm,cutlass_simt_hgemm_256x128_8x2_nt_align1,passed,success,universal,serial,8,8,2,f16:column,f16:row,f16:column,1,0,1,1,simt,f16,256,128,8,2,4,2,1,1,1,1,50,1024,192,384,2,0.0110592,0.0161688,0.0347222
31,CUTLASS,gemm,cutlass_simt_hgemm_256x128_8x2_tn_align1,passed,success,universal,serial,8,8,2,f16:row,f16:column,f16:column,1,0,1,1,simt,f16,256,128,8,2,4,2,1,1,1,1,50,1024,192,384,2,0.0109568,0.0163199,0.0350467
31,CUTLASS,gemm,cutlass_simt_hgemm_256x128_8x2_tt_align1,passed,success,universal,serial,8,8,2,f16:row,f16:row,f16:column,1,0,1,1,simt,f16,256,128,8,2,4,2,1,1,1,1,50,1024,192,384,2,0.0110592,0.0161688,0.0347222
32,CUTLASS,gemm,cutlass_simt_hgemm_256x128_8x2_nn_align1,passed,success,universal,serial,16,8,2,f16:column,f16:column,f16:column,1,0,1,1,simt,f16,256,128,8,2,4,2,1,1,1,1,50,1024,352,768,2,0.0110592,0.0296428,0.0694444
32,CUTLASS,gemm,cutlass_simt_hgemm_256x128_8x2_nt_align1,passed,success,universal,serial,16,8,2,f16:column,f16:row,f16:column,1,0,1,1,simt,f16,256,128,8,2,4,2,1,1,1,1,50,1024,352,768,2,0.011056,0.0296514,0.0694645
32,CUTLASS,gemm,cutlass_simt_hgemm_256x128_8x2_tn_align1,passed,success,universal,serial,16,8,2,f16:row,f16:column,f16:column,1,0,1,1,simt,f16,256,128,8,2,4,2,1,1,1,1,50,1024,352,768,2,0.0110624,0.0296342,0.0694244
32,CUTLASS,gemm,cutlass_simt_hgemm_256x128_8x2_tt_align1,passed,success,universal,serial,16,8,2,f16:row,f16:row,f16:column,1,0,1,1,simt,f16,256,128,8,2,4,2,1,1,1,1,50,1024,352,768,2,0.0111616,0.0293708,0.0688073
33,CUTLASS,gemm,cutlass_simt_hgemm_256x128_8x2_nn_align1,passed,success,universal,serial,32,8,2,f16:column,f16:column,f16:column,1,0,1,1,simt,f16,256,128,8,2,4,2,1,1,1,1,50,1024,672,1536,2,0.0111648,0.0560555,0.137575
33,CUTLASS,gemm,cutlass_simt_hgemm_256x128_8x2_nt_align1,passed,success,universal,serial,32,8,2,f16:column,f16:row,f16:column,1,0,1,1,simt,f16,256,128,8,2,4,2,1,1,1,1,50,1024,672,1536,2,0.0111616,0.0560716,0.137615
33,CUTLASS,gemm,cutlass_simt_hgemm_256x128_8x2_tn_align1,passed,success,universal,serial,32,8,2,f16:row,f16:column,f16:column,1,0,1,1,simt,f16,256,128,8,2,4,2,1,1,1,1,50,1024,672,1536,2,0.0110592,0.0565908,0.138889
33,CUTLASS,gemm,cutlass_simt_hgemm_256x128_8x2_tt_align1,passed,success,universal,serial,32,8,2,f16:row,f16:row,f16:column,1,0,1,1,simt,f16,256,128,8,2,4,2,1,1,1,1,50,1024,672,1536,2,0.0110624,0.0565744,0.138849
34,CUTLASS,gemm,cutlass_simt_hgemm_256x128_8x2_nn_align1,passed,success,universal,serial,64,8,2,f16:column,f16:column,f16:column,1,0,1,1,simt,f16,256,128,8,2,4,2,1,1,1,1,50,1024,1312,3072,2,0.0110592,0.110487,0.277778
34,CUTLASS,gemm,cutlass_simt_hgemm_256x128_8x2_nt_align1,passed,success,universal,serial,64,8,2,f16:column,f16:row,f16:column,1,0,1,1,simt,f16,256,128,8,2,4,2,1,1,1,1,50,1024,1312,3072,2,0.0110592,0.110487,0.277778
34,CUTLASS,gemm,cutlass_simt_hgemm_256x128_8x2_tn_align1,passed,success,universal,serial,64,8,2,f16:row,f16:column,f16:column,1,0,1,1,simt,f16,256,128,8,2,4,2,1,1,1,1,50,1024,1312,3072,2,0.0110592,0.110487,0.277778
34,CUTLASS,gemm,cutlass_simt_hgemm_256x128_8x2_tt_align1,passed,success,universal,serial,64,8,2,f16:row,f16:row,f16:column,1,0,1,1,simt,f16,256,128,8,2,4,2,1,1,1,1,50,1024,1312,3072,2,0.0110592,0.110487,0.277778
35,CUTLASS,gemm,cutlass_simt_hgemm_256x128_8x2_nn_align1,passed,success,universal,serial,128,8,2,f16:column,f16:column,f16:column,1,0,1,1,simt,f16,256,128,8,2,4,2,1,1,1,1,50,1024,2592,6144,2,0.0112672,0.214249,0.5453
35,CUTLASS,gemm,cutlass_simt_hgemm_256x128_8x2_nt_align1,passed,success,universal,serial,128,8,2,f16:column,f16:row,f16:column,1,0,1,1,simt,f16,256,128,8,2,4,2,1,1,1,1,50,1024,2592,6144,2,0.0111584,0.216338,0.550617
35,CUTLASS,gemm,cutlass_simt_hgemm_256x128_8x2_tn_align1,passed,success,universal,serial,128,8,2,f16:row,f16:column,f16:column,1,0,1,1,simt,f16,256,128,8,2,4,2,1,1,1,1,50,1024,2592,6144,2,0.0110592,0.218279,0.555556
35,CUTLASS,gemm,cutlass_simt_hgemm_256x128_8x2_tt_align1,passed,success,universal,serial,128,8,2,f16:row,f16:row,f16:column,1,0,1,1,simt,f16,256,128,8,2,4,2,1,1,1,1,50,1024,2592,6144,2,0.0110592,0.218279,0.555556
36,CUTLASS,gemm,cutlass_simt_hgemm_256x128_8x2_nn_align1,passed,success,universal,serial,256,8,2,f16:column,f16:column,f16:column,1,0,1,1,simt,f16,256,128,8,2,4,2,1,1,1,1,50,1024,5152,12288,2,0.0111616,0.429882,1.10092
36,CUTLASS,gemm,cutlass_simt_hgemm_256x128_8x2_nt_align1,passed,success,universal,serial,256,8,2,f16:column,f16:row,f16:column,1,0,1,1,simt,f16,256,128,8,2,4,2,1,1,1,1,50,1024,5152,12288,2,0.0111616,0.429882,1.10092
36,CUTLASS,gemm,cutlass_simt_hgemm_256x128_8x2_tn_align1,passed,success,universal,serial,256,8,2,f16:row,f16:column,f16:column,1,0,1,1,simt,f16,256,128,8,2,4,2,1,1,1,1,50,1024,5152,12288,2,0.0111584,0.430006,1.10123
36,CUTLASS,gemm,cutlass_simt_hgemm_256x128_8x2_tt_align1,passed,success,universal,serial,256,8,2,f16:row,f16:row,f16:column,1,0,1,1,simt,f16,256,128,8,2,4,2,1,1,1,1,50,1024,5152,12288,2,0.0111584,0.430006,1.10123
37,CUTLASS,gemm,cutlass_simt_hgemm_256x128_8x2_nn_align1,passed,success,universal,serial,512,8,2,f16:column,f16:column,f16:column,1,0,1,1,simt,f16,256,128,8,2,4,2,1,1,1,1,50,1024,10272,24576,2,0.0111616,0.857094,2.20183
37,CUTLASS,gemm,cutlass_simt_hgemm_256x128_8x2_nt_align1,passed,success,universal,serial,512,8,2,f16:column,f16:row,f16:column,1,0,1,1,simt,f16,256,128,8,2,4,2,1,1,1,1,50,1024,10272,24576,2,0.0111616,0.857094,2.20183
37,CUTLASS,gemm,cutlass_simt_hgemm_256x128_8x2_tn_align1,passed,success,universal,serial,512,8,2,f16:row,f16:column,f16:column,1,0,1,1,simt,f16,256,128,8,2,4,2,1,1,1,1,50,1024,10272,24576,2,0.0111616,0.857094,2.20183
37,CUTLASS,gemm,cutlass_simt_hgemm_256x128_8x2_tt_align1,passed,success,universal,serial,512,8,2,f16:row,f16:row,f16:column,1,0,1,1,simt,f16,256,128,8,2,4,2,1,1,1,1,50,1024,10272,24576,2,0.0110592,0.865031,2.22222
38,CUTLASS,gemm,cutlass_simt_hgemm_256x128_8x2_nn_align1,passed,success,universal,serial,1024,8,2,f16:column,f16:column,f16:column,1,0,1,1,simt,f16,256,128,8,2,4,2,1,1,1,1,50,1024,20512,49152,2,0.0111616,1.71152,4.40367
38,CUTLASS,gemm,cutlass_simt_hgemm_256x128_8x2_nt_align1,passed,success,universal,serial,1024,8,2,f16:column,f16:row,f16:column,1,0,1,1,simt,f16,256,128,8,2,4,2,1,1,1,1,50,1024,20512,49152,2,0.0111584,1.71201,4.40493
38,CUTLASS,gemm,cutlass_simt_hgemm_256x128_8x2_tn_align1,passed,success,universal,serial,1024,8,2,f16:row,f16:column,f16:column,1,0,1,1,simt,f16,256,128,8,2,4,2,1,1,1,1,50,1024,20512,49152,2,0.0111616,1.71152,4.40367
38,CUTLASS,gemm,cutlass_simt_hgemm_256x128_8x2_tt_align1,passed,success,universal,serial,1024,8,2,f16:row,f16:row,f16:column,1,0,1,1,simt,f16,256,128,8,2,4,2,1,1,1,1,50,1024,20512,49152,2,0.011056,1.72787,4.44573
39,CUTLASS,gemm,cutlass_simt_hgemm_256x128_8x2_nn_align1,passed,success,universal,serial,2048,8,2,f16:column,f16:column,f16:column,1,0,1,1,simt,f16,256,128,8,2,4,2,1,1,1,1,50,1024,40992,98304,2,0.0111616,3.42037,8.80734
39,CUTLASS,gemm,cutlass_simt_hgemm_256x128_8x2_nt_align1,passed,success,universal,serial,2048,8,2,f16:column,f16:row,f16:column,1,0,1,1,simt,f16,256,128,8,2,4,2,1,1,1,1,50,1024,40992,98304,2,0.0111616,3.42037,8.80734
39,CUTLASS,gemm,cutlass_simt_hgemm_256x128_8x2_tn_align1,passed,success,universal,serial,2048,8,2,f16:row,f16:column,f16:column,1,0,1,1,simt,f16,256,128,8,2,4,2,1,1,1,1,50,1024,40992,98304,2,0.0111616,3.42037,8.80734
39,CUTLASS,gemm,cutlass_simt_hgemm_256x128_8x2_tt_align1,passed,success,universal,serial,2048,8,2,f16:row,f16:row,f16:column,1,0,1,1,simt,f16,256,128,8,2,4,2,1,1,1,1,50,1024,40992,98304,2,0.0111616,3.42037,8.80734
40,CUTLASS,gemm,cutlass_simt_hgemm_256x128_8x2_nn_align1,passed,success,universal,serial,4096,8,2,f16:column,f16:column,f16:column,1,0,1,1,simt,f16,256,128,8,2,4,2,1,1,1,1,50,1024,81952,196608,2,0.0111616,6.83807,17.6147
40,CUTLASS,gemm,cutlass_simt_hgemm_256x128_8x2_nt_align1,passed,success,universal,serial,4096,8,2,f16:column,f16:row,f16:column,1,0,1,1,simt,f16,256,128,8,2,4,2,1,1,1,1,50,1024,81952,196608,2,0.0111616,6.83807,17.6147
40,CUTLASS,gemm,cutlass_simt_hgemm_256x128_8x2_tn_align1,passed,success,universal,serial,4096,8,2,f16:row,f16:column,f16:column,1,0,1,1,simt,f16,256,128,8,2,4,2,1,1,1,1,50,1024,81952,196608,2,0.0111616,6.83807,17.6147
40,CUTLASS,gemm,cutlass_simt_hgemm_256x128_8x2_tt_align1,passed,success,universal,serial,4096,8,2,f16:row,f16:row,f16:column,1,0,1,1,simt,f16,256,128,8,2,4,2,1,1,1,1,50,1024,81952,196608,2,0.0111584,6.84003,17.6197
41,CUTLASS,gemm,cutlass_simt_hgemm_256x128_8x2_nn_align1,passed,success,universal,serial,8192,8,2,f16:column,f16:column,f16:column,1,0,1,1,simt,f16,256,128,8,2,4,2,1,1,1,1,50,1024,163872,393216,2,0.0111616,13.6735,35.2294
41,CUTLASS,gemm,cutlass_simt_hgemm_256x128_8x2_nt_align1,passed,success,universal,serial,8192,8,2,f16:column,f16:row,f16:column,1,0,1,1,simt,f16,256,128,8,2,4,2,1,1,1,1,50,1024,163872,393216,2,0.011264,13.5492,34.9091
41,CUTLASS,gemm,cutlass_simt_hgemm_256x128_8x2_tn_align1,passed,success,universal,serial,8192,8,2,f16:row,f16:column,f16:column,1,0,1,1,simt,f16,256,128,8,2,4,2,1,1,1,1,50,1024,163872,393216,2,0.0111616,13.6735,35.2294
41,CUTLASS,gemm,cutlass_simt_hgemm_256x128_8x2_tt_align1,passed,success,universal,serial,8192,8,2,f16:row,f16:row,f16:column,1,0,1,1,simt,f16,256,128,8,2,4,2,1,1,1,1,50,1024,163872,393216,2,0.011264,13.5492,34.9091
42,CUTLASS,gemm,cutlass_simt_hgemm_256x128_8x2_nn_align1,passed,success,universal,serial,16384,8,2,f16:column,f16:column,f16:column,1,0,1,1,simt,f16,256,128,8,2,4,2,1,1,1,1,50,1024,327712,786432,2,0.0198624,15.366,39.594
42,CUTLASS,gemm,cutlass_simt_hgemm_256x128_8x2_nt_align1,passed,success,universal,serial,16384,8,2,f16:column,f16:row,f16:column,1,0,1,1,simt,f16,256,128,8,2,4,2,1,1,1,1,50,1024,327712,786432,2,0.0198656,15.3635,39.5876
42,CUTLASS,gemm,cutlass_simt_hgemm_256x128_8x2_tn_align1,passed,success,universal,serial,16384,8,2,f16:row,f16:column,f16:column,1,0,1,1,simt,f16,256,128,8,2,4,2,1,1,1,1,50,1024,327712,786432,2,0.0199648,15.2872,39.3909
42,CUTLASS,gemm,cutlass_simt_hgemm_256x128_8x2_tt_align1,passed,success,universal,serial,16384,8,2,f16:row,f16:row,f16:column,1,0,1,1,simt,f16,256,128,8,2,4,2,1,1,1,1,50,1024,327712,786432,2,0.0198656,15.3635,39.5876
43,CUTLASS,gemm,cutlass_simt_hgemm_256x128_8x2_nn_align1,passed,success,universal,serial,2,16,2,f16:column,f16:column,f16:column,1,0,1,1,simt,f16,256,128,8,2,4,2,1,1,1,1,50,1024,136,192,1,0.011056,0.0114562,0.0173661
43,CUTLASS,gemm,cutlass_simt_hgemm_256x128_8x2_nt_align1,passed,success,universal,serial,2,16,2,f16:column,f16:row,f16:column,1,0,1,1,simt,f16,256,128,8,2,4,2,1,1,1,1,50,1024,136,192,1,0.0111616,0.0113478,0.0172018
43,CUTLASS,gemm,cutlass_simt_hgemm_256x128_8x2_tn_align1,passed,success,universal,serial,2,16,2,f16:row,f16:column,f16:column,1,0,1,1,simt,f16,256,128,8,2,4,2,1,1,1,1,50,1024,136,192,1,0.0110592,0.0114529,0.0173611
43,CUTLASS,gemm,cutlass_simt_hgemm_256x128_8x2_tt_align1,passed,success,universal,serial,2,16,2,f16:row,f16:row,f16:column,1,0,1,1,simt,f16,256,128,8,2,4,2,1,1,1,1,50,1024,136,192,1,0.0111584,0.0113511,0.0172068
44,CUTLASS,gemm,cutlass_simt_hgemm_256x128_8x2_nn_align1,passed,success,universal,serial,4,16,2,f16:column,f16:column,f16:column,1,0,1,1,simt,f16,256,128,8,2,4,2,1,1,1,1,50,1024,208,384,1,0.0111584,0.0173605,0.0344135
44,CUTLASS,gemm,cutlass_simt_hgemm_256x128_8x2_nt_align1,passed,success,universal,serial,4,16,2,f16:column,f16:row,f16:column,1,0,1,1,simt,f16,256,128,8,2,4,2,1,1,1,1,50,1024,208,384,1,0.0111648,0.0173505,0.0343938
44,CUTLASS,gemm,cutlass_simt_hgemm_256x128_8x2_tn_align1,passed,success,universal,serial,4,16,2,f16:row,f16:column,f16:column,1,0,1,1,simt,f16,256,128,8,2,4,2,1,1,1,1,50,1024,208,384,1,0.011056,0.0175213,0.0347323
44,CUTLASS,gemm,cutlass_simt_hgemm_256x128_8x2_tt_align1,passed,success,universal,serial,4,16,2,f16:row,f16:row,f16:column,1,0,1,1,simt,f16,256,128,8,2,4,2,1,1,1,1,50,1024,208,384,1,0.0111648,0.0173505,0.0343938
45,CUTLASS,gemm,cutlass_simt_hgemm_256x128_8x2_nn_align1,passed,success,universal,serial,8,16,2,f16:column,f16:column,f16:column,1,0,1,1,simt,f16,256,128,8,2,4,2,1,1,1,1,50,1024,352,768,2,0.0110592,0.0296428,0.0694444
45,CUTLASS,gemm,cutlass_simt_hgemm_256x128_8x2_nt_align1,passed,success,universal,serial,8,16,2,f16:column,f16:row,f16:column,1,0,1,1,simt,f16,256,128,8,2,4,2,1,1,1,1,50,1024,352,768,2,0.0111648,0.0293624,0.0687876
45,CUTLASS,gemm,cutlass_simt_hgemm_256x128_8x2_tn_align1,passed,success,universal,serial,8,16,2,f16:row,f16:column,f16:column,1,0,1,1,simt,f16,256,128,8,2,4,2,1,1,1,1,50,1024,352,768,2,0.01096,0.0299111,0.070073
45,CUTLASS,gemm,cutlass_simt_hgemm_256x128_8x2_tt_align1,passed,success,universal,serial,8,16,2,f16:row,f16:row,f16:column,1,0,1,1,simt,f16,256,128,8,2,4,2,1,1,1,1,50,1024,352,768,2,0.0110592,0.0296428,0.0694444
46,CUTLASS,gemm,cutlass_simt_hgemm_256x128_8x2_nn_align1,passed,success,universal,serial,16,16,2,f16:column,f16:column,f16:column,1,0,1,1,simt,f16,256,128,8,2,4,2,1,1,1,1,50,1024,640,1536,2,0.0111616,0.0534015,0.137615
46,CUTLASS,gemm,cutlass_simt_hgemm_256x128_8x2_nt_align1,passed,success,universal,serial,16,16,2,f16:column,f16:row,f16:column,1,0,1,1,simt,f16,256,128,8,2,4,2,1,1,1,1,50,1024,640,1536,2,0.0110592,0.053896,0.138889
46,CUTLASS,gemm,cutlass_simt_hgemm_256x128_8x2_tn_align1,passed,success,universal,serial,16,16,2,f16:row,f16:column,f16:column,1,0,1,1,simt,f16,256,128,8,2,4,2,1,1,1,1,50,1024,640,1536,2,0.011056,0.0539116,0.138929
46,CUTLASS,gemm,cutlass_simt_hgemm_256x128_8x2_tt_align1,passed,success,universal,serial,16,16,2,f16:row,f16:row,f16:column,1,0,1,1,simt,f16,256,128,8,2,4,2,1,1,1,1,50,1024,640,1536,2,0.0111584,0.0534168,0.137654
47,CUTLASS,gemm,cutlass_simt_hgemm_256x128_8x2_nn_align1,passed,success,universal,serial,32,16,2,f16:column,f16:column,f16:column,1,0,1,1,simt,f16,256,128,8,2,4,2,1,1,1,1,50,1024,1216,3072,2,0.0111648,0.101434,0.27515
47,CUTLASS,gemm,cutlass_simt_hgemm_256x128_8x2_nt_align1,passed,success,universal,serial,32,16,2,f16:column,f16:row,f16:column,1,0,1,1,simt,f16,256,128,8,2,4,2,1,1,1,1,50,1024,1216,3072,2,0.0111616,0.101463,0.275229
47,CUTLASS,gemm,cutlass_simt_hgemm_256x128_8x2_tn_align1,passed,success,universal,serial,32,16,2,f16:row,f16:column,f16:column,1,0,1,1,simt,f16,256,128,8,2,4,2,1,1,1,1,50,1024,1216,3072,2,0.0111584,0.101492,0.275308
47,CUTLASS,gemm,cutlass_simt_hgemm_256x128_8x2_tt_align1,passed,success,universal,serial,32,16,2,f16:row,f16:row,f16:column,1,0,1,1,simt,f16,256,128,8,2,4,2,1,1,1,1,50,1024,1216,3072,2,0.0111584,0.101492,0.275308
48,CUTLASS,gemm,cutlass_simt_hgemm_256x128_8x2_nn_align1,passed,success,universal,serial,64,16,2,f16:column,f16:column,f16:column,1,0,1,1,simt,f16,256,128,8,2,4,2,1,1,1,1,50,1024,2368,6144,2,0.0110592,0.199415,0.555556
48,CUTLASS,gemm,cutlass_simt_hgemm_256x128_8x2_nt_align1,passed,success,universal,serial,64,16,2,f16:column,f16:row,f16:column,1,0,1,1,simt,f16,256,128,8,2,4,2,1,1,1,1,50,1024,2368,6144,2,0.0111584,0.197642,0.550617
48,CUTLASS,gemm,cutlass_simt_hgemm_256x128_8x2_tn_align1,passed,success,universal,serial,64,16,2,f16:row,f16:column,f16:column,1,0,1,1,simt,f16,256,128,8,2,4,2,1,1,1,1,50,1024,2368,6144,2,0.0111616,0.197586,0.550459
48,CUTLASS,gemm,cutlass_simt_hgemm_256x128_8x2_tt_align1,passed,success,universal,serial,64,16,2,f16:row,f16:row,f16:column,1,0,1,1,simt,f16,256,128,8,2,4,2,1,1,1,1,50,1024,2368,6144,2,0.0110624,0.199357,0.555395
49,CUTLASS,gemm,cutlass_simt_hgemm_256x128_8x2_nn_align1,passed,success,universal,serial,128,16,2,f16:column,f16:column,f16:column,1,0,1,1,simt,f16,256,128,8,2,4,2,1,1,1,1,50,1024,4672,12288,2,0.0110592,0.393441,1.11111
49,CUTLASS,gemm,cutlass_simt_hgemm_256x128_8x2_nt_align1,passed,success,universal,serial,128,16,2,f16:column,f16:row,f16:column,1,0,1,1,simt,f16,256,128,8,2,4,2,1,1,1,1,50,1024,4672,12288,2,0.0111648,0.389719,1.1006
49,CUTLASS,gemm,cutlass_simt_hgemm_256x128_8x2_tn_align1,passed,success,universal,serial,128,16,2,f16:row,f16:column,f16:column,1,0,1,1,simt,f16,256,128,8,2,4,2,1,1,1,1,50,1024,4672,12288,2,0.0111616,0.389831,1.10092
49,CUTLASS,gemm,cutlass_simt_hgemm_256x128_8x2_tt_align1,passed,success,universal,serial,128,16,2,f16:row,f16:row,f16:column,1,0,1,1,simt,f16,256,128,8,2,4,2,1,1,1,1,50,1024,4672,12288,2,0.0111616,0.389831,1.10092
50,CUTLASS,gemm,cutlass_simt_hgemm_256x128_8x2_nn_align1,passed,success,universal,serial,256,16,2,f16:column,f16:column,f16:column,1,0,1,1,simt,f16,256,128,8,2,4,2,1,1,1,1,50,1024,9280,24576,2,0.0111616,0.774322,2.20183
50,CUTLASS,gemm,cutlass_simt_hgemm_256x128_8x2_nt_align1,passed,success,universal,serial,256,16,2,f16:column,f16:row,f16:column,1,0,1,1,simt,f16,256,128,8,2,4,2,1,1,1,1,50,1024,9280,24576,2,0.0111648,0.7741,2.2012
50,CUTLASS,gemm,cutlass_simt_hgemm_256x128_8x2_tn_align1,passed,success,universal,serial,256,16,2,f16:row,f16:column,f16:column,1,0,1,1,simt,f16,256,128,8,2,4,2,1,1,1,1,50,1024,9280,24576,2,0.0111584,0.774544,2.20247
50,CUTLASS,gemm,cutlass_simt_hgemm_256x128_8x2_tt_align1,passed,success,universal,serial,256,16,2,f16:row,f16:row,f16:column,1,0,1,1,simt,f16,256,128,8,2,4,2,1,1,1,1,50,1024,9280,24576,2,0.0111616,0.774322,2.20183
51,CUTLASS,gemm,cutlass_simt_hgemm_256x128_8x2_nn_align1,passed,success,universal,serial,512,16,2,f16:column,f16:column,f16:column,1,0,1,1,simt,f16,256,128,8,2,4,2,1,1,1,1,50,1024,18496,49152,2,0.0111616,1.5433,4.40367
51,CUTLASS,gemm,cutlass_simt_hgemm_256x128_8x2_nt_align1,passed,success,universal,serial,512,16,2,f16:column,f16:row,f16:column,1,0,1,1,simt,f16,256,128,8,2,4,2,1,1,1,1,50,1024,18496,49152,2,0.0111648,1.54286,4.40241
51,CUTLASS,gemm,cutlass_simt_hgemm_256x128_8x2_tn_align1,passed,success,universal,serial,512,16,2,f16:row,f16:column,f16:column,1,0,1,1,simt,f16,256,128,8,2,4,2,1,1,1,1,50,1024,18496,49152,2,0.011264,1.52927,4.36364
51,CUTLASS,gemm,cutlass_simt_hgemm_256x128_8x2_tt_align1,passed,success,universal,serial,512,16,2,f16:row,f16:row,f16:column,1,0,1,1,simt,f16,256,128,8,2,4,2,1,1,1,1,50,1024,18496,49152,2,0.0111616,1.5433,4.40367
52,CUTLASS,gemm,cutlass_simt_hgemm_256x128_8x2_nn_align1,passed,success,universal,serial,1024,16,2,f16:column,f16:column,f16:column,1,0,1,1,simt,f16,256,128,8,2,4,2,1,1,1,1,50,1024,36928,98304,2,0.0111616,3.08127,8.80734
52,CUTLASS,gemm,cutlass_simt_hgemm_256x128_8x2_nt_align1,passed,success,universal,serial,1024,16,2,f16:column,f16:row,f16:column,1,0,1,1,simt,f16,256,128,8,2,4,2,1,1,1,1,50,1024,36928,98304,2,0.0111584,3.08215,8.80987
52,CUTLASS,gemm,cutlass_simt_hgemm_256x128_8x2_tn_align1,passed,success,universal,serial,1024,16,2,f16:row,f16:column,f16:column,1,0,1,1,simt,f16,256,128,8,2,4,2,1,1,1,1,50,1024,36928,98304,2,0.0112672,3.05239,8.72479
52,CUTLASS,gemm,cutlass_simt_hgemm_256x128_8x2_tt_align1,passed,success,universal,serial,1024,16,2,f16:row,f16:row,f16:column,1,0,1,1,simt,f16,256,128,8,2,4,2,1,1,1,1,50,1024,36928,98304,2,0.0111584,3.08215,8.80987
53,CUTLASS,gemm,cutlass_simt_hgemm_256x128_8x2_nn_align1,passed,success,universal,serial,2048,16,2,f16:column,f16:column,f16:column,1,0,1,1,simt,f16,256,128,8,2,4,2,1,1,1,1,50,1024,73792,196608,2,0.0111616,6.1572,17.6147
53,CUTLASS,gemm,cutlass_simt_hgemm_256x128_8x2_nt_align1,passed,success,universal,serial,2048,16,2,f16:column,f16:row,f16:column,1,0,1,1,simt,f16,256,128,8,2,4,2,1,1,1,1,50,1024,73792,196608,2,0.0111616,6.1572,17.6147
53,CUTLASS,gemm,cutlass_simt_hgemm_256x128_8x2_tn_align1,passed,success,universal,serial,2048,16,2,f16:row,f16:column,f16:column,1,0,1,1,simt,f16,256,128,8,2,4,2,1,1,1,1,50,1024,73792,196608,2,0.0111616,6.1572,17.6147
53,CUTLASS,gemm,cutlass_simt_hgemm_256x128_8x2_tt_align1,passed,success,universal,serial,2048,16,2,f16:row,f16:row,f16:column,1,0,1,1,simt,f16,256,128,8,2,4,2,1,1,1,1,50,1024,73792,196608,2,0.0111616,6.1572,17.6147
54,CUTLASS,gemm,cutlass_simt_hgemm_256x128_8x2_nn_align1,passed,success,universal,serial,4096,16,2,f16:column,f16:column,f16:column,1,0,1,1,simt,f16,256,128,8,2,4,2,1,1,1,1,50,1024,147520,393216,2,0.011264,12.1972,34.9091
54,CUTLASS,gemm,cutlass_simt_hgemm_256x128_8x2_nt_align1,passed,success,universal,serial,4096,16,2,f16:column,f16:row,f16:column,1,0,1,1,simt,f16,256,128,8,2,4,2,1,1,1,1,50,1024,147520,393216,2,0.0112672,12.1937,34.8992
54,CUTLASS,gemm,cutlass_simt_hgemm_256x128_8x2_tn_align1,passed,success,universal,serial,4096,16,2,f16:row,f16:column,f16:column,1,0,1,1,simt,f16,256,128,8,2,4,2,1,1,1,1,50,1024,147520,393216,2,0.0111616,12.3091,35.2294
54,CUTLASS,gemm,cutlass_simt_hgemm_256x128_8x2_tt_align1,passed,success,universal,serial,4096,16,2,f16:row,f16:row,f16:column,1,0,1,1,simt,f16,256,128,8,2,4,2,1,1,1,1,50,1024,147520,393216,2,0.0111648,12.3055,35.2193
55,CUTLASS,gemm,cutlass_simt_hgemm_256x128_8x2_nn_align1,passed,success,universal,serial,8192,16,2,f16:column,f16:column,f16:column,1,0,1,1,simt,f16,256,128,8,2,4,2,1,1,1,1,50,1024,294976,786432,2,0.0113664,24.1693,69.1892
55,CUTLASS,gemm,cutlass_simt_hgemm_256x128_8x2_nt_align1,passed,success,universal,serial,8192,16,2,f16:column,f16:row,f16:column,1,0,1,1,simt,f16,256,128,8,2,4,2,1,1,1,1,50,1024,294976,786432,2,0.0113696,24.1625,69.1697
55,CUTLASS,gemm,cutlass_simt_hgemm_256x128_8x2_tn_align1,passed,success,universal,serial,8192,16,2,f16:row,f16:column,f16:column,1,0,1,1,simt,f16,256,128,8,2,4,2,1,1,1,1,50,1024,294976,786432,2,0.0113632,24.1761,69.2087
55,CUTLASS,gemm,cutlass_simt_hgemm_256x128_8x2_tt_align1,passed,success,universal,serial,8192,16,2,f16:row,f16:row,f16:column,1,0,1,1,simt,f16,256,128,8,2,4,2,1,1,1,1,50,1024,294976,786432,2,0.011264,24.389,69.8182
56,CUTLASS,gemm,cutlass_simt_hgemm_256x128_8x2_nn_align1,passed,success,universal,serial,16384,16,2,f16:column,f16:column,f16:column,1,0,1,1,simt,f16,256,128,8,2,4,2,1,1,1,1,50,1024,589888,1572864,2,0.0198624,27.6591,79.188
56,CUTLASS,gemm,cutlass_simt_hgemm_256x128_8x2_nt_align1,passed,success,universal,serial,16384,16,2,f16:column,f16:row,f16:column,1,0,1,1,simt,f16,256,128,8,2,4,2,1,1,1,1,50,1024,589888,1572864,2,0.0198624,27.6591,79.188
56,CUTLASS,gemm,cutlass_simt_hgemm_256x128_8x2_tn_align1,passed,success,universal,serial,16384,16,2,f16:row,f16:column,f16:column,1,0,1,1,simt,f16,256,128,8,2,4,2,1,1,1,1,50,1024,589888,1572864,2,0.0198656,27.6546,79.1753
56,CUTLASS,gemm,cutlass_simt_hgemm_256x128_8x2_tt_align1,passed,success,universal,serial,16384,16,2,f16:row,f16:row,f16:column,1,0,1,1,simt,f16,256,128,8,2,4,2,1,1,1,1,50,1024,589888,1572864,2,0.0199712,27.5084,78.7566
57,CUTLASS,gemm,cutlass_simt_hgemm_256x128_8x2_nn_align1,passed,success,universal,serial,2,32,2,f16:column,f16:column,f16:column,1,0,1,1,simt,f16,256,128,8,2,4,2,1,1,1,1,50,1024,264,384,1,0.0111648,0.0220218,0.0343938
57,CUTLASS,gemm,cutlass_simt_hgemm_256x128_8x2_nt_align1,passed,success,universal,serial,2,32,2,f16:column,f16:row,f16:column,1,0,1,1,simt,f16,256,128,8,2,4,2,1,1,1,1,50,1024,264,384,1,0.0110592,0.0222321,0.0347222
57,CUTLASS,gemm,cutlass_simt_hgemm_256x128_8x2_tn_align1,passed,success,universal,serial,2,32,2,f16:row,f16:column,f16:column,1,0,1,1,simt,f16,256,128,8,2,4,2,1,1,1,1,50,1024,264,384,1,0.0110592,0.0222321,0.0347222
57,CUTLASS,gemm,cutlass_simt_hgemm_256x128_8x2_tt_align1,passed,success,universal,serial,2,32,2,f16:row,f16:row,f16:column,1,0,1,1,simt,f16,256,128,8,2,4,2,1,1,1,1,50,1024,264,384,1,0.0111648,0.0220218,0.0343938
58,CUTLASS,gemm,cutlass_simt_hgemm_256x128_8x2_nn_align1,passed,success,universal,serial,4,32,2,f16:column,f16:column,f16:column,1,0,1,1,simt,f16,256,128,8,2,4,2,1,1,1,1,50,1024,400,768,1,0.0111648,0.0333664,0.0687876
58,CUTLASS,gemm,cutlass_simt_hgemm_256x128_8x2_nt_align1,passed,success,universal,serial,4,32,2,f16:column,f16:row,f16:column,1,0,1,1,simt,f16,256,128,8,2,4,2,1,1,1,1,50,1024,400,768,1,0.0110592,0.033685,0.0694444
58,CUTLASS,gemm,cutlass_simt_hgemm_256x128_8x2_tn_align1,passed,success,universal,serial,4,32,2,f16:row,f16:column,f16:column,1,0,1,1,simt,f16,256,128,8,2,4,2,1,1,1,1,50,1024,400,768,1,0.0110624,0.0336752,0.0694244
58,CUTLASS,gemm,cutlass_simt_hgemm_256x128_8x2_tt_align1,passed,success,universal,serial,4,32,2,f16:row,f16:row,f16:column,1,0,1,1,simt,f16,256,128,8,2,4,2,1,1,1,1,50,1024,400,768,1,0.0110592,0.033685,0.0694444
59,CUTLASS,gemm,cutlass_simt_hgemm_256x128_8x2_nn_align1,passed,success,universal,serial,8,32,2,f16:column,f16:column,f16:column,1,0,1,1,simt,f16,256,128,8,2,4,2,1,1,1,1,50,1024,672,1536,2,0.0111584,0.0560877,0.137654
59,CUTLASS,gemm,cutlass_simt_hgemm_256x128_8x2_nt_align1,passed,success,universal,serial,8,32,2,f16:column,f16:row,f16:column,1,0,1,1,simt,f16,256,128,8,2,4,2,1,1,1,1,50,1024,672,1536,2,0.0110592,0.0565908,0.138889
59,CUTLASS,gemm,cutlass_simt_hgemm_256x128_8x2_tn_align1,passed,success,universal,serial,8,32,2,f16:row,f16:column,f16:column,1,0,1,1,simt,f16,256,128,8,2,4,2,1,1,1,1,50,1024,672,1536,2,0.0110592,0.0565908,0.138889
59,CUTLASS,gemm,cutlass_simt_hgemm_256x128_8x2_tt_align1,passed,success,universal,serial,8,32,2,f16:row,f16:row,f16:column,1,0,1,1,simt,f16,256,128,8,2,4,2,1,1,1,1,50,1024,672,1536,2,0.0111584,0.0560877,0.137654
60,CUTLASS,gemm,cutlass_simt_hgemm_256x128_8x2_nn_align1,passed,success,universal,serial,16,32,2,f16:column,f16:column,f16:column,1,0,1,1,simt,f16,256,128,8,2,4,2,1,1,1,1,50,1024,1216,3072,2,0.0111616,0.101463,0.275229
60,CUTLASS,gemm,cutlass_simt_hgemm_256x128_8x2_nt_align1,passed,success,universal,serial,16,32,2,f16:column,f16:row,f16:column,1,0,1,1,simt,f16,256,128,8,2,4,2,1,1,1,1,50,1024,1216,3072,2,0.0111648,0.101434,0.27515
60,CUTLASS,gemm,cutlass_simt_hgemm_256x128_8x2_tn_align1,passed,success,universal,serial,16,32,2,f16:row,f16:column,f16:column,1,0,1,1,simt,f16,256,128,8,2,4,2,1,1,1,1,50,1024,1216,3072,2,0.0111616,0.101463,0.275229
60,CUTLASS,gemm,cutlass_simt_hgemm_256x128_8x2_tt_align1,passed,success,universal,serial,16,32,2,f16:row,f16:row,f16:column,1,0,1,1,simt,f16,256,128,8,2,4,2,1,1,1,1,50,1024,1216,3072,2,0.0111648,0.101434,0.27515
61,CUTLASS,gemm,cutlass_simt_hgemm_256x128_8x2_nn_align1,passed,success,universal,serial,32,32,2,f16:column,f16:column,f16:column,1,0,1,1,simt,f16,256,128,8,2,4,2,1,1,1,1,50,1024,2304,6144,2,0.0110592,0.194026,0.555556
61,CUTLASS,gemm,cutlass_simt_hgemm_256x128_8x2_nt_align1,passed,success,universal,serial,32,32,2,f16:column,f16:row,f16:column,1,0,1,1,simt,f16,256,128,8,2,4,2,1,1,1,1,50,1024,2304,6144,2,0.0111584,0.192301,0.550617
61,CUTLASS,gemm,cutlass_simt_hgemm_256x128_8x2_tn_align1,passed,success,universal,serial,32,32,2,f16:row,f16:column,f16:column,1,0,1,1,simt,f16,256,128,8,2,4,2,1,1,1,1,50,1024,2304,6144,2,0.0111616,0.192245,0.550459
61,CUTLASS,gemm,cutlass_simt_hgemm_256x128_8x2_tt_align1,passed,success,universal,serial,32,32,2,f16:row,f16:row,f16:column,1,0,1,1,simt,f16,256,128,8,2,4,2,1,1,1,1,50,1024,2304,6144,2,0.0111584,0.192301,0.550617
62,CUTLASS,gemm,cutlass_simt_hgemm_256x128_8x2_nn_align1,passed,success,universal,serial,64,32,2,f16:column,f16:column,f16:column,1,0,1,1,simt,f16,256,128,8,2,4,2,1,1,1,1,50,1024,4480,12288,2,0.0111616,0.373811,1.10092
62,CUTLASS,gemm,cutlass_simt_hgemm_256x128_8x2_nt_align1,passed,success,universal,serial,64,32,2,f16:column,f16:row,f16:column,1,0,1,1,simt,f16,256,128,8,2,4,2,1,1,1,1,50,1024,4480,12288,2,0.0110592,0.377272,1.11111
62,CUTLASS,gemm,cutlass_simt_hgemm_256x128_8x2_tn_align1,passed,success,universal,serial,64,32,2,f16:row,f16:column,f16:column,1,0,1,1,simt,f16,256,128,8,2,4,2,1,1,1,1,50,1024,4480,12288,2,0.0110624,0.377163,1.11079
62,CUTLASS,gemm,cutlass_simt_hgemm_256x128_8x2_tt_align1,passed,success,universal,serial,64,32,2,f16:row,f16:row,f16:column,1,0,1,1,simt,f16,256,128,8,2,4,2,1,1,1,1,50,1024,4480,12288,2,0.0111584,0.373918,1.10123
63,CUTLASS,gemm,cutlass_simt_hgemm_256x128_8x2_nn_align1,passed,success,universal,serial,128,32,2,f16:column,f16:column,f16:column,1,0,1,1,simt,f16,256,128,8,2,4,2,1,1,1,1,50,1024,8832,24576,2,0.0111648,0.73673,2.2012
63,CUTLASS,gemm,cutlass_simt_hgemm_256x128_8x2_nt_align1,passed,success,universal,serial,128,32,2,f16:column,f16:row,f16:column,1,0,1,1,simt,f16,256,128,8,2,4,2,1,1,1,1,50,1024,8832,24576,2,0.0110592,0.743765,2.22222
63,CUTLASS,gemm,cutlass_simt_hgemm_256x128_8x2_tn_align1,passed,success,universal,serial,128,32,2,f16:row,f16:column,f16:column,1,0,1,1,simt,f16,256,128,8,2,4,2,1,1,1,1,50,1024,8832,24576,2,0.0110624,0.743549,2.22158
63,CUTLASS,gemm,cutlass_simt_hgemm_256x128_8x2_tt_align1,passed,success,universal,serial,128,32,2,f16:row,f16:row,f16:column,1,0,1,1,simt,f16,256,128,8,2,4,2,1,1,1,1,50,1024,8832,24576,2,0.011056,0.74398,2.22287
64,CUTLASS,gemm,cutlass_simt_hgemm_256x128_8x2_nn_align1,passed,success,universal,serial,256,32,2,f16:column,f16:column,f16:column,1,0,1,1,simt,f16,256,128,8,2,4,2,1,1,1,1,50,1024,17536,49152,2,0.0111616,1.4632,4.40367
64,CUTLASS,gemm,cutlass_simt_hgemm_256x128_8x2_nt_align1,passed,success,universal,serial,256,32,2,f16:column,f16:row,f16:column,1,0,1,1,simt,f16,256,128,8,2,4,2,1,1,1,1,50,1024,17536,49152,2,0.0111616,1.4632,4.40367
64,CUTLASS,gemm,cutlass_simt_hgemm_256x128_8x2_tn_align1,passed,success,universal,serial,256,32,2,f16:row,f16:column,f16:column,1,0,1,1,simt,f16,256,128,8,2,4,2,1,1,1,1,50,1024,17536,49152,2,0.0111584,1.46362,4.40493
64,CUTLASS,gemm,cutlass_simt_hgemm_256x128_8x2_tt_align1,passed,success,universal,serial,256,32,2,f16:row,f16:row,f16:column,1,0,1,1,simt,f16,256,128,8,2,4,2,1,1,1,1,50,1024,17536,49152,2,0.0111616,1.4632,4.40367
65,CUTLASS,gemm,cutlass_simt_hgemm_256x128_8x2_nn_align1,passed,success,universal,serial,512,32,2,f16:column,f16:column,f16:column,1,0,1,1,simt,f16,256,128,8,2,4,2,1,1,1,1,50,1024,34944,98304,2,0.0112672,2.8884,8.72479
65,CUTLASS,gemm,cutlass_simt_hgemm_256x128_8x2_nt_align1,passed,success,universal,serial,512,32,2,f16:column,f16:row,f16:column,1,0,1,1,simt,f16,256,128,8,2,4,2,1,1,1,1,50,1024,34944,98304,2,0.011056,2.94357,8.89146
65,CUTLASS,gemm,cutlass_simt_hgemm_256x128_8x2_tn_align1,passed,success,universal,serial,512,32,2,f16:row,f16:column,f16:column,1,0,1,1,simt,f16,256,128,8,2,4,2,1,1,1,1,50,1024,34944,98304,2,0.0112672,2.8884,8.72479
65,CUTLASS,gemm,cutlass_simt_hgemm_256x128_8x2_tt_align1,passed,success,universal,serial,512,32,2,f16:row,f16:row,f16:column,1,0,1,1,simt,f16,256,128,8,2,4,2,1,1,1,1,50,1024,34944,98304,2,0.0111616,2.91572,8.80734
66,CUTLASS,gemm,cutlass_simt_hgemm_256x128_8x2_nn_align1,passed,success,universal,serial,1024,32,2,f16:column,f16:column,f16:column,1,0,1,1,simt,f16,256,128,8,2,4,2,1,1,1,1,50,1024,69760,196608,2,0.0111584,5.82244,17.6197
66,CUTLASS,gemm,cutlass_simt_hgemm_256x128_8x2_nt_align1,passed,success,universal,serial,1024,32,2,f16:column,f16:row,f16:column,1,0,1,1,simt,f16,256,128,8,2,4,2,1,1,1,1,50,1024,69760,196608,2,0.0111616,5.82077,17.6147
66,CUTLASS,gemm,cutlass_simt_hgemm_256x128_8x2_tn_align1,passed,success,universal,serial,1024,32,2,f16:row,f16:column,f16:column,1,0,1,1,simt,f16,256,128,8,2,4,2,1,1,1,1,50,1024,69760,196608,2,0.0111616,5.82077,17.6147
66,CUTLASS,gemm,cutlass_simt_hgemm_256x128_8x2_tt_align1,passed,success,universal,serial,1024,32,2,f16:row,f16:row,f16:column,1,0,1,1,simt,f16,256,128,8,2,4,2,1,1,1,1,50,1024,69760,196608,2,0.0111616,5.82077,17.6147
67,CUTLASS,gemm,cutlass_simt_hgemm_256x128_8x2_nn_align1,passed,success,universal,serial,2048,32,2,f16:column,f16:column,f16:column,1,0,1,1,simt,f16,256,128,8,2,4,2,1,1,1,1,50,1024,139392,393216,2,0.0111648,11.6275,35.2193
67,CUTLASS,gemm,cutlass_simt_hgemm_256x128_8x2_nt_align1,passed,success,universal,serial,2048,32,2,f16:column,f16:row,f16:column,1,0,1,1,simt,f16,256,128,8,2,4,2,1,1,1,1,50,1024,139392,393216,2,0.0111584,11.6342,35.2395
67,CUTLASS,gemm,cutlass_simt_hgemm_256x128_8x2_tn_align1,passed,success,universal,serial,2048,32,2,f16:row,f16:column,f16:column,1,0,1,1,simt,f16,256,128,8,2,4,2,1,1,1,1,50,1024,139392,393216,2,0.0111616,11.6309,35.2294
67,CUTLASS,gemm,cutlass_simt_hgemm_256x128_8x2_tt_align1,passed,success,universal,serial,2048,32,2,f16:row,f16:row,f16:column,1,0,1,1,simt,f16,256,128,8,2,4,2,1,1,1,1,50,1024,139392,393216,2,0.011264,11.5251,34.9091
68,CUTLASS,gemm,cutlass_simt_hgemm_256x128_8x2_nn_align1,passed,success,universal,serial,4096,32,2,f16:column,f16:column,f16:column,1,0,1,1,simt,f16,256,128,8,2,4,2,1,1,1,1,50,1024,278656,786432,2,0.0111616,23.251,70.4587
68,CUTLASS,gemm,cutlass_simt_hgemm_256x128_8x2_nt_align1,passed,success,universal,serial,4096,32,2,f16:column,f16:row,f16:column,1,0,1,1,simt,f16,256,128,8,2,4,2,1,1,1,1,50,1024,278656,786432,2,0.0111616,23.251,70.4587
68,CUTLASS,gemm,cutlass_simt_hgemm_256x128_8x2_tn_align1,passed,success,universal,serial,4096,32,2,f16:row,f16:column,f16:column,1,0,1,1,simt,f16,256,128,8,2,4,2,1,1,1,1,50,1024,278656,786432,2,0.0111616,23.251,70.4587
68,CUTLASS,gemm,cutlass_simt_hgemm_256x128_8x2_tt_align1,passed,success,universal,serial,4096,32,2,f16:row,f16:row,f16:column,1,0,1,1,simt,f16,256,128,8,2,4,2,1,1,1,1,50,1024,278656,786432,2,0.0112608,23.0462,69.838
69,CUTLASS,gemm,cutlass_simt_hgemm_256x128_8x2_nn_align1,passed,success,universal,serial,8192,32,2,f16:column,f16:column,f16:column,1,0,1,1,simt,f16,256,128,8,2,4,2,1,1,1,1,50,1024,557184,1572864,2,0.011472,45.2334,137.105
69,CUTLASS,gemm,cutlass_simt_hgemm_256x128_8x2_nt_align1,passed,success,universal,serial,8192,32,2,f16:column,f16:row,f16:column,1,0,1,1,simt,f16,256,128,8,2,4,2,1,1,1,1,50,1024,557184,1572864,2,0.0113664,45.6537,138.378
69,CUTLASS,gemm,cutlass_simt_hgemm_256x128_8x2_tn_align1,passed,success,universal,serial,8192,32,2,f16:row,f16:column,f16:column,1,0,1,1,simt,f16,256,128,8,2,4,2,1,1,1,1,50,1024,557184,1572864,2,0.0113664,45.6537,138.378
69,CUTLASS,gemm,cutlass_simt_hgemm_256x128_8x2_tt_align1,passed,success,universal,serial,8192,32,2,f16:row,f16:row,f16:column,1,0,1,1,simt,f16,256,128,8,2,4,2,1,1,1,1,50,1024,557184,1572864,2,0.0113664,45.6537,138.378
70,CUTLASS,gemm,cutlass_simt_hgemm_256x128_8x2_nn_align1,passed,success,universal,serial,16384,32,2,f16:column,f16:column,f16:column,1,0,1,1,simt,f16,256,128,8,2,4,2,1,1,1,1,50,1024,1114240,3145728,2,0.0199648,51.9773,157.564
70,CUTLASS,gemm,cutlass_simt_hgemm_256x128_8x2_nt_align1,passed,success,universal,serial,16384,32,2,f16:column,f16:row,f16:column,1,0,1,1,simt,f16,256,128,8,2,4,2,1,1,1,1,50,1024,1114240,3145728,2,0.0198624,52.2453,158.376
70,CUTLASS,gemm,cutlass_simt_hgemm_256x128_8x2_tn_align1,passed,success,universal,serial,16384,32,2,f16:row,f16:column,f16:column,1,0,1,1,simt,f16,256,128,8,2,4,2,1,1,1,1,50,1024,1114240,3145728,2,0.0200672,51.7121,156.76
70,CUTLASS,gemm,cutlass_simt_hgemm_256x128_8x2_tt_align1,passed,success,universal,serial,16384,32,2,f16:row,f16:row,f16:column,1,0,1,1,simt,f16,256,128,8,2,4,2,1,1,1,1,50,1024,1114240,3145728,2,0.019968,51.969,157.538
71,CUTLASS,gemm,cutlass_simt_hgemm_256x128_8x2_nn_align1,passed,success,universal,serial,2,64,2,f16:column,f16:column,f16:column,1,0,1,1,simt,f16,256,128,8,2,4,2,1,1,1,1,50,1024,520,768,1,0.0110592,0.0437905,0.0694444
71,CUTLASS,gemm,cutlass_simt_hgemm_256x128_8x2_nt_align1,passed,success,universal,serial,2,64,2,f16:column,f16:row,f16:column,1,0,1,1,simt,f16,256,128,8,2,4,2,1,1,1,1,50,1024,520,768,1,0.0111616,0.0433887,0.0688073
71,CUTLASS,gemm,cutlass_simt_hgemm_256x128_8x2_tn_align1,passed,success,universal,serial,2,64,2,f16:row,f16:column,f16:column,1,0,1,1,simt,f16,256,128,8,2,4,2,1,1,1,1,50,1024,520,768,1,0.0111616,0.0433887,0.0688073
71,CUTLASS,gemm,cutlass_simt_hgemm_256x128_8x2_tt_align1,passed,success,universal,serial,2,64,2,f16:row,f16:row,f16:column,1,0,1,1,simt,f16,256,128,8,2,4,2,1,1,1,1,50,1024,520,768,1,0.0111584,0.0434012,0.0688271
72,CUTLASS,gemm,cutlass_simt_hgemm_256x128_8x2_nn_align1,passed,success,universal,serial,4,64,2,f16:column,f16:column,f16:column,1,0,1,1,simt,f16,256,128,8,2,4,2,1,1,1,1,50,1024,784,1536,1,0.0111648,0.0653981,0.137575
72,CUTLASS,gemm,cutlass_simt_hgemm_256x128_8x2_nt_align1,passed,success,universal,serial,4,64,2,f16:column,f16:row,f16:column,1,0,1,1,simt,f16,256,128,8,2,4,2,1,1,1,1,50,1024,784,1536,1,0.011056,0.0660417,0.138929
72,CUTLASS,gemm,cutlass_simt_hgemm_256x128_8x2_tn_align1,passed,success,universal,serial,4,64,2,f16:row,f16:column,f16:column,1,0,1,1,simt,f16,256,128,8,2,4,2,1,1,1,1,50,1024,784,1536,1,0.0110592,0.0660226,0.138889
72,CUTLASS,gemm,cutlass_simt_hgemm_256x128_8x2_tt_align1,passed,success,universal,serial,4,64,2,f16:row,f16:row,f16:column,1,0,1,1,simt,f16,256,128,8,2,4,2,1,1,1,1,50,1024,784,1536,1,0.011056,0.0660417,0.138929
73,CUTLASS,gemm,cutlass_simt_hgemm_256x128_8x2_nn_align1,passed,success,universal,serial,8,64,2,f16:column,f16:column,f16:column,1,0,1,1,simt,f16,256,128,8,2,4,2,1,1,1,1,50,1024,1312,3072,2,0.0110624,0.110455,0.277697
73,CUTLASS,gemm,cutlass_simt_hgemm_256x128_8x2_nt_align1,passed,success,universal,serial,8,64,2,f16:column,f16:row,f16:column,1,0,1,1,simt,f16,256,128,8,2,4,2,1,1,1,1,50,1024,1312,3072,2,0.0110592,0.110487,0.277778
73,CUTLASS,gemm,cutlass_simt_hgemm_256x128_8x2_tn_align1,passed,success,universal,serial,8,64,2,f16:row,f16:column,f16:column,1,0,1,1,simt,f16,256,128,8,2,4,2,1,1,1,1,50,1024,1312,3072,2,0.0110592,0.110487,0.277778
73,CUTLASS,gemm,cutlass_simt_hgemm_256x128_8x2_tt_align1,passed,success,universal,serial,8,64,2,f16:row,f16:row,f16:column,1,0,1,1,simt,f16,256,128,8,2,4,2,1,1,1,1,50,1024,1312,3072,2,0.011264,0.108478,0.272727
74,CUTLASS,gemm,cutlass_simt_hgemm_256x128_8x2_nn_align1,passed,success,universal,serial,16,64,2,f16:column,f16:column,f16:column,1,0,1,1,simt,f16,256,128,8,2,4,2,1,1,1,1,50,1024,2368,6144,2,0.0110624,0.199357,0.555395
74,CUTLASS,gemm,cutlass_simt_hgemm_256x128_8x2_nt_align1,passed,success,universal,serial,16,64,2,f16:column,f16:row,f16:column,1,0,1,1,simt,f16,256,128,8,2,4,2,1,1,1,1,50,1024,2368,6144,2,0.0111616,0.197586,0.550459
