CUTLASS/cutlassgemm-benchmark/functional-test.gemm.csv
Problem,Provider,OperationKind,Operation,Disposition,Status,gemm_kind,split_k_mode,m,n,k,A,B,C,alpha,beta,split_k_slices,batch_count,op_class,accum,cta_m,cta_n,cta_k,stages,warps_m,warps_n,warps_k,inst_m,inst_n,inst_k,min_cc,max_cc,Bytes,Flops,Flops/Byte,Runtime,GB/s,GFLOPs
1,CUTLASS,gemm,cutlass_simt_sgemm_128x128_8x2_nn_align1,passed,success,universal,serial,2,2,2,f32:column,f32:column,f32:column,1,0,1,1,simt,f32,128,128,8,2,4,2,1,1,1,1,50,1024,48,24,0,0.010528,0.00424615,0.00227964
1,CUTLASS,gemm,cutlass_simt_sgemm_128x128_8x2_nt_align1,passed,success,universal,serial,2,2,2,f32:column,f32:row,f32:column,1,0,1,1,simt,f32,128,128,8,2,4,2,1,1,1,1,50,1024,48,24,0,0.010112,0.00442084,0.00237342
1,CUTLASS,gemm,cutlass_simt_sgemm_128x128_8x2_tn_align1,passed,success,universal,serial,2,2,2,f32:row,f32:column,f32:column,1,0,1,1,simt,f32,128,128,8,2,4,2,1,1,1,1,50,1024,48,24,0,0.009952,0.00449191,0.00241158
1,CUTLASS,gemm,cutlass_simt_sgemm_128x128_8x2_tt_align1,passed,success,universal,serial,2,2,2,f32:row,f32:row,f32:column,1,0,1,1,simt,f32,128,128,8,2,4,2,1,1,1,1,50,1024,48,24,0,0.010208,0.00437926,0.0023511
2,CUTLASS,gemm,cutlass_simt_sgemm_128x128_8x2_nn_align1,passed,success,universal,serial,4,2,2,f32:column,f32:column,f32:column,1,0,1,1,simt,f32,128,128,8,2,4,2,1,1,1,1,50,1024,80,48,0,0.010336,0.00720838,0.00464396
2,CUTLASS,gemm,cutlass_simt_sgemm_128x128_8x2_nt_align1,passed,success,universal,serial,4,2,2,f32:column,f32:row,f32:column,1,0,1,1,simt,f32,128,128,8,2,4,2,1,1,1,1,50,1024,80,48,0,0.010368,0.00718613,0.00462963
2,CUTLASS,gemm,cutlass_simt_sgemm_128x128_8x2_tn_align1,passed,success,universal,serial,4,2,2,f32:row,f32:column,f32:column,1,0,1,1,simt,f32,128,128,8,2,4,2,1,1,1,1,50,1024,80,48,0,0.0104,0.00716402,0.00461538
2,CUTLASS,gemm,cutlass_simt_sgemm_128x128_8x2_tt_align1,passed,success,universal,serial,4,2,2,f32:row,f32:row,f32:column,1,0,1,1,simt,f32,128,128,8,2,4,2,1,1,1,1,50,1024,80,48,0,0.010368,0.00718613,0.00462963
3,CUTLASS,gemm,cutlass_simt_sgemm_128x128_8x2_nn_align1,passed,success,universal,serial,8,2,2,f32:column,f32:column,f32:column,1,0,1,1,simt,f32,128,128,8,2,4,2,1,1,1,1,50,1024,144,96,0,0.010656,0.0125854,0.00900901
3,CUTLASS,gemm,cutlass_simt_sgemm_128x128_8x2_nt_align1,passed,success,universal,serial,8,2,2,f32:column,f32:row,f32:column,1,0,1,1,simt,f32,128,128,8,2,4,2,1,1,1,1,50,1024,144,96,0,0.010368,0.012935,0.00925926
3,CUTLASS,gemm,cutlass_simt_sgemm_128x128_8x2_tn_align1,passed,success,universal,serial,8,2,2,f32:row,f32:column,f32:column,1,0,1,1,simt,f32,128,128,8,2,4,2,1,1,1,1,50,1024,144,96,0,0.010368,0.012935,0.00925926
3,CUTLASS,gemm,cutlass_simt_sgemm_128x128_8x2_tt_align1,passed,success,universal,serial,8,2,2,f32:row,f32:row,f32:column,1,0,1,1,simt,f32,128,128,8,2,4,2,1,1,1,1,50,1024,144,96,0,0.010368,0.012935,0.00925926
4,CUTLASS,gemm,cutlass_simt_sgemm_128x128_8x2_nn_align1,passed,success,universal,serial,56,2,2,f32:column,f32:column,f32:column,1,0,1,1,simt,f32,128,128,8,2,4,2,1,1,1,1,50,1024,912,672,0,0.010336,0.0821755,0.0650155
4,CUTLASS,gemm,cutlass_simt_sgemm_128x128_8x2_nt_align1,passed,success,universal,serial,56,2,2,f32:column,f32:row,f32:column,1,0,1,1,simt,f32,128,128,8,2,4,2,1,1,1,1,50,1024,912,672,0,0.010336,0.0821755,0.0650155
4,CUTLASS,gemm,cutlass_simt_sgemm_128x128_8x2_tn_align1,passed,success,universal,serial,56,2,2,f32:row,f32:column,f32:column,1,0,1,1,simt,f32,128,128,8,2,4,2,1,1,1,1,50,1024,912,672,0,0.010368,0.0819219,0.0648148
4,CUTLASS,gemm,cutlass_simt_sgemm_128x128_8x2_tt_align1,passed,success,universal,serial,56,2,2,f32:row,f32:row,f32:column,1,0,1,1,simt,f32,128,128,8,2,4,2,1,1,1,1,50,1024,912,672,0,0.010336,0.0821755,0.0650155
5,CUTLASS,gemm,cutlass_simt_sgemm_128x128_8x2_nn_align1,passed,success,universal,serial,120,2,2,f32:column,f32:column,f32:column,1,0,1,1,simt,f32,128,128,8,2,4,2,1,1,1,1,50,1024,1936,1440,0,0.010592,0.170227,0.135952
5,CUTLASS,gemm,cutlass_simt_sgemm_128x128_8x2_nt_align1,passed,success,universal,serial,120,2,2,f32:column,f32:row,f32:column,1,0,1,1,simt,f32,128,128,8,2,4,2,1,1,1,1,50,1024,1936,1440,0,0.010368,0.173904,0.138889
5,CUTLASS,gemm,cutlass_simt_sgemm_128x128_8x2_tn_align1,passed,success,universal,serial,120,2,2,f32:row,f32:column,f32:column,1,0,1,1,simt,f32,128,128,8,2,4,2,1,1,1,1,50,1024,1936,1440,0,0.010464,0.172309,0.137615
5,CUTLASS,gemm,cutlass_simt_sgemm_128x128_8x2_tt_align1,passed,success,universal,serial,120,2,2,f32:row,f32:row,f32:column,1,0,1,1,simt,f32,128,128,8,2,4,2,1,1,1,1,50,1024,1936,1440,0,0.010496,0.171784,0.137195
6,CUTLASS,gemm,cutlass_simt_sgemm_128x128_8x2_nn_align1,passed,success,universal,serial,136,2,2,f32:column,f32:column,f32:column,1,0,1,1,simt,f32,128,128,8,2,4,2,1,1,1,1,50,1024,2192,1632,0,0.010368,0.1969,0.157407
6,CUTLASS,gemm,cutlass_simt_sgemm_128x128_8x2_nt_align1,passed,success,universal,serial,136,2,2,f32:column,f32:row,f32:column,1,0,1,1,simt,f32,128,128,8,2,4,2,1,1,1,1,50,1024,2192,1632,0,0.010368,0.1969,0.157407
6,CUTLASS,gemm,cutlass_simt_sgemm_128x128_8x2_tn_align1,passed,success,universal,serial,136,2,2,f32:row,f32:column,f32:column,1,0,1,1,simt,f32,128,128,8,2,4,2,1,1,1,1,50,1024,2192,1632,0,0.010368,0.1969,0.157407
6,CUTLASS,gemm,cutlass_simt_sgemm_128x128_8x2_tt_align1,passed,success,universal,serial,136,2,2,f32:row,f32:row,f32:column,1,0,1,1,simt,f32,128,128,8,2,4,2,1,1,1,1,50,1024,2192,1632,0,0.010368,0.1969,0.157407
7,CUTLASS,gemm,cutlass_simt_sgemm_128x128_8x2_nn_align1,passed,success,universal,serial,256,2,2,f32:column,f32:column,f32:column,1,0,1,1,simt,f32,128,128,8,2,4,2,1,1,1,1,50,1024,4112,3072,0,0.010336,0.370511,0.297214
7,CUTLASS,gemm,cutlass_simt_sgemm_128x128_8x2_nt_align1,passed,success,universal,serial,256,2,2,f32:column,f32:row,f32:column,1,0,1,1,simt,f32,128,128,8,2,4,2,1,1,1,1,50,1024,4112,3072,0,0.010464,0.365978,0.293578
7,CUTLASS,gemm,cutlass_simt_sgemm_128x128_8x2_tn_align1,passed,success,universal,serial,256,2,2,f32:row,f32:column,f32:column,1,0,1,1,simt,f32,128,128,8,2,4,2,1,1,1,1,50,1024,4112,3072,0,0.010624,0.360467,0.289157
7,CUTLASS,gemm,cutlass_simt_sgemm_128x128_8x2_tt_align1,passed,success,universal,serial,256,2,2,f32:row,f32:row,f32:column,1,0,1,1,simt,f32,128,128,8,2,4,2,1,1,1,1,50,1024,4112,3072,0,0.010624,0.360467,0.289157
8,CUTLASS,gemm,cutlass_simt_sgemm_128x128_8x2_nn_align1,passed,success,universal,serial,264,2,2,f32:column,f32:column,f32:column,1,0,1,1,simt,f32,128,128,8,2,4,2,1,1,1,1,50,1024,4240,3168,0,0.010624,0.371687,0.298193
8,CUTLASS,gemm,cutlass_simt_sgemm_128x128_8x2_nt_align1,passed,success,universal,serial,264,2,2,f32:column,f32:row,f32:column,1,0,1,1,simt,f32,128,128,8,2,4,2,1,1,1,1,50,1024,4240,3168,0,0.010368,0.380865,0.305556
8,CUTLASS,gemm,cutlass_simt_sgemm_128x128_8x2_tn_align1,passed,success,universal,serial,264,2,2,f32:row,f32:column,f32:column,1,0,1,1,simt,f32,128,128,8,2,4,2,1,1,1,1,50,1024,4240,3168,0,0.010368,0.380865,0.305556
8,CUTLASS,gemm,cutlass_simt_sgemm_128x128_8x2_tt_align1,passed,success,universal,serial,264,2,2,f32:row,f32:row,f32:column,1,0,1,1,simt,f32,128,128,8,2,4,2,1,1,1,1,50,1024,4240,3168,0,0.010368,0.380865,0.305556
9,CUTLASS,gemm,cutlass_simt_sgemm_128x128_8x2_nn_align1,passed,success,universal,serial,512,2,2,f32:column,f32:column,f32:column,1,0,1,1,simt,f32,128,128,8,2,4,2,1,1,1,1,50,1024,8208,6144,0,0.010368,0.737297,0.592593
9,CUTLASS,gemm,cutlass_simt_sgemm_128x128_8x2_nt_align1,passed,success,universal,serial,512,2,2,f32:column,f32:row,f32:column,1,0,1,1,simt,f32,128,128,8,2,4,2,1,1,1,1,50,1024,8208,6144,0,0.010368,0.737297,0.592593
9,CUTLASS,gemm,cutlass_simt_sgemm_128x128_8x2_tn_align1,passed,success,universal,serial,512,2,2,f32:row,f32:column,f32:column,1,0,1,1,simt,f32,128,128,8,2,4,2,1,1,1,1,50,1024,8208,6144,0,0.010624,0.719531,0.578313
9,CUTLASS,gemm,cutlass_simt_sgemm_128x128_8x2_tt_align1,passed,success,universal,serial,512,2,2,f32:row,f32:row,f32:column,1,0,1,1,simt,f32,128,128,8,2,4,2,1,1,1,1,50,1024,8208,6144,0,0.010592,0.721705,0.58006
10,CUTLASS,gemm,cutlass_simt_sgemm_128x128_8x2_nn_align1,passed,success,universal,serial,520,2,2,f32:column,f32:column,f32:column,1,0,1,1,simt,f32,128,128,8,2,4,2,1,1,1,1,50,1024,8336,6240,0,0.010624,0.730752,0.587349
10,CUTLASS,gemm,cutlass_simt_sgemm_128x128_8x2_nt_align1,passed,success,universal,serial,520,2,2,f32:column,f32:row,f32:column,1,0,1,1,simt,f32,128,128,8,2,4,2,1,1,1,1,50,1024,8336,6240,0,0.010368,0.748795,0.601852
10,CUTLASS,gemm,cutlass_simt_sgemm_128x128_8x2_tn_align1,passed,success,universal,serial,520,2,2,f32:row,f32:column,f32:column,1,0,1,1,simt,f32,128,128,8,2,4,2,1,1,1,1,50,1024,8336,6240,0,0.010592,0.732959,0.589124
10,CUTLASS,gemm,cutlass_simt_sgemm_128x128_8x2_tt_align1,passed,success,universal,serial,520,2,2,f32:row,f32:row,f32:column,1,0,1,1,simt,f32,128,128,8,2,4,2,1,1,1,1,50,1024,8336,6240,0,0.010336,0.751113,0.603715
11,CUTLASS,gemm,cutlass_simt_sgemm_128x128_8x2_nn_align1,passed,success,universal,serial,1024,2,2,f32:column,f32:column,f32:column,1,0,1,1,simt,f32,128,128,8,2,4,2,1,1,1,1,50,1024,16400,12288,0,0.010368,1.47316,1.18519
11,CUTLASS,gemm,cutlass_simt_sgemm_128x128_8x2_nt_align1,passed,success,universal,serial,1024,2,2,f32:column,f32:row,f32:column,1,0,1,1,simt,f32,128,128,8,2,4,2,1,1,1,1,50,1024,16400,12288,0,0.010368,1.47316,1.18519
11,CUTLASS,gemm,cutlass_simt_sgemm_128x128_8x2_tn_align1,passed,success,universal,serial,1024,2,2,f32:row,f32:column,f32:column,1,0,1,1,simt,f32,128,128,8,2,4,2,1,1,1,1,50,1024,16400,12288,0,0.010656,1.43334,1.15315
11,CUTLASS,gemm,cutlass_simt_sgemm_128x128_8x2_tt_align1,passed,success,universal,serial,1024,2,2,f32:row,f32:row,f32:column,1,0,1,1,simt,f32,128,128,8,2,4,2,1,1,1,1,50,1024,16400,12288,0,0.010624,1.43766,1.15663
12,CUTLASS,gemm,cutlass_simt_sgemm_128x128_8x2_nn_align1,passed,success,universal,serial,1032,2,2,f32:column,f32:column,f32:column,1,0,1,1,simt,f32,128,128,8,2,4,2,1,1,1,1,50,1024,16528,12384,0,0.010624,1.44888,1.16566
12,CUTLASS,gemm,cutlass_simt_sgemm_128x128_8x2_nt_align1,passed,success,universal,serial,1032,2,2,f32:column,f32:row,f32:column,1,0,1,1,simt,f32,128,128,8,2,4,2,1,1,1,1,50,1024,16528,12384,0,0.010624,1.44888,1.16566
12,CUTLASS,gemm,cutlass_simt_sgemm_128x128_8x2_tn_align1,passed,success,universal,serial,1032,2,2,f32:row,f32:column,f32:column,1,0,1,1,simt,f32,128,128,8,2,4,2,1,1,1,1,50,1024,16528,12384,0,0.010848,1.41896,1.14159
12,CUTLASS,gemm,cutlass_simt_sgemm_128x128_8x2_tt_align1,passed,success,universal,serial,1032,2,2,f32:row,f32:row,f32:column,1,0,1,1,simt,f32,128,128,8,2,4,2,1,1,1,1,50,1024,16528,12384,0,0.010624,1.44888,1.16566
13,CUTLASS,gemm,cutlass_simt_sgemm_128x128_8x2_nn_align1,passed,success,universal,serial,4096,2,2,f32:column,f32:column,f32:column,1,0,1,1,simt,f32,128,128,8,2,4,2,1,1,1,1,50,1024,65552,49152,0,0.010464,5.83429,4.69725
13,CUTLASS,gemm,cutlass_simt_sgemm_128x128_8x2_nt_align1,passed,success,universal,serial,4096,2,2,f32:column,f32:row,f32:column,1,0,1,1,simt,f32,128,128,8,2,4,2,1,1,1,1,50,1024,65552,49152,0,0.0104,5.8702,4.72615
13,CUTLASS,gemm,cutlass_simt_sgemm_128x128_8x2_tn_align1,passed,success,universal,serial,4096,2,2,f32:row,f32:column,f32:column,1,0,1,1,simt,f32,128,128,8,2,4,2,1,1,1,1,50,1024,65552,49152,0,0.010368,5.88832,4.74074
13,CUTLASS,gemm,cutlass_simt_sgemm_128x128_8x2_tt_align1,passed,success,universal,serial,4096,2,2,f32:row,f32:row,f32:column,1,0,1,1,simt,f32,128,128,8,2,4,2,1,1,1,1,50,1024,65552,49152,0,0.010656,5.72917,4.61261
14,CUTLASS,gemm,cutlass_simt_sgemm_128x128_8x2_nn_align1,passed,success,universal,serial,8192,2,2,f32:column,f32:column,f32:column,1,0,1,1,simt,f32,128,128,8,2,4,2,1,1,1,1,50,1024,131088,98304,0,0.010688,11.4226,9.1976
14,CUTLASS,gemm,cutlass_simt_sgemm_128x128_8x2_nt_align1,passed,success,universal,serial,8192,2,2,f32:column,f32:row,f32:column,1,0,1,1,simt,f32,128,128,8,2,4,2,1,1,1,1,50,1024,131088,98304,0,0.010656,11.4569,9.22523
14,CUTLASS,gemm,cutlass_simt_sgemm_128x128_8x2_tn_align1,passed,success,universal,serial,8192,2,2,f32:row,f32:column,f32:column,1,0,1,1,simt,f32,128,128,8,2,4,2,1,1,1,1,50,1024,131088,98304,0,0.010688,11.4226,9.1976
14,CUTLASS,gemm,cutlass_simt_sgemm_128x128_8x2_tt_align1,passed,success,universal,serial,8192,2,2,f32:row,f32:row,f32:column,1,0,1,1,simt,f32,128,128,8,2,4,2,1,1,1,1,50,1024,131088,98304,0,0.010688,11.4226,9.1976
15,CUTLASS,gemm,cutlass_simt_sgemm_128x128_8x2_nn_align1,passed,success,universal,serial,16384,2,2,f32:column,f32:column,f32:column,1,0,1,1,simt,f32,128,128,8,2,4,2,1,1,1,1,50,1024,262160,196608,0,0.016288,14.9899,12.0707
15,CUTLASS,gemm,cutlass_simt_sgemm_128x128_8x2_nt_align1,passed,success,universal,serial,16384,2,2,f32:column,f32:row,f32:column,1,0,1,1,simt,f32,128,128,8,2,4,2,1,1,1,1,50,1024,262160,196608,0,0.016224,15.049,12.1183
15,CUTLASS,gemm,cutlass_simt_sgemm_128x128_8x2_tn_align1,passed,success,universal,serial,16384,2,2,f32:row,f32:column,f32:column,1,0,1,1,simt,f32,128,128,8,2,4,2,1,1,1,1,50,1024,262160,196608,0,0.016224,15.049,12.1183
15,CUTLASS,gemm,cutlass_simt_sgemm_128x128_8x2_tt_align1,passed,success,universal,serial,16384,2,2,f32:row,f32:row,f32:column,1,0,1,1,simt,f32,128,128,8,2,4,2,1,1,1,1,50,1024,262160,196608,0,0.016192,15.0788,12.1423
16,CUTLASS,gemm,cutlass_simt_sgemm_128x128_8x2_nn_align1,passed,success,universal,serial,2,4,2,f32:column,f32:column,f32:column,1,0,1,1,simt,f32,128,128,8,2,4,2,1,1,1,1,50,1024,80,48,0,0.01008,0.00739145,0.0047619
16,CUTLASS,gemm,cutlass_simt_sgemm_128x128_8x2_nt_align1,passed,success,universal,serial,2,4,2,f32:column,f32:row,f32:column,1,0,1,1,simt,f32,128,128,8,2,4,2,1,1,1,1,50,1024,80,48,0,0.010368,0.00718613,0.00462963
16,CUTLASS,gemm,cutlass_simt_sgemm_128x128_8x2_tn_align1,passed,success,universal,serial,2,4,2,f32:row,f32:column,f32:column,1,0,1,1,simt,f32,128,128,8,2,4,2,1,1,1,1,50,1024,80,48,0,0.01008,0.00739145,0.0047619
16,CUTLASS,gemm,cutlass_simt_sgemm_128x128_8x2_tt_align1,passed,success,universal,serial,2,4,2,f32:row,f32:row,f32:column,1,0,1,1,simt,f32,128,128,8,2,4,2,1,1,1,1,50,1024,80,48,0,0.010368,0.00718613,0.00462963
17,CUTLASS,gemm,cutlass_simt_sgemm_128x128_8x2_nn_align1,passed,success,universal,serial,4,4,2,f32:column,f32:column,f32:column,1,0,1,1,simt,f32,128,128,8,2,4,2,1,1,1,1,50,1024,128,96,0,0.010368,0.0114978,0.00925926
17,CUTLASS,gemm,cutlass_simt_sgemm_128x128_8x2_nt_align1,passed,success,universal,serial,4,4,2,f32:column,f32:row,f32:column,1,0,1,1,simt,f32,128,128,8,2,4,2,1,1,1,1,50,1024,128,96,0,0.010368,0.0114978,0.00925926
17,CUTLASS,gemm,cutlass_simt_sgemm_128x128_8x2_tn_align1,passed,success,universal,serial,4,4,2,f32:row,f32:column,f32:column,1,0,1,1,simt,f32,128,128,8,2,4,2,1,1,1,1,50,1024,128,96,0,0.010336,0.0115334,0.00928793
17,CUTLASS,gemm,cutlass_simt_sgemm_128x128_8x2_tt_align1,passed,success,universal,serial,4,4,2,f32:row,f32:row,f32:column,1,0,1,1,simt,f32,128,128,8,2,4,2,1,1,1,1,50,1024,128,96,0,0.010368,0.0114978,0.00925926
18,CUTLASS,gemm,cutlass_simt_sgemm_128x128_8x2_nn_align1,passed,success,universal,serial,8,4,2,f32:column,f32:column,f32:column,1,0,1,1,simt,f32,128,128,8,2,4,2,1,1,1,1,50,1024,224,192,0,0.010336,0.0201835,0.0185759
18,CUTLASS,gemm,cutlass_simt_sgemm_128x128_8x2_nt_align1,passed,success,universal,serial,8,4,2,f32:column,f32:row,f32:column,1,0,1,1,simt,f32,128,128,8,2,4,2,1,1,1,1,50,1024,224,192,0,0.010368,0.0201212,0.0185185
18,CUTLASS,gemm,cutlass_simt_sgemm_128x128_8x2_tn_align1,passed,success,universal,serial,8,4,2,f32:row,f32:column,f32:column,1,0,1,1,simt,f32,128,128,8,2,4,2,1,1,1,1,50,1024,224,192,0,0.010496,0.0198758,0.0182927
18,CUTLASS,gemm,cutlass_simt_sgemm_128x128_8x2_tt_align1,passed,success,universal,serial,8,4,2,f32:row,f32:row,f32:column,1,0,1,1,simt,f32,128,128,8,2,4,2,1,1,1,1,50,1024,224,192,0,0.010368,0.0201212,0.0185185
19,CUTLASS,gemm,cutlass_simt_sgemm_128x128_8x2_nn_align1,passed,success,universal,serial,56,4,2,f32:column,f32:column,f32:column,1,0,1,1,simt,f32,128,128,8,2,4,2,1,1,1,1,50,1024,1376,1344,0,0.010528,0.121723,0.12766
19,CUTLASS,gemm,cutlass_simt_sgemm_128x128_8x2_nt_align1,passed,success,universal,serial,56,4,2,f32:column,f32:row,f32:column,1,0,1,1,simt,f32,128,128,8,2,4,2,1,1,1,1,50,1024,1376,1344,0,0.010336,0.123984,0.130031
19,CUTLASS,gemm,cutlass_simt_sgemm_128x128_8x2_tn_align1,passed,success,universal,serial,56,4,2,f32:row,f32:column,f32:column,1,0,1,1,simt,f32,128,128,8,2,4,2,1,1,1,1,50,1024,1376,1344,0,0.010368,0.123601,0.12963
19,CUTLASS,gemm,cutlass_simt_sgemm_128x128_8x2_tt_align1,passed,success,universal,serial,56,4,2,f32:row,f32:row,f32:column,1,0,1,1,simt,f32,128,128,8,2,4,2,1,1,1,1,50,1024,1376,1344,0,0.010368,0.123601,0.12963
20,CUTLASS,gemm,cutlass_simt_sgemm_128x128_8x2_nn_align1,passed,success,universal,serial,120,4,2,f32:column,f32:column,f32:column,1,0,1,1,simt,f32,128,128,8,2,4,2,1,1,1,1,50,1024,2912,2880,0,0.010304,0.2632,0.279503
20,CUTLASS,gemm,cutlass_simt_sgemm_128x128_8x2_nt_align1,passed,success,universal,serial,120,4,2,f32:column,f32:row,f32:column,1,0,1,1,simt,f32,128,128,8,2,4,2,1,1,1,1,50,1024,2912,2880,0,0.010624,0.255272,0.271084
20,CUTLASS,gemm,cutlass_simt_sgemm_128x128_8x2_tn_align1,passed,success,universal,serial,120,4,2,f32:row,f32:column,f32:column,1,0,1,1,simt,f32,128,128,8,2,4,2,1,1,1,1,50,1024,2912,2880,0,0.010368,0.261575,0.277778
20,CUTLASS,gemm,cutlass_simt_sgemm_128x128_8x2_tt_align1,passed,success,universal,serial,120,4,2,f32:row,f32:row,f32:column,1,0,1,1,simt,f32,128,128,8,2,4,2,1,1,1,1,50,1024,2912,2880,0,0.010368,0.261575,0.277778
21,CUTLASS,gemm,cutlass_simt_sgemm_128x128_8x2_nn_align1,passed,success,universal,serial,136,4,2,f32:column,f32:column,f32:column,1,0,1,1,simt,f32,128,128,8,2,4,2,1,1,1,1,50,1024,3296,3264,0,0.010496,0.292458,0.310976
21,CUTLASS,gemm,cutlass_simt_sgemm_128x128_8x2_nt_align1,passed,success,universal,serial,136,4,2,f32:column,f32:row,f32:column,1,0,1,1,simt,f32,128,128,8,2,4,2,1,1,1,1,50,1024,3296,3264,0,0.010336,0.296985,0.315789
21,CUTLASS,gemm,cutlass_simt_sgemm_128x128_8x2_tn_align1,passed,success,universal,serial,136,4,2,f32:row,f32:column,f32:column,1,0,1,1,simt,f32,128,128,8,2,4,2,1,1,1,1,50,1024,3296,3264,0,0.010368,0.296069,0.314815
21,CUTLASS,gemm,cutlass_simt_sgemm_128x128_8x2_tt_align1,passed,success,universal,serial,136,4,2,f32:row,f32:row,f32:column,1,0,1,1,simt,f32,128,128,8,2,4,2,1,1,1,1,50,1024,3296,3264,0,0.010656,0.288067,0.306306
22,CUTLASS,gemm,cutlass_simt_sgemm_128x128_8x2_nn_align1,passed,success,universal,serial,256,4,2,f32:column,f32:column,f32:column,1,0,1,1,simt,f32,128,128,8,2,4,2,1,1,1,1,50,1024,6176,6144,0,0.010368,0.554769,0.592593
22,CUTLASS,gemm,cutlass_simt_sgemm_128x128_8x2_nt_align1,passed,success,universal,serial,256,4,2,f32:column,f32:row,f32:column,1,0,1,1,simt,f32,128,128,8,2,4,2,1,1,1,1,50,1024,6176,6144,0,0.010368,0.554769,0.592593
22,CUTLASS,gemm,cutlass_simt_sgemm_128x128_8x2_tn_align1,passed,success,universal,serial,256,4,2,f32:row,f32:column,f32:column,1,0,1,1,simt,f32,128,128,8,2,4,2,1,1,1,1,50,1024,6176,6144,0,0.010368,0.554769,0.592593
22,CUTLASS,gemm,cutlass_simt_sgemm_128x128_8x2_tt_align1,passed,success,universal,serial,256,4,2,f32:row,f32:row,f32:column,1,0,1,1,simt,f32,128,128,8,2,4,2,1,1,1,1,50,1024,6176,6144,0,0.010368,0.554769,0.592593
23,CUTLASS,gemm,cutlass_simt_sgemm_128x128_8x2_nn_align1,passed,success,universal,serial,264,4,2,f32:column,f32:column,f32:column,1,0,1,1,simt,f32,128,128,8,2,4,2,1,1,1,1,50,1024,6368,6336,0,0.010368,0.572016,0.611111
23,CUTLASS,gemm,cutlass_simt_sgemm_128x128_8x2_nt_align1,passed,success,universal,serial,264,4,2,f32:column,f32:row,f32:column,1,0,1,1,simt,f32,128,128,8,2,4,2,1,1,1,1,50,1024,6368,6336,0,0.010368,0.572016,0.611111
23,CUTLASS,gemm,cutlass_simt_sgemm_128x128_8x2_tn_align1,passed,success,universal,serial,264,4,2,f32:row,f32:column,f32:column,1,0,1,1,simt,f32,128,128,8,2,4,2,1,1,1,1,50,1024,6368,6336,0,0.010368,0.572016,0.611111
23,CUTLASS,gemm,cutlass_simt_sgemm_128x128_8x2_tt_align1,passed,success,universal,serial,264,4,2,f32:row,f32:row,f32:column,1,0,1,1,simt,f32,128,128,8,2,4,2,1,1,1,1,50,1024,6368,6336,0,0.010368,0.572016,0.611111
24,CUTLASS,gemm,cutlass_simt_sgemm_128x128_8x2_nn_align1,passed,success,universal,serial,512,4,2,f32:column,f32:column,f32:column,1,0,1,1,simt,f32,128,128,8,2,4,2,1,1,1,1,50,1024,12320,12288,0,0.010624,1.08,1.15663
24,CUTLASS,gemm,cutlass_simt_sgemm_128x128_8x2_nt_align1,passed,success,universal,serial,512,4,2,f32:column,f32:row,f32:column,1,0,1,1,simt,f32,128,128,8,2,4,2,1,1,1,1,50,1024,12320,12288,0,0.010336,1.11009,1.18885
24,CUTLASS,gemm,cutlass_simt_sgemm_128x128_8x2_tn_align1,passed,success,universal,serial,512,4,2,f32:row,f32:column,f32:column,1,0,1,1,simt,f32,128,128,8,2,4,2,1,1,1,1,50,1024,12320,12288,0,0.010592,1.08326,1.16012
24,CUTLASS,gemm,cutlass_simt_sgemm_128x128_8x2_tt_align1,passed,success,universal,serial,512,4,2,f32:row,f32:row,f32:column,1,0,1,1,simt,f32,128,128,8,2,4,2,1,1,1,1,50,1024,12320,12288,0,0.010624,1.08,1.15663
25,CUTLASS,gemm,cutlass_simt_sgemm_128x128_8x2_nn_align1,passed,success,universal,serial,520,4,2,f32:column,f32:column,f32:column,1,0,1,1,simt,f32,128,128,8,2,4,2,1,1,1,1,50,1024,12512,12480,0,0.010336,1.12739,1.20743
25,CUTLASS,gemm,cutlass_simt_sgemm_128x128_8x2_nt_align1,passed,success,universal,serial,520,4,2,f32:column,f32:row,f32:column,1,0,1,1,simt,f32,128,128,8,2,4,2,1,1,1,1,50,1024,12512,12480,0,0.010368,1.12391,1.2037
25,CUTLASS,gemm,cutlass_simt_sgemm_128x128_8x2_tn_align1,passed,success,universal,serial,520,4,2,f32:row,f32:column,f32:column,1,0,1,1,simt,f32,128,128,8,2,4,2,1,1,1,1,50,1024,12512,12480,0,0.010624,1.09683,1.1747
25,CUTLASS,gemm,cutlass_simt_sgemm_128x128_8x2_tt_align1,passed,success,universal,serial,520,4,2,f32:row,f32:row,f32:column,1,0,1,1,simt,f32,128,128,8,2,4,2,1,1,1,1,50,1024,12512,12480,0,0.010368,1.12391,1.2037
26,CUTLASS,gemm,cutlass_simt_sgemm_128x128_8x2_nn_align1,passed,success,universal,serial,1024,4,2,f32:column,f32:column,f32:column,1,0,1,1,simt,f32,128,128,8,2,4,2,1,1,1,1,50,1024,24608,24576,0,0.010368,2.21045,2.37037
26,CUTLASS,gemm,cutlass_simt_sgemm_128x128_8x2_nt_align1,passed,success,universal,serial,1024,4,2,f32:column,f32:row,f32:column,1,0,1,1,simt,f32,128,128,8,2,4,2,1,1,1,1,50,1024,24608,24576,0,0.010624,2.15719,2.31325
26,CUTLASS,gemm,cutlass_simt_sgemm_128x128_8x2_tn_align1,passed,success,universal,serial,1024,4,2,f32:row,f32:column,f32:column,1,0,1,1,simt,f32,128,128,8,2,4,2,1,1,1,1,50,1024,24608,24576,0,0.010368,2.21045,2.37037
26,CUTLASS,gemm,cutlass_simt_sgemm_128x128_8x2_tt_align1,passed,success,universal,serial,1024,4,2,f32:row,f32:row,f32:column,1,0,1,1,simt,f32,128,128,8,2,4,2,1,1,1,1,50,1024,24608,24576,0,0.010656,2.15071,2.30631
27,CUTLASS,gemm,cutlass_simt_sgemm_128x128_8x2_nn_align1,passed,success,universal,serial,1032,4,2,f32:column,f32:column,f32:column,1,0,1,1,simt,f32,128,128,8,2,4,2,1,1,1,1,50,1024,24800,24768,0,0.010368,2.2277,2.38889
27,CUTLASS,gemm,cutlass_simt_sgemm_128x128_8x2_nt_align1,passed,success,universal,serial,1032,4,2,f32:column,f32:row,f32:column,1,0,1,1,simt,f32,128,128,8,2,4,2,1,1,1,1,50,1024,24800,24768,0,0.010624,2.17402,2.33133
27,CUTLASS,gemm,cutlass_simt_sgemm_128x128_8x2_tn_align1,passed,success,universal,serial,1032,4,2,f32:row,f32:column,f32:column,1,0,1,1,simt,f32,128,128,8,2,4,2,1,1,1,1,50,1024,24800,24768,0,0.0104,2.22085,2.38154
27,CUTLASS,gemm,cutlass_simt_sgemm_128x128_8x2_tt_align1,passed,success,universal,serial,1032,4,2,f32:row,f32:row,f32:column,1,0,1,1,simt,f32,128,128,8,2,4,2,1,1,1,1,50,1024,24800,24768,0,0.010624,2.17402,2.33133
28,CUTLASS,gemm,cutlass_simt_sgemm_128x128_8x2_nn_align1,passed,success,universal,serial,4096,4,2,f32:column,f32:column,f32:column,1,0,1,1,simt,f32,128,128,8,2,4,2,1,1,1,1,50,1024,98336,98304,0,0.010816,8.46732,9.08876
28,CUTLASS,gemm,cutlass_simt_sgemm_128x128_8x2_nt_align1,passed,success,universal,serial,4096,4,2,f32:column,f32:row,f32:column,1,0,1,1,simt,f32,128,128,8,2,4,2,1,1,1,1,50,1024,98336,98304,0,0.0104,8.80601,9.45231
28,CUTLASS,gemm,cutlass_simt_sgemm_128x128_8x2_tn_align1,passed,success,universal,serial,4096,4,2,f32:row,f32:column,f32:column,1,0,1,1,simt,f32,128,128,8,2,4,2,1,1,1,1,50,1024,98336,98304,0,0.0104,8.80601,9.45231
28,CUTLASS,gemm,cutlass_simt_sgemm_128x128_8x2_tt_align1,passed,success,universal,serial,4096,4,2,f32:row,f32:row,f32:column,1,0,1,1,simt,f32,128,128,8,2,4,2,1,1,1,1,50,1024,98336,98304,0,0.010656,8.59446,9.22523
29,CUTLASS,gemm,cutlass_simt_sgemm_128x128_8x2_nn_align1,passed,success,universal,serial,8192,4,2,f32:column,f32:column,f32:column,1,0,1,1,simt,f32,128,128,8,2,4,2,1,1,1,1,50,1024,196640,196608,0,0.010784,16.9821,18.2315
29,CUTLASS,gemm,cutlass_simt_sgemm_128x128_8x2_nt_align1,passed,success,universal,serial,8192,4,2,f32:column,f32:row,f32:column,1,0,1,1,simt,f32,128,128,8,2,4,2,1,1,1,1,50,1024,196640,196608,0,0.010688,17.1347,18.3952
29,CUTLASS,gemm,cutlass_simt_sgemm_128x128_8x2_tn_align1,passed,success,universal,serial,8192,4,2,f32:row,f32:column,f32:column,1,0,1,1,simt,f32,128,128,8,2,4,2,1,1,1,1,50,1024,196640,196608,0,0.01072,17.0835,18.3403
29,CUTLASS,gemm,cutlass_simt_sgemm_128x128_8x2_tt_align1,passed,success,universal,serial,8192,4,2,f32:row,f32:row,f32:column,1,0,1,1,simt,f32,128,128,8,2,4,2,1,1,1,1,50,1024,196640,196608,0,0.010688,17.1347,18.3952
30,CUTLASS,gemm,cutlass_simt_sgemm_128x128_8x2_nn_align1,passed,success,universal,serial,16384,4,2,f32:column,f32:column,f32:column,1,0,1,1,simt,f32,128,128,8,2,4,2,1,1,1,1,50,1024,393248,393216,0,0.01632,22.4412,24.0941
30,CUTLASS,gemm,cutlass_simt_sgemm_128x128_8x2_nt_align1,passed,success,universal,serial,16384,4,2,f32:column,f32:row,f32:column,1,0,1,1,simt,f32,128,128,8,2,4,2,1,1,1,1,50,1024,393248,393216,0,0.016096,22.7535,24.4294
30,CUTLASS,gemm,cutlass_simt_sgemm_128x128_8x2_tn_align1,passed,success,universal,serial,16384,4,2,f32:row,f32:column,f32:column,1,0,1,1,simt,f32,128,128,8,2,4,2,1,1,1,1,50,1024,393248,393216,0,0.01584,23.1213,24.8242
30,CUTLASS,gemm,cutlass_simt_sgemm_128x128_8x2_tt_align1,passed,success,universal,serial,16384,4,2,f32:row,f32:row,f32:column,1,0,1,1,simt,f32,128,128,8,2,4,2,1,1,1,1,50,1024,393248,393216,0,0.016224,22.574,24.2367
31,CUTLASS,gemm,cutlass_simt_sgemm_128x128_8x2_nn_align1,passed,success,universal,serial,2,8,2,f32:column,f32:column,f32:column,1,0,1,1,simt,f32,128,128,8,2,4,2,1,1,1,1,50,1024,144,96,0,0.010112,0.0132625,0.00949367
31,CUTLASS,gemm,cutlass_simt_sgemm_128x128_8x2_nt_align1,passed,success,universal,serial,2,8,2,f32:column,f32:row,f32:column,1,0,1,1,simt,f32,128,128,8,2,4,2,1,1,1,1,50,1024,144,96,0,0.010336,0.0129751,0.00928793
31,CUTLASS,gemm,cutlass_simt_sgemm_128x128_8x2_tn_align1,passed,success,universal,serial,2,8,2,f32:row,f32:column,f32:column,1,0,1,1,simt,f32,128,128,8,2,4,2,1,1,1,1,50,1024,144,96,0,0.010112,0.0132625,0.00949367
31,CUTLASS,gemm,cutlass_simt_sgemm_128x128_8x2_tt_align1,passed,success,universal,serial,2,8,2,f32:row,f32:row,f32:column,1,0,1,1,simt,f32,128,128,8,2,4,2,1,1,1,1,50,1024,144,96,0,0.010624,0.0126233,0.00903614
32,CUTLASS,gemm,cutlass_simt_sgemm_128x128_8x2_nn_align1,passed,success,universal,serial,4,8,2,f32:column,f32:column,f32:column,1,0,1,1,simt,f32,128,128,8,2,4,2,1,1,1,1,50,1024,224,192,0,0.010368,0.0201212,0.0185185
32,CUTLASS,gemm,cutlass_simt_sgemm_128x128_8x2_nt_align1,passed,success,universal,serial,4,8,2,f32:column,f32:row,f32:column,1,0,1,1,simt,f32,128,128,8,2,4,2,1,1,1,1,50,1024,224,192,0,0.010368,0.0201212,0.0185185
32,CUTLASS,gemm,cutlass_simt_sgemm_128x128_8x2_tn_align1,passed,success,universal,serial,4,8,2,f32:row,f32:column,f32:column,1,0,1,1,simt,f32,128,128,8,2,4,2,1,1,1,1,50,1024,224,192,0,0.010336,0.0201835,0.0185759
32,CUTLASS,gemm,cutlass_simt_sgemm_128x128_8x2_tt_align1,passed,success,universal,serial,4,8,2,f32:row,f32:row,f32:column,1,0,1,1,simt,f32,128,128,8,2,4,2,1,1,1,1,50,1024,224,192,0,0.010336,0.0201835,0.0185759
33,CUTLASS,gemm,cutlass_simt_sgemm_128x128_8x2_nn_align1,passed,success,universal,serial,8,8,2,f32:column,f32:column,f32:column,1,0,1,1,simt,f32,128,128,8,2,4,2,1,1,1,1,50,1024,384,384,1,0.010208,0.0350341,0.0376176
33,CUTLASS,gemm,cutlass_simt_sgemm_128x128_8x2_nt_align1,passed,success,universal,serial,8,8,2,f32:column,f32:row,f32:column,1,0,1,1,simt,f32,128,128,8,2,4,2,1,1,1,1,50,1024,384,384,1,0.010208,0.0350341,0.0376176
33,CUTLASS,gemm,cutlass_simt_sgemm_128x128_8x2_tn_align1,passed,success,universal,serial,8,8,2,f32:row,f32:column,f32:column,1,0,1,1,simt,f32,128,128,8,2,4,2,1,1,1,1,50,1024,384,384,1,0.010336,0.0346002,0.0371517
33,CUTLASS,gemm,cutlass_simt_sgemm_128x128_8x2_tt_align1,passed,success,universal,serial,8,8,2,f32:row,f32:row,f32:column,1,0,1,1,simt,f32,128,128,8,2,4,2,1,1,1,1,50,1024,384,384,1,0.010496,0.0340728,0.0365854
34,CUTLASS,gemm,cutlass_simt_sgemm_128x128_8x2_nn_align1,passed,success,universal,serial,56,8,2,f32:column,f32:column,f32:column,1,0,1,1,simt,f32,128,128,8,2,4,2,1,1,1,1,50,1024,2304,2688,1,0.010336,0.207601,0.260062
34,CUTLASS,gemm,cutlass_simt_sgemm_128x128_8x2_nt_align1,passed,success,universal,serial,56,8,2,f32:column,f32:row,f32:column,1,0,1,1,simt,f32,128,128,8,2,4,2,1,1,1,1,50,1024,2304,2688,1,0.010368,0.206961,0.259259
34,CUTLASS,gemm,cutlass_simt_sgemm_128x128_8x2_tn_align1,passed,success,universal,serial,56,8,2,f32:row,f32:column,f32:column,1,0,1,1,simt,f32,128,128,8,2,4,2,1,1,1,1,50,1024,2304,2688,1,0.010368,0.206961,0.259259
34,CUTLASS,gemm,cutlass_simt_sgemm_128x128_8x2_tt_align1,passed,success,universal,serial,56,8,2,f32:row,f32:row,f32:column,1,0,1,1,simt,f32,128,128,8,2,4,2,1,1,1,1,50,1024,2304,2688,1,0.010368,0.206961,0.259259
35,CUTLASS,gemm,cutlass_simt_sgemm_128x128_8x2_nn_align1,passed,success,universal,serial,120,8,2,f32:column,f32:column,f32:column,1,0,1,1,simt,f32,128,128,8,2,4,2,1,1,1,1,50,1024,4864,5760,1,0.01056,0.428973,0.545455
35,CUTLASS,gemm,cutlass_simt_sgemm_128x128_8x2_nt_align1,passed,success,universal,serial,120,8,2,f32:column,f32:row,f32:column,1,0,1,1,simt,f32,128,128,8,2,4,2,1,1,1,1,50,1024,4864,5760,1,0.010496,0.431589,0.54878
35,CUTLASS,gemm,cutlass_simt_sgemm_128x128_8x2_tn_align1,passed,success,universal,serial,120,8,2,f32:row,f32:column,f32:column,1,0,1,1,simt,f32,128,128,8,2,4,2,1,1,1,1,50,1024,4864,5760,1,0.010368,0.436917,0.555556
35,CUTLASS,gemm,cutlass_simt_sgemm_128x128_8x2_tt_align1,passed,success,universal,serial,120,8,2,f32:row,f32:row,f32:column,1,0,1,1,simt,f32,128,128,8,2,4,2,1,1,1,1,50,1024,4864,5760,1,0.010496,0.431589,0.54878
36,CUTLASS,gemm,cutlass_simt_sgemm_128x128_8x2_nn_align1,passed,success,universal,serial,136,8,2,f32:column,f32:column,f32:column,1,0,1,1,simt,f32,128,128,8,2,4,2,1,1,1,1,50,1024,5504,6528,1,0.010656,0.481043,0.612613
36,CUTLASS,gemm,cutlass_simt_sgemm_128x128_8x2_nt_align1,passed,success,universal,serial,136,8,2,f32:column,f32:row,f32:column,1,0,1,1,simt,f32,128,128,8,2,4,2,1,1,1,1,50,1024,5504,6528,1,0.010368,0.494406,0.62963
36,CUTLASS,gemm,cutlass_simt_sgemm_128x128_8x2_tn_align1,passed,success,universal,serial,136,8,2,f32:row,f32:column,f32:column,1,0,1,1,simt,f32,128,128,8,2,4,2,1,1,1,1,50,1024,5504,6528,1,0.010368,0.494406,0.62963
36,CUTLASS,gemm,cutlass_simt_sgemm_128x128_8x2_tt_align1,passed,success,universal,serial,136,8,2,f32:row,f32:row,f32:column,1,0,1,1,simt,f32,128,128,8,2,4,2,1,1,1,1,50,1024,5504,6528,1,0.010368,0.494406,0.62963
37,CUTLASS,gemm,cutlass_simt_sgemm_128x128_8x2_nn_align1,passed,success,universal,serial,256,8,2,f32:column,f32:column,f32:column,1,0,1,1,simt,f32,128,128,8,2,4,2,1,1,1,1,50,1024,10304,12288,1,0.010368,0.925574,1.18519
37,CUTLASS,gemm,cutlass_simt_sgemm_128x128_8x2_nt_align1,passed,success,universal,serial,256,8,2,f32:column,f32:row,f32:column,1,0,1,1,simt,f32,128,128,8,2,4,2,1,1,1,1,50,1024,10304,12288,1,0.010592,0.906,1.16012
37,CUTLASS,gemm,cutlass_simt_sgemm_128x128_8x2_tn_align1,passed,success,universal,serial,256,8,2,f32:row,f32:column,f32:column,1,0,1,1,simt,f32,128,128,8,2,4,2,1,1,1,1,50,1024,10304,12288,1,0.010368,0.925574,1.18519
37,CUTLASS,gemm,cutlass_simt_sgemm_128x128_8x2_tt_align1,passed,success,universal,serial,256,8,2,f32:row,f32:row,f32:column,1,0,1,1,simt,f32,128,128,8,2,4,2,1,1,1,1,50,1024,10304,12288,1,0.010368,0.925574,1.18519
38,CUTLASS,gemm,cutlass_simt_sgemm_128x128_8x2_nn_align1,passed,success,universal,serial,264,8,2,f32:column,f32:column,f32:column,1,0,1,1,simt,f32,128,128,8,2,4,2,1,1,1,1,50,1024,10624,12672,1,0.010368,0.954318,1.22222
38,CUTLASS,gemm,cutlass_simt_sgemm_128x128_8x2_nt_align1,passed,success,universal,serial,264,8,2,f32:column,f32:row,f32:column,1,0,1,1,simt,f32,128,128,8,2,4,2,1,1,1,1,50,1024,10624,12672,1,0.010368,0.954318,1.22222
38,CUTLASS,gemm,cutlass_simt_sgemm_128x128_8x2_tn_align1,passed,success,universal,serial,264,8,2,f32:row,f32:column,f32:column,1,0,1,1,simt,f32,128,128,8,2,4,2,1,1,1,1,50,1024,10624,12672,1,0.010368,0.954318,1.22222
38,CUTLASS,gemm,cutlass_simt_sgemm_128x128_8x2_tt_align1,passed,success,universal,serial,264,8,2,f32:row,f32:row,f32:column,1,0,1,1,simt,f32,128,128,8,2,4,2,1,1,1,1,50,1024,10624,12672,1,0.010336,0.957273,1.22601
39,CUTLASS,gemm,cutlass_simt_sgemm_128x128_8x2_nn_align1,passed,success,universal,serial,512,8,2,f32:column,f32:column,f32:column,1,0,1,1,simt,f32,128,128,8,2,4,2,1,1,1,1,50,1024,20544,24576,1,0.01056,1.81185,2.32727
39,CUTLASS,gemm,cutlass_simt_sgemm_128x128_8x2_nt_align1,passed,success,universal,serial,512,8,2,f32:column,f32:row,f32:column,1,0,1,1,simt,f32,128,128,8,2,4,2,1,1,1,1,50,1024,20544,24576,1,0.010368,1.8454,2.37037
39,CUTLASS,gemm,cutlass_simt_sgemm_128x128_8x2_tn_align1,passed,success,universal,serial,512,8,2,f32:row,f32:column,f32:column,1,0,1,1,simt,f32,128,128,8,2,4,2,1,1,1,1,50,1024,20544,24576,1,0.010976,1.74318,2.23907
39,CUTLASS,gemm,cutlass_simt_sgemm_128x128_8x2_tt_align1,passed,success,universal,serial,512,8,2,f32:row,f32:row,f32:column,1,0,1,1,simt,f32,128,128,8,2,4,2,1,1,1,1,50,1024,20544,24576,1,0.0104,1.83972,2.36308
40,CUTLASS,gemm,cutlass_simt_sgemm_128x128_8x2_nn_align1,passed,success,universal,serial,520,8,2,f32:column,f32:column,f32:column,1,0,1,1,simt,f32,128,128,8,2,4,2,1,1,1,1,50,1024,20864,24960,1,0.010368,1.87414,2.40741
40,CUTLASS,gemm,cutlass_simt_sgemm_128x128_8x2_nt_align1,passed,success,universal,serial,520,8,2,f32:column,f32:row,f32:column,1,0,1,1,simt,f32,128,128,8,2,4,2,1,1,1,1,50,1024,20864,24960,1,0.010336,1.87995,2.41486
40,CUTLASS,gemm,cutlass_simt_sgemm_128x128_8x2_tn_align1,passed,success,universal,serial,520,8,2,f32:row,f32:column,f32:column,1,0,1,1,simt,f32,128,128,8,2,4,2,1,1,1,1,50,1024,20864,24960,1,0.0104,1.86838,2.4
40,CUTLASS,gemm,cutlass_simt_sgemm_128x128_8x2_tt_align1,passed,success,universal,serial,520,8,2,f32:row,f32:row,f32:column,1,0,1,1,simt,f32,128,128,8,2,4,2,1,1,1,1,50,1024,20864,24960,1,0.010624,1.82898,2.3494
41,CUTLASS,gemm,cutlass_simt_sgemm_128x128_8x2_nn_align1,passed,success,universal,serial,1024,8,2,f32:column,f32:column,f32:column,1,0,1,1,simt,f32,128,128,8,2,4,2,1,1,1,1,50,1024,41024,49152,1,0.010432,3.66244,4.71166
41,CUTLASS,gemm,cutlass_simt_sgemm_128x128_8x2_nt_align1,passed,success,universal,serial,1024,8,2,f32:column,f32:row,f32:column,1,0,1,1,simt,f32,128,128,8,2,4,2,1,1,1,1,50,1024,41024,49152,1,0.010368,3.68505,4.74074
41,CUTLASS,gemm,cutlass_simt_sgemm_128x128_8x2_tn_align1,passed,success,universal,serial,1024,8,2,f32:row,f32:column,f32:column,1,0,1,1,simt,f32,128,128,8,2,4,2,1,1,1,1,50,1024,41024,49152,1,0.010368,3.68505,4.74074
41,CUTLASS,gemm,cutlass_simt_sgemm_128x128_8x2_tt_align1,passed,success,universal,serial,1024,8,2,f32:row,f32:row,f32:column,1,0,1,1,simt,f32,128,128,8,2,4,2,1,1,1,1,50,1024,41024,49152,1,0.010624,3.59625,4.62651
42,CUTLASS,gemm,cutlass_simt_sgemm_128x128_8x2_nn_align1,passed,success,universal,serial,1032,8,2,f32:column,f32:column,f32:column,1,0,1,1,simt,f32,128,128,8,2,4,2,1,1,1,1,50,1024,41344,49536,1,0.010624,3.6243,4.66265
42,CUTLASS,gemm,cutlass_simt_sgemm_128x128_8x2_nt_align1,passed,success,universal,serial,1032,8,2,f32:column,f32:row,f32:column,1,0,1,1,simt,f32,128,128,8,2,4,2,1,1,1,1,50,1024,41344,49536,1,0.010336,3.72529,4.79257
42,CUTLASS,gemm,cutlass_simt_sgemm_128x128_8x2_tn_align1,passed,success,universal,serial,1032,8,2,f32:row,f32:column,f32:column,1,0,1,1,simt,f32,128,128,8,2,4,2,1,1,1,1,50,1024,41344,49536,1,0.010656,3.61342,4.64865
42,CUTLASS,gemm,cutlass_simt_sgemm_128x128_8x2_tt_align1,passed,success,universal,serial,1032,8,2,f32:row,f32:row,f32:column,1,0,1,1,simt,f32,128,128,8,2,4,2,1,1,1,1,50,1024,41344,49536,1,0.010624,3.6243,4.66265
43,CUTLASS,gemm,cutlass_simt_sgemm_128x128_8x2_nn_align1,passed,success,universal,serial,4096,8,2,f32:column,f32:column,f32:column,1,0,1,1,simt,f32,128,128,8,2,4,2,1,1,1,1,50,1024,163904,196608,1,0.010496,14.5434,18.7317
43,CUTLASS,gemm,cutlass_simt_sgemm_128x128_8x2_nt_align1,passed,success,universal,serial,4096,8,2,f32:column,f32:row,f32:column,1,0,1,1,simt,f32,128,128,8,2,4,2,1,1,1,1,50,1024,163904,196608,1,0.010656,14.325,18.4505
43,CUTLASS,gemm,cutlass_simt_sgemm_128x128_8x2_tn_align1,passed,success,universal,serial,4096,8,2,f32:row,f32:column,f32:column,1,0,1,1,simt,f32,128,128,8,2,4,2,1,1,1,1,50,1024,163904,196608,1,0.010688,14.2821,18.3952
43,CUTLASS,gemm,cutlass_simt_sgemm_128x128_8x2_tt_align1,passed,success,universal,serial,4096,8,2,f32:row,f32:row,f32:column,1,0,1,1,simt,f32,128,128,8,2,4,2,1,1,1,1,50,1024,163904,196608,1,0.010656,14.325,18.4505
44,CUTLASS,gemm,cutlass_simt_sgemm_128x128_8x2_nn_align1,passed,success,universal,serial,8192,8,2,f32:column,f32:column,f32:column,1,0,1,1,simt,f32,128,128,8,2,4,2,1,1,1,1,50,1024,327744,393216,1,0.010816,28.2207,36.355
44,CUTLASS,gemm,cutlass_simt_sgemm_128x128_8x2_nt_align1,passed,success,universal,serial,8192,8,2,f32:column,f32:row,f32:column,1,0,1,1,simt,f32,128,128,8,2,4,2,1,1,1,1,50,1024,327744,393216,1,0.01072,28.4735,36.6806
44,CUTLASS,gemm,cutlass_simt_sgemm_128x128_8x2_tn_align1,passed,success,universal,serial,8192,8,2,f32:row,f32:column,f32:column,1,0,1,1,simt,f32,128,128,8,2,4,2,1,1,1,1,50,1024,327744,393216,1,0.010688,28.5587,36.7904
44,CUTLASS,gemm,cutlass_simt_sgemm_128x128_8x2_tt_align1,passed,success,universal,serial,8192,8,2,f32:row,f32:row,f32:column,1,0,1,1,simt,f32,128,128,8,2,4,2,1,1,1,1,50,1024,327744,393216,1,0.01072,28.4735,36.6806
45,CUTLASS,gemm,cutlass_simt_sgemm_128x128_8x2_nn_align1,passed,success,universal,serial,16384,8,2,f32:column,f32:column,f32:column,1,0,1,1,simt,f32,128,128,8,2,4,2,1,1,1,1,50,1024,655424,786432,1,0.016352,37.3295,48.0939
45,CUTLASS,gemm,cutlass_simt_sgemm_128x128_8x2_nt_align1,passed,success,universal,serial,16384,8,2,f32:column,f32:row,f32:column,1,0,1,1,simt,f32,128,128,8,2,4,2,1,1,1,1,50,1024,655424,786432,1,0.016256,37.5499,48.378
45,CUTLASS,gemm,cutlass_simt_sgemm_128x128_8x2_tn_align1,passed,success,universal,serial,16384,8,2,f32:row,f32:column,f32:column,1,0,1,1,simt,f32,128,128,8,2,4,2,1,1,1,1,50,1024,655424,786432,1,0.016064,37.9987,48.9562
45,CUTLASS,gemm,cutlass_simt_sgemm_128x128_8x2_tt_align1,passed,success,universal,serial,16384,8,2,f32:row,f32:row,f32:column,1,0,1,1,simt,f32,128,128,8,2,4,2,1,1,1,1,50,1024,655424,786432,1,0.016256,37.5499,48.378
46,CUTLASS,gemm,cutlass_simt_sgemm_128x128_8x2_nn_align1,passed,success,universal,serial,2,56,2,f32:column,f32:column,f32:column,1,0,1,1,simt,f32,128,128,8,2,4,2,1,1,1,1,50,1024,912,672,0,0.010368,0.0819219,0.0648148
46,CUTLASS,gemm,cutlass_simt_sgemm_128x128_8x2_nt_align1,passed,success,universal,serial,2,56,2,f32:column,f32:row,f32:column,1,0,1,1,simt,f32,128,128,8,2,4,2,1,1,1,1,50,1024,912,672,0,0.010336,0.0821755,0.0650155
46,CUTLASS,gemm,cutlass_simt_sgemm_128x128_8x2_tn_align1,passed,success,universal,serial,2,56,2,f32:row,f32:column,f32:column,1,0,1,1,simt,f32,128,128,8,2,4,2,1,1,1,1,50,1024,912,672,0,0.010368,0.0819219,0.0648148
46,CUTLASS,gemm,cutlass_simt_sgemm_128x128_8x2_tt_align1,passed,success,universal,serial,2,56,2,f32:row,f32:row,f32:column,1,0,1,1,simt,f32,128,128,8,2,4,2,1,1,1,1,50,1024,912,672,0,0.010368,0.0819219,0.0648148
47,CUTLASS,gemm,cutlass_simt_sgemm_128x128_8x2_nn_align1,passed,success,universal,serial,4,56,2,f32:column,f32:column,f32:column,1,0,1,1,simt,f32,128,128,8,2,4,2,1,1,1,1,50,1024,1376,1344,0,0.0104,0.123221,0.129231
47,CUTLASS,gemm,cutlass_simt_sgemm_128x128_8x2_nt_align1,passed,success,universal,serial,4,56,2,f32:column,f32:row,f32:column,1,0,1,1,simt,f32,128,128,8,2,4,2,1,1,1,1,50,1024,1376,1344,0,0.010336,0.123984,0.130031
47,CUTLASS,gemm,cutlass_simt_sgemm_128x128_8x2_tn_align1,passed,success,universal,serial,4,56,2,f32:row,f32:column,f32:column,1,0,1,1,simt,f32,128,128,8,2,4,2,1,1,1,1,50,1024,1376,1344,0,0.010368,0.123601,0.12963
47,CUTLASS,gemm,cutlass_simt_sgemm_128x128_8x2_tt_align1,passed,success,universal,serial,4,56,2,f32:row,f32:row,f32:column,1,0,1,1,simt,f32,128,128,8,2,4,2,1,1,1,1,50,1024,1376,1344,0,0.010368,0.123601,0.12963
48,CUTLASS,gemm,cutlass_simt_sgemm_128x128_8x2_nn_align1,passed,success,universal,serial,8,56,2,f32:column,f32:column,f32:column,1,0,1,1,simt,f32,128,128,8,2,4,2,1,1,1,1,50,1024,2304,2688,1,0.010368,0.206961,0.259259
48,CUTLASS,gemm,cutlass_simt_sgemm_128x128_8x2_nt_align1,passed,success,universal,serial,8,56,2,f32:column,f32:row,f32:column,1,0,1,1,simt,f32,128,128,8,2,4,2,1,1,1,1,50,1024,2304,2688,1,0.010368,0.206961,0.259259
48,CUTLASS,gemm,cutlass_simt_sgemm_128x128_8x2_tn_align1,passed,success,universal,serial,8,56,2,f32:row,f32:column,f32:column,1,0,1,1,simt,f32,128,128,8,2,4,2,1,1,1,1,50,1024,2304,2688,1,0.010336,0.207601,0.260062
48,CUTLASS,gemm,cutlass_simt_sgemm_128x128_8x2_tt_align1,passed,success,universal,serial,8,56,2,f32:row,f32:row,f32:column,1,0,1,1,simt,f32,128,128,8,2,4,2,1,1,1,1,50,1024,2304,2688,1,0.010528,0.203815,0.255319
49,CUTLASS,gemm,cutlass_simt_sgemm_128x128_8x2_nn_align1,passed,success,universal,serial,56,56,2,f32:column,f32:column,f32:column,1,0,1,1,simt,f32,128,128,8,2,4,2,1,1,1,1,50,1024,13440,18816,1,0.010368,1.20727,1.81481
49,CUTLASS,gemm,cutlass_simt_sgemm_128x128_8x2_nt_align1,passed,success,universal,serial,56,56,2,f32:column,f32:row,f32:column,1,0,1,1,simt,f32,128,128,8,2,4,2,1,1,1,1,50,1024,13440,18816,1,0.010368,1.20727,1.81481
49,CUTLASS,gemm,cutlass_simt_sgemm_128x128_8x2_tn_align1,passed,success,universal,serial,56,56,2,f32:row,f32:column,f32:column,1,0,1,1,simt,f32,128,128,8,2,4,2,1,1,1,1,50,1024,13440,18816,1,0.0104,1.20356,1.80923
49,CUTLASS,gemm,cutlass_simt_sgemm_128x128_8x2_tt_align1,passed,success,universal,serial,56,56,2,f32:row,f32:row,f32:column,1,0,1,1,simt,f32,128,128,8,2,4,2,1,1,1,1,50,1024,13440,18816,1,0.010368,1.20727,1.81481
50,CUTLASS,gemm,cutlass_simt_sgemm_128x128_8x2_nn_align1,passed,success,universal,serial,120,56,2,f32:column,f32:column,f32:column,1,0,1,1,simt,f32,128,128,8,2,4,2,1,1,1,1,50,1024,28288,40320,1,0.010336,2.54888,3.90093
50,CUTLASS,gemm,cutlass_simt_sgemm_128x128_8x2_nt_align1,passed,success,universal,serial,120,56,2,f32:column,f32:row,f32:column,1,0,1,1,simt,f32,128,128,8,2,4,2,1,1,1,1,50,1024,28288,40320,1,0.010368,2.54102,3.88889
50,CUTLASS,gemm,cutlass_simt_sgemm_128x128_8x2_tn_align1,passed,success,universal,serial,120,56,2,f32:row,f32:column,f32:column,1,0,1,1,simt,f32,128,128,8,2,4,2,1,1,1,1,50,1024,28288,40320,1,0.010944,2.40728,3.68421
50,CUTLASS,gemm,cutlass_simt_sgemm_128x128_8x2_tt_align1,passed,success,universal,serial,120,56,2,f32:row,f32:row,f32:column,1,0,1,1,simt,f32,128,128,8,2,4,2,1,1,1,1,50,1024,28288,40320,1,0.010336,2.54888,3.90093
51,CUTLASS,gemm,cutlass_simt_sgemm_128x128_8x2_nn_align1,passed,success,universal,serial,136,56,2,f32:column,f32:column,f32:column,1,0,1,1,simt,f32,128,128,8,2,4,2,1,1,1,1,50,1024,32000,45696,1,0.010368,2.87445,4.40741
51,CUTLASS,gemm,cutlass_simt_sgemm_128x128_8x2_nt_align1,passed,success,universal,serial,136,56,2,f32:column,f32:row,f32:column,1,0,1,1,simt,f32,128,128,8,2,4,2,1,1,1,1,50,1024,32000,45696,1,0.010656,2.79676,4.28829
51,CUTLASS,gemm,cutlass_simt_sgemm_128x128_8x2_tn_align1,passed,success,universal,serial,136,56,2,f32:row,f32:column,f32:column,1,0,1,1,simt,f32,128,128,8,2,4,2,1,1,1,1,50,1024,32000,45696,1,0.010368,2.87445,4.40741
51,CUTLASS,gemm,cutlass_simt_sgemm_128x128_8x2_tt_align1,passed,success,universal,serial,136,56,2,f32:row,f32:row,f32:column,1,0,1,1,simt,f32,128,128,8,2,4,2,1,1,1,1,50,1024,32000,45696,1,0.010656,2.79676,4.28829
52,CUTLASS,gemm,cutlass_simt_sgemm_128x128_8x2_nn_align1,passed,success,universal,serial,256,56,2,f32:column,f32:column,f32:column,1,0,1,1,simt,f32,128,128,8,2,4,2,1,1,1,1,50,1024,59840,86016,1,0.010464,5.32591,8.22018
52,CUTLASS,gemm,cutlass_simt_sgemm_128x128_8x2_nt_align1,passed,success,universal,serial,256,56,2,f32:column,f32:row,f32:column,1,0,1,1,simt,f32,128,128,8,2,4,2,1,1,1,1,50,1024,59840,86016,1,0.010592,5.26155,8.12085
52,CUTLASS,gemm,cutlass_simt_sgemm_128x128_8x2_tn_align1,passed,success,universal,serial,256,56,2,f32:row,f32:column,f32:column,1,0,1,1,simt,f32,128,128,8,2,4,2,1,1,1,1,50,1024,59840,86016,1,0.010624,5.2457,8.09639
52,CUTLASS,gemm,cutlass_simt_sgemm_128x128_8x2_tt_align1,passed,success,universal,serial,256,56,2,f32:row,f32:row,f32:column,1,0,1,1,simt,f32,128,128,8,2,4,2,1,1,1,1,50,1024,59840,86016,1,0.010624,5.2457,8.09639
53,CUTLASS,gemm,cutlass_simt_sgemm_128x128_8x2_nn_align1,passed,success,universal,serial,264,56,2,f32:column,f32:column,f32:column,1,0,1,1,simt,f32,128,128,8,2,4,2,1,1,1,1,50,1024,61696,88704,1,0.010368,5.54194,8.55556
53,CUTLASS,gemm,cutlass_simt_sgemm_128x128_8x2_nt_align1,passed,success,universal,serial,264,56,2,f32:column,f32:row,f32:column,1,0,1,1,simt,f32,128,128,8,2,4,2,1,1,1,1,50,1024,61696,88704,1,0.010336,5.5591,8.58204
53,CUTLASS,gemm,cutlass_simt_sgemm_128x128_8x2_tn_align1,passed,success,universal,serial,264,56,2,f32:row,f32:column,f32:column,1,0,1,1,simt,f32,128,128,8,2,4,2,1,1,1,1,50,1024,61696,88704,1,0.010624,5.4084,8.3494
53,CUTLASS,gemm,cutlass_simt_sgemm_128x128_8x2_tt_align1,passed,success,universal,serial,264,56,2,f32:row,f32:row,f32:column,1,0,1,1,simt,f32,128,128,8,2,4,2,1,1,1,1,50,1024,61696,88704,1,0.010624,5.4084,8.3494
54,CUTLASS,gemm,cutlass_simt_sgemm_128x128_8x2_nn_align1,passed,success,universal,serial,512,56,2,f32:column,f32:column,f32:column,1,0,1,1,simt,f32,128,128,8,2,4,2,1,1,1,1,50,1024,119232,172032,1,0.010464,10.612,16.4404
54,CUTLASS,gemm,cutlass_simt_sgemm_128x128_8x2_nt_align1,passed,success,universal,serial,512,56,2,f32:column,f32:row,f32:column,1,0,1,1,simt,f32,128,128,8,2,4,2,1,1,1,1,50,1024,119232,172032,1,0.010592,10.4837,16.2417
54,CUTLASS,gemm,cutlass_simt_sgemm_128x128_8x2_tn_align1,passed,success,universal,serial,512,56,2,f32:row,f32:column,f32:column,1,0,1,1,simt,f32,128,128,8,2,4,2,1,1,1,1,50,1024,119232,172032,1,0.010368,10.7102,16.5926
54,CUTLASS,gemm,cutlass_simt_sgemm_128x128_8x2_tt_align1,passed,success,universal,serial,512,56,2,f32:row,f32:row,f32:column,1,0,1,1,simt,f32,128,128,8,2,4,2,1,1,1,1,50,1024,119232,172032,1,0.010848,10.2363,15.8584
55,CUTLASS,gemm,cutlass_simt_sgemm_128x128_8x2_nn_align1,passed,success,universal,serial,520,56,2,f32:column,f32:column,f32:column,1,0,1,1,simt,f32,128,128,8,2,4,2,1,1,1,1,50,1024,121088,174720,1,0.010336,10.9106,16.904
55,CUTLASS,gemm,cutlass_simt_sgemm_128x128_8x2_nt_align1,passed,success,universal,serial,520,56,2,f32:column,f32:row,f32:column,1,0,1,1,simt,f32,128,128,8,2,4,2,1,1,1,1,50,1024,121088,174720,1,0.010432,10.8102,16.7485
55,CUTLASS,gemm,cutlass_simt_sgemm_128x128_8x2_tn_align1,passed,success,universal,serial,520,56,2,f32:row,f32:column,f32:column,1,0,1,1,simt,f32,128,128,8,2,4,2,1,1,1,1,50,1024,121088,174720,1,0.010592,10.6469,16.4955
55,CUTLASS,gemm,cutlass_simt_sgemm_128x128_8x2_tt_align1,passed,success,universal,serial,520,56,2,f32:row,f32:row,f32:column,1,0,1,1,simt,f32,128,128,8,2,4,2,1,1,1,1,50,1024,121088,174720,1,0.010656,10.583,16.3964
56,CUTLASS,gemm,cutlass_simt_sgemm_128x128_8x2_nn_align1,passed,success,universal,serial,1024,56,2,f32:column,f32:column,f32:column,1,0,1,1,simt,f32,128,128,8,2,4,2,1,1,1,1,50,1024,238016,344064,1,0.011136,19.9057,30.8966
56,CUTLASS,gemm,cutlass_simt_sgemm_128x128_8x2_nt_align1,passed,success,universal,serial,1024,56,2,f32:column,f32:row,f32:column,1,0,1,1,simt,f32,128,128,8,2,4,2,1,1,1,1,50,1024,238016,344064,1,0.011168,19.8486,30.808
56,CUTLASS,gemm,cutlass_simt_sgemm_128x128_8x2_tn_align1,passed,success,universal,serial,1024,56,2,f32:row,f32:column,f32:column,1,0,1,1,simt,f32,128,128,8,2,4,2,1,1,1,1,50,1024,238016,344064,1,0.011104,19.963,30.9856
56,CUTLASS,gemm,cutlass_simt_sgemm_128x128_8x2_tt_align1,passed,success,universal,serial,1024,56,2,f32:row,f32:row,f32:column,1,0,1,1,simt,f32,128,128,8,2,4,2,1,1,1,1,50,1024,238016,344064,1,0.011168,19.8486,30.808
57,CUTLASS,gemm,cutlass_simt_sgemm_128x128_8x2_nn_align1,passed,success,universal,serial,1032,56,2,f32:column,f32:column,f32:column,1,0,1,1,simt,f32,128,128,8,2,4,2,1,1,1,1,50,1024,239872,346752,1,0.010656,20.9645,32.5405
57,CUTLASS,gemm,cutlass_simt_sgemm_128x128_8x2_nt_align1,passed,success,universal,serial,1032,56,2,f32:column,f32:row,f32:column,1,0,1,1,simt,f32,128,128,8,2,4,2,1,1,1,1,50,1024,239872,346752,1,0.010784,20.7157,32.1543
57,CUTLASS,gemm,cutlass_simt_sgemm_128x128_8x2_tn_align1,passed,success,universal,serial,1032,56,2,f32:row,f32:column,f32:column,1,0,1,1,simt,f32,128,128,8,2,4,2,1,1,1,1,50,1024,239872,346752,1,0.010656,20.9645,32.5405
57,CUTLASS,gemm,cutlass_simt_sgemm_128x128_8x2_tt_align1,passed,success,universal,serial,1032,56,2,f32:row,f32:row,f32:column,1,0,1,1,simt,f32,128,128,8,2,4,2,1,1,1,1,50,1024,239872,346752,1,0.010656,20.9645,32.5405
58,CUTLASS,gemm,cutlass_simt_sgemm_128x128_8x2_nn_align1,passed,success,universal,serial,4096,56,2,f32:column,f32:column,f32:column,1,0,1,1,simt,f32,128,128,8,2,4,2,1,1,1,1,50,1024,950720,1376256,1,0.010784,82.1056,127.62
58,CUTLASS,gemm,cutlass_simt_sgemm_128x128_8x2_nt_align1,passed,success,universal,serial,4096,56,2,f32:column,f32:row,f32:column,1,0,1,1,simt,f32,128,128,8,2,4,2,1,1,1,1,50,1024,950720,1376256,1,0.010976,80.6694,125.388
58,CUTLASS,gemm,cutlass_simt_sgemm_128x128_8x2_tn_align1,passed,success,universal,serial,4096,56,2,f32:row,f32:column,f32:column,1,0,1,1,simt,f32,128,128,8,2,4,2,1,1,1,1,50,1024,950720,1376256,1,0.010976,80.6694,125.388
58,CUTLASS,gemm,cutlass_simt_sgemm_128x128_8x2_tt_align1,passed,success,universal,serial,4096,56,2,f32:row,f32:row,f32:column,1,0,1,1,simt,f32,128,128,8,2,4,2,1,1,1,1,50,1024,950720,1376256,1,0.010976,80.6694,125.388
59,CUTLASS,gemm,cutlass_simt_sgemm_128x128_8x2_nn_align1,passed,success,universal,serial,8192,56,2,f32:column,f32:column,f32:column,1,0,1,1,simt,f32,128,128,8,2,4,2,1,1,1,1,50,1024,1900992,2752512,1,0.01088,162.724,252.988
59,CUTLASS,gemm,cutlass_simt_sgemm_128x128_8x2_nt_align1,passed,success,universal,serial,8192,56,2,f32:column,f32:row,f32:column,1,0,1,1,simt,f32,128,128,8,2,4,2,1,1,1,1,50,1024,1900992,2752512,1,0.010752,164.661,256
59,CUTLASS,gemm,cutlass_simt_sgemm_128x128_8x2_tn_align1,passed,success,universal,serial,8192,56,2,f32:row,f32:column,f32:column,1,0,1,1,simt,f32,128,128,8,2,4,2,1,1,1,1,50,1024,1900992,2752512,1,0.01104,160.366,249.322
59,CUTLASS,gemm,cutlass_simt_sgemm_128x128_8x2_tt_align1,passed,success,universal,serial,8192,56,2,f32:row,f32:row,f32:column,1,0,1,1,simt,f32,128,128,8,2,4,2,1,1,1,1,50,1024,1900992,2752512,1,0.011008,160.832,250.047
60,CUTLASS,gemm,cutlass_simt_sgemm_128x128_8x2_nn_align1,passed,success,universal,serial,16384,56,2,f32:column,f32:column,f32:column,1,0,1,1,simt,f32,128,128,8,2,4,2,1,1,1,1,50,1024,3801536,5505024,1,0.017216,205.649,319.762
60,CUTLASS,gemm,cutlass_simt_sgemm_128x128_8x2_nt_align1,passed,success,universal,serial,16384,56,2,f32:column,f32:row,f32:column,1,0,1,1,simt,f32,128,128,8,2,4,2,1,1,1,1,50,1024,3801536,5505024,1,0.017184,206.032,320.358
60,CUTLASS,gemm,cutlass_simt_sgemm_128x128_8x2_tn_align1,passed,success,universal,serial,16384,56,2,f32:row,f32:column,f32:column,1,0,1,1,simt,f32,128,128,8,2,4,2,1,1,1,1,50,1024,3801536,5505024,1,0.016864,209.942,326.436
60,CUTLASS,gemm,cutlass_simt_sgemm_128x128_8x2_tt_align1,passed,success,universal,serial,16384,56,2,f32:row,f32:row,f32:column,1,0,1,1,simt,f32,128,128,8,2,4,2,1,1,1,1,50,1024,3801536,5505024,1,0.016896,209.544,325.818
61,CUTLASS,gemm,cutlass_simt_sgemm_128x128_8x2_nn_align1,passed,success,universal,serial,2,120,2,f32:column,f32:column,f32:column,1,0,1,1,simt,f32,128,128,8,2,4,2,1,1,1,1,50,1024,1936,1440,0,0.010368,0.173904,0.138889
61,CUTLASS,gemm,cutlass_simt_sgemm_128x128_8x2_nt_align1,passed,success,universal,serial,2,120,2,f32:column,f32:row,f32:column,1,0,1,1,simt,f32,128,128,8,2,4,2,1,1,1,1,50,1024,1936,1440,0,0.010336,0.174443,0.139319
61,CUTLASS,gemm,cutlass_simt_sgemm_128x128_8x2_tn_align1,passed,success,universal,serial,2,120,2,f32:row,f32:column,f32:column,1,0,1,1,simt,f32,128,128,8,2,4,2,1,1,1,1,50,1024,1936,1440,0,0.010624,0.169714,0.135542
61,CUTLASS,gemm,cutlass_simt_sgemm_128x128_8x2_tt_align1,passed,success,universal,serial,2,120,2,f32:row,f32:row,f32:column,1,0,1,1,simt,f32,128,128,8,2,4,2,1,1,1,1,50,1024,1936,1440,0,0.010368,0.173904,0.138889
62,CUTLASS,gemm,cutlass_simt_sgemm_128x128_8x2_nn_align1,passed,success,universal,serial,4,120,2,f32:column,f32:column,f32:column,1,0,1,1,simt,f32,128,128,8,2,4,2,1,1,1,1,50,1024,2912,2880,0,0.010368,0.261575,0.277778
62,CUTLASS,gemm,cutlass_simt_sgemm_128x128_8x2_nt_align1,passed,success,universal,serial,4,120,2,f32:column,f32:row,f32:column,1,0,1,1,simt,f32,128,128,8,2,4,2,1,1,1,1,50,1024,2912,2880,0,0.010368,0.261575,0.277778
62,CUTLASS,gemm,cutlass_simt_sgemm_128x128_8x2_tn_align1,passed,success,universal,serial,4,120,2,f32:row,f32:column,f32:column,1,0,1,1,simt,f32,128,128,8,2,4,2,1,1,1,1,50,1024,2912,2880,0,0.010368,0.261575,0.277778
62,CUTLASS,gemm,cutlass_simt_sgemm_128x128_8x2_tt_align1,passed,success,universal,serial,4,120,2,f32:row,f32:row,f32:column,1,0,1,1,simt,f32,128,128,8,2,4,2,1,1,1,1,50,1024,2912,2880,0,0.010336,0.262385,0.278638
63,CUTLASS,gemm,cutlass_simt_sgemm_128x128_8x2_nn_align1,passed,success,universal,serial,8,120,2,f32:column,f32:column,f32:column,1,0,1,1,simt,f32,128,128,8,2,4,2,1,1,1,1,50,1024,4864,5760,1,0.010368,0.436917,0.555556
63,CUTLASS,gemm,cutlass_simt_sgemm_128x128_8x2_nt_align1,passed,success,universal,serial,8,120,2,f32:column,f32:row,f32:column,1,0,1,1,simt,f32,128,128,8,2,4,2,1,1,1,1,50,1024,4864,5760,1,0.010368,0.436917,0.555556
63,CUTLASS,gemm,cutlass_simt_sgemm_128x128_8x2_tn_align1,passed,success,universal,serial,8,120,2,f32:row,f32:column,f32:column,1,0,1,1,simt,f32,128,128,8,2,4,2,1,1,1,1,50,1024,4864,5760,1,0.010368,0.436917,0.555556
63,CUTLASS,gemm,cutlass_simt_sgemm_128x128_8x2_tt_align1,passed,success,universal,serial,8,120,2,f32:row,f32:row,f32:column,1,0,1,1,simt,f32,128,128,8,2,4,2,1,1,1,1,50,1024,4864,5760,1,0.010496,0.431589,0.54878
64,CUTLASS,gemm,cutlass_simt_sgemm_128x128_8x2_nn_align1,passed,success,universal,serial,56,120,2,f32:column,f32:column,f32:column,1,0,1,1,simt,f32,128,128,8,2,4,2,1,1,1,1,50,1024,28288,40320,1,0.010368,2.54102,3.88889
64,CUTLASS,gemm,cutlass_simt_sgemm_128x128_8x2_nt_align1,passed,success,universal,serial,56,120,2,f32:column,f32:row,f32:column,1,0,1,1,simt,f32,128,128,8,2,4,2,1,1,1,1,50,1024,28288,40320,1,0.010368,2.54102,3.88889
64,CUTLASS,gemm,cutlass_simt_sgemm_128x128_8x2_tn_align1,passed,success,universal,serial,56,120,2,f32:row,f32:column,f32:column,1,0,1,1,simt,f32,128,128,8,2,4,2,1,1,1,1,50,1024,28288,40320,1,0.010368,2.54102,3.88889
64,CUTLASS,gemm,cutlass_simt_sgemm_128x128_8x2_tt_align1,passed,success,universal,serial,56,120,2,f32:row,f32:row,f32:column,1,0,1,1,simt,f32,128,128,8,2,4,2,1,1,1,1,50,1024,28288,40320,1,0.010368,2.54102,3.88889
65,CUTLASS,gemm,cutlass_simt_sgemm_128x128_8x2_nn_align1,passed,success,universal,serial,120,120,2,f32:column,f32:column,f32:column,1,0,1,1,simt,f32,128,128,8,2,4,2,1,1,1,1,50,1024,59520,86400,1,0.011136,4.97776,7.75862
65,CUTLASS,gemm,cutlass_simt_sgemm_128x128_8x2_nt_align1,passed,success,universal,serial,120,120,2,f32:column,f32:row,f32:column,1,0,1,1,simt,f32,128,128,8,2,4,2,1,1,1,1,50,1024,59520,86400,1,0.011136,4.97776,7.75862
65,CUTLASS,gemm,cutlass_simt_sgemm_128x128_8x2_tn_align1,passed,success,universal,serial,120,120,2,f32:row,f32:column,f32:column,1,0,1,1,simt,f32,128,128,8,2,4,2,1,1,1,1,50,1024,59520,86400,1,0.011136,4.97776,7.75862
65,CUTLASS,gemm,cutlass_simt_sgemm_128x128_8x2_tt_align1,passed,success,universal,serial,120,120,2,f32:row,f32:row,f32:column,1,0,1,1,simt,f32,128,128,8,2,4,2,1,1,1,1,50,1024,59520,86400,1,0.01136,4.87961,7.60563
66,CUTLASS,gemm,cutlass_simt_sgemm_128x128_8x2_nn_align1,passed,success,universal,serial,136,120,2,f32:column,f32:column,f32:column,1,0,1,1,simt,f32,128,128,8,2,4,2,1,1,1,1,50,1024,67328,97920,1,0.011136,5.63075,8.7931
66,CUTLASS,gemm,cutlass_simt_sgemm_128x128_8x2_nt_align1,passed,success,universal,serial,136,120,2,f32:column,f32:row,f32:column,1,0,1,1,simt,f32,128,128,8,2,4,2,1,1,1,1,50,1024,67328,97920,1,0.011168,5.61462,8.76791
66,CUTLASS,gemm,cutlass_simt_sgemm_128x128_8x2_tn_align1,passed,success,universal,serial,136,120,2,f32:row,f32:column,f32:column,1,0,1,1,simt,f32,128,128,8,2,4,2,1,1,1,1,50,1024,67328,97920,1,0.011136,5.63075,8.7931
66,CUTLASS,gemm,cutlass_simt_sgemm_128x128_8x2_tt_align1,passed,success,universal,serial,136,120,2,f32:row,f32:row,f32:column,1,0,1,1,simt,f32,128,128,8,2,4,2,1,1,1,1,50,1024,67328,97920,1,0.011136,5.63075,8.7931
67,CUTLASS,gemm,cutlass_simt_sgemm_128x128_8x2_nn_align1,passed,success,universal,serial,256,120,2,f32:column,f32:column,f32:column,1,0,1,1,simt,f32,128,128,8,2,4,2,1,1,1,1,50,1024,125888,184320,1,0.010848,10.8077,16.9912
67,CUTLASS,gemm,cutlass_simt_sgemm_128x128_8x2_nt_align1,passed,success,universal,serial,256,120,2,f32:column,f32:row,f32:column,1,0,1,1,simt,f32,128,128,8,2,4,2,1,1,1,1,50,1024,125888,184320,1,0.01088,10.776,16.9412
67,CUTLASS,gemm,cutlass_simt_sgemm_128x128_8x2_tn_align1,passed,success,universal,serial,256,120,2,f32:row,f32:column,f32:column,1,0,1,1,simt,f32,128,128,8,2,4,2,1,1,1,1,50,1024,125888,184320,1,0.01088,10.776,16.9412
67,CUTLASS,gemm,cutlass_simt_sgemm_128x128_8x2_tt_align1,passed,success,universal,serial,256,120,2,f32:row,f32:row,f32:column,1,0,1,1,simt,f32,128,128,8,2,4,2,1,1,1,1,50,1024,125888,184320,1,0.010912,10.7443,16.8915
68,CUTLASS,gemm,cutlass_simt_sgemm_128x128_8x2_nn_align1,passed,success,universal,serial,264,120,2,f32:column,f32:column,f32:column,1,0,1,1,simt,f32,128,128,8,2,4,2,1,1,1,1,50,1024,129792,190080,1,0.011392,10.6108,16.6854
