CUTLASS/cutlassgemm-benchmark/csv_logs/cutlass_shape_8192_22016_8192_performance.gemm.csv
Problem,Provider,OperationKind,Operation,Disposition,Status,gemm_kind,split_k_mode,m,n,k,A,B,C,alpha,beta,split_k_slices,batch_count,op_class,accum,cta_m,cta_n,cta_k,stages,warps_m,warps_n,warps_k,inst_m,inst_n,inst_k,min_cc,max_cc,Bytes,Flops,Flops/Byte,Runtime,GB/s,GFLOPs
1,CUTLASS,gemm,cutlass_tensorop_h1688gemm_256x128_32x2_nn_align8,incorrect,success,universal,serial,8192,8192,22016,f16:column,f16:column,f16:column,1,0,1,1,tensorop,f16,256,128,32,2,4,2,1,16,8,8,75,1024,855638016,2955071717376,3453,23.0782,34.5293,128046
1,CUTLASS,gemm,cutlass_tensorop_h1688gemm_256x128_32x2_nn_align4,incorrect,success,universal,serial,8192,8192,22016,f16:column,f16:column,f16:column,1,0,1,1,tensorop,f16,256,128,32,2,4,2,1,16,8,8,75,1024,855638016,2955071717376,3453,27.3447,29.1419,108067
1,CUTLASS,gemm,cutlass_tensorop_h1688gemm_256x128_32x2_nn_align2,incorrect,success,universal,serial,8192,8192,22016,f16:column,f16:column,f16:column,1,0,1,1,tensorop,f16,256,128,32,2,4,2,1,16,8,8,75,1024,855638016,2955071717376,3453,32.0318,24.8776,92254.2
1,CUTLASS,gemm,cutlass_tensorop_h1688gemm_256x128_32x2_nn_align1,incorrect,success,universal,serial,8192,8192,22016,f16:column,f16:column,f16:column,1,0,1,1,tensorop,f16,256,128,32,2,4,2,1,16,8,8,75,1024,855638016,2955071717376,3453,43.4304,18.3483,68041.6
1,CUTLASS,gemm,cutlass_tensorop_h1688gemm_128x256_32x2_nn_align8,incorrect,success,universal,serial,8192,8192,22016,f16:column,f16:column,f16:column,1,0,1,1,tensorop,f16,128,256,32,2,2,4,1,16,8,8,75,1024,855638016,2955071717376,3453,22.4835,35.4427,131433
1,CUTLASS,gemm,cutlass_tensorop_h1688gemm_128x256_32x2_nn_align4,incorrect,success,universal,serial,8192,8192,22016,f16:column,f16:column,f16:column,1,0,1,1,tensorop,f16,128,256,32,2,2,4,1,16,8,8,75,1024,855638016,2955071717376,3453,24.4119,32.6429,121051
1,CUTLASS,gemm,cutlass_tensorop_h1688gemm_128x256_32x2_nn_align2,incorrect,success,universal,serial,8192,8192,22016,f16:column,f16:column,f16:column,1,0,1,1,tensorop,f16,128,256,32,2,2,4,1,16,8,8,75,1024,855638016,2955071717376,3453,27.3258,29.1619,108142
1,CUTLASS,gemm,cutlass_tensorop_h1688gemm_128x256_32x2_nn_align1,incorrect,success,universal,serial,8192,8192,22016,f16:column,f16:column,f16:column,1,0,1,1,tensorop,f16,128,256,32,2,2,4,1,16,8,8,75,1024,855638016,2955071717376,3453,40.5164,19.668,72935.2
1,CUTLASS,gemm,cutlass_tensorop_h1688gemm_128x128_32x2_nn_align8,incorrect,success,universal,serial,8192,8192,22016,f16:column,f16:column,f16:column,1,0,1,1,tensorop,f16,128,128,32,2,2,2,1,16,8,8,75,1024,855638016,2955071717376,3453,42.015,18.9664,70333.7
1,CUTLASS,gemm,cutlass_tensorop_h1688gemm_128x128_32x2_nn_align4,incorrect,success,universal,serial,8192,8192,22016,f16:column,f16:column,f16:column,1,0,1,1,tensorop,f16,128,128,32,2,2,2,1,16,8,8,75,1024,855638016,2955071717376,3453,30.3949,26.2174,97222.7
1,CUTLASS,gemm,cutlass_tensorop_h1688gemm_128x128_32x2_nn_align2,incorrect,success,universal,serial,8192,8192,22016,f16:column,f16:column,f16:column,1,0,1,1,tensorop,f16,128,128,32,2,2,2,1,16,8,8,75,1024,855638016,2955071717376,3453,34.4544,23.1284,85767.5
1,CUTLASS,gemm,cutlass_tensorop_h1688gemm_128x128_32x2_nn_align1,incorrect,success,universal,serial,8192,8192,22016,f16:column,f16:column,f16:column,1,0,1,1,tensorop,f16,128,128,32,2,2,2,1,16,8,8,75,1024,855638016,2955071717376,3453,43.0135,18.5261,68701
1,CUTLASS,gemm,cutlass_tensorop_h1688gemm_64x256_32x2_nn_align8,incorrect,success,universal,serial,8192,8192,22016,f16:column,f16:column,f16:column,1,0,1,1,tensorop,f16,64,256,32,2,1,4,1,16,8,8,75,1024,855638016,2955071717376,3453,35.1059,22.6992,84175.9
1,CUTLASS,gemm,cutlass_tensorop_h1688gemm_64x256_32x2_nn_align4,incorrect,success,universal,serial,8192,8192,22016,f16:column,f16:column,f16:column,1,0,1,1,tensorop,f16,64,256,32,2,1,4,1,16,8,8,75,1024,855638016,2955071717376,3453,47.1228,16.9106,62710
1,CUTLASS,gemm,cutlass_tensorop_h1688gemm_64x256_32x2_nn_align2,incorrect,success,universal,serial,8192,8192,22016,f16:column,f16:column,f16:column,1,0,1,1,tensorop,f16,64,256,32,2,1,4,1,16,8,8,75,1024,855638016,2955071717376,3453,34.3651,23.1885,85990.4
1,CUTLASS,gemm,cutlass_tensorop_h1688gemm_64x256_32x2_nn_align1,incorrect,success,universal,serial,8192,8192,22016,f16:column,f16:column,f16:column,1,0,1,1,tensorop,f16,64,256,32,2,1,4,1,16,8,8,75,1024,855638016,2955071717376,3453,51.256,15.547,57653.2
1,CUTLASS,gemm,cutlass_tensorop_h1688gemm_256x64_32x2_nn_align8,incorrect,success,universal,serial,8192,8192,22016,f16:column,f16:column,f16:column,1,0,1,1,tensorop,f16,256,64,32,2,4,1,1,16,8,8,75,1024,855638016,2955071717376,3453,40.9499,19.4598,72163.2
1,CUTLASS,gemm,cutlass_tensorop_h1688gemm_256x64_32x2_nn_align4,incorrect,success,universal,serial,8192,8192,22016,f16:column,f16:column,f16:column,1,0,1,1,tensorop,f16,256,64,32,2,4,1,1,16,8,8,75,1024,855638016,2955071717376,3453,41.1828,19.3497,71755
1,CUTLASS,gemm,cutlass_tensorop_h1688gemm_256x64_32x2_nn_align2,incorrect,success,universal,serial,8192,8192,22016,f16:column,f16:column,f16:column,1,0,1,1,tensorop,f16,256,64,32,2,4,1,1,16,8,8,75,1024,855638016,2955071717376,3453,43.2458,18.4267,68332
1,CUTLASS,gemm,cutlass_tensorop_h1688gemm_256x64_32x2_nn_align1,incorrect,success,universal,serial,8192,8192,22016,f16:column,f16:column,f16:column,1,0,1,1,tensorop,f16,256,64,32,2,4,1,1,16,8,8,75,1024,855638016,2955071717376,3453,58.3817,13.6494,50616.4
1,CUTLASS,gemm,cutlass_tensorop_h1688gemm_64x128_32x2_nn_align8,incorrect,success,universal,serial,8192,8192,22016,f16:column,f16:column,f16:column,1,0,1,1,tensorop,f16,64,128,32,2,2,2,1,16,8,8,75,1024,855638016,2955071717376,3453,62.952,12.6584,46941.6
1,CUTLASS,gemm,cutlass_tensorop_h1688gemm_64x128_32x2_nn_align4,incorrect,success,universal,serial,8192,8192,22016,f16:column,f16:column,f16:column,1,0,1,1,tensorop,f16,64,128,32,2,2,2,1,16,8,8,75,1024,855638016,2955071717376,3453,64.4425,12.3657,45856
1,CUTLASS,gemm,cutlass_tensorop_h1688gemm_64x128_32x2_nn_align2,incorrect,success,universal,serial,8192,8192,22016,f16:column,f16:column,f16:column,1,0,1,1,tensorop,f16,64,128,32,2,2,2,1,16,8,8,75,1024,855638016,2955071717376,3453,55.8537,14.2672,52907.4
1,CUTLASS,gemm,cutlass_tensorop_h1688gemm_64x128_32x2_nn_align1,incorrect,success,universal,serial,8192,8192,22016,f16:column,f16:column,f16:column,1,0,1,1,tensorop,f16,64,128,32,2,2,2,1,16,8,8,75,1024,855638016,2955071717376,3453,57.6147,13.8311,51290.3
1,CUTLASS,gemm,cutlass_tensorop_h1688gemm_128x64_32x2_nn_align8,incorrect,success,universal,serial,8192,8192,22016,f16:column,f16:column,f16:column,1,0,1,1,tensorop,f16,128,64,32,2,2,2,1,16,8,8,75,1024,855638016,2955071717376,3453,38.2896,20.8118,77176.9
1,CUTLASS,gemm,cutlass_tensorop_h1688gemm_128x64_32x2_nn_align4,incorrect,success,universal,serial,8192,8192,22016,f16:column,f16:column,f16:column,1,0,1,1,tensorop,f16,128,64,32,2,2,2,1,16,8,8,75,1024,855638016,2955071717376,3453,49.2099,16.1934,60050.4
1,CUTLASS,gemm,cutlass_tensorop_h1688gemm_128x64_32x2_nn_align2,incorrect,success,universal,serial,8192,8192,22016,f16:column,f16:column,f16:column,1,0,1,1,tensorop,f16,128,64,32,2,2,2,1,16,8,8,75,1024,855638016,2955071717376,3453,55.7043,14.3055,53049.3
1,CUTLASS,gemm,cutlass_tensorop_h1688gemm_128x64_32x2_nn_align1,incorrect,success,universal,serial,8192,8192,22016,f16:column,f16:column,f16:column,1,0,1,1,tensorop,f16,128,64,32,2,2,2,1,16,8,8,75,1024,855638016,2955071717376,3453,66.9587,11.901,44132.7
1,CUTLASS,gemm,cutlass_tensorop_h1688gemm_64x64_32x2_nn_align8,incorrect,success,universal,serial,8192,8192,22016,f16:column,f16:column,f16:column,1,0,1,1,tensorop,f16,64,64,32,2,2,2,1,16,8,8,75,1024,855638016,2955071717376,3453,71.5462,11.1379,41303
1,CUTLASS,gemm,cutlass_tensorop_h1688gemm_64x64_32x2_nn_align4,incorrect,success,universal,serial,8192,8192,22016,f16:column,f16:column,f16:column,1,0,1,1,tensorop,f16,64,64,32,2,2,2,1,16,8,8,75,1024,855638016,2955071717376,3453,72.0732,11.0565,41001
1,CUTLASS,gemm,cutlass_tensorop_h1688gemm_64x64_32x2_nn_align2,incorrect,success,universal,serial,8192,8192,22016,f16:column,f16:column,f16:column,1,0,1,1,tensorop,f16,64,64,32,2,2,2,1,16,8,8,75,1024,855638016,2955071717376,3453,62.2549,12.8002,47467.3
1,CUTLASS,gemm,cutlass_tensorop_h1688gemm_64x64_32x2_nn_align1,incorrect,success,universal,serial,8192,8192,22016,f16:column,f16:column,f16:column,1,0,1,1,tensorop,f16,64,64,32,2,2,2,1,16,8,8,75,1024,855638016,2955071717376,3453,82.9008,9.61239,35645.9
1,CUTLASS,gemm,cutlass_tensorop_h1688gemm_64x128_64x2_nn_align8,incorrect,success,universal,serial,8192,8192,22016,f16:column,f16:column,f16:column,1,0,1,1,tensorop,f16,64,128,64,2,1,2,2,16,8,8,75,1024,855638016,2955071717376,3453,37.3105,21.3579,79202.2
1,CUTLASS,gemm,cutlass_tensorop_h1688gemm_64x128_64x2_nn_align4,incorrect,success,universal,serial,8192,8192,22016,f16:column,f16:column,f16:column,1,0,1,1,tensorop,f16,64,128,64,2,1,2,2,16,8,8,75,1024,855638016,2955071717376,3453,39.322,20.2654,75150.6
1,CUTLASS,gemm,cutlass_tensorop_h1688gemm_64x128_64x2_nn_align2,incorrect,success,universal,serial,8192,8192,22016,f16:column,f16:column,f16:column,1,0,1,1,tensorop,f16,64,128,64,2,1,2,2,16,8,8,75,1024,855638016,2955071717376,3453,38.604,20.6423,76548.4
1,CUTLASS,gemm,cutlass_tensorop_h1688gemm_64x128_64x2_nn_align1,incorrect,success,universal,serial,8192,8192,22016,f16:column,f16:column,f16:column,1,0,1,1,tensorop,f16,64,128,64,2,1,2,2,16,8,8,75,1024,855638016,2955071717376,3453,45.1374,17.6544,65468.4
1,CUTLASS,gemm,cutlass_tensorop_h1688gemm_256x128_32x2_nt_align8,incorrect,success,universal,serial,8192,8192,22016,f16:column,f16:row,f16:column,1,0,1,1,tensorop,f16,256,128,32,2,4,2,1,16,8,8,75,1024,855638016,2955071717376,3453,22.3618,35.6355,132148
1,CUTLASS,gemm,cutlass_tensorop_h1688gemm_256x128_32x2_nt_align4,incorrect,success,universal,serial,8192,8192,22016,f16:column,f16:row,f16:column,1,0,1,1,tensorop,f16,256,128,32,2,4,2,1,16,8,8,75,1024,855638016,2955071717376,3453,24.4301,32.6186,120960
1,CUTLASS,gemm,cutlass_tensorop_h1688gemm_256x128_32x2_nt_align2,incorrect,success,universal,serial,8192,8192,22016,f16:column,f16:row,f16:column,1,0,1,1,tensorop,f16,256,128,32,2,4,2,1,16,8,8,75,1024,855638016,2955071717376,3453,28.5465,27.915,103518
1,CUTLASS,gemm,cutlass_tensorop_h1688gemm_256x128_32x2_nt_align1,incorrect,success,universal,serial,8192,8192,22016,f16:column,f16:row,f16:column,1,0,1,1,tensorop,f16,256,128,32,2,4,2,1,16,8,8,75,1024,855638016,2955071717376,3453,33.6914,23.6521,87709.9
1,CUTLASS,gemm,cutlass_tensorop_h1688gemm_128x256_32x2_nt_align8,incorrect,success,universal,serial,8192,8192,22016,f16:column,f16:row,f16:column,1,0,1,1,tensorop,f16,128,256,32,2,2,4,1,16,8,8,75,1024,855638016,2955071717376,3453,22.2616,35.796,132743
1,CUTLASS,gemm,cutlass_tensorop_h1688gemm_128x256_32x2_nt_align4,incorrect,success,universal,serial,8192,8192,22016,f16:column,f16:row,f16:column,1,0,1,1,tensorop,f16,128,256,32,2,2,4,1,16,8,8,75,1024,855638016,2955071717376,3453,23.9267,33.3049,123505
1,CUTLASS,gemm,cutlass_tensorop_h1688gemm_128x256_32x2_nt_align2,incorrect,success,universal,serial,8192,8192,22016,f16:column,f16:row,f16:column,1,0,1,1,tensorop,f16,128,256,32,2,2,4,1,16,8,8,75,1024,855638016,2955071717376,3453,28.5792,27.883,103399
1,CUTLASS,gemm,cutlass_tensorop_h1688gemm_128x256_32x2_nt_align1,incorrect,success,universal,serial,8192,8192,22016,f16:column,f16:row,f16:column,1,0,1,1,tensorop,f16,128,256,32,2,2,4,1,16,8,8,75,1024,855638016,2955071717376,3453,31.9671,24.9279,92440.9
1,CUTLASS,gemm,cutlass_tensorop_h1688gemm_128x128_32x2_nt_align8,incorrect,success,universal,serial,8192,8192,22016,f16:column,f16:row,f16:column,1,0,1,1,tensorop,f16,128,128,32,2,2,2,1,16,8,8,75,1024,855638016,2955071717376,3453,24.6529,32.3238,119867
1,CUTLASS,gemm,cutlass_tensorop_h1688gemm_128x128_32x2_nt_align4,incorrect,success,universal,serial,8192,8192,22016,f16:column,f16:row,f16:column,1,0,1,1,tensorop,f16,128,128,32,2,2,2,1,16,8,8,75,1024,855638016,2955071717376,3453,35.3831,22.5214,83516.5
1,CUTLASS,gemm,cutlass_tensorop_h1688gemm_128x128_32x2_nt_align2,incorrect,success,universal,serial,8192,8192,22016,f16:column,f16:row,f16:column,1,0,1,1,tensorop,f16,128,128,32,2,2,2,1,16,8,8,75,1024,855638016,2955071717376,3453,32.9816,24.1612,89597.6
1,CUTLASS,gemm,cutlass_tensorop_h1688gemm_128x128_32x2_nt_align1,incorrect,success,universal,serial,8192,8192,22016,f16:column,f16:row,f16:column,1,0,1,1,tensorop,f16,128,128,32,2,2,2,1,16,8,8,75,1024,855638016,2955071717376,3453,35.5675,22.4046,83083.4
1,CUTLASS,gemm,cutlass_tensorop_h1688gemm_64x256_32x2_nt_align8,incorrect,success,universal,serial,8192,8192,22016,f16:column,f16:row,f16:column,1,0,1,1,tensorop,f16,64,256,32,2,1,4,1,16,8,8,75,1024,855638016,2955071717376,3453,36.5421,21.8071,80867.7
1,CUTLASS,gemm,cutlass_tensorop_h1688gemm_64x256_32x2_nt_align4,incorrect,success,universal,serial,8192,8192,22016,f16:column,f16:row,f16:column,1,0,1,1,tensorop,f16,64,256,32,2,1,4,1,16,8,8,75,1024,855638016,2955071717376,3453,49.5601,16.079,59626.1
1,CUTLASS,gemm,cutlass_tensorop_h1688gemm_64x256_32x2_nt_align2,incorrect,success,universal,serial,8192,8192,22016,f16:column,f16:row,f16:column,1,0,1,1,tensorop,f16,64,256,32,2,1,4,1,16,8,8,75,1024,855638016,2955071717376,3453,31.8152,25.047,92882.5
1,CUTLASS,gemm,cutlass_tensorop_h1688gemm_64x256_32x2_nt_align1,incorrect,success,universal,serial,8192,8192,22016,f16:column,f16:row,f16:column,1,0,1,1,tensorop,f16,64,256,32,2,1,4,1,16,8,8,75,1024,855638016,2955071717376,3453,40.5293,19.6617,72912
1,CUTLASS,gemm,cutlass_tensorop_h1688gemm_256x64_32x2_nt_align8,incorrect,success,universal,serial,8192,8192,22016,f16:column,f16:row,f16:column,1,0,1,1,tensorop,f16,256,64,32,2,4,1,1,16,8,8,75,1024,855638016,2955071717376,3453,31.7736,25.0798,93004
1,CUTLASS,gemm,cutlass_tensorop_h1688gemm_256x64_32x2_nt_align4,incorrect,success,universal,serial,8192,8192,22016,f16:column,f16:row,f16:column,1,0,1,1,tensorop,f16,256,64,32,2,4,1,1,16,8,8,75,1024,855638016,2955071717376,3453,32.1242,24.8061,91988.9
1,CUTLASS,gemm,cutlass_tensorop_h1688gemm_256x64_32x2_nt_align2,incorrect,success,universal,serial,8192,8192,22016,f16:column,f16:row,f16:column,1,0,1,1,tensorop,f16,256,64,32,2,4,1,1,16,8,8,75,1024,855638016,2955071717376,3453,33.2273,23.9826,88935.1
1,CUTLASS,gemm,cutlass_tensorop_h1688gemm_256x64_32x2_nt_align1,incorrect,success,universal,serial,8192,8192,22016,f16:column,f16:row,f16:column,1,0,1,1,tensorop,f16,256,64,32,2,4,1,1,16,8,8,75,1024,855638016,2955071717376,3453,42.935,18.56,68826.7
1,CUTLASS,gemm,cutlass_tensorop_h1688gemm_64x128_32x2_nt_align8,incorrect,success,universal,serial,8192,8192,22016,f16:column,f16:row,f16:column,1,0,1,1,tensorop,f16,64,128,32,2,2,2,1,16,8,8,75,1024,855638016,2955071717376,3453,34.5182,23.0856,85609
1,CUTLASS,gemm,cutlass_tensorop_h1688gemm_64x128_32x2_nt_align4,incorrect,success,universal,serial,8192,8192,22016,f16:column,f16:row,f16:column,1,0,1,1,tensorop,f16,64,128,32,2,2,2,1,16,8,8,75,1024,855638016,2955071717376,3453,42.9307,18.5619,68833.6
1,CUTLASS,gemm,cutlass_tensorop_h1688gemm_64x128_32x2_nt_align2,incorrect,success,universal,serial,8192,8192,22016,f16:column,f16:row,f16:column,1,0,1,1,tensorop,f16,64,128,32,2,2,2,1,16,8,8,75,1024,855638016,2955071717376,3453,38.7181,20.5815,76322.8
1,CUTLASS,gemm,cutlass_tensorop_h1688gemm_64x128_32x2_nt_align1,incorrect,success,universal,serial,8192,8192,22016,f16:column,f16:row,f16:column,1,0,1,1,tensorop,f16,64,128,32,2,2,2,1,16,8,8,75,1024,855638016,2955071717376,3453,57.425,13.8768,51459.7
1,CUTLASS,gemm,cutlass_tensorop_h1688gemm_128x64_32x2_nt_align8,incorrect,success,universal,serial,8192,8192,22016,f16:column,f16:row,f16:column,1,0,1,1,tensorop,f16,128,64,32,2,2,2,1,16,8,8,75,1024,855638016,2955071717376,3453,34.8698,22.8529,84746
1,CUTLASS,gemm,cutlass_tensorop_h1688gemm_128x64_32x2_nt_align4,incorrect,success,universal,serial,8192,8192,22016,f16:column,f16:row,f16:column,1,0,1,1,tensorop,f16,128,64,32,2,2,2,1,16,8,8,75,1024,855638016,2955071717376,3453,35.3314,22.5543,83638.7
1,CUTLASS,gemm,cutlass_tensorop_h1688gemm_128x64_32x2_nt_align2,incorrect,success,universal,serial,8192,8192,22016,f16:column,f16:row,f16:column,1,0,1,1,tensorop,f16,128,64,32,2,2,2,1,16,8,8,75,1024,855638016,2955071717376,3453,38.633,20.6268,76490.9
1,CUTLASS,gemm,cutlass_tensorop_h1688gemm_128x64_32x2_nt_align1,incorrect,success,universal,serial,8192,8192,22016,f16:column,f16:row,f16:column,1,0,1,1,tensorop,f16,128,64,32,2,2,2,1,16,8,8,75,1024,855638016,2955071717376,3453,50.3588,15.824,58680.4
1,CUTLASS,gemm,cutlass_tensorop_h1688gemm_64x64_32x2_nt_align8,incorrect,success,universal,serial,8192,8192,22016,f16:column,f16:row,f16:column,1,0,1,1,tensorop,f16,64,64,32,2,2,2,1,16,8,8,75,1024,855638016,2955071717376,3453,43.8521,18.1719,67387.3
1,CUTLASS,gemm,cutlass_tensorop_h1688gemm_64x64_32x2_nt_align4,incorrect,success,universal,serial,8192,8192,22016,f16:column,f16:row,f16:column,1,0,1,1,tensorop,f16,64,64,32,2,2,2,1,16,8,8,75,1024,855638016,2955071717376,3453,44.1059,18.0673,66999.4
1,CUTLASS,gemm,cutlass_tensorop_h1688gemm_64x64_32x2_nt_align2,incorrect,success,universal,serial,8192,8192,22016,f16:column,f16:row,f16:column,1,0,1,1,tensorop,f16,64,64,32,2,2,2,1,16,8,8,75,1024,855638016,2955071717376,3453,46.3375,17.1972,63772.7
1,CUTLASS,gemm,cutlass_tensorop_h1688gemm_64x64_32x2_nt_align1,incorrect,success,universal,serial,8192,8192,22016,f16:column,f16:row,f16:column,1,0,1,1,tensorop,f16,64,64,32,2,2,2,1,16,8,8,75,1024,855638016,2955071717376,3453,64.8412,12.2896,45574
1,CUTLASS,gemm,cutlass_tensorop_h1688gemm_64x128_64x2_nt_align8,incorrect,success,universal,serial,8192,8192,22016,f16:column,f16:row,f16:column,1,0,1,1,tensorop,f16,64,128,64,2,1,2,2,16,8,8,75,1024,855638016,2955071717376,3453,50.8311,15.6769,58135.2
1,CUTLASS,gemm,cutlass_tensorop_h1688gemm_64x128_64x2_nt_align4,incorrect,success,universal,serial,8192,8192,22016,f16:column,f16:row,f16:column,1,0,1,1,tensorop,f16,64,128,64,2,1,2,2,16,8,8,75,1024,855638016,2955071717376,3453,52.4503,15.193,56340.4
1,CUTLASS,gemm,cutlass_tensorop_h1688gemm_64x128_64x2_nt_align2,incorrect,success,universal,serial,8192,8192,22016,f16:column,f16:row,f16:column,1,0,1,1,tensorop,f16,64,128,64,2,1,2,2,16,8,8,75,1024,855638016,2955071717376,3453,37.9688,20.9876,77829
1,CUTLASS,gemm,cutlass_tensorop_h1688gemm_64x128_64x2_nt_align1,incorrect,success,universal,serial,8192,8192,22016,f16:column,f16:row,f16:column,1,0,1,1,tensorop,f16,64,128,64,2,1,2,2,16,8,8,75,1024,855638016,2955071717376,3453,46.4471,17.1566,63622.3
1,CUTLASS,gemm,cutlass_tensorop_h1688gemm_256x128_32x2_tn_align8,incorrect,success,universal,serial,8192,8192,22016,f16:row,f16:column,f16:column,1,0,1,1,tensorop,f16,256,128,32,2,4,2,1,16,8,8,75,1024,855638016,2955071717376,3453,28.6856,27.7796,103016
1,CUTLASS,gemm,cutlass_tensorop_h1688gemm_256x128_32x2_tn_align4,incorrect,success,universal,serial,8192,8192,22016,f16:row,f16:column,f16:column,1,0,1,1,tensorop,f16,256,128,32,2,4,2,1,16,8,8,75,1024,855638016,2955071717376,3453,27.4164,29.0657,107785
1,CUTLASS,gemm,cutlass_tensorop_h1688gemm_256x128_32x2_tn_align2,incorrect,success,universal,serial,8192,8192,22016,f16:row,f16:column,f16:column,1,0,1,1,tensorop,f16,256,128,32,2,4,2,1,16,8,8,75,1024,855638016,2955071717376,3453,30.0713,26.4995,98268.9
1,CUTLASS,gemm,cutlass_tensorop_h1688gemm_256x128_32x2_tn_align1,incorrect,success,universal,serial,8192,8192,22016,f16:row,f16:column,f16:column,1,0,1,1,tensorop,f16,256,128,32,2,4,2,1,16,8,8,75,1024,855638016,2955071717376,3453,46.9699,16.9657,62914.2
1,CUTLASS,gemm,cutlass_tensorop_h1688gemm_128x256_32x2_tn_align8,incorrect,success,universal,serial,8192,8192,22016,f16:row,f16:column,f16:column,1,0,1,1,tensorop,f16,128,256,32,2,2,4,1,16,8,8,75,1024,855638016,2955071717376,3453,35.3388,22.5496,83621.3
1,CUTLASS,gemm,cutlass_tensorop_h1688gemm_128x256_32x2_tn_align4,incorrect,success,universal,serial,8192,8192,22016,f16:row,f16:column,f16:column,1,0,1,1,tensorop,f16,128,256,32,2,2,4,1,16,8,8,75,1024,855638016,2955071717376,3453,35.5885,22.3914,83034.4
1,CUTLASS,gemm,cutlass_tensorop_h1688gemm_128x256_32x2_tn_align2,incorrect,success,universal,serial,8192,8192,22016,f16:row,f16:column,f16:column,1,0,1,1,tensorop,f16,128,256,32,2,2,4,1,16,8,8,75,1024,855638016,2955071717376,3453,30.5099,26.1186,96856.2
1,CUTLASS,gemm,cutlass_tensorop_h1688gemm_128x256_32x2_tn_align1,incorrect,success,universal,serial,8192,8192,22016,f16:row,f16:column,f16:column,1,0,1,1,tensorop,f16,128,256,32,2,2,4,1,16,8,8,75,1024,855638016,2955071717376,3453,47.2686,16.8585,62516.6
1,CUTLASS,gemm,cutlass_tensorop_h1688gemm_128x128_32x2_tn_align8,incorrect,success,universal,serial,8192,8192,22016,f16:row,f16:column,f16:column,1,0,1,1,tensorop,f16,128,128,32,2,2,2,1,16,8,8,75,1024,855638016,2955071717376,3453,76.2428,10.4518,38758.7
1,CUTLASS,gemm,cutlass_tensorop_h1688gemm_128x128_32x2_tn_align4,incorrect,success,universal,serial,8192,8192,22016,f16:row,f16:column,f16:column,1,0,1,1,tensorop,f16,128,128,32,2,2,2,1,16,8,8,75,1024,855638016,2955071717376,3453,75.2856,10.5847,39251.5
1,CUTLASS,gemm,cutlass_tensorop_h1688gemm_128x128_32x2_tn_align2,incorrect,success,universal,serial,8192,8192,22016,f16:row,f16:column,f16:column,1,0,1,1,tensorop,f16,128,128,32,2,2,2,1,16,8,8,75,1024,855638016,2955071717376,3453,73.7104,10.8109,40090.3
1,CUTLASS,gemm,cutlass_tensorop_h1688gemm_128x128_32x2_tn_align1,incorrect,success,universal,serial,8192,8192,22016,f16:row,f16:column,f16:column,1,0,1,1,tensorop,f16,128,128,32,2,2,2,1,16,8,8,75,1024,855638016,2955071717376,3453,53.7237,14.8328,55005
1,CUTLASS,gemm,cutlass_tensorop_h1688gemm_64x256_32x2_tn_align8,incorrect,success,universal,serial,8192,8192,22016,f16:row,f16:column,f16:column,1,0,1,1,tensorop,f16,64,256,32,2,1,4,1,16,8,8,75,1024,855638016,2955071717376,3453,87.2446,9.1338,33871.1
1,CUTLASS,gemm,cutlass_tensorop_h1688gemm_64x256_32x2_tn_align4,incorrect,success,universal,serial,8192,8192,22016,f16:row,f16:column,f16:column,1,0,1,1,tensorop,f16,64,256,32,2,1,4,1,16,8,8,75,1024,855638016,2955071717376,3453,84.2397,9.45962,35079.3
1,CUTLASS,gemm,cutlass_tensorop_h1688gemm_64x256_32x2_tn_align2,incorrect,success,universal,serial,8192,8192,22016,f16:row,f16:column,f16:column,1,0,1,1,tensorop,f16,64,256,32,2,1,4,1,16,8,8,75,1024,855638016,2955071717376,3453,88.9995,8.9537,33203.2
1,CUTLASS,gemm,cutlass_tensorop_h1688gemm_64x256_32x2_tn_align1,incorrect,success,universal,serial,8192,8192,22016,f16:row,f16:column,f16:column,1,0,1,1,tensorop,f16,64,256,32,2,1,4,1,16,8,8,75,1024,855638016,2955071717376,3453,84.3386,9.44852,35038.2
1,CUTLASS,gemm,cutlass_tensorop_h1688gemm_256x64_32x2_tn_align8,incorrect,success,universal,serial,8192,8192,22016,f16:row,f16:column,f16:column,1,0,1,1,tensorop,f16,256,64,32,2,4,1,1,16,8,8,75,1024,855638016,2955071717376,3453,72.771,10.9505,40607.8
1,CUTLASS,gemm,cutlass_tensorop_h1688gemm_256x64_32x2_tn_align4,incorrect,success,universal,serial,8192,8192,22016,f16:row,f16:column,f16:column,1,0,1,1,tensorop,f16,256,64,32,2,4,1,1,16,8,8,75,1024,855638016,2955071717376,3453,49.1672,16.2075,60102.6
1,CUTLASS,gemm,cutlass_tensorop_h1688gemm_256x64_32x2_tn_align2,incorrect,success,universal,serial,8192,8192,22016,f16:row,f16:column,f16:column,1,0,1,1,tensorop,f16,256,64,32,2,4,1,1,16,8,8,75,1024,855638016,2955071717376,3453,63.4061,12.5678,46605.5
1,CUTLASS,gemm,cutlass_tensorop_h1688gemm_256x64_32x2_tn_align1,incorrect,success,universal,serial,8192,8192,22016,f16:row,f16:column,f16:column,1,0,1,1,tensorop,f16,256,64,32,2,4,1,1,16,8,8,75,1024,855638016,2955071717376,3453,61.024,13.0584,48424.8
1,CUTLASS,gemm,cutlass_tensorop_h1688gemm_64x128_32x2_tn_align8,incorrect,success,universal,serial,8192,8192,22016,f16:row,f16:column,f16:column,1,0,1,1,tensorop,f16,64,128,32,2,2,2,1,16,8,8,75,1024,855638016,2955071717376,3453,114.463,6.96184,25816.8
1,CUTLASS,gemm,cutlass_tensorop_h1688gemm_64x128_32x2_tn_align4,incorrect,success,universal,serial,8192,8192,22016,f16:row,f16:column,f16:column,1,0,1,1,tensorop,f16,64,128,32,2,2,2,1,16,8,8,75,1024,855638016,2955071717376,3453,111.775,7.12929,26437.7
1,CUTLASS,gemm,cutlass_tensorop_h1688gemm_64x128_32x2_tn_align2,incorrect,success,universal,serial,8192,8192,22016,f16:row,f16:column,f16:column,1,0,1,1,tensorop,f16,64,128,32,2,2,2,1,16,8,8,75,1024,855638016,2955071717376,3453,110.461,7.21409,26752.2
1,CUTLASS,gemm,cutlass_tensorop_h1688gemm_64x128_32x2_tn_align1,incorrect,success,universal,serial,8192,8192,22016,f16:row,f16:column,f16:column,1,0,1,1,tensorop,f16,64,128,32,2,2,2,1,16,8,8,75,1024,855638016,2955071717376,3453,99.9478,7.97291,29566.1
1,CUTLASS,gemm,cutlass_tensorop_h1688gemm_128x64_32x2_tn_align8,incorrect,success,universal,serial,8192,8192,22016,f16:row,f16:column,f16:column,1,0,1,1,tensorop,f16,128,64,32,2,2,2,1,16,8,8,75,1024,855638016,2955071717376,3453,106.752,7.46472,27681.6
1,CUTLASS,gemm,cutlass_tensorop_h1688gemm_128x64_32x2_tn_align4,incorrect,success,universal,serial,8192,8192,22016,f16:row,f16:column,f16:column,1,0,1,1,tensorop,f16,128,64,32,2,2,2,1,16,8,8,75,1024,855638016,2955071717376,3453,103.221,7.72012,28628.7
1,CUTLASS,gemm,cutlass_tensorop_h1688gemm_128x64_32x2_tn_align2,incorrect,success,universal,serial,8192,8192,22016,f16:row,f16:column,f16:column,1,0,1,1,tensorop,f16,128,64,32,2,2,2,1,16,8,8,75,1024,855638016,2955071717376,3453,97.7035,8.15605,30245.3
1,CUTLASS,gemm,cutlass_tensorop_h1688gemm_128x64_32x2_tn_align1,incorrect,success,universal,serial,8192,8192,22016,f16:row,f16:column,f16:column,1,0,1,1,tensorop,f16,128,64,32,2,2,2,1,16,8,8,75,1024,855638016,2955071717376,3453,74.8769,10.6425,39465.7
1,CUTLASS,gemm,cutlass_tensorop_h1688gemm_64x64_32x2_tn_align8,incorrect,success,universal,serial,8192,8192,22016,f16:row,f16:column,f16:column,1,0,1,1,tensorop,f16,64,64,32,2,2,2,1,16,8,8,75,1024,855638016,2955071717376,3453,125.404,6.35444,23564.3
1,CUTLASS,gemm,cutlass_tensorop_h1688gemm_64x64_32x2_tn_align4,incorrect,success,universal,serial,8192,8192,22016,f16:row,f16:column,f16:column,1,0,1,1,tensorop,f16,64,64,32,2,2,2,1,16,8,8,75,1024,855638016,2955071717376,3453,123.372,6.45911,23952.5
1,CUTLASS,gemm,cutlass_tensorop_h1688gemm_64x64_32x2_tn_align2,incorrect,success,universal,serial,8192,8192,22016,f16:row,f16:column,f16:column,1,0,1,1,tensorop,f16,64,64,32,2,2,2,1,16,8,8,75,1024,855638016,2955071717376,3453,119.113,6.69007,24809
1,CUTLASS,gemm,cutlass_tensorop_h1688gemm_64x64_32x2_tn_align1,incorrect,success,universal,serial,8192,8192,22016,f16:row,f16:column,f16:column,1,0,1,1,tensorop,f16,64,64,32,2,2,2,1,16,8,8,75,1024,855638016,2955071717376,3453,118.217,6.74076,24996.9
1,CUTLASS,gemm,cutlass_tensorop_h1688gemm_64x128_64x2_tn_align8,incorrect,success,universal,serial,8192,8192,22016,f16:row,f16:column,f16:column,1,0,1,1,tensorop,f16,64,128,64,2,1,2,2,16,8,8,75,1024,855638016,2955071717376,3453,58.1988,13.6923,50775.4
1,CUTLASS,gemm,cutlass_tensorop_h1688gemm_64x128_64x2_tn_align4,incorrect,success,universal,serial,8192,8192,22016,f16:row,f16:column,f16:column,1,0,1,1,tensorop,f16,64,128,64,2,1,2,2,16,8,8,75,1024,855638016,2955071717376,3453,56.5318,14.0961,52272.8
1,CUTLASS,gemm,cutlass_tensorop_h1688gemm_64x128_64x2_tn_align2,incorrect,success,universal,serial,8192,8192,22016,f16:row,f16:column,f16:column,1,0,1,1,tensorop,f16,64,128,64,2,1,2,2,16,8,8,75,1024,855638016,2955071717376,3453,51.3536,15.5174,57543.6
1,CUTLASS,gemm,cutlass_tensorop_h1688gemm_64x128_64x2_tn_align1,incorrect,success,universal,serial,8192,8192,22016,f16:row,f16:column,f16:column,1,0,1,1,tensorop,f16,64,128,64,2,1,2,2,16,8,8,75,1024,855638016,2955071717376,3453,43.625,18.2665,67738.1
1,CUTLASS,gemm,cutlass_tensorop_h1688gemm_256x128_32x2_tt_align8,incorrect,success,universal,serial,8192,8192,22016,f16:row,f16:row,f16:column,1,0,1,1,tensorop,f16,256,128,32,2,4,2,1,16,8,8,75,1024,855638016,2955071717376,3453,24.0522,33.131,122861
1,CUTLASS,gemm,cutlass_tensorop_h1688gemm_256x128_32x2_tt_align4,incorrect,success,universal,serial,8192,8192,22016,f16:row,f16:row,f16:column,1,0,1,1,tensorop,f16,256,128,32,2,4,2,1,16,8,8,75,1024,855638016,2955071717376,3453,24.3901,32.672,121158
1,CUTLASS,gemm,cutlass_tensorop_h1688gemm_256x128_32x2_tt_align2,incorrect,success,universal,serial,8192,8192,22016,f16:row,f16:row,f16:column,1,0,1,1,tensorop,f16,256,128,32,2,4,2,1,16,8,8,75,1024,855638016,2955071717376,3453,29.2156,27.2756,101147
1,CUTLASS,gemm,cutlass_tensorop_h1688gemm_256x128_32x2_tt_align1,incorrect,success,universal,serial,8192,8192,22016,f16:row,f16:row,f16:column,1,0,1,1,tensorop,f16,256,128,32,2,4,2,1,16,8,8,75,1024,855638016,2955071717376,3453,38.4781,20.7098,76798.7
1,CUTLASS,gemm,cutlass_tensorop_h1688gemm_128x256_32x2_tt_align8,incorrect,success,universal,serial,8192,8192,22016,f16:row,f16:row,f16:column,1,0,1,1,tensorop,f16,128,256,32,2,2,4,1,16,8,8,75,1024,855638016,2955071717376,3453,22.8977,34.8016,129056
1,CUTLASS,gemm,cutlass_tensorop_h1688gemm_128x256_32x2_tt_align4,incorrect,success,universal,serial,8192,8192,22016,f16:row,f16:row,f16:column,1,0,1,1,tensorop,f16,128,256,32,2,2,4,1,16,8,8,75,1024,855638016,2955071717376,3453,27.1002,29.4048,109043
1,CUTLASS,gemm,cutlass_tensorop_h1688gemm_128x256_32x2_tt_align2,incorrect,success,universal,serial,8192,8192,22016,f16:row,f16:row,f16:column,1,0,1,1,tensorop,f16,128,256,32,2,2,4,1,16,8,8,75,1024,855638016,2955071717376,3453,31.9921,24.9085,92368.8
1,CUTLASS,gemm,cutlass_tensorop_h1688gemm_128x256_32x2_tt_align1,incorrect,success,universal,serial,8192,8192,22016,f16:row,f16:row,f16:column,1,0,1,1,tensorop,f16,128,256,32,2,2,4,1,16,8,8,75,1024,855638016,2955071717376,3453,42.4659,18.7651,69586.9
1,CUTLASS,gemm,cutlass_tensorop_h1688gemm_128x128_32x2_tt_align8,incorrect,success,universal,serial,8192,8192,22016,f16:row,f16:row,f16:column,1,0,1,1,tensorop,f16,128,128,32,2,2,2,1,16,8,8,75,1024,855638016,2955071717376,3453,48.4504,16.4472,60991.7
1,CUTLASS,gemm,cutlass_tensorop_h1688gemm_128x128_32x2_tt_align4,incorrect,success,universal,serial,8192,8192,22016,f16:row,f16:row,f16:column,1,0,1,1,tensorop,f16,128,128,32,2,2,2,1,16,8,8,75,1024,855638016,2955071717376,3453,35.4466,22.481,83366.9
1,CUTLASS,gemm,cutlass_tensorop_h1688gemm_128x128_32x2_tt_align2,incorrect,success,universal,serial,8192,8192,22016,f16:row,f16:row,f16:column,1,0,1,1,tensorop,f16,128,128,32,2,2,2,1,16,8,8,75,1024,855638016,2955071717376,3453,37.7098,21.1318,78363.4
1,CUTLASS,gemm,cutlass_tensorop_h1688gemm_128x128_32x2_tt_align1,incorrect,success,universal,serial,8192,8192,22016,f16:row,f16:row,f16:column,1,0,1,1,tensorop,f16,128,128,32,2,2,2,1,16,8,8,75,1024,855638016,2955071717376,3453,43.0887,18.4938,68581.1
1,CUTLASS,gemm,cutlass_tensorop_h1688gemm_64x256_32x2_tt_align8,incorrect,success,universal,serial,8192,8192,22016,f16:row,f16:row,f16:column,1,0,1,1,tensorop,f16,64,256,32,2,1,4,1,16,8,8,75,1024,855638016,2955071717376,3453,74.0102,10.7671,39927.9
1,CUTLASS,gemm,cutlass_tensorop_h1688gemm_64x256_32x2_tt_align4,incorrect,success,universal,serial,8192,8192,22016,f16:row,f16:row,f16:column,1,0,1,1,tensorop,f16,64,256,32,2,1,4,1,16,8,8,75,1024,855638016,2955071717376,3453,70.5433,11.2963,41890.2
1,CUTLASS,gemm,cutlass_tensorop_h1688gemm_64x256_32x2_tt_align2,incorrect,success,universal,serial,8192,8192,22016,f16:row,f16:row,f16:column,1,0,1,1,tensorop,f16,64,256,32,2,1,4,1,16,8,8,75,1024,855638016,2955071717376,3453,54.8887,14.518,53837.6
1,CUTLASS,gemm,cutlass_tensorop_h1688gemm_64x256_32x2_tt_align1,incorrect,success,universal,serial,8192,8192,22016,f16:row,f16:row,f16:column,1,0,1,1,tensorop,f16,64,256,32,2,1,4,1,16,8,8,75,1024,855638016,2955071717376,3453,54.8709,14.5227,53855
1,CUTLASS,gemm,cutlass_tensorop_h1688gemm_256x64_32x2_tt_align8,incorrect,success,universal,serial,8192,8192,22016,f16:row,f16:row,f16:column,1,0,1,1,tensorop,f16,256,64,32,2,4,1,1,16,8,8,75,1024,855638016,2955071717376,3453,30.0582,26.5111,98311.7
1,CUTLASS,gemm,cutlass_tensorop_h1688gemm_256x64_32x2_tt_align4,incorrect,success,universal,serial,8192,8192,22016,f16:row,f16:row,f16:column,1,0,1,1,tensorop,f16,256,64,32,2,4,1,1,16,8,8,75,1024,855638016,2955071717376,3453,32.6977,24.371,90375.7
1,CUTLASS,gemm,cutlass_tensorop_h1688gemm_256x64_32x2_tt_align2,incorrect,success,universal,serial,8192,8192,22016,f16:row,f16:row,f16:column,1,0,1,1,tensorop,f16,256,64,32,2,4,1,1,16,8,8,75,1024,855638016,2955071717376,3453,33.5067,23.7825,88193.4
1,CUTLASS,gemm,cutlass_tensorop_h1688gemm_256x64_32x2_tt_align1,incorrect,success,universal,serial,8192,8192,22016,f16:row,f16:row,f16:column,1,0,1,1,tensorop,f16,256,64,32,2,4,1,1,16,8,8,75,1024,855638016,2955071717376,3453,46.8154,17.0216,63121.7
1,CUTLASS,gemm,cutlass_tensorop_h1688gemm_64x128_32x2_tt_align8,incorrect,success,universal,serial,8192,8192,22016,f16:row,f16:row,f16:column,1,0,1,1,tensorop,f16,64,128,32,2,2,2,1,16,8,8,75,1024,855638016,2955071717376,3453,88.0367,9.05163,33566.4
1,CUTLASS,gemm,cutlass_tensorop_h1688gemm_64x128_32x2_tt_align4,incorrect,success,universal,serial,8192,8192,22016,f16:row,f16:row,f16:column,1,0,1,1,tensorop,f16,64,128,32,2,2,2,1,16,8,8,75,1024,855638016,2955071717376,3453,86.8126,9.17926,34039.7
1,CUTLASS,gemm,cutlass_tensorop_h1688gemm_64x128_32x2_tt_align2,incorrect,success,universal,serial,8192,8192,22016,f16:row,f16:row,f16:column,1,0,1,1,tensorop,f16,64,128,32,2,2,2,1,16,8,8,75,1024,855638016,2955071717376,3453,82.8528,9.61797,35666.5
1,CUTLASS,gemm,cutlass_tensorop_h1688gemm_64x128_32x2_tt_align1,incorrect,success,universal,serial,8192,8192,22016,f16:row,f16:row,f16:column,1,0,1,1,tensorop,f16,64,128,32,2,2,2,1,16,8,8,75,1024,855638016,2955071717376,3453,74.1174,10.7515,39870.1
1,CUTLASS,gemm,cutlass_tensorop_h1688gemm_128x64_32x2_tt_align8,incorrect,success,universal,serial,8192,8192,22016,f16:row,f16:row,f16:column,1,0,1,1,tensorop,f16,128,64,32,2,2,2,1,16,8,8,75,1024,855638016,2955071717376,3453,35.8532,22.226,82421.4
1,CUTLASS,gemm,cutlass_tensorop_h1688gemm_128x64_32x2_tt_align4,incorrect,success,universal,serial,8192,8192,22016,f16:row,f16:row,f16:column,1,0,1,1,tensorop,f16,128,64,32,2,2,2,1,16,8,8,75,1024,855638016,2955071717376,3453,40.5678,19.643,72842.8
1,CUTLASS,gemm,cutlass_tensorop_h1688gemm_128x64_32x2_tt_align2,incorrect,success,universal,serial,8192,8192,22016,f16:row,f16:row,f16:column,1,0,1,1,tensorop,f16,128,64,32,2,2,2,1,16,8,8,75,1024,855638016,2955071717376,3453,41.8152,19.057,70669.7
1,CUTLASS,gemm,cutlass_tensorop_h1688gemm_128x64_32x2_tt_align1,incorrect,success,universal,serial,8192,8192,22016,f16:row,f16:row,f16:column,1,0,1,1,tensorop,f16,128,64,32,2,2,2,1,16,8,8,75,1024,855638016,2955071717376,3453,56.3342,14.1455,52456.1
1,CUTLASS,gemm,cutlass_tensorop_h1688gemm_64x64_32x2_tt_align8,incorrect,success,universal,serial,8192,8192,22016,f16:row,f16:row,f16:column,1,0,1,1,tensorop,f16,64,64,32,2,2,2,1,16,8,8,75,1024,855638016,2955071717376,3453,46.6742,17.0731,63312.7
1,CUTLASS,gemm,cutlass_tensorop_h1688gemm_64x64_32x2_tt_align4,incorrect,success,universal,serial,8192,8192,22016,f16:row,f16:row,f16:column,1,0,1,1,tensorop,f16,64,64,32,2,2,2,1,16,8,8,75,1024,855638016,2955071717376,3453,81.3625,9.79413,36319.8
1,CUTLASS,gemm,cutlass_tensorop_h1688gemm_64x64_32x2_tt_align2,incorrect,success,universal,serial,8192,8192,22016,f16:row,f16:row,f16:column,1,0,1,1,tensorop,f16,64,64,32,2,2,2,1,16,8,8,75,1024,855638016,2955071717376,3453,66.0564,12.0636,44735.6
1,CUTLASS,gemm,cutlass_tensorop_h1688gemm_64x64_32x2_tt_align1,incorrect,success,universal,serial,8192,8192,22016,f16:row,f16:row,f16:column,1,0,1,1,tensorop,f16,64,64,32,2,2,2,1,16,8,8,75,1024,855638016,2955071717376,3453,81.7504,9.74766,36147.5
1,CUTLASS,gemm,cutlass_tensorop_h1688gemm_64x128_64x2_tt_align8,incorrect,success,universal,serial,8192,8192,22016,f16:row,f16:row,f16:column,1,0,1,1,tensorop,f16,64,128,64,2,1,2,2,16,8,8,75,1024,855638016,2955071717376,3453,58.7033,13.5746,50339.1
1,CUTLASS,gemm,cutlass_tensorop_h1688gemm_64x128_64x2_tt_align4,incorrect,success,universal,serial,8192,8192,22016,f16:row,f16:row,f16:column,1,0,1,1,tensorop,f16,64,128,64,2,1,2,2,16,8,8,75,1024,855638016,2955071717376,3453,56.9797,13.9853,51861.9
1,CUTLASS,gemm,cutlass_tensorop_h1688gemm_64x128_64x2_tt_align2,incorrect,success,universal,serial,8192,8192,22016,f16:row,f16:row,f16:column,1,0,1,1,tensorop,f16,64,128,64,2,1,2,2,16,8,8,75,1024,855638016,2955071717376,3453,46.5832,17.1065,63436.4
1,CUTLASS,gemm,cutlass_tensorop_h1688gemm_64x128_64x2_tt_align1,incorrect,success,universal,serial,8192,8192,22016,f16:row,f16:row,f16:column,1,0,1,1,tensorop,f16,64,128,64,2,1,2,2,16,8,8,75,1024,855638016,2955071717376,3453,43.7796,18.202,67498.9
1,CUTLASS,gemm,cutlass_tensorop_h16816gemm_256x128_32x3_nn_align8,incorrect,success,universal,serial,8192,8192,22016,f16:column,f16:column,f16:column,1,0,1,1,tensorop,f16,256,128,32,3,4,2,1,16,8,16,80,1024,855638016,2955071717376,3453,21.4003,37.2367,138086
1,CUTLASS,gemm,cutlass_tensorop_h16816gemm_256x128_32x3_nn_align4,incorrect,success,universal,serial,8192,8192,22016,f16:column,f16:column,f16:column,1,0,1,1,tensorop,f16,256,128,32,3,4,2,1,16,8,16,80,1024,855638016,2955071717376,3453,22.3088,35.7203,132462
1,CUTLASS,gemm,cutlass_tensorop_h16816gemm_256x128_32x3_nn_align2,incorrect,success,universal,serial,8192,8192,22016,f16:column,f16:column,f16:column,1,0,1,1,tensorop,f16,256,128,32,3,4,2,1,16,8,16,80,1024,855638016,2955071717376,3453,24.3874,32.6757,121172
1,CUTLASS,gemm,cutlass_tensorop_h16816gemm_128x256_32x3_nn_align8,incorrect,success,universal,serial,8192,8192,22016,f16:column,f16:column,f16:column,1,0,1,1,tensorop,f16,128,256,32,3,2,4,1,16,8,16,80,1024,855638016,2955071717376,3453,21.245,37.5088,139095
1,CUTLASS,gemm,cutlass_tensorop_h16816gemm_128x256_32x3_nn_align4,incorrect,success,universal,serial,8192,8192,22016,f16:column,f16:column,f16:column,1,0,1,1,tensorop,f16,128,256,32,3,2,4,1,16,8,16,80,1024,855638016,2955071717376,3453,22.0538,36.1333,133994
1,CUTLASS,gemm,cutlass_tensorop_h16816gemm_128x256_32x3_nn_align2,incorrect,success,universal,serial,8192,8192,22016,f16:column,f16:column,f16:column,1,0,1,1,tensorop,f16,128,256,32,3,2,4,1,16,8,16,80,1024,855638016,2955071717376,3453,22.8972,34.8024,129058
1,CUTLASS,gemm,cutlass_tensorop_h16816gemm_256x64_32x3_nn_align8,incorrect,success,universal,serial,8192,8192,22016,f16:column,f16:column,f16:column,1,0,1,1,tensorop,f16,256,64,32,3,4,1,1,16,8,16,80,1024,855638016,2955071717376,3453,28.312,28.1462,104375
1,CUTLASS,gemm,cutlass_tensorop_h16816gemm_256x64_32x3_nn_align4,incorrect,success,universal,serial,8192,8192,22016,f16:column,f16:column,f16:column,1,0,1,1,tensorop,f16,256,64,32,3,4,1,1,16,8,16,80,1024,855638016,2955071717376,3453,29.9202,26.6334,98765.3
1,CUTLASS,gemm,cutlass_tensorop_h16816gemm_256x64_32x3_nn_align2,incorrect,success,universal,serial,8192,8192,22016,f16:column,f16:column,f16:column,1,0,1,1,tensorop,f16,256,64,32,3,4,1,1,16,8,16,80,1024,855638016,2955071717376,3453,64.1337,12.4252,46076.7
1,CUTLASS,gemm,cutlass_tensorop_h16816gemm_256x64_32x4_nn_align8,incorrect,success,universal,serial,8192,8192,22016,f16:column,f16:column,f16:column,1,0,1,1,tensorop,f16,256,64,32,4,4,1,1,16,8,16,80,1024,855638016,2955071717376,3453,28.3615,28.097,104193
1,CUTLASS,gemm,cutlass_tensorop_h16816gemm_256x64_32x4_nn_align4,incorrect,success,universal,serial,8192,8192,22016,f16:column,f16:column,f16:column,1,0,1,1,tensorop,f16,256,64,32,4,4,1,1,16,8,16,80,1024,855638016,2955071717376,3453,34.3071,23.2277,86135.9
1,CUTLASS,gemm,cutlass_tensorop_h16816gemm_256x64_32x4_nn_align2,incorrect,success,universal,serial,8192,8192,22016,f16:column,f16:column,f16:column,1,0,1,1,tensorop,f16,256,64,32,4,4,1,1,16,8,16,80,1024,855638016,2955071717376,3453,55.9751,14.2362,52792.6
1,CUTLASS,gemm,cutlass_tensorop_h16816gemm_64x256_32x4_nn_align8,incorrect,success,universal,serial,8192,8192,22016,f16:column,f16:column,f16:column,1,0,1,1,tensorop,f16,64,256,32,4,1,4,1,16,8,16,80,1024,855638016,2955071717376,3453,35.3787,22.5242,83526.9
1,CUTLASS,gemm,cutlass_tensorop_h16816gemm_64x256_32x4_nn_align4,incorrect,success,universal,serial,8192,8192,22016,f16:column,f16:column,f16:column,1,0,1,1,tensorop,f16,64,256,32,4,1,4,1,16,8,16,80,1024,855638016,2955071717376,3453,30.6096,26.0335,96540.6
1,CUTLASS,gemm,cutlass_tensorop_h16816gemm_64x256_32x4_nn_align2,incorrect,success,universal,serial,8192,8192,22016,f16:column,f16:column,f16:column,1,0,1,1,tensorop,f16,64,256,32,4,1,4,1,16,8,16,80,1024,855638016,2955071717376,3453,40.9758,19.4475,72117.5
1,CUTLASS,gemm,cutlass_tensorop_h16816gemm_128x128_32x3_nn_align8,incorrect,success,universal,serial,8192,8192,22016,f16:column,f16:column,f16:column,1,0,1,1,tensorop,f16,128,128,32,3,2,2,1,16,8,16,80,1024,855638016,2955071717376,3453,24.0756,33.0989,122742
1,CUTLASS,gemm,cutlass_tensorop_h16816gemm_128x128_32x3_nn_align4,incorrect,success,universal,serial,8192,8192,22016,f16:column,f16:column,f16:column,1,0,1,1,tensorop,f16,128,128,32,3,2,2,1,16,8,16,80,1024,855638016,2955071717376,3453,35.8539,22.2256,82419.8
1,CUTLASS,gemm,cutlass_tensorop_h16816gemm_128x128_32x3_nn_align2,incorrect,success,universal,serial,8192,8192,22016,f16:column,f16:column,f16:column,1,0,1,1,tensorop,f16,128,128,32,3,2,2,1,16,8,16,80,1024,855638016,2955071717376,3453,29.0336,27.4467,101781
1,CUTLASS,gemm,cutlass_tensorop_h16816gemm_128x128_32x4_nn_align8,incorrect,success,universal,serial,8192,8192,22016,f16:column,f16:column,f16:column,1,0,1,1,tensorop,f16,128,128,32,4,2,2,1,16,8,16,80,1024,855638016,2955071717376,3453,22.3407,35.6692,132273
1,CUTLASS,gemm,cutlass_tensorop_h16816gemm_128x128_32x4_nn_align4,incorrect,success,universal,serial,8192,8192,22016,f16:column,f16:column,f16:column,1,0,1,1,tensorop,f16,128,128,32,4,2,2,1,16,8,16,80,1024,855638016,2955071717376,3453,25.5022,31.2473,115875
1,CUTLASS,gemm,cutlass_tensorop_h16816gemm_128x128_32x4_nn_align2,incorrect,success,universal,serial,8192,8192,22016,f16:column,f16:column,f16:column,1,0,1,1,tensorop,f16,128,128,32,4,2,2,1,16,8,16,80,1024,855638016,2955071717376,3453,28.2489,28.2091,104608
1,CUTLASS,gemm,cutlass_tensorop_h16816gemm_128x128_32x5_nn_align8,incorrect,success,universal,serial,8192,8192,22016,f16:column,f16:column,f16:column,1,0,1,1,tensorop,f16,128,128,32,5,2,2,1,16,8,16,80,1024,855638016,2955071717376,3453,22.3404,35.6697,132275
1,CUTLASS,gemm,cutlass_tensorop_h16816gemm_128x128_32x5_nn_align4,incorrect,success,universal,serial,8192,8192,22016,f16:column,f16:column,f16:column,1,0,1,1,tensorop,f16,128,128,32,5,2,2,1,16,8,16,80,1024,855638016,2955071717376,3453,25.0128,31.8586,118142
1,CUTLASS,gemm,cutlass_tensorop_h16816gemm_128x128_32x5_nn_align2,incorrect,success,universal,serial,8192,8192,22016,f16:column,f16:column,f16:column,1,0,1,1,tensorop,f16,128,128,32,5,2,2,1,16,8,16,80,1024,855638016,2955071717376,3453,28.8949,27.5784,102270
1,CUTLASS,gemm,cutlass_tensorop_h16816gemm_128x64_32x6_nn_align8,incorrect,success,universal,serial,8192,8192,22016,f16:column,f16:column,f16:column,1,0,1,1,tensorop,f16,128,64,32,6,2,2,1,16,8,16,80,1024,855638016,2955071717376,3453,43.307,18.4006,68235.4
1,CUTLASS,gemm,cutlass_tensorop_h16816gemm_128x64_32x6_nn_align4,incorrect,success,universal,serial,8192,8192,22016,f16:column,f16:column,f16:column,1,0,1,1,tensorop,f16,128,64,32,6,2,2,1,16,8,16,80,1024,855638016,2955071717376,3453,34.9636,22.7916,84518.6
1,CUTLASS,gemm,cutlass_tensorop_h16816gemm_128x64_32x6_nn_align2,incorrect,success,universal,serial,8192,8192,22016,f16:column,f16:column,f16:column,1,0,1,1,tensorop,f16,128,64,32,6,2,2,1,16,8,16,80,1024,855638016,2955071717376,3453,43.8891,18.1566,67330.5
1,CUTLASS,gemm,cutlass_tensorop_h16816gemm_64x128_32x6_nn_align8,incorrect,success,universal,serial,8192,8192,22016,f16:column,f16:column,f16:column,1,0,1,1,tensorop,f16,64,128,32,6,2,2,1,16,8,16,80,1024,855638016,2955071717376,3453,60.8552,13.0946,48559.1
1,CUTLASS,gemm,cutlass_tensorop_h16816gemm_64x128_32x6_nn_align4,incorrect,success,universal,serial,8192,8192,22016,f16:column,f16:column,f16:column,1,0,1,1,tensorop,f16,64,128,32,6,2,2,1,16,8,16,80,1024,855638016,2955071717376,3453,35.4919,22.4523,83260.4
1,CUTLASS,gemm,cutlass_tensorop_h16816gemm_64x128_32x6_nn_align2,incorrect,success,universal,serial,8192,8192,22016,f16:column,f16:column,f16:column,1,0,1,1,tensorop,f16,64,128,32,6,2,2,1,16,8,16,80,1024,855638016,2955071717376,3453,40.6878,19.5851,72627.9
1,CUTLASS,gemm,cutlass_tensorop_h16816gemm_64x64_32x10_nn_align8,incorrect,success,universal,serial,8192,8192,22016,f16:column,f16:column,f16:column,1,0,1,1,tensorop,f16,64,64,32,10,2,2,1,16,8,16,80,1024,855638016,2955071717376,3453,69.6664,11.4384,42417.5
1,CUTLASS,gemm,cutlass_tensorop_h16816gemm_64x64_32x10_nn_align4,incorrect,success,universal,serial,8192,8192,22016,f16:column,f16:column,f16:column,1,0,1,1,tensorop,f16,64,64,32,10,2,2,1,16,8,16,80,1024,855638016,2955071717376,3453,46.6798,17.0711,63305.2
1,CUTLASS,gemm,cutlass_tensorop_h16816gemm_64x64_32x10_nn_align2,incorrect,success,universal,serial,8192,8192,22016,f16:column,f16:column,f16:column,1,0,1,1,tensorop,f16,64,64,32,10,2,2,1,16,8,16,80,1024,855638016,2955071717376,3453,56.5685,14.0869,52238.8
1,CUTLASS,gemm,cutlass_tensorop_h16816gemm_128x64_64x3_nn_align8,incorrect,success,universal,serial,8192,8192,22016,f16:column,f16:column,f16:column,1,0,1,1,tensorop,f16,128,64,64,3,2,2,1,16,8,16,80,1024,855638016,2955071717376,3453,33.3673,23.8819,88561.8
1,CUTLASS,gemm,cutlass_tensorop_h16816gemm_128x64_64x3_nn_align4,incorrect,success,universal,serial,8192,8192,22016,f16:column,f16:column,f16:column,1,0,1,1,tensorop,f16,128,64,64,3,2,2,1,16,8,16,80,1024,855638016,2955071717376,3453,34.3614,23.191,85999.6
1,CUTLASS,gemm,cutlass_tensorop_h16816gemm_128x64_64x3_nn_align2,incorrect,success,universal,serial,8192,8192,22016,f16:column,f16:column,f16:column,1,0,1,1,tensorop,f16,128,64,64,3,2,2,1,16,8,16,80,1024,855638016,2955071717376,3453,46.0752,17.2951,64135.9
1,CUTLASS,gemm,cutlass_tensorop_h16816gemm_64x128_64x3_nn_align8,incorrect,success,universal,serial,8192,8192,22016,f16:column,f16:column,f16:column,1,0,1,1,tensorop,f16,64,128,64,3,2,2,1,16,8,16,80,1024,855638016,2955071717376,3453,34.0183,23.4249,86867.1
1,CUTLASS,gemm,cutlass_tensorop_h16816gemm_64x128_64x3_nn_align4,incorrect,success,universal,serial,8192,8192,22016,f16:column,f16:column,f16:column,1,0,1,1,tensorop,f16,64,128,64,3,2,2,1,16,8,16,80,1024,855638016,2955071717376,3453,34.8978,22.8345,84677.8
1,CUTLASS,gemm,cutlass_tensorop_h16816gemm_64x128_64x3_nn_align2,incorrect,success,universal,serial,8192,8192,22016,f16:column,f16:column,f16:column,1,0,1,1,tensorop,f16,64,128,64,3,2,2,1,16,8,16,80,1024,855638016,2955071717376,3453,44.4283,17.9362,66513.3
1,CUTLASS,gemm,cutlass_tensorop_h16816gemm_64x64_64x5_nn_align8,incorrect,success,universal,serial,8192,8192,22016,f16:column,f16:column,f16:column,1,0,1,1,tensorop,f16,64,64,64,5,2,2,1,16,8,16,80,1024,855638016,2955071717376,3453,68.1402,11.6946,43367.5
1,CUTLASS,gemm,cutlass_tensorop_h16816gemm_64x64_64x5_nn_align4,incorrect,success,universal,serial,8192,8192,22016,f16:column,f16:column,f16:column,1,0,1,1,tensorop,f16,64,64,64,5,2,2,1,16,8,16,80,1024,855638016,2955071717376,3453,44.6309,17.8548,66211.3
1,CUTLASS,gemm,cutlass_tensorop_h16816gemm_64x64_64x5_nn_align2,incorrect,success,universal,serial,8192,8192,22016,f16:column,f16:column,f16:column,1,0,1,1,tensorop,f16,64,64,64,5,2,2,1,16,8,16,80,1024,855638016,2955071717376,3453,48.0841,16.5725,61456.4
1,CUTLASS,gemm,cutlass_tensorop_h16816gemm_256x128_32x3_nt_align8,incorrect,success,universal,serial,8192,8192,22016,f16:column,f16:row,f16:column,1,0,1,1,tensorop,f16,256,128,32,3,4,2,1,16,8,16,80,1024,855638016,2955071717376,3453,21.2747,37.4564,138900
1,CUTLASS,gemm,cutlass_tensorop_h16816gemm_256x128_32x3_nt_align4,incorrect,success,universal,serial,8192,8192,22016,f16:column,f16:row,f16:column,1,0,1,1,tensorop,f16,256,128,32,3,4,2,1,16,8,16,80,1024,855638016,2955071717376,3453,21.9874,36.2423,134398
1,CUTLASS,gemm,cutlass_tensorop_h16816gemm_256x128_32x3_nt_align2,incorrect,success,universal,serial,8192,8192,22016,f16:column,f16:row,f16:column,1,0,1,1,tensorop,f16,256,128,32,3,4,2,1,16,8,16,80,1024,855638016,2955071717376,3453,24.0816,33.0906,122711
1,CUTLASS,gemm,cutlass_tensorop_h16816gemm_128x256_32x3_nt_align8,incorrect,success,universal,serial,8192,8192,22016,f16:column,f16:row,f16:column,1,0,1,1,tensorop,f16,128,256,32,3,2,4,1,16,8,16,80,1024,855638016,2955071717376,3453,21.0772,37.8075,140202
1,CUTLASS,gemm,cutlass_tensorop_h16816gemm_128x256_32x3_nt_align4,incorrect,success,universal,serial,8192,8192,22016,f16:column,f16:row,f16:column,1,0,1,1,tensorop,f16,128,256,32,3,2,4,1,16,8,16,80,1024,855638016,2955071717376,3453,21.9189,36.3556,134818
1,CUTLASS,gemm,cutlass_tensorop_h16816gemm_128x256_32x3_nt_align2,incorrect,success,universal,serial,8192,8192,22016,f16:column,f16:row,f16:column,1,0,1,1,tensorop,f16,128,256,32,3,2,4,1,16,8,16,80,1024,855638016,2955071717376,3453,24.9967,31.8793,118219
1,CUTLASS,gemm,cutlass_tensorop_h16816gemm_256x64_32x3_nt_align8,incorrect,success,universal,serial,8192,8192,22016,f16:column,f16:row,f16:column,1,0,1,1,tensorop,f16,256,64,32,3,4,1,1,16,8,16,80,1024,855638016,2955071717376,3453,27.8894,28.5727,105957
1,CUTLASS,gemm,cutlass_tensorop_h16816gemm_256x64_32x3_nt_align4,incorrect,success,universal,serial,8192,8192,22016,f16:column,f16:row,f16:column,1,0,1,1,tensorop,f16,256,64,32,3,4,1,1,16,8,16,80,1024,855638016,2955071717376,3453,29.0344,27.4459,101778
1,CUTLASS,gemm,cutlass_tensorop_h16816gemm_256x64_32x3_nt_align2,incorrect,success,universal,serial,8192,8192,22016,f16:column,f16:row,f16:column,1,0,1,1,tensorop,f16,256,64,32,3,4,1,1,16,8,16,80,1024,855638016,2955071717376,3453,33.1656,24.0271,89100.5
1,CUTLASS,gemm,cutlass_tensorop_h16816gemm_256x64_32x4_nt_align8,incorrect,success,universal,serial,8192,8192,22016,f16:column,f16:row,f16:column,1,0,1,1,tensorop,f16,256,64,32,4,4,1,1,16,8,16,80,1024,855638016,2955071717376,3453,27.6552,28.8147,106854
1,CUTLASS,gemm,cutlass_tensorop_h16816gemm_256x64_32x4_nt_align4,incorrect,success,universal,serial,8192,8192,22016,f16:column,f16:row,f16:column,1,0,1,1,tensorop,f16,256,64,32,4,4,1,1,16,8,16,80,1024,855638016,2955071717376,3453,28.8133,27.6565,102559
1,CUTLASS,gemm,cutlass_tensorop_h16816gemm_256x64_32x4_nt_align2,incorrect,success,universal,serial,8192,8192,22016,f16:column,f16:row,f16:column,1,0,1,1,tensorop,f16,256,64,32,4,4,1,1,16,8,16,80,1024,855638016,2955071717376,3453,38.7729,20.5523,76214.8
1,CUTLASS,gemm,cutlass_tensorop_h16816gemm_64x256_32x4_nt_align8,incorrect,success,universal,serial,8192,8192,22016,f16:column,f16:row,f16:column,1,0,1,1,tensorop,f16,64,256,32,4,1,4,1,16,8,16,80,1024,855638016,2955071717376,3453,31.0998,25.6232,95019
1,CUTLASS,gemm,cutlass_tensorop_h16816gemm_64x256_32x4_nt_align4,incorrect,success,universal,serial,8192,8192,22016,f16:column,f16:row,f16:column,1,0,1,1,tensorop,f16,64,256,32,4,1,4,1,16,8,16,80,1024,855638016,2955071717376,3453,29.0625,27.4194,101680
1,CUTLASS,gemm,cutlass_tensorop_h16816gemm_64x256_32x4_nt_align2,incorrect,success,universal,serial,8192,8192,22016,f16:column,f16:row,f16:column,1,0,1,1,tensorop,f16,64,256,32,4,1,4,1,16,8,16,80,1024,855638016,2955071717376,3453,40.1889,19.8282,73529.5
1,CUTLASS,gemm,cutlass_tensorop_h16816gemm_128x128_32x3_nt_align8,incorrect,success,universal,serial,8192,8192,22016,f16:column,f16:row,f16:column,1,0,1,1,tensorop,f16,128,128,32,3,2,2,1,16,8,16,80,1024,855638016,2955071717376,3453,32.5049,24.5155,90911.5
1,CUTLASS,gemm,cutlass_tensorop_h16816gemm_128x128_32x3_nt_align4,incorrect,success,universal,serial,8192,8192,22016,f16:column,f16:row,f16:column,1,0,1,1,tensorop,f16,128,128,32,3,2,2,1,16,8,16,80,1024,855638016,2955071717376,3453,26.018,30.6278,113578
1,CUTLASS,gemm,cutlass_tensorop_h16816gemm_128x128_32x3_nt_align2,incorrect,success,universal,serial,8192,8192,22016,f16:column,f16:row,f16:column,1,0,1,1,tensorop,f16,128,128,32,3,2,2,1,16,8,16,80,1024,855638016,2955071717376,3453,24.984,31.8955,118279
1,CUTLASS,gemm,cutlass_tensorop_h16816gemm_128x128_32x4_nt_align8,incorrect,success,universal,serial,8192,8192,22016,f16:column,f16:row,f16:column,1,0,1,1,tensorop,f16,128,128,32,4,2,2,1,16,8,16,80,1024,855638016,2955071717376,3453,22.6239,35.2226,130617
1,CUTLASS,gemm,cutlass_tensorop_h16816gemm_128x128_32x4_nt_align4,incorrect,success,universal,serial,8192,8192,22016,f16:column,f16:row,f16:column,1,0,1,1,tensorop,f16,128,128,32,4,2,2,1,16,8,16,80,1024,855638016,2955071717376,3453,22.8285,34.907,129446
1,CUTLASS,gemm,cutlass_tensorop_h16816gemm_128x128_32x4_nt_align2,incorrect,success,universal,serial,8192,8192,22016,f16:column,f16:row,f16:column,1,0,1,1,tensorop,f16,128,128,32,4,2,2,1,16,8,16,80,1024,855638016,2955071717376,3453,26.3218,30.2743,112267
1,CUTLASS,gemm,cutlass_tensorop_h16816gemm_128x128_32x5_nt_align8,incorrect,success,universal,serial,8192,8192,22016,f16:column,f16:row,f16:column,1,0,1,1,tensorop,f16,128,128,32,5,2,2,1,16,8,16,80,1024,855638016,2955071717376,3453,22.1025,36.0536,133698
1,CUTLASS,gemm,cutlass_tensorop_h16816gemm_128x128_32x5_nt_align4,incorrect,success,universal,serial,8192,8192,22016,f16:column,f16:row,f16:column,1,0,1,1,tensorop,f16,128,128,32,5,2,2,1,16,8,16,80,1024,855638016,2955071717376,3453,22.8259,34.911,129461
1,CUTLASS,gemm,cutlass_tensorop_h16816gemm_128x128_32x5_nt_align2,incorrect,success,universal,serial,8192,8192,22016,f16:column,f16:row,f16:column,1,0,1,1,tensorop,f16,128,128,32,5,2,2,1,16,8,16,80,1024,855638016,2955071717376,3453,26.4956,30.0758,111531
1,CUTLASS,gemm,cutlass_tensorop_h16816gemm_128x64_32x6_nt_align8,incorrect,success,universal,serial,8192,8192,22016,f16:column,f16:row,f16:column,1,0,1,1,tensorop,f16,128,64,32,6,2,2,1,16,8,16,80,1024,855638016,2955071717376,3453,40.9712,19.4497,72125.7
1,CUTLASS,gemm,cutlass_tensorop_h16816gemm_128x64_32x6_nt_align4,incorrect,success,universal,serial,8192,8192,22016,f16:column,f16:row,f16:column,1,0,1,1,tensorop,f16,128,64,32,6,2,2,1,16,8,16,80,1024,855638016,2955071717376,3453,33.7662,23.5998,87515.7
1,CUTLASS,gemm,cutlass_tensorop_h16816gemm_128x64_32x6_nt_align2,incorrect,success,universal,serial,8192,8192,22016,f16:column,f16:row,f16:column,1,0,1,1,tensorop,f16,128,64,32,6,2,2,1,16,8,16,80,1024,855638016,2955071717376,3453,39.6648,20.0902,74501
1,CUTLASS,gemm,cutlass_tensorop_h16816gemm_64x128_32x6_nt_align8,incorrect,success,universal,serial,8192,8192,22016,f16:column,f16:row,f16:column,1,0,1,1,tensorop,f16,64,128,32,6,2,2,1,16,8,16,80,1024,855638016,2955071717376,3453,48.2116,16.5287,61293.8
1,CUTLASS,gemm,cutlass_tensorop_h16816gemm_64x128_32x6_nt_align4,incorrect,success,universal,serial,8192,8192,22016,f16:column,f16:row,f16:column,1,0,1,1,tensorop,f16,64,128,32,6,2,2,1,16,8,16,80,1024,855638016,2955071717376,3453,34.1258,23.3511,86593.4
1,CUTLASS,gemm,cutlass_tensorop_h16816gemm_64x128_32x6_nt_align2,incorrect,success,universal,serial,8192,8192,22016,f16:column,f16:row,f16:column,1,0,1,1,tensorop,f16,64,128,32,6,2,2,1,16,8,16,80,1024,855638016,2955071717376,3453,39.89,19.9768,74080.5
1,CUTLASS,gemm,cutlass_tensorop_h16816gemm_64x64_32x10_nt_align8,incorrect,success,universal,serial,8192,8192,22016,f16:column,f16:row,f16:column,1,0,1,1,tensorop,f16,64,64,32,10,2,2,1,16,8,16,80,1024,855638016,2955071717376,3453,67.0095,11.892,44099.3
1,CUTLASS,gemm,cutlass_tensorop_h16816gemm_64x64_32x10_nt_align4,incorrect,success,universal,serial,8192,8192,22016,f16:column,f16:row,f16:column,1,0,1,1,tensorop,f16,64,64,32,10,2,2,1,16,8,16,80,1024,855638016,2955071717376,3453,43.4844,18.3256,67957.1
1,CUTLASS,gemm,cutlass_tensorop_h16816gemm_64x64_32x10_nt_align2,incorrect,success,universal,serial,8192,8192,22016,f16:column,f16:row,f16:column,1,0,1,1,tensorop,f16,64,64,32,10,2,2,1,16,8,16,80,1024,855638016,2955071717376,3453,50.0539,15.9203,59037.7
1,CUTLASS,gemm,cutlass_tensorop_h16816gemm_128x64_64x3_nt_align8,incorrect,success,universal,serial,8192,8192,22016,f16:column,f16:row,f16:column,1,0,1,1,tensorop,f16,128,64,64,3,2,2,1,16,8,16,80,1024,855638016,2955071717376,3453,33.4195,23.8446,88423.7
1,CUTLASS,gemm,cutlass_tensorop_h16816gemm_128x64_64x3_nt_align4,incorrect,success,universal,serial,8192,8192,22016,f16:column,f16:row,f16:column,1,0,1,1,tensorop,f16,128,64,64,3,2,2,1,16,8,16,80,1024,855638016,2955071717376,3453,34.5674,23.0528,85487.3
1,CUTLASS,gemm,cutlass_tensorop_h16816gemm_128x64_64x3_nt_align2,incorrect,success,universal,serial,8192,8192,22016,f16:column,f16:row,f16:column,1,0,1,1,tensorop,f16,128,64,64,3,2,2,1,16,8,16,80,1024,855638016,2955071717376,3453,47.9067,16.6339,61683.9
1,CUTLASS,gemm,cutlass_tensorop_h16816gemm_64x128_64x3_nt_align8,incorrect,success,universal,serial,8192,8192,22016,f16:column,f16:row,f16:column,1,0,1,1,tensorop,f16,64,128,64,3,2,2,1,16,8,16,80,1024,855638016,2955071717376,3453,33.6723,23.6656,87759.7
1,CUTLASS,gemm,cutlass_tensorop_h16816gemm_64x128_64x3_nt_align4,incorrect,success,universal,serial,8192,8192,22016,f16:column,f16:row,f16:column,1,0,1,1,tensorop,f16,64,128,64,3,2,2,1,16,8,16,80,1024,855638016,2955071717376,3453,34.6118,23.0232,85377.5
1,CUTLASS,gemm,cutlass_tensorop_h16816gemm_64x128_64x3_nt_align2,incorrect,success,universal,serial,8192,8192,22016,f16:column,f16:row,f16:column,1,0,1,1,tensorop,f16,64,128,64,3,2,2,1,16,8,16,80,1024,855638016,2955071717376,3453,49.2218,16.1895,60035.8
1,CUTLASS,gemm,cutlass_tensorop_h16816gemm_64x64_64x5_nt_align8,incorrect,success,universal,serial,8192,8192,22016,f16:column,f16:row,f16:column,1,0,1,1,tensorop,f16,64,64,64,5,2,2,1,16,8,16,80,1024,855638016,2955071717376,3453,63.5371,12.5419,46509.4
1,CUTLASS,gemm,cutlass_tensorop_h16816gemm_64x64_64x5_nt_align4,incorrect,success,universal,serial,8192,8192,22016,f16:column,f16:row,f16:column,1,0,1,1,tensorop,f16,64,64,64,5,2,2,1,16,8,16,80,1024,855638016,2955071717376,3453,44.1198,18.0616,66978.4
1,CUTLASS,gemm,cutlass_tensorop_h16816gemm_64x64_64x5_nt_align2,incorrect,success,universal,serial,8192,8192,22016,f16:column,f16:row,f16:column,1,0,1,1,tensorop,f16,64,64,64,5,2,2,1,16,8,16,80,1024,855638016,2955071717376,3453,47.8687,16.6471,61732.8
1,CUTLASS,gemm,cutlass_tensorop_h16816gemm_256x128_32x3_tn_align8,incorrect,success,universal,serial,8192,8192,22016,f16:row,f16:column,f16:column,1,0,1,1,tensorop,f16,256,128,32,3,4,2,1,16,8,16,80,1024,855638016,2955071717376,3453,21.5213,37.0273,137309
1,CUTLASS,gemm,cutlass_tensorop_h16816gemm_256x128_32x3_tn_align4,incorrect,success,universal,serial,8192,8192,22016,f16:row,f16:column,f16:column,1,0,1,1,tensorop,f16,256,128,32,3,4,2,1,16,8,16,80,1024,855638016,2955071717376,3453,22.6979,35.1079,130192
1,CUTLASS,gemm,cutlass_tensorop_h16816gemm_256x128_32x3_tn_align2,incorrect,success,universal,serial,8192,8192,22016,f16:row,f16:column,f16:column,1,0,1,1,tensorop,f16,256,128,32,3,4,2,1,16,8,16,80,1024,855638016,2955071717376,3453,27.6717,28.7975,106791
1,CUTLASS,gemm,cutlass_tensorop_h16816gemm_128x256_32x3_tn_align8,incorrect,success,universal,serial,8192,8192,22016,f16:row,f16:column,f16:column,1,0,1,1,tensorop,f16,128,256,32,3,2,4,1,16,8,16,80,1024,855638016,2955071717376,3453,21.6414,36.8217,136547
1,CUTLASS,gemm,cutlass_tensorop_h16816gemm_128x256_32x3_tn_align4,incorrect,success,universal,serial,8192,8192,22016,f16:row,f16:column,f16:column,1,0,1,1,tensorop,f16,128,256,32,3,2,4,1,16,8,16,80,1024,855638016,2955071717376,3453,22.6963,35.1103,130200
1,CUTLASS,gemm,cutlass_tensorop_h16816gemm_128x256_32x3_tn_align2,incorrect,success,universal,serial,8192,8192,22016,f16:row,f16:column,f16:column,1,0,1,1,tensorop,f16,128,256,32,3,2,4,1,16,8,16,80,1024,855638016,2955071717376,3453,28.4343,28.0251,103926
1,CUTLASS,gemm,cutlass_tensorop_h16816gemm_256x64_32x3_tn_align8,incorrect,success,universal,serial,8192,8192,22016,f16:row,f16:column,f16:column,1,0,1,1,tensorop,f16,256,64,32,3,4,1,1,16,8,16,80,1024,855638016,2955071717376,3453,29.42,27.0861,100444
1,CUTLASS,gemm,cutlass_tensorop_h16816gemm_256x64_32x3_tn_align4,incorrect,success,universal,serial,8192,8192,22016,f16:row,f16:column,f16:column,1,0,1,1,tensorop,f16,256,64,32,3,4,1,1,16,8,16,80,1024,855638016,2955071717376,3453,35.4804,22.4596,83287.5
1,CUTLASS,gemm,cutlass_tensorop_h16816gemm_256x64_32x3_tn_align2,incorrect,success,universal,serial,8192,8192,22016,f16:row,f16:column,f16:column,1,0,1,1,tensorop,f16,256,64,32,3,4,1,1,16,8,16,80,1024,855638016,2955071717376,3453,59.7697,13.3324,49441
1,CUTLASS,gemm,cutlass_tensorop_h16816gemm_256x64_32x4_tn_align8,incorrect,success,universal,serial,8192,8192,22016,f16:row,f16:column,f16:column,1,0,1,1,tensorop,f16,256,64,32,4,4,1,1,16,8,16,80,1024,855638016,2955071717376,3453,29.5053,27.0078,100154
1,CUTLASS,gemm,cutlass_tensorop_h16816gemm_256x64_32x4_tn_align4,incorrect,success,universal,serial,8192,8192,22016,f16:row,f16:column,f16:column,1,0,1,1,tensorop,f16,256,64,32,4,4,1,1,16,8,16,80,1024,855638016,2955071717376,3453,37.9526,20.9966,77862.1
1,CUTLASS,gemm,cutlass_tensorop_h16816gemm_256x64_32x4_tn_align2,incorrect,success,universal,serial,8192,8192,22016,f16:row,f16:column,f16:column,1,0,1,1,tensorop,f16,256,64,32,4,4,1,1,16,8,16,80,1024,855638016,2955071717376,3453,65.9521,12.0826,44806.4
1,CUTLASS,gemm,cutlass_tensorop_h16816gemm_64x256_32x4_tn_align8,incorrect,success,universal,serial,8192,8192,22016,f16:row,f16:column,f16:column,1,0,1,1,tensorop,f16,64,256,32,4,1,4,1,16,8,16,80,1024,855638016,2955071717376,3453,61.3547,12.988,48163.8
1,CUTLASS,gemm,cutlass_tensorop_h16816gemm_64x256_32x4_tn_align4,incorrect,success,universal,serial,8192,8192,22016,f16:row,f16:column,f16:column,1,0,1,1,tensorop,f16,64,256,32,4,1,4,1,16,8,16,80,1024,855638016,2955071717376,3453,60.5895,13.152,48772
1,CUTLASS,gemm,cutlass_tensorop_h16816gemm_64x256_32x4_tn_align2,incorrect,success,universal,serial,8192,8192,22016,f16:row,f16:column,f16:column,1,0,1,1,tensorop,f16,64,256,32,4,1,4,1,16,8,16,80,1024,855638016,2955071717376,3453,58.4139,13.6419,50588.5
1,CUTLASS,gemm,cutlass_tensorop_h16816gemm_128x128_32x3_tn_align8,incorrect,success,universal,serial,8192,8192,22016,f16:row,f16:column,f16:column,1,0,1,1,tensorop,f16,128,128,32,3,2,2,1,16,8,16,80,1024,855638016,2955071717376,3453,34.1679,23.3223,86486.8
1,CUTLASS,gemm,cutlass_tensorop_h16816gemm_128x128_32x3_tn_align4,incorrect,success,universal,serial,8192,8192,22016,f16:row,f16:column,f16:column,1,0,1,1,tensorop,f16,128,128,32,3,2,2,1,16,8,16,80,1024,855638016,2955071717376,3453,49.2891,16.1674,59953.8
1,CUTLASS,gemm,cutlass_tensorop_h16816gemm_128x128_32x3_tn_align2,incorrect,success,universal,serial,8192,8192,22016,f16:row,f16:column,f16:column,1,0,1,1,tensorop,f16,128,128,32,3,2,2,1,16,8,16,80,1024,855638016,2955071717376,3453,40.0472,19.8984,73789.7
1,CUTLASS,gemm,cutlass_tensorop_h16816gemm_128x128_32x4_tn_align8,incorrect,success,universal,serial,8192,8192,22016,f16:row,f16:column,f16:column,1,0,1,1,tensorop,f16,128,128,32,4,2,2,1,16,8,16,80,1024,855638016,2955071717376,3453,22.6665,35.1564,130372
1,CUTLASS,gemm,cutlass_tensorop_h16816gemm_128x128_32x4_tn_align4,incorrect,success,universal,serial,8192,8192,22016,f16:row,f16:column,f16:column,1,0,1,1,tensorop,f16,128,128,32,4,2,2,1,16,8,16,80,1024,855638016,2955071717376,3453,27.712,28.7556,106635
1,CUTLASS,gemm,cutlass_tensorop_h16816gemm_128x128_32x4_tn_align2,incorrect,success,universal,serial,8192,8192,22016,f16:row,f16:column,f16:column,1,0,1,1,tensorop,f16,128,128,32,4,2,2,1,16,8,16,80,1024,855638016,2955071717376,3453,33.3073,23.9249,88721.3
1,CUTLASS,gemm,cutlass_tensorop_h16816gemm_128x128_32x5_tn_align8,incorrect,success,universal,serial,8192,8192,22016,f16:row,f16:column,f16:column,1,0,1,1,tensorop,f16,128,128,32,5,2,2,1,16,8,16,80,1024,855638016,2955071717376,3453,22.3796,35.6072,132043
1,CUTLASS,gemm,cutlass_tensorop_h16816gemm_128x128_32x5_tn_align4,incorrect,success,universal,serial,8192,8192,22016,f16:row,f16:column,f16:column,1,0,1,1,tensorop,f16,128,128,32,5,2,2,1,16,8,16,80,1024,855638016,2955071717376,3453,27.9083,28.5533,105885
