CUTLASS/cutlassgemm-benchmark/csv_logs/cutlass_shape_8192_36864_9216_performance.gemm.csv
Problem,Provider,OperationKind,Operation,Disposition,Status,gemm_kind,m,n,k,A,B,C,D,alpha,beta,split_k_mode,split_k_slices,batch_count,raster_order,op_class,accum,cta_m,cta_n,cta_k,cluster_m,cluster_n,cluster_k,stages,warps_m,warps_n,warps_k,inst_m,inst_n,inst_k,min_cc,max_cc,Bytes,Flops,Flops/Byte,Runtime,GB/s,GFLOPs
1,CUTLASS,gemm,cutlass_tensorop_h1688gemm_256x128_32x2_nn_align8,passed,success,universal,8192,9216,36864,f16:column,f16:column,f16:column,f16:column,1,0,serial,1,1,heuristic,tensorop,f16,256,128,32,1,1,1,2,4,2,1,16,8,8,75,1024,1434451968,5566428610560,3880,27.276,48.9785,204078
1,CUTLASS,gemm,cutlass_tensorop_h1688gemm_256x128_32x2_nn_align4,passed,success,universal,8192,9216,36864,f16:column,f16:column,f16:column,f16:column,1,0,serial,1,1,heuristic,tensorop,f16,256,128,32,1,1,1,2,4,2,1,16,8,8,75,1024,1434451968,5566428610560,3880,26.5934,50.2357,209316
1,CUTLASS,gemm,cutlass_tensorop_h1688gemm_256x128_32x2_nn_align2,passed,success,universal,8192,9216,36864,f16:column,f16:column,f16:column,f16:column,1,0,serial,1,1,heuristic,tensorop,f16,256,128,32,1,1,1,2,4,2,1,16,8,8,75,1024,1434451968,5566428610560,3880,27.0461,49.3948,205813
1,CUTLASS,gemm,cutlass_tensorop_h1688gemm_256x128_32x2_nn_align1,passed,success,universal,8192,9216,36864,f16:column,f16:column,f16:column,f16:column,1,0,serial,1,1,heuristic,tensorop,f16,256,128,32,1,1,1,2,4,2,1,16,8,8,75,1024,1434451968,5566428610560,3880,33.7294,39.6075,165032
1,CUTLASS,gemm,cutlass_tensorop_h1688gemm_128x256_32x2_nn_align8,passed,success,universal,8192,9216,36864,f16:column,f16:column,f16:column,f16:column,1,0,serial,1,1,heuristic,tensorop,f16,128,256,32,1,1,1,2,2,4,1,16,8,8,75,1024,1434451968,5566428610560,3880,26.159,51.0699,212792
1,CUTLASS,gemm,cutlass_tensorop_h1688gemm_128x256_32x2_nn_align4,passed,success,universal,8192,9216,36864,f16:column,f16:column,f16:column,f16:column,1,0,serial,1,1,heuristic,tensorop,f16,128,256,32,1,1,1,2,2,4,1,16,8,8,75,1024,1434451968,5566428610560,3880,25.0332,53.3666,222362
1,CUTLASS,gemm,cutlass_tensorop_h1688gemm_128x256_32x2_nn_align2,passed,success,universal,8192,9216,36864,f16:column,f16:column,f16:column,f16:column,1,0,serial,1,1,heuristic,tensorop,f16,128,256,32,1,1,1,2,2,4,1,16,8,8,75,1024,1434451968,5566428610560,3880,24.6766,54.1377,225575
1,CUTLASS,gemm,cutlass_tensorop_h1688gemm_128x256_32x2_nn_align1,passed,success,universal,8192,9216,36864,f16:column,f16:column,f16:column,f16:column,1,0,serial,1,1,heuristic,tensorop,f16,128,256,32,1,1,1,2,2,4,1,16,8,8,75,1024,1434451968,5566428610560,3880,27.4745,48.6246,202603
1,CUTLASS,gemm,cutlass_tensorop_h1688gemm_128x128_32x2_nn_align8,passed,success,universal,8192,9216,36864,f16:column,f16:column,f16:column,f16:column,1,0,serial,1,1,heuristic,tensorop,f16,128,128,32,1,1,1,2,2,2,1,16,8,8,75,1024,1434451968,5566428610560,3880,21.7768,61.3468,255613
1,CUTLASS,gemm,cutlass_tensorop_h1688gemm_128x128_32x2_nn_align4,passed,success,universal,8192,9216,36864,f16:column,f16:column,f16:column,f16:column,1,0,serial,1,1,heuristic,tensorop,f16,128,128,32,1,1,1,2,2,2,1,16,8,8,75,1024,1434451968,5566428610560,3880,23.8651,55.9786,233245
1,CUTLASS,gemm,cutlass_tensorop_h1688gemm_128x128_32x2_nn_align2,passed,success,universal,8192,9216,36864,f16:column,f16:column,f16:column,f16:column,1,0,serial,1,1,heuristic,tensorop,f16,128,128,32,1,1,1,2,2,2,1,16,8,8,75,1024,1434451968,5566428610560,3880,24.3203,54.9309,228880
1,CUTLASS,gemm,cutlass_tensorop_h1688gemm_128x128_32x2_nn_align1,passed,success,universal,8192,9216,36864,f16:column,f16:column,f16:column,f16:column,1,0,serial,1,1,heuristic,tensorop,f16,128,128,32,1,1,1,2,2,2,1,16,8,8,75,1024,1434451968,5566428610560,3880,31.6618,42.194,175809
1,CUTLASS,gemm,cutlass_tensorop_h1688gemm_64x256_32x2_nn_align8,passed,success,universal,8192,9216,36864,f16:column,f16:column,f16:column,f16:column,1,0,serial,1,1,heuristic,tensorop,f16,64,256,32,1,1,1,2,1,4,1,16,8,8,75,1024,1434451968,5566428610560,3880,24.7743,53.9242,224685
1,CUTLASS,gemm,cutlass_tensorop_h1688gemm_64x256_32x2_nn_align4,passed,success,universal,8192,9216,36864,f16:column,f16:column,f16:column,f16:column,1,0,serial,1,1,heuristic,tensorop,f16,64,256,32,1,1,1,2,1,4,1,16,8,8,75,1024,1434451968,5566428610560,3880,25.8927,51.5951,214980
1,CUTLASS,gemm,cutlass_tensorop_h1688gemm_64x256_32x2_nn_align2,passed,success,universal,8192,9216,36864,f16:column,f16:column,f16:column,f16:column,1,0,serial,1,1,heuristic,tensorop,f16,64,256,32,1,1,1,2,1,4,1,16,8,8,75,1024,1434451968,5566428610560,3880,26.9632,49.5468,206446
1,CUTLASS,gemm,cutlass_tensorop_h1688gemm_64x256_32x2_nn_align1,passed,success,universal,8192,9216,36864,f16:column,f16:column,f16:column,f16:column,1,0,serial,1,1,heuristic,tensorop,f16,64,256,32,1,1,1,2,1,4,1,16,8,8,75,1024,1434451968,5566428610560,3880,33.1019,40.3583,168160
1,CUTLASS,gemm,cutlass_tensorop_h1688gemm_256x64_32x2_nn_align8,passed,success,universal,8192,9216,36864,f16:column,f16:column,f16:column,f16:column,1,0,serial,1,1,heuristic,tensorop,f16,256,64,32,1,1,1,2,4,1,1,16,8,8,75,1024,1434451968,5566428610560,3880,28.8774,46.2624,192761
1,CUTLASS,gemm,cutlass_tensorop_h1688gemm_256x64_32x2_nn_align4,passed,success,universal,8192,9216,36864,f16:column,f16:column,f16:column,f16:column,1,0,serial,1,1,heuristic,tensorop,f16,256,64,32,1,1,1,2,4,1,1,16,8,8,75,1024,1434451968,5566428610560,3880,31.8697,41.9187,174662
1,CUTLASS,gemm,cutlass_tensorop_h1688gemm_256x64_32x2_nn_align2,passed,success,universal,8192,9216,36864,f16:column,f16:column,f16:column,f16:column,1,0,serial,1,1,heuristic,tensorop,f16,256,64,32,1,1,1,2,4,1,1,16,8,8,75,1024,1434451968,5566428610560,3880,29.2559,45.6639,190267
1,CUTLASS,gemm,cutlass_tensorop_h1688gemm_256x64_32x2_nn_align1,passed,success,universal,8192,9216,36864,f16:column,f16:column,f16:column,f16:column,1,0,serial,1,1,heuristic,tensorop,f16,256,64,32,1,1,1,2,4,1,1,16,8,8,75,1024,1434451968,5566428610560,3880,43.6391,30.6133,127556
1,CUTLASS,gemm,cutlass_tensorop_h1688gemm_64x128_32x2_nn_align8,passed,success,universal,8192,9216,36864,f16:column,f16:column,f16:column,f16:column,1,0,serial,1,1,heuristic,tensorop,f16,64,128,32,1,1,1,2,2,2,1,16,8,8,75,1024,1434451968,5566428610560,3880,29.2516,45.6706,190295
1,CUTLASS,gemm,cutlass_tensorop_h1688gemm_64x128_32x2_nn_align4,passed,success,universal,8192,9216,36864,f16:column,f16:column,f16:column,f16:column,1,0,serial,1,1,heuristic,tensorop,f16,64,128,32,1,1,1,2,2,2,1,16,8,8,75,1024,1434451968,5566428610560,3880,29.6013,45.1311,188047
1,CUTLASS,gemm,cutlass_tensorop_h1688gemm_64x128_32x2_nn_align2,passed,success,universal,8192,9216,36864,f16:column,f16:column,f16:column,f16:column,1,0,serial,1,1,heuristic,tensorop,f16,64,128,32,1,1,1,2,2,2,1,16,8,8,75,1024,1434451968,5566428610560,3880,32.1772,41.5182,172993
1,CUTLASS,gemm,cutlass_tensorop_h1688gemm_64x128_32x2_nn_align1,passed,success,universal,8192,9216,36864,f16:column,f16:column,f16:column,f16:column,1,0,serial,1,1,heuristic,tensorop,f16,64,128,32,1,1,1,2,2,2,1,16,8,8,75,1024,1434451968,5566428610560,3880,42.3739,31.5273,131364
1,CUTLASS,gemm,cutlass_tensorop_h1688gemm_128x64_32x2_nn_align8,passed,success,universal,8192,9216,36864,f16:column,f16:column,f16:column,f16:column,1,0,serial,1,1,heuristic,tensorop,f16,128,64,32,1,1,1,2,2,2,1,16,8,8,75,1024,1434451968,5566428610560,3880,29.9275,44.6391,185997
1,CUTLASS,gemm,cutlass_tensorop_h1688gemm_128x64_32x2_nn_align4,passed,success,universal,8192,9216,36864,f16:column,f16:column,f16:column,f16:column,1,0,serial,1,1,heuristic,tensorop,f16,128,64,32,1,1,1,2,2,2,1,16,8,8,75,1024,1434451968,5566428610560,3880,32.5847,40.9989,170829
1,CUTLASS,gemm,cutlass_tensorop_h1688gemm_128x64_32x2_nn_align2,passed,success,universal,8192,9216,36864,f16:column,f16:column,f16:column,f16:column,1,0,serial,1,1,heuristic,tensorop,f16,128,64,32,1,1,1,2,2,2,1,16,8,8,75,1024,1434451968,5566428610560,3880,36.4701,36.6311,152630
1,CUTLASS,gemm,cutlass_tensorop_h1688gemm_128x64_32x2_nn_align1,passed,success,universal,8192,9216,36864,f16:column,f16:column,f16:column,f16:column,1,0,serial,1,1,heuristic,tensorop,f16,128,64,32,1,1,1,2,2,2,1,16,8,8,75,1024,1434451968,5566428610560,3880,48.9762,27.2773,113656
1,CUTLASS,gemm,cutlass_tensorop_h1688gemm_64x64_32x2_nn_align8,passed,success,universal,8192,9216,36864,f16:column,f16:column,f16:column,f16:column,1,0,serial,1,1,heuristic,tensorop,f16,64,64,32,1,1,1,2,2,2,1,16,8,8,75,1024,1434451968,5566428610560,3880,37.134,35.9761,149901
1,CUTLASS,gemm,cutlass_tensorop_h1688gemm_64x64_32x2_nn_align4,passed,success,universal,8192,9216,36864,f16:column,f16:column,f16:column,f16:column,1,0,serial,1,1,heuristic,tensorop,f16,64,64,32,1,1,1,2,2,2,1,16,8,8,75,1024,1434451968,5566428610560,3880,38.0189,35.1388,146412
1,CUTLASS,gemm,cutlass_tensorop_h1688gemm_64x64_32x2_nn_align2,passed,success,universal,8192,9216,36864,f16:column,f16:column,f16:column,f16:column,1,0,serial,1,1,heuristic,tensorop,f16,64,64,32,1,1,1,2,2,2,1,16,8,8,75,1024,1434451968,5566428610560,3880,42.0611,31.7618,132341
1,CUTLASS,gemm,cutlass_tensorop_h1688gemm_64x64_32x2_nn_align1,passed,success,universal,8192,9216,36864,f16:column,f16:column,f16:column,f16:column,1,0,serial,1,1,heuristic,tensorop,f16,64,64,32,1,1,1,2,2,2,1,16,8,8,75,1024,1434451968,5566428610560,3880,61.3364,21.7805,90752.5
1,CUTLASS,gemm,cutlass_tensorop_h1688gemm_64x128_64x2_nn_align8,passed,success,universal,8192,9216,36864,f16:column,f16:column,f16:column,f16:column,1,0,serial,1,1,heuristic,tensorop,f16,64,128,64,1,1,1,2,1,2,2,16,8,8,75,1024,1434451968,5566428610560,3880,28.3608,47.1051,196272
1,CUTLASS,gemm,cutlass_tensorop_h1688gemm_64x128_64x2_nn_align4,passed,success,universal,8192,9216,36864,f16:column,f16:column,f16:column,f16:column,1,0,serial,1,1,heuristic,tensorop,f16,64,128,64,1,1,1,2,1,2,2,16,8,8,75,1024,1434451968,5566428610560,3880,28.6828,46.5763,194069
1,CUTLASS,gemm,cutlass_tensorop_h1688gemm_64x128_64x2_nn_align2,passed,success,universal,8192,9216,36864,f16:column,f16:column,f16:column,f16:column,1,0,serial,1,1,heuristic,tensorop,f16,64,128,64,1,1,1,2,1,2,2,16,8,8,75,1024,1434451968,5566428610560,3880,29.0399,46.0035,191682
1,CUTLASS,gemm,cutlass_tensorop_h1688gemm_64x128_64x2_nn_align1,passed,success,universal,8192,9216,36864,f16:column,f16:column,f16:column,f16:column,1,0,serial,1,1,heuristic,tensorop,f16,64,128,64,1,1,1,2,1,2,2,16,8,8,75,1024,1434451968,5566428610560,3880,37.1699,35.9414,149756
1,CUTLASS,gemm,cutlass_tensorop_h1688gemm_256x128_32x2_nt_align8,passed,success,universal,8192,9216,36864,f16:column,f16:row,f16:column,f16:column,1,0,serial,1,1,heuristic,tensorop,f16,256,128,32,1,1,1,2,4,2,1,16,8,8,75,1024,1434451968,5566428610560,3880,23.8227,56.0783,233661
1,CUTLASS,gemm,cutlass_tensorop_h1688gemm_256x128_32x2_nt_align4,passed,success,universal,8192,9216,36864,f16:column,f16:row,f16:column,f16:column,1,0,serial,1,1,heuristic,tensorop,f16,256,128,32,1,1,1,2,4,2,1,16,8,8,75,1024,1434451968,5566428610560,3880,26.8803,49.6994,207082
1,CUTLASS,gemm,cutlass_tensorop_h1688gemm_256x128_32x2_nt_align2,passed,success,universal,8192,9216,36864,f16:column,f16:row,f16:column,f16:column,1,0,serial,1,1,heuristic,tensorop,f16,256,128,32,1,1,1,2,4,2,1,16,8,8,75,1024,1434451968,5566428610560,3880,24.1495,55.3195,230499
1,CUTLASS,gemm,cutlass_tensorop_h1688gemm_256x128_32x2_nt_align1,passed,success,universal,8192,9216,36864,f16:column,f16:row,f16:column,f16:column,1,0,serial,1,1,heuristic,tensorop,f16,256,128,32,1,1,1,2,4,2,1,16,8,8,75,1024,1434451968,5566428610560,3880,28.3556,47.1136,196308
1,CUTLASS,gemm,cutlass_tensorop_h1688gemm_128x256_32x2_nt_align8,passed,success,universal,8192,9216,36864,f16:column,f16:row,f16:column,f16:column,1,0,serial,1,1,heuristic,tensorop,f16,128,256,32,1,1,1,2,2,4,1,16,8,8,75,1024,1434451968,5566428610560,3880,23.4705,56.9199,237167
1,CUTLASS,gemm,cutlass_tensorop_h1688gemm_128x256_32x2_nt_align4,passed,success,universal,8192,9216,36864,f16:column,f16:row,f16:column,f16:column,1,0,serial,1,1,heuristic,tensorop,f16,128,256,32,1,1,1,2,2,4,1,16,8,8,75,1024,1434451968,5566428610560,3880,24.0493,55.5501,231460
1,CUTLASS,gemm,cutlass_tensorop_h1688gemm_128x256_32x2_nt_align2,passed,success,universal,8192,9216,36864,f16:column,f16:row,f16:column,f16:column,1,0,serial,1,1,heuristic,tensorop,f16,128,256,32,1,1,1,2,2,4,1,16,8,8,75,1024,1434451968,5566428610560,3880,27.3033,48.9294,203874
1,CUTLASS,gemm,cutlass_tensorop_h1688gemm_128x256_32x2_nt_align1,passed,success,universal,8192,9216,36864,f16:column,f16:row,f16:column,f16:column,1,0,serial,1,1,heuristic,tensorop,f16,128,256,32,1,1,1,2,2,4,1,16,8,8,75,1024,1434451968,5566428610560,3880,29.1416,45.843,191013
1,CUTLASS,gemm,cutlass_tensorop_h1688gemm_128x128_32x2_nt_align8,passed,success,universal,8192,9216,36864,f16:column,f16:row,f16:column,f16:column,1,0,serial,1,1,heuristic,tensorop,f16,128,128,32,1,1,1,2,2,2,1,16,8,8,75,1024,1434451968,5566428610560,3880,20.4786,65.2359,271817
1,CUTLASS,gemm,cutlass_tensorop_h1688gemm_128x128_32x2_nt_align4,passed,success,universal,8192,9216,36864,f16:column,f16:row,f16:column,f16:column,1,0,serial,1,1,heuristic,tensorop,f16,128,128,32,1,1,1,2,2,2,1,16,8,8,75,1024,1434451968,5566428610560,3880,24.0275,55.6002,231669
1,CUTLASS,gemm,cutlass_tensorop_h1688gemm_128x128_32x2_nt_align2,passed,success,universal,8192,9216,36864,f16:column,f16:row,f16:column,f16:column,1,0,serial,1,1,heuristic,tensorop,f16,128,128,32,1,1,1,2,2,2,1,16,8,8,75,1024,1434451968,5566428610560,3880,22.2731,59.9798,249917
1,CUTLASS,gemm,cutlass_tensorop_h1688gemm_128x128_32x2_nt_align1,passed,success,universal,8192,9216,36864,f16:column,f16:row,f16:column,f16:column,1,0,serial,1,1,heuristic,tensorop,f16,128,128,32,1,1,1,2,2,2,1,16,8,8,75,1024,1434451968,5566428610560,3880,27.7263,48.183,200763
1,CUTLASS,gemm,cutlass_tensorop_h1688gemm_64x256_32x2_nt_align8,passed,success,universal,8192,9216,36864,f16:column,f16:row,f16:column,f16:column,1,0,serial,1,1,heuristic,tensorop,f16,64,256,32,1,1,1,2,1,4,1,16,8,8,75,1024,1434451968,5566428610560,3880,24.6564,54.1822,225760
1,CUTLASS,gemm,cutlass_tensorop_h1688gemm_64x256_32x2_nt_align4,passed,success,universal,8192,9216,36864,f16:column,f16:row,f16:column,f16:column,1,0,serial,1,1,heuristic,tensorop,f16,64,256,32,1,1,1,2,1,4,1,16,8,8,75,1024,1434451968,5566428610560,3880,25.3086,52.786,219942
1,CUTLASS,gemm,cutlass_tensorop_h1688gemm_64x256_32x2_nt_align2,passed,success,universal,8192,9216,36864,f16:column,f16:row,f16:column,f16:column,1,0,serial,1,1,heuristic,tensorop,f16,64,256,32,1,1,1,2,1,4,1,16,8,8,75,1024,1434451968,5566428610560,3880,26.8307,49.7913,207465
1,CUTLASS,gemm,cutlass_tensorop_h1688gemm_64x256_32x2_nt_align1,passed,success,universal,8192,9216,36864,f16:column,f16:row,f16:column,f16:column,1,0,serial,1,1,heuristic,tensorop,f16,64,256,32,1,1,1,2,1,4,1,16,8,8,75,1024,1434451968,5566428610560,3880,31.4524,42.4749,176979
1,CUTLASS,gemm,cutlass_tensorop_h1688gemm_256x64_32x2_nt_align8,passed,success,universal,8192,9216,36864,f16:column,f16:row,f16:column,f16:column,1,0,serial,1,1,heuristic,tensorop,f16,256,64,32,1,1,1,2,4,1,1,16,8,8,75,1024,1434451968,5566428610560,3880,25.3138,52.7751,219897
1,CUTLASS,gemm,cutlass_tensorop_h1688gemm_256x64_32x2_nt_align4,passed,success,universal,8192,9216,36864,f16:column,f16:row,f16:column,f16:column,1,0,serial,1,1,heuristic,tensorop,f16,256,64,32,1,1,1,2,4,1,1,16,8,8,75,1024,1434451968,5566428610560,3880,26.7794,49.8868,207863
1,CUTLASS,gemm,cutlass_tensorop_h1688gemm_256x64_32x2_nt_align2,passed,success,universal,8192,9216,36864,f16:column,f16:row,f16:column,f16:column,1,0,serial,1,1,heuristic,tensorop,f16,256,64,32,1,1,1,2,4,1,1,16,8,8,75,1024,1434451968,5566428610560,3880,27.1335,49.2356,205149
1,CUTLASS,gemm,cutlass_tensorop_h1688gemm_256x64_32x2_nt_align1,passed,success,universal,8192,9216,36864,f16:column,f16:row,f16:column,f16:column,1,0,serial,1,1,heuristic,tensorop,f16,256,64,32,1,1,1,2,4,1,1,16,8,8,75,1024,1434451968,5566428610560,3880,32.3651,41.2772,171989
1,CUTLASS,gemm,cutlass_tensorop_h1688gemm_64x128_32x2_nt_align8,passed,success,universal,8192,9216,36864,f16:column,f16:row,f16:column,f16:column,1,0,serial,1,1,heuristic,tensorop,f16,64,128,32,1,1,1,2,2,2,1,16,8,8,75,1024,1434451968,5566428610560,3880,28.1408,47.4734,197807
1,CUTLASS,gemm,cutlass_tensorop_h1688gemm_64x128_32x2_nt_align4,passed,success,universal,8192,9216,36864,f16:column,f16:row,f16:column,f16:column,1,0,serial,1,1,heuristic,tensorop,f16,64,128,32,1,1,1,2,2,2,1,16,8,8,75,1024,1434451968,5566428610560,3880,28.5639,46.7702,194877
1,CUTLASS,gemm,cutlass_tensorop_h1688gemm_64x128_32x2_nt_align2,passed,success,universal,8192,9216,36864,f16:column,f16:row,f16:column,f16:column,1,0,serial,1,1,heuristic,tensorop,f16,64,128,32,1,1,1,2,2,2,1,16,8,8,75,1024,1434451968,5566428610560,3880,30.2455,44.1698,184042
1,CUTLASS,gemm,cutlass_tensorop_h1688gemm_64x128_32x2_nt_align1,passed,success,universal,8192,9216,36864,f16:column,f16:row,f16:column,f16:column,1,0,serial,1,1,heuristic,tensorop,f16,64,128,32,1,1,1,2,2,2,1,16,8,8,75,1024,1434451968,5566428610560,3880,35.9822,37.1277,154699
1,CUTLASS,gemm,cutlass_tensorop_h1688gemm_128x64_32x2_nt_align8,passed,success,universal,8192,9216,36864,f16:column,f16:row,f16:column,f16:column,1,0,serial,1,1,heuristic,tensorop,f16,128,64,32,1,1,1,2,2,2,1,16,8,8,75,1024,1434451968,5566428610560,3880,28.1732,47.4187,197579
1,CUTLASS,gemm,cutlass_tensorop_h1688gemm_128x64_32x2_nt_align4,passed,success,universal,8192,9216,36864,f16:column,f16:row,f16:column,f16:column,1,0,serial,1,1,heuristic,tensorop,f16,128,64,32,1,1,1,2,2,2,1,16,8,8,75,1024,1434451968,5566428610560,3880,28.6403,46.6454,194357
1,CUTLASS,gemm,cutlass_tensorop_h1688gemm_128x64_32x2_nt_align2,passed,success,universal,8192,9216,36864,f16:column,f16:row,f16:column,f16:column,1,0,serial,1,1,heuristic,tensorop,f16,128,64,32,1,1,1,2,2,2,1,16,8,8,75,1024,1434451968,5566428610560,3880,29.5042,45.2796,188666
1,CUTLASS,gemm,cutlass_tensorop_h1688gemm_128x64_32x2_nt_align1,passed,success,universal,8192,9216,36864,f16:column,f16:row,f16:column,f16:column,1,0,serial,1,1,heuristic,tensorop,f16,128,64,32,1,1,1,2,2,2,1,16,8,8,75,1024,1434451968,5566428610560,3880,35.6626,37.4604,156086
1,CUTLASS,gemm,cutlass_tensorop_h1688gemm_64x64_32x2_nt_align8,passed,success,universal,8192,9216,36864,f16:column,f16:row,f16:column,f16:column,1,0,serial,1,1,heuristic,tensorop,f16,64,64,32,1,1,1,2,2,2,1,16,8,8,75,1024,1434451968,5566428610560,3880,35.5029,37.629,156788
1,CUTLASS,gemm,cutlass_tensorop_h1688gemm_64x64_32x2_nt_align4,passed,success,universal,8192,9216,36864,f16:column,f16:row,f16:column,f16:column,1,0,serial,1,1,heuristic,tensorop,f16,64,64,32,1,1,1,2,2,2,1,16,8,8,75,1024,1434451968,5566428610560,3880,36.2267,36.8772,153656
1,CUTLASS,gemm,cutlass_tensorop_h1688gemm_64x64_32x2_nt_align2,passed,success,universal,8192,9216,36864,f16:column,f16:row,f16:column,f16:column,1,0,serial,1,1,heuristic,tensorop,f16,64,64,32,1,1,1,2,2,2,1,16,8,8,75,1024,1434451968,5566428610560,3880,37.3617,35.7569,148988
1,CUTLASS,gemm,cutlass_tensorop_h1688gemm_64x64_32x2_nt_align1,passed,success,universal,8192,9216,36864,f16:column,f16:row,f16:column,f16:column,1,0,serial,1,1,heuristic,tensorop,f16,64,64,32,1,1,1,2,2,2,1,16,8,8,75,1024,1434451968,5566428610560,3880,46.7261,28.5908,119129
1,CUTLASS,gemm,cutlass_tensorop_h1688gemm_64x128_64x2_nt_align8,passed,success,universal,8192,9216,36864,f16:column,f16:row,f16:column,f16:column,1,0,serial,1,1,heuristic,tensorop,f16,64,128,64,1,1,1,2,1,2,2,16,8,8,75,1024,1434451968,5566428610560,3880,28.0867,47.5648,198188
1,CUTLASS,gemm,cutlass_tensorop_h1688gemm_64x128_64x2_nt_align4,passed,success,universal,8192,9216,36864,f16:column,f16:row,f16:column,f16:column,1,0,serial,1,1,heuristic,tensorop,f16,64,128,64,1,1,1,2,1,2,2,16,8,8,75,1024,1434451968,5566428610560,3880,27.7189,48.1959,200817
1,CUTLASS,gemm,cutlass_tensorop_h1688gemm_64x128_64x2_nt_align2,passed,success,universal,8192,9216,36864,f16:column,f16:row,f16:column,f16:column,1,0,serial,1,1,heuristic,tensorop,f16,64,128,64,1,1,1,2,1,2,2,16,8,8,75,1024,1434451968,5566428610560,3880,28.475,46.9162,195485
1,CUTLASS,gemm,cutlass_tensorop_h1688gemm_64x128_64x2_nt_align1,passed,success,universal,8192,9216,36864,f16:column,f16:row,f16:column,f16:column,1,0,serial,1,1,heuristic,tensorop,f16,64,128,64,1,1,1,2,1,2,2,16,8,8,75,1024,1434451968,5566428610560,3880,39.9139,33.4705,139461
1,CUTLASS,gemm,cutlass_tensorop_h1688gemm_256x128_32x2_tn_align8,passed,success,universal,8192,9216,36864,f16:row,f16:column,f16:column,f16:column,1,0,serial,1,1,heuristic,tensorop,f16,256,128,32,1,1,1,2,4,2,1,16,8,8,75,1024,1434451968,5566428610560,3880,24.8071,53.853,224388
1,CUTLASS,gemm,cutlass_tensorop_h1688gemm_256x128_32x2_tn_align4,passed,success,universal,8192,9216,36864,f16:row,f16:column,f16:column,f16:column,1,0,serial,1,1,heuristic,tensorop,f16,256,128,32,1,1,1,2,4,2,1,16,8,8,75,1024,1434451968,5566428610560,3880,26.4468,50.5141,210476
1,CUTLASS,gemm,cutlass_tensorop_h1688gemm_256x128_32x2_tn_align2,passed,success,universal,8192,9216,36864,f16:row,f16:column,f16:column,f16:column,1,0,serial,1,1,heuristic,tensorop,f16,256,128,32,1,1,1,2,4,2,1,16,8,8,75,1024,1434451968,5566428610560,3880,30.9571,43.1545,179811
1,CUTLASS,gemm,cutlass_tensorop_h1688gemm_256x128_32x2_tn_align1,passed,success,universal,8192,9216,36864,f16:row,f16:column,f16:column,f16:column,1,0,serial,1,1,heuristic,tensorop,f16,256,128,32,1,1,1,2,4,2,1,16,8,8,75,1024,1434451968,5566428610560,3880,37.331,35.7862,149110
1,CUTLASS,gemm,cutlass_tensorop_h1688gemm_128x256_32x2_tn_align8,passed,success,universal,8192,9216,36864,f16:row,f16:column,f16:column,f16:column,1,0,serial,1,1,heuristic,tensorop,f16,128,256,32,1,1,1,2,2,4,1,16,8,8,75,1024,1434451968,5566428610560,3880,24.9932,53.4521,222718
1,CUTLASS,gemm,cutlass_tensorop_h1688gemm_128x256_32x2_tn_align4,passed,success,universal,8192,9216,36864,f16:row,f16:column,f16:column,f16:column,1,0,serial,1,1,heuristic,tensorop,f16,128,256,32,1,1,1,2,2,4,1,16,8,8,75,1024,1434451968,5566428610560,3880,24.3829,54.79,228293
1,CUTLASS,gemm,cutlass_tensorop_h1688gemm_128x256_32x2_tn_align2,passed,success,universal,8192,9216,36864,f16:row,f16:column,f16:column,f16:column,1,0,serial,1,1,heuristic,tensorop,f16,128,256,32,1,1,1,2,2,4,1,16,8,8,75,1024,1434451968,5566428610560,3880,26.9831,49.5101,206293
1,CUTLASS,gemm,cutlass_tensorop_h1688gemm_128x256_32x2_tn_align1,passed,success,universal,8192,9216,36864,f16:row,f16:column,f16:column,f16:column,1,0,serial,1,1,heuristic,tensorop,f16,128,256,32,1,1,1,2,2,4,1,16,8,8,75,1024,1434451968,5566428610560,3880,37.8178,35.3257,147191
1,CUTLASS,gemm,cutlass_tensorop_h1688gemm_128x128_32x2_tn_align8,passed,success,universal,8192,9216,36864,f16:row,f16:column,f16:column,f16:column,1,0,serial,1,1,heuristic,tensorop,f16,128,128,32,1,1,1,2,2,2,1,16,8,8,75,1024,1434451968,5566428610560,3880,24.7002,54.086,225359
1,CUTLASS,gemm,cutlass_tensorop_h1688gemm_128x128_32x2_tn_align4,passed,success,universal,8192,9216,36864,f16:row,f16:column,f16:column,f16:column,1,0,serial,1,1,heuristic,tensorop,f16,128,128,32,1,1,1,2,2,2,1,16,8,8,75,1024,1434451968,5566428610560,3880,30.869,43.2777,180324
1,CUTLASS,gemm,cutlass_tensorop_h1688gemm_128x128_32x2_tn_align2,passed,success,universal,8192,9216,36864,f16:row,f16:column,f16:column,f16:column,1,0,serial,1,1,heuristic,tensorop,f16,128,128,32,1,1,1,2,2,2,1,16,8,8,75,1024,1434451968,5566428610560,3880,29.1402,45.8452,191022
1,CUTLASS,gemm,cutlass_tensorop_h1688gemm_128x128_32x2_tn_align1,passed,success,universal,8192,9216,36864,f16:row,f16:column,f16:column,f16:column,1,0,serial,1,1,heuristic,tensorop,f16,128,128,32,1,1,1,2,2,2,1,16,8,8,75,1024,1434451968,5566428610560,3880,38.739,34.4856,143690
1,CUTLASS,gemm,cutlass_tensorop_h1688gemm_64x256_32x2_tn_align8,passed,success,universal,8192,9216,36864,f16:row,f16:column,f16:column,f16:column,1,0,serial,1,1,heuristic,tensorop,f16,64,256,32,1,1,1,2,1,4,1,16,8,8,75,1024,1434451968,5566428610560,3880,28.6173,46.6828,194513
1,CUTLASS,gemm,cutlass_tensorop_h1688gemm_64x256_32x2_tn_align4,passed,success,universal,8192,9216,36864,f16:row,f16:column,f16:column,f16:column,1,0,serial,1,1,heuristic,tensorop,f16,64,256,32,1,1,1,2,1,4,1,16,8,8,75,1024,1434451968,5566428610560,3880,29.4999,45.2862,188693
1,CUTLASS,gemm,cutlass_tensorop_h1688gemm_64x256_32x2_tn_align2,passed,success,universal,8192,9216,36864,f16:row,f16:column,f16:column,f16:column,1,0,serial,1,1,heuristic,tensorop,f16,64,256,32,1,1,1,2,1,4,1,16,8,8,75,1024,1434451968,5566428610560,3880,34.6031,38.6074,160865
1,CUTLASS,gemm,cutlass_tensorop_h1688gemm_64x256_32x2_tn_align1,passed,success,universal,8192,9216,36864,f16:row,f16:column,f16:column,f16:column,1,0,serial,1,1,heuristic,tensorop,f16,64,256,32,1,1,1,2,1,4,1,16,8,8,75,1024,1434451968,5566428610560,3880,47.9197,27.8787,116162
1,CUTLASS,gemm,cutlass_tensorop_h1688gemm_256x64_32x2_tn_align8,passed,success,universal,8192,9216,36864,f16:row,f16:column,f16:column,f16:column,1,0,serial,1,1,heuristic,tensorop,f16,256,64,32,1,1,1,2,4,1,1,16,8,8,75,1024,1434451968,5566428610560,3880,30.5289,43.7597,182333
1,CUTLASS,gemm,cutlass_tensorop_h1688gemm_256x64_32x2_tn_align4,passed,success,universal,8192,9216,36864,f16:row,f16:column,f16:column,f16:column,1,0,serial,1,1,heuristic,tensorop,f16,256,64,32,1,1,1,2,4,1,1,16,8,8,75,1024,1434451968,5566428610560,3880,33.907,39.4001,164168
1,CUTLASS,gemm,cutlass_tensorop_h1688gemm_256x64_32x2_tn_align2,passed,success,universal,8192,9216,36864,f16:row,f16:column,f16:column,f16:column,1,0,serial,1,1,heuristic,tensorop,f16,256,64,32,1,1,1,2,4,1,1,16,8,8,75,1024,1434451968,5566428610560,3880,33.2046,40.2335,167640
1,CUTLASS,gemm,cutlass_tensorop_h1688gemm_256x64_32x2_tn_align1,passed,success,universal,8192,9216,36864,f16:row,f16:column,f16:column,f16:column,1,0,serial,1,1,heuristic,tensorop,f16,256,64,32,1,1,1,2,4,1,1,16,8,8,75,1024,1434451968,5566428610560,3880,46.8054,28.5424,118927
1,CUTLASS,gemm,cutlass_tensorop_h1688gemm_64x128_32x2_tn_align8,passed,success,universal,8192,9216,36864,f16:row,f16:column,f16:column,f16:column,1,0,serial,1,1,heuristic,tensorop,f16,64,128,32,1,1,1,2,2,2,1,16,8,8,75,1024,1434451968,5566428610560,3880,31.2953,42.6881,177868
1,CUTLASS,gemm,cutlass_tensorop_h1688gemm_64x128_32x2_tn_align4,passed,success,universal,8192,9216,36864,f16:row,f16:column,f16:column,f16:column,1,0,serial,1,1,heuristic,tensorop,f16,64,128,32,1,1,1,2,2,2,1,16,8,8,75,1024,1434451968,5566428610560,3880,43.111,30.9883,129118
1,CUTLASS,gemm,cutlass_tensorop_h1688gemm_64x128_32x2_tn_align2,passed,success,universal,8192,9216,36864,f16:row,f16:column,f16:column,f16:column,1,0,serial,1,1,heuristic,tensorop,f16,64,128,32,1,1,1,2,2,2,1,16,8,8,75,1024,1434451968,5566428610560,3880,43.9167,30.4198,126750
1,CUTLASS,gemm,cutlass_tensorop_h1688gemm_64x128_32x2_tn_align1,passed,success,universal,8192,9216,36864,f16:row,f16:column,f16:column,f16:column,1,0,serial,1,1,heuristic,tensorop,f16,64,128,32,1,1,1,2,2,2,1,16,8,8,75,1024,1434451968,5566428610560,3880,55.7512,23.9625,99844.2
1,CUTLASS,gemm,cutlass_tensorop_h1688gemm_128x64_32x2_tn_align8,passed,success,universal,8192,9216,36864,f16:row,f16:column,f16:column,f16:column,1,0,serial,1,1,heuristic,tensorop,f16,128,64,32,1,1,1,2,2,2,1,16,8,8,75,1024,1434451968,5566428610560,3880,31.078,42.9866,179112
1,CUTLASS,gemm,cutlass_tensorop_h1688gemm_128x64_32x2_tn_align4,passed,success,universal,8192,9216,36864,f16:row,f16:column,f16:column,f16:column,1,0,serial,1,1,heuristic,tensorop,f16,128,64,32,1,1,1,2,2,2,1,16,8,8,75,1024,1434451968,5566428610560,3880,38.1673,35.0021,145843
1,CUTLASS,gemm,cutlass_tensorop_h1688gemm_128x64_32x2_tn_align2,passed,success,universal,8192,9216,36864,f16:row,f16:column,f16:column,f16:column,1,0,serial,1,1,heuristic,tensorop,f16,128,64,32,1,1,1,2,2,2,1,16,8,8,75,1024,1434451968,5566428610560,3880,48.7124,27.425,114271
1,CUTLASS,gemm,cutlass_tensorop_h1688gemm_128x64_32x2_tn_align1,passed,success,universal,8192,9216,36864,f16:row,f16:column,f16:column,f16:column,1,0,serial,1,1,heuristic,tensorop,f16,128,64,32,1,1,1,2,2,2,1,16,8,8,75,1024,1434451968,5566428610560,3880,55.8209,23.9326,99719.4
1,CUTLASS,gemm,cutlass_tensorop_h1688gemm_64x64_32x2_tn_align8,passed,success,universal,8192,9216,36864,f16:row,f16:column,f16:column,f16:column,1,0,serial,1,1,heuristic,tensorop,f16,64,64,32,1,1,1,2,2,2,1,16,8,8,75,1024,1434451968,5566428610560,3880,41.2759,32.366,134859
1,CUTLASS,gemm,cutlass_tensorop_h1688gemm_64x64_32x2_tn_align4,passed,success,universal,8192,9216,36864,f16:row,f16:column,f16:column,f16:column,1,0,serial,1,1,heuristic,tensorop,f16,64,64,32,1,1,1,2,2,2,1,16,8,8,75,1024,1434451968,5566428610560,3880,50.3447,26.5358,110566
1,CUTLASS,gemm,cutlass_tensorop_h1688gemm_64x64_32x2_tn_align2,passed,success,universal,8192,9216,36864,f16:row,f16:column,f16:column,f16:column,1,0,serial,1,1,heuristic,tensorop,f16,64,64,32,1,1,1,2,2,2,1,16,8,8,75,1024,1434451968,5566428610560,3880,56.0376,23.84,99333.9
1,CUTLASS,gemm,cutlass_tensorop_h1688gemm_64x64_32x2_tn_align1,passed,success,universal,8192,9216,36864,f16:row,f16:column,f16:column,f16:column,1,0,serial,1,1,heuristic,tensorop,f16,64,64,32,1,1,1,2,2,2,1,16,8,8,75,1024,1434451968,5566428610560,3880,75.388,17.7208,73837.1
1,CUTLASS,gemm,cutlass_tensorop_h1688gemm_64x128_64x2_tn_align8,passed,success,universal,8192,9216,36864,f16:row,f16:column,f16:column,f16:column,1,0,serial,1,1,heuristic,tensorop,f16,64,128,64,1,1,1,2,1,2,2,16,8,8,75,1024,1434451968,5566428610560,3880,28.4369,46.979,195747
1,CUTLASS,gemm,cutlass_tensorop_h1688gemm_64x128_64x2_tn_align4,passed,success,universal,8192,9216,36864,f16:row,f16:column,f16:column,f16:column,1,0,serial,1,1,heuristic,tensorop,f16,64,128,64,1,1,1,2,1,2,2,16,8,8,75,1024,1434451968,5566428610560,3880,29.3675,45.4903,189544
1,CUTLASS,gemm,cutlass_tensorop_h1688gemm_64x128_64x2_tn_align2,passed,success,universal,8192,9216,36864,f16:row,f16:column,f16:column,f16:column,1,0,serial,1,1,heuristic,tensorop,f16,64,128,64,1,1,1,2,1,2,2,16,8,8,75,1024,1434451968,5566428610560,3880,30.0144,44.51,185459
1,CUTLASS,gemm,cutlass_tensorop_h1688gemm_64x128_64x2_tn_align1,passed,success,universal,8192,9216,36864,f16:row,f16:column,f16:column,f16:column,1,0,serial,1,1,heuristic,tensorop,f16,64,128,64,1,1,1,2,1,2,2,16,8,8,75,1024,1434451968,5566428610560,3880,34.1276,39.1454,163107
1,CUTLASS,gemm,cutlass_tensorop_h1688gemm_256x128_32x2_tt_align8,passed,success,universal,8192,9216,36864,f16:row,f16:row,f16:column,f16:column,1,0,serial,1,1,heuristic,tensorop,f16,256,128,32,1,1,1,2,4,2,1,16,8,8,75,1024,1434451968,5566428610560,3880,24.0173,55.624,231768
1,CUTLASS,gemm,cutlass_tensorop_h1688gemm_256x128_32x2_tt_align4,passed,success,universal,8192,9216,36864,f16:row,f16:row,f16:column,f16:column,1,0,serial,1,1,heuristic,tensorop,f16,256,128,32,1,1,1,2,4,2,1,16,8,8,75,1024,1434451968,5566428610560,3880,26.6141,50.1967,209154
1,CUTLASS,gemm,cutlass_tensorop_h1688gemm_256x128_32x2_tt_align2,passed,success,universal,8192,9216,36864,f16:row,f16:row,f16:column,f16:column,1,0,serial,1,1,heuristic,tensorop,f16,256,128,32,1,1,1,2,4,2,1,16,8,8,75,1024,1434451968,5566428610560,3880,25.4021,52.5917,219133
1,CUTLASS,gemm,cutlass_tensorop_h1688gemm_256x128_32x2_tt_align1,passed,success,universal,8192,9216,36864,f16:row,f16:row,f16:column,f16:column,1,0,serial,1,1,heuristic,tensorop,f16,256,128,32,1,1,1,2,4,2,1,16,8,8,75,1024,1434451968,5566428610560,3880,27.5946,48.413,201722
1,CUTLASS,gemm,cutlass_tensorop_h1688gemm_128x256_32x2_tt_align8,passed,success,universal,8192,9216,36864,f16:row,f16:row,f16:column,f16:column,1,0,serial,1,1,heuristic,tensorop,f16,128,256,32,1,1,1,2,2,4,1,16,8,8,75,1024,1434451968,5566428610560,3880,23.3864,57.1245,238020
1,CUTLASS,gemm,cutlass_tensorop_h1688gemm_128x256_32x2_tt_align4,passed,success,universal,8192,9216,36864,f16:row,f16:row,f16:column,f16:column,1,0,serial,1,1,heuristic,tensorop,f16,128,256,32,1,1,1,2,2,4,1,16,8,8,75,1024,1434451968,5566428610560,3880,26.5126,50.3888,209954
1,CUTLASS,gemm,cutlass_tensorop_h1688gemm_128x256_32x2_tt_align2,passed,success,universal,8192,9216,36864,f16:row,f16:row,f16:column,f16:column,1,0,serial,1,1,heuristic,tensorop,f16,128,256,32,1,1,1,2,2,4,1,16,8,8,75,1024,1434451968,5566428610560,3880,26.9516,49.5681,206534
1,CUTLASS,gemm,cutlass_tensorop_h1688gemm_128x256_32x2_tt_align1,passed,success,universal,8192,9216,36864,f16:row,f16:row,f16:column,f16:column,1,0,serial,1,1,heuristic,tensorop,f16,128,256,32,1,1,1,2,2,4,1,16,8,8,75,1024,1434451968,5566428610560,3880,33.3568,40.0499,166875
1,CUTLASS,gemm,cutlass_tensorop_h1688gemm_128x128_32x2_tt_align8,passed,success,universal,8192,9216,36864,f16:row,f16:row,f16:column,f16:column,1,0,serial,1,1,heuristic,tensorop,f16,128,128,32,1,1,1,2,2,2,1,16,8,8,75,1024,1434451968,5566428610560,3880,21.7481,61.4278,255950
1,CUTLASS,gemm,cutlass_tensorop_h1688gemm_128x128_32x2_tt_align4,passed,success,universal,8192,9216,36864,f16:row,f16:row,f16:column,f16:column,1,0,serial,1,1,heuristic,tensorop,f16,128,128,32,1,1,1,2,2,2,1,16,8,8,75,1024,1434451968,5566428610560,3880,24.3417,54.8827,228679
1,CUTLASS,gemm,cutlass_tensorop_h1688gemm_128x128_32x2_tt_align2,passed,success,universal,8192,9216,36864,f16:row,f16:row,f16:column,f16:column,1,0,serial,1,1,heuristic,tensorop,f16,128,128,32,1,1,1,2,2,2,1,16,8,8,75,1024,1434451968,5566428610560,3880,24.3813,54.7934,228307
1,CUTLASS,gemm,cutlass_tensorop_h1688gemm_128x128_32x2_tt_align1,passed,success,universal,8192,9216,36864,f16:row,f16:row,f16:column,f16:column,1,0,serial,1,1,heuristic,tensorop,f16,128,128,32,1,1,1,2,2,2,1,16,8,8,75,1024,1434451968,5566428610560,3880,31.6169,42.2539,176059
1,CUTLASS,gemm,cutlass_tensorop_h1688gemm_64x256_32x2_tt_align8,passed,success,universal,8192,9216,36864,f16:row,f16:row,f16:column,f16:column,1,0,serial,1,1,heuristic,tensorop,f16,64,256,32,1,1,1,2,1,4,1,16,8,8,75,1024,1434451968,5566428610560,3880,27.6991,48.2304,200961
1,CUTLASS,gemm,cutlass_tensorop_h1688gemm_64x256_32x2_tt_align4,passed,success,universal,8192,9216,36864,f16:row,f16:row,f16:column,f16:column,1,0,serial,1,1,heuristic,tensorop,f16,64,256,32,1,1,1,2,1,4,1,16,8,8,75,1024,1434451968,5566428610560,3880,29.6634,45.0365,187653
1,CUTLASS,gemm,cutlass_tensorop_h1688gemm_64x256_32x2_tt_align2,passed,success,universal,8192,9216,36864,f16:row,f16:row,f16:column,f16:column,1,0,serial,1,1,heuristic,tensorop,f16,64,256,32,1,1,1,2,1,4,1,16,8,8,75,1024,1434451968,5566428610560,3880,32.7345,40.8113,170048
1,CUTLASS,gemm,cutlass_tensorop_h1688gemm_64x256_32x2_tt_align1,passed,success,universal,8192,9216,36864,f16:row,f16:row,f16:column,f16:column,1,0,serial,1,1,heuristic,tensorop,f16,64,256,32,1,1,1,2,1,4,1,16,8,8,75,1024,1434451968,5566428610560,3880,43.4907,30.7178,127991
1,CUTLASS,gemm,cutlass_tensorop_h1688gemm_256x64_32x2_tt_align8,passed,success,universal,8192,9216,36864,f16:row,f16:row,f16:column,f16:column,1,0,serial,1,1,heuristic,tensorop,f16,256,64,32,1,1,1,2,4,1,1,16,8,8,75,1024,1434451968,5566428610560,3880,24.78,53.912,224634
1,CUTLASS,gemm,cutlass_tensorop_h1688gemm_256x64_32x2_tt_align4,passed,success,universal,8192,9216,36864,f16:row,f16:row,f16:column,f16:column,1,0,serial,1,1,heuristic,tensorop,f16,256,64,32,1,1,1,2,4,1,1,16,8,8,75,1024,1434451968,5566428610560,3880,27.0246,49.4341,205976
1,CUTLASS,gemm,cutlass_tensorop_h1688gemm_256x64_32x2_tt_align2,passed,success,universal,8192,9216,36864,f16:row,f16:row,f16:column,f16:column,1,0,serial,1,1,heuristic,tensorop,f16,256,64,32,1,1,1,2,4,1,1,16,8,8,75,1024,1434451968,5566428610560,3880,28.9306,46.1774,192407
1,CUTLASS,gemm,cutlass_tensorop_h1688gemm_256x64_32x2_tt_align1,passed,success,universal,8192,9216,36864,f16:row,f16:row,f16:column,f16:column,1,0,serial,1,1,heuristic,tensorop,f16,256,64,32,1,1,1,2,4,1,1,16,8,8,75,1024,1434451968,5566428610560,3880,34.4949,38.7286,161370
1,CUTLASS,gemm,cutlass_tensorop_h1688gemm_64x128_32x2_tt_align8,passed,success,universal,8192,9216,36864,f16:row,f16:row,f16:column,f16:column,1,0,serial,1,1,heuristic,tensorop,f16,64,128,32,1,1,1,2,2,2,1,16,8,8,75,1024,1434451968,5566428610560,3880,30.0213,44.4996,185416
1,CUTLASS,gemm,cutlass_tensorop_h1688gemm_64x128_32x2_tt_align4,passed,success,universal,8192,9216,36864,f16:row,f16:row,f16:column,f16:column,1,0,serial,1,1,heuristic,tensorop,f16,64,128,32,1,1,1,2,2,2,1,16,8,8,75,1024,1434451968,5566428610560,3880,37.7438,35.3949,147479
1,CUTLASS,gemm,cutlass_tensorop_h1688gemm_64x128_32x2_tt_align2,passed,success,universal,8192,9216,36864,f16:row,f16:row,f16:column,f16:column,1,0,serial,1,1,heuristic,tensorop,f16,64,128,32,1,1,1,2,2,2,1,16,8,8,75,1024,1434451968,5566428610560,3880,35.1809,37.9733,158223
1,CUTLASS,gemm,cutlass_tensorop_h1688gemm_64x128_32x2_tt_align1,passed,success,universal,8192,9216,36864,f16:row,f16:row,f16:column,f16:column,1,0,serial,1,1,heuristic,tensorop,f16,64,128,32,1,1,1,2,2,2,1,16,8,8,75,1024,1434451968,5566428610560,3880,49.03,27.2473,113531
1,CUTLASS,gemm,cutlass_tensorop_h1688gemm_128x64_32x2_tt_align8,passed,success,universal,8192,9216,36864,f16:row,f16:row,f16:column,f16:column,1,0,serial,1,1,heuristic,tensorop,f16,128,64,32,1,1,1,2,2,2,1,16,8,8,75,1024,1434451968,5566428610560,3880,28.9817,46.096,192067
1,CUTLASS,gemm,cutlass_tensorop_h1688gemm_128x64_32x2_tt_align4,passed,success,universal,8192,9216,36864,f16:row,f16:row,f16:column,f16:column,1,0,serial,1,1,heuristic,tensorop,f16,128,64,32,1,1,1,2,2,2,1,16,8,8,75,1024,1434451968,5566428610560,3880,30.3625,43.9996,183332
1,CUTLASS,gemm,cutlass_tensorop_h1688gemm_128x64_32x2_tt_align2,passed,success,universal,8192,9216,36864,f16:row,f16:row,f16:column,f16:column,1,0,serial,1,1,heuristic,tensorop,f16,128,64,32,1,1,1,2,2,2,1,16,8,8,75,1024,1434451968,5566428610560,3880,31.7933,42.0195,175082
1,CUTLASS,gemm,cutlass_tensorop_h1688gemm_128x64_32x2_tt_align1,passed,success,universal,8192,9216,36864,f16:row,f16:row,f16:column,f16:column,1,0,serial,1,1,heuristic,tensorop,f16,128,64,32,1,1,1,2,2,2,1,16,8,8,75,1024,1434451968,5566428610560,3880,42.8272,31.1936,129974
1,CUTLASS,gemm,cutlass_tensorop_h1688gemm_64x64_32x2_tt_align8,passed,success,universal,8192,9216,36864,f16:row,f16:row,f16:column,f16:column,1,0,serial,1,1,heuristic,tensorop,f16,64,64,32,1,1,1,2,2,2,1,16,8,8,75,1024,1434451968,5566428610560,3880,37.0277,36.0794,150331
1,CUTLASS,gemm,cutlass_tensorop_h1688gemm_64x64_32x2_tt_align4,passed,success,universal,8192,9216,36864,f16:row,f16:row,f16:column,f16:column,1,0,serial,1,1,heuristic,tensorop,f16,64,64,32,1,1,1,2,2,2,1,16,8,8,75,1024,1434451968,5566428610560,3880,37.3417,35.776,149067
1,CUTLASS,gemm,cutlass_tensorop_h1688gemm_64x64_32x2_tt_align2,passed,success,universal,8192,9216,36864,f16:row,f16:row,f16:column,f16:column,1,0,serial,1,1,heuristic,tensorop,f16,64,64,32,1,1,1,2,2,2,1,16,8,8,75,1024,1434451968,5566428610560,3880,42.5782,31.3761,130734
1,CUTLASS,gemm,cutlass_tensorop_h1688gemm_64x64_32x2_tt_align1,passed,success,universal,8192,9216,36864,f16:row,f16:row,f16:column,f16:column,1,0,serial,1,1,heuristic,tensorop,f16,64,64,32,1,1,1,2,2,2,1,16,8,8,75,1024,1434451968,5566428610560,3880,60.318,22.1482,92284.7
1,CUTLASS,gemm,cutlass_tensorop_h1688gemm_64x128_64x2_tt_align8,passed,success,universal,8192,9216,36864,f16:row,f16:row,f16:column,f16:column,1,0,serial,1,1,heuristic,tensorop,f16,64,128,64,1,1,1,2,1,2,2,16,8,8,75,1024,1434451968,5566428610560,3880,28.5218,46.8392,195164
1,CUTLASS,gemm,cutlass_tensorop_h1688gemm_64x128_64x2_tt_align4,passed,success,universal,8192,9216,36864,f16:row,f16:row,f16:column,f16:column,1,0,serial,1,1,heuristic,tensorop,f16,64,128,64,1,1,1,2,1,2,2,16,8,8,75,1024,1434451968,5566428610560,3880,28.7881,46.4059,193359
1,CUTLASS,gemm,cutlass_tensorop_h1688gemm_64x128_64x2_tt_align2,passed,success,universal,8192,9216,36864,f16:row,f16:row,f16:column,f16:column,1,0,serial,1,1,heuristic,tensorop,f16,64,128,64,1,1,1,2,1,2,2,16,8,8,75,1024,1434451968,5566428610560,3880,30.0058,44.5227,185512
1,CUTLASS,gemm,cutlass_tensorop_h1688gemm_64x128_64x2_tt_align1,passed,success,universal,8192,9216,36864,f16:row,f16:row,f16:column,f16:column,1,0,serial,1,1,heuristic,tensorop,f16,64,128,64,1,1,1,2,1,2,2,16,8,8,75,1024,1434451968,5566428610560,3880,33.5961,39.7646,165687
1,CUTLASS,gemm,cutlass_tensorop_h16816gemm_256x128_32x3_nn_align8,passed,success,universal,8192,9216,36864,f16:column,f16:column,f16:column,f16:column,1,0,serial,1,1,heuristic,tensorop,f16,256,128,32,1,1,1,3,4,2,1,16,8,16,80,1024,1434451968,5566428610560,3880,17.8882,74.6828,311180
1,CUTLASS,gemm,cutlass_tensorop_h16816gemm_256x128_32x3_nn_align4,passed,success,universal,8192,9216,36864,f16:column,f16:column,f16:column,f16:column,1,0,serial,1,1,heuristic,tensorop,f16,256,128,32,1,1,1,3,4,2,1,16,8,16,80,1024,1434451968,5566428610560,3880,18.5801,71.9016,299591
1,CUTLASS,gemm,cutlass_tensorop_h16816gemm_256x128_32x3_nn_align2,passed,success,universal,8192,9216,36864,f16:column,f16:column,f16:column,f16:column,1,0,serial,1,1,heuristic,tensorop,f16,256,128,32,1,1,1,3,4,2,1,16,8,16,80,1024,1434451968,5566428610560,3880,20.4101,65.4549,272730
1,CUTLASS,gemm,cutlass_tensorop_h16816gemm_128x256_32x3_nn_align8,passed,success,universal,8192,9216,36864,f16:column,f16:column,f16:column,f16:column,1,0,serial,1,1,heuristic,tensorop,f16,128,256,32,1,1,1,3,2,4,1,16,8,16,80,1024,1434451968,5566428610560,3880,17.2593,77.4039,322517
1,CUTLASS,gemm,cutlass_tensorop_h16816gemm_128x256_32x3_nn_align4,passed,success,universal,8192,9216,36864,f16:column,f16:column,f16:column,f16:column,1,0,serial,1,1,heuristic,tensorop,f16,128,256,32,1,1,1,3,2,4,1,16,8,16,80,1024,1434451968,5566428610560,3880,17.9141,74.5745,310728
1,CUTLASS,gemm,cutlass_tensorop_h16816gemm_128x256_32x3_nn_align2,passed,success,universal,8192,9216,36864,f16:column,f16:column,f16:column,f16:column,1,0,serial,1,1,heuristic,tensorop,f16,128,256,32,1,1,1,3,2,4,1,16,8,16,80,1024,1434451968,5566428610560,3880,18.6992,71.4437,297683
1,CUTLASS,gemm,cutlass_tensorop_h16816gemm_256x64_32x3_nn_align8,passed,success,universal,8192,9216,36864,f16:column,f16:column,f16:column,f16:column,1,0,serial,1,1,heuristic,tensorop,f16,256,64,32,1,1,1,3,4,1,1,16,8,16,80,1024,1434451968,5566428610560,3880,24.7927,53.8844,224519
1,CUTLASS,gemm,cutlass_tensorop_h16816gemm_256x64_32x3_nn_align4,passed,success,universal,8192,9216,36864,f16:column,f16:column,f16:column,f16:column,1,0,serial,1,1,heuristic,tensorop,f16,256,64,32,1,1,1,3,4,1,1,16,8,16,80,1024,1434451968,5566428610560,3880,25.7843,51.812,215884
1,CUTLASS,gemm,cutlass_tensorop_h16816gemm_256x64_32x3_nn_align2,passed,success,universal,8192,9216,36864,f16:column,f16:column,f16:column,f16:column,1,0,serial,1,1,heuristic,tensorop,f16,256,64,32,1,1,1,3,4,1,1,16,8,16,80,1024,1434451968,5566428610560,3880,49.1186,27.1982,113326
1,CUTLASS,gemm,cutlass_tensorop_h16816gemm_256x64_32x4_nn_align8,passed,success,universal,8192,9216,36864,f16:column,f16:column,f16:column,f16:column,1,0,serial,1,1,heuristic,tensorop,f16,256,64,32,1,1,1,4,4,1,1,16,8,16,80,1024,1434451968,5566428610560,3880,24.537,54.4459,226859
1,CUTLASS,gemm,cutlass_tensorop_h16816gemm_256x64_32x4_nn_align4,passed,success,universal,8192,9216,36864,f16:column,f16:column,f16:column,f16:column,1,0,serial,1,1,heuristic,tensorop,f16,256,64,32,1,1,1,4,4,1,1,16,8,16,80,1024,1434451968,5566428610560,3880,27.0796,49.3338,205558
1,CUTLASS,gemm,cutlass_tensorop_h16816gemm_256x64_32x4_nn_align2,passed,success,universal,8192,9216,36864,f16:column,f16:column,f16:column,f16:column,1,0,serial,1,1,heuristic,tensorop,f16,256,64,32,1,1,1,4,4,1,1,16,8,16,80,1024,1434451968,5566428610560,3880,61.3089,21.7903,90793.1
1,CUTLASS,gemm,cutlass_tensorop_h16816gemm_64x256_32x4_nn_align8,passed,success,universal,8192,9216,36864,f16:column,f16:column,f16:column,f16:column,1,0,serial,1,1,heuristic,tensorop,f16,64,256,32,1,1,1,4,1,4,1,16,8,16,80,1024,1434451968,5566428610560,3880,24.4215,54.7032,227931
1,CUTLASS,gemm,cutlass_tensorop_h16816gemm_64x256_32x4_nn_align4,passed,success,universal,8192,9216,36864,f16:column,f16:column,f16:column,f16:column,1,0,serial,1,1,heuristic,tensorop,f16,64,256,32,1,1,1,4,1,4,1,16,8,16,80,1024,1434451968,5566428610560,3880,24.521,54.4813,227006
1,CUTLASS,gemm,cutlass_tensorop_h16816gemm_64x256_32x4_nn_align2,passed,success,universal,8192,9216,36864,f16:column,f16:column,f16:column,f16:column,1,0,serial,1,1,heuristic,tensorop,f16,64,256,32,1,1,1,4,1,4,1,16,8,16,80,1024,1434451968,5566428610560,3880,25.0204,53.3939,222475
1,CUTLASS,gemm,cutlass_tensorop_h16816gemm_128x128_32x3_nn_align8,passed,success,universal,8192,9216,36864,f16:column,f16:column,f16:column,f16:column,1,0,serial,1,1,heuristic,tensorop,f16,128,128,32,1,1,1,3,2,2,1,16,8,16,80,1024,1434451968,5566428610560,3880,19.7937,67.493,281222
1,CUTLASS,gemm,cutlass_tensorop_h16816gemm_128x128_32x3_nn_align4,passed,success,universal,8192,9216,36864,f16:column,f16:column,f16:column,f16:column,1,0,serial,1,1,heuristic,tensorop,f16,128,128,32,1,1,1,3,2,2,1,16,8,16,80,1024,1434451968,5566428610560,3880,20.7912,64.255,267730
1,CUTLASS,gemm,cutlass_tensorop_h16816gemm_128x128_32x3_nn_align2,passed,success,universal,8192,9216,36864,f16:column,f16:column,f16:column,f16:column,1,0,serial,1,1,heuristic,tensorop,f16,128,128,32,1,1,1,3,2,2,1,16,8,16,80,1024,1434451968,5566428610560,3880,22.29,59.9343,249727
1,CUTLASS,gemm,cutlass_tensorop_h16816gemm_128x128_32x4_nn_align8,passed,success,universal,8192,9216,36864,f16:column,f16:column,f16:column,f16:column,1,0,serial,1,1,heuristic,tensorop,f16,128,128,32,1,1,1,4,2,2,1,16,8,16,80,1024,1434451968,5566428610560,3880,20.6105,64.8184,270078
1,CUTLASS,gemm,cutlass_tensorop_h16816gemm_128x128_32x4_nn_align4,passed,success,universal,8192,9216,36864,f16:column,f16:column,f16:column,f16:column,1,0,serial,1,1,heuristic,tensorop,f16,128,128,32,1,1,1,4,2,2,1,16,8,16,80,1024,1434451968,5566428610560,3880,21.2025,63.0084,262536
1,CUTLASS,gemm,cutlass_tensorop_h16816gemm_128x128_32x4_nn_align2,passed,success,universal,8192,9216,36864,f16:column,f16:column,f16:column,f16:column,1,0,serial,1,1,heuristic,tensorop,f16,128,128,32,1,1,1,4,2,2,1,16,8,16,80,1024,1434451968,5566428610560,3880,23.4985,56.852,236884
1,CUTLASS,gemm,cutlass_tensorop_h16816gemm_128x128_32x5_nn_align8,passed,success,universal,8192,9216,36864,f16:column,f16:column,f16:column,f16:column,1,0,serial,1,1,heuristic,tensorop,f16,128,128,32,1,1,1,5,2,2,1,16,8,16,80,1024,1434451968,5566428610560,3880,20.2955,65.8244,274269
1,CUTLASS,gemm,cutlass_tensorop_h16816gemm_128x128_32x5_nn_align4,passed,success,universal,8192,9216,36864,f16:column,f16:column,f16:column,f16:column,1,0,serial,1,1,heuristic,tensorop,f16,128,128,32,1,1,1,5,2,2,1,16,8,16,80,1024,1434451968,5566428610560,3880,21.2113,62.9822,262427
1,CUTLASS,gemm,cutlass_tensorop_h16816gemm_128x128_32x5_nn_align2,passed,success,universal,8192,9216,36864,f16:column,f16:column,f16:column,f16:column,1,0,serial,1,1,heuristic,tensorop,f16,128,128,32,1,1,1,5,2,2,1,16,8,16,80,1024,1434451968,5566428610560,3880,23.659,56.4664,235278
1,CUTLASS,gemm,cutlass_tensorop_h16816gemm_128x64_32x6_nn_align8,passed,success,universal,8192,9216,36864,f16:column,f16:column,f16:column,f16:column,1,0,serial,1,1,heuristic,tensorop,f16,128,64,32,1,1,1,6,2,2,1,16,8,16,80,1024,1434451968,5566428610560,3880,27.9662,47.7698,199042
1,CUTLASS,gemm,cutlass_tensorop_h16816gemm_128x64_32x6_nn_align4,passed,success,universal,8192,9216,36864,f16:column,f16:column,f16:column,f16:column,1,0,serial,1,1,heuristic,tensorop,f16,128,64,32,1,1,1,6,2,2,1,16,8,16,80,1024,1434451968,5566428610560,3880,30.3182,44.0639,183600
1,CUTLASS,gemm,cutlass_tensorop_h16816gemm_128x64_32x6_nn_align2,passed,success,universal,8192,9216,36864,f16:column,f16:column,f16:column,f16:column,1,0,serial,1,1,heuristic,tensorop,f16,128,64,32,1,1,1,6,2,2,1,16,8,16,80,1024,1434451968,5566428610560,3880,35.1893,37.9643,158185
1,CUTLASS,gemm,cutlass_tensorop_h16816gemm_64x128_32x6_nn_align8,passed,success,universal,8192,9216,36864,f16:column,f16:column,f16:column,f16:column,1,0,serial,1,1,heuristic,tensorop,f16,64,128,32,1,1,1,6,2,2,1,16,8,16,80,1024,1434451968,5566428610560,3880,27.6005,48.4027,201679
1,CUTLASS,gemm,cutlass_tensorop_h16816gemm_64x128_32x6_nn_align4,passed,success,universal,8192,9216,36864,f16:column,f16:column,f16:column,f16:column,1,0,serial,1,1,heuristic,tensorop,f16,64,128,32,1,1,1,6,2,2,1,16,8,16,80,1024,1434451968,5566428610560,3880,28.855,46.2983,192911
1,CUTLASS,gemm,cutlass_tensorop_h16816gemm_64x128_32x6_nn_align2,passed,success,universal,8192,9216,36864,f16:column,f16:column,f16:column,f16:column,1,0,serial,1,1,heuristic,tensorop,f16,64,128,32,1,1,1,6,2,2,1,16,8,16,80,1024,1434451968,5566428610560,3880,30.0716,44.4252,185106
1,CUTLASS,gemm,cutlass_tensorop_h16816gemm_64x64_32x10_nn_align8,passed,success,universal,8192,9216,36864,f16:column,f16:column,f16:column,f16:column,1,0,serial,1,1,heuristic,tensorop,f16,64,64,32,1,1,1,10,2,2,1,16,8,16,80,1024,1434451968,5566428610560,3880,34.5083,38.7136,161307
1,CUTLASS,gemm,cutlass_tensorop_h16816gemm_64x64_32x10_nn_align4,passed,success,universal,8192,9216,36864,f16:column,f16:column,f16:column,f16:column,1,0,serial,1,1,heuristic,tensorop,f16,64,64,32,1,1,1,10,2,2,1,16,8,16,80,1024,1434451968,5566428610560,3880,36.1816,36.9231,153847
1,CUTLASS,gemm,cutlass_tensorop_h16816gemm_64x64_32x10_nn_align2,passed,success,universal,8192,9216,36864,f16:column,f16:column,f16:column,f16:column,1,0,serial,1,1,heuristic,tensorop,f16,64,64,32,1,1,1,10,2,2,1,16,8,16,80,1024,1434451968,5566428610560,3880,42.1475,31.6967,132070
1,CUTLASS,gemm,cutlass_tensorop_h16816gemm_128x128_64x3_nn_align8,passed,success,universal,8192,9216,36864,f16:column,f16:column,f16:column,f16:column,1,0,serial,1,1,heuristic,tensorop,f16,128,128,64,1,1,1,3,2,2,1,16,8,16,80,1024,1434451968,5566428610560,3880,20.234,66.0245,275103
1,CUTLASS,gemm,cutlass_tensorop_h16816gemm_128x128_64x3_nn_align4,passed,success,universal,8192,9216,36864,f16:column,f16:column,f16:column,f16:column,1,0,serial,1,1,heuristic,tensorop,f16,128,128,64,1,1,1,3,2,2,1,16,8,16,80,1024,1434451968,5566428610560,3880,20.7201,64.4754,268649
1,CUTLASS,gemm,cutlass_tensorop_h16816gemm_128x128_64x3_nn_align2,passed,success,universal,8192,9216,36864,f16:column,f16:column,f16:column,f16:column,1,0,serial,1,1,heuristic,tensorop,f16,128,128,64,1,1,1,3,2,2,1,16,8,16,80,1024,1434451968,5566428610560,3880,21.702,61.5581,256493
1,CUTLASS,gemm,cutlass_tensorop_h16816gemm_128x64_64x3_nn_align8,passed,success,universal,8192,9216,36864,f16:column,f16:column,f16:column,f16:column,1,0,serial,1,1,heuristic,tensorop,f16,128,64,64,1,1,1,3,2,2,1,16,8,16,80,1024,1434451968,5566428610560,3880,27.5238,48.5376,202241
1,CUTLASS,gemm,cutlass_tensorop_h16816gemm_128x64_64x3_nn_align4,passed,success,universal,8192,9216,36864,f16:column,f16:column,f16:column,f16:column,1,0,serial,1,1,heuristic,tensorop,f16,128,64,64,1,1,1,3,2,2,1,16,8,16,80,1024,1434451968,5566428610560,3880,28.4532,46.9522,195635
1,CUTLASS,gemm,cutlass_tensorop_h16816gemm_128x64_64x3_nn_align2,passed,success,universal,8192,9216,36864,f16:column,f16:column,f16:column,f16:column,1,0,serial,1,1,heuristic,tensorop,f16,128,64,64,1,1,1,3,2,2,1,16,8,16,80,1024,1434451968,5566428610560,3880,29.8609,44.7387,186412
1,CUTLASS,gemm,cutlass_tensorop_h16816gemm_64x128_64x3_nn_align8,passed,success,universal,8192,9216,36864,f16:column,f16:column,f16:column,f16:column,1,0,serial,1,1,heuristic,tensorop,f16,64,128,64,1,1,1,3,2,2,1,16,8,16,80,1024,1434451968,5566428610560,3880,27.8318,48.0004,200002
1,CUTLASS,gemm,cutlass_tensorop_h16816gemm_64x128_64x3_nn_align4,passed,success,universal,8192,9216,36864,f16:column,f16:column,f16:column,f16:column,1,0,serial,1,1,heuristic,tensorop,f16,64,128,64,1,1,1,3,2,2,1,16,8,16,80,1024,1434451968,5566428610560,3880,28.6735,46.5913,194131
1,CUTLASS,gemm,cutlass_tensorop_h16816gemm_64x128_64x3_nn_align2,passed,success,universal,8192,9216,36864,f16:column,f16:column,f16:column,f16:column,1,0,serial,1,1,heuristic,tensorop,f16,64,128,64,1,1,1,3,2,2,1,16,8,16,80,1024,1434451968,5566428610560,3880,29.768,44.8783,186994
1,CUTLASS,gemm,cutlass_tensorop_h16816gemm_64x64_64x5_nn_align8,passed,success,universal,8192,9216,36864,f16:column,f16:column,f16:column,f16:column,1,0,serial,1,1,heuristic,tensorop,f16,64,64,64,1,1,1,5,2,2,1,16,8,16,80,1024,1434451968,5566428610560,3880,34.4017,38.8335,161807
1,CUTLASS,gemm,cutlass_tensorop_h16816gemm_64x64_64x5_nn_align4,passed,success,universal,8192,9216,36864,f16:column,f16:column,f16:column,f16:column,1,0,serial,1,1,heuristic,tensorop,f16,64,64,64,1,1,1,5,2,2,1,16,8,16,80,1024,1434451968,5566428610560,3880,35.5603,37.5682,156535
1,CUTLASS,gemm,cutlass_tensorop_h16816gemm_64x64_64x5_nn_align2,passed,success,universal,8192,9216,36864,f16:column,f16:column,f16:column,f16:column,1,0,serial,1,1,heuristic,tensorop,f16,64,64,64,1,1,1,5,2,2,1,16,8,16,80,1024,1434451968,5566428610560,3880,38.837,34.3985,143328
1,CUTLASS,gemm,cutlass_tensorop_h16816gemm_256x128_32x3_nt_align8,passed,success,universal,8192,9216,36864,f16:column,f16:row,f16:column,f16:column,1,0,serial,1,1,heuristic,tensorop,f16,256,128,32,1,1,1,3,4,2,1,16,8,16,80,1024,1434451968,5566428610560,3880,16.9941,78.6118,327551
1,CUTLASS,gemm,cutlass_tensorop_h16816gemm_256x128_32x3_nt_align4,passed,success,universal,8192,9216,36864,f16:column,f16:row,f16:column,f16:column,1,0,serial,1,1,heuristic,tensorop,f16,256,128,32,1,1,1,3,4,2,1,16,8,16,80,1024,1434451968,5566428610560,3880,17.8066,75.0247,312604
1,CUTLASS,gemm,cutlass_tensorop_h16816gemm_256x128_32x3_nt_align2,passed,success,universal,8192,9216,36864,f16:column,f16:row,f16:column,f16:column,1,0,serial,1,1,heuristic,tensorop,f16,256,128,32,1,1,1,3,4,2,1,16,8,16,80,1024,1434451968,5566428610560,3880,18.4697,72.3314,301382
1,CUTLASS,gemm,cutlass_tensorop_h16816gemm_128x256_32x3_nt_align8,passed,success,universal,8192,9216,36864,f16:column,f16:row,f16:column,f16:column,1,0,serial,1,1,heuristic,tensorop,f16,128,256,32,1,1,1,3,2,4,1,16,8,16,80,1024,1434451968,5566428610560,3880,17.3712,76.9051,320439
1,CUTLASS,gemm,cutlass_tensorop_h16816gemm_128x256_32x3_nt_align4,passed,success,universal,8192,9216,36864,f16:column,f16:row,f16:column,f16:column,1,0,serial,1,1,heuristic,tensorop,f16,128,256,32,1,1,1,3,2,4,1,16,8,16,80,1024,1434451968,5566428610560,3880,17.7208,75.388,314118
1,CUTLASS,gemm,cutlass_tensorop_h16816gemm_128x256_32x3_nt_align2,passed,success,universal,8192,9216,36864,f16:column,f16:row,f16:column,f16:column,1,0,serial,1,1,heuristic,tensorop,f16,128,256,32,1,1,1,3,2,4,1,16,8,16,80,1024,1434451968,5566428610560,3880,18.5136,72.1597,300667
1,CUTLASS,gemm,cutlass_tensorop_h16816gemm_256x64_32x3_nt_align8,passed,success,universal,8192,9216,36864,f16:column,f16:row,f16:column,f16:column,1,0,serial,1,1,heuristic,tensorop,f16,256,64,32,1,1,1,3,4,1,1,16,8,16,80,1024,1434451968,5566428610560,3880,22.5561,59.2274,246782
1,CUTLASS,gemm,cutlass_tensorop_h16816gemm_256x64_32x3_nt_align4,passed,success,universal,8192,9216,36864,f16:column,f16:row,f16:column,f16:column,1,0,serial,1,1,heuristic,tensorop,f16,256,64,32,1,1,1,3,4,1,1,16,8,16,80,1024,1434451968,5566428610560,3880,23.3401,57.2378,238492
1,CUTLASS,gemm,cutlass_tensorop_h16816gemm_256x64_32x3_nt_align2,passed,success,universal,8192,9216,36864,f16:column,f16:row,f16:column,f16:column,1,0,serial,1,1,heuristic,tensorop,f16,256,64,32,1,1,1,3,4,1,1,16,8,16,80,1024,1434451968,5566428610560,3880,24.5689,54.3751,226564
1,CUTLASS,gemm,cutlass_tensorop_h16816gemm_256x64_32x4_nt_align8,passed,success,universal,8192,9216,36864,f16:column,f16:row,f16:column,f16:column,1,0,serial,1,1,heuristic,tensorop,f16,256,64,32,1,1,1,4,4,1,1,16,8,16,80,1024,1434451968,5566428610560,3880,22.4949,59.3884,247453
1,CUTLASS,gemm,cutlass_tensorop_h16816gemm_256x64_32x4_nt_align4,passed,success,universal,8192,9216,36864,f16:column,f16:row,f16:column,f16:column,1,0,serial,1,1,heuristic,tensorop,f16,256,64,32,1,1,1,4,4,1,1,16,8,16,80,1024,1434451968,5566428610560,3880,23.2555,57.446,239359
1,CUTLASS,gemm,cutlass_tensorop_h16816gemm_256x64_32x4_nt_align2,passed,success,universal,8192,9216,36864,f16:column,f16:row,f16:column,f16:column,1,0,serial,1,1,heuristic,tensorop,f16,256,64,32,1,1,1,4,4,1,1,16,8,16,80,1024,1434451968,5566428610560,3880,24.5684,54.3762,226569
1,CUTLASS,gemm,cutlass_tensorop_h16816gemm_64x256_32x4_nt_align8,passed,success,universal,8192,9216,36864,f16:column,f16:row,f16:column,f16:column,1,0,serial,1,1,heuristic,tensorop,f16,64,256,32,1,1,1,4,1,4,1,16,8,16,80,1024,1434451968,5566428610560,3880,23.4643,56.9348,237229
1,CUTLASS,gemm,cutlass_tensorop_h16816gemm_64x256_32x4_nt_align4,passed,success,universal,8192,9216,36864,f16:column,f16:row,f16:column,f16:column,1,0,serial,1,1,heuristic,tensorop,f16,64,256,32,1,1,1,4,1,4,1,16,8,16,80,1024,1434451968,5566428610560,3880,23.9097,55.8743,232811
1,CUTLASS,gemm,cutlass_tensorop_h16816gemm_64x256_32x4_nt_align2,passed,success,universal,8192,9216,36864,f16:column,f16:row,f16:column,f16:column,1,0,serial,1,1,heuristic,tensorop,f16,64,256,32,1,1,1,4,1,4,1,16,8,16,80,1024,1434451968,5566428610560,3880,24.3421,54.8817,228675
1,CUTLASS,gemm,cutlass_tensorop_h16816gemm_128x128_32x3_nt_align8,passed,success,universal,8192,9216,36864,f16:column,f16:row,f16:column,f16:column,1,0,serial,1,1,heuristic,tensorop,f16,128,128,32,1,1,1,3,2,2,1,16,8,16,80,1024,1434451968,5566428610560,3880,19.0739,70.0399,291834
1,CUTLASS,gemm,cutlass_tensorop_h16816gemm_128x128_32x3_nt_align4,passed,success,universal,8192,9216,36864,f16:column,f16:row,f16:column,f16:column,1,0,serial,1,1,heuristic,tensorop,f16,128,128,32,1,1,1,3,2,2,1,16,8,16,80,1024,1434451968,5566428610560,3880,19.8302,67.3689,280705
1,CUTLASS,gemm,cutlass_tensorop_h16816gemm_128x128_32x3_nt_align2,passed,success,universal,8192,9216,36864,f16:column,f16:row,f16:column,f16:column,1,0,serial,1,1,heuristic,tensorop,f16,128,128,32,1,1,1,3,2,2,1,16,8,16,80,1024,1434451968,5566428610560,3880,19.8334,67.3578,280659
1,CUTLASS,gemm,cutlass_tensorop_h16816gemm_128x128_32x4_nt_align8,passed,success,universal,8192,9216,36864,f16:column,f16:row,f16:column,f16:column,1,0,serial,1,1,heuristic,tensorop,f16,128,128,32,1,1,1,4,2,2,1,16,8,16,80,1024,1434451968,5566428610560,3880,19.1933,69.6042,290019
1,CUTLASS,gemm,cutlass_tensorop_h16816gemm_128x128_32x4_nt_align4,passed,success,universal,8192,9216,36864,f16:column,f16:row,f16:column,f16:column,1,0,serial,1,1,heuristic,tensorop,f16,128,128,32,1,1,1,4,2,2,1,16,8,16,80,1024,1434451968,5566428610560,3880,19.7323,67.7031,282097
1,CUTLASS,gemm,cutlass_tensorop_h16816gemm_128x128_32x4_nt_align2,passed,success,universal,8192,9216,36864,f16:column,f16:row,f16:column,f16:column,1,0,serial,1,1,heuristic,tensorop,f16,128,128,32,1,1,1,4,2,2,1,16,8,16,80,1024,1434451968,5566428610560,3880,20.011,66.7602,278169
1,CUTLASS,gemm,cutlass_tensorop_h16816gemm_128x128_32x5_nt_align8,passed,success,universal,8192,9216,36864,f16:column,f16:row,f16:column,f16:column,1,0,serial,1,1,heuristic,tensorop,f16,128,128,32,1,1,1,5,2,2,1,16,8,16,80,1024,1434451968,5566428610560,3880,19.2118,69.5374,289740
1,CUTLASS,gemm,cutlass_tensorop_h16816gemm_128x128_32x5_nt_align4,passed,success,universal,8192,9216,36864,f16:column,f16:row,f16:column,f16:column,1,0,serial,1,1,heuristic,tensorop,f16,128,128,32,1,1,1,5,2,2,1,16,8,16,80,1024,1434451968,5566428610560,3880,19.8188,67.4076,280866
1,CUTLASS,gemm,cutlass_tensorop_h16816gemm_128x128_32x5_nt_align2,passed,success,universal,8192,9216,36864,f16:column,f16:row,f16:column,f16:column,1,0,serial,1,1,heuristic,tensorop,f16,128,128,32,1,1,1,5,2,2,1,16,8,16,80,1024,1434451968,5566428610560,3880,20.1792,66.2038,275850
1,CUTLASS,gemm,cutlass_tensorop_h16816gemm_128x64_32x6_nt_align8,passed,success,universal,8192,9216,36864,f16:column,f16:row,f16:column,f16:column,1,0,serial,1,1,heuristic,tensorop,f16,128,64,32,1,1,1,6,2,2,1,16,8,16,80,1024,1434451968,5566428610560,3880,26.4731,50.464,210268
1,CUTLASS,gemm,cutlass_tensorop_h16816gemm_128x64_32x6_nt_align4,passed,success,universal,8192,9216,36864,f16:column,f16:row,f16:column,f16:column,1,0,serial,1,1,heuristic,tensorop,f16,128,64,32,1,1,1,6,2,2,1,16,8,16,80,1024,1434451968,5566428610560,3880,27.5481,48.4947,202062
1,CUTLASS,gemm,cutlass_tensorop_h16816gemm_128x64_32x6_nt_align2,passed,success,universal,8192,9216,36864,f16:column,f16:row,f16:column,f16:column,1,0,serial,1,1,heuristic,tensorop,f16,128,64,32,1,1,1,6,2,2,1,16,8,16,80,1024,1434451968,5566428610560,3880,28.3411,47.1377,196408
1,CUTLASS,gemm,cutlass_tensorop_h16816gemm_64x128_32x6_nt_align8,passed,success,universal,8192,9216,36864,f16:column,f16:row,f16:column,f16:column,1,0,serial,1,1,heuristic,tensorop,f16,64,128,32,1,1,1,6,2,2,1,16,8,16,80,1024,1434451968,5566428610560,3880,26.8044,49.8402,207668
1,CUTLASS,gemm,cutlass_tensorop_h16816gemm_64x128_32x6_nt_align4,passed,success,universal,8192,9216,36864,f16:column,f16:row,f16:column,f16:column,1,0,serial,1,1,heuristic,tensorop,f16,64,128,32,1,1,1,6,2,2,1,16,8,16,80,1024,1434451968,5566428610560,3880,27.6936,48.24,201001
1,CUTLASS,gemm,cutlass_tensorop_h16816gemm_64x128_32x6_nt_align2,passed,success,universal,8192,9216,36864,f16:column,f16:row,f16:column,f16:column,1,0,serial,1,1,heuristic,tensorop,f16,64,128,32,1,1,1,6,2,2,1,16,8,16,80,1024,1434451968,5566428610560,3880,28.4482,46.9604,195669
1,CUTLASS,gemm,cutlass_tensorop_h16816gemm_64x64_32x10_nt_align8,passed,success,universal,8192,9216,36864,f16:column,f16:row,f16:column,f16:column,1,0,serial,1,1,heuristic,tensorop,f16,64,64,32,1,1,1,10,2,2,1,16,8,16,80,1024,1434451968,5566428610560,3880,34.0942,39.1838,163266
1,CUTLASS,gemm,cutlass_tensorop_h16816gemm_64x64_32x10_nt_align4,passed,success,universal,8192,9216,36864,f16:column,f16:row,f16:column,f16:column,1,0,serial,1,1,heuristic,tensorop,f16,64,64,32,1,1,1,10,2,2,1,16,8,16,80,1024,1434451968,5566428610560,3880,35.1624,37.9933,158306
1,CUTLASS,gemm,cutlass_tensorop_h16816gemm_64x64_32x10_nt_align2,passed,success,universal,8192,9216,36864,f16:column,f16:row,f16:column,f16:column,1,0,serial,1,1,heuristic,tensorop,f16,64,64,32,1,1,1,10,2,2,1,16,8,16,80,1024,1434451968,5566428610560,3880,37.0476,36.06,150251
1,CUTLASS,gemm,cutlass_tensorop_h16816gemm_128x128_64x3_nt_align8,passed,success,universal,8192,9216,36864,f16:column,f16:row,f16:column,f16:column,1,0,serial,1,1,heuristic,tensorop,f16,128,128,64,1,1,1,3,2,2,1,16,8,16,80,1024,1434451968,5566428610560,3880,19.1515,69.7561,290652
1,CUTLASS,gemm,cutlass_tensorop_h16816gemm_128x128_64x3_nt_align4,passed,success,universal,8192,9216,36864,f16:column,f16:row,f16:column,f16:column,1,0,serial,1,1,heuristic,tensorop,f16,128,128,64,1,1,1,3,2,2,1,16,8,16,80,1024,1434451968,5566428610560,3880,19.7478,67.6498,281875
1,CUTLASS,gemm,cutlass_tensorop_h16816gemm_128x128_64x3_nt_align2,passed,success,universal,8192,9216,36864,f16:column,f16:row,f16:column,f16:column,1,0,serial,1,1,heuristic,tensorop,f16,128,128,64,1,1,1,3,2,2,1,16,8,16,80,1024,1434451968,5566428610560,3880,21.4682,62.2288,259288
1,CUTLASS,gemm,cutlass_tensorop_h16816gemm_128x64_64x3_nt_align8,passed,success,universal,8192,9216,36864,f16:column,f16:row,f16:column,f16:column,1,0,serial,1,1,heuristic,tensorop,f16,128,64,64,1,1,1,3,2,2,1,16,8,16,80,1024,1434451968,5566428610560,3880,26.5388,50.339,209747
1,CUTLASS,gemm,cutlass_tensorop_h16816gemm_128x64_64x3_nt_align4,passed,success,universal,8192,9216,36864,f16:column,f16:row,f16:column,f16:column,1,0,serial,1,1,heuristic,tensorop,f16,128,64,64,1,1,1,3,2,2,1,16,8,16,80,1024,1434451968,5566428610560,3880,27.7274,48.1811,200755
1,CUTLASS,gemm,cutlass_tensorop_h16816gemm_128x64_64x3_nt_align2,passed,success,universal,8192,9216,36864,f16:column,f16:row,f16:column,f16:column,1,0,serial,1,1,heuristic,tensorop,f16,128,64,64,1,1,1,3,2,2,1,16,8,16,80,1024,1434451968,5566428610560,3880,29.5166,45.2606,188586
1,CUTLASS,gemm,cutlass_tensorop_h16816gemm_64x128_64x3_nt_align8,passed,success,universal,8192,9216,36864,f16:column,f16:row,f16:column,f16:column,1,0,serial,1,1,heuristic,tensorop,f16,64,128,64,1,1,1,3,2,2,1,16,8,16,80,1024,1434451968,5566428610560,3880,26.8972,49.6683,206952
