CUTLASS/cutlassgemm-benchmark/csv_logs/cutlass_shape_8192_14336_57344_performance.gemm.csv
Problem,Provider,OperationKind,Operation,Disposition,Status,gemm_kind,split_k_mode,m,n,k,A,B,C,alpha,beta,split_k_slices,batch_count,op_class,accum,cta_m,cta_n,cta_k,stages,warps_m,warps_n,warps_k,inst_m,inst_n,inst_k,min_cc,max_cc,Bytes,Flops,Flops/Byte,Runtime,GB/s,GFLOPs
1,CUTLASS,gemm,cutlass_tensorop_h1688gemm_256x128_32x2_nn_align8,passed,success,universal,serial,8192,57344,14336,f16:column,f16:column,f16:column,1,0,1,1,tensorop,f16,256,128,32,2,4,2,1,16,8,8,75,1024,2818572288,13469956964352,4779,105.177,24.9579,128069
1,CUTLASS,gemm,cutlass_tensorop_h1688gemm_256x128_32x2_nn_align4,passed,success,universal,serial,8192,57344,14336,f16:column,f16:column,f16:column,1,0,1,1,tensorop,f16,256,128,32,2,4,2,1,16,8,8,75,1024,2818572288,13469956964352,4779,129.115,20.3307,104325
1,CUTLASS,gemm,cutlass_tensorop_h1688gemm_256x128_32x2_nn_align2,passed,success,universal,serial,8192,57344,14336,f16:column,f16:column,f16:column,1,0,1,1,tensorop,f16,256,128,32,2,4,2,1,16,8,8,75,1024,2818572288,13469956964352,4779,145.827,18.0007,92369.2
1,CUTLASS,gemm,cutlass_tensorop_h1688gemm_256x128_32x2_nn_align1,passed,success,universal,serial,8192,57344,14336,f16:column,f16:column,f16:column,1,0,1,1,tensorop,f16,256,128,32,2,4,2,1,16,8,8,75,1024,2818572288,13469956964352,4779,198.467,13.2264,67870.1
1,CUTLASS,gemm,cutlass_tensorop_h1688gemm_128x256_32x2_nn_align8,passed,success,universal,serial,8192,57344,14336,f16:column,f16:column,f16:column,1,0,1,1,tensorop,f16,128,256,32,2,2,4,1,16,8,8,75,1024,2818572288,13469956964352,4779,102.763,25.5441,131077
1,CUTLASS,gemm,cutlass_tensorop_h1688gemm_128x256_32x2_nn_align4,passed,success,universal,serial,8192,57344,14336,f16:column,f16:column,f16:column,1,0,1,1,tensorop,f16,128,256,32,2,2,4,1,16,8,8,75,1024,2818572288,13469956964352,4779,110.844,23.682,121522
1,CUTLASS,gemm,cutlass_tensorop_h1688gemm_128x256_32x2_nn_align2,passed,success,universal,serial,8192,57344,14336,f16:column,f16:column,f16:column,1,0,1,1,tensorop,f16,128,256,32,2,2,4,1,16,8,8,75,1024,2818572288,13469956964352,4779,125.646,20.892,107206
1,CUTLASS,gemm,cutlass_tensorop_h1688gemm_128x256_32x2_nn_align1,passed,success,universal,serial,8192,57344,14336,f16:column,f16:column,f16:column,1,0,1,1,tensorop,f16,128,256,32,2,2,4,1,16,8,8,75,1024,2818572288,13469956964352,4779,185.15,14.1777,72751.4
