CUTLASS/cutlassgemm-benchmark/csv_logs/cutlass_shape_8192_36864_9216_performance.gemm.csv
Problem,Provider,OperationKind,Operation,Disposition,Status,gemm_kind,split_k_mode,m,n,k,A,B,C,alpha,beta,split_k_slices,batch_count,op_class,accum,cta_m,cta_n,cta_k,stages,warps_m,warps_n,warps_k,inst_m,inst_n,inst_k,min_cc,max_cc,Bytes,Flops,Flops/Byte,Runtime,GB/s,GFLOPs
1,CUTLASS,gemm,cutlass_tensorop_h1688gemm_256x128_32x2_nn_align8,incorrect,success,universal,serial,8192,9216,36864,f16:column,f16:column,f16:column,1,0,1,1,tensorop,f16,256,128,32,2,4,2,1,16,8,8,75,1024,1434451968,5566428610560,3880,48.5789,27.5004,114585
1,CUTLASS,gemm,cutlass_tensorop_h1688gemm_256x128_32x2_nn_align4,incorrect,success,universal,serial,8192,9216,36864,f16:column,f16:column,f16:column,1,0,1,1,tensorop,f16,256,128,32,2,4,2,1,16,8,8,75,1024,1434451968,5566428610560,3880,55.7653,23.9564,99818.9
1,CUTLASS,gemm,cutlass_tensorop_h1688gemm_256x128_32x2_nn_align2,incorrect,success,universal,serial,8192,9216,36864,f16:column,f16:column,f16:column,1,0,1,1,tensorop,f16,256,128,32,2,4,2,1,16,8,8,75,1024,1434451968,5566428610560,3880,61.9752,21.556,89817
1,CUTLASS,gemm,cutlass_tensorop_h1688gemm_256x128_32x2_nn_align1,incorrect,success,universal,serial,8192,9216,36864,f16:column,f16:column,f16:column,1,0,1,1,tensorop,f16,256,128,32,2,4,2,1,16,8,8,75,1024,1434451968,5566428610560,3880,84.8414,15.7463,65609.8
1,CUTLASS,gemm,cutlass_tensorop_h1688gemm_128x256_32x2_nn_align8,incorrect,success,universal,serial,8192,9216,36864,f16:column,f16:column,f16:column,1,0,1,1,tensorop,f16,128,256,32,2,2,4,1,16,8,8,75,1024,1434451968,5566428610560,3880,43.173,30.9438,128933
1,CUTLASS,gemm,cutlass_tensorop_h1688gemm_128x256_32x2_nn_align4,incorrect,success,universal,serial,8192,9216,36864,f16:column,f16:column,f16:column,1,0,1,1,tensorop,f16,128,256,32,2,2,4,1,16,8,8,75,1024,1434451968,5566428610560,3880,46.2003,28.9162,120485
1,CUTLASS,gemm,cutlass_tensorop_h1688gemm_128x256_32x2_nn_align2,incorrect,success,universal,serial,8192,9216,36864,f16:column,f16:column,f16:column,1,0,1,1,tensorop,f16,128,256,32,2,2,4,1,16,8,8,75,1024,1434451968,5566428610560,3880,52.837,25.2841,105351
1,CUTLASS,gemm,cutlass_tensorop_h1688gemm_128x256_32x2_nn_align1,incorrect,success,universal,serial,8192,9216,36864,f16:column,f16:column,f16:column,1,0,1,1,tensorop,f16,128,256,32,2,2,4,1,16,8,8,75,1024,1434451968,5566428610560,3880,78.4042,17.0391,70996.6
1,CUTLASS,gemm,cutlass_tensorop_h1688gemm_128x128_32x2_nn_align8,incorrect,success,universal,serial,8192,9216,36864,f16:column,f16:column,f16:column,1,0,1,1,tensorop,f16,128,128,32,2,2,2,1,16,8,8,75,1024,1434451968,5566428610560,3880,93.397,14.3039,59599.7
1,CUTLASS,gemm,cutlass_tensorop_h1688gemm_128x128_32x2_nn_align4,incorrect,success,universal,serial,8192,9216,36864,f16:column,f16:column,f16:column,1,0,1,1,tensorop,f16,128,128,32,2,2,2,1,16,8,8,75,1024,1434451968,5566428610560,3880,64.476,20.7199,86333.4
1,CUTLASS,gemm,cutlass_tensorop_h1688gemm_128x128_32x2_nn_align2,incorrect,success,universal,serial,8192,9216,36864,f16:column,f16:column,f16:column,1,0,1,1,tensorop,f16,128,128,32,2,2,2,1,16,8,8,75,1024,1434451968,5566428610560,3880,74.894,17.8377,74324.1
1,CUTLASS,gemm,cutlass_tensorop_h1688gemm_128x128_32x2_nn_align1,incorrect,success,universal,serial,8192,9216,36864,f16:column,f16:column,f16:column,1,0,1,1,tensorop,f16,128,128,32,2,2,2,1,16,8,8,75,1024,1434451968,5566428610560,3880,86.928,15.3683,64035
1,CUTLASS,gemm,cutlass_tensorop_h1688gemm_64x256_32x2_nn_align8,incorrect,success,universal,serial,8192,9216,36864,f16:column,f16:column,f16:column,1,0,1,1,tensorop,f16,64,256,32,2,1,4,1,16,8,8,75,1024,1434451968,5566428610560,3880,73.7106,18.1241,75517.4
1,CUTLASS,gemm,cutlass_tensorop_h1688gemm_64x256_32x2_nn_align4,incorrect,success,universal,serial,8192,9216,36864,f16:column,f16:column,f16:column,1,0,1,1,tensorop,f16,64,256,32,2,1,4,1,16,8,8,75,1024,1434451968,5566428610560,3880,102.346,13.0532,54388.5
1,CUTLASS,gemm,cutlass_tensorop_h1688gemm_64x256_32x2_nn_align2,incorrect,success,universal,serial,8192,9216,36864,f16:column,f16:column,f16:column,1,0,1,1,tensorop,f16,64,256,32,2,1,4,1,16,8,8,75,1024,1434451968,5566428610560,3880,90.9803,14.6838,61182.8
1,CUTLASS,gemm,cutlass_tensorop_h1688gemm_64x256_32x2_nn_align1,incorrect,success,universal,serial,8192,9216,36864,f16:column,f16:column,f16:column,1,0,1,1,tensorop,f16,64,256,32,2,1,4,1,16,8,8,75,1024,1434451968,5566428610560,3880,109.029,12.253,51054.4
1,CUTLASS,gemm,cutlass_tensorop_h1688gemm_256x64_32x2_nn_align8,incorrect,success,universal,serial,8192,9216,36864,f16:column,f16:column,f16:column,1,0,1,1,tensorop,f16,256,64,32,2,4,1,1,16,8,8,75,1024,1434451968,5566428610560,3880,93.5062,14.2871,59530
1,CUTLASS,gemm,cutlass_tensorop_h1688gemm_256x64_32x2_nn_align4,incorrect,success,universal,serial,8192,9216,36864,f16:column,f16:column,f16:column,1,0,1,1,tensorop,f16,256,64,32,2,4,1,1,16,8,8,75,1024,1434451968,5566428610560,3880,84.4623,15.817,65904.3
1,CUTLASS,gemm,cutlass_tensorop_h1688gemm_256x64_32x2_nn_align2,incorrect,success,universal,serial,8192,9216,36864,f16:column,f16:column,f16:column,1,0,1,1,tensorop,f16,256,64,32,2,4,1,1,16,8,8,75,1024,1434451968,5566428610560,3880,91.683,14.5713,60713.8
1,CUTLASS,gemm,cutlass_tensorop_h1688gemm_256x64_32x2_nn_align1,incorrect,success,universal,serial,8192,9216,36864,f16:column,f16:column,f16:column,1,0,1,1,tensorop,f16,256,64,32,2,4,1,1,16,8,8,75,1024,1434451968,5566428610560,3880,111.775,11.952,49800.3
1,CUTLASS,gemm,cutlass_tensorop_h1688gemm_64x128_32x2_nn_align8,incorrect,success,universal,serial,8192,9216,36864,f16:column,f16:column,f16:column,1,0,1,1,tensorop,f16,64,128,32,2,2,2,1,16,8,8,75,1024,1434451968,5566428610560,3880,134.303,9.94716,41446.7
1,CUTLASS,gemm,cutlass_tensorop_h1688gemm_64x128_32x2_nn_align4,incorrect,success,universal,serial,8192,9216,36864,f16:column,f16:column,f16:column,1,0,1,1,tensorop,f16,64,128,32,2,2,2,1,16,8,8,75,1024,1434451968,5566428610560,3880,134.844,9.90726,41280.4
1,CUTLASS,gemm,cutlass_tensorop_h1688gemm_64x128_32x2_nn_align2,incorrect,success,universal,serial,8192,9216,36864,f16:column,f16:column,f16:column,1,0,1,1,tensorop,f16,64,128,32,2,2,2,1,16,8,8,75,1024,1434451968,5566428610560,3880,133.675,9.9939,41641.4
1,CUTLASS,gemm,cutlass_tensorop_h1688gemm_64x128_32x2_nn_align1,incorrect,success,universal,serial,8192,9216,36864,f16:column,f16:column,f16:column,1,0,1,1,tensorop,f16,64,128,32,2,2,2,1,16,8,8,75,1024,1434451968,5566428610560,3880,115.116,11.6051,48355
1,CUTLASS,gemm,cutlass_tensorop_h1688gemm_128x64_32x2_nn_align8,incorrect,success,universal,serial,8192,9216,36864,f16:column,f16:column,f16:column,1,0,1,1,tensorop,f16,128,64,32,2,2,2,1,16,8,8,75,1024,1434451968,5566428610560,3880,123.178,10.8456,45190
1,CUTLASS,gemm,cutlass_tensorop_h1688gemm_128x64_32x2_nn_align4,incorrect,success,universal,serial,8192,9216,36864,f16:column,f16:column,f16:column,1,0,1,1,tensorop,f16,128,64,32,2,2,2,1,16,8,8,75,1024,1434451968,5566428610560,3880,112.375,11.8882,49534.3
1,CUTLASS,gemm,cutlass_tensorop_h1688gemm_128x64_32x2_nn_align2,incorrect,success,universal,serial,8192,9216,36864,f16:column,f16:column,f16:column,1,0,1,1,tensorop,f16,128,64,32,2,2,2,1,16,8,8,75,1024,1434451968,5566428610560,3880,122.233,10.9294,45539.3
1,CUTLASS,gemm,cutlass_tensorop_h1688gemm_128x64_32x2_nn_align1,incorrect,success,universal,serial,8192,9216,36864,f16:column,f16:column,f16:column,1,0,1,1,tensorop,f16,128,64,32,2,2,2,1,16,8,8,75,1024,1434451968,5566428610560,3880,133.236,10.0268,41778.6
1,CUTLASS,gemm,cutlass_tensorop_h1688gemm_64x64_32x2_nn_align8,incorrect,success,universal,serial,8192,9216,36864,f16:column,f16:column,f16:column,1,0,1,1,tensorop,f16,64,64,32,2,2,2,1,16,8,8,75,1024,1434451968,5566428610560,3880,169.031,7.90349,32931.3
1,CUTLASS,gemm,cutlass_tensorop_h1688gemm_64x64_32x2_nn_align4,incorrect,success,universal,serial,8192,9216,36864,f16:column,f16:column,f16:column,1,0,1,1,tensorop,f16,64,64,32,2,2,2,1,16,8,8,75,1024,1434451968,5566428610560,3880,162.004,8.24633,34359.8
1,CUTLASS,gemm,cutlass_tensorop_h1688gemm_64x64_32x2_nn_align2,incorrect,success,universal,serial,8192,9216,36864,f16:column,f16:column,f16:column,1,0,1,1,tensorop,f16,64,64,32,2,2,2,1,16,8,8,75,1024,1434451968,5566428610560,3880,158.109,8.44947,35206.3
1,CUTLASS,gemm,cutlass_tensorop_h1688gemm_64x64_32x2_nn_align1,incorrect,success,universal,serial,8192,9216,36864,f16:column,f16:column,f16:column,1,0,1,1,tensorop,f16,64,64,32,2,2,2,1,16,8,8,75,1024,1434451968,5566428610560,3880,161.177,8.28865,34536.2
1,CUTLASS,gemm,cutlass_tensorop_h1688gemm_64x128_64x2_nn_align8,incorrect,success,universal,serial,8192,9216,36864,f16:column,f16:column,f16:column,1,0,1,1,tensorop,f16,64,128,64,2,1,2,2,16,8,8,75,1024,1434451968,5566428610560,3880,108.766,12.2827,51178
1,CUTLASS,gemm,cutlass_tensorop_h1688gemm_64x128_64x2_nn_align4,incorrect,success,universal,serial,8192,9216,36864,f16:column,f16:column,f16:column,1,0,1,1,tensorop,f16,64,128,64,2,1,2,2,16,8,8,75,1024,1434451968,5566428610560,3880,115.786,11.538,48075.2
1,CUTLASS,gemm,cutlass_tensorop_h1688gemm_64x128_64x2_nn_align2,incorrect,success,universal,serial,8192,9216,36864,f16:column,f16:column,f16:column,1,0,1,1,tensorop,f16,64,128,64,2,1,2,2,16,8,8,75,1024,1434451968,5566428610560,3880,107.103,12.4734,51972.7
1,CUTLASS,gemm,cutlass_tensorop_h1688gemm_64x128_64x2_nn_align1,incorrect,success,universal,serial,8192,9216,36864,f16:column,f16:column,f16:column,1,0,1,1,tensorop,f16,64,128,64,2,1,2,2,16,8,8,75,1024,1434451968,5566428610560,3880,118.855,11.24,46833.6
1,CUTLASS,gemm,cutlass_tensorop_h1688gemm_256x128_32x2_nt_align8,incorrect,success,universal,serial,8192,9216,36864,f16:column,f16:row,f16:column,1,0,1,1,tensorop,f16,256,128,32,2,4,2,1,16,8,8,75,1024,1434451968,5566428610560,3880,42.744,31.2544,130227
1,CUTLASS,gemm,cutlass_tensorop_h1688gemm_256x128_32x2_nt_align4,incorrect,success,universal,serial,8192,9216,36864,f16:column,f16:row,f16:column,1,0,1,1,tensorop,f16,256,128,32,2,4,2,1,16,8,8,75,1024,1434451968,5566428610560,3880,48.9541,27.2896,113707
1,CUTLASS,gemm,cutlass_tensorop_h1688gemm_256x128_32x2_nt_align2,incorrect,success,universal,serial,8192,9216,36864,f16:column,f16:row,f16:column,1,0,1,1,tensorop,f16,256,128,32,2,4,2,1,16,8,8,75,1024,1434451968,5566428610560,3880,55.4308,24.101,100421
1,CUTLASS,gemm,cutlass_tensorop_h1688gemm_256x128_32x2_nt_align1,incorrect,success,universal,serial,8192,9216,36864,f16:column,f16:row,f16:column,1,0,1,1,tensorop,f16,256,128,32,2,4,2,1,16,8,8,75,1024,1434451968,5566428610560,3880,62.8216,21.2656,88606.9
1,CUTLASS,gemm,cutlass_tensorop_h1688gemm_128x256_32x2_nt_align8,incorrect,success,universal,serial,8192,9216,36864,f16:column,f16:row,f16:column,1,0,1,1,tensorop,f16,128,256,32,2,2,4,1,16,8,8,75,1024,1434451968,5566428610560,3880,42.7466,31.2525,130219
1,CUTLASS,gemm,cutlass_tensorop_h1688gemm_128x256_32x2_nt_align4,incorrect,success,universal,serial,8192,9216,36864,f16:column,f16:row,f16:column,1,0,1,1,tensorop,f16,128,256,32,2,2,4,1,16,8,8,75,1024,1434451968,5566428610560,3880,46.9611,28.4478,118533
1,CUTLASS,gemm,cutlass_tensorop_h1688gemm_128x256_32x2_nt_align2,incorrect,success,universal,serial,8192,9216,36864,f16:column,f16:row,f16:column,1,0,1,1,tensorop,f16,128,256,32,2,2,4,1,16,8,8,75,1024,1434451968,5566428610560,3880,56.1313,23.8002,99168
1,CUTLASS,gemm,cutlass_tensorop_h1688gemm_128x256_32x2_nt_align1,incorrect,success,universal,serial,8192,9216,36864,f16:column,f16:row,f16:column,1,0,1,1,tensorop,f16,128,256,32,2,2,4,1,16,8,8,75,1024,1434451968,5566428610560,3880,62.8681,21.2499,88541.4
1,CUTLASS,gemm,cutlass_tensorop_h1688gemm_128x128_32x2_nt_align8,incorrect,success,universal,serial,8192,9216,36864,f16:column,f16:row,f16:column,1,0,1,1,tensorop,f16,128,128,32,2,2,2,1,16,8,8,75,1024,1434451968,5566428610560,3880,73.4016,18.2004,75835.3
1,CUTLASS,gemm,cutlass_tensorop_h1688gemm_128x128_32x2_nt_align4,incorrect,success,universal,serial,8192,9216,36864,f16:column,f16:row,f16:column,1,0,1,1,tensorop,f16,128,128,32,2,2,2,1,16,8,8,75,1024,1434451968,5566428610560,3880,76.5193,17.4588,72745.4
1,CUTLASS,gemm,cutlass_tensorop_h1688gemm_128x128_32x2_nt_align2,incorrect,success,universal,serial,8192,9216,36864,f16:column,f16:row,f16:column,1,0,1,1,tensorop,f16,128,128,32,2,2,2,1,16,8,8,75,1024,1434451968,5566428610560,3880,72.5185,18.422,76758.8
1,CUTLASS,gemm,cutlass_tensorop_h1688gemm_128x128_32x2_nt_align1,incorrect,success,universal,serial,8192,9216,36864,f16:column,f16:row,f16:column,1,0,1,1,tensorop,f16,128,128,32,2,2,2,1,16,8,8,75,1024,1434451968,5566428610560,3880,74.7109,17.8814,74506.2
1,CUTLASS,gemm,cutlass_tensorop_h1688gemm_64x256_32x2_nt_align8,incorrect,success,universal,serial,8192,9216,36864,f16:column,f16:row,f16:column,1,0,1,1,tensorop,f16,64,256,32,2,1,4,1,16,8,8,75,1024,1434451968,5566428610560,3880,86.3053,15.4792,64497
1,CUTLASS,gemm,cutlass_tensorop_h1688gemm_64x256_32x2_nt_align4,incorrect,success,universal,serial,8192,9216,36864,f16:column,f16:row,f16:column,1,0,1,1,tensorop,f16,64,256,32,2,1,4,1,16,8,8,75,1024,1434451968,5566428610560,3880,103.455,12.9133,53805.5
1,CUTLASS,gemm,cutlass_tensorop_h1688gemm_64x256_32x2_nt_align2,incorrect,success,universal,serial,8192,9216,36864,f16:column,f16:row,f16:column,1,0,1,1,tensorop,f16,64,256,32,2,1,4,1,16,8,8,75,1024,1434451968,5566428610560,3880,92.8172,14.3932,59971.9
1,CUTLASS,gemm,cutlass_tensorop_h1688gemm_64x256_32x2_nt_align1,incorrect,success,universal,serial,8192,9216,36864,f16:column,f16:row,f16:column,1,0,1,1,tensorop,f16,64,256,32,2,1,4,1,16,8,8,75,1024,1434451968,5566428610560,3880,83.1188,16.0726,66969.6
1,CUTLASS,gemm,cutlass_tensorop_h1688gemm_256x64_32x2_nt_align8,incorrect,success,universal,serial,8192,9216,36864,f16:column,f16:row,f16:column,1,0,1,1,tensorop,f16,256,64,32,2,4,1,1,16,8,8,75,1024,1434451968,5566428610560,3880,66.6212,20.0528,83553.5
1,CUTLASS,gemm,cutlass_tensorop_h1688gemm_256x64_32x2_nt_align4,incorrect,success,universal,serial,8192,9216,36864,f16:column,f16:row,f16:column,1,0,1,1,tensorop,f16,256,64,32,2,4,1,1,16,8,8,75,1024,1434451968,5566428610560,3880,64.6698,20.6578,86074.6
1,CUTLASS,gemm,cutlass_tensorop_h1688gemm_256x64_32x2_nt_align2,incorrect,success,universal,serial,8192,9216,36864,f16:column,f16:row,f16:column,1,0,1,1,tensorop,f16,256,64,32,2,4,1,1,16,8,8,75,1024,1434451968,5566428610560,3880,65.9184,20.2665,84444.3
1,CUTLASS,gemm,cutlass_tensorop_h1688gemm_256x64_32x2_nt_align1,incorrect,success,universal,serial,8192,9216,36864,f16:column,f16:row,f16:column,1,0,1,1,tensorop,f16,256,64,32,2,4,1,1,16,8,8,75,1024,1434451968,5566428610560,3880,84.288,15.8497,66040.6
1,CUTLASS,gemm,cutlass_tensorop_h1688gemm_64x128_32x2_nt_align8,incorrect,success,universal,serial,8192,9216,36864,f16:column,f16:row,f16:column,1,0,1,1,tensorop,f16,64,128,32,2,2,2,1,16,8,8,75,1024,1434451968,5566428610560,3880,105.234,12.695,52895.9
1,CUTLASS,gemm,cutlass_tensorop_h1688gemm_64x128_32x2_nt_align4,incorrect,success,universal,serial,8192,9216,36864,f16:column,f16:row,f16:column,1,0,1,1,tensorop,f16,64,128,32,2,2,2,1,16,8,8,75,1024,1434451968,5566428610560,3880,120.246,11.11,46291.9
1,CUTLASS,gemm,cutlass_tensorop_h1688gemm_64x128_32x2_nt_align2,incorrect,success,universal,serial,8192,9216,36864,f16:column,f16:row,f16:column,1,0,1,1,tensorop,f16,64,128,32,2,2,2,1,16,8,8,75,1024,1434451968,5566428610560,3880,79.1156,16.8859,70358.2
1,CUTLASS,gemm,cutlass_tensorop_h1688gemm_64x128_32x2_nt_align1,incorrect,success,universal,serial,8192,9216,36864,f16:column,f16:row,f16:column,1,0,1,1,tensorop,f16,64,128,32,2,2,2,1,16,8,8,75,1024,1434451968,5566428610560,3880,121.678,10.9793,45747.3
1,CUTLASS,gemm,cutlass_tensorop_h1688gemm_128x64_32x2_nt_align8,incorrect,success,universal,serial,8192,9216,36864,f16:column,f16:row,f16:column,1,0,1,1,tensorop,f16,128,64,32,2,2,2,1,16,8,8,75,1024,1434451968,5566428610560,3880,69.3175,19.2727,80303.3
1,CUTLASS,gemm,cutlass_tensorop_h1688gemm_128x64_32x2_nt_align4,incorrect,success,universal,serial,8192,9216,36864,f16:column,f16:row,f16:column,1,0,1,1,tensorop,f16,128,64,32,2,2,2,1,16,8,8,75,1024,1434451968,5566428610560,3880,105.721,12.6364,52651.9
1,CUTLASS,gemm,cutlass_tensorop_h1688gemm_128x64_32x2_nt_align2,incorrect,success,universal,serial,8192,9216,36864,f16:column,f16:row,f16:column,1,0,1,1,tensorop,f16,128,64,32,2,2,2,1,16,8,8,75,1024,1434451968,5566428610560,3880,83.886,15.9256,66357.1
1,CUTLASS,gemm,cutlass_tensorop_h1688gemm_128x64_32x2_nt_align1,incorrect,success,universal,serial,8192,9216,36864,f16:column,f16:row,f16:column,1,0,1,1,tensorop,f16,128,64,32,2,2,2,1,16,8,8,75,1024,1434451968,5566428610560,3880,110.326,12.109,50454.6
1,CUTLASS,gemm,cutlass_tensorop_h1688gemm_64x64_32x2_nt_align8,incorrect,success,universal,serial,8192,9216,36864,f16:column,f16:row,f16:column,1,0,1,1,tensorop,f16,64,64,32,2,2,2,1,16,8,8,75,1024,1434451968,5566428610560,3880,85.6801,15.5922,64967.6
1,CUTLASS,gemm,cutlass_tensorop_h1688gemm_64x64_32x2_nt_align4,incorrect,success,universal,serial,8192,9216,36864,f16:column,f16:row,f16:column,1,0,1,1,tensorop,f16,64,64,32,2,2,2,1,16,8,8,75,1024,1434451968,5566428610560,3880,87.3178,15.2997,63749.1
1,CUTLASS,gemm,cutlass_tensorop_h1688gemm_64x64_32x2_nt_align2,incorrect,success,universal,serial,8192,9216,36864,f16:column,f16:row,f16:column,1,0,1,1,tensorop,f16,64,64,32,2,2,2,1,16,8,8,75,1024,1434451968,5566428610560,3880,96.659,13.8211,57588.3
1,CUTLASS,gemm,cutlass_tensorop_h1688gemm_64x64_32x2_nt_align1,incorrect,success,universal,serial,8192,9216,36864,f16:column,f16:row,f16:column,1,0,1,1,tensorop,f16,64,64,32,2,2,2,1,16,8,8,75,1024,1434451968,5566428610560,3880,124.87,10.6986,44577.6
1,CUTLASS,gemm,cutlass_tensorop_h1688gemm_64x128_64x2_nt_align8,incorrect,success,universal,serial,8192,9216,36864,f16:column,f16:row,f16:column,1,0,1,1,tensorop,f16,64,128,64,2,1,2,2,16,8,8,75,1024,1434451968,5566428610560,3880,109.844,12.1621,50675.6
1,CUTLASS,gemm,cutlass_tensorop_h1688gemm_64x128_64x2_nt_align4,incorrect,success,universal,serial,8192,9216,36864,f16:column,f16:row,f16:column,1,0,1,1,tensorop,f16,64,128,64,2,1,2,2,16,8,8,75,1024,1434451968,5566428610560,3880,114.449,11.6728,48636.8
1,CUTLASS,gemm,cutlass_tensorop_h1688gemm_64x128_64x2_nt_align2,incorrect,success,universal,serial,8192,9216,36864,f16:column,f16:row,f16:column,1,0,1,1,tensorop,f16,64,128,64,2,1,2,2,16,8,8,75,1024,1434451968,5566428610560,3880,97.3925,13.717,57154.6
1,CUTLASS,gemm,cutlass_tensorop_h1688gemm_64x128_64x2_nt_align1,incorrect,success,universal,serial,8192,9216,36864,f16:column,f16:row,f16:column,1,0,1,1,tensorop,f16,64,128,64,2,1,2,2,16,8,8,75,1024,1434451968,5566428610560,3880,93.2604,14.3248,59686.9
1,CUTLASS,gemm,cutlass_tensorop_h1688gemm_256x128_32x2_tn_align8,incorrect,success,universal,serial,8192,9216,36864,f16:row,f16:column,f16:column,1,0,1,1,tensorop,f16,256,128,32,2,4,2,1,16,8,8,75,1024,1434451968,5566428610560,3880,62.7767,21.2808,88670.3
1,CUTLASS,gemm,cutlass_tensorop_h1688gemm_256x128_32x2_tn_align4,incorrect,success,universal,serial,8192,9216,36864,f16:row,f16:column,f16:column,1,0,1,1,tensorop,f16,256,128,32,2,4,2,1,16,8,8,75,1024,1434451968,5566428610560,3880,62.4038,21.408,89200.2
1,CUTLASS,gemm,cutlass_tensorop_h1688gemm_256x128_32x2_tn_align2,incorrect,success,universal,serial,8192,9216,36864,f16:row,f16:column,f16:column,1,0,1,1,tensorop,f16,256,128,32,2,4,2,1,16,8,8,75,1024,1434451968,5566428610560,3880,65.9681,20.2513,84380.6
1,CUTLASS,gemm,cutlass_tensorop_h1688gemm_256x128_32x2_tn_align1,incorrect,success,universal,serial,8192,9216,36864,f16:row,f16:column,f16:column,1,0,1,1,tensorop,f16,256,128,32,2,4,2,1,16,8,8,75,1024,1434451968,5566428610560,3880,91.7381,14.5625,60677.4
1,CUTLASS,gemm,cutlass_tensorop_h1688gemm_128x256_32x2_tn_align8,incorrect,success,universal,serial,8192,9216,36864,f16:row,f16:column,f16:column,1,0,1,1,tensorop,f16,128,256,32,2,2,4,1,16,8,8,75,1024,1434451968,5566428610560,3880,72.1917,18.5054,77106.2
1,CUTLASS,gemm,cutlass_tensorop_h1688gemm_128x256_32x2_tn_align4,incorrect,success,universal,serial,8192,9216,36864,f16:row,f16:column,f16:column,1,0,1,1,tensorop,f16,128,256,32,2,2,4,1,16,8,8,75,1024,1434451968,5566428610560,3880,75.0468,17.8014,74172.8
1,CUTLASS,gemm,cutlass_tensorop_h1688gemm_128x256_32x2_tn_align2,incorrect,success,universal,serial,8192,9216,36864,f16:row,f16:column,f16:column,1,0,1,1,tensorop,f16,128,256,32,2,2,4,1,16,8,8,75,1024,1434451968,5566428610560,3880,73.577,18.157,75654.5
1,CUTLASS,gemm,cutlass_tensorop_h1688gemm_128x256_32x2_tn_align1,incorrect,success,universal,serial,8192,9216,36864,f16:row,f16:column,f16:column,1,0,1,1,tensorop,f16,128,256,32,2,2,4,1,16,8,8,75,1024,1434451968,5566428610560,3880,91.6646,14.5742,60726.1
1,CUTLASS,gemm,cutlass_tensorop_h1688gemm_128x128_32x2_tn_align8,incorrect,success,universal,serial,8192,9216,36864,f16:row,f16:column,f16:column,1,0,1,1,tensorop,f16,128,128,32,2,2,2,1,16,8,8,75,1024,1434451968,5566428610560,3880,156.987,8.50988,35458
1,CUTLASS,gemm,cutlass_tensorop_h1688gemm_128x128_32x2_tn_align4,incorrect,success,universal,serial,8192,9216,36864,f16:row,f16:column,f16:column,1,0,1,1,tensorop,f16,128,128,32,2,2,2,1,16,8,8,75,1024,1434451968,5566428610560,3880,154.375,8.65386,36057.9
1,CUTLASS,gemm,cutlass_tensorop_h1688gemm_128x128_32x2_tn_align2,incorrect,success,universal,serial,8192,9216,36864,f16:row,f16:column,f16:column,1,0,1,1,tensorop,f16,128,128,32,2,2,2,1,16,8,8,75,1024,1434451968,5566428610560,3880,153.206,8.71987,36333
1,CUTLASS,gemm,cutlass_tensorop_h1688gemm_128x128_32x2_tn_align1,incorrect,success,universal,serial,8192,9216,36864,f16:row,f16:column,f16:column,1,0,1,1,tensorop,f16,128,128,32,2,2,2,1,16,8,8,75,1024,1434451968,5566428610560,3880,108.942,12.2628,51095.3
1,CUTLASS,gemm,cutlass_tensorop_h1688gemm_64x256_32x2_tn_align8,incorrect,success,universal,serial,8192,9216,36864,f16:row,f16:column,f16:column,1,0,1,1,tensorop,f16,64,256,32,2,1,4,1,16,8,8,75,1024,1434451968,5566428610560,3880,175.32,7.61999,31750.1
1,CUTLASS,gemm,cutlass_tensorop_h1688gemm_64x256_32x2_tn_align4,incorrect,success,universal,serial,8192,9216,36864,f16:row,f16:column,f16:column,1,0,1,1,tensorop,f16,64,256,32,2,1,4,1,16,8,8,75,1024,1434451968,5566428610560,3880,172.991,7.72257,32177.5
1,CUTLASS,gemm,cutlass_tensorop_h1688gemm_64x256_32x2_tn_align2,incorrect,success,universal,serial,8192,9216,36864,f16:row,f16:column,f16:column,1,0,1,1,tensorop,f16,64,256,32,2,1,4,1,16,8,8,75,1024,1434451968,5566428610560,3880,178.738,7.47426,31142.9
1,CUTLASS,gemm,cutlass_tensorop_h1688gemm_64x256_32x2_tn_align1,incorrect,success,universal,serial,8192,9216,36864,f16:row,f16:column,f16:column,1,0,1,1,tensorop,f16,64,256,32,2,1,4,1,16,8,8,75,1024,1434451968,5566428610560,3880,172.265,7.75512,32313.1
1,CUTLASS,gemm,cutlass_tensorop_h1688gemm_256x64_32x2_tn_align8,incorrect,success,universal,serial,8192,9216,36864,f16:row,f16:column,f16:column,1,0,1,1,tensorop,f16,256,64,32,2,4,1,1,16,8,8,75,1024,1434451968,5566428610560,3880,154.505,8.64658,36027.5
1,CUTLASS,gemm,cutlass_tensorop_h1688gemm_256x64_32x2_tn_align4,incorrect,success,universal,serial,8192,9216,36864,f16:row,f16:column,f16:column,1,0,1,1,tensorop,f16,256,64,32,2,4,1,1,16,8,8,75,1024,1434451968,5566428610560,3880,138.075,9.67547,40314.6
1,CUTLASS,gemm,cutlass_tensorop_h1688gemm_256x64_32x2_tn_align2,incorrect,success,universal,serial,8192,9216,36864,f16:row,f16:column,f16:column,1,0,1,1,tensorop,f16,256,64,32,2,4,1,1,16,8,8,75,1024,1434451968,5566428610560,3880,148.021,9.0253,37605.6
1,CUTLASS,gemm,cutlass_tensorop_h1688gemm_256x64_32x2_tn_align1,incorrect,success,universal,serial,8192,9216,36864,f16:row,f16:column,f16:column,1,0,1,1,tensorop,f16,256,64,32,2,4,1,1,16,8,8,75,1024,1434451968,5566428610560,3880,117.864,11.3346,47227.7
1,CUTLASS,gemm,cutlass_tensorop_h1688gemm_64x128_32x2_tn_align8,incorrect,success,universal,serial,8192,9216,36864,f16:row,f16:column,f16:column,1,0,1,1,tensorop,f16,64,128,32,2,2,2,1,16,8,8,75,1024,1434451968,5566428610560,3880,234.994,5.685,23687.6
1,CUTLASS,gemm,cutlass_tensorop_h1688gemm_64x128_32x2_tn_align4,incorrect,success,universal,serial,8192,9216,36864,f16:row,f16:column,f16:column,1,0,1,1,tensorop,f16,64,128,32,2,2,2,1,16,8,8,75,1024,1434451968,5566428610560,3880,231.816,5.76292,24012.3
1,CUTLASS,gemm,cutlass_tensorop_h1688gemm_64x128_32x2_tn_align2,incorrect,success,universal,serial,8192,9216,36864,f16:row,f16:column,f16:column,1,0,1,1,tensorop,f16,64,128,32,2,2,2,1,16,8,8,75,1024,1434451968,5566428610560,3880,228.367,5.84996,24374.9
1,CUTLASS,gemm,cutlass_tensorop_h1688gemm_64x128_32x2_tn_align1,incorrect,success,universal,serial,8192,9216,36864,f16:row,f16:column,f16:column,1,0,1,1,tensorop,f16,64,128,32,2,2,2,1,16,8,8,75,1024,1434451968,5566428610560,3880,223.935,5.96573,24857.3
1,CUTLASS,gemm,cutlass_tensorop_h1688gemm_128x64_32x2_tn_align8,incorrect,success,universal,serial,8192,9216,36864,f16:row,f16:column,f16:column,1,0,1,1,tensorop,f16,128,64,32,2,2,2,1,16,8,8,75,1024,1434451968,5566428610560,3880,222.563,6.00252,25010.6
1,CUTLASS,gemm,cutlass_tensorop_h1688gemm_128x64_32x2_tn_align4,incorrect,success,universal,serial,8192,9216,36864,f16:row,f16:column,f16:column,1,0,1,1,tensorop,f16,128,64,32,2,2,2,1,16,8,8,75,1024,1434451968,5566428610560,3880,218.511,6.11382,25474.3
1,CUTLASS,gemm,cutlass_tensorop_h1688gemm_128x64_32x2_tn_align2,incorrect,success,universal,serial,8192,9216,36864,f16:row,f16:column,f16:column,1,0,1,1,tensorop,f16,128,64,32,2,2,2,1,16,8,8,75,1024,1434451968,5566428610560,3880,212.594,6.28398,26183.3
1,CUTLASS,gemm,cutlass_tensorop_h1688gemm_128x64_32x2_tn_align1,incorrect,success,universal,serial,8192,9216,36864,f16:row,f16:column,f16:column,1,0,1,1,tensorop,f16,128,64,32,2,2,2,1,16,8,8,75,1024,1434451968,5566428610560,3880,197.649,6.75913,28163.2
1,CUTLASS,gemm,cutlass_tensorop_h1688gemm_64x64_32x2_tn_align8,incorrect,success,universal,serial,8192,9216,36864,f16:row,f16:column,f16:column,1,0,1,1,tensorop,f16,64,64,32,2,2,2,1,16,8,8,75,1024,1434451968,5566428610560,3880,265.38,5.03406,20975.3
1,CUTLASS,gemm,cutlass_tensorop_h1688gemm_64x64_32x2_tn_align4,incorrect,success,universal,serial,8192,9216,36864,f16:row,f16:column,f16:column,1,0,1,1,tensorop,f16,64,64,32,2,2,2,1,16,8,8,75,1024,1434451968,5566428610560,3880,263.556,5.06888,21120.4
1,CUTLASS,gemm,cutlass_tensorop_h1688gemm_64x64_32x2_tn_align2,incorrect,success,universal,serial,8192,9216,36864,f16:row,f16:column,f16:column,1,0,1,1,tensorop,f16,64,64,32,2,2,2,1,16,8,8,75,1024,1434451968,5566428610560,3880,257.822,5.18163,21590.2
1,CUTLASS,gemm,cutlass_tensorop_h1688gemm_64x64_32x2_tn_align1,incorrect,success,universal,serial,8192,9216,36864,f16:row,f16:column,f16:column,1,0,1,1,tensorop,f16,64,64,32,2,2,2,1,16,8,8,75,1024,1434451968,5566428610560,3880,249.105,5.36295,22345.7
1,CUTLASS,gemm,cutlass_tensorop_h1688gemm_64x128_64x2_tn_align8,incorrect,success,universal,serial,8192,9216,36864,f16:row,f16:column,f16:column,1,0,1,1,tensorop,f16,64,128,64,2,1,2,2,16,8,8,75,1024,1434451968,5566428610560,3880,127.124,10.5089,43787.4
1,CUTLASS,gemm,cutlass_tensorop_h1688gemm_64x128_64x2_tn_align4,incorrect,success,universal,serial,8192,9216,36864,f16:row,f16:column,f16:column,1,0,1,1,tensorop,f16,64,128,64,2,1,2,2,16,8,8,75,1024,1434451968,5566428610560,3880,127.744,10.4579,43574.9
1,CUTLASS,gemm,cutlass_tensorop_h1688gemm_64x128_64x2_tn_align2,incorrect,success,universal,serial,8192,9216,36864,f16:row,f16:column,f16:column,1,0,1,1,tensorop,f16,64,128,64,2,1,2,2,16,8,8,75,1024,1434451968,5566428610560,3880,127.765,10.4562,43567.6
1,CUTLASS,gemm,cutlass_tensorop_h1688gemm_64x128_64x2_tn_align1,incorrect,success,universal,serial,8192,9216,36864,f16:row,f16:column,f16:column,1,0,1,1,tensorop,f16,64,128,64,2,1,2,2,16,8,8,75,1024,1434451968,5566428610560,3880,85.3794,15.6471,65196.4
1,CUTLASS,gemm,cutlass_tensorop_h1688gemm_256x128_32x2_tt_align8,incorrect,success,universal,serial,8192,9216,36864,f16:row,f16:row,f16:column,1,0,1,1,tensorop,f16,256,128,32,2,4,2,1,16,8,8,75,1024,1434451968,5566428610560,3880,46.0015,29.0412,121005
1,CUTLASS,gemm,cutlass_tensorop_h1688gemm_256x128_32x2_tt_align4,incorrect,success,universal,serial,8192,9216,36864,f16:row,f16:row,f16:column,1,0,1,1,tensorop,f16,256,128,32,2,4,2,1,16,8,8,75,1024,1434451968,5566428610560,3880,46.8776,28.4984,118744
1,CUTLASS,gemm,cutlass_tensorop_h1688gemm_256x128_32x2_tt_align2,incorrect,success,universal,serial,8192,9216,36864,f16:row,f16:row,f16:column,1,0,1,1,tensorop,f16,256,128,32,2,4,2,1,16,8,8,75,1024,1434451968,5566428610560,3880,56.8263,23.5091,97955.2
1,CUTLASS,gemm,cutlass_tensorop_h1688gemm_256x128_32x2_tt_align1,incorrect,success,universal,serial,8192,9216,36864,f16:row,f16:row,f16:column,1,0,1,1,tensorop,f16,256,128,32,2,4,2,1,16,8,8,75,1024,1434451968,5566428610560,3880,77.0488,17.3388,72245.5
1,CUTLASS,gemm,cutlass_tensorop_h1688gemm_128x256_32x2_tt_align8,incorrect,success,universal,serial,8192,9216,36864,f16:row,f16:row,f16:column,1,0,1,1,tensorop,f16,128,256,32,2,2,4,1,16,8,8,75,1024,1434451968,5566428610560,3880,66.5449,20.0757,83649.2
1,CUTLASS,gemm,cutlass_tensorop_h1688gemm_128x256_32x2_tt_align4,incorrect,success,universal,serial,8192,9216,36864,f16:row,f16:row,f16:column,1,0,1,1,tensorop,f16,128,256,32,2,2,4,1,16,8,8,75,1024,1434451968,5566428610560,3880,67.4653,19.8018,82508
1,CUTLASS,gemm,cutlass_tensorop_h1688gemm_128x256_32x2_tt_align2,incorrect,success,universal,serial,8192,9216,36864,f16:row,f16:row,f16:column,1,0,1,1,tensorop,f16,128,256,32,2,2,4,1,16,8,8,75,1024,1434451968,5566428610560,3880,66.3329,20.1399,83916.6
1,CUTLASS,gemm,cutlass_tensorop_h1688gemm_128x256_32x2_tt_align1,incorrect,success,universal,serial,8192,9216,36864,f16:row,f16:row,f16:column,1,0,1,1,tensorop,f16,128,256,32,2,2,4,1,16,8,8,75,1024,1434451968,5566428610560,3880,83.4145,16.0156,66732.1
1,CUTLASS,gemm,cutlass_tensorop_h1688gemm_128x128_32x2_tt_align8,incorrect,success,universal,serial,8192,9216,36864,f16:row,f16:row,f16:column,1,0,1,1,tensorop,f16,128,128,32,2,2,2,1,16,8,8,75,1024,1434451968,5566428610560,3880,104.885,12.7372,53072
1,CUTLASS,gemm,cutlass_tensorop_h1688gemm_128x128_32x2_tt_align4,incorrect,success,universal,serial,8192,9216,36864,f16:row,f16:row,f16:column,1,0,1,1,tensorop,f16,128,128,32,2,2,2,1,16,8,8,75,1024,1434451968,5566428610560,3880,93.8834,14.2298,59290.9
1,CUTLASS,gemm,cutlass_tensorop_h1688gemm_128x128_32x2_tt_align2,incorrect,success,universal,serial,8192,9216,36864,f16:row,f16:row,f16:column,1,0,1,1,tensorop,f16,128,128,32,2,2,2,1,16,8,8,75,1024,1434451968,5566428610560,3880,94.8499,14.0847,58686.7
1,CUTLASS,gemm,cutlass_tensorop_h1688gemm_128x128_32x2_tt_align1,incorrect,success,universal,serial,8192,9216,36864,f16:row,f16:row,f16:column,1,0,1,1,tensorop,f16,128,128,32,2,2,2,1,16,8,8,75,1024,1434451968,5566428610560,3880,85.8502,15.5613,64838.8
1,CUTLASS,gemm,cutlass_tensorop_h1688gemm_64x256_32x2_tt_align8,incorrect,success,universal,serial,8192,9216,36864,f16:row,f16:row,f16:column,1,0,1,1,tensorop,f16,64,256,32,2,1,4,1,16,8,8,75,1024,1434451968,5566428610560,3880,153.278,8.71577,36315.9
1,CUTLASS,gemm,cutlass_tensorop_h1688gemm_64x256_32x2_tt_align4,incorrect,success,universal,serial,8192,9216,36864,f16:row,f16:row,f16:column,1,0,1,1,tensorop,f16,64,256,32,2,1,4,1,16,8,8,75,1024,1434451968,5566428610560,3880,147.534,9.05513,37729.8
1,CUTLASS,gemm,cutlass_tensorop_h1688gemm_64x256_32x2_tt_align2,incorrect,success,universal,serial,8192,9216,36864,f16:row,f16:row,f16:column,1,0,1,1,tensorop,f16,64,256,32,2,1,4,1,16,8,8,75,1024,1434451968,5566428610560,3880,144.261,9.26058,38585.9
1,CUTLASS,gemm,cutlass_tensorop_h1688gemm_64x256_32x2_tt_align1,incorrect,success,universal,serial,8192,9216,36864,f16:row,f16:row,f16:column,1,0,1,1,tensorop,f16,64,256,32,2,1,4,1,16,8,8,75,1024,1434451968,5566428610560,3880,107.703,12.4039,51683.1
1,CUTLASS,gemm,cutlass_tensorop_h1688gemm_256x64_32x2_tt_align8,incorrect,success,universal,serial,8192,9216,36864,f16:row,f16:row,f16:column,1,0,1,1,tensorop,f16,256,64,32,2,4,1,1,16,8,8,75,1024,1434451968,5566428610560,3880,61.3535,21.7744,90727.2
1,CUTLASS,gemm,cutlass_tensorop_h1688gemm_256x64_32x2_tt_align4,incorrect,success,universal,serial,8192,9216,36864,f16:row,f16:row,f16:column,1,0,1,1,tensorop,f16,256,64,32,2,4,1,1,16,8,8,75,1024,1434451968,5566428610560,3880,65.5013,20.3956,84982
1,CUTLASS,gemm,cutlass_tensorop_h1688gemm_256x64_32x2_tt_align2,incorrect,success,universal,serial,8192,9216,36864,f16:row,f16:row,f16:column,1,0,1,1,tensorop,f16,256,64,32,2,4,1,1,16,8,8,75,1024,1434451968,5566428610560,3880,66.7971,19.9999,83333.4
1,CUTLASS,gemm,cutlass_tensorop_h1688gemm_256x64_32x2_tt_align1,incorrect,success,universal,serial,8192,9216,36864,f16:row,f16:row,f16:column,1,0,1,1,tensorop,f16,256,64,32,2,4,1,1,16,8,8,75,1024,1434451968,5566428610560,3880,90.1661,14.8164,61735.3
1,CUTLASS,gemm,cutlass_tensorop_h1688gemm_64x128_32x2_tt_align8,incorrect,success,universal,serial,8192,9216,36864,f16:row,f16:row,f16:column,1,0,1,1,tensorop,f16,64,128,32,2,2,2,1,16,8,8,75,1024,1434451968,5566428610560,3880,181.742,7.35075,30628.2
1,CUTLASS,gemm,cutlass_tensorop_h1688gemm_64x128_32x2_tt_align4,incorrect,success,universal,serial,8192,9216,36864,f16:row,f16:row,f16:column,1,0,1,1,tensorop,f16,64,128,32,2,2,2,1,16,8,8,75,1024,1434451968,5566428610560,3880,178.885,7.46812,31117.3
1,CUTLASS,gemm,cutlass_tensorop_h1688gemm_64x128_32x2_tt_align2,incorrect,success,universal,serial,8192,9216,36864,f16:row,f16:row,f16:column,1,0,1,1,tensorop,f16,64,128,32,2,2,2,1,16,8,8,75,1024,1434451968,5566428610560,3880,176.198,7.582,31591.8
1,CUTLASS,gemm,cutlass_tensorop_h1688gemm_64x128_32x2_tt_align1,incorrect,success,universal,serial,8192,9216,36864,f16:row,f16:row,f16:column,1,0,1,1,tensorop,f16,64,128,32,2,2,2,1,16,8,8,75,1024,1434451968,5566428610560,3880,173.938,7.68054,32002.4
1,CUTLASS,gemm,cutlass_tensorop_h1688gemm_128x64_32x2_tt_align8,incorrect,success,universal,serial,8192,9216,36864,f16:row,f16:row,f16:column,1,0,1,1,tensorop,f16,128,64,32,2,2,2,1,16,8,8,75,1024,1434451968,5566428610560,3880,109.198,12.234,50975.4
1,CUTLASS,gemm,cutlass_tensorop_h1688gemm_128x64_32x2_tt_align4,incorrect,success,universal,serial,8192,9216,36864,f16:row,f16:row,f16:column,1,0,1,1,tensorop,f16,128,64,32,2,2,2,1,16,8,8,75,1024,1434451968,5566428610560,3880,83.0844,16.0793,66997.3
1,CUTLASS,gemm,cutlass_tensorop_h1688gemm_128x64_32x2_tt_align2,incorrect,success,universal,serial,8192,9216,36864,f16:row,f16:row,f16:column,1,0,1,1,tensorop,f16,128,64,32,2,2,2,1,16,8,8,75,1024,1434451968,5566428610560,3880,85.6255,15.6021,65009
1,CUTLASS,gemm,cutlass_tensorop_h1688gemm_128x64_32x2_tt_align1,incorrect,success,universal,serial,8192,9216,36864,f16:row,f16:row,f16:column,1,0,1,1,tensorop,f16,128,64,32,2,2,2,1,16,8,8,75,1024,1434451968,5566428610560,3880,112.612,11.8632,49430.1
1,CUTLASS,gemm,cutlass_tensorop_h1688gemm_64x64_32x2_tt_align8,incorrect,success,universal,serial,8192,9216,36864,f16:row,f16:row,f16:column,1,0,1,1,tensorop,f16,64,64,32,2,2,2,1,16,8,8,75,1024,1434451968,5566428610560,3880,182.986,7.30077,30420
1,CUTLASS,gemm,cutlass_tensorop_h1688gemm_64x64_32x2_tt_align4,incorrect,success,universal,serial,8192,9216,36864,f16:row,f16:row,f16:column,1,0,1,1,tensorop,f16,64,64,32,2,2,2,1,16,8,8,75,1024,1434451968,5566428610560,3880,188.026,7.10507,29604.6
1,CUTLASS,gemm,cutlass_tensorop_h1688gemm_64x64_32x2_tt_align2,incorrect,success,universal,serial,8192,9216,36864,f16:row,f16:row,f16:column,1,0,1,1,tensorop,f16,64,64,32,2,2,2,1,16,8,8,75,1024,1434451968,5566428610560,3880,182.817,7.30749,30448
1,CUTLASS,gemm,cutlass_tensorop_h1688gemm_64x64_32x2_tt_align1,incorrect,success,universal,serial,8192,9216,36864,f16:row,f16:row,f16:column,1,0,1,1,tensorop,f16,64,64,32,2,2,2,1,16,8,8,75,1024,1434451968,5566428610560,3880,164.388,8.12672,33861.5
1,CUTLASS,gemm,cutlass_tensorop_h1688gemm_64x128_64x2_tt_align8,incorrect,success,universal,serial,8192,9216,36864,f16:row,f16:row,f16:column,1,0,1,1,tensorop,f16,64,128,64,2,1,2,2,16,8,8,75,1024,1434451968,5566428610560,3880,122.178,10.9344,45560
1,CUTLASS,gemm,cutlass_tensorop_h1688gemm_64x128_64x2_tt_align4,incorrect,success,universal,serial,8192,9216,36864,f16:row,f16:row,f16:column,1,0,1,1,tensorop,f16,64,128,64,2,1,2,2,16,8,8,75,1024,1434451968,5566428610560,3880,122.584,10.8981,45408.9
1,CUTLASS,gemm,cutlass_tensorop_h1688gemm_64x128_64x2_tt_align2,incorrect,success,universal,serial,8192,9216,36864,f16:row,f16:row,f16:column,1,0,1,1,tensorop,f16,64,128,64,2,1,2,2,16,8,8,75,1024,1434451968,5566428610560,3880,121.015,11.0395,45998
1,CUTLASS,gemm,cutlass_tensorop_h1688gemm_64x128_64x2_tt_align1,incorrect,success,universal,serial,8192,9216,36864,f16:row,f16:row,f16:column,1,0,1,1,tensorop,f16,64,128,64,2,1,2,2,16,8,8,75,1024,1434451968,5566428610560,3880,112.582,11.8663,49443.3
1,CUTLASS,gemm,cutlass_tensorop_h16816gemm_256x128_32x3_nn_align8,incorrect,success,universal,serial,8192,9216,36864,f16:column,f16:column,f16:column,1,0,1,1,tensorop,f16,256,128,32,3,4,2,1,16,8,16,80,1024,1434451968,5566428610560,3880,41.1777,32.4432,135181
1,CUTLASS,gemm,cutlass_tensorop_h16816gemm_256x128_32x3_nn_align4,incorrect,success,universal,serial,8192,9216,36864,f16:column,f16:column,f16:column,1,0,1,1,tensorop,f16,256,128,32,3,4,2,1,16,8,16,80,1024,1434451968,5566428610560,3880,42.7684,31.2366,130153
1,CUTLASS,gemm,cutlass_tensorop_h16816gemm_256x128_32x3_nn_align2,incorrect,success,universal,serial,8192,9216,36864,f16:column,f16:column,f16:column,1,0,1,1,tensorop,f16,256,128,32,3,4,2,1,16,8,16,80,1024,1434451968,5566428610560,3880,51.7239,25.8283,107618
1,CUTLASS,gemm,cutlass_tensorop_h16816gemm_128x256_32x3_nn_align8,incorrect,success,universal,serial,8192,9216,36864,f16:column,f16:column,f16:column,1,0,1,1,tensorop,f16,128,256,32,3,2,4,1,16,8,16,80,1024,1434451968,5566428610560,3880,40.5144,32.9744,137394
1,CUTLASS,gemm,cutlass_tensorop_h16816gemm_128x256_32x3_nn_align4,incorrect,success,universal,serial,8192,9216,36864,f16:column,f16:column,f16:column,1,0,1,1,tensorop,f16,128,256,32,3,2,4,1,16,8,16,80,1024,1434451968,5566428610560,3880,42.1154,31.7209,132171
1,CUTLASS,gemm,cutlass_tensorop_h16816gemm_128x256_32x3_nn_align2,incorrect,success,universal,serial,8192,9216,36864,f16:column,f16:column,f16:column,1,0,1,1,tensorop,f16,128,256,32,3,2,4,1,16,8,16,80,1024,1434451968,5566428610560,3880,43.6816,30.5835,127432
1,CUTLASS,gemm,cutlass_tensorop_h16816gemm_256x64_32x3_nn_align8,incorrect,success,universal,serial,8192,9216,36864,f16:column,f16:column,f16:column,1,0,1,1,tensorop,f16,256,64,32,3,4,1,1,16,8,16,80,1024,1434451968,5566428610560,3880,55.9112,23.8939,99558.3
1,CUTLASS,gemm,cutlass_tensorop_h16816gemm_256x64_32x3_nn_align4,incorrect,success,universal,serial,8192,9216,36864,f16:column,f16:column,f16:column,1,0,1,1,tensorop,f16,256,64,32,3,4,1,1,16,8,16,80,1024,1434451968,5566428610560,3880,64.8923,20.587,85779.5
1,CUTLASS,gemm,cutlass_tensorop_h16816gemm_256x64_32x3_nn_align2,incorrect,success,universal,serial,8192,9216,36864,f16:column,f16:column,f16:column,1,0,1,1,tensorop,f16,256,64,32,3,4,1,1,16,8,16,80,1024,1434451968,5566428610560,3880,122.283,10.925,45521
1,CUTLASS,gemm,cutlass_tensorop_h16816gemm_256x64_32x4_nn_align8,incorrect,success,universal,serial,8192,9216,36864,f16:column,f16:column,f16:column,1,0,1,1,tensorop,f16,256,64,32,4,4,1,1,16,8,16,80,1024,1434451968,5566428610560,3880,56.6941,23.564,98183.6
1,CUTLASS,gemm,cutlass_tensorop_h16816gemm_256x64_32x4_nn_align4,incorrect,success,universal,serial,8192,9216,36864,f16:column,f16:column,f16:column,1,0,1,1,tensorop,f16,256,64,32,4,4,1,1,16,8,16,80,1024,1434451968,5566428610560,3880,71.8235,18.6003,77501.5
1,CUTLASS,gemm,cutlass_tensorop_h16816gemm_256x64_32x4_nn_align2,incorrect,success,universal,serial,8192,9216,36864,f16:column,f16:column,f16:column,1,0,1,1,tensorop,f16,256,64,32,4,4,1,1,16,8,16,80,1024,1434451968,5566428610560,3880,108.461,12.3172,51321.7
1,CUTLASS,gemm,cutlass_tensorop_h16816gemm_64x256_32x4_nn_align8,incorrect,success,universal,serial,8192,9216,36864,f16:column,f16:column,f16:column,1,0,1,1,tensorop,f16,64,256,32,4,1,4,1,16,8,16,80,1024,1434451968,5566428610560,3880,74.692,17.886,74525.1
1,CUTLASS,gemm,cutlass_tensorop_h16816gemm_64x256_32x4_nn_align4,incorrect,success,universal,serial,8192,9216,36864,f16:column,f16:column,f16:column,1,0,1,1,tensorop,f16,64,256,32,4,1,4,1,16,8,16,80,1024,1434451968,5566428610560,3880,64.685,20.653,86054.5
1,CUTLASS,gemm,cutlass_tensorop_h16816gemm_64x256_32x4_nn_align2,incorrect,success,universal,serial,8192,9216,36864,f16:column,f16:column,f16:column,1,0,1,1,tensorop,f16,64,256,32,4,1,4,1,16,8,16,80,1024,1434451968,5566428610560,3880,78.8273,16.9476,70615.5
1,CUTLASS,gemm,cutlass_tensorop_h16816gemm_128x128_32x3_nn_align8,incorrect,success,universal,serial,8192,9216,36864,f16:column,f16:column,f16:column,1,0,1,1,tensorop,f16,128,128,32,3,2,2,1,16,8,16,80,1024,1434451968,5566428610560,3880,69.4177,19.2449,80187.5
1,CUTLASS,gemm,cutlass_tensorop_h16816gemm_128x128_32x3_nn_align4,incorrect,success,universal,serial,8192,9216,36864,f16:column,f16:column,f16:column,1,0,1,1,tensorop,f16,128,128,32,3,2,2,1,16,8,16,80,1024,1434451968,5566428610560,3880,74.488,17.9349,74729.2
1,CUTLASS,gemm,cutlass_tensorop_h16816gemm_128x128_32x3_nn_align2,incorrect,success,universal,serial,8192,9216,36864,f16:column,f16:column,f16:column,1,0,1,1,tensorop,f16,128,128,32,3,2,2,1,16,8,16,80,1024,1434451968,5566428610560,3880,58.0941,22.9961,95817.5
1,CUTLASS,gemm,cutlass_tensorop_h16816gemm_128x128_32x4_nn_align8,incorrect,success,universal,serial,8192,9216,36864,f16:column,f16:column,f16:column,1,0,1,1,tensorop,f16,128,128,32,4,2,2,1,16,8,16,80,1024,1434451968,5566428610560,3880,44.8724,29.7719,124050
1,CUTLASS,gemm,cutlass_tensorop_h16816gemm_128x128_32x4_nn_align4,incorrect,success,universal,serial,8192,9216,36864,f16:column,f16:column,f16:column,1,0,1,1,tensorop,f16,128,128,32,4,2,2,1,16,8,16,80,1024,1434451968,5566428610560,3880,60.1314,22.217,92571
1,CUTLASS,gemm,cutlass_tensorop_h16816gemm_128x128_32x4_nn_align2,incorrect,success,universal,serial,8192,9216,36864,f16:column,f16:column,f16:column,1,0,1,1,tensorop,f16,128,128,32,4,2,2,1,16,8,16,80,1024,1434451968,5566428610560,3880,62.5813,21.3472,88947.1
1,CUTLASS,gemm,cutlass_tensorop_h16816gemm_128x128_32x5_nn_align8,incorrect,success,universal,serial,8192,9216,36864,f16:column,f16:column,f16:column,1,0,1,1,tensorop,f16,128,128,32,5,2,2,1,16,8,16,80,1024,1434451968,5566428610560,3880,44.7811,29.8326,124303
1,CUTLASS,gemm,cutlass_tensorop_h16816gemm_128x128_32x5_nn_align4,incorrect,success,universal,serial,8192,9216,36864,f16:column,f16:column,f16:column,1,0,1,1,tensorop,f16,128,128,32,5,2,2,1,16,8,16,80,1024,1434451968,5566428610560,3880,59.906,22.3005,92919.3
1,CUTLASS,gemm,cutlass_tensorop_h16816gemm_128x128_32x5_nn_align2,incorrect,success,universal,serial,8192,9216,36864,f16:column,f16:column,f16:column,1,0,1,1,tensorop,f16,128,128,32,5,2,2,1,16,8,16,80,1024,1434451968,5566428610560,3880,62.808,21.2702,88626.2
1,CUTLASS,gemm,cutlass_tensorop_h16816gemm_128x64_32x6_nn_align8,incorrect,success,universal,serial,8192,9216,36864,f16:column,f16:column,f16:column,1,0,1,1,tensorop,f16,128,64,32,6,2,2,1,16,8,16,80,1024,1434451968,5566428610560,3880,99.8203,13.3834,55764.5
1,CUTLASS,gemm,cutlass_tensorop_h16816gemm_128x64_32x6_nn_align4,incorrect,success,universal,serial,8192,9216,36864,f16:column,f16:column,f16:column,1,0,1,1,tensorop,f16,128,64,32,6,2,2,1,16,8,16,80,1024,1434451968,5566428610560,3880,86.6913,15.4103,64209.8
1,CUTLASS,gemm,cutlass_tensorop_h16816gemm_128x64_32x6_nn_align2,incorrect,success,universal,serial,8192,9216,36864,f16:column,f16:column,f16:column,1,0,1,1,tensorop,f16,128,64,32,6,2,2,1,16,8,16,80,1024,1434451968,5566428610560,3880,89.4335,14.9378,62241
1,CUTLASS,gemm,cutlass_tensorop_h16816gemm_64x128_32x6_nn_align8,incorrect,success,universal,serial,8192,9216,36864,f16:column,f16:column,f16:column,1,0,1,1,tensorop,f16,64,128,32,6,2,2,1,16,8,16,80,1024,1434451968,5566428610560,3880,123.266,10.8378,45157.8
1,CUTLASS,gemm,cutlass_tensorop_h16816gemm_64x128_32x6_nn_align4,incorrect,success,universal,serial,8192,9216,36864,f16:column,f16:column,f16:column,1,0,1,1,tensorop,f16,64,128,32,6,2,2,1,16,8,16,80,1024,1434451968,5566428610560,3880,77.9765,17.1326,71386
1,CUTLASS,gemm,cutlass_tensorop_h16816gemm_64x128_32x6_nn_align2,incorrect,success,universal,serial,8192,9216,36864,f16:column,f16:column,f16:column,1,0,1,1,tensorop,f16,64,128,32,6,2,2,1,16,8,16,80,1024,1434451968,5566428610560,3880,78.8172,16.9498,70624.6
1,CUTLASS,gemm,cutlass_tensorop_h16816gemm_64x64_32x10_nn_align8,incorrect,success,universal,serial,8192,9216,36864,f16:column,f16:column,f16:column,1,0,1,1,tensorop,f16,64,64,32,10,2,2,1,16,8,16,80,1024,1434451968,5566428610560,3880,145.485,9.18267,38261.3
1,CUTLASS,gemm,cutlass_tensorop_h16816gemm_64x64_32x10_nn_align4,incorrect,success,universal,serial,8192,9216,36864,f16:column,f16:column,f16:column,1,0,1,1,tensorop,f16,64,64,32,10,2,2,1,16,8,16,80,1024,1434451968,5566428610560,3880,89.1773,14.9807,62419.8
1,CUTLASS,gemm,cutlass_tensorop_h16816gemm_64x64_32x10_nn_align2,incorrect,success,universal,serial,8192,9216,36864,f16:column,f16:column,f16:column,1,0,1,1,tensorop,f16,64,64,32,10,2,2,1,16,8,16,80,1024,1434451968,5566428610560,3880,106.458,12.549,52287.6
1,CUTLASS,gemm,cutlass_tensorop_h16816gemm_128x64_64x3_nn_align8,incorrect,success,universal,serial,8192,9216,36864,f16:column,f16:column,f16:column,1,0,1,1,tensorop,f16,128,64,64,3,2,2,1,16,8,16,80,1024,1434451968,5566428610560,3880,64.1736,20.8176,86740.2
1,CUTLASS,gemm,cutlass_tensorop_h16816gemm_128x64_64x3_nn_align4,incorrect,success,universal,serial,8192,9216,36864,f16:column,f16:column,f16:column,1,0,1,1,tensorop,f16,128,64,64,3,2,2,1,16,8,16,80,1024,1434451968,5566428610560,3880,73.1534,18.2621,76092.5
1,CUTLASS,gemm,cutlass_tensorop_h16816gemm_128x64_64x3_nn_align2,incorrect,success,universal,serial,8192,9216,36864,f16:column,f16:column,f16:column,1,0,1,1,tensorop,f16,128,64,64,3,2,2,1,16,8,16,80,1024,1434451968,5566428610560,3880,93.4968,14.2886,59536
1,CUTLASS,gemm,cutlass_tensorop_h16816gemm_64x128_64x3_nn_align8,incorrect,success,universal,serial,8192,9216,36864,f16:column,f16:column,f16:column,1,0,1,1,tensorop,f16,64,128,64,3,2,2,1,16,8,16,80,1024,1434451968,5566428610560,3880,65.0089,20.5501,85625.6
1,CUTLASS,gemm,cutlass_tensorop_h16816gemm_64x128_64x3_nn_align4,incorrect,success,universal,serial,8192,9216,36864,f16:column,f16:column,f16:column,1,0,1,1,tensorop,f16,64,128,64,3,2,2,1,16,8,16,80,1024,1434451968,5566428610560,3880,66.6599,20.0411,83504.9
1,CUTLASS,gemm,cutlass_tensorop_h16816gemm_64x128_64x3_nn_align2,incorrect,success,universal,serial,8192,9216,36864,f16:column,f16:column,f16:column,1,0,1,1,tensorop,f16,64,128,64,3,2,2,1,16,8,16,80,1024,1434451968,5566428610560,3880,85.3784,15.6473,65197.2
1,CUTLASS,gemm,cutlass_tensorop_h16816gemm_64x64_64x5_nn_align8,incorrect,success,universal,serial,8192,9216,36864,f16:column,f16:column,f16:column,1,0,1,1,tensorop,f16,64,64,64,5,2,2,1,16,8,16,80,1024,1434451968,5566428610560,3880,146.857,9.09685,37903.7
1,CUTLASS,gemm,cutlass_tensorop_h16816gemm_64x64_64x5_nn_align4,incorrect,success,universal,serial,8192,9216,36864,f16:column,f16:column,f16:column,1,0,1,1,tensorop,f16,64,64,64,5,2,2,1,16,8,16,80,1024,1434451968,5566428610560,3880,85.9218,15.5483,64784.8
1,CUTLASS,gemm,cutlass_tensorop_h16816gemm_64x64_64x5_nn_align2,incorrect,success,universal,serial,8192,9216,36864,f16:column,f16:column,f16:column,1,0,1,1,tensorop,f16,64,64,64,5,2,2,1,16,8,16,80,1024,1434451968,5566428610560,3880,92.0515,14.5129,60470.8
1,CUTLASS,gemm,cutlass_tensorop_h16816gemm_256x128_32x3_nt_align8,incorrect,success,universal,serial,8192,9216,36864,f16:column,f16:row,f16:column,1,0,1,1,tensorop,f16,256,128,32,3,4,2,1,16,8,16,80,1024,1434451968,5566428610560,3880,40.5985,32.9061,137109
1,CUTLASS,gemm,cutlass_tensorop_h16816gemm_256x128_32x3_nt_align4,incorrect,success,universal,serial,8192,9216,36864,f16:column,f16:row,f16:column,1,0,1,1,tensorop,f16,256,128,32,3,4,2,1,16,8,16,80,1024,1434451968,5566428610560,3880,42.0117,31.7991,132497
1,CUTLASS,gemm,cutlass_tensorop_h16816gemm_256x128_32x3_nt_align2,incorrect,success,universal,serial,8192,9216,36864,f16:column,f16:row,f16:column,1,0,1,1,tensorop,f16,256,128,32,3,4,2,1,16,8,16,80,1024,1434451968,5566428610560,3880,46.1929,28.9208,120504
1,CUTLASS,gemm,cutlass_tensorop_h16816gemm_128x256_32x3_nt_align8,incorrect,success,universal,serial,8192,9216,36864,f16:column,f16:row,f16:column,1,0,1,1,tensorop,f16,128,256,32,3,2,4,1,16,8,16,80,1024,1434451968,5566428610560,3880,40.4581,33.0202,137585
1,CUTLASS,gemm,cutlass_tensorop_h16816gemm_128x256_32x3_nt_align4,incorrect,success,universal,serial,8192,9216,36864,f16:column,f16:row,f16:column,1,0,1,1,tensorop,f16,128,256,32,3,2,4,1,16,8,16,80,1024,1434451968,5566428610560,3880,42.4777,31.4503,131044
1,CUTLASS,gemm,cutlass_tensorop_h16816gemm_128x256_32x3_nt_align2,incorrect,success,universal,serial,8192,9216,36864,f16:column,f16:row,f16:column,1,0,1,1,tensorop,f16,128,256,32,3,2,4,1,16,8,16,80,1024,1434451968,5566428610560,3880,47.8592,27.9139,116308
1,CUTLASS,gemm,cutlass_tensorop_h16816gemm_256x64_32x3_nt_align8,incorrect,success,universal,serial,8192,9216,36864,f16:column,f16:row,f16:column,1,0,1,1,tensorop,f16,256,64,32,3,4,1,1,16,8,16,80,1024,1434451968,5566428610560,3880,53.8275,24.8189,103412
1,CUTLASS,gemm,cutlass_tensorop_h16816gemm_256x64_32x3_nt_align4,incorrect,success,universal,serial,8192,9216,36864,f16:column,f16:row,f16:column,1,0,1,1,tensorop,f16,256,64,32,3,4,1,1,16,8,16,80,1024,1434451968,5566428610560,3880,55.7839,23.9484,99785.5
1,CUTLASS,gemm,cutlass_tensorop_h16816gemm_256x64_32x3_nt_align2,incorrect,success,universal,serial,8192,9216,36864,f16:column,f16:row,f16:column,1,0,1,1,tensorop,f16,256,64,32,3,4,1,1,16,8,16,80,1024,1434451968,5566428610560,3880,65.3239,20.451,85212.8
1,CUTLASS,gemm,cutlass_tensorop_h16816gemm_256x64_32x4_nt_align8,incorrect,success,universal,serial,8192,9216,36864,f16:column,f16:row,f16:column,1,0,1,1,tensorop,f16,256,64,32,4,4,1,1,16,8,16,80,1024,1434451968,5566428610560,3880,52.9503,25.23,105125
1,CUTLASS,gemm,cutlass_tensorop_h16816gemm_256x64_32x4_nt_align4,incorrect,success,universal,serial,8192,9216,36864,f16:column,f16:row,f16:column,1,0,1,1,tensorop,f16,256,64,32,4,4,1,1,16,8,16,80,1024,1434451968,5566428610560,3880,54.7518,24.3999,101666
1,CUTLASS,gemm,cutlass_tensorop_h16816gemm_256x64_32x4_nt_align2,incorrect,success,universal,serial,8192,9216,36864,f16:column,f16:row,f16:column,1,0,1,1,tensorop,f16,256,64,32,4,4,1,1,16,8,16,80,1024,1434451968,5566428610560,3880,74.8551,17.847,74362.7
1,CUTLASS,gemm,cutlass_tensorop_h16816gemm_64x256_32x4_nt_align8,incorrect,success,universal,serial,8192,9216,36864,f16:column,f16:row,f16:column,1,0,1,1,tensorop,f16,64,256,32,4,1,4,1,16,8,16,80,1024,1434451968,5566428610560,3880,60.8757,21.9453,91439.3
1,CUTLASS,gemm,cutlass_tensorop_h16816gemm_64x256_32x4_nt_align4,incorrect,success,universal,serial,8192,9216,36864,f16:column,f16:row,f16:column,1,0,1,1,tensorop,f16,64,256,32,4,1,4,1,16,8,16,80,1024,1434451968,5566428610560,3880,54.3977,24.5587,102328
1,CUTLASS,gemm,cutlass_tensorop_h16816gemm_64x256_32x4_nt_align2,incorrect,success,universal,serial,8192,9216,36864,f16:column,f16:row,f16:column,1,0,1,1,tensorop,f16,64,256,32,4,1,4,1,16,8,16,80,1024,1434451968,5566428610560,3880,77.417,17.2564,71901.9
1,CUTLASS,gemm,cutlass_tensorop_h16816gemm_128x128_32x3_nt_align8,incorrect,success,universal,serial,8192,9216,36864,f16:column,f16:row,f16:column,1,0,1,1,tensorop,f16,128,128,32,3,2,2,1,16,8,16,80,1024,1434451968,5566428610560,3880,69.4172,19.2451,80188.1
1,CUTLASS,gemm,cutlass_tensorop_h16816gemm_128x128_32x3_nt_align4,incorrect,success,universal,serial,8192,9216,36864,f16:column,f16:row,f16:column,1,0,1,1,tensorop,f16,128,128,32,3,2,2,1,16,8,16,80,1024,1434451968,5566428610560,3880,68.7005,19.4458,81024.6
1,CUTLASS,gemm,cutlass_tensorop_h16816gemm_128x128_32x3_nt_align2,incorrect,success,universal,serial,8192,9216,36864,f16:column,f16:row,f16:column,1,0,1,1,tensorop,f16,128,128,32,3,2,2,1,16,8,16,80,1024,1434451968,5566428610560,3880,51.3569,26.0128,108387
1,CUTLASS,gemm,cutlass_tensorop_h16816gemm_128x128_32x4_nt_align8,incorrect,success,universal,serial,8192,9216,36864,f16:column,f16:row,f16:column,1,0,1,1,tensorop,f16,128,128,32,4,2,2,1,16,8,16,80,1024,1434451968,5566428610560,3880,44.0747,30.3108,126295
1,CUTLASS,gemm,cutlass_tensorop_h16816gemm_128x128_32x4_nt_align4,incorrect,success,universal,serial,8192,9216,36864,f16:column,f16:row,f16:column,1,0,1,1,tensorop,f16,128,128,32,4,2,2,1,16,8,16,80,1024,1434451968,5566428610560,3880,45.1029,29.6198,123416
1,CUTLASS,gemm,cutlass_tensorop_h16816gemm_128x128_32x4_nt_align2,incorrect,success,universal,serial,8192,9216,36864,f16:column,f16:row,f16:column,1,0,1,1,tensorop,f16,128,128,32,4,2,2,1,16,8,16,80,1024,1434451968,5566428610560,3880,52.6706,25.364,105684
1,CUTLASS,gemm,cutlass_tensorop_h16816gemm_128x128_32x5_nt_align8,incorrect,success,universal,serial,8192,9216,36864,f16:column,f16:row,f16:column,1,0,1,1,tensorop,f16,128,128,32,5,2,2,1,16,8,16,80,1024,1434451968,5566428610560,3880,43.6872,30.5796,127415
1,CUTLASS,gemm,cutlass_tensorop_h16816gemm_128x128_32x5_nt_align4,incorrect,success,universal,serial,8192,9216,36864,f16:column,f16:row,f16:column,1,0,1,1,tensorop,f16,128,128,32,5,2,2,1,16,8,16,80,1024,1434451968,5566428610560,3880,45.1595,29.5826,123261
1,CUTLASS,gemm,cutlass_tensorop_h16816gemm_128x128_32x5_nt_align2,incorrect,success,universal,serial,8192,9216,36864,f16:column,f16:row,f16:column,1,0,1,1,tensorop,f16,128,128,32,5,2,2,1,16,8,16,80,1024,1434451968,5566428610560,3880,50.5866,26.4089,110038
1,CUTLASS,gemm,cutlass_tensorop_h16816gemm_128x64_32x6_nt_align8,incorrect,success,universal,serial,8192,9216,36864,f16:column,f16:row,f16:column,1,0,1,1,tensorop,f16,128,64,32,6,2,2,1,16,8,16,80,1024,1434451968,5566428610560,3880,91.2247,14.6445,61018.9
1,CUTLASS,gemm,cutlass_tensorop_h16816gemm_128x64_32x6_nt_align4,incorrect,success,universal,serial,8192,9216,36864,f16:column,f16:row,f16:column,1,0,1,1,tensorop,f16,128,64,32,6,2,2,1,16,8,16,80,1024,1434451968,5566428610560,3880,64.8188,20.6103,85876.8
1,CUTLASS,gemm,cutlass_tensorop_h16816gemm_128x64_32x6_nt_align2,incorrect,success,universal,serial,8192,9216,36864,f16:column,f16:row,f16:column,1,0,1,1,tensorop,f16,128,64,32,6,2,2,1,16,8,16,80,1024,1434451968,5566428610560,3880,75.4726,17.701,73754.3
1,CUTLASS,gemm,cutlass_tensorop_h16816gemm_64x128_32x6_nt_align8,incorrect,success,universal,serial,8192,9216,36864,f16:column,f16:row,f16:column,1,0,1,1,tensorop,f16,64,128,32,6,2,2,1,16,8,16,80,1024,1434451968,5566428610560,3880,104.865,12.7396,53081.8
1,CUTLASS,gemm,cutlass_tensorop_h16816gemm_64x128_32x6_nt_align4,incorrect,success,universal,serial,8192,9216,36864,f16:column,f16:row,f16:column,1,0,1,1,tensorop,f16,64,128,32,6,2,2,1,16,8,16,80,1024,1434451968,5566428610560,3880,64.5862,20.6846,86186
1,CUTLASS,gemm,cutlass_tensorop_h16816gemm_64x128_32x6_nt_align2,incorrect,success,universal,serial,8192,9216,36864,f16:column,f16:row,f16:column,1,0,1,1,tensorop,f16,64,128,32,6,2,2,1,16,8,16,80,1024,1434451968,5566428610560,3880,75.0956,17.7898,74124.6
1,CUTLASS,gemm,cutlass_tensorop_h16816gemm_64x64_32x10_nt_align8,incorrect,success,universal,serial,8192,9216,36864,f16:column,f16:row,f16:column,1,0,1,1,tensorop,f16,64,64,32,10,2,2,1,16,8,16,80,1024,1434451968,5566428610560,3880,141.075,9.46967,39457.1
1,CUTLASS,gemm,cutlass_tensorop_h16816gemm_64x64_32x10_nt_align4,incorrect,success,universal,serial,8192,9216,36864,f16:column,f16:row,f16:column,1,0,1,1,tensorop,f16,64,64,32,10,2,2,1,16,8,16,80,1024,1434451968,5566428610560,3880,83.1227,16.0719,66966.4
1,CUTLASS,gemm,cutlass_tensorop_h16816gemm_64x64_32x10_nt_align2,incorrect,success,universal,serial,8192,9216,36864,f16:column,f16:row,f16:column,1,0,1,1,tensorop,f16,64,64,32,10,2,2,1,16,8,16,80,1024,1434451968,5566428610560,3880,94.0991,14.1971,59155
1,CUTLASS,gemm,cutlass_tensorop_h16816gemm_128x64_64x3_nt_align8,incorrect,success,universal,serial,8192,9216,36864,f16:column,f16:row,f16:column,1,0,1,1,tensorop,f16,128,64,64,3,2,2,1,16,8,16,80,1024,1434451968,5566428610560,3880,64.1765,20.8166,86736.2
1,CUTLASS,gemm,cutlass_tensorop_h16816gemm_128x64_64x3_nt_align4,incorrect,success,universal,serial,8192,9216,36864,f16:column,f16:row,f16:column,1,0,1,1,tensorop,f16,128,64,64,3,2,2,1,16,8,16,80,1024,1434451968,5566428610560,3880,66.6695,20.0382,83492.9
1,CUTLASS,gemm,cutlass_tensorop_h16816gemm_128x64_64x3_nt_align2,incorrect,success,universal,serial,8192,9216,36864,f16:column,f16:row,f16:column,1,0,1,1,tensorop,f16,128,64,64,3,2,2,1,16,8,16,80,1024,1434451968,5566428610560,3880,91.7175,14.5658,60691
1,CUTLASS,gemm,cutlass_tensorop_h16816gemm_64x128_64x3_nt_align8,incorrect,success,universal,serial,8192,9216,36864,f16:column,f16:row,f16:column,1,0,1,1,tensorop,f16,64,128,64,3,2,2,1,16,8,16,80,1024,1434451968,5566428610560,3880,63.9405,20.8934,87056.4
1,CUTLASS,gemm,cutlass_tensorop_h16816gemm_64x128_64x3_nt_align4,incorrect,success,universal,serial,8192,9216,36864,f16:column,f16:row,f16:column,1,0,1,1,tensorop,f16,64,128,64,3,2,2,1,16,8,16,80,1024,1434451968,5566428610560,3880,65.7774,20.31,84625.3
1,CUTLASS,gemm,cutlass_tensorop_h16816gemm_64x128_64x3_nt_align2,incorrect,success,universal,serial,8192,9216,36864,f16:column,f16:row,f16:column,1,0,1,1,tensorop,f16,64,128,64,3,2,2,1,16,8,16,80,1024,1434451968,5566428610560,3880,102.693,13.009,54204.5
1,CUTLASS,gemm,cutlass_tensorop_h16816gemm_64x64_64x5_nt_align8,incorrect,success,universal,serial,8192,9216,36864,f16:column,f16:row,f16:column,1,0,1,1,tensorop,f16,64,64,64,5,2,2,1,16,8,16,80,1024,1434451968,5566428610560,3880,136.617,9.77867,40744.6
1,CUTLASS,gemm,cutlass_tensorop_h16816gemm_64x64_64x5_nt_align4,incorrect,success,universal,serial,8192,9216,36864,f16:column,f16:row,f16:column,1,0,1,1,tensorop,f16,64,64,64,5,2,2,1,16,8,16,80,1024,1434451968,5566428610560,3880,83.5878,15.9824,66593.8
1,CUTLASS,gemm,cutlass_tensorop_h16816gemm_64x64_64x5_nt_align2,incorrect,success,universal,serial,8192,9216,36864,f16:column,f16:row,f16:column,1,0,1,1,tensorop,f16,64,64,64,5,2,2,1,16,8,16,80,1024,1434451968,5566428610560,3880,89.8025,14.8764,61985.2
1,CUTLASS,gemm,cutlass_tensorop_h16816gemm_256x128_32x3_tn_align8,incorrect,success,universal,serial,8192,9216,36864,f16:row,f16:column,f16:column,1,0,1,1,tensorop,f16,256,128,32,3,4,2,1,16,8,16,80,1024,1434451968,5566428610560,3880,41.5212,32.1748,134062
1,CUTLASS,gemm,cutlass_tensorop_h16816gemm_256x128_32x3_tn_align4,incorrect,success,universal,serial,8192,9216,36864,f16:row,f16:column,f16:column,1,0,1,1,tensorop,f16,256,128,32,3,4,2,1,16,8,16,80,1024,1434451968,5566428610560,3880,52.8538,25.2761,105318
1,CUTLASS,gemm,cutlass_tensorop_h16816gemm_256x128_32x3_tn_align2,incorrect,success,universal,serial,8192,9216,36864,f16:row,f16:column,f16:column,1,0,1,1,tensorop,f16,256,128,32,3,4,2,1,16,8,16,80,1024,1434451968,5566428610560,3880,60.055,22.2452,92688.8
1,CUTLASS,gemm,cutlass_tensorop_h16816gemm_128x256_32x3_tn_align8,incorrect,success,universal,serial,8192,9216,36864,f16:row,f16:column,f16:column,1,0,1,1,tensorop,f16,128,256,32,3,2,4,1,16,8,16,80,1024,1434451968,5566428610560,3880,41.1444,32.4695,135290
1,CUTLASS,gemm,cutlass_tensorop_h16816gemm_128x256_32x3_tn_align4,incorrect,success,universal,serial,8192,9216,36864,f16:row,f16:column,f16:column,1,0,1,1,tensorop,f16,128,256,32,3,2,4,1,16,8,16,80,1024,1434451968,5566428610560,3880,65.5809,20.3708,84878.9
1,CUTLASS,gemm,cutlass_tensorop_h16816gemm_128x256_32x3_tn_align2,incorrect,success,universal,serial,8192,9216,36864,f16:row,f16:column,f16:column,1,0,1,1,tensorop,f16,128,256,32,3,2,4,1,16,8,16,80,1024,1434451968,5566428610560,3880,64.2398,20.7961,86650.8
1,CUTLASS,gemm,cutlass_tensorop_h16816gemm_256x64_32x3_tn_align8,incorrect,success,universal,serial,8192,9216,36864,f16:row,f16:column,f16:column,1,0,1,1,tensorop,f16,256,64,32,3,4,1,1,16,8,16,80,1024,1434451968,5566428610560,3880,67.7644,19.7144,82143.8
1,CUTLASS,gemm,cutlass_tensorop_h16816gemm_256x64_32x3_tn_align4,incorrect,success,universal,serial,8192,9216,36864,f16:row,f16:column,f16:column,1,0,1,1,tensorop,f16,256,64,32,3,4,1,1,16,8,16,80,1024,1434451968,5566428610560,3880,82.6492,16.164,67350.1
1,CUTLASS,gemm,cutlass_tensorop_h16816gemm_256x64_32x3_tn_align2,incorrect,success,universal,serial,8192,9216,36864,f16:row,f16:column,f16:column,1,0,1,1,tensorop,f16,256,64,32,3,4,1,1,16,8,16,80,1024,1434451968,5566428610560,3880,114.076,11.7109,48795.8
1,CUTLASS,gemm,cutlass_tensorop_h16816gemm_256x64_32x4_tn_align8,incorrect,success,universal,serial,8192,9216,36864,f16:row,f16:column,f16:column,1,0,1,1,tensorop,f16,256,64,32,4,4,1,1,16,8,16,80,1024,1434451968,5566428610560,3880,81.9121,16.3094,67956.1
1,CUTLASS,gemm,cutlass_tensorop_h16816gemm_256x64_32x4_tn_align4,incorrect,success,universal,serial,8192,9216,36864,f16:row,f16:column,f16:column,1,0,1,1,tensorop,f16,256,64,32,4,4,1,1,16,8,16,80,1024,1434451968,5566428610560,3880,85.4997,15.6251,65104.7
1,CUTLASS,gemm,cutlass_tensorop_h16816gemm_256x64_32x4_tn_align2,incorrect,success,universal,serial,8192,9216,36864,f16:row,f16:column,f16:column,1,0,1,1,tensorop,f16,256,64,32,4,4,1,1,16,8,16,80,1024,1434451968,5566428610560,3880,125.428,10.651,44379.4
1,CUTLASS,gemm,cutlass_tensorop_h16816gemm_64x256_32x4_tn_align8,incorrect,success,universal,serial,8192,9216,36864,f16:row,f16:column,f16:column,1,0,1,1,tensorop,f16,64,256,32,4,1,4,1,16,8,16,80,1024,1434451968,5566428610560,3880,126.117,10.5928,44137
1,CUTLASS,gemm,cutlass_tensorop_h16816gemm_64x256_32x4_tn_align4,incorrect,success,universal,serial,8192,9216,36864,f16:row,f16:column,f16:column,1,0,1,1,tensorop,f16,64,256,32,4,1,4,1,16,8,16,80,1024,1434451968,5566428610560,3880,119.744,11.1566,46486.2
1,CUTLASS,gemm,cutlass_tensorop_h16816gemm_64x256_32x4_tn_align2,incorrect,success,universal,serial,8192,9216,36864,f16:row,f16:column,f16:column,1,0,1,1,tensorop,f16,64,256,32,4,1,4,1,16,8,16,80,1024,1434451968,5566428610560,3880,116.08,11.5088,47953.5
1,CUTLASS,gemm,cutlass_tensorop_h16816gemm_128x128_32x3_tn_align8,incorrect,success,universal,serial,8192,9216,36864,f16:row,f16:column,f16:column,1,0,1,1,tensorop,f16,128,128,32,3,2,2,1,16,8,16,80,1024,1434451968,5566428610560,3880,84.7871,15.7564,65651.8
1,CUTLASS,gemm,cutlass_tensorop_h16816gemm_128x128_32x3_tn_align4,incorrect,success,universal,serial,8192,9216,36864,f16:row,f16:column,f16:column,1,0,1,1,tensorop,f16,128,128,32,3,2,2,1,16,8,16,80,1024,1434451968,5566428610560,3880,105.861,12.6198,52582.6
1,CUTLASS,gemm,cutlass_tensorop_h16816gemm_128x128_32x3_tn_align2,incorrect,success,universal,serial,8192,9216,36864,f16:row,f16:column,f16:column,1,0,1,1,tensorop,f16,128,128,32,3,2,2,1,16,8,16,80,1024,1434451968,5566428610560,3880,101.686,13.1379,54741.5
1,CUTLASS,gemm,cutlass_tensorop_h16816gemm_128x128_32x4_tn_align8,incorrect,success,universal,serial,8192,9216,36864,f16:row,f16:column,f16:column,1,0,1,1,tensorop,f16,128,128,32,4,2,2,1,16,8,16,80,1024,1434451968,5566428610560,3880,68.719,19.4406,81002.8
1,CUTLASS,gemm,cutlass_tensorop_h16816gemm_128x128_32x4_tn_align4,incorrect,success,universal,serial,8192,9216,36864,f16:row,f16:column,f16:column,1,0,1,1,tensorop,f16,128,128,32,4,2,2,1,16,8,16,80,1024,1434451968,5566428610560,3880,76.6226,17.4353,72647.3
1,CUTLASS,gemm,cutlass_tensorop_h16816gemm_128x128_32x4_tn_align2,incorrect,success,universal,serial,8192,9216,36864,f16:row,f16:column,f16:column,1,0,1,1,tensorop,f16,128,128,32,4,2,2,1,16,8,16,80,1024,1434451968,5566428610560,3880,82.2558,16.2413,67672.2
1,CUTLASS,gemm,cutlass_tensorop_h16816gemm_128x128_32x5_tn_align8,incorrect,success,universal,serial,8192,9216,36864,f16:row,f16:column,f16:column,1,0,1,1,tensorop,f16,128,128,32,5,2,2,1,16,8,16,80,1024,1434451968,5566428610560,3880,74.4385,17.9469,74778.8
