CUTLASS/cutlassgemm-benchmark/csv_logs/cutlass_shape_16384_16384_16384_performance.gemm.csv
Problem,Provider,OperationKind,Operation,Disposition,Status,gemm_kind,split_k_mode,m,n,k,A,B,C,alpha,beta,split_k_slices,batch_count,op_class,accum,cta_m,cta_n,cta_k,stages,warps_m,warps_n,warps_k,inst_m,inst_n,inst_k,min_cc,max_cc,Bytes,Flops,Flops/Byte,Runtime,GB/s,GFLOPs
1,CUTLASS,gemm,cutlass_tensorop_h1688gemm_256x128_32x2_nn_align8,passed,success,universal,serial,16384,16384,16384,f16:column,f16:column,f16:column,1,0,1,1,tensorop,f16,256,128,32,2,4,2,1,16,8,8,75,1024,1610612736,8796629893120,5461,68.0987,22.0269,129175
1,CUTLASS,gemm,cutlass_tensorop_h1688gemm_256x128_32x2_nn_align4,passed,success,universal,serial,16384,16384,16384,f16:column,f16:column,f16:column,1,0,1,1,tensorop,f16,256,128,32,2,4,2,1,16,8,8,75,1024,1610612736,8796629893120,5461,82.0273,18.2866,107240
1,CUTLASS,gemm,cutlass_tensorop_h1688gemm_256x128_32x2_nn_align2,passed,success,universal,serial,16384,16384,16384,f16:column,f16:column,f16:column,1,0,1,1,tensorop,f16,256,128,32,2,4,2,1,16,8,8,75,1024,1610612736,8796629893120,5461,94.5676,15.8617,93019.5
1,CUTLASS,gemm,cutlass_tensorop_h1688gemm_256x128_32x2_nn_align1,passed,success,universal,serial,16384,16384,16384,f16:column,f16:column,f16:column,1,0,1,1,tensorop,f16,256,128,32,2,4,2,1,16,8,8,75,1024,1610612736,8796629893120,5461,131.851,11.3764,66716.2
1,CUTLASS,gemm,cutlass_tensorop_h1688gemm_128x256_32x2_nn_align8,passed,success,universal,serial,16384,16384,16384,f16:column,f16:column,f16:column,1,0,1,1,tensorop,f16,128,256,32,2,2,4,1,16,8,8,75,1024,1610612736,8796629893120,5461,66.4632,22.5689,132353
1,CUTLASS,gemm,cutlass_tensorop_h1688gemm_128x256_32x2_nn_align4,passed,success,universal,serial,16384,16384,16384,f16:column,f16:column,f16:column,1,0,1,1,tensorop,f16,128,256,32,2,2,4,1,16,8,8,75,1024,1610612736,8796629893120,5461,71.9171,20.8574,122316
1,CUTLASS,gemm,cutlass_tensorop_h1688gemm_128x256_32x2_nn_align2,passed,success,universal,serial,16384,16384,16384,f16:column,f16:column,f16:column,1,0,1,1,tensorop,f16,128,256,32,2,2,4,1,16,8,8,75,1024,1610612736,8796629893120,5461,82.3757,18.2093,106787
1,CUTLASS,gemm,cutlass_tensorop_h1688gemm_128x256_32x2_nn_align1,passed,success,universal,serial,16384,16384,16384,f16:column,f16:column,f16:column,1,0,1,1,tensorop,f16,128,256,32,2,2,4,1,16,8,8,75,1024,1610612736,8796629893120,5461,119.517,12.5505,73601.6
1,CUTLASS,gemm,cutlass_tensorop_h1688gemm_128x128_32x2_nn_align8,passed,success,universal,serial,16384,16384,16384,f16:column,f16:column,f16:column,1,0,1,1,tensorop,f16,128,128,32,2,2,2,1,16,8,8,75,1024,1610612736,8796629893120,5461,118.687,12.6383,74116.4
1,CUTLASS,gemm,cutlass_tensorop_h1688gemm_128x128_32x2_nn_align4,passed,success,universal,serial,16384,16384,16384,f16:column,f16:column,f16:column,1,0,1,1,tensorop,f16,128,128,32,2,2,2,1,16,8,8,75,1024,1610612736,8796629893120,5461,90.5451,16.5663,97152
1,CUTLASS,gemm,cutlass_tensorop_h1688gemm_128x128_32x2_nn_align2,passed,success,universal,serial,16384,16384,16384,f16:column,f16:column,f16:column,1,0,1,1,tensorop,f16,128,128,32,2,2,2,1,16,8,8,75,1024,1610612736,8796629893120,5461,102.815,14.5893,85557.7
1,CUTLASS,gemm,cutlass_tensorop_h1688gemm_128x128_32x2_nn_align1,passed,success,universal,serial,16384,16384,16384,f16:column,f16:column,f16:column,1,0,1,1,tensorop,f16,128,128,32,2,2,2,1,16,8,8,75,1024,1610612736,8796629893120,5461,130.102,11.5294,67613.5
1,CUTLASS,gemm,cutlass_tensorop_h1688gemm_64x256_32x2_nn_align8,passed,success,universal,serial,16384,16384,16384,f16:column,f16:column,f16:column,1,0,1,1,tensorop,f16,64,256,32,2,1,4,1,16,8,8,75,1024,1610612736,8796629893120,5461,144.319,10.3937,60952.7
1,CUTLASS,gemm,cutlass_tensorop_h1688gemm_64x256_32x2_nn_align4,passed,success,universal,serial,16384,16384,16384,f16:column,f16:column,f16:column,1,0,1,1,tensorop,f16,64,256,32,2,1,4,1,16,8,8,75,1024,1610612736,8796629893120,5461,157.92,9.4985,55703.2
1,CUTLASS,gemm,cutlass_tensorop_h1688gemm_64x256_32x2_nn_align2,passed,success,universal,serial,16384,16384,16384,f16:column,f16:column,f16:column,1,0,1,1,tensorop,f16,64,256,32,2,1,4,1,16,8,8,75,1024,1610612736,8796629893120,5461,96.6954,15.5126,90972.6
1,CUTLASS,gemm,cutlass_tensorop_h1688gemm_64x256_32x2_nn_align1,passed,success,universal,serial,16384,16384,16384,f16:column,f16:column,f16:column,1,0,1,1,tensorop,f16,64,256,32,2,1,4,1,16,8,8,75,1024,1610612736,8796629893120,5461,146.893,10.2115,59884.8
1,CUTLASS,gemm,cutlass_tensorop_h1688gemm_256x64_32x2_nn_align8,passed,success,universal,serial,16384,16384,16384,f16:column,f16:column,f16:column,1,0,1,1,tensorop,f16,256,64,32,2,4,1,1,16,8,8,75,1024,1610612736,8796629893120,5461,101.6,14.7637,86580.6
1,CUTLASS,gemm,cutlass_tensorop_h1688gemm_256x64_32x2_nn_align4,passed,success,universal,serial,16384,16384,16384,f16:column,f16:column,f16:column,1,0,1,1,tensorop,f16,256,64,32,2,4,1,1,16,8,8,75,1024,1610612736,8796629893120,5461,119.658,12.5357,73514.6
1,CUTLASS,gemm,cutlass_tensorop_h1688gemm_256x64_32x2_nn_align2,passed,success,universal,serial,16384,16384,16384,f16:column,f16:column,f16:column,1,0,1,1,tensorop,f16,256,64,32,2,4,1,1,16,8,8,75,1024,1610612736,8796629893120,5461,124.295,12.0681,70772.3
1,CUTLASS,gemm,cutlass_tensorop_h1688gemm_256x64_32x2_nn_align1,passed,success,universal,serial,16384,16384,16384,f16:column,f16:column,f16:column,1,0,1,1,tensorop,f16,256,64,32,2,4,1,1,16,8,8,75,1024,1610612736,8796629893120,5461,173.688,8.63616,50646.1
1,CUTLASS,gemm,cutlass_tensorop_h1688gemm_64x128_32x2_nn_align8,passed,success,universal,serial,16384,16384,16384,f16:column,f16:column,f16:column,1,0,1,1,tensorop,f16,64,128,32,2,2,2,1,16,8,8,75,1024,1610612736,8796629893120,5461,114.813,13.0647,76617
1,CUTLASS,gemm,cutlass_tensorop_h1688gemm_64x128_32x2_nn_align4,passed,success,universal,serial,16384,16384,16384,f16:column,f16:column,f16:column,1,0,1,1,tensorop,f16,64,128,32,2,2,2,1,16,8,8,75,1024,1610612736,8796629893120,5461,154.32,9.72009,57002.7
1,CUTLASS,gemm,cutlass_tensorop_h1688gemm_64x128_32x2_nn_align2,passed,success,universal,serial,16384,16384,16384,f16:column,f16:column,f16:column,1,0,1,1,tensorop,f16,64,128,32,2,2,2,1,16,8,8,75,1024,1610612736,8796629893120,5461,143.144,10.4789,61453
1,CUTLASS,gemm,cutlass_tensorop_h1688gemm_64x128_32x2_nn_align1,passed,success,universal,serial,16384,16384,16384,f16:column,f16:column,f16:column,1,0,1,1,tensorop,f16,64,128,32,2,2,2,1,16,8,8,75,1024,1610612736,8796629893120,5461,170.323,8.80681,51646.8
1,CUTLASS,gemm,cutlass_tensorop_h1688gemm_128x64_32x2_nn_align8,passed,success,universal,serial,16384,16384,16384,f16:column,f16:column,f16:column,1,0,1,1,tensorop,f16,128,64,32,2,2,2,1,16,8,8,75,1024,1610612736,8796629893120,5461,108.133,13.8718,81350.1
1,CUTLASS,gemm,cutlass_tensorop_h1688gemm_128x64_32x2_nn_align4,passed,success,universal,serial,16384,16384,16384,f16:column,f16:column,f16:column,1,0,1,1,tensorop,f16,128,64,32,2,2,2,1,16,8,8,75,1024,1610612736,8796629893120,5461,130.145,11.5256,67590.8
1,CUTLASS,gemm,cutlass_tensorop_h1688gemm_128x64_32x2_nn_align2,passed,success,universal,serial,16384,16384,16384,f16:column,f16:column,f16:column,1,0,1,1,tensorop,f16,128,64,32,2,2,2,1,16,8,8,75,1024,1610612736,8796629893120,5461,151.974,9.87013,57882.6
1,CUTLASS,gemm,cutlass_tensorop_h1688gemm_128x64_32x2_nn_align1,passed,success,universal,serial,16384,16384,16384,f16:column,f16:column,f16:column,1,0,1,1,tensorop,f16,128,64,32,2,2,2,1,16,8,8,75,1024,1610612736,8796629893120,5461,198.452,7.55851,44326.3
1,CUTLASS,gemm,cutlass_tensorop_h1688gemm_64x64_32x2_nn_align8,passed,success,universal,serial,16384,16384,16384,f16:column,f16:column,f16:column,1,0,1,1,tensorop,f16,64,64,32,2,2,2,1,16,8,8,75,1024,1610612736,8796629893120,5461,137.562,10.9042,63946.7
1,CUTLASS,gemm,cutlass_tensorop_h1688gemm_64x64_32x2_nn_align4,passed,success,universal,serial,16384,16384,16384,f16:column,f16:column,f16:column,1,0,1,1,tensorop,f16,64,64,32,2,2,2,1,16,8,8,75,1024,1610612736,8796629893120,5461,163.692,9.16355,53738.9
1,CUTLASS,gemm,cutlass_tensorop_h1688gemm_64x64_32x2_nn_align2,passed,success,universal,serial,16384,16384,16384,f16:column,f16:column,f16:column,1,0,1,1,tensorop,f16,64,64,32,2,2,2,1,16,8,8,75,1024,1610612736,8796629893120,5461,172.19,8.71129,51086.6
1,CUTLASS,gemm,cutlass_tensorop_h1688gemm_64x64_32x2_nn_align1,passed,success,universal,serial,16384,16384,16384,f16:column,f16:column,f16:column,1,0,1,1,tensorop,f16,64,64,32,2,2,2,1,16,8,8,75,1024,1610612736,8796629893120,5461,248.729,6.03065,35366.3
1,CUTLASS,gemm,cutlass_tensorop_h1688gemm_64x128_64x2_nn_align8,passed,success,universal,serial,16384,16384,16384,f16:column,f16:column,f16:column,1,0,1,1,tensorop,f16,64,128,64,2,1,2,2,16,8,8,75,1024,1610612736,8796629893120,5461,107.642,13.935,81721
1,CUTLASS,gemm,cutlass_tensorop_h1688gemm_64x128_64x2_nn_align4,passed,success,universal,serial,16384,16384,16384,f16:column,f16:column,f16:column,1,0,1,1,tensorop,f16,64,128,64,2,1,2,2,16,8,8,75,1024,1610612736,8796629893120,5461,109.912,13.6473,80033.6
1,CUTLASS,gemm,cutlass_tensorop_h1688gemm_64x128_64x2_nn_align2,passed,success,universal,serial,16384,16384,16384,f16:column,f16:column,f16:column,1,0,1,1,tensorop,f16,64,128,64,2,1,2,2,16,8,8,75,1024,1610612736,8796629893120,5461,114.734,13.0737,76669.7
1,CUTLASS,gemm,cutlass_tensorop_h1688gemm_64x128_64x2_nn_align1,passed,success,universal,serial,16384,16384,16384,f16:column,f16:column,f16:column,1,0,1,1,tensorop,f16,64,128,64,2,1,2,2,16,8,8,75,1024,1610612736,8796629893120,5461,138.135,10.859,63681.6
1,CUTLASS,gemm,cutlass_tensorop_h1688gemm_256x128_32x2_nt_align8,incorrect,success,universal,serial,16384,16384,16384,f16:column,f16:row,f16:column,1,0,1,1,tensorop,f16,256,128,32,2,4,2,1,16,8,8,75,1024,1610612736,8796629893120,5461,66.1454,22.6773,132989
1,CUTLASS,gemm,cutlass_tensorop_h1688gemm_256x128_32x2_nt_align4,incorrect,success,universal,serial,16384,16384,16384,f16:column,f16:row,f16:column,1,0,1,1,tensorop,f16,256,128,32,2,4,2,1,16,8,8,75,1024,1610612736,8796629893120,5461,74.4823,20.139,118104
1,CUTLASS,gemm,cutlass_tensorop_h1688gemm_256x128_32x2_nt_align2,incorrect,success,universal,serial,16384,16384,16384,f16:column,f16:row,f16:column,1,0,1,1,tensorop,f16,256,128,32,2,4,2,1,16,8,8,75,1024,1610612736,8796629893120,5461,86.3163,17.3779,101912
1,CUTLASS,gemm,cutlass_tensorop_h1688gemm_256x128_32x2_nt_align1,incorrect,success,universal,serial,16384,16384,16384,f16:column,f16:row,f16:column,1,0,1,1,tensorop,f16,256,128,32,2,4,2,1,16,8,8,75,1024,1610612736,8796629893120,5461,105.485,14.22,83392
1,CUTLASS,gemm,cutlass_tensorop_h1688gemm_128x256_32x2_nt_align8,incorrect,success,universal,serial,16384,16384,16384,f16:column,f16:row,f16:column,1,0,1,1,tensorop,f16,128,256,32,2,2,4,1,16,8,8,75,1024,1610612736,8796629893120,5461,66.1843,22.664,132911
1,CUTLASS,gemm,cutlass_tensorop_h1688gemm_128x256_32x2_nt_align4,incorrect,success,universal,serial,16384,16384,16384,f16:column,f16:row,f16:column,1,0,1,1,tensorop,f16,128,256,32,2,2,4,1,16,8,8,75,1024,1610612736,8796629893120,5461,71.4785,20.9853,123067
1,CUTLASS,gemm,cutlass_tensorop_h1688gemm_128x256_32x2_nt_align2,incorrect,success,universal,serial,16384,16384,16384,f16:column,f16:row,f16:column,1,0,1,1,tensorop,f16,128,256,32,2,2,4,1,16,8,8,75,1024,1610612736,8796629893120,5461,86.8244,17.2762,101315
1,CUTLASS,gemm,cutlass_tensorop_h1688gemm_128x256_32x2_nt_align1,incorrect,success,universal,serial,16384,16384,16384,f16:column,f16:row,f16:column,1,0,1,1,tensorop,f16,128,256,32,2,2,4,1,16,8,8,75,1024,1610612736,8796629893120,5461,96.3185,15.5733,91328.6
1,CUTLASS,gemm,cutlass_tensorop_h1688gemm_128x128_32x2_nt_align8,incorrect,success,universal,serial,16384,16384,16384,f16:column,f16:row,f16:column,1,0,1,1,tensorop,f16,128,128,32,2,2,2,1,16,8,8,75,1024,1610612736,8796629893120,5461,84.3201,17.7894,104324
1,CUTLASS,gemm,cutlass_tensorop_h1688gemm_128x128_32x2_nt_align4,incorrect,success,universal,serial,16384,16384,16384,f16:column,f16:row,f16:column,1,0,1,1,tensorop,f16,128,128,32,2,2,2,1,16,8,8,75,1024,1610612736,8796629893120,5461,112.833,13.294,77961.7
1,CUTLASS,gemm,cutlass_tensorop_h1688gemm_128x128_32x2_nt_align2,incorrect,success,universal,serial,16384,16384,16384,f16:column,f16:row,f16:column,1,0,1,1,tensorop,f16,128,128,32,2,2,2,1,16,8,8,75,1024,1610612736,8796629893120,5461,102.509,14.6328,85812.9
1,CUTLASS,gemm,cutlass_tensorop_h1688gemm_128x128_32x2_nt_align1,incorrect,success,universal,serial,16384,16384,16384,f16:column,f16:row,f16:column,1,0,1,1,tensorop,f16,128,128,32,2,2,2,1,16,8,8,75,1024,1610612736,8796629893120,5461,113.231,13.2473,77687.5
1,CUTLASS,gemm,cutlass_tensorop_h1688gemm_64x256_32x2_nt_align8,incorrect,success,universal,serial,16384,16384,16384,f16:column,f16:row,f16:column,1,0,1,1,tensorop,f16,64,256,32,2,1,4,1,16,8,8,75,1024,1610612736,8796629893120,5461,160.02,9.37385,54972.2
1,CUTLASS,gemm,cutlass_tensorop_h1688gemm_64x256_32x2_nt_align4,incorrect,success,universal,serial,16384,16384,16384,f16:column,f16:row,f16:column,1,0,1,1,tensorop,f16,64,256,32,2,1,4,1,16,8,8,75,1024,1610612736,8796629893120,5461,159.136,9.4259,55277.5
1,CUTLASS,gemm,cutlass_tensorop_h1688gemm_64x256_32x2_nt_align2,incorrect,success,universal,serial,16384,16384,16384,f16:column,f16:row,f16:column,1,0,1,1,tensorop,f16,64,256,32,2,1,4,1,16,8,8,75,1024,1610612736,8796629893120,5461,100.531,14.9207,87501.5
1,CUTLASS,gemm,cutlass_tensorop_h1688gemm_64x256_32x2_nt_align1,incorrect,success,universal,serial,16384,16384,16384,f16:column,f16:row,f16:column,1,0,1,1,tensorop,f16,64,256,32,2,1,4,1,16,8,8,75,1024,1610612736,8796629893120,5461,124.736,12.0254,70521.8
1,CUTLASS,gemm,cutlass_tensorop_h1688gemm_256x64_32x2_nt_align8,incorrect,success,universal,serial,16384,16384,16384,f16:column,f16:row,f16:column,1,0,1,1,tensorop,f16,256,64,32,2,4,1,1,16,8,8,75,1024,1610612736,8796629893120,5461,98.1125,15.2886,89658.6
1,CUTLASS,gemm,cutlass_tensorop_h1688gemm_256x64_32x2_nt_align4,incorrect,success,universal,serial,16384,16384,16384,f16:column,f16:row,f16:column,1,0,1,1,tensorop,f16,256,64,32,2,4,1,1,16,8,8,75,1024,1610612736,8796629893120,5461,96.9181,15.477,90763.5
1,CUTLASS,gemm,cutlass_tensorop_h1688gemm_256x64_32x2_nt_align2,incorrect,success,universal,serial,16384,16384,16384,f16:column,f16:row,f16:column,1,0,1,1,tensorop,f16,256,64,32,2,4,1,1,16,8,8,75,1024,1610612736,8796629893120,5461,101.105,14.836,87004.5
1,CUTLASS,gemm,cutlass_tensorop_h1688gemm_256x64_32x2_nt_align1,incorrect,success,universal,serial,16384,16384,16384,f16:column,f16:row,f16:column,1,0,1,1,tensorop,f16,256,64,32,2,4,1,1,16,8,8,75,1024,1610612736,8796629893120,5461,130.205,11.5203,67559.6
1,CUTLASS,gemm,cutlass_tensorop_h1688gemm_64x128_32x2_nt_align8,incorrect,success,universal,serial,16384,16384,16384,f16:column,f16:row,f16:column,1,0,1,1,tensorop,f16,64,128,32,2,2,2,1,16,8,8,75,1024,1610612736,8796629893120,5461,104.695,14.3274,84021.8
1,CUTLASS,gemm,cutlass_tensorop_h1688gemm_64x128_32x2_nt_align4,incorrect,success,universal,serial,16384,16384,16384,f16:column,f16:row,f16:column,1,0,1,1,tensorop,f16,64,128,32,2,2,2,1,16,8,8,75,1024,1610612736,8796629893120,5461,113.762,13.1854,77324.7
1,CUTLASS,gemm,cutlass_tensorop_h1688gemm_64x128_32x2_nt_align2,incorrect,success,universal,serial,16384,16384,16384,f16:column,f16:row,f16:column,1,0,1,1,tensorop,f16,64,128,32,2,2,2,1,16,8,8,75,1024,1610612736,8796629893120,5461,118.259,12.6841,74384.7
1,CUTLASS,gemm,cutlass_tensorop_h1688gemm_64x128_32x2_nt_align1,incorrect,success,universal,serial,16384,16384,16384,f16:column,f16:row,f16:column,1,0,1,1,tensorop,f16,64,128,32,2,2,2,1,16,8,8,75,1024,1610612736,8796629893120,5461,170.474,8.799,51601
1,CUTLASS,gemm,cutlass_tensorop_h1688gemm_128x64_32x2_nt_align8,incorrect,success,universal,serial,16384,16384,16384,f16:column,f16:row,f16:column,1,0,1,1,tensorop,f16,128,64,32,2,2,2,1,16,8,8,75,1024,1610612736,8796629893120,5461,105.702,14.1908,83220.7
1,CUTLASS,gemm,cutlass_tensorop_h1688gemm_128x64_32x2_nt_align4,incorrect,success,universal,serial,16384,16384,16384,f16:column,f16:row,f16:column,1,0,1,1,tensorop,f16,128,64,32,2,2,2,1,16,8,8,75,1024,1610612736,8796629893120,5461,108.789,13.7882,80859.7
1,CUTLASS,gemm,cutlass_tensorop_h1688gemm_128x64_32x2_nt_align2,incorrect,success,universal,serial,16384,16384,16384,f16:column,f16:row,f16:column,1,0,1,1,tensorop,f16,128,64,32,2,2,2,1,16,8,8,75,1024,1610612736,8796629893120,5461,118.842,12.6218,74019.6
1,CUTLASS,gemm,cutlass_tensorop_h1688gemm_128x64_32x2_nt_align1,incorrect,success,universal,serial,16384,16384,16384,f16:column,f16:row,f16:column,1,0,1,1,tensorop,f16,128,64,32,2,2,2,1,16,8,8,75,1024,1610612736,8796629893120,5461,153.859,9.7492,57173.4
1,CUTLASS,gemm,cutlass_tensorop_h1688gemm_64x64_32x2_nt_align8,incorrect,success,universal,serial,16384,16384,16384,f16:column,f16:row,f16:column,1,0,1,1,tensorop,f16,64,64,32,2,2,2,1,16,8,8,75,1024,1610612736,8796629893120,5461,132.57,11.3148,66354.4
1,CUTLASS,gemm,cutlass_tensorop_h1688gemm_64x64_32x2_nt_align4,incorrect,success,universal,serial,16384,16384,16384,f16:column,f16:row,f16:column,1,0,1,1,tensorop,f16,64,64,32,2,2,2,1,16,8,8,75,1024,1610612736,8796629893120,5461,134.062,11.1888,65616
1,CUTLASS,gemm,cutlass_tensorop_h1688gemm_64x64_32x2_nt_align2,incorrect,success,universal,serial,16384,16384,16384,f16:column,f16:row,f16:column,1,0,1,1,tensorop,f16,64,64,32,2,2,2,1,16,8,8,75,1024,1610612736,8796629893120,5461,143.506,10.4525,61298
1,CUTLASS,gemm,cutlass_tensorop_h1688gemm_64x64_32x2_nt_align1,incorrect,success,universal,serial,16384,16384,16384,f16:column,f16:row,f16:column,1,0,1,1,tensorop,f16,64,64,32,2,2,2,1,16,8,8,75,1024,1610612736,8796629893120,5461,190.511,7.87357,46173.9
1,CUTLASS,gemm,cutlass_tensorop_h1688gemm_64x128_64x2_nt_align8,incorrect,success,universal,serial,16384,16384,16384,f16:column,f16:row,f16:column,1,0,1,1,tensorop,f16,64,128,64,2,1,2,2,16,8,8,75,1024,1610612736,8796629893120,5461,108.178,13.866,81316.2
1,CUTLASS,gemm,cutlass_tensorop_h1688gemm_64x128_64x2_nt_align4,incorrect,success,universal,serial,16384,16384,16384,f16:column,f16:row,f16:column,1,0,1,1,tensorop,f16,64,128,64,2,1,2,2,16,8,8,75,1024,1610612736,8796629893120,5461,110.6,13.5624,79535.7
1,CUTLASS,gemm,cutlass_tensorop_h1688gemm_64x128_64x2_nt_align2,incorrect,success,universal,serial,16384,16384,16384,f16:column,f16:row,f16:column,1,0,1,1,tensorop,f16,64,128,64,2,1,2,2,16,8,8,75,1024,1610612736,8796629893120,5461,115.979,12.9334,75846.8
1,CUTLASS,gemm,cutlass_tensorop_h1688gemm_64x128_64x2_nt_align1,incorrect,success,universal,serial,16384,16384,16384,f16:column,f16:row,f16:column,1,0,1,1,tensorop,f16,64,128,64,2,1,2,2,16,8,8,75,1024,1610612736,8796629893120,5461,167.762,8.94126,52435.3
1,CUTLASS,gemm,cutlass_tensorop_h1688gemm_256x128_32x2_tn_align8,incorrect,success,universal,serial,16384,16384,16384,f16:row,f16:column,f16:column,1,0,1,1,tensorop,f16,256,128,32,2,4,2,1,16,8,8,75,1024,1610612736,8796629893120,5461,68.968,21.7492,127546
1,CUTLASS,gemm,cutlass_tensorop_h1688gemm_256x128_32x2_tn_align4,incorrect,success,universal,serial,16384,16384,16384,f16:row,f16:column,f16:column,1,0,1,1,tensorop,f16,256,128,32,2,4,2,1,16,8,8,75,1024,1610612736,8796629893120,5461,79.356,18.9022,110850
1,CUTLASS,gemm,cutlass_tensorop_h1688gemm_256x128_32x2_tn_align2,incorrect,success,universal,serial,16384,16384,16384,f16:row,f16:column,f16:column,1,0,1,1,tensorop,f16,256,128,32,2,4,2,1,16,8,8,75,1024,1610612736,8796629893120,5461,89.3481,16.7883,98453.5
1,CUTLASS,gemm,cutlass_tensorop_h1688gemm_256x128_32x2_tn_align1,incorrect,success,universal,serial,16384,16384,16384,f16:row,f16:column,f16:column,1,0,1,1,tensorop,f16,256,128,32,2,4,2,1,16,8,8,75,1024,1610612736,8796629893120,5461,140.729,10.6588,62507.4
1,CUTLASS,gemm,cutlass_tensorop_h1688gemm_128x256_32x2_tn_align8,incorrect,success,universal,serial,16384,16384,16384,f16:row,f16:column,f16:column,1,0,1,1,tensorop,f16,128,256,32,2,2,4,1,16,8,8,75,1024,1610612736,8796629893120,5461,69.0099,21.736,127469
1,CUTLASS,gemm,cutlass_tensorop_h1688gemm_128x256_32x2_tn_align4,incorrect,success,universal,serial,16384,16384,16384,f16:row,f16:column,f16:column,1,0,1,1,tensorop,f16,128,256,32,2,2,4,1,16,8,8,75,1024,1610612736,8796629893120,5461,80.5767,18.6158,109171
1,CUTLASS,gemm,cutlass_tensorop_h1688gemm_128x256_32x2_tn_align2,incorrect,success,universal,serial,16384,16384,16384,f16:row,f16:column,f16:column,1,0,1,1,tensorop,f16,128,256,32,2,2,4,1,16,8,8,75,1024,1610612736,8796629893120,5461,90.8237,16.5155,96853.9
1,CUTLASS,gemm,cutlass_tensorop_h1688gemm_128x256_32x2_tn_align1,incorrect,success,universal,serial,16384,16384,16384,f16:row,f16:column,f16:column,1,0,1,1,tensorop,f16,128,256,32,2,2,4,1,16,8,8,75,1024,1610612736,8796629893120,5461,138.292,10.8466,63609.1
1,CUTLASS,gemm,cutlass_tensorop_h1688gemm_128x128_32x2_tn_align8,incorrect,success,universal,serial,16384,16384,16384,f16:row,f16:column,f16:column,1,0,1,1,tensorop,f16,128,128,32,2,2,2,1,16,8,8,75,1024,1610612736,8796629893120,5461,215.553,6.95884,40809.6
1,CUTLASS,gemm,cutlass_tensorop_h1688gemm_128x128_32x2_tn_align4,incorrect,success,universal,serial,16384,16384,16384,f16:row,f16:column,f16:column,1,0,1,1,tensorop,f16,128,128,32,2,2,2,1,16,8,8,75,1024,1610612736,8796629893120,5461,220.39,6.80612,39914
1,CUTLASS,gemm,cutlass_tensorop_h1688gemm_128x128_32x2_tn_align2,incorrect,success,universal,serial,16384,16384,16384,f16:row,f16:column,f16:column,1,0,1,1,tensorop,f16,128,128,32,2,2,2,1,16,8,8,75,1024,1610612736,8796629893120,5461,210.936,7.11117,41702.9
1,CUTLASS,gemm,cutlass_tensorop_h1688gemm_128x128_32x2_tn_align1,incorrect,success,universal,serial,16384,16384,16384,f16:row,f16:column,f16:column,1,0,1,1,tensorop,f16,128,128,32,2,2,2,1,16,8,8,75,1024,1610612736,8796629893120,5461,162.496,9.23098,54134.4
1,CUTLASS,gemm,cutlass_tensorop_h1688gemm_64x256_32x2_tn_align8,incorrect,success,universal,serial,16384,16384,16384,f16:row,f16:column,f16:column,1,0,1,1,tensorop,f16,64,256,32,2,1,4,1,16,8,8,75,1024,1610612736,8796629893120,5461,268.066,5.59565,32815.2
1,CUTLASS,gemm,cutlass_tensorop_h1688gemm_64x256_32x2_tn_align4,incorrect,success,universal,serial,16384,16384,16384,f16:row,f16:column,f16:column,1,0,1,1,tensorop,f16,64,256,32,2,1,4,1,16,8,8,75,1024,1610612736,8796629893120,5461,261.788,5.72982,33602.1
1,CUTLASS,gemm,cutlass_tensorop_h1688gemm_64x256_32x2_tn_align2,incorrect,success,universal,serial,16384,16384,16384,f16:row,f16:column,f16:column,1,0,1,1,tensorop,f16,64,256,32,2,1,4,1,16,8,8,75,1024,1610612736,8796629893120,5461,268.838,5.57957,32720.9
1,CUTLASS,gemm,cutlass_tensorop_h1688gemm_64x256_32x2_tn_align1,incorrect,success,universal,serial,16384,16384,16384,f16:row,f16:column,f16:column,1,0,1,1,tensorop,f16,64,256,32,2,1,4,1,16,8,8,75,1024,1610612736,8796629893120,5461,239.184,6.27133,36777.7
1,CUTLASS,gemm,cutlass_tensorop_h1688gemm_256x64_32x2_tn_align8,incorrect,success,universal,serial,16384,16384,16384,f16:row,f16:column,f16:column,1,0,1,1,tensorop,f16,256,64,32,2,4,1,1,16,8,8,75,1024,1610612736,8796629893120,5461,196.771,7.62308,44705
1,CUTLASS,gemm,cutlass_tensorop_h1688gemm_256x64_32x2_tn_align4,incorrect,success,universal,serial,16384,16384,16384,f16:row,f16:column,f16:column,1,0,1,1,tensorop,f16,256,64,32,2,4,1,1,16,8,8,75,1024,1610612736,8796629893120,5461,128.444,11.6783,68486.3
1,CUTLASS,gemm,cutlass_tensorop_h1688gemm_256x64_32x2_tn_align2,incorrect,success,universal,serial,16384,16384,16384,f16:row,f16:column,f16:column,1,0,1,1,tensorop,f16,256,64,32,2,4,1,1,16,8,8,75,1024,1610612736,8796629893120,5461,134.324,11.167,65488
1,CUTLASS,gemm,cutlass_tensorop_h1688gemm_256x64_32x2_tn_align1,incorrect,success,universal,serial,16384,16384,16384,f16:row,f16:column,f16:column,1,0,1,1,tensorop,f16,256,64,32,2,4,1,1,16,8,8,75,1024,1610612736,8796629893120,5461,180.083,8.32949,48847.6
1,CUTLASS,gemm,cutlass_tensorop_h1688gemm_64x128_32x2_tn_align8,incorrect,success,universal,serial,16384,16384,16384,f16:row,f16:column,f16:column,1,0,1,1,tensorop,f16,64,128,32,2,2,2,1,16,8,8,75,1024,1610612736,8796629893120,5461,331.806,4.52071,26511.4
1,CUTLASS,gemm,cutlass_tensorop_h1688gemm_64x128_32x2_tn_align4,incorrect,success,universal,serial,16384,16384,16384,f16:row,f16:column,f16:column,1,0,1,1,tensorop,f16,64,128,32,2,2,2,1,16,8,8,75,1024,1610612736,8796629893120,5461,324.719,4.61938,27090
1,CUTLASS,gemm,cutlass_tensorop_h1688gemm_64x128_32x2_tn_align2,incorrect,success,universal,serial,16384,16384,16384,f16:row,f16:column,f16:column,1,0,1,1,tensorop,f16,64,128,32,2,2,2,1,16,8,8,75,1024,1610612736,8796629893120,5461,320.818,4.67554,27419.3
1,CUTLASS,gemm,cutlass_tensorop_h1688gemm_64x128_32x2_tn_align1,incorrect,success,universal,serial,16384,16384,16384,f16:row,f16:column,f16:column,1,0,1,1,tensorop,f16,64,128,32,2,2,2,1,16,8,8,75,1024,1610612736,8796629893120,5461,267.604,5.60531,32871.9
1,CUTLASS,gemm,cutlass_tensorop_h1688gemm_128x64_32x2_tn_align8,incorrect,success,universal,serial,16384,16384,16384,f16:row,f16:column,f16:column,1,0,1,1,tensorop,f16,128,64,32,2,2,2,1,16,8,8,75,1024,1610612736,8796629893120,5461,296.889,5.0524,29629.4
1,CUTLASS,gemm,cutlass_tensorop_h1688gemm_128x64_32x2_tn_align4,incorrect,success,universal,serial,16384,16384,16384,f16:row,f16:column,f16:column,1,0,1,1,tensorop,f16,128,64,32,2,2,2,1,16,8,8,75,1024,1610612736,8796629893120,5461,281.543,5.32778,31244.3
1,CUTLASS,gemm,cutlass_tensorop_h1688gemm_128x64_32x2_tn_align2,incorrect,success,universal,serial,16384,16384,16384,f16:row,f16:column,f16:column,1,0,1,1,tensorop,f16,128,64,32,2,2,2,1,16,8,8,75,1024,1610612736,8796629893120,5461,273.061,5.49327,32214.9
1,CUTLASS,gemm,cutlass_tensorop_h1688gemm_128x64_32x2_tn_align1,incorrect,success,universal,serial,16384,16384,16384,f16:row,f16:column,f16:column,1,0,1,1,tensorop,f16,128,64,32,2,2,2,1,16,8,8,75,1024,1610612736,8796629893120,5461,224.387,6.68487,39202.9
1,CUTLASS,gemm,cutlass_tensorop_h1688gemm_64x64_32x2_tn_align8,incorrect,success,universal,serial,16384,16384,16384,f16:row,f16:column,f16:column,1,0,1,1,tensorop,f16,64,64,32,2,2,2,1,16,8,8,75,1024,1610612736,8796629893120,5461,339.132,4.42306,25938.7
1,CUTLASS,gemm,cutlass_tensorop_h1688gemm_64x64_32x2_tn_align4,incorrect,success,universal,serial,16384,16384,16384,f16:row,f16:column,f16:column,1,0,1,1,tensorop,f16,64,64,32,2,2,2,1,16,8,8,75,1024,1610612736,8796629893120,5461,335.533,4.4705,26216.9
1,CUTLASS,gemm,cutlass_tensorop_h1688gemm_64x64_32x2_tn_align2,incorrect,success,universal,serial,16384,16384,16384,f16:row,f16:column,f16:column,1,0,1,1,tensorop,f16,64,64,32,2,2,2,1,16,8,8,75,1024,1610612736,8796629893120,5461,271.257,5.5298,32429.1
1,CUTLASS,gemm,cutlass_tensorop_h1688gemm_64x64_32x2_tn_align1,incorrect,success,universal,serial,16384,16384,16384,f16:row,f16:column,f16:column,1,0,1,1,tensorop,f16,64,64,32,2,2,2,1,16,8,8,75,1024,1610612736,8796629893120,5461,314.079,4.77587,28007.7
1,CUTLASS,gemm,cutlass_tensorop_h1688gemm_64x128_64x2_tn_align8,incorrect,success,universal,serial,16384,16384,16384,f16:row,f16:column,f16:column,1,0,1,1,tensorop,f16,64,128,64,2,1,2,2,16,8,8,75,1024,1610612736,8796629893120,5461,182.25,8.23045,48266.8
1,CUTLASS,gemm,cutlass_tensorop_h1688gemm_64x128_64x2_tn_align4,incorrect,success,universal,serial,16384,16384,16384,f16:row,f16:column,f16:column,1,0,1,1,tensorop,f16,64,128,64,2,1,2,2,16,8,8,75,1024,1610612736,8796629893120,5461,171.135,8.76501,51401.7
1,CUTLASS,gemm,cutlass_tensorop_h1688gemm_64x128_64x2_tn_align2,incorrect,success,universal,serial,16384,16384,16384,f16:row,f16:column,f16:column,1,0,1,1,tensorop,f16,64,128,64,2,1,2,2,16,8,8,75,1024,1610612736,8796629893120,5461,148.965,10.0695,59051.7
1,CUTLASS,gemm,cutlass_tensorop_h1688gemm_64x128_64x2_tn_align1,incorrect,success,universal,serial,16384,16384,16384,f16:row,f16:column,f16:column,1,0,1,1,tensorop,f16,64,128,64,2,1,2,2,16,8,8,75,1024,1610612736,8796629893120,5461,137.22,10.9313,64105.8
1,CUTLASS,gemm,cutlass_tensorop_h1688gemm_256x128_32x2_tt_align8,passed,success,universal,serial,16384,16384,16384,f16:row,f16:row,f16:column,1,0,1,1,tensorop,f16,256,128,32,2,4,2,1,16,8,8,75,1024,1610612736,8796629893120,5461,72.0264,20.8257,122131
1,CUTLASS,gemm,cutlass_tensorop_h1688gemm_256x128_32x2_tt_align4,passed,success,universal,serial,16384,16384,16384,f16:row,f16:row,f16:column,1,0,1,1,tensorop,f16,256,128,32,2,4,2,1,16,8,8,75,1024,1610612736,8796629893120,5461,72.2359,20.7653,121776
1,CUTLASS,gemm,cutlass_tensorop_h1688gemm_256x128_32x2_tt_align2,passed,success,universal,serial,16384,16384,16384,f16:row,f16:row,f16:column,1,0,1,1,tensorop,f16,256,128,32,2,4,2,1,16,8,8,75,1024,1610612736,8796629893120,5461,87.8383,17.0768,100146
1,CUTLASS,gemm,cutlass_tensorop_h1688gemm_256x128_32x2_tt_align1,passed,success,universal,serial,16384,16384,16384,f16:row,f16:row,f16:column,1,0,1,1,tensorop,f16,256,128,32,2,4,2,1,16,8,8,75,1024,1610612736,8796629893120,5461,114.056,13.1514,77125.3
1,CUTLASS,gemm,cutlass_tensorop_h1688gemm_128x256_32x2_tt_align8,passed,success,universal,serial,16384,16384,16384,f16:row,f16:row,f16:column,1,0,1,1,tensorop,f16,128,256,32,2,2,4,1,16,8,8,75,1024,1610612736,8796629893120,5461,67.5336,22.2112,130256
1,CUTLASS,gemm,cutlass_tensorop_h1688gemm_128x256_32x2_tt_align4,passed,success,universal,serial,16384,16384,16384,f16:row,f16:row,f16:column,1,0,1,1,tensorop,f16,128,256,32,2,2,4,1,16,8,8,75,1024,1610612736,8796629893120,5461,81.7043,18.3589,107664
1,CUTLASS,gemm,cutlass_tensorop_h1688gemm_128x256_32x2_tt_align2,passed,success,universal,serial,16384,16384,16384,f16:row,f16:row,f16:column,1,0,1,1,tensorop,f16,128,256,32,2,2,4,1,16,8,8,75,1024,1610612736,8796629893120,5461,96.6326,15.5227,91031.7
1,CUTLASS,gemm,cutlass_tensorop_h1688gemm_128x256_32x2_tt_align1,passed,success,universal,serial,16384,16384,16384,f16:row,f16:row,f16:column,1,0,1,1,tensorop,f16,128,256,32,2,2,4,1,16,8,8,75,1024,1610612736,8796629893120,5461,127.047,11.8066,69239.1
1,CUTLASS,gemm,cutlass_tensorop_h1688gemm_128x128_32x2_tt_align8,passed,success,universal,serial,16384,16384,16384,f16:row,f16:row,f16:column,1,0,1,1,tensorop,f16,128,128,32,2,2,2,1,16,8,8,75,1024,1610612736,8796629893120,5461,143.334,10.465,61371.4
1,CUTLASS,gemm,cutlass_tensorop_h1688gemm_128x128_32x2_tt_align4,passed,success,universal,serial,16384,16384,16384,f16:row,f16:row,f16:column,1,0,1,1,tensorop,f16,128,128,32,2,2,2,1,16,8,8,75,1024,1610612736,8796629893120,5461,94.1879,15.9256,93394.5
1,CUTLASS,gemm,cutlass_tensorop_h1688gemm_128x128_32x2_tt_align2,passed,success,universal,serial,16384,16384,16384,f16:row,f16:row,f16:column,1,0,1,1,tensorop,f16,128,128,32,2,2,2,1,16,8,8,75,1024,1610612736,8796629893120,5461,105.497,14.2184,83382.9
1,CUTLASS,gemm,cutlass_tensorop_h1688gemm_128x128_32x2_tt_align1,passed,success,universal,serial,16384,16384,16384,f16:row,f16:row,f16:column,1,0,1,1,tensorop,f16,128,128,32,2,2,2,1,16,8,8,75,1024,1610612736,8796629893120,5461,127.012,11.8099,69258.1
1,CUTLASS,gemm,cutlass_tensorop_h1688gemm_64x256_32x2_tt_align8,passed,success,universal,serial,16384,16384,16384,f16:row,f16:row,f16:column,1,0,1,1,tensorop,f16,64,256,32,2,1,4,1,16,8,8,75,1024,1610612736,8796629893120,5461,171.834,8.72936,51192.6
1,CUTLASS,gemm,cutlass_tensorop_h1688gemm_64x256_32x2_tt_align4,passed,success,universal,serial,16384,16384,16384,f16:row,f16:row,f16:column,1,0,1,1,tensorop,f16,64,256,32,2,1,4,1,16,8,8,75,1024,1610612736,8796629893120,5461,224.932,6.66867,39107.9
1,CUTLASS,gemm,cutlass_tensorop_h1688gemm_64x256_32x2_tt_align2,passed,success,universal,serial,16384,16384,16384,f16:row,f16:row,f16:column,1,0,1,1,tensorop,f16,64,256,32,2,1,4,1,16,8,8,75,1024,1610612736,8796629893120,5461,169.522,8.84843,51890.9
1,CUTLASS,gemm,cutlass_tensorop_h1688gemm_64x256_32x2_tt_align1,passed,success,universal,serial,16384,16384,16384,f16:row,f16:row,f16:column,1,0,1,1,tensorop,f16,64,256,32,2,1,4,1,16,8,8,75,1024,1610612736,8796629893120,5461,166.267,9.02165,52906.7
1,CUTLASS,gemm,cutlass_tensorop_h1688gemm_256x64_32x2_tt_align8,passed,success,universal,serial,16384,16384,16384,f16:row,f16:row,f16:column,1,0,1,1,tensorop,f16,256,64,32,2,4,1,1,16,8,8,75,1024,1610612736,8796629893120,5461,91.2992,16.4295,96349.4
1,CUTLASS,gemm,cutlass_tensorop_h1688gemm_256x64_32x2_tt_align4,passed,success,universal,serial,16384,16384,16384,f16:row,f16:row,f16:column,1,0,1,1,tensorop,f16,256,64,32,2,4,1,1,16,8,8,75,1024,1610612736,8796629893120,5461,98.6098,15.2115,89206.5
1,CUTLASS,gemm,cutlass_tensorop_h1688gemm_256x64_32x2_tt_align2,passed,success,universal,serial,16384,16384,16384,f16:row,f16:row,f16:column,1,0,1,1,tensorop,f16,256,64,32,2,4,1,1,16,8,8,75,1024,1610612736,8796629893120,5461,104.235,14.3906,84392.3
1,CUTLASS,gemm,cutlass_tensorop_h1688gemm_256x64_32x2_tt_align1,passed,success,universal,serial,16384,16384,16384,f16:row,f16:row,f16:column,1,0,1,1,tensorop,f16,256,64,32,2,4,1,1,16,8,8,75,1024,1610612736,8796629893120,5461,141.046,10.6348,62367
1,CUTLASS,gemm,cutlass_tensorop_h1688gemm_64x128_32x2_tt_align8,passed,success,universal,serial,16384,16384,16384,f16:row,f16:row,f16:column,1,0,1,1,tensorop,f16,64,128,32,2,2,2,1,16,8,8,75,1024,1610612736,8796629893120,5461,257.349,5.82865,34181.7
1,CUTLASS,gemm,cutlass_tensorop_h1688gemm_64x128_32x2_tt_align4,passed,success,universal,serial,16384,16384,16384,f16:row,f16:row,f16:column,1,0,1,1,tensorop,f16,64,128,32,2,2,2,1,16,8,8,75,1024,1610612736,8796629893120,5461,250.37,5.99113,35134.5
1,CUTLASS,gemm,cutlass_tensorop_h1688gemm_64x128_32x2_tt_align2,passed,success,universal,serial,16384,16384,16384,f16:row,f16:row,f16:column,1,0,1,1,tensorop,f16,64,128,32,2,2,2,1,16,8,8,75,1024,1610612736,8796629893120,5461,226.322,6.62773,38867.8
1,CUTLASS,gemm,cutlass_tensorop_h1688gemm_64x128_32x2_tt_align1,passed,success,universal,serial,16384,16384,16384,f16:row,f16:row,f16:column,1,0,1,1,tensorop,f16,64,128,32,2,2,2,1,16,8,8,75,1024,1610612736,8796629893120,5461,228.175,6.57391,38552.2
1,CUTLASS,gemm,cutlass_tensorop_h1688gemm_128x64_32x2_tt_align8,passed,success,universal,serial,16384,16384,16384,f16:row,f16:row,f16:column,1,0,1,1,tensorop,f16,128,64,32,2,2,2,1,16,8,8,75,1024,1610612736,8796629893120,5461,107.679,13.9303,81693.1
1,CUTLASS,gemm,cutlass_tensorop_h1688gemm_128x64_32x2_tt_align4,passed,success,universal,serial,16384,16384,16384,f16:row,f16:row,f16:column,1,0,1,1,tensorop,f16,128,64,32,2,2,2,1,16,8,8,75,1024,1610612736,8796629893120,5461,120.131,12.4864,73225.2
1,CUTLASS,gemm,cutlass_tensorop_h1688gemm_128x64_32x2_tt_align2,passed,success,universal,serial,16384,16384,16384,f16:row,f16:row,f16:column,1,0,1,1,tensorop,f16,128,64,32,2,2,2,1,16,8,8,75,1024,1610612736,8796629893120,5461,126.249,11.8813,69676.9
1,CUTLASS,gemm,cutlass_tensorop_h1688gemm_128x64_32x2_tt_align1,passed,success,universal,serial,16384,16384,16384,f16:row,f16:row,f16:column,1,0,1,1,tensorop,f16,128,64,32,2,2,2,1,16,8,8,75,1024,1610612736,8796629893120,5461,169.758,8.83611,51818.7
1,CUTLASS,gemm,cutlass_tensorop_h1688gemm_64x64_32x2_tt_align8,passed,success,universal,serial,16384,16384,16384,f16:row,f16:row,f16:column,1,0,1,1,tensorop,f16,64,64,32,2,2,2,1,16,8,8,75,1024,1610612736,8796629893120,5461,136.477,10.9909,64455.2
1,CUTLASS,gemm,cutlass_tensorop_h1688gemm_64x64_32x2_tt_align4,passed,success,universal,serial,16384,16384,16384,f16:row,f16:row,f16:column,1,0,1,1,tensorop,f16,64,64,32,2,2,2,1,16,8,8,75,1024,1610612736,8796629893120,5461,172.04,8.71892,51131.4
1,CUTLASS,gemm,cutlass_tensorop_h1688gemm_64x64_32x2_tt_align2,passed,success,universal,serial,16384,16384,16384,f16:row,f16:row,f16:column,1,0,1,1,tensorop,f16,64,64,32,2,2,2,1,16,8,8,75,1024,1610612736,8796629893120,5461,160.165,9.36536,54922.4
1,CUTLASS,gemm,cutlass_tensorop_h1688gemm_64x64_32x2_tt_align1,passed,success,universal,serial,16384,16384,16384,f16:row,f16:row,f16:column,1,0,1,1,tensorop,f16,64,64,32,2,2,2,1,16,8,8,75,1024,1610612736,8796629893120,5461,241.135,6.22059,36480.2
1,CUTLASS,gemm,cutlass_tensorop_h1688gemm_64x128_64x2_tt_align8,passed,success,universal,serial,16384,16384,16384,f16:row,f16:row,f16:column,1,0,1,1,tensorop,f16,64,128,64,2,1,2,2,16,8,8,75,1024,1610612736,8796629893120,5461,168.675,8.89284,52151.3
1,CUTLASS,gemm,cutlass_tensorop_h1688gemm_64x128_64x2_tt_align4,passed,success,universal,serial,16384,16384,16384,f16:row,f16:row,f16:column,1,0,1,1,tensorop,f16,64,128,64,2,1,2,2,16,8,8,75,1024,1610612736,8796629893120,5461,139.792,10.7302,62926.5
1,CUTLASS,gemm,cutlass_tensorop_h1688gemm_64x128_64x2_tt_align2,passed,success,universal,serial,16384,16384,16384,f16:row,f16:row,f16:column,1,0,1,1,tensorop,f16,64,128,64,2,1,2,2,16,8,8,75,1024,1610612736,8796629893120,5461,133.912,11.2014,65689.9
1,CUTLASS,gemm,cutlass_tensorop_h1688gemm_64x128_64x2_tt_align1,passed,success,universal,serial,16384,16384,16384,f16:row,f16:row,f16:column,1,0,1,1,tensorop,f16,64,128,64,2,1,2,2,16,8,8,75,1024,1610612736,8796629893120,5461,132.296,11.3382,66491.9
1,CUTLASS,gemm,cutlass_tensorop_h16816gemm_256x128_32x3_nn_align8,passed,success,universal,serial,16384,16384,16384,f16:column,f16:column,f16:column,1,0,1,1,tensorop,f16,256,128,32,3,4,2,1,16,8,16,80,1024,1610612736,8796629893120,5461,63.4299,23.6481,138683
1,CUTLASS,gemm,cutlass_tensorop_h16816gemm_256x128_32x3_nn_align4,passed,success,universal,serial,16384,16384,16384,f16:column,f16:column,f16:column,1,0,1,1,tensorop,f16,256,128,32,3,4,2,1,16,8,16,80,1024,1610612736,8796629893120,5461,66.1916,22.6615,132897
1,CUTLASS,gemm,cutlass_tensorop_h16816gemm_256x128_32x3_nn_align2,passed,success,universal,serial,16384,16384,16384,f16:column,f16:column,f16:column,1,0,1,1,tensorop,f16,256,128,32,3,4,2,1,16,8,16,80,1024,1610612736,8796629893120,5461,73.5434,20.3961,119611
1,CUTLASS,gemm,cutlass_tensorop_h16816gemm_128x256_32x3_nn_align8,passed,success,universal,serial,16384,16384,16384,f16:column,f16:column,f16:column,1,0,1,1,tensorop,f16,128,256,32,3,2,4,1,16,8,16,80,1024,1610612736,8796629893120,5461,64.9911,23.0801,135351
1,CUTLASS,gemm,cutlass_tensorop_h16816gemm_128x256_32x3_nn_align4,passed,success,universal,serial,16384,16384,16384,f16:column,f16:column,f16:column,1,0,1,1,tensorop,f16,128,256,32,3,2,4,1,16,8,16,80,1024,1610612736,8796629893120,5461,67.0997,22.3548,131098
1,CUTLASS,gemm,cutlass_tensorop_h16816gemm_128x256_32x3_nn_align2,passed,success,universal,serial,16384,16384,16384,f16:column,f16:column,f16:column,1,0,1,1,tensorop,f16,128,256,32,3,2,4,1,16,8,16,80,1024,1610612736,8796629893120,5461,70.2503,21.3522,125218
1,CUTLASS,gemm,cutlass_tensorop_h16816gemm_256x64_32x3_nn_align8,passed,success,universal,serial,16384,16384,16384,f16:column,f16:column,f16:column,1,0,1,1,tensorop,f16,256,64,32,3,4,1,1,16,8,16,80,1024,1610612736,8796629893120,5461,84.9944,17.6482,103497
1,CUTLASS,gemm,cutlass_tensorop_h16816gemm_256x64_32x3_nn_align4,passed,success,universal,serial,16384,16384,16384,f16:column,f16:column,f16:column,1,0,1,1,tensorop,f16,256,64,32,3,4,1,1,16,8,16,80,1024,1610612736,8796629893120,5461,94.803,15.8223,92788.5
1,CUTLASS,gemm,cutlass_tensorop_h16816gemm_256x64_32x3_nn_align2,passed,success,universal,serial,16384,16384,16384,f16:column,f16:column,f16:column,1,0,1,1,tensorop,f16,256,64,32,3,4,1,1,16,8,16,80,1024,1610612736,8796629893120,5461,190.304,7.88212,46224.1
1,CUTLASS,gemm,cutlass_tensorop_h16816gemm_256x64_32x4_nn_align8,passed,success,universal,serial,16384,16384,16384,f16:column,f16:column,f16:column,1,0,1,1,tensorop,f16,256,64,32,4,4,1,1,16,8,16,80,1024,1610612736,8796629893120,5461,85.1907,17.6076,103258
1,CUTLASS,gemm,cutlass_tensorop_h16816gemm_256x64_32x4_nn_align4,passed,success,universal,serial,16384,16384,16384,f16:column,f16:column,f16:column,1,0,1,1,tensorop,f16,256,64,32,4,4,1,1,16,8,16,80,1024,1610612736,8796629893120,5461,96.3962,15.5608,91255
1,CUTLASS,gemm,cutlass_tensorop_h16816gemm_256x64_32x4_nn_align2,passed,success,universal,serial,16384,16384,16384,f16:column,f16:column,f16:column,1,0,1,1,tensorop,f16,256,64,32,4,4,1,1,16,8,16,80,1024,1610612736,8796629893120,5461,165.208,9.07944,53245.6
1,CUTLASS,gemm,cutlass_tensorop_h16816gemm_64x256_32x4_nn_align8,passed,success,universal,serial,16384,16384,16384,f16:column,f16:column,f16:column,1,0,1,1,tensorop,f16,64,256,32,4,1,4,1,16,8,16,80,1024,1610612736,8796629893120,5461,149.763,10.0158,58737.1
1,CUTLASS,gemm,cutlass_tensorop_h16816gemm_64x256_32x4_nn_align4,passed,success,universal,serial,16384,16384,16384,f16:column,f16:column,f16:column,1,0,1,1,tensorop,f16,64,256,32,4,1,4,1,16,8,16,80,1024,1610612736,8796629893120,5461,88.07,17.0319,99882.2
1,CUTLASS,gemm,cutlass_tensorop_h16816gemm_64x256_32x4_nn_align2,passed,success,universal,serial,16384,16384,16384,f16:column,f16:column,f16:column,1,0,1,1,tensorop,f16,64,256,32,4,1,4,1,16,8,16,80,1024,1610612736,8796629893120,5461,122.735,12.2215,71671.8
1,CUTLASS,gemm,cutlass_tensorop_h16816gemm_128x128_32x3_nn_align8,passed,success,universal,serial,16384,16384,16384,f16:column,f16:column,f16:column,1,0,1,1,tensorop,f16,128,128,32,3,2,2,1,16,8,16,80,1024,1610612736,8796629893120,5461,75.5473,19.8551,116439
1,CUTLASS,gemm,cutlass_tensorop_h16816gemm_128x128_32x3_nn_align4,passed,success,universal,serial,16384,16384,16384,f16:column,f16:column,f16:column,1,0,1,1,tensorop,f16,128,128,32,3,2,2,1,16,8,16,80,1024,1610612736,8796629893120,5461,99.9926,15.0011,87972.8
1,CUTLASS,gemm,cutlass_tensorop_h16816gemm_128x128_32x3_nn_align2,passed,success,universal,serial,16384,16384,16384,f16:column,f16:column,f16:column,1,0,1,1,tensorop,f16,128,128,32,3,2,2,1,16,8,16,80,1024,1610612736,8796629893120,5461,84.7138,17.7067,103839
1,CUTLASS,gemm,cutlass_tensorop_h16816gemm_128x128_32x4_nn_align8,passed,success,universal,serial,16384,16384,16384,f16:column,f16:column,f16:column,1,0,1,1,tensorop,f16,128,128,32,4,2,2,1,16,8,16,80,1024,1610612736,8796629893120,5461,68.6378,21.8538,128160
1,CUTLASS,gemm,cutlass_tensorop_h16816gemm_128x128_32x4_nn_align4,passed,success,universal,serial,16384,16384,16384,f16:column,f16:column,f16:column,1,0,1,1,tensorop,f16,128,128,32,4,2,2,1,16,8,16,80,1024,1610612736,8796629893120,5461,75.6318,19.8329,116309
1,CUTLASS,gemm,cutlass_tensorop_h16816gemm_128x128_32x4_nn_align2,passed,success,universal,serial,16384,16384,16384,f16:column,f16:column,f16:column,1,0,1,1,tensorop,f16,128,128,32,4,2,2,1,16,8,16,80,1024,1610612736,8796629893120,5461,87.721,17.0997,100280
1,CUTLASS,gemm,cutlass_tensorop_h16816gemm_128x128_32x5_nn_align8,passed,success,universal,serial,16384,16384,16384,f16:column,f16:column,f16:column,1,0,1,1,tensorop,f16,128,128,32,5,2,2,1,16,8,16,80,1024,1610612736,8796629893120,5461,68.5599,21.8787,128306
1,CUTLASS,gemm,cutlass_tensorop_h16816gemm_128x128_32x5_nn_align4,passed,success,universal,serial,16384,16384,16384,f16:column,f16:column,f16:column,1,0,1,1,tensorop,f16,128,128,32,5,2,2,1,16,8,16,80,1024,1610612736,8796629893120,5461,74.0628,20.2531,118773
1,CUTLASS,gemm,cutlass_tensorop_h16816gemm_128x128_32x5_nn_align2,passed,success,universal,serial,16384,16384,16384,f16:column,f16:column,f16:column,1,0,1,1,tensorop,f16,128,128,32,5,2,2,1,16,8,16,80,1024,1610612736,8796629893120,5461,89.2749,16.802,98534.2
1,CUTLASS,gemm,cutlass_tensorop_h16816gemm_128x64_32x6_nn_align8,passed,success,universal,serial,16384,16384,16384,f16:column,f16:column,f16:column,1,0,1,1,tensorop,f16,128,64,32,6,2,2,1,16,8,16,80,1024,1610612736,8796629893120,5461,107.574,13.9439,81773
1,CUTLASS,gemm,cutlass_tensorop_h16816gemm_128x64_32x6_nn_align4,passed,success,universal,serial,16384,16384,16384,f16:column,f16:column,f16:column,1,0,1,1,tensorop,f16,128,64,32,6,2,2,1,16,8,16,80,1024,1610612736,8796629893120,5461,105.58,14.2072,83316.8
1,CUTLASS,gemm,cutlass_tensorop_h16816gemm_128x64_32x6_nn_align2,passed,success,universal,serial,16384,16384,16384,f16:column,f16:column,f16:column,1,0,1,1,tensorop,f16,128,64,32,6,2,2,1,16,8,16,80,1024,1610612736,8796629893120,5461,129.831,11.5535,67754.6
1,CUTLASS,gemm,cutlass_tensorop_h16816gemm_64x128_32x6_nn_align8,passed,success,universal,serial,16384,16384,16384,f16:column,f16:column,f16:column,1,0,1,1,tensorop,f16,64,128,32,6,2,2,1,16,8,16,80,1024,1610612736,8796629893120,5461,172.894,8.67585,50878.8
1,CUTLASS,gemm,cutlass_tensorop_h16816gemm_64x128_32x6_nn_align4,passed,success,universal,serial,16384,16384,16384,f16:column,f16:column,f16:column,1,0,1,1,tensorop,f16,64,128,32,6,2,2,1,16,8,16,80,1024,1610612736,8796629893120,5461,105.149,14.2655,83658.8
1,CUTLASS,gemm,cutlass_tensorop_h16816gemm_64x128_32x6_nn_align2,passed,success,universal,serial,16384,16384,16384,f16:column,f16:column,f16:column,1,0,1,1,tensorop,f16,64,128,32,6,2,2,1,16,8,16,80,1024,1610612736,8796629893120,5461,128.832,11.6431,68280.1
1,CUTLASS,gemm,cutlass_tensorop_h16816gemm_64x64_32x10_nn_align8,passed,success,universal,serial,16384,16384,16384,f16:column,f16:column,f16:column,1,0,1,1,tensorop,f16,64,64,32,10,2,2,1,16,8,16,80,1024,1610612736,8796629893120,5461,178.437,8.40634,49298.3
1,CUTLASS,gemm,cutlass_tensorop_h16816gemm_64x64_32x10_nn_align4,passed,success,universal,serial,16384,16384,16384,f16:column,f16:column,f16:column,1,0,1,1,tensorop,f16,64,64,32,10,2,2,1,16,8,16,80,1024,1610612736,8796629893120,5461,136.711,10.9721,64344.9
1,CUTLASS,gemm,cutlass_tensorop_h16816gemm_64x64_32x10_nn_align2,passed,success,universal,serial,16384,16384,16384,f16:column,f16:column,f16:column,1,0,1,1,tensorop,f16,64,64,32,10,2,2,1,16,8,16,80,1024,1610612736,8796629893120,5461,170.689,8.78792,51536
1,CUTLASS,gemm,cutlass_tensorop_h16816gemm_128x64_64x3_nn_align8,passed,success,universal,serial,16384,16384,16384,f16:column,f16:column,f16:column,1,0,1,1,tensorop,f16,128,64,64,3,2,2,1,16,8,16,80,1024,1610612736,8796629893120,5461,98.6629,15.2033,89158.4
1,CUTLASS,gemm,cutlass_tensorop_h16816gemm_128x64_64x3_nn_align4,passed,success,universal,serial,16384,16384,16384,f16:column,f16:column,f16:column,1,0,1,1,tensorop,f16,128,64,64,3,2,2,1,16,8,16,80,1024,1610612736,8796629893120,5461,101.855,14.7268,86363.9
1,CUTLASS,gemm,cutlass_tensorop_h16816gemm_128x64_64x3_nn_align2,passed,success,universal,serial,16384,16384,16384,f16:column,f16:column,f16:column,1,0,1,1,tensorop,f16,128,64,64,3,2,2,1,16,8,16,80,1024,1610612736,8796629893120,5461,137.492,10.9097,63979.1
1,CUTLASS,gemm,cutlass_tensorop_h16816gemm_64x128_64x3_nn_align8,passed,success,universal,serial,16384,16384,16384,f16:column,f16:column,f16:column,1,0,1,1,tensorop,f16,64,128,64,3,2,2,1,16,8,16,80,1024,1610612736,8796629893120,5461,100.595,14.9112,87445.6
1,CUTLASS,gemm,cutlass_tensorop_h16816gemm_64x128_64x3_nn_align4,passed,success,universal,serial,16384,16384,16384,f16:column,f16:column,f16:column,1,0,1,1,tensorop,f16,64,128,64,3,2,2,1,16,8,16,80,1024,1610612736,8796629893120,5461,103.68,14.4676,84844
1,CUTLASS,gemm,cutlass_tensorop_h16816gemm_64x128_64x3_nn_align2,passed,success,universal,serial,16384,16384,16384,f16:column,f16:column,f16:column,1,0,1,1,tensorop,f16,64,128,64,3,2,2,1,16,8,16,80,1024,1610612736,8796629893120,5461,131.177,11.4349,67059.1
1,CUTLASS,gemm,cutlass_tensorop_h16816gemm_64x64_64x5_nn_align8,passed,success,universal,serial,16384,16384,16384,f16:column,f16:column,f16:column,1,0,1,1,tensorop,f16,64,64,64,5,2,2,1,16,8,16,80,1024,1610612736,8796629893120,5461,149.317,10.0457,58912.3
1,CUTLASS,gemm,cutlass_tensorop_h16816gemm_64x64_64x5_nn_align4,passed,success,universal,serial,16384,16384,16384,f16:column,f16:column,f16:column,1,0,1,1,tensorop,f16,64,64,64,5,2,2,1,16,8,16,80,1024,1610612736,8796629893120,5461,132.887,11.2878,66196.5
1,CUTLASS,gemm,cutlass_tensorop_h16816gemm_64x64_64x5_nn_align2,passed,success,universal,serial,16384,16384,16384,f16:column,f16:column,f16:column,1,0,1,1,tensorop,f16,64,64,64,5,2,2,1,16,8,16,80,1024,1610612736,8796629893120,5461,149.455,10.0365,58858.2
1,CUTLASS,gemm,cutlass_tensorop_h16816gemm_256x128_32x3_nt_align8,incorrect,success,universal,serial,16384,16384,16384,f16:column,f16:row,f16:column,1,0,1,1,tensorop,f16,256,128,32,3,4,2,1,16,8,16,80,1024,1610612736,8796629893120,5461,62.9409,23.8319,139760
1,CUTLASS,gemm,cutlass_tensorop_h16816gemm_256x128_32x3_nt_align4,incorrect,success,universal,serial,16384,16384,16384,f16:column,f16:row,f16:column,1,0,1,1,tensorop,f16,256,128,32,3,4,2,1,16,8,16,80,1024,1610612736,8796629893120,5461,65.2072,23.0036,134903
1,CUTLASS,gemm,cutlass_tensorop_h16816gemm_256x128_32x3_nt_align2,incorrect,success,universal,serial,16384,16384,16384,f16:column,f16:row,f16:column,1,0,1,1,tensorop,f16,256,128,32,3,4,2,1,16,8,16,80,1024,1610612736,8796629893120,5461,73.1616,20.5026,120236
1,CUTLASS,gemm,cutlass_tensorop_h16816gemm_128x256_32x3_nt_align8,incorrect,success,universal,serial,16384,16384,16384,f16:column,f16:row,f16:column,1,0,1,1,tensorop,f16,128,256,32,3,2,4,1,16,8,16,80,1024,1610612736,8796629893120,5461,63.1383,23.7574,139323
1,CUTLASS,gemm,cutlass_tensorop_h16816gemm_128x256_32x3_nt_align4,incorrect,success,universal,serial,16384,16384,16384,f16:column,f16:row,f16:column,1,0,1,1,tensorop,f16,128,256,32,3,2,4,1,16,8,16,80,1024,1610612736,8796629893120,5461,64.9635,23.0899,135409
1,CUTLASS,gemm,cutlass_tensorop_h16816gemm_128x256_32x3_nt_align2,incorrect,success,universal,serial,16384,16384,16384,f16:column,f16:row,f16:column,1,0,1,1,tensorop,f16,128,256,32,3,2,4,1,16,8,16,80,1024,1610612736,8796629893120,5461,77.0215,19.4751,114210
1,CUTLASS,gemm,cutlass_tensorop_h16816gemm_256x64_32x3_nt_align8,incorrect,success,universal,serial,16384,16384,16384,f16:column,f16:row,f16:column,1,0,1,1,tensorop,f16,256,64,32,3,4,1,1,16,8,16,80,1024,1610612736,8796629893120,5461,83.6916,17.9229,105108
1,CUTLASS,gemm,cutlass_tensorop_h16816gemm_256x64_32x3_nt_align4,incorrect,success,universal,serial,16384,16384,16384,f16:column,f16:row,f16:column,1,0,1,1,tensorop,f16,256,64,32,3,4,1,1,16,8,16,80,1024,1610612736,8796629893120,5461,86.9519,17.2509,101167
1,CUTLASS,gemm,cutlass_tensorop_h16816gemm_256x64_32x3_nt_align2,incorrect,success,universal,serial,16384,16384,16384,f16:column,f16:row,f16:column,1,0,1,1,tensorop,f16,256,64,32,3,4,1,1,16,8,16,80,1024,1610612736,8796629893120,5461,100.602,14.9102,87439.5
1,CUTLASS,gemm,cutlass_tensorop_h16816gemm_256x64_32x4_nt_align8,incorrect,success,universal,serial,16384,16384,16384,f16:column,f16:row,f16:column,1,0,1,1,tensorop,f16,256,64,32,4,4,1,1,16,8,16,80,1024,1610612736,8796629893120,5461,82.6616,18.1463,106417
1,CUTLASS,gemm,cutlass_tensorop_h16816gemm_256x64_32x4_nt_align4,incorrect,success,universal,serial,16384,16384,16384,f16:column,f16:row,f16:column,1,0,1,1,tensorop,f16,256,64,32,4,4,1,1,16,8,16,80,1024,1610612736,8796629893120,5461,86.2755,17.3862,101960
1,CUTLASS,gemm,cutlass_tensorop_h16816gemm_256x64_32x4_nt_align2,incorrect,success,universal,serial,16384,16384,16384,f16:column,f16:row,f16:column,1,0,1,1,tensorop,f16,256,64,32,4,4,1,1,16,8,16,80,1024,1610612736,8796629893120,5461,112.9,13.2861,77915.1
1,CUTLASS,gemm,cutlass_tensorop_h16816gemm_64x256_32x4_nt_align8,incorrect,success,universal,serial,16384,16384,16384,f16:column,f16:row,f16:column,1,0,1,1,tensorop,f16,64,256,32,4,1,4,1,16,8,16,80,1024,1610612736,8796629893120,5461,93.2323,16.0888,94351.7
1,CUTLASS,gemm,cutlass_tensorop_h16816gemm_64x256_32x4_nt_align4,incorrect,success,universal,serial,16384,16384,16384,f16:column,f16:row,f16:column,1,0,1,1,tensorop,f16,64,256,32,4,1,4,1,16,8,16,80,1024,1610612736,8796629893120,5461,86.8862,17.264,101243
1,CUTLASS,gemm,cutlass_tensorop_h16816gemm_64x256_32x4_nt_align2,incorrect,success,universal,serial,16384,16384,16384,f16:column,f16:row,f16:column,1,0,1,1,tensorop,f16,64,256,32,4,1,4,1,16,8,16,80,1024,1610612736,8796629893120,5461,115.933,12.9385,75876.6
1,CUTLASS,gemm,cutlass_tensorop_h16816gemm_128x128_32x3_nt_align8,incorrect,success,universal,serial,16384,16384,16384,f16:column,f16:row,f16:column,1,0,1,1,tensorop,f16,128,128,32,3,2,2,1,16,8,16,80,1024,1610612736,8796629893120,5461,99.2857,15.1079,88599.2
1,CUTLASS,gemm,cutlass_tensorop_h16816gemm_128x128_32x3_nt_align4,incorrect,success,universal,serial,16384,16384,16384,f16:column,f16:row,f16:column,1,0,1,1,tensorop,f16,128,128,32,3,2,2,1,16,8,16,80,1024,1610612736,8796629893120,5461,69.6355,21.5407,126324
1,CUTLASS,gemm,cutlass_tensorop_h16816gemm_128x128_32x3_nt_align2,incorrect,success,universal,serial,16384,16384,16384,f16:column,f16:row,f16:column,1,0,1,1,tensorop,f16,128,128,32,3,2,2,1,16,8,16,80,1024,1610612736,8796629893120,5461,76.9236,19.4999,114355
1,CUTLASS,gemm,cutlass_tensorop_h16816gemm_128x128_32x4_nt_align8,incorrect,success,universal,serial,16384,16384,16384,f16:column,f16:row,f16:column,1,0,1,1,tensorop,f16,128,128,32,4,2,2,1,16,8,16,80,1024,1610612736,8796629893120,5461,68.8332,21.7918,127796
1,CUTLASS,gemm,cutlass_tensorop_h16816gemm_128x128_32x4_nt_align4,incorrect,success,universal,serial,16384,16384,16384,f16:column,f16:row,f16:column,1,0,1,1,tensorop,f16,128,128,32,4,2,2,1,16,8,16,80,1024,1610612736,8796629893120,5461,69.5135,21.5785,126546
1,CUTLASS,gemm,cutlass_tensorop_h16816gemm_128x128_32x4_nt_align2,incorrect,success,universal,serial,16384,16384,16384,f16:column,f16:row,f16:column,1,0,1,1,tensorop,f16,128,128,32,4,2,2,1,16,8,16,80,1024,1610612736,8796629893120,5461,79.775,18.8029,110268
1,CUTLASS,gemm,cutlass_tensorop_h16816gemm_128x128_32x5_nt_align8,incorrect,success,universal,serial,16384,16384,16384,f16:column,f16:row,f16:column,1,0,1,1,tensorop,f16,128,128,32,5,2,2,1,16,8,16,80,1024,1610612736,8796629893120,5461,68.1915,21.9969,128999
1,CUTLASS,gemm,cutlass_tensorop_h16816gemm_128x128_32x5_nt_align4,incorrect,success,universal,serial,16384,16384,16384,f16:column,f16:row,f16:column,1,0,1,1,tensorop,f16,128,128,32,5,2,2,1,16,8,16,80,1024,1610612736,8796629893120,5461,69.7138,21.5165,126182
1,CUTLASS,gemm,cutlass_tensorop_h16816gemm_128x128_32x5_nt_align2,incorrect,success,universal,serial,16384,16384,16384,f16:column,f16:row,f16:column,1,0,1,1,tensorop,f16,128,128,32,5,2,2,1,16,8,16,80,1024,1610612736,8796629893120,5461,79.94,18.7641,110040
1,CUTLASS,gemm,cutlass_tensorop_h16816gemm_128x64_32x6_nt_align8,incorrect,success,universal,serial,16384,16384,16384,f16:column,f16:row,f16:column,1,0,1,1,tensorop,f16,128,64,32,6,2,2,1,16,8,16,80,1024,1610612736,8796629893120,5461,102.679,14.6086,85671.2
1,CUTLASS,gemm,cutlass_tensorop_h16816gemm_128x64_32x6_nt_align4,incorrect,success,universal,serial,16384,16384,16384,f16:column,f16:row,f16:column,1,0,1,1,tensorop,f16,128,64,32,6,2,2,1,16,8,16,80,1024,1610612736,8796629893120,5461,101.336,14.8022,86806.4
1,CUTLASS,gemm,cutlass_tensorop_h16816gemm_128x64_32x6_nt_align2,incorrect,success,universal,serial,16384,16384,16384,f16:column,f16:row,f16:column,1,0,1,1,tensorop,f16,128,64,32,6,2,2,1,16,8,16,80,1024,1610612736,8796629893120,5461,121.436,12.3522,72438.5
1,CUTLASS,gemm,cutlass_tensorop_h16816gemm_64x128_32x6_nt_align8,incorrect,success,universal,serial,16384,16384,16384,f16:column,f16:row,f16:column,1,0,1,1,tensorop,f16,64,128,32,6,2,2,1,16,8,16,80,1024,1610612736,8796629893120,5461,155.648,9.63714,56516.2
1,CUTLASS,gemm,cutlass_tensorop_h16816gemm_64x128_32x6_nt_align4,incorrect,success,universal,serial,16384,16384,16384,f16:column,f16:row,f16:column,1,0,1,1,tensorop,f16,64,128,32,6,2,2,1,16,8,16,80,1024,1610612736,8796629893120,5461,101.692,14.7505,86502.9
1,CUTLASS,gemm,cutlass_tensorop_h16816gemm_64x128_32x6_nt_align2,incorrect,success,universal,serial,16384,16384,16384,f16:column,f16:row,f16:column,1,0,1,1,tensorop,f16,64,128,32,6,2,2,1,16,8,16,80,1024,1610612736,8796629893120,5461,122.903,12.2047,71573.6
1,CUTLASS,gemm,cutlass_tensorop_h16816gemm_64x64_32x10_nt_align8,incorrect,success,universal,serial,16384,16384,16384,f16:column,f16:row,f16:column,1,0,1,1,tensorop,f16,64,64,32,10,2,2,1,16,8,16,80,1024,1610612736,8796629893120,5461,151.619,9.89325,58018.2
1,CUTLASS,gemm,cutlass_tensorop_h16816gemm_64x64_32x10_nt_align4,incorrect,success,universal,serial,16384,16384,16384,f16:column,f16:row,f16:column,1,0,1,1,tensorop,f16,64,64,32,10,2,2,1,16,8,16,80,1024,1610612736,8796629893120,5461,131.596,11.3985,66845.8
1,CUTLASS,gemm,cutlass_tensorop_h16816gemm_64x64_32x10_nt_align2,incorrect,success,universal,serial,16384,16384,16384,f16:column,f16:row,f16:column,1,0,1,1,tensorop,f16,64,64,32,10,2,2,1,16,8,16,80,1024,1610612736,8796629893120,5461,151.696,9.88819,57988.5
1,CUTLASS,gemm,cutlass_tensorop_h16816gemm_128x64_64x3_nt_align8,incorrect,success,universal,serial,16384,16384,16384,f16:column,f16:row,f16:column,1,0,1,1,tensorop,f16,128,64,64,3,2,2,1,16,8,16,80,1024,1610612736,8796629893120,5461,99.9083,15.0138,88047
1,CUTLASS,gemm,cutlass_tensorop_h16816gemm_128x64_64x3_nt_align4,incorrect,success,universal,serial,16384,16384,16384,f16:column,f16:row,f16:column,1,0,1,1,tensorop,f16,128,64,64,3,2,2,1,16,8,16,80,1024,1610612736,8796629893120,5461,103.294,14.5217,85161.3
1,CUTLASS,gemm,cutlass_tensorop_h16816gemm_128x64_64x3_nt_align2,incorrect,success,universal,serial,16384,16384,16384,f16:column,f16:row,f16:column,1,0,1,1,tensorop,f16,128,64,64,3,2,2,1,16,8,16,80,1024,1610612736,8796629893120,5461,144.858,10.3549,60725.7
1,CUTLASS,gemm,cutlass_tensorop_h16816gemm_64x128_64x3_nt_align8,incorrect,success,universal,serial,16384,16384,16384,f16:column,f16:row,f16:column,1,0,1,1,tensorop,f16,64,128,64,3,2,2,1,16,8,16,80,1024,1610612736,8796629893120,5461,100.231,14.9654,87763.4
1,CUTLASS,gemm,cutlass_tensorop_h16816gemm_64x128_64x3_nt_align4,incorrect,success,universal,serial,16384,16384,16384,f16:column,f16:row,f16:column,1,0,1,1,tensorop,f16,64,128,64,3,2,2,1,16,8,16,80,1024,1610612736,8796629893120,5461,102.417,14.646,85890.2
1,CUTLASS,gemm,cutlass_tensorop_h16816gemm_64x128_64x3_nt_align2,incorrect,success,universal,serial,16384,16384,16384,f16:column,f16:row,f16:column,1,0,1,1,tensorop,f16,64,128,64,3,2,2,1,16,8,16,80,1024,1610612736,8796629893120,5461,147.172,10.1922,59771.1
1,CUTLASS,gemm,cutlass_tensorop_h16816gemm_64x64_64x5_nt_align8,incorrect,success,universal,serial,16384,16384,16384,f16:column,f16:row,f16:column,1,0,1,1,tensorop,f16,64,64,64,5,2,2,1,16,8,16,80,1024,1610612736,8796629893120,5461,131.967,11.3664,66657.6
1,CUTLASS,gemm,cutlass_tensorop_h16816gemm_64x64_64x5_nt_align4,incorrect,success,universal,serial,16384,16384,16384,f16:column,f16:row,f16:column,1,0,1,1,tensorop,f16,64,64,64,5,2,2,1,16,8,16,80,1024,1610612736,8796629893120,5461,131.718,11.3879,66783.6
1,CUTLASS,gemm,cutlass_tensorop_h16816gemm_64x64_64x5_nt_align2,incorrect,success,universal,serial,16384,16384,16384,f16:column,f16:row,f16:column,1,0,1,1,tensorop,f16,64,64,64,5,2,2,1,16,8,16,80,1024,1610612736,8796629893120,5461,145.313,10.3225,60535.7
1,CUTLASS,gemm,cutlass_tensorop_h16816gemm_256x128_32x3_tn_align8,incorrect,success,universal,serial,16384,16384,16384,f16:row,f16:column,f16:column,1,0,1,1,tensorop,f16,256,128,32,3,4,2,1,16,8,16,80,1024,1610612736,8796629893120,5461,64.5781,23.2277,136217
1,CUTLASS,gemm,cutlass_tensorop_h16816gemm_256x128_32x3_tn_align4,incorrect,success,universal,serial,16384,16384,16384,f16:row,f16:column,f16:column,1,0,1,1,tensorop,f16,256,128,32,3,4,2,1,16,8,16,80,1024,1610612736,8796629893120,5461,66.8699,22.4316,131549
1,CUTLASS,gemm,cutlass_tensorop_h16816gemm_256x128_32x3_tn_align2,incorrect,success,universal,serial,16384,16384,16384,f16:row,f16:column,f16:column,1,0,1,1,tensorop,f16,256,128,32,3,4,2,1,16,8,16,80,1024,1610612736,8796629893120,5461,76.2855,19.663,115312
1,CUTLASS,gemm,cutlass_tensorop_h16816gemm_128x256_32x3_tn_align8,incorrect,success,universal,serial,16384,16384,16384,f16:row,f16:column,f16:column,1,0,1,1,tensorop,f16,128,256,32,3,2,4,1,16,8,16,80,1024,1610612736,8796629893120,5461,64.0919,23.4039,137250
1,CUTLASS,gemm,cutlass_tensorop_h16816gemm_128x256_32x3_tn_align4,incorrect,success,universal,serial,16384,16384,16384,f16:row,f16:column,f16:column,1,0,1,1,tensorop,f16,128,256,32,3,2,4,1,16,8,16,80,1024,1610612736,8796629893120,5461,66.9764,22.396,131339
1,CUTLASS,gemm,cutlass_tensorop_h16816gemm_128x256_32x3_tn_align2,incorrect,success,universal,serial,16384,16384,16384,f16:row,f16:column,f16:column,1,0,1,1,tensorop,f16,128,256,32,3,2,4,1,16,8,16,80,1024,1610612736,8796629893120,5461,76.2747,19.6658,115328
1,CUTLASS,gemm,cutlass_tensorop_h16816gemm_256x64_32x3_tn_align8,incorrect,success,universal,serial,16384,16384,16384,f16:row,f16:column,f16:column,1,0,1,1,tensorop,f16,256,64,32,3,4,1,1,16,8,16,80,1024,1610612736,8796629893120,5461,84.7052,17.7085,103850
1,CUTLASS,gemm,cutlass_tensorop_h16816gemm_256x64_32x3_tn_align4,incorrect,success,universal,serial,16384,16384,16384,f16:row,f16:column,f16:column,1,0,1,1,tensorop,f16,256,64,32,3,4,1,1,16,8,16,80,1024,1610612736,8796629893120,5461,94.9679,15.7948,92627.4
1,CUTLASS,gemm,cutlass_tensorop_h16816gemm_256x64_32x3_tn_align2,incorrect,success,universal,serial,16384,16384,16384,f16:row,f16:column,f16:column,1,0,1,1,tensorop,f16,256,64,32,3,4,1,1,16,8,16,80,1024,1610612736,8796629893120,5461,180.543,8.30826,48723.1
1,CUTLASS,gemm,cutlass_tensorop_h16816gemm_256x64_32x4_tn_align8,incorrect,success,universal,serial,16384,16384,16384,f16:row,f16:column,f16:column,1,0,1,1,tensorop,f16,256,64,32,4,4,1,1,16,8,16,80,1024,1610612736,8796629893120,5461,85.4758,17.5488,102914
1,CUTLASS,gemm,cutlass_tensorop_h16816gemm_256x64_32x4_tn_align4,incorrect,success,universal,serial,16384,16384,16384,f16:row,f16:column,f16:column,1,0,1,1,tensorop,f16,256,64,32,4,4,1,1,16,8,16,80,1024,1610612736,8796629893120,5461,91.6939,16.3588,95934.7
1,CUTLASS,gemm,cutlass_tensorop_h16816gemm_256x64_32x4_tn_align2,incorrect,success,universal,serial,16384,16384,16384,f16:row,f16:column,f16:column,1,0,1,1,tensorop,f16,256,64,32,4,4,1,1,16,8,16,80,1024,1610612736,8796629893120,5461,194.305,7.7198,45272.2
1,CUTLASS,gemm,cutlass_tensorop_h16816gemm_64x256_32x4_tn_align8,incorrect,success,universal,serial,16384,16384,16384,f16:row,f16:column,f16:column,1,0,1,1,tensorop,f16,64,256,32,4,1,4,1,16,8,16,80,1024,1610612736,8796629893120,5461,190.075,7.89164,46279.9
1,CUTLASS,gemm,cutlass_tensorop_h16816gemm_64x256_32x4_tn_align4,incorrect,success,universal,serial,16384,16384,16384,f16:row,f16:column,f16:column,1,0,1,1,tensorop,f16,64,256,32,4,1,4,1,16,8,16,80,1024,1610612736,8796629893120,5461,157.904,9.49946,55708.8
1,CUTLASS,gemm,cutlass_tensorop_h16816gemm_64x256_32x4_tn_align2,incorrect,success,universal,serial,16384,16384,16384,f16:row,f16:column,f16:column,1,0,1,1,tensorop,f16,64,256,32,4,1,4,1,16,8,16,80,1024,1610612736,8796629893120,5461,182.373,8.22491,48234.3
1,CUTLASS,gemm,cutlass_tensorop_h16816gemm_128x128_32x3_tn_align8,incorrect,success,universal,serial,16384,16384,16384,f16:row,f16:column,f16:column,1,0,1,1,tensorop,f16,128,128,32,3,2,2,1,16,8,16,80,1024,1610612736,8796629893120,5461,67.581,22.1956,130164
1,CUTLASS,gemm,cutlass_tensorop_h16816gemm_128x128_32x3_tn_align4,incorrect,success,universal,serial,16384,16384,16384,f16:row,f16:column,f16:column,1,0,1,1,tensorop,f16,128,128,32,3,2,2,1,16,8,16,80,1024,1610612736,8796629893120,5461,139.248,10.7722,63172.5
1,CUTLASS,gemm,cutlass_tensorop_h16816gemm_128x128_32x3_tn_align2,incorrect,success,universal,serial,16384,16384,16384,f16:row,f16:column,f16:column,1,0,1,1,tensorop,f16,128,128,32,3,2,2,1,16,8,16,80,1024,1610612736,8796629893120,5461,95.5758,15.6944,92038.3
1,CUTLASS,gemm,cutlass_tensorop_h16816gemm_128x128_32x4_tn_align8,incorrect,success,universal,serial,16384,16384,16384,f16:row,f16:column,f16:column,1,0,1,1,tensorop,f16,128,128,32,4,2,2,1,16,8,16,80,1024,1610612736,8796629893120,5461,67.0768,22.3624,131143
1,CUTLASS,gemm,cutlass_tensorop_h16816gemm_128x128_32x4_tn_align4,incorrect,success,universal,serial,16384,16384,16384,f16:row,f16:column,f16:column,1,0,1,1,tensorop,f16,128,128,32,4,2,2,1,16,8,16,80,1024,1610612736,8796629893120,5461,76.7818,19.5359,114567
1,CUTLASS,gemm,cutlass_tensorop_h16816gemm_128x128_32x4_tn_align2,incorrect,success,universal,serial,16384,16384,16384,f16:row,f16:column,f16:column,1,0,1,1,tensorop,f16,128,128,32,4,2,2,1,16,8,16,80,1024,1610612736,8796629893120,5461,96.5601,15.5344,91100
1,CUTLASS,gemm,cutlass_tensorop_h16816gemm_128x128_32x5_tn_align8,incorrect,success,universal,serial,16384,16384,16384,f16:row,f16:column,f16:column,1,0,1,1,tensorop,f16,128,128,32,5,2,2,1,16,8,16,80,1024,1610612736,8796629893120,5461,68.0385,22.0464,129289
