CUTLASS/cutlassgemm-benchmark/csv_logs/cutlass_shape_8192_9216_36864_performance.gemm.csv
Problem,Provider,OperationKind,Operation,Disposition,Status,gemm_kind,split_k_mode,m,n,k,A,B,C,alpha,beta,split_k_slices,batch_count,op_class,accum,cta_m,cta_n,cta_k,stages,warps_m,warps_n,warps_k,inst_m,inst_n,inst_k,min_cc,max_cc,Bytes,Flops,Flops/Byte,Runtime,GB/s,GFLOPs
1,CUTLASS,gemm,cutlass_tensorop_h1688gemm_256x128_32x2_nn_align8,passed,success,universal,serial,8192,36864,9216,f16:column,f16:column,f16:column,1,0,1,1,tensorop,f16,256,128,32,2,4,2,1,16,8,8,75,1024,1434451968,5566881595392,3880,43.8464,30.4686,126963
1,CUTLASS,gemm,cutlass_tensorop_h1688gemm_256x128_32x2_nn_align4,passed,success,universal,serial,8192,36864,9216,f16:column,f16:column,f16:column,1,0,1,1,tensorop,f16,256,128,32,2,4,2,1,16,8,8,75,1024,1434451968,5566881595392,3880,53.7139,24.8713,103639
1,CUTLASS,gemm,cutlass_tensorop_h1688gemm_256x128_32x2_nn_align2,passed,success,universal,serial,8192,36864,9216,f16:column,f16:column,f16:column,1,0,1,1,tensorop,f16,256,128,32,2,4,2,1,16,8,8,75,1024,1434451968,5566881595392,3880,60.1796,22.1992,92504.5
1,CUTLASS,gemm,cutlass_tensorop_h1688gemm_256x128_32x2_nn_align1,passed,success,universal,serial,8192,36864,9216,f16:column,f16:column,f16:column,1,0,1,1,tensorop,f16,256,128,32,2,4,2,1,16,8,8,75,1024,1434451968,5566881595392,3880,83.1942,16.0581,66914.3
1,CUTLASS,gemm,cutlass_tensorop_h1688gemm_128x256_32x2_nn_align8,passed,success,universal,serial,8192,36864,9216,f16:column,f16:column,f16:column,1,0,1,1,tensorop,f16,128,256,32,2,2,4,1,16,8,8,75,1024,1434451968,5566881595392,3880,42.6783,31.3025,130438
1,CUTLASS,gemm,cutlass_tensorop_h1688gemm_128x256_32x2_nn_align4,passed,success,universal,serial,8192,36864,9216,f16:column,f16:column,f16:column,1,0,1,1,tensorop,f16,128,256,32,2,2,4,1,16,8,8,75,1024,1434451968,5566881595392,3880,45.9523,29.0723,121145
1,CUTLASS,gemm,cutlass_tensorop_h1688gemm_128x256_32x2_nn_align2,passed,success,universal,serial,8192,36864,9216,f16:column,f16:column,f16:column,1,0,1,1,tensorop,f16,128,256,32,2,2,4,1,16,8,8,75,1024,1434451968,5566881595392,3880,51.8882,25.7464,107286
1,CUTLASS,gemm,cutlass_tensorop_h1688gemm_128x256_32x2_nn_align1,passed,success,universal,serial,8192,36864,9216,f16:column,f16:column,f16:column,1,0,1,1,tensorop,f16,128,256,32,2,2,4,1,16,8,8,75,1024,1434451968,5566881595392,3880,76.2417,17.5224,73016.2
1,CUTLASS,gemm,cutlass_tensorop_h1688gemm_128x128_32x2_nn_align8,passed,success,universal,serial,8192,36864,9216,f16:column,f16:column,f16:column,1,0,1,1,tensorop,f16,128,128,32,2,2,2,1,16,8,8,75,1024,1434451968,5566881595392,3880,58.328,22.9039,95441
1,CUTLASS,gemm,cutlass_tensorop_h1688gemm_128x128_32x2_nn_align4,passed,success,universal,serial,8192,36864,9216,f16:column,f16:column,f16:column,1,0,1,1,tensorop,f16,128,128,32,2,2,2,1,16,8,8,75,1024,1434451968,5566881595392,3880,48.6109,27.4823,114519
1,CUTLASS,gemm,cutlass_tensorop_h1688gemm_128x128_32x2_nn_align2,passed,success,universal,serial,8192,36864,9216,f16:column,f16:column,f16:column,1,0,1,1,tensorop,f16,128,128,32,2,2,2,1,16,8,8,75,1024,1434451968,5566881595392,3880,62.0449,21.5318,89723.5
1,CUTLASS,gemm,cutlass_tensorop_h1688gemm_128x128_32x2_nn_align1,passed,success,universal,serial,8192,36864,9216,f16:column,f16:column,f16:column,1,0,1,1,tensorop,f16,128,128,32,2,2,2,1,16,8,8,75,1024,1434451968,5566881595392,3880,79.9734,16.7048,69609.2
1,CUTLASS,gemm,cutlass_tensorop_h1688gemm_64x256_32x2_nn_align8,passed,success,universal,serial,8192,36864,9216,f16:column,f16:column,f16:column,1,0,1,1,tensorop,f16,64,256,32,2,1,4,1,16,8,8,75,1024,1434451968,5566881595392,3880,57.0086,23.4339,97649.8
1,CUTLASS,gemm,cutlass_tensorop_h1688gemm_64x256_32x2_nn_align4,passed,success,universal,serial,8192,36864,9216,f16:column,f16:column,f16:column,1,0,1,1,tensorop,f16,64,256,32,2,1,4,1,16,8,8,75,1024,1434451968,5566881595392,3880,74.9059,17.8349,74318.3
1,CUTLASS,gemm,cutlass_tensorop_h1688gemm_64x256_32x2_nn_align2,passed,success,universal,serial,8192,36864,9216,f16:column,f16:column,f16:column,1,0,1,1,tensorop,f16,64,256,32,2,1,4,1,16,8,8,75,1024,1434451968,5566881595392,3880,59.2756,22.5377,93915.3
1,CUTLASS,gemm,cutlass_tensorop_h1688gemm_64x256_32x2_nn_align1,passed,success,universal,serial,8192,36864,9216,f16:column,f16:column,f16:column,1,0,1,1,tensorop,f16,64,256,32,2,1,4,1,16,8,8,75,1024,1434451968,5566881595392,3880,86.7526,15.3994,64169.6
1,CUTLASS,gemm,cutlass_tensorop_h1688gemm_256x64_32x2_nn_align8,passed,success,universal,serial,8192,36864,9216,f16:column,f16:column,f16:column,1,0,1,1,tensorop,f16,256,64,32,2,4,1,1,16,8,8,75,1024,1434451968,5566881595392,3880,61.3177,21.7871,90787.5
1,CUTLASS,gemm,cutlass_tensorop_h1688gemm_256x64_32x2_nn_align4,passed,success,universal,serial,8192,36864,9216,f16:column,f16:column,f16:column,1,0,1,1,tensorop,f16,256,64,32,2,4,1,1,16,8,8,75,1024,1434451968,5566881595392,3880,57.722,23.1444,96443.1
1,CUTLASS,gemm,cutlass_tensorop_h1688gemm_256x64_32x2_nn_align2,passed,success,universal,serial,8192,36864,9216,f16:column,f16:column,f16:column,1,0,1,1,tensorop,f16,256,64,32,2,4,1,1,16,8,8,75,1024,1434451968,5566881595392,3880,68.6395,19.4631,81103.1
1,CUTLASS,gemm,cutlass_tensorop_h1688gemm_256x64_32x2_nn_align1,passed,success,universal,serial,8192,36864,9216,f16:column,f16:column,f16:column,1,0,1,1,tensorop,f16,256,64,32,2,4,1,1,16,8,8,75,1024,1434451968,5566881595392,3880,110.406,12.1002,50421.9
1,CUTLASS,gemm,cutlass_tensorop_h1688gemm_64x128_32x2_nn_align8,passed,success,universal,serial,8192,36864,9216,f16:column,f16:column,f16:column,1,0,1,1,tensorop,f16,64,128,32,2,2,2,1,16,8,8,75,1024,1434451968,5566881595392,3880,70.4534,18.962,79015.1
1,CUTLASS,gemm,cutlass_tensorop_h1688gemm_64x128_32x2_nn_align4,passed,success,universal,serial,8192,36864,9216,f16:column,f16:column,f16:column,1,0,1,1,tensorop,f16,64,128,32,2,2,2,1,16,8,8,75,1024,1434451968,5566881595392,3880,73.0396,18.2906,76217.3
1,CUTLASS,gemm,cutlass_tensorop_h1688gemm_64x128_32x2_nn_align2,passed,success,universal,serial,8192,36864,9216,f16:column,f16:column,f16:column,1,0,1,1,tensorop,f16,64,128,32,2,2,2,1,16,8,8,75,1024,1434451968,5566881595392,3880,76.7314,17.4106,72550.3
1,CUTLASS,gemm,cutlass_tensorop_h1688gemm_64x128_32x2_nn_align1,passed,success,universal,serial,8192,36864,9216,f16:column,f16:column,f16:column,1,0,1,1,tensorop,f16,64,128,32,2,2,2,1,16,8,8,75,1024,1434451968,5566881595392,3880,106.29,12.5688,52374.3
1,CUTLASS,gemm,cutlass_tensorop_h1688gemm_128x64_32x2_nn_align8,passed,success,universal,serial,8192,36864,9216,f16:column,f16:column,f16:column,1,0,1,1,tensorop,f16,128,64,32,2,2,2,1,16,8,8,75,1024,1434451968,5566881595392,3880,66.3338,20.1396,83922.2
1,CUTLASS,gemm,cutlass_tensorop_h1688gemm_128x64_32x2_nn_align4,passed,success,universal,serial,8192,36864,9216,f16:column,f16:column,f16:column,1,0,1,1,tensorop,f16,128,64,32,2,2,2,1,16,8,8,75,1024,1434451968,5566881595392,3880,78.0277,17.1213,71345
1,CUTLASS,gemm,cutlass_tensorop_h1688gemm_128x64_32x2_nn_align2,passed,success,universal,serial,8192,36864,9216,f16:column,f16:column,f16:column,1,0,1,1,tensorop,f16,128,64,32,2,2,2,1,16,8,8,75,1024,1434451968,5566881595392,3880,82.6211,16.1694,67378.4
1,CUTLASS,gemm,cutlass_tensorop_h1688gemm_128x64_32x2_nn_align1,passed,success,universal,serial,8192,36864,9216,f16:column,f16:column,f16:column,1,0,1,1,tensorop,f16,128,64,32,2,2,2,1,16,8,8,75,1024,1434451968,5566881595392,3880,125.342,10.6583,44413.4
1,CUTLASS,gemm,cutlass_tensorop_h1688gemm_64x64_32x2_nn_align8,passed,success,universal,serial,8192,36864,9216,f16:column,f16:column,f16:column,1,0,1,1,tensorop,f16,64,64,32,2,2,2,1,16,8,8,75,1024,1434451968,5566881595392,3880,86.3709,15.4674,64453.2
1,CUTLASS,gemm,cutlass_tensorop_h1688gemm_64x64_32x2_nn_align4,passed,success,universal,serial,8192,36864,9216,f16:column,f16:column,f16:column,1,0,1,1,tensorop,f16,64,64,32,2,2,2,1,16,8,8,75,1024,1434451968,5566881595392,3880,90.049,14.8357,61820.6
1,CUTLASS,gemm,cutlass_tensorop_h1688gemm_64x64_32x2_nn_align2,passed,success,universal,serial,8192,36864,9216,f16:column,f16:column,f16:column,1,0,1,1,tensorop,f16,64,64,32,2,2,2,1,16,8,8,75,1024,1434451968,5566881595392,3880,98.6325,13.5446,56440.6
1,CUTLASS,gemm,cutlass_tensorop_h1688gemm_64x64_32x2_nn_align1,passed,success,universal,serial,8192,36864,9216,f16:column,f16:column,f16:column,1,0,1,1,tensorop,f16,64,64,32,2,2,2,1,16,8,8,75,1024,1434451968,5566881595392,3880,153.996,8.67512,36149.4
1,CUTLASS,gemm,cutlass_tensorop_h1688gemm_64x128_64x2_nn_align8,passed,success,universal,serial,8192,36864,9216,f16:column,f16:column,f16:column,1,0,1,1,tensorop,f16,64,128,64,2,1,2,2,16,8,8,75,1024,1434451968,5566881595392,3880,67.1628,19.891,82886.3
1,CUTLASS,gemm,cutlass_tensorop_h1688gemm_64x128_64x2_nn_align4,passed,success,universal,serial,8192,36864,9216,f16:column,f16:column,f16:column,1,0,1,1,tensorop,f16,64,128,64,2,1,2,2,16,8,8,75,1024,1434451968,5566881595392,3880,68.1956,19.5898,81631.1
1,CUTLASS,gemm,cutlass_tensorop_h1688gemm_64x128_64x2_nn_align2,passed,success,universal,serial,8192,36864,9216,f16:column,f16:column,f16:column,1,0,1,1,tensorop,f16,64,128,64,2,1,2,2,16,8,8,75,1024,1434451968,5566881595392,3880,70.8375,18.8592,78586.7
1,CUTLASS,gemm,cutlass_tensorop_h1688gemm_64x128_64x2_nn_align1,passed,success,universal,serial,8192,36864,9216,f16:column,f16:column,f16:column,1,0,1,1,tensorop,f16,64,128,64,2,1,2,2,16,8,8,75,1024,1434451968,5566881595392,3880,83.4083,16.0168,66742.6
1,CUTLASS,gemm,cutlass_tensorop_h1688gemm_256x128_32x2_nt_align8,passed,success,universal,serial,8192,36864,9216,f16:column,f16:row,f16:column,1,0,1,1,tensorop,f16,256,128,32,2,4,2,1,16,8,8,75,1024,1434451968,5566881595392,3880,42.1286,31.7109,132140
1,CUTLASS,gemm,cutlass_tensorop_h1688gemm_256x128_32x2_nt_align4,passed,success,universal,serial,8192,36864,9216,f16:column,f16:row,f16:column,1,0,1,1,tensorop,f16,256,128,32,2,4,2,1,16,8,8,75,1024,1434451968,5566881595392,3880,47.7189,27.996,116660
1,CUTLASS,gemm,cutlass_tensorop_h1688gemm_256x128_32x2_nt_align2,passed,success,universal,serial,8192,36864,9216,f16:column,f16:row,f16:column,1,0,1,1,tensorop,f16,256,128,32,2,4,2,1,16,8,8,75,1024,1434451968,5566881595392,3880,55.346,24.1379,100583
1,CUTLASS,gemm,cutlass_tensorop_h1688gemm_256x128_32x2_nt_align1,passed,success,universal,serial,8192,36864,9216,f16:column,f16:row,f16:column,1,0,1,1,tensorop,f16,256,128,32,2,4,2,1,16,8,8,75,1024,1434451968,5566881595392,3880,62.8493,21.2562,88575
1,CUTLASS,gemm,cutlass_tensorop_h1688gemm_128x256_32x2_nt_align8,passed,success,universal,serial,8192,36864,9216,f16:column,f16:row,f16:column,1,0,1,1,tensorop,f16,128,256,32,2,2,4,1,16,8,8,75,1024,1434451968,5566881595392,3880,42.3508,31.5446,131447
1,CUTLASS,gemm,cutlass_tensorop_h1688gemm_128x256_32x2_nt_align4,passed,success,universal,serial,8192,36864,9216,f16:column,f16:row,f16:column,1,0,1,1,tensorop,f16,128,256,32,2,2,4,1,16,8,8,75,1024,1434451968,5566881595392,3880,46.0115,29.0349,120989
1,CUTLASS,gemm,cutlass_tensorop_h1688gemm_128x256_32x2_nt_align2,passed,success,universal,serial,8192,36864,9216,f16:column,f16:row,f16:column,1,0,1,1,tensorop,f16,128,256,32,2,2,4,1,16,8,8,75,1024,1434451968,5566881595392,3880,54.9071,24.3309,101387
1,CUTLASS,gemm,cutlass_tensorop_h1688gemm_128x256_32x2_nt_align1,passed,success,universal,serial,8192,36864,9216,f16:column,f16:row,f16:column,1,0,1,1,tensorop,f16,128,256,32,2,2,4,1,16,8,8,75,1024,1434451968,5566881595392,3880,61.8834,21.588,89957.6
1,CUTLASS,gemm,cutlass_tensorop_h1688gemm_128x128_32x2_nt_align8,passed,success,universal,serial,8192,36864,9216,f16:column,f16:row,f16:column,1,0,1,1,tensorop,f16,128,128,32,2,2,2,1,16,8,8,75,1024,1434451968,5566881595392,3880,49.3785,27.055,112739
1,CUTLASS,gemm,cutlass_tensorop_h1688gemm_128x128_32x2_nt_align4,passed,success,universal,serial,8192,36864,9216,f16:column,f16:row,f16:column,1,0,1,1,tensorop,f16,128,128,32,2,2,2,1,16,8,8,75,1024,1434451968,5566881595392,3880,54.6468,24.4468,101870
1,CUTLASS,gemm,cutlass_tensorop_h1688gemm_128x128_32x2_nt_align2,passed,success,universal,serial,8192,36864,9216,f16:column,f16:row,f16:column,1,0,1,1,tensorop,f16,128,128,32,2,2,2,1,16,8,8,75,1024,1434451968,5566881595392,3880,55.4188,24.1062,100451
1,CUTLASS,gemm,cutlass_tensorop_h1688gemm_128x128_32x2_nt_align1,passed,success,universal,serial,8192,36864,9216,f16:column,f16:row,f16:column,1,0,1,1,tensorop,f16,128,128,32,2,2,2,1,16,8,8,75,1024,1434451968,5566881595392,3880,68.0273,19.6383,81833.1
1,CUTLASS,gemm,cutlass_tensorop_h1688gemm_64x256_32x2_nt_align8,passed,success,universal,serial,8192,36864,9216,f16:column,f16:row,f16:column,1,0,1,1,tensorop,f16,64,256,32,2,1,4,1,16,8,8,75,1024,1434451968,5566881595392,3880,57.0909,23.4002,97509.1
1,CUTLASS,gemm,cutlass_tensorop_h1688gemm_64x256_32x2_nt_align4,passed,success,universal,serial,8192,36864,9216,f16:column,f16:row,f16:column,1,0,1,1,tensorop,f16,64,256,32,2,1,4,1,16,8,8,75,1024,1434451968,5566881595392,3880,82.1324,16.2657,67779.4
1,CUTLASS,gemm,cutlass_tensorop_h1688gemm_64x256_32x2_nt_align2,passed,success,universal,serial,8192,36864,9216,f16:column,f16:row,f16:column,1,0,1,1,tensorop,f16,64,256,32,2,1,4,1,16,8,8,75,1024,1434451968,5566881595392,3880,59.0726,22.6152,94237.9
1,CUTLASS,gemm,cutlass_tensorop_h1688gemm_64x256_32x2_nt_align1,passed,success,universal,serial,8192,36864,9216,f16:column,f16:row,f16:column,1,0,1,1,tensorop,f16,64,256,32,2,1,4,1,16,8,8,75,1024,1434451968,5566881595392,3880,77.7365,17.1854,71612.2
1,CUTLASS,gemm,cutlass_tensorop_h1688gemm_256x64_32x2_nt_align8,passed,success,universal,serial,8192,36864,9216,f16:column,f16:row,f16:column,1,0,1,1,tensorop,f16,256,64,32,2,4,1,1,16,8,8,75,1024,1434451968,5566881595392,3880,57.215,23.3494,97297.6
1,CUTLASS,gemm,cutlass_tensorop_h1688gemm_256x64_32x2_nt_align4,passed,success,universal,serial,8192,36864,9216,f16:column,f16:row,f16:column,1,0,1,1,tensorop,f16,256,64,32,2,4,1,1,16,8,8,75,1024,1434451968,5566881595392,3880,60.2789,22.1626,92352.1
1,CUTLASS,gemm,cutlass_tensorop_h1688gemm_256x64_32x2_nt_align2,passed,success,universal,serial,8192,36864,9216,f16:column,f16:row,f16:column,1,0,1,1,tensorop,f16,256,64,32,2,4,1,1,16,8,8,75,1024,1434451968,5566881595392,3880,62.0822,21.5189,89669.6
1,CUTLASS,gemm,cutlass_tensorop_h1688gemm_256x64_32x2_nt_align1,passed,success,universal,serial,8192,36864,9216,f16:column,f16:row,f16:column,1,0,1,1,tensorop,f16,256,64,32,2,4,1,1,16,8,8,75,1024,1434451968,5566881595392,3880,81.0349,16.486,68697.4
1,CUTLASS,gemm,cutlass_tensorop_h1688gemm_64x128_32x2_nt_align8,passed,success,universal,serial,8192,36864,9216,f16:column,f16:row,f16:column,1,0,1,1,tensorop,f16,64,128,32,2,2,2,1,16,8,8,75,1024,1434451968,5566881595392,3880,66.9939,19.9412,83095.4
1,CUTLASS,gemm,cutlass_tensorop_h1688gemm_64x128_32x2_nt_align4,passed,success,universal,serial,8192,36864,9216,f16:column,f16:row,f16:column,1,0,1,1,tensorop,f16,64,128,32,2,2,2,1,16,8,8,75,1024,1434451968,5566881595392,3880,68.7357,19.4359,80989.7
1,CUTLASS,gemm,cutlass_tensorop_h1688gemm_64x128_32x2_nt_align2,passed,success,universal,serial,8192,36864,9216,f16:column,f16:row,f16:column,1,0,1,1,tensorop,f16,64,128,32,2,2,2,1,16,8,8,75,1024,1434451968,5566881595392,3880,70.7775,18.8752,78653.3
1,CUTLASS,gemm,cutlass_tensorop_h1688gemm_64x128_32x2_nt_align1,passed,success,universal,serial,8192,36864,9216,f16:column,f16:row,f16:column,1,0,1,1,tensorop,f16,64,128,32,2,2,2,1,16,8,8,75,1024,1434451968,5566881595392,3880,94.4673,14.1418,58929.2
1,CUTLASS,gemm,cutlass_tensorop_h1688gemm_128x64_32x2_nt_align8,passed,success,universal,serial,8192,36864,9216,f16:column,f16:row,f16:column,1,0,1,1,tensorop,f16,128,64,32,2,2,2,1,16,8,8,75,1024,1434451968,5566881595392,3880,67.3867,19.825,82611
1,CUTLASS,gemm,cutlass_tensorop_h1688gemm_128x64_32x2_nt_align4,passed,success,universal,serial,8192,36864,9216,f16:column,f16:row,f16:column,1,0,1,1,tensorop,f16,128,64,32,2,2,2,1,16,8,8,75,1024,1434451968,5566881595392,3880,68.0161,19.6415,81846.5
1,CUTLASS,gemm,cutlass_tensorop_h1688gemm_128x64_32x2_nt_align2,passed,success,universal,serial,8192,36864,9216,f16:column,f16:row,f16:column,1,0,1,1,tensorop,f16,128,64,32,2,2,2,1,16,8,8,75,1024,1434451968,5566881595392,3880,71.2792,18.7423,78099.7
1,CUTLASS,gemm,cutlass_tensorop_h1688gemm_128x64_32x2_nt_align1,passed,success,universal,serial,8192,36864,9216,f16:column,f16:row,f16:column,1,0,1,1,tensorop,f16,128,64,32,2,2,2,1,16,8,8,75,1024,1434451968,5566881595392,3880,92.0575,14.512,60471.8
1,CUTLASS,gemm,cutlass_tensorop_h1688gemm_64x64_32x2_nt_align8,passed,success,universal,serial,8192,36864,9216,f16:column,f16:row,f16:column,1,0,1,1,tensorop,f16,64,64,32,2,2,2,1,16,8,8,75,1024,1434451968,5566881595392,3880,85.952,15.5428,64767.3
1,CUTLASS,gemm,cutlass_tensorop_h1688gemm_64x64_32x2_nt_align4,passed,success,universal,serial,8192,36864,9216,f16:column,f16:row,f16:column,1,0,1,1,tensorop,f16,64,64,32,2,2,2,1,16,8,8,75,1024,1434451968,5566881595392,3880,86.9013,15.373,64059.8
1,CUTLASS,gemm,cutlass_tensorop_h1688gemm_64x64_32x2_nt_align2,passed,success,universal,serial,8192,36864,9216,f16:column,f16:row,f16:column,1,0,1,1,tensorop,f16,64,64,32,2,2,2,1,16,8,8,75,1024,1434451968,5566881595392,3880,88.9363,15.0213,62594
1,CUTLASS,gemm,cutlass_tensorop_h1688gemm_64x64_32x2_nt_align1,passed,success,universal,serial,8192,36864,9216,f16:column,f16:row,f16:column,1,0,1,1,tensorop,f16,64,64,32,2,2,2,1,16,8,8,75,1024,1434451968,5566881595392,3880,119.024,11.2241,46771.2
1,CUTLASS,gemm,cutlass_tensorop_h1688gemm_64x128_64x2_nt_align8,passed,success,universal,serial,8192,36864,9216,f16:column,f16:row,f16:column,1,0,1,1,tensorop,f16,64,128,64,2,1,2,2,16,8,8,75,1024,1434451968,5566881595392,3880,67.0129,19.9355,83071.8
1,CUTLASS,gemm,cutlass_tensorop_h1688gemm_64x128_64x2_nt_align4,passed,success,universal,serial,8192,36864,9216,f16:column,f16:row,f16:column,1,0,1,1,tensorop,f16,64,128,64,2,1,2,2,16,8,8,75,1024,1434451968,5566881595392,3880,68.4143,19.5272,81370.2
1,CUTLASS,gemm,cutlass_tensorop_h1688gemm_64x128_64x2_nt_align2,passed,success,universal,serial,8192,36864,9216,f16:column,f16:row,f16:column,1,0,1,1,tensorop,f16,64,128,64,2,1,2,2,16,8,8,75,1024,1434451968,5566881595392,3880,70.4203,18.9709,79052.3
1,CUTLASS,gemm,cutlass_tensorop_h1688gemm_64x128_64x2_nt_align1,passed,success,universal,serial,8192,36864,9216,f16:column,f16:row,f16:column,1,0,1,1,tensorop,f16,64,128,64,2,1,2,2,16,8,8,75,1024,1434451968,5566881595392,3880,83.3202,16.0338,66813.1
1,CUTLASS,gemm,cutlass_tensorop_h1688gemm_256x128_32x2_tn_align8,passed,success,universal,serial,8192,36864,9216,f16:row,f16:column,f16:column,1,0,1,1,tensorop,f16,256,128,32,2,4,2,1,16,8,8,75,1024,1434451968,5566881595392,3880,43.6007,30.6403,127679
1,CUTLASS,gemm,cutlass_tensorop_h1688gemm_256x128_32x2_tn_align4,passed,success,universal,serial,8192,36864,9216,f16:row,f16:column,f16:column,1,0,1,1,tensorop,f16,256,128,32,2,4,2,1,16,8,8,75,1024,1434451968,5566881595392,3880,50.691,26.3545,109820
1,CUTLASS,gemm,cutlass_tensorop_h1688gemm_256x128_32x2_tn_align2,passed,success,universal,serial,8192,36864,9216,f16:row,f16:column,f16:column,1,0,1,1,tensorop,f16,256,128,32,2,4,2,1,16,8,8,75,1024,1434451968,5566881595392,3880,56.1459,23.794,99150.2
1,CUTLASS,gemm,cutlass_tensorop_h1688gemm_256x128_32x2_tn_align1,passed,success,universal,serial,8192,36864,9216,f16:row,f16:column,f16:column,1,0,1,1,tensorop,f16,256,128,32,2,4,2,1,16,8,8,75,1024,1434451968,5566881595392,3880,90.0592,14.834,61813.6
1,CUTLASS,gemm,cutlass_tensorop_h1688gemm_128x256_32x2_tn_align8,passed,success,universal,serial,8192,36864,9216,f16:row,f16:column,f16:column,1,0,1,1,tensorop,f16,128,256,32,2,2,4,1,16,8,8,75,1024,1434451968,5566881595392,3880,44.2003,30.2246,125947
1,CUTLASS,gemm,cutlass_tensorop_h1688gemm_128x256_32x2_tn_align4,passed,success,universal,serial,8192,36864,9216,f16:row,f16:column,f16:column,1,0,1,1,tensorop,f16,128,256,32,2,2,4,1,16,8,8,75,1024,1434451968,5566881595392,3880,51.7489,25.8158,107575
1,CUTLASS,gemm,cutlass_tensorop_h1688gemm_128x256_32x2_tn_align2,passed,success,universal,serial,8192,36864,9216,f16:row,f16:column,f16:column,1,0,1,1,tensorop,f16,128,256,32,2,2,4,1,16,8,8,75,1024,1434451968,5566881595392,3880,57.5506,23.2133,96730.1
1,CUTLASS,gemm,cutlass_tensorop_h1688gemm_128x256_32x2_tn_align1,passed,success,universal,serial,8192,36864,9216,f16:row,f16:column,f16:column,1,0,1,1,tensorop,f16,128,256,32,2,2,4,1,16,8,8,75,1024,1434451968,5566881595392,3880,89.6146,14.9076,62120.2
1,CUTLASS,gemm,cutlass_tensorop_h1688gemm_128x128_32x2_tn_align8,passed,success,universal,serial,8192,36864,9216,f16:row,f16:column,f16:column,1,0,1,1,tensorop,f16,128,128,32,2,2,2,1,16,8,8,75,1024,1434451968,5566881595392,3880,105.468,12.6668,52782.8
1,CUTLASS,gemm,cutlass_tensorop_h1688gemm_128x128_32x2_tn_align4,passed,success,universal,serial,8192,36864,9216,f16:row,f16:column,f16:column,1,0,1,1,tensorop,f16,128,128,32,2,2,2,1,16,8,8,75,1024,1434451968,5566881595392,3880,62.4906,21.3782,89083.5
1,CUTLASS,gemm,cutlass_tensorop_h1688gemm_128x128_32x2_tn_align2,passed,success,universal,serial,8192,36864,9216,f16:row,f16:column,f16:column,1,0,1,1,tensorop,f16,128,128,32,2,2,2,1,16,8,8,75,1024,1434451968,5566881595392,3880,93.0181,14.3621,59847.3
1,CUTLASS,gemm,cutlass_tensorop_h1688gemm_128x128_32x2_tn_align1,passed,success,universal,serial,8192,36864,9216,f16:row,f16:column,f16:column,1,0,1,1,tensorop,f16,128,128,32,2,2,2,1,16,8,8,75,1024,1434451968,5566881595392,3880,101.954,13.1034,54602
1,CUTLASS,gemm,cutlass_tensorop_h1688gemm_64x256_32x2_tn_align8,passed,success,universal,serial,8192,36864,9216,f16:row,f16:column,f16:column,1,0,1,1,tensorop,f16,64,256,32,2,1,4,1,16,8,8,75,1024,1434451968,5566881595392,3880,146.032,9.14824,38120.9
1,CUTLASS,gemm,cutlass_tensorop_h1688gemm_64x256_32x2_tn_align4,passed,success,universal,serial,8192,36864,9216,f16:row,f16:column,f16:column,1,0,1,1,tensorop,f16,64,256,32,2,1,4,1,16,8,8,75,1024,1434451968,5566881595392,3880,60.8703,21.9473,91454.7
1,CUTLASS,gemm,cutlass_tensorop_h1688gemm_64x256_32x2_tn_align2,passed,success,universal,serial,8192,36864,9216,f16:row,f16:column,f16:column,1,0,1,1,tensorop,f16,64,256,32,2,1,4,1,16,8,8,75,1024,1434451968,5566881595392,3880,99.8771,13.3758,55737.3
1,CUTLASS,gemm,cutlass_tensorop_h1688gemm_64x256_32x2_tn_align1,passed,success,universal,serial,8192,36864,9216,f16:row,f16:column,f16:column,1,0,1,1,tensorop,f16,64,256,32,2,1,4,1,16,8,8,75,1024,1434451968,5566881595392,3880,153.897,8.68074,36172.8
1,CUTLASS,gemm,cutlass_tensorop_h1688gemm_256x64_32x2_tn_align8,passed,success,universal,serial,8192,36864,9216,f16:row,f16:column,f16:column,1,0,1,1,tensorop,f16,256,64,32,2,4,1,1,16,8,8,75,1024,1434451968,5566881595392,3880,71.012,18.8129,78393.6
1,CUTLASS,gemm,cutlass_tensorop_h1688gemm_256x64_32x2_tn_align4,passed,success,universal,serial,8192,36864,9216,f16:row,f16:column,f16:column,1,0,1,1,tensorop,f16,256,64,32,2,4,1,1,16,8,8,75,1024,1434451968,5566881595392,3880,57.7418,23.1364,96409.9
1,CUTLASS,gemm,cutlass_tensorop_h1688gemm_256x64_32x2_tn_align2,passed,success,universal,serial,8192,36864,9216,f16:row,f16:column,f16:column,1,0,1,1,tensorop,f16,256,64,32,2,4,1,1,16,8,8,75,1024,1434451968,5566881595392,3880,75.7897,17.6269,73451.7
1,CUTLASS,gemm,cutlass_tensorop_h1688gemm_256x64_32x2_tn_align1,passed,success,universal,serial,8192,36864,9216,f16:row,f16:column,f16:column,1,0,1,1,tensorop,f16,256,64,32,2,4,1,1,16,8,8,75,1024,1434451968,5566881595392,3880,115.471,11.5695,48210.3
1,CUTLASS,gemm,cutlass_tensorop_h1688gemm_64x128_32x2_tn_align8,passed,success,universal,serial,8192,36864,9216,f16:row,f16:column,f16:column,1,0,1,1,tensorop,f16,64,128,32,2,2,2,1,16,8,8,75,1024,1434451968,5566881595392,3880,162.183,8.23721,34324.6
1,CUTLASS,gemm,cutlass_tensorop_h1688gemm_64x128_32x2_tn_align4,passed,success,universal,serial,8192,36864,9216,f16:row,f16:column,f16:column,1,0,1,1,tensorop,f16,64,128,32,2,2,2,1,16,8,8,75,1024,1434451968,5566881595392,3880,148.249,9.01144,37550.9
1,CUTLASS,gemm,cutlass_tensorop_h1688gemm_64x128_32x2_tn_align2,passed,success,universal,serial,8192,36864,9216,f16:row,f16:column,f16:column,1,0,1,1,tensorop,f16,64,128,32,2,2,2,1,16,8,8,75,1024,1434451968,5566881595392,3880,91.9844,14.5235,60519.9
1,CUTLASS,gemm,cutlass_tensorop_h1688gemm_64x128_32x2_tn_align1,passed,success,universal,serial,8192,36864,9216,f16:row,f16:column,f16:column,1,0,1,1,tensorop,f16,64,128,32,2,2,2,1,16,8,8,75,1024,1434451968,5566881595392,3880,149.876,8.91359,37143.1
1,CUTLASS,gemm,cutlass_tensorop_h1688gemm_128x64_32x2_tn_align8,passed,success,universal,serial,8192,36864,9216,f16:row,f16:column,f16:column,1,0,1,1,tensorop,f16,128,64,32,2,2,2,1,16,8,8,75,1024,1434451968,5566881595392,3880,141.645,9.43159,39301.6
1,CUTLASS,gemm,cutlass_tensorop_h1688gemm_128x64_32x2_tn_align4,passed,success,universal,serial,8192,36864,9216,f16:row,f16:column,f16:column,1,0,1,1,tensorop,f16,128,64,32,2,2,2,1,16,8,8,75,1024,1434451968,5566881595392,3880,129.079,10.3498,43127.7
1,CUTLASS,gemm,cutlass_tensorop_h1688gemm_128x64_32x2_tn_align2,passed,success,universal,serial,8192,36864,9216,f16:row,f16:column,f16:column,1,0,1,1,tensorop,f16,128,64,32,2,2,2,1,16,8,8,75,1024,1434451968,5566881595392,3880,98.1634,13.6093,56710.4
1,CUTLASS,gemm,cutlass_tensorop_h1688gemm_128x64_32x2_tn_align1,passed,success,universal,serial,8192,36864,9216,f16:row,f16:column,f16:column,1,0,1,1,tensorop,f16,128,64,32,2,2,2,1,16,8,8,75,1024,1434451968,5566881595392,3880,139.14,9.6014,40009.2
1,CUTLASS,gemm,cutlass_tensorop_h1688gemm_64x64_32x2_tn_align8,passed,success,universal,serial,8192,36864,9216,f16:row,f16:column,f16:column,1,0,1,1,tensorop,f16,64,64,32,2,2,2,1,16,8,8,75,1024,1434451968,5566881595392,3880,151.653,8.80915,36707.9
1,CUTLASS,gemm,cutlass_tensorop_h1688gemm_64x64_32x2_tn_align4,passed,success,universal,serial,8192,36864,9216,f16:row,f16:column,f16:column,1,0,1,1,tensorop,f16,64,64,32,2,2,2,1,16,8,8,75,1024,1434451968,5566881595392,3880,144.917,9.21867,38414.4
1,CUTLASS,gemm,cutlass_tensorop_h1688gemm_64x64_32x2_tn_align2,passed,success,universal,serial,8192,36864,9216,f16:row,f16:column,f16:column,1,0,1,1,tensorop,f16,64,64,32,2,2,2,1,16,8,8,75,1024,1434451968,5566881595392,3880,115.438,11.5727,48223.8
1,CUTLASS,gemm,cutlass_tensorop_h1688gemm_64x64_32x2_tn_align1,passed,success,universal,serial,8192,36864,9216,f16:row,f16:column,f16:column,1,0,1,1,tensorop,f16,64,64,32,2,2,2,1,16,8,8,75,1024,1434451968,5566881595392,3880,195.66,6.82783,28451.7
1,CUTLASS,gemm,cutlass_tensorop_h1688gemm_64x128_64x2_tn_align8,passed,success,universal,serial,8192,36864,9216,f16:row,f16:column,f16:column,1,0,1,1,tensorop,f16,64,128,64,2,1,2,2,16,8,8,75,1024,1434451968,5566881595392,3880,68.6406,19.4628,81101.9
1,CUTLASS,gemm,cutlass_tensorop_h1688gemm_64x128_64x2_tn_align4,passed,success,universal,serial,8192,36864,9216,f16:row,f16:column,f16:column,1,0,1,1,tensorop,f16,64,128,64,2,1,2,2,16,8,8,75,1024,1434451968,5566881595392,3880,71.7017,18.6319,77639.5
1,CUTLASS,gemm,cutlass_tensorop_h1688gemm_64x128_64x2_tn_align2,passed,success,universal,serial,8192,36864,9216,f16:row,f16:column,f16:column,1,0,1,1,tensorop,f16,64,128,64,2,1,2,2,16,8,8,75,1024,1434451968,5566881595392,3880,74.1421,18.0186,75083.9
1,CUTLASS,gemm,cutlass_tensorop_h1688gemm_64x128_64x2_tn_align1,passed,success,universal,serial,8192,36864,9216,f16:row,f16:column,f16:column,1,0,1,1,tensorop,f16,64,128,64,2,1,2,2,16,8,8,75,1024,1434451968,5566881595392,3880,87.8915,15.1999,63338.1
1,CUTLASS,gemm,cutlass_tensorop_h1688gemm_256x128_32x2_tt_align8,passed,success,universal,serial,8192,36864,9216,f16:row,f16:row,f16:column,1,0,1,1,tensorop,f16,256,128,32,2,4,2,1,16,8,8,75,1024,1434451968,5566881595392,3880,46.3928,28.7962,119994
1,CUTLASS,gemm,cutlass_tensorop_h1688gemm_256x128_32x2_tt_align4,passed,success,universal,serial,8192,36864,9216,f16:row,f16:row,f16:column,1,0,1,1,tensorop,f16,256,128,32,2,4,2,1,16,8,8,75,1024,1434451968,5566881595392,3880,46.4252,28.7761,119911
1,CUTLASS,gemm,cutlass_tensorop_h1688gemm_256x128_32x2_tt_align2,passed,success,universal,serial,8192,36864,9216,f16:row,f16:row,f16:column,1,0,1,1,tensorop,f16,256,128,32,2,4,2,1,16,8,8,75,1024,1434451968,5566881595392,3880,56.3731,23.6981,98750.6
1,CUTLASS,gemm,cutlass_tensorop_h1688gemm_256x128_32x2_tt_align1,passed,success,universal,serial,8192,36864,9216,f16:row,f16:row,f16:column,1,0,1,1,tensorop,f16,256,128,32,2,4,2,1,16,8,8,75,1024,1434451968,5566881595392,3880,74.9137,17.833,74310.6
1,CUTLASS,gemm,cutlass_tensorop_h1688gemm_128x256_32x2_tt_align8,passed,success,universal,serial,8192,36864,9216,f16:row,f16:row,f16:column,1,0,1,1,tensorop,f16,128,256,32,2,2,4,1,16,8,8,75,1024,1434451968,5566881595392,3880,44.2892,30.1639,125694
1,CUTLASS,gemm,cutlass_tensorop_h1688gemm_128x256_32x2_tt_align4,passed,success,universal,serial,8192,36864,9216,f16:row,f16:row,f16:column,1,0,1,1,tensorop,f16,128,256,32,2,2,4,1,16,8,8,75,1024,1434451968,5566881595392,3880,54.335,24.5871,102455
1,CUTLASS,gemm,cutlass_tensorop_h1688gemm_128x256_32x2_tt_align2,passed,success,universal,serial,8192,36864,9216,f16:row,f16:row,f16:column,1,0,1,1,tensorop,f16,128,256,32,2,2,4,1,16,8,8,75,1024,1434451968,5566881595392,3880,61.1014,21.8643,91108.9
1,CUTLASS,gemm,cutlass_tensorop_h1688gemm_128x256_32x2_tt_align1,passed,success,universal,serial,8192,36864,9216,f16:row,f16:row,f16:column,1,0,1,1,tensorop,f16,128,256,32,2,2,4,1,16,8,8,75,1024,1434451968,5566881595392,3880,81.9239,16.3071,67951.9
1,CUTLASS,gemm,cutlass_tensorop_h1688gemm_128x128_32x2_tt_align8,passed,success,universal,serial,8192,36864,9216,f16:row,f16:row,f16:column,1,0,1,1,tensorop,f16,128,128,32,2,2,2,1,16,8,8,75,1024,1434451968,5566881595392,3880,78.5778,17.0015,70845.5
1,CUTLASS,gemm,cutlass_tensorop_h1688gemm_128x128_32x2_tt_align4,passed,success,universal,serial,8192,36864,9216,f16:row,f16:row,f16:column,1,0,1,1,tensorop,f16,128,128,32,2,2,2,1,16,8,8,75,1024,1434451968,5566881595392,3880,55.0788,24.255,101071
1,CUTLASS,gemm,cutlass_tensorop_h1688gemm_128x128_32x2_tt_align2,passed,success,universal,serial,8192,36864,9216,f16:row,f16:row,f16:column,1,0,1,1,tensorop,f16,128,128,32,2,2,2,1,16,8,8,75,1024,1434451968,5566881595392,3880,59.8353,22.3269,93036.8
1,CUTLASS,gemm,cutlass_tensorop_h1688gemm_128x128_32x2_tt_align1,passed,success,universal,serial,8192,36864,9216,f16:row,f16:row,f16:column,1,0,1,1,tensorop,f16,128,128,32,2,2,2,1,16,8,8,75,1024,1434451968,5566881595392,3880,80.4577,16.6042,69190.1
1,CUTLASS,gemm,cutlass_tensorop_h1688gemm_64x256_32x2_tt_align8,passed,success,universal,serial,8192,36864,9216,f16:row,f16:row,f16:column,1,0,1,1,tensorop,f16,64,256,32,2,1,4,1,16,8,8,75,1024,1434451968,5566881595392,3880,79.38,16.8297,70129.6
1,CUTLASS,gemm,cutlass_tensorop_h1688gemm_64x256_32x2_tt_align4,passed,success,universal,serial,8192,36864,9216,f16:row,f16:row,f16:column,1,0,1,1,tensorop,f16,64,256,32,2,1,4,1,16,8,8,75,1024,1434451968,5566881595392,3880,55.8167,23.9344,99735.1
1,CUTLASS,gemm,cutlass_tensorop_h1688gemm_64x256_32x2_tt_align2,passed,success,universal,serial,8192,36864,9216,f16:row,f16:row,f16:column,1,0,1,1,tensorop,f16,64,256,32,2,1,4,1,16,8,8,75,1024,1434451968,5566881595392,3880,75.8485,17.6132,73394.8
1,CUTLASS,gemm,cutlass_tensorop_h1688gemm_64x256_32x2_tt_align1,passed,success,universal,serial,8192,36864,9216,f16:row,f16:row,f16:column,1,0,1,1,tensorop,f16,64,256,32,2,1,4,1,16,8,8,75,1024,1434451968,5566881595392,3880,105.189,12.7004,52922.8
1,CUTLASS,gemm,cutlass_tensorop_h1688gemm_256x64_32x2_tt_align8,passed,success,universal,serial,8192,36864,9216,f16:row,f16:row,f16:column,1,0,1,1,tensorop,f16,256,64,32,2,4,1,1,16,8,8,75,1024,1434451968,5566881595392,3880,56.4829,23.6521,98558.7
1,CUTLASS,gemm,cutlass_tensorop_h1688gemm_256x64_32x2_tt_align4,passed,success,universal,serial,8192,36864,9216,f16:row,f16:row,f16:column,1,0,1,1,tensorop,f16,256,64,32,2,4,1,1,16,8,8,75,1024,1434451968,5566881595392,3880,61.7728,21.6266,90118.7
1,CUTLASS,gemm,cutlass_tensorop_h1688gemm_256x64_32x2_tt_align2,passed,success,universal,serial,8192,36864,9216,f16:row,f16:row,f16:column,1,0,1,1,tensorop,f16,256,64,32,2,4,1,1,16,8,8,75,1024,1434451968,5566881595392,3880,63.1818,21.1443,88108.9
1,CUTLASS,gemm,cutlass_tensorop_h1688gemm_256x64_32x2_tt_align1,passed,success,universal,serial,8192,36864,9216,f16:row,f16:row,f16:column,1,0,1,1,tensorop,f16,256,64,32,2,4,1,1,16,8,8,75,1024,1434451968,5566881595392,3880,86.0893,15.518,64664
1,CUTLASS,gemm,cutlass_tensorop_h1688gemm_64x128_32x2_tt_align8,passed,success,universal,serial,8192,36864,9216,f16:row,f16:row,f16:column,1,0,1,1,tensorop,f16,64,128,32,2,2,2,1,16,8,8,75,1024,1434451968,5566881595392,3880,127.399,10.4863,43696.5
1,CUTLASS,gemm,cutlass_tensorop_h1688gemm_64x128_32x2_tt_align4,passed,success,universal,serial,8192,36864,9216,f16:row,f16:row,f16:column,1,0,1,1,tensorop,f16,64,128,32,2,2,2,1,16,8,8,75,1024,1434451968,5566881595392,3880,111.334,11.9993,50001.5
1,CUTLASS,gemm,cutlass_tensorop_h1688gemm_64x128_32x2_tt_align2,passed,success,universal,serial,8192,36864,9216,f16:row,f16:row,f16:column,1,0,1,1,tensorop,f16,64,128,32,2,2,2,1,16,8,8,75,1024,1434451968,5566881595392,3880,77.8213,17.1667,71534.1
1,CUTLASS,gemm,cutlass_tensorop_h1688gemm_64x128_32x2_tt_align1,passed,success,universal,serial,8192,36864,9216,f16:row,f16:row,f16:column,1,0,1,1,tensorop,f16,64,128,32,2,2,2,1,16,8,8,75,1024,1434451968,5566881595392,3880,131.805,10.1357,42235.7
1,CUTLASS,gemm,cutlass_tensorop_h1688gemm_128x64_32x2_tt_align8,passed,success,universal,serial,8192,36864,9216,f16:row,f16:row,f16:column,1,0,1,1,tensorop,f16,128,64,32,2,2,2,1,16,8,8,75,1024,1434451968,5566881595392,3880,68.1455,19.6042,81691.2
1,CUTLASS,gemm,cutlass_tensorop_h1688gemm_128x64_32x2_tt_align4,passed,success,universal,serial,8192,36864,9216,f16:row,f16:row,f16:column,1,0,1,1,tensorop,f16,128,64,32,2,2,2,1,16,8,8,75,1024,1434451968,5566881595392,3880,77.3082,17.2807,72008.9
1,CUTLASS,gemm,cutlass_tensorop_h1688gemm_128x64_32x2_tt_align2,passed,success,universal,serial,8192,36864,9216,f16:row,f16:row,f16:column,1,0,1,1,tensorop,f16,128,64,32,2,2,2,1,16,8,8,75,1024,1434451968,5566881595392,3880,77.7677,17.1786,71583.5
1,CUTLASS,gemm,cutlass_tensorop_h1688gemm_128x64_32x2_tt_align1,passed,success,universal,serial,8192,36864,9216,f16:row,f16:row,f16:column,1,0,1,1,tensorop,f16,128,64,32,2,2,2,1,16,8,8,75,1024,1434451968,5566881595392,3880,105.683,12.641,52675.4
1,CUTLASS,gemm,cutlass_tensorop_h1688gemm_64x64_32x2_tt_align8,passed,success,universal,serial,8192,36864,9216,f16:row,f16:row,f16:column,1,0,1,1,tensorop,f16,64,64,32,2,2,2,1,16,8,8,75,1024,1434451968,5566881595392,3880,87.6198,15.247,63534.5
1,CUTLASS,gemm,cutlass_tensorop_h1688gemm_64x64_32x2_tt_align4,passed,success,universal,serial,8192,36864,9216,f16:row,f16:row,f16:column,1,0,1,1,tensorop,f16,64,64,32,2,2,2,1,16,8,8,75,1024,1434451968,5566881595392,3880,92.1224,14.5018,60429.2
1,CUTLASS,gemm,cutlass_tensorop_h1688gemm_64x64_32x2_tt_align2,passed,success,universal,serial,8192,36864,9216,f16:row,f16:row,f16:column,1,0,1,1,tensorop,f16,64,64,32,2,2,2,1,16,8,8,75,1024,1434451968,5566881595392,3880,98.0252,13.6285,56790.3
1,CUTLASS,gemm,cutlass_tensorop_h1688gemm_64x64_32x2_tt_align1,passed,success,universal,serial,8192,36864,9216,f16:row,f16:row,f16:column,1,0,1,1,tensorop,f16,64,64,32,2,2,2,1,16,8,8,75,1024,1434451968,5566881595392,3880,151.733,8.80455,36688.8
1,CUTLASS,gemm,cutlass_tensorop_h1688gemm_64x128_64x2_tt_align8,passed,success,universal,serial,8192,36864,9216,f16:row,f16:row,f16:column,1,0,1,1,tensorop,f16,64,128,64,2,1,2,2,16,8,8,75,1024,1434451968,5566881595392,3880,67.6276,19.7543,82316.7
1,CUTLASS,gemm,cutlass_tensorop_h1688gemm_64x128_64x2_tt_align4,passed,success,universal,serial,8192,36864,9216,f16:row,f16:row,f16:column,1,0,1,1,tensorop,f16,64,128,64,2,1,2,2,16,8,8,75,1024,1434451968,5566881595392,3880,68.8117,19.4144,80900.2
1,CUTLASS,gemm,cutlass_tensorop_h1688gemm_64x128_64x2_tt_align2,passed,success,universal,serial,8192,36864,9216,f16:row,f16:row,f16:column,1,0,1,1,tensorop,f16,64,128,64,2,1,2,2,16,8,8,75,1024,1434451968,5566881595392,3880,71.2902,18.7394,78087.7
1,CUTLASS,gemm,cutlass_tensorop_h1688gemm_64x128_64x2_tt_align1,passed,success,universal,serial,8192,36864,9216,f16:row,f16:row,f16:column,1,0,1,1,tensorop,f16,64,128,64,2,1,2,2,16,8,8,75,1024,1434451968,5566881595392,3880,84.4479,15.8197,65920.9
1,CUTLASS,gemm,cutlass_tensorop_h16816gemm_256x128_32x3_nn_align8,passed,success,universal,serial,8192,36864,9216,f16:column,f16:column,f16:column,1,0,1,1,tensorop,f16,256,128,32,3,4,2,1,16,8,16,80,1024,1434451968,5566881595392,3880,40.0056,33.3937,139152
1,CUTLASS,gemm,cutlass_tensorop_h16816gemm_256x128_32x3_nn_align4,passed,success,universal,serial,8192,36864,9216,f16:column,f16:column,f16:column,1,0,1,1,tensorop,f16,256,128,32,3,4,2,1,16,8,16,80,1024,1434451968,5566881595392,3880,42.3255,31.5634,131525
1,CUTLASS,gemm,cutlass_tensorop_h16816gemm_256x128_32x3_nn_align2,passed,success,universal,serial,8192,36864,9216,f16:column,f16:column,f16:column,1,0,1,1,tensorop,f16,256,128,32,3,4,2,1,16,8,16,80,1024,1434451968,5566881595392,3880,46.2765,28.8686,120296
1,CUTLASS,gemm,cutlass_tensorop_h16816gemm_128x256_32x3_nn_align8,passed,success,universal,serial,8192,36864,9216,f16:column,f16:column,f16:column,1,0,1,1,tensorop,f16,128,256,32,3,2,4,1,16,8,16,80,1024,1434451968,5566881595392,3880,40.8939,32.6684,136130
1,CUTLASS,gemm,cutlass_tensorop_h16816gemm_128x256_32x3_nn_align4,passed,success,universal,serial,8192,36864,9216,f16:column,f16:column,f16:column,1,0,1,1,tensorop,f16,128,256,32,3,2,4,1,16,8,16,80,1024,1434451968,5566881595392,3880,42.1465,31.6975,132084
1,CUTLASS,gemm,cutlass_tensorop_h16816gemm_128x256_32x3_nn_align2,passed,success,universal,serial,8192,36864,9216,f16:column,f16:column,f16:column,1,0,1,1,tensorop,f16,128,256,32,3,2,4,1,16,8,16,80,1024,1434451968,5566881595392,3880,43.1686,30.947,128957
1,CUTLASS,gemm,cutlass_tensorop_h16816gemm_256x64_32x3_nn_align8,passed,success,universal,serial,8192,36864,9216,f16:column,f16:column,f16:column,1,0,1,1,tensorop,f16,256,64,32,3,4,1,1,16,8,16,80,1024,1434451968,5566881595392,3880,53.4134,25.0113,104223
1,CUTLASS,gemm,cutlass_tensorop_h16816gemm_256x64_32x3_nn_align4,passed,success,universal,serial,8192,36864,9216,f16:column,f16:column,f16:column,1,0,1,1,tensorop,f16,256,64,32,3,4,1,1,16,8,16,80,1024,1434451968,5566881595392,3880,53.7199,24.8686,103628
1,CUTLASS,gemm,cutlass_tensorop_h16816gemm_256x64_32x3_nn_align2,passed,success,universal,serial,8192,36864,9216,f16:column,f16:column,f16:column,1,0,1,1,tensorop,f16,256,64,32,3,4,1,1,16,8,16,80,1024,1434451968,5566881595392,3880,120.006,11.1322,46388.2
1,CUTLASS,gemm,cutlass_tensorop_h16816gemm_256x64_32x4_nn_align8,passed,success,universal,serial,8192,36864,9216,f16:column,f16:column,f16:column,1,0,1,1,tensorop,f16,256,64,32,4,4,1,1,16,8,16,80,1024,1434451968,5566881595392,3880,52.6962,25.3517,105641
1,CUTLASS,gemm,cutlass_tensorop_h16816gemm_256x64_32x4_nn_align4,passed,success,universal,serial,8192,36864,9216,f16:column,f16:column,f16:column,1,0,1,1,tensorop,f16,256,64,32,4,4,1,1,16,8,16,80,1024,1434451968,5566881595392,3880,56.8597,23.4953,97905.5
1,CUTLASS,gemm,cutlass_tensorop_h16816gemm_256x64_32x4_nn_align2,passed,success,universal,serial,8192,36864,9216,f16:column,f16:column,f16:column,1,0,1,1,tensorop,f16,256,64,32,4,4,1,1,16,8,16,80,1024,1434451968,5566881595392,3880,105.921,12.6125,52556.7
1,CUTLASS,gemm,cutlass_tensorop_h16816gemm_64x256_32x4_nn_align8,passed,success,universal,serial,8192,36864,9216,f16:column,f16:column,f16:column,1,0,1,1,tensorop,f16,64,256,32,4,1,4,1,16,8,16,80,1024,1434451968,5566881595392,3880,58.6551,22.7761,94908.7
1,CUTLASS,gemm,cutlass_tensorop_h16816gemm_64x256_32x4_nn_align4,passed,success,universal,serial,8192,36864,9216,f16:column,f16:column,f16:column,1,0,1,1,tensorop,f16,64,256,32,4,1,4,1,16,8,16,80,1024,1434451968,5566881595392,3880,56.1554,23.79,99133.4
1,CUTLASS,gemm,cutlass_tensorop_h16816gemm_64x256_32x4_nn_align2,passed,success,universal,serial,8192,36864,9216,f16:column,f16:column,f16:column,1,0,1,1,tensorop,f16,64,256,32,4,1,4,1,16,8,16,80,1024,1434451968,5566881595392,3880,79.6272,16.7774,69911.8
1,CUTLASS,gemm,cutlass_tensorop_h16816gemm_128x128_32x3_nn_align8,passed,success,universal,serial,8192,36864,9216,f16:column,f16:column,f16:column,1,0,1,1,tensorop,f16,128,128,32,3,2,2,1,16,8,16,80,1024,1434451968,5566881595392,3880,47.5449,28.0984,117087
1,CUTLASS,gemm,cutlass_tensorop_h16816gemm_128x128_32x3_nn_align4,passed,success,universal,serial,8192,36864,9216,f16:column,f16:column,f16:column,1,0,1,1,tensorop,f16,128,128,32,3,2,2,1,16,8,16,80,1024,1434451968,5566881595392,3880,52.2812,25.5529,106480
1,CUTLASS,gemm,cutlass_tensorop_h16816gemm_128x128_32x3_nn_align2,passed,success,universal,serial,8192,36864,9216,f16:column,f16:column,f16:column,1,0,1,1,tensorop,f16,128,128,32,3,2,2,1,16,8,16,80,1024,1434451968,5566881595392,3880,54.7566,24.3978,101666
1,CUTLASS,gemm,cutlass_tensorop_h16816gemm_128x128_32x4_nn_align8,passed,success,universal,serial,8192,36864,9216,f16:column,f16:column,f16:column,1,0,1,1,tensorop,f16,128,128,32,4,2,2,1,16,8,16,80,1024,1434451968,5566881595392,3880,44.3676,30.1107,125472
1,CUTLASS,gemm,cutlass_tensorop_h16816gemm_128x128_32x4_nn_align4,passed,success,universal,serial,8192,36864,9216,f16:column,f16:column,f16:column,1,0,1,1,tensorop,f16,128,128,32,4,2,2,1,16,8,16,80,1024,1434451968,5566881595392,3880,49.3572,27.0667,112788
1,CUTLASS,gemm,cutlass_tensorop_h16816gemm_128x128_32x4_nn_align2,passed,success,universal,serial,8192,36864,9216,f16:column,f16:column,f16:column,1,0,1,1,tensorop,f16,128,128,32,4,2,2,1,16,8,16,80,1024,1434451968,5566881595392,3880,53.7462,24.8564,103577
1,CUTLASS,gemm,cutlass_tensorop_h16816gemm_128x128_32x5_nn_align8,passed,success,universal,serial,8192,36864,9216,f16:column,f16:column,f16:column,1,0,1,1,tensorop,f16,128,128,32,5,2,2,1,16,8,16,80,1024,1434451968,5566881595392,3880,44.3416,30.1283,125545
1,CUTLASS,gemm,cutlass_tensorop_h16816gemm_128x128_32x5_nn_align4,passed,success,universal,serial,8192,36864,9216,f16:column,f16:column,f16:column,1,0,1,1,tensorop,f16,128,128,32,5,2,2,1,16,8,16,80,1024,1434451968,5566881595392,3880,48.7623,27.397,114164
1,CUTLASS,gemm,cutlass_tensorop_h16816gemm_128x128_32x5_nn_align2,passed,success,universal,serial,8192,36864,9216,f16:column,f16:column,f16:column,1,0,1,1,tensorop,f16,128,128,32,5,2,2,1,16,8,16,80,1024,1434451968,5566881595392,3880,56.3318,23.7155,98823.1
1,CUTLASS,gemm,cutlass_tensorop_h16816gemm_128x64_32x6_nn_align8,passed,success,universal,serial,8192,36864,9216,f16:column,f16:column,f16:column,1,0,1,1,tensorop,f16,128,64,32,6,2,2,1,16,8,16,80,1024,1434451968,5566881595392,3880,64.001,20.8737,86981.1
1,CUTLASS,gemm,cutlass_tensorop_h16816gemm_128x64_32x6_nn_align4,passed,success,universal,serial,8192,36864,9216,f16:column,f16:column,f16:column,1,0,1,1,tensorop,f16,128,64,32,6,2,2,1,16,8,16,80,1024,1434451968,5566881595392,3880,68.0082,19.6438,81856
1,CUTLASS,gemm,cutlass_tensorop_h16816gemm_128x64_32x6_nn_align2,passed,success,universal,serial,8192,36864,9216,f16:column,f16:column,f16:column,1,0,1,1,tensorop,f16,128,64,32,6,2,2,1,16,8,16,80,1024,1434451968,5566881595392,3880,84.4794,15.8138,65896.3
1,CUTLASS,gemm,cutlass_tensorop_h16816gemm_64x128_32x6_nn_align8,passed,success,universal,serial,8192,36864,9216,f16:column,f16:column,f16:column,1,0,1,1,tensorop,f16,64,128,32,6,2,2,1,16,8,16,80,1024,1434451968,5566881595392,3880,75.4178,17.7138,73813.9
1,CUTLASS,gemm,cutlass_tensorop_h16816gemm_64x128_32x6_nn_align4,passed,success,universal,serial,8192,36864,9216,f16:column,f16:column,f16:column,1,0,1,1,tensorop,f16,64,128,32,6,2,2,1,16,8,16,80,1024,1434451968,5566881595392,3880,67.485,19.7961,82490.7
1,CUTLASS,gemm,cutlass_tensorop_h16816gemm_64x128_32x6_nn_align2,passed,success,universal,serial,8192,36864,9216,f16:column,f16:column,f16:column,1,0,1,1,tensorop,f16,64,128,32,6,2,2,1,16,8,16,80,1024,1434451968,5566881595392,3880,78.85,16.9428,70600.9
1,CUTLASS,gemm,cutlass_tensorop_h16816gemm_64x64_32x10_nn_align8,passed,success,universal,serial,8192,36864,9216,f16:column,f16:column,f16:column,1,0,1,1,tensorop,f16,64,64,32,10,2,2,1,16,8,16,80,1024,1434451968,5566881595392,3880,83.7803,15.9457,66446.2
1,CUTLASS,gemm,cutlass_tensorop_h16816gemm_64x64_32x10_nn_align4,passed,success,universal,serial,8192,36864,9216,f16:column,f16:column,f16:column,1,0,1,1,tensorop,f16,64,64,32,10,2,2,1,16,8,16,80,1024,1434451968,5566881595392,3880,87.3274,15.298,63747.2
1,CUTLASS,gemm,cutlass_tensorop_h16816gemm_64x64_32x10_nn_align2,passed,success,universal,serial,8192,36864,9216,f16:column,f16:column,f16:column,1,0,1,1,tensorop,f16,64,64,32,10,2,2,1,16,8,16,80,1024,1434451968,5566881595392,3880,105.277,12.6897,52878.2
1,CUTLASS,gemm,cutlass_tensorop_h16816gemm_128x64_64x3_nn_align8,passed,success,universal,serial,8192,36864,9216,f16:column,f16:column,f16:column,1,0,1,1,tensorop,f16,128,64,64,3,2,2,1,16,8,16,80,1024,1434451968,5566881595392,3880,64.0268,20.8653,86946.1
1,CUTLASS,gemm,cutlass_tensorop_h16816gemm_128x64_64x3_nn_align4,passed,success,universal,serial,8192,36864,9216,f16:column,f16:column,f16:column,1,0,1,1,tensorop,f16,128,64,64,3,2,2,1,16,8,16,80,1024,1434451968,5566881595392,3880,65.438,20.4153,85071.1
1,CUTLASS,gemm,cutlass_tensorop_h16816gemm_128x64_64x3_nn_align2,passed,success,universal,serial,8192,36864,9216,f16:column,f16:column,f16:column,1,0,1,1,tensorop,f16,128,64,64,3,2,2,1,16,8,16,80,1024,1434451968,5566881595392,3880,86.6998,15.4088,64208.7
1,CUTLASS,gemm,cutlass_tensorop_h16816gemm_64x128_64x3_nn_align8,passed,success,universal,serial,8192,36864,9216,f16:column,f16:column,f16:column,1,0,1,1,tensorop,f16,64,128,64,3,2,2,1,16,8,16,80,1024,1434451968,5566881595392,3880,64.9162,20.5794,85754.9
1,CUTLASS,gemm,cutlass_tensorop_h16816gemm_64x128_64x3_nn_align4,passed,success,universal,serial,8192,36864,9216,f16:column,f16:column,f16:column,1,0,1,1,tensorop,f16,64,128,64,3,2,2,1,16,8,16,80,1024,1434451968,5566881595392,3880,65.8948,20.2738,84481.3
1,CUTLASS,gemm,cutlass_tensorop_h16816gemm_64x128_64x3_nn_align2,passed,success,universal,serial,8192,36864,9216,f16:column,f16:column,f16:column,1,0,1,1,tensorop,f16,64,128,64,3,2,2,1,16,8,16,80,1024,1434451968,5566881595392,3880,84.6312,15.7854,65778.1
1,CUTLASS,gemm,cutlass_tensorop_h16816gemm_64x64_64x5_nn_align8,passed,success,universal,serial,8192,36864,9216,f16:column,f16:column,f16:column,1,0,1,1,tensorop,f16,64,64,64,5,2,2,1,16,8,16,80,1024,1434451968,5566881595392,3880,83.4132,16.0159,66738.6
1,CUTLASS,gemm,cutlass_tensorop_h16816gemm_64x64_64x5_nn_align4,passed,success,universal,serial,8192,36864,9216,f16:column,f16:column,f16:column,1,0,1,1,tensorop,f16,64,64,64,5,2,2,1,16,8,16,80,1024,1434451968,5566881595392,3880,85.286,15.6642,65273.1
1,CUTLASS,gemm,cutlass_tensorop_h16816gemm_64x64_64x5_nn_align2,passed,success,universal,serial,8192,36864,9216,f16:column,f16:column,f16:column,1,0,1,1,tensorop,f16,64,64,64,5,2,2,1,16,8,16,80,1024,1434451968,5566881595392,3880,93.4528,14.2953,59568.9
1,CUTLASS,gemm,cutlass_tensorop_h16816gemm_256x128_32x3_nt_align8,passed,success,universal,serial,8192,36864,9216,f16:column,f16:row,f16:column,1,0,1,1,tensorop,f16,256,128,32,3,4,2,1,16,8,16,80,1024,1434451968,5566881595392,3880,40.0437,33.362,139020
1,CUTLASS,gemm,cutlass_tensorop_h16816gemm_256x128_32x3_nt_align4,passed,success,universal,serial,8192,36864,9216,f16:column,f16:row,f16:column,1,0,1,1,tensorop,f16,256,128,32,3,4,2,1,16,8,16,80,1024,1434451968,5566881595392,3880,41.4279,32.2473,134375
1,CUTLASS,gemm,cutlass_tensorop_h16816gemm_256x128_32x3_nt_align2,passed,success,universal,serial,8192,36864,9216,f16:column,f16:row,f16:column,1,0,1,1,tensorop,f16,256,128,32,3,4,2,1,16,8,16,80,1024,1434451968,5566881595392,3880,45.4742,29.3779,122418
1,CUTLASS,gemm,cutlass_tensorop_h16816gemm_128x256_32x3_nt_align8,passed,success,universal,serial,8192,36864,9216,f16:column,f16:row,f16:column,1,0,1,1,tensorop,f16,128,256,32,3,2,4,1,16,8,16,80,1024,1434451968,5566881595392,3880,40.6799,32.8402,136846
1,CUTLASS,gemm,cutlass_tensorop_h16816gemm_128x256_32x3_nt_align4,passed,success,universal,serial,8192,36864,9216,f16:column,f16:row,f16:column,1,0,1,1,tensorop,f16,128,256,32,3,2,4,1,16,8,16,80,1024,1434451968,5566881595392,3880,41.2476,32.3882,134962
1,CUTLASS,gemm,cutlass_tensorop_h16816gemm_128x256_32x3_nt_align2,passed,success,universal,serial,8192,36864,9216,f16:column,f16:row,f16:column,1,0,1,1,tensorop,f16,128,256,32,3,2,4,1,16,8,16,80,1024,1434451968,5566881595392,3880,47.0128,28.4165,118412
1,CUTLASS,gemm,cutlass_tensorop_h16816gemm_256x64_32x3_nt_align8,passed,success,universal,serial,8192,36864,9216,f16:column,f16:row,f16:column,1,0,1,1,tensorop,f16,256,64,32,3,4,1,1,16,8,16,80,1024,1434451968,5566881595392,3880,54.8363,24.3623,101518
1,CUTLASS,gemm,cutlass_tensorop_h16816gemm_256x64_32x3_nt_align4,passed,success,universal,serial,8192,36864,9216,f16:column,f16:row,f16:column,1,0,1,1,tensorop,f16,256,64,32,3,4,1,1,16,8,16,80,1024,1434451968,5566881595392,3880,56.7995,23.5202,98009.3
1,CUTLASS,gemm,cutlass_tensorop_h16816gemm_256x64_32x3_nt_align2,passed,success,universal,serial,8192,36864,9216,f16:column,f16:row,f16:column,1,0,1,1,tensorop,f16,256,64,32,3,4,1,1,16,8,16,80,1024,1434451968,5566881595392,3880,64.2227,20.8016,86680.9
1,CUTLASS,gemm,cutlass_tensorop_h16816gemm_256x64_32x4_nt_align8,passed,success,universal,serial,8192,36864,9216,f16:column,f16:row,f16:column,1,0,1,1,tensorop,f16,256,64,32,4,4,1,1,16,8,16,80,1024,1434451968,5566881595392,3880,54.3273,24.5905,102469
1,CUTLASS,gemm,cutlass_tensorop_h16816gemm_256x64_32x4_nt_align4,passed,success,universal,serial,8192,36864,9216,f16:column,f16:row,f16:column,1,0,1,1,tensorop,f16,256,64,32,4,4,1,1,16,8,16,80,1024,1434451968,5566881595392,3880,56.4788,23.6538,98565.8
1,CUTLASS,gemm,cutlass_tensorop_h16816gemm_256x64_32x4_nt_align2,passed,success,universal,serial,8192,36864,9216,f16:column,f16:row,f16:column,1,0,1,1,tensorop,f16,256,64,32,4,4,1,1,16,8,16,80,1024,1434451968,5566881595392,3880,74.1515,18.0163,75074.4
1,CUTLASS,gemm,cutlass_tensorop_h16816gemm_64x256_32x4_nt_align8,passed,success,universal,serial,8192,36864,9216,f16:column,f16:row,f16:column,1,0,1,1,tensorop,f16,64,256,32,4,1,4,1,16,8,16,80,1024,1434451968,5566881595392,3880,53.1366,25.1416,104766
1,CUTLASS,gemm,cutlass_tensorop_h16816gemm_64x256_32x4_nt_align4,passed,success,universal,serial,8192,36864,9216,f16:column,f16:row,f16:column,1,0,1,1,tensorop,f16,64,256,32,4,1,4,1,16,8,16,80,1024,1434451968,5566881595392,3880,54.8325,24.364,101525
1,CUTLASS,gemm,cutlass_tensorop_h16816gemm_64x256_32x4_nt_align2,passed,success,universal,serial,8192,36864,9216,f16:column,f16:row,f16:column,1,0,1,1,tensorop,f16,64,256,32,4,1,4,1,16,8,16,80,1024,1434451968,5566881595392,3880,76.284,17.5127,72975.7
1,CUTLASS,gemm,cutlass_tensorop_h16816gemm_128x128_32x3_nt_align8,passed,success,universal,serial,8192,36864,9216,f16:column,f16:row,f16:column,1,0,1,1,tensorop,f16,128,128,32,3,2,2,1,16,8,16,80,1024,1434451968,5566881595392,3880,45.5336,29.3396,122259
1,CUTLASS,gemm,cutlass_tensorop_h16816gemm_128x128_32x3_nt_align4,passed,success,universal,serial,8192,36864,9216,f16:column,f16:row,f16:column,1,0,1,1,tensorop,f16,128,128,32,3,2,2,1,16,8,16,80,1024,1434451968,5566881595392,3880,45.9506,29.0734,121149
1,CUTLASS,gemm,cutlass_tensorop_h16816gemm_128x128_32x3_nt_align2,passed,success,universal,serial,8192,36864,9216,f16:column,f16:row,f16:column,1,0,1,1,tensorop,f16,128,128,32,3,2,2,1,16,8,16,80,1024,1434451968,5566881595392,3880,46.6819,28.6179,119251
1,CUTLASS,gemm,cutlass_tensorop_h16816gemm_128x128_32x4_nt_align8,passed,success,universal,serial,8192,36864,9216,f16:column,f16:row,f16:column,1,0,1,1,tensorop,f16,128,128,32,4,2,2,1,16,8,16,80,1024,1434451968,5566881595392,3880,44.7835,29.831,124306
1,CUTLASS,gemm,cutlass_tensorop_h16816gemm_128x128_32x4_nt_align4,passed,success,universal,serial,8192,36864,9216,f16:column,f16:row,f16:column,1,0,1,1,tensorop,f16,128,128,32,4,2,2,1,16,8,16,80,1024,1434451968,5566881595392,3880,45.6217,29.283,122023
1,CUTLASS,gemm,cutlass_tensorop_h16816gemm_128x128_32x4_nt_align2,passed,success,universal,serial,8192,36864,9216,f16:column,f16:row,f16:column,1,0,1,1,tensorop,f16,128,128,32,4,2,2,1,16,8,16,80,1024,1434451968,5566881595392,3880,51.9082,25.7365,107245
1,CUTLASS,gemm,cutlass_tensorop_h16816gemm_128x128_32x5_nt_align8,passed,success,universal,serial,8192,36864,9216,f16:column,f16:row,f16:column,1,0,1,1,tensorop,f16,128,128,32,5,2,2,1,16,8,16,80,1024,1434451968,5566881595392,3880,45.2426,29.5283,123045
1,CUTLASS,gemm,cutlass_tensorop_h16816gemm_128x128_32x5_nt_align4,passed,success,universal,serial,8192,36864,9216,f16:column,f16:row,f16:column,1,0,1,1,tensorop,f16,128,128,32,5,2,2,1,16,8,16,80,1024,1434451968,5566881595392,3880,45.6924,29.2376,121834
1,CUTLASS,gemm,cutlass_tensorop_h16816gemm_128x128_32x5_nt_align2,passed,success,universal,serial,8192,36864,9216,f16:column,f16:row,f16:column,1,0,1,1,tensorop,f16,128,128,32,5,2,2,1,16,8,16,80,1024,1434451968,5566881595392,3880,49.419,27.0329,112647
1,CUTLASS,gemm,cutlass_tensorop_h16816gemm_128x64_32x6_nt_align8,passed,success,universal,serial,8192,36864,9216,f16:column,f16:row,f16:column,1,0,1,1,tensorop,f16,128,64,32,6,2,2,1,16,8,16,80,1024,1434451968,5566881595392,3880,65.2696,20.468,85290.5
1,CUTLASS,gemm,cutlass_tensorop_h16816gemm_128x64_32x6_nt_align4,passed,success,universal,serial,8192,36864,9216,f16:column,f16:row,f16:column,1,0,1,1,tensorop,f16,128,64,32,6,2,2,1,16,8,16,80,1024,1434451968,5566881595392,3880,66.8878,19.9728,83227.2
1,CUTLASS,gemm,cutlass_tensorop_h16816gemm_128x64_32x6_nt_align2,passed,success,universal,serial,8192,36864,9216,f16:column,f16:row,f16:column,1,0,1,1,tensorop,f16,128,64,32,6,2,2,1,16,8,16,80,1024,1434451968,5566881595392,3880,74.8737,17.8426,74350.3
1,CUTLASS,gemm,cutlass_tensorop_h16816gemm_64x128_32x6_nt_align8,passed,success,universal,serial,8192,36864,9216,f16:column,f16:row,f16:column,1,0,1,1,tensorop,f16,64,128,32,6,2,2,1,16,8,16,80,1024,1434451968,5566881595392,3880,64.9492,20.5689,85711.3
1,CUTLASS,gemm,cutlass_tensorop_h16816gemm_64x128_32x6_nt_align4,passed,success,universal,serial,8192,36864,9216,f16:column,f16:row,f16:column,1,0,1,1,tensorop,f16,64,128,32,6,2,2,1,16,8,16,80,1024,1434451968,5566881595392,3880,65.2956,20.4599,85256.7
1,CUTLASS,gemm,cutlass_tensorop_h16816gemm_64x128_32x6_nt_align2,passed,success,universal,serial,8192,36864,9216,f16:column,f16:row,f16:column,1,0,1,1,tensorop,f16,64,128,32,6,2,2,1,16,8,16,80,1024,1434451968,5566881595392,3880,75.5342,17.6865,73700.1
1,CUTLASS,gemm,cutlass_tensorop_h16816gemm_64x64_32x10_nt_align8,passed,success,universal,serial,8192,36864,9216,f16:column,f16:row,f16:column,1,0,1,1,tensorop,f16,64,64,32,10,2,2,1,16,8,16,80,1024,1434451968,5566881595392,3880,84.0622,15.8922,66223.4
1,CUTLASS,gemm,cutlass_tensorop_h16816gemm_64x64_32x10_nt_align4,passed,success,universal,serial,8192,36864,9216,f16:column,f16:row,f16:column,1,0,1,1,tensorop,f16,64,64,32,10,2,2,1,16,8,16,80,1024,1434451968,5566881595392,3880,85.2151,15.6772,65327.4
1,CUTLASS,gemm,cutlass_tensorop_h16816gemm_64x64_32x10_nt_align2,passed,success,universal,serial,8192,36864,9216,f16:column,f16:row,f16:column,1,0,1,1,tensorop,f16,64,64,32,10,2,2,1,16,8,16,80,1024,1434451968,5566881595392,3880,95.1303,14.0432,58518.5
1,CUTLASS,gemm,cutlass_tensorop_h16816gemm_128x64_64x3_nt_align8,passed,success,universal,serial,8192,36864,9216,f16:column,f16:row,f16:column,1,0,1,1,tensorop,f16,128,64,64,3,2,2,1,16,8,16,80,1024,1434451968,5566881595392,3880,65.8153,20.2983,84583.3
1,CUTLASS,gemm,cutlass_tensorop_h16816gemm_128x64_64x3_nt_align4,passed,success,universal,serial,8192,36864,9216,f16:column,f16:row,f16:column,1,0,1,1,tensorop,f16,128,64,64,3,2,2,1,16,8,16,80,1024,1434451968,5566881595392,3880,68.5466,19.4895,81213.1
1,CUTLASS,gemm,cutlass_tensorop_h16816gemm_128x64_64x3_nt_align2,passed,success,universal,serial,8192,36864,9216,f16:column,f16:row,f16:column,1,0,1,1,tensorop,f16,128,64,64,3,2,2,1,16,8,16,80,1024,1434451968,5566881595392,3880,93.9998,14.2121,59222.3
1,CUTLASS,gemm,cutlass_tensorop_h16816gemm_64x128_64x3_nt_align8,passed,success,universal,serial,8192,36864,9216,f16:column,f16:row,f16:column,1,0,1,1,tensorop,f16,64,128,64,3,2,2,1,16,8,16,80,1024,1434451968,5566881595392,3880,64.8181,20.6106,85884.7
1,CUTLASS,gemm,cutlass_tensorop_h16816gemm_64x128_64x3_nt_align4,passed,success,universal,serial,8192,36864,9216,f16:column,f16:row,f16:column,1,0,1,1,tensorop,f16,64,128,64,3,2,2,1,16,8,16,80,1024,1434451968,5566881595392,3880,65.7351,20.3231,84686.6
1,CUTLASS,gemm,cutlass_tensorop_h16816gemm_64x128_64x3_nt_align2,passed,success,universal,serial,8192,36864,9216,f16:column,f16:row,f16:column,1,0,1,1,tensorop,f16,64,128,64,3,2,2,1,16,8,16,80,1024,1434451968,5566881595392,3880,89.3084,14.9587,62333.3
1,CUTLASS,gemm,cutlass_tensorop_h16816gemm_64x64_64x5_nt_align8,passed,success,universal,serial,8192,36864,9216,f16:column,f16:row,f16:column,1,0,1,1,tensorop,f16,64,64,64,5,2,2,1,16,8,16,80,1024,1434451968,5566881595392,3880,84.1232,15.8807,66175.3
1,CUTLASS,gemm,cutlass_tensorop_h16816gemm_64x64_64x5_nt_align4,passed,success,universal,serial,8192,36864,9216,f16:column,f16:row,f16:column,1,0,1,1,tensorop,f16,64,64,64,5,2,2,1,16,8,16,80,1024,1434451968,5566881595392,3880,85.4652,15.6314,65136.2
1,CUTLASS,gemm,cutlass_tensorop_h16816gemm_64x64_64x5_nt_align2,passed,success,universal,serial,8192,36864,9216,f16:column,f16:row,f16:column,1,0,1,1,tensorop,f16,64,64,64,5,2,2,1,16,8,16,80,1024,1434451968,5566881595392,3880,91.0026,14.6802,61172.8
1,CUTLASS,gemm,cutlass_tensorop_h16816gemm_256x128_32x3_tn_align8,passed,success,universal,serial,8192,36864,9216,f16:row,f16:column,f16:column,1,0,1,1,tensorop,f16,256,128,32,3,4,2,1,16,8,16,80,1024,1434451968,5566881595392,3880,41.2117,32.4165,135080
1,CUTLASS,gemm,cutlass_tensorop_h16816gemm_256x128_32x3_tn_align4,passed,success,universal,serial,8192,36864,9216,f16:row,f16:column,f16:column,1,0,1,1,tensorop,f16,256,128,32,3,4,2,1,16,8,16,80,1024,1434451968,5566881595392,3880,42.9912,31.0747,129489
1,CUTLASS,gemm,cutlass_tensorop_h16816gemm_256x128_32x3_tn_align2,passed,success,universal,serial,8192,36864,9216,f16:row,f16:column,f16:column,1,0,1,1,tensorop,f16,256,128,32,3,4,2,1,16,8,16,80,1024,1434451968,5566881595392,3880,49.9881,26.7251,111364
1,CUTLASS,gemm,cutlass_tensorop_h16816gemm_128x256_32x3_tn_align8,passed,success,universal,serial,8192,36864,9216,f16:row,f16:column,f16:column,1,0,1,1,tensorop,f16,128,256,32,3,2,4,1,16,8,16,80,1024,1434451968,5566881595392,3880,41.1883,32.4349,135157
1,CUTLASS,gemm,cutlass_tensorop_h16816gemm_128x256_32x3_tn_align4,passed,success,universal,serial,8192,36864,9216,f16:row,f16:column,f16:column,1,0,1,1,tensorop,f16,128,256,32,3,2,4,1,16,8,16,80,1024,1434451968,5566881595392,3880,42.9427,31.1098,129635
1,CUTLASS,gemm,cutlass_tensorop_h16816gemm_128x256_32x3_tn_align2,passed,success,universal,serial,8192,36864,9216,f16:row,f16:column,f16:column,1,0,1,1,tensorop,f16,128,256,32,3,2,4,1,16,8,16,80,1024,1434451968,5566881595392,3880,50.0501,26.692,111226
1,CUTLASS,gemm,cutlass_tensorop_h16816gemm_256x64_32x3_tn_align8,passed,success,universal,serial,8192,36864,9216,f16:row,f16:column,f16:column,1,0,1,1,tensorop,f16,256,64,32,3,4,1,1,16,8,16,80,1024,1434451968,5566881595392,3880,53.3268,25.0519,104392
1,CUTLASS,gemm,cutlass_tensorop_h16816gemm_256x64_32x3_tn_align4,passed,success,universal,serial,8192,36864,9216,f16:row,f16:column,f16:column,1,0,1,1,tensorop,f16,256,64,32,3,4,1,1,16,8,16,80,1024,1434451968,5566881595392,3880,53.7917,24.8354,103490
1,CUTLASS,gemm,cutlass_tensorop_h16816gemm_256x64_32x3_tn_align2,passed,success,universal,serial,8192,36864,9216,f16:row,f16:column,f16:column,1,0,1,1,tensorop,f16,256,64,32,3,4,1,1,16,8,16,80,1024,1434451968,5566881595392,3880,114.007,11.718,48829.3
1,CUTLASS,gemm,cutlass_tensorop_h16816gemm_256x64_32x4_tn_align8,passed,success,universal,serial,8192,36864,9216,f16:row,f16:column,f16:column,1,0,1,1,tensorop,f16,256,64,32,4,4,1,1,16,8,16,80,1024,1434451968,5566881595392,3880,52.4171,25.4867,106203
1,CUTLASS,gemm,cutlass_tensorop_h16816gemm_256x64_32x4_tn_align4,passed,success,universal,serial,8192,36864,9216,f16:row,f16:column,f16:column,1,0,1,1,tensorop,f16,256,64,32,4,4,1,1,16,8,16,80,1024,1434451968,5566881595392,3880,58.1446,22.9761,95742.1
1,CUTLASS,gemm,cutlass_tensorop_h16816gemm_256x64_32x4_tn_align2,passed,success,universal,serial,8192,36864,9216,f16:row,f16:column,f16:column,1,0,1,1,tensorop,f16,256,64,32,4,4,1,1,16,8,16,80,1024,1434451968,5566881595392,3880,123.688,10.8008,45007.3
1,CUTLASS,gemm,cutlass_tensorop_h16816gemm_64x256_32x4_tn_align8,passed,success,universal,serial,8192,36864,9216,f16:row,f16:column,f16:column,1,0,1,1,tensorop,f16,64,256,32,4,1,4,1,16,8,16,80,1024,1434451968,5566881595392,3880,111.384,11.994,49979.3
1,CUTLASS,gemm,cutlass_tensorop_h16816gemm_64x256_32x4_tn_align4,passed,success,universal,serial,8192,36864,9216,f16:row,f16:column,f16:column,1,0,1,1,tensorop,f16,64,256,32,4,1,4,1,16,8,16,80,1024,1434451968,5566881595392,3880,56.7876,23.5252,98029.9
1,CUTLASS,gemm,cutlass_tensorop_h16816gemm_64x256_32x4_tn_align2,passed,success,universal,serial,8192,36864,9216,f16:row,f16:column,f16:column,1,0,1,1,tensorop,f16,64,256,32,4,1,4,1,16,8,16,80,1024,1434451968,5566881595392,3880,112.51,11.8739,49478.9
1,CUTLASS,gemm,cutlass_tensorop_h16816gemm_128x128_32x3_tn_align8,passed,success,universal,serial,8192,36864,9216,f16:row,f16:column,f16:column,1,0,1,1,tensorop,f16,128,128,32,3,2,2,1,16,8,16,80,1024,1434451968,5566881595392,3880,44.6111,29.9463,124787
1,CUTLASS,gemm,cutlass_tensorop_h16816gemm_128x128_32x3_tn_align4,passed,success,universal,serial,8192,36864,9216,f16:row,f16:column,f16:column,1,0,1,1,tensorop,f16,128,128,32,3,2,2,1,16,8,16,80,1024,1434451968,5566881595392,3880,61.6233,21.6791,90337.3
1,CUTLASS,gemm,cutlass_tensorop_h16816gemm_128x128_32x3_tn_align2,passed,success,universal,serial,8192,36864,9216,f16:row,f16:column,f16:column,1,0,1,1,tensorop,f16,128,128,32,3,2,2,1,16,8,16,80,1024,1434451968,5566881595392,3880,64.3495,20.7607,86510.1
1,CUTLASS,gemm,cutlass_tensorop_h16816gemm_128x128_32x4_tn_align8,passed,success,universal,serial,8192,36864,9216,f16:row,f16:column,f16:column,1,0,1,1,tensorop,f16,128,128,32,4,2,2,1,16,8,16,80,1024,1434451968,5566881595392,3880,43.2167,30.9125,128813
1,CUTLASS,gemm,cutlass_tensorop_h16816gemm_128x128_32x4_tn_align4,passed,success,universal,serial,8192,36864,9216,f16:row,f16:column,f16:column,1,0,1,1,tensorop,f16,128,128,32,4,2,2,1,16,8,16,80,1024,1434451968,5566881595392,3880,48.9366,27.2994,113757
1,CUTLASS,gemm,cutlass_tensorop_h16816gemm_128x128_32x4_tn_align2,passed,success,universal,serial,8192,36864,9216,f16:row,f16:column,f16:column,1,0,1,1,tensorop,f16,128,128,32,4,2,2,1,16,8,16,80,1024,1434451968,5566881595392,3880,63.5865,21.0098,87548.2
1,CUTLASS,gemm,cutlass_tensorop_h16816gemm_128x128_32x5_tn_align8,passed,success,universal,serial,8192,36864,9216,f16:row,f16:column,f16:column,1,0,1,1,tensorop,f16,128,128,32,5,2,2,1,16,8,16,80,1024,1434451968,5566881595392,3880,43.1774,30.9407,128931
1,CUTLASS,gemm,cutlass_tensorop_h16816gemm_128x128_32x5_tn_align4,passed,success,universal,serial,8192,36864,9216,f16:row,f16:column,f16:column,1,0,1,1,tensorop,f16,128,128,32,5,2,2,1,16,8,16,80,1024,1434451968,5566881595392,3880,49.3115,27.0918,112892
1,CUTLASS,gemm,cutlass_tensorop_h16816gemm_128x128_32x5_tn_align2,passed,success,universal,serial,8192,36864,9216,f16:row,f16:column,f16:column,1,0,1,1,tensorop,f16,128,128,32,5,2,2,1,16,8,16,80,1024,1434451968,5566881595392,3880,66.8894,19.9723,83225.1
1,CUTLASS,gemm,cutlass_tensorop_h16816gemm_128x64_32x6_tn_align8,passed,success,universal,serial,8192,36864,9216,f16:row,f16:column,f16:column,1,0,1,1,tensorop,f16,128,64,32,6,2,2,1,16,8,16,80,1024,1434451968,5566881595392,3880,64.4445,20.73,86382.5
