CUTLASS/cutlassgemm-benchmark/csv_logs/cutlass_shape_8192_14336_43008_performance.gemm.csv
Problem,Provider,OperationKind,Operation,Disposition,Status,gemm_kind,m,n,k,A,B,C,D,alpha,beta,split_k_mode,split_k_slices,batch_count,raster_order,op_class,accum,cta_m,cta_n,cta_k,cluster_m,cluster_n,cluster_k,stages,warps_m,warps_n,warps_k,inst_m,inst_n,inst_k,min_cc,max_cc,Bytes,Flops,Flops/Byte,Runtime,GB/s,GFLOPs
1,CUTLASS,gemm,cutlass_tensorop_h1688gemm_256x128_32x2_nn_align8,passed,success,universal,8192,43008,14336,f16:column,f16:column,f16:column,f16:column,1,0,serial,1,1,heuristic,tensorop,f16,256,128,32,1,1,1,2,4,2,1,16,8,8,75,1024,2172649472,10102467723264,4649,50.1206,40.3714,201563
1,CUTLASS,gemm,cutlass_tensorop_h1688gemm_256x128_32x2_nn_align4,passed,success,universal,8192,43008,14336,f16:column,f16:column,f16:column,f16:column,1,0,serial,1,1,heuristic,tensorop,f16,256,128,32,1,1,1,2,4,2,1,16,8,8,75,1024,2172649472,10102467723264,4649,48.1449,42.0281,209835
1,CUTLASS,gemm,cutlass_tensorop_h1688gemm_256x128_32x2_nn_align2,passed,success,universal,8192,43008,14336,f16:column,f16:column,f16:column,f16:column,1,0,serial,1,1,heuristic,tensorop,f16,256,128,32,1,1,1,2,4,2,1,16,8,8,75,1024,2172649472,10102467723264,4649,49.0375,41.263,206015
1,CUTLASS,gemm,cutlass_tensorop_h1688gemm_256x128_32x2_nn_align1,passed,success,universal,8192,43008,14336,f16:column,f16:column,f16:column,f16:column,1,0,serial,1,1,heuristic,tensorop,f16,256,128,32,1,1,1,2,4,2,1,16,8,8,75,1024,2172649472,10102467723264,4649,60.8971,33.2271,165894
1,CUTLASS,gemm,cutlass_tensorop_h1688gemm_128x256_32x2_nn_align8,passed,success,universal,8192,43008,14336,f16:column,f16:column,f16:column,f16:column,1,0,serial,1,1,heuristic,tensorop,f16,128,256,32,1,1,1,2,2,4,1,16,8,8,75,1024,2172649472,10102467723264,4649,47.8425,42.2937,211161
1,CUTLASS,gemm,cutlass_tensorop_h1688gemm_128x256_32x2_nn_align4,passed,success,universal,8192,43008,14336,f16:column,f16:column,f16:column,f16:column,1,0,serial,1,1,heuristic,tensorop,f16,128,256,32,1,1,1,2,2,4,1,16,8,8,75,1024,2172649472,10102467723264,4649,45.6893,44.2869,221112
1,CUTLASS,gemm,cutlass_tensorop_h1688gemm_128x256_32x2_nn_align2,passed,success,universal,8192,43008,14336,f16:column,f16:column,f16:column,f16:column,1,0,serial,1,1,heuristic,tensorop,f16,128,256,32,1,1,1,2,2,4,1,16,8,8,75,1024,2172649472,10102467723264,4649,44.9984,44.9668,224507
1,CUTLASS,gemm,cutlass_tensorop_h1688gemm_128x256_32x2_nn_align1,passed,success,universal,8192,43008,14336,f16:column,f16:column,f16:column,f16:column,1,0,serial,1,1,heuristic,tensorop,f16,128,256,32,1,1,1,2,2,4,1,16,8,8,75,1024,2172649472,10102467723264,4649,50.2027,40.3053,201233
1,CUTLASS,gemm,cutlass_tensorop_h1688gemm_128x128_32x2_nn_align8,passed,success,universal,8192,43008,14336,f16:column,f16:column,f16:column,f16:column,1,0,serial,1,1,heuristic,tensorop,f16,128,128,32,1,1,1,2,2,2,1,16,8,8,75,1024,2172649472,10102467723264,4649,37.0535,54.6085,272645
1,CUTLASS,gemm,cutlass_tensorop_h1688gemm_128x128_32x2_nn_align4,passed,success,universal,8192,43008,14336,f16:column,f16:column,f16:column,f16:column,1,0,serial,1,1,heuristic,tensorop,f16,128,128,32,1,1,1,2,2,2,1,16,8,8,75,1024,2172649472,10102467723264,4649,40.2654,50.2525,250897
1,CUTLASS,gemm,cutlass_tensorop_h1688gemm_128x128_32x2_nn_align2,passed,success,universal,8192,43008,14336,f16:column,f16:column,f16:column,f16:column,1,0,serial,1,1,heuristic,tensorop,f16,128,128,32,1,1,1,2,2,2,1,16,8,8,75,1024,2172649472,10102467723264,4649,41.7801,48.4307,241801
1,CUTLASS,gemm,cutlass_tensorop_h1688gemm_128x128_32x2_nn_align1,passed,success,universal,8192,43008,14336,f16:column,f16:column,f16:column,f16:column,1,0,serial,1,1,heuristic,tensorop,f16,128,128,32,1,1,1,2,2,2,1,16,8,8,75,1024,2172649472,10102467723264,4649,56.5721,35.7674,178577
1,CUTLASS,gemm,cutlass_tensorop_h1688gemm_64x256_32x2_nn_align8,passed,success,universal,8192,43008,14336,f16:column,f16:column,f16:column,f16:column,1,0,serial,1,1,heuristic,tensorop,f16,64,256,32,1,1,1,2,1,4,1,16,8,8,75,1024,2172649472,10102467723264,4649,42.6509,47.4418,236864
1,CUTLASS,gemm,cutlass_tensorop_h1688gemm_64x256_32x2_nn_align4,passed,success,universal,8192,43008,14336,f16:column,f16:column,f16:column,f16:column,1,0,serial,1,1,heuristic,tensorop,f16,64,256,32,1,1,1,2,1,4,1,16,8,8,75,1024,2172649472,10102467723264,4649,45.0966,44.869,224019
1,CUTLASS,gemm,cutlass_tensorop_h1688gemm_64x256_32x2_nn_align2,passed,success,universal,8192,43008,14336,f16:column,f16:column,f16:column,f16:column,1,0,serial,1,1,heuristic,tensorop,f16,64,256,32,1,1,1,2,1,4,1,16,8,8,75,1024,2172649472,10102467723264,4649,47.4585,42.6359,212869
1,CUTLASS,gemm,cutlass_tensorop_h1688gemm_64x256_32x2_nn_align1,passed,success,universal,8192,43008,14336,f16:column,f16:column,f16:column,f16:column,1,0,serial,1,1,heuristic,tensorop,f16,64,256,32,1,1,1,2,1,4,1,16,8,8,75,1024,2172649472,10102467723264,4649,59.4915,34.0122,169814
1,CUTLASS,gemm,cutlass_tensorop_h1688gemm_256x64_32x2_nn_align8,passed,success,universal,8192,43008,14336,f16:column,f16:column,f16:column,f16:column,1,0,serial,1,1,heuristic,tensorop,f16,256,64,32,1,1,1,2,4,1,1,16,8,8,75,1024,2172649472,10102467723264,4649,48.7806,41.4804,207100
1,CUTLASS,gemm,cutlass_tensorop_h1688gemm_256x64_32x2_nn_align4,passed,success,universal,8192,43008,14336,f16:column,f16:column,f16:column,f16:column,1,0,serial,1,1,heuristic,tensorop,f16,256,64,32,1,1,1,2,4,1,1,16,8,8,75,1024,2172649472,10102467723264,4649,53.6851,37.6908,188180
1,CUTLASS,gemm,cutlass_tensorop_h1688gemm_256x64_32x2_nn_align2,passed,success,universal,8192,43008,14336,f16:column,f16:column,f16:column,f16:column,1,0,serial,1,1,heuristic,tensorop,f16,256,64,32,1,1,1,2,4,1,1,16,8,8,75,1024,2172649472,10102467723264,4649,51.3352,39.4162,196794
1,CUTLASS,gemm,cutlass_tensorop_h1688gemm_256x64_32x2_nn_align1,passed,success,universal,8192,43008,14336,f16:column,f16:column,f16:column,f16:column,1,0,serial,1,1,heuristic,tensorop,f16,256,64,32,1,1,1,2,4,1,1,16,8,8,75,1024,2172649472,10102467723264,4649,81.4515,24.8422,124030
1,CUTLASS,gemm,cutlass_tensorop_h1688gemm_64x128_32x2_nn_align8,passed,success,universal,8192,43008,14336,f16:column,f16:column,f16:column,f16:column,1,0,serial,1,1,heuristic,tensorop,f16,64,128,32,1,1,1,2,2,2,1,16,8,8,75,1024,2172649472,10102467723264,4649,50.1912,40.3146,201280
1,CUTLASS,gemm,cutlass_tensorop_h1688gemm_64x128_32x2_nn_align4,passed,success,universal,8192,43008,14336,f16:column,f16:column,f16:column,f16:column,1,0,serial,1,1,heuristic,tensorop,f16,64,128,32,1,1,1,2,2,2,1,16,8,8,75,1024,2172649472,10102467723264,4649,51.2897,39.4511,196969
1,CUTLASS,gemm,cutlass_tensorop_h1688gemm_64x128_32x2_nn_align2,passed,success,universal,8192,43008,14336,f16:column,f16:column,f16:column,f16:column,1,0,serial,1,1,heuristic,tensorop,f16,64,128,32,1,1,1,2,2,2,1,16,8,8,75,1024,2172649472,10102467723264,4649,55.7589,36.289,181181
1,CUTLASS,gemm,cutlass_tensorop_h1688gemm_64x128_32x2_nn_align1,passed,success,universal,8192,43008,14336,f16:column,f16:column,f16:column,f16:column,1,0,serial,1,1,heuristic,tensorop,f16,64,128,32,1,1,1,2,2,2,1,16,8,8,75,1024,2172649472,10102467723264,4649,77.9176,25.9689,129656
1,CUTLASS,gemm,cutlass_tensorop_h1688gemm_128x64_32x2_nn_align8,passed,success,universal,8192,43008,14336,f16:column,f16:column,f16:column,f16:column,1,0,serial,1,1,heuristic,tensorop,f16,128,64,32,1,1,1,2,2,2,1,16,8,8,75,1024,2172649472,10102467723264,4649,51.74,39.1078,195255
1,CUTLASS,gemm,cutlass_tensorop_h1688gemm_128x64_32x2_nn_align4,passed,success,universal,8192,43008,14336,f16:column,f16:column,f16:column,f16:column,1,0,serial,1,1,heuristic,tensorop,f16,128,64,32,1,1,1,2,2,2,1,16,8,8,75,1024,2172649472,10102467723264,4649,56.6039,35.7473,178477
1,CUTLASS,gemm,cutlass_tensorop_h1688gemm_128x64_32x2_nn_align2,passed,success,universal,8192,43008,14336,f16:column,f16:column,f16:column,f16:column,1,0,serial,1,1,heuristic,tensorop,f16,128,64,32,1,1,1,2,2,2,1,16,8,8,75,1024,2172649472,10102467723264,4649,60.9324,33.2079,165798
1,CUTLASS,gemm,cutlass_tensorop_h1688gemm_128x64_32x2_nn_align1,passed,success,universal,8192,43008,14336,f16:column,f16:column,f16:column,f16:column,1,0,serial,1,1,heuristic,tensorop,f16,128,64,32,1,1,1,2,2,2,1,16,8,8,75,1024,2172649472,10102467723264,4649,89.9554,22.4938,112305
1,CUTLASS,gemm,cutlass_tensorop_h1688gemm_64x64_32x2_nn_align8,passed,success,universal,8192,43008,14336,f16:column,f16:column,f16:column,f16:column,1,0,serial,1,1,heuristic,tensorop,f16,64,64,32,1,1,1,2,2,2,1,16,8,8,75,1024,2172649472,10102467723264,4649,65.6622,30.8159,153855
1,CUTLASS,gemm,cutlass_tensorop_h1688gemm_64x64_32x2_nn_align4,passed,success,universal,8192,43008,14336,f16:column,f16:column,f16:column,f16:column,1,0,serial,1,1,heuristic,tensorop,f16,64,64,32,1,1,1,2,2,2,1,16,8,8,75,1024,2172649472,10102467723264,4649,67.6297,29.9194,149379
1,CUTLASS,gemm,cutlass_tensorop_h1688gemm_64x64_32x2_nn_align2,passed,success,universal,8192,43008,14336,f16:column,f16:column,f16:column,f16:column,1,0,serial,1,1,heuristic,tensorop,f16,64,64,32,1,1,1,2,2,2,1,16,8,8,75,1024,2172649472,10102467723264,4649,74.6248,27.1148,135377
1,CUTLASS,gemm,cutlass_tensorop_h1688gemm_64x64_32x2_nn_align1,passed,success,universal,8192,43008,14336,f16:column,f16:column,f16:column,f16:column,1,0,serial,1,1,heuristic,tensorop,f16,64,64,32,1,1,1,2,2,2,1,16,8,8,75,1024,2172649472,10102467723264,4649,110.823,18.2582,91158.3
1,CUTLASS,gemm,cutlass_tensorop_h1688gemm_64x128_64x2_nn_align8,passed,success,universal,8192,43008,14336,f16:column,f16:column,f16:column,f16:column,1,0,serial,1,1,heuristic,tensorop,f16,64,128,64,1,1,1,2,1,2,2,16,8,8,75,1024,2172649472,10102467723264,4649,49.1622,41.1584,205492
1,CUTLASS,gemm,cutlass_tensorop_h1688gemm_64x128_64x2_nn_align4,passed,success,universal,8192,43008,14336,f16:column,f16:column,f16:column,f16:column,1,0,serial,1,1,heuristic,tensorop,f16,64,128,64,1,1,1,2,1,2,2,16,8,8,75,1024,2172649472,10102467723264,4649,48.9805,41.3111,206255
1,CUTLASS,gemm,cutlass_tensorop_h1688gemm_64x128_64x2_nn_align2,passed,success,universal,8192,43008,14336,f16:column,f16:column,f16:column,f16:column,1,0,serial,1,1,heuristic,tensorop,f16,64,128,64,1,1,1,2,1,2,2,16,8,8,75,1024,2172649472,10102467723264,4649,49.462,40.909,204247
1,CUTLASS,gemm,cutlass_tensorop_h1688gemm_64x128_64x2_nn_align1,passed,success,universal,8192,43008,14336,f16:column,f16:column,f16:column,f16:column,1,0,serial,1,1,heuristic,tensorop,f16,64,128,64,1,1,1,2,1,2,2,16,8,8,75,1024,2172649472,10102467723264,4649,67.7402,29.8706,149135
1,CUTLASS,gemm,cutlass_tensorop_h1688gemm_256x128_32x2_nt_align8,passed,success,universal,8192,43008,14336,f16:column,f16:row,f16:column,f16:column,1,0,serial,1,1,heuristic,tensorop,f16,256,128,32,1,1,1,2,4,2,1,16,8,8,75,1024,2172649472,10102467723264,4649,43.9918,45.9958,229645
1,CUTLASS,gemm,cutlass_tensorop_h1688gemm_256x128_32x2_nt_align4,passed,success,universal,8192,43008,14336,f16:column,f16:row,f16:column,f16:column,1,0,serial,1,1,heuristic,tensorop,f16,256,128,32,1,1,1,2,4,2,1,16,8,8,75,1024,2172649472,10102467723264,4649,49.9002,40.5497,202453
1,CUTLASS,gemm,cutlass_tensorop_h1688gemm_256x128_32x2_nt_align2,passed,success,universal,8192,43008,14336,f16:column,f16:row,f16:column,f16:column,1,0,serial,1,1,heuristic,tensorop,f16,256,128,32,1,1,1,2,4,2,1,16,8,8,75,1024,2172649472,10102467723264,4649,44.2827,45.6936,228136
1,CUTLASS,gemm,cutlass_tensorop_h1688gemm_256x128_32x2_nt_align1,passed,success,universal,8192,43008,14336,f16:column,f16:row,f16:column,f16:column,1,0,serial,1,1,heuristic,tensorop,f16,256,128,32,1,1,1,2,4,2,1,16,8,8,75,1024,2172649472,10102467723264,4649,52.4419,38.5844,192641
1,CUTLASS,gemm,cutlass_tensorop_h1688gemm_128x256_32x2_nt_align8,passed,success,universal,8192,43008,14336,f16:column,f16:row,f16:column,f16:column,1,0,serial,1,1,heuristic,tensorop,f16,128,256,32,1,1,1,2,2,4,1,16,8,8,75,1024,2172649472,10102467723264,4649,43.5541,46.458,231952
1,CUTLASS,gemm,cutlass_tensorop_h1688gemm_128x256_32x2_nt_align4,passed,success,universal,8192,43008,14336,f16:column,f16:row,f16:column,f16:column,1,0,serial,1,1,heuristic,tensorop,f16,128,256,32,1,1,1,2,2,4,1,16,8,8,75,1024,2172649472,10102467723264,4649,44.789,45.1771,225557
1,CUTLASS,gemm,cutlass_tensorop_h1688gemm_128x256_32x2_nt_align2,passed,success,universal,8192,43008,14336,f16:column,f16:row,f16:column,f16:column,1,0,serial,1,1,heuristic,tensorop,f16,128,256,32,1,1,1,2,2,4,1,16,8,8,75,1024,2172649472,10102467723264,4649,50.2688,40.2524,200969
1,CUTLASS,gemm,cutlass_tensorop_h1688gemm_128x256_32x2_nt_align1,passed,success,universal,8192,43008,14336,f16:column,f16:row,f16:column,f16:column,1,0,serial,1,1,heuristic,tensorop,f16,128,256,32,1,1,1,2,2,4,1,16,8,8,75,1024,2172649472,10102467723264,4649,53.8407,37.5819,187636
1,CUTLASS,gemm,cutlass_tensorop_h1688gemm_128x128_32x2_nt_align8,passed,success,universal,8192,43008,14336,f16:column,f16:row,f16:column,f16:column,1,0,serial,1,1,heuristic,tensorop,f16,128,128,32,1,1,1,2,2,2,1,16,8,8,75,1024,2172649472,10102467723264,4649,36.1245,56.0129,279657
1,CUTLASS,gemm,cutlass_tensorop_h1688gemm_128x128_32x2_nt_align4,passed,success,universal,8192,43008,14336,f16:column,f16:row,f16:column,f16:column,1,0,serial,1,1,heuristic,tensorop,f16,128,128,32,1,1,1,2,2,2,1,16,8,8,75,1024,2172649472,10102467723264,4649,42.5809,47.5199,237254
1,CUTLASS,gemm,cutlass_tensorop_h1688gemm_128x128_32x2_nt_align2,passed,success,universal,8192,43008,14336,f16:column,f16:row,f16:column,f16:column,1,0,serial,1,1,heuristic,tensorop,f16,128,128,32,1,1,1,2,2,2,1,16,8,8,75,1024,2172649472,10102467723264,4649,38.7543,52.2119,260680
1,CUTLASS,gemm,cutlass_tensorop_h1688gemm_128x128_32x2_nt_align1,passed,success,universal,8192,43008,14336,f16:column,f16:row,f16:column,f16:column,1,0,serial,1,1,heuristic,tensorop,f16,128,128,32,1,1,1,2,2,2,1,16,8,8,75,1024,2172649472,10102467723264,4649,49.9917,40.4755,202083
1,CUTLASS,gemm,cutlass_tensorop_h1688gemm_64x256_32x2_nt_align8,passed,success,universal,8192,43008,14336,f16:column,f16:row,f16:column,f16:column,1,0,serial,1,1,heuristic,tensorop,f16,64,256,32,1,1,1,2,1,4,1,16,8,8,75,1024,2172649472,10102467723264,4649,42.3479,47.7813,238559
1,CUTLASS,gemm,cutlass_tensorop_h1688gemm_64x256_32x2_nt_align4,passed,success,universal,8192,43008,14336,f16:column,f16:row,f16:column,f16:column,1,0,serial,1,1,heuristic,tensorop,f16,64,256,32,1,1,1,2,1,4,1,16,8,8,75,1024,2172649472,10102467723264,4649,44.926,45.0394,224869
1,CUTLASS,gemm,cutlass_tensorop_h1688gemm_64x256_32x2_nt_align2,passed,success,universal,8192,43008,14336,f16:column,f16:row,f16:column,f16:column,1,0,serial,1,1,heuristic,tensorop,f16,64,256,32,1,1,1,2,1,4,1,16,8,8,75,1024,2172649472,10102467723264,4649,47.3106,42.7692,213535
1,CUTLASS,gemm,cutlass_tensorop_h1688gemm_64x256_32x2_nt_align1,passed,success,universal,8192,43008,14336,f16:column,f16:row,f16:column,f16:column,1,0,serial,1,1,heuristic,tensorop,f16,64,256,32,1,1,1,2,1,4,1,16,8,8,75,1024,2172649472,10102467723264,4649,56.3621,35.9007,179242
1,CUTLASS,gemm,cutlass_tensorop_h1688gemm_256x64_32x2_nt_align8,passed,success,universal,8192,43008,14336,f16:column,f16:row,f16:column,f16:column,1,0,serial,1,1,heuristic,tensorop,f16,256,64,32,1,1,1,2,4,1,1,16,8,8,75,1024,2172649472,10102467723264,4649,46.3314,43.6731,218048
1,CUTLASS,gemm,cutlass_tensorop_h1688gemm_256x64_32x2_nt_align4,passed,success,universal,8192,43008,14336,f16:column,f16:row,f16:column,f16:column,1,0,serial,1,1,heuristic,tensorop,f16,256,64,32,1,1,1,2,4,1,1,16,8,8,75,1024,2172649472,10102467723264,4649,49.3119,41.0334,204869
1,CUTLASS,gemm,cutlass_tensorop_h1688gemm_256x64_32x2_nt_align2,passed,success,universal,8192,43008,14336,f16:column,f16:row,f16:column,f16:column,1,0,serial,1,1,heuristic,tensorop,f16,256,64,32,1,1,1,2,4,1,1,16,8,8,75,1024,2172649472,10102467723264,4649,49.2237,41.107,205236
1,CUTLASS,gemm,cutlass_tensorop_h1688gemm_256x64_32x2_nt_align1,passed,success,universal,8192,43008,14336,f16:column,f16:row,f16:column,f16:column,1,0,serial,1,1,heuristic,tensorop,f16,256,64,32,1,1,1,2,4,1,1,16,8,8,75,1024,2172649472,10102467723264,4649,59.0662,34.2571,171036
1,CUTLASS,gemm,cutlass_tensorop_h1688gemm_64x128_32x2_nt_align8,passed,success,universal,8192,43008,14336,f16:column,f16:row,f16:column,f16:column,1,0,serial,1,1,heuristic,tensorop,f16,64,128,32,1,1,1,2,2,2,1,16,8,8,75,1024,2172649472,10102467723264,4649,49.5853,40.8072,203739
1,CUTLASS,gemm,cutlass_tensorop_h1688gemm_64x128_32x2_nt_align4,passed,success,universal,8192,43008,14336,f16:column,f16:row,f16:column,f16:column,1,0,serial,1,1,heuristic,tensorop,f16,64,128,32,1,1,1,2,2,2,1,16,8,8,75,1024,2172649472,10102467723264,4649,50.1536,40.3448,201431
1,CUTLASS,gemm,cutlass_tensorop_h1688gemm_64x128_32x2_nt_align2,passed,success,universal,8192,43008,14336,f16:column,f16:row,f16:column,f16:column,1,0,serial,1,1,heuristic,tensorop,f16,64,128,32,1,1,1,2,2,2,1,16,8,8,75,1024,2172649472,10102467723264,4649,52.8876,38.2592,191018
1,CUTLASS,gemm,cutlass_tensorop_h1688gemm_64x128_32x2_nt_align1,passed,success,universal,8192,43008,14336,f16:column,f16:row,f16:column,f16:column,1,0,serial,1,1,heuristic,tensorop,f16,64,128,32,1,1,1,2,2,2,1,16,8,8,75,1024,2172649472,10102467723264,4649,65.3787,30.9495,154522
1,CUTLASS,gemm,cutlass_tensorop_h1688gemm_128x64_32x2_nt_align8,passed,success,universal,8192,43008,14336,f16:column,f16:row,f16:column,f16:column,1,0,serial,1,1,heuristic,tensorop,f16,128,64,32,1,1,1,2,2,2,1,16,8,8,75,1024,2172649472,10102467723264,4649,50.2629,40.257,200992
1,CUTLASS,gemm,cutlass_tensorop_h1688gemm_128x64_32x2_nt_align4,passed,success,universal,8192,43008,14336,f16:column,f16:row,f16:column,f16:column,1,0,serial,1,1,heuristic,tensorop,f16,128,64,32,1,1,1,2,2,2,1,16,8,8,75,1024,2172649472,10102467723264,4649,51.1568,39.5536,197480
1,CUTLASS,gemm,cutlass_tensorop_h1688gemm_128x64_32x2_nt_align2,passed,success,universal,8192,43008,14336,f16:column,f16:row,f16:column,f16:column,1,0,serial,1,1,heuristic,tensorop,f16,128,64,32,1,1,1,2,2,2,1,16,8,8,75,1024,2172649472,10102467723264,4649,52.662,38.4231,191836
1,CUTLASS,gemm,cutlass_tensorop_h1688gemm_128x64_32x2_nt_align1,passed,success,universal,8192,43008,14336,f16:column,f16:row,f16:column,f16:column,1,0,serial,1,1,heuristic,tensorop,f16,128,64,32,1,1,1,2,2,2,1,16,8,8,75,1024,2172649472,10102467723264,4649,66.3171,30.5115,152336
1,CUTLASS,gemm,cutlass_tensorop_h1688gemm_64x64_32x2_nt_align8,passed,success,universal,8192,43008,14336,f16:column,f16:row,f16:column,f16:column,1,0,serial,1,1,heuristic,tensorop,f16,64,64,32,1,1,1,2,2,2,1,16,8,8,75,1024,2172649472,10102467723264,4649,63.7759,31.7273,158406
1,CUTLASS,gemm,cutlass_tensorop_h1688gemm_64x64_32x2_nt_align4,passed,success,universal,8192,43008,14336,f16:column,f16:row,f16:column,f16:column,1,0,serial,1,1,heuristic,tensorop,f16,64,64,32,1,1,1,2,2,2,1,16,8,8,75,1024,2172649472,10102467723264,4649,65.1008,31.0816,155182
1,CUTLASS,gemm,cutlass_tensorop_h1688gemm_64x64_32x2_nt_align2,passed,success,universal,8192,43008,14336,f16:column,f16:row,f16:column,f16:column,1,0,serial,1,1,heuristic,tensorop,f16,64,64,32,1,1,1,2,2,2,1,16,8,8,75,1024,2172649472,10102467723264,4649,67.4591,29.995,149757
1,CUTLASS,gemm,cutlass_tensorop_h1688gemm_64x64_32x2_nt_align1,passed,success,universal,8192,43008,14336,f16:column,f16:row,f16:column,f16:column,1,0,serial,1,1,heuristic,tensorop,f16,64,64,32,1,1,1,2,2,2,1,16,8,8,75,1024,2172649472,10102467723264,4649,86.7028,23.3376,116518
1,CUTLASS,gemm,cutlass_tensorop_h1688gemm_64x128_64x2_nt_align8,passed,success,universal,8192,43008,14336,f16:column,f16:row,f16:column,f16:column,1,0,serial,1,1,heuristic,tensorop,f16,64,128,64,1,1,1,2,1,2,2,16,8,8,75,1024,2172649472,10102467723264,4649,48.994,41.2997,206198
1,CUTLASS,gemm,cutlass_tensorop_h1688gemm_64x128_64x2_nt_align4,passed,success,universal,8192,43008,14336,f16:column,f16:row,f16:column,f16:column,1,0,serial,1,1,heuristic,tensorop,f16,64,128,64,1,1,1,2,1,2,2,16,8,8,75,1024,2172649472,10102467723264,4649,49.0374,41.2631,206016
1,CUTLASS,gemm,cutlass_tensorop_h1688gemm_64x128_64x2_nt_align2,passed,success,universal,8192,43008,14336,f16:column,f16:row,f16:column,f16:column,1,0,serial,1,1,heuristic,tensorop,f16,64,128,64,1,1,1,2,1,2,2,16,8,8,75,1024,2172649472,10102467723264,4649,49.7645,40.6603,203006
1,CUTLASS,gemm,cutlass_tensorop_h1688gemm_64x128_64x2_nt_align1,passed,success,universal,8192,43008,14336,f16:column,f16:row,f16:column,f16:column,1,0,serial,1,1,heuristic,tensorop,f16,64,128,64,1,1,1,2,1,2,2,16,8,8,75,1024,2172649472,10102467723264,4649,73.7944,27.4199,136900
1,CUTLASS,gemm,cutlass_tensorop_h1688gemm_256x128_32x2_tn_align8,passed,success,universal,8192,43008,14336,f16:row,f16:column,f16:column,f16:column,1,0,serial,1,1,heuristic,tensorop,f16,256,128,32,1,1,1,2,4,2,1,16,8,8,75,1024,2172649472,10102467723264,4649,43.4719,46.5459,232391
1,CUTLASS,gemm,cutlass_tensorop_h1688gemm_256x128_32x2_tn_align4,passed,success,universal,8192,43008,14336,f16:row,f16:column,f16:column,f16:column,1,0,serial,1,1,heuristic,tensorop,f16,256,128,32,1,1,1,2,4,2,1,16,8,8,75,1024,2172649472,10102467723264,4649,47.7255,42.3974,211679
1,CUTLASS,gemm,cutlass_tensorop_h1688gemm_256x128_32x2_tn_align2,passed,success,universal,8192,43008,14336,f16:row,f16:column,f16:column,f16:column,1,0,serial,1,1,heuristic,tensorop,f16,256,128,32,1,1,1,2,4,2,1,16,8,8,75,1024,2172649472,10102467723264,4649,56.532,35.7928,178704
1,CUTLASS,gemm,cutlass_tensorop_h1688gemm_256x128_32x2_tn_align1,passed,success,universal,8192,43008,14336,f16:row,f16:column,f16:column,f16:column,1,0,serial,1,1,heuristic,tensorop,f16,256,128,32,1,1,1,2,4,2,1,16,8,8,75,1024,2172649472,10102467723264,4649,67.7725,29.8563,149064
1,CUTLASS,gemm,cutlass_tensorop_h1688gemm_128x256_32x2_tn_align8,passed,success,universal,8192,43008,14336,f16:row,f16:column,f16:column,f16:column,1,0,serial,1,1,heuristic,tensorop,f16,128,256,32,1,1,1,2,2,4,1,16,8,8,75,1024,2172649472,10102467723264,4649,44.7582,45.2082,225712
1,CUTLASS,gemm,cutlass_tensorop_h1688gemm_128x256_32x2_tn_align4,passed,success,universal,8192,43008,14336,f16:row,f16:column,f16:column,f16:column,1,0,serial,1,1,heuristic,tensorop,f16,128,256,32,1,1,1,2,2,4,1,16,8,8,75,1024,2172649472,10102467723264,4649,44.241,45.7367,228351
1,CUTLASS,gemm,cutlass_tensorop_h1688gemm_128x256_32x2_tn_align2,passed,success,universal,8192,43008,14336,f16:row,f16:column,f16:column,f16:column,1,0,serial,1,1,heuristic,tensorop,f16,128,256,32,1,1,1,2,2,4,1,16,8,8,75,1024,2172649472,10102467723264,4649,48.7695,41.4898,207147
1,CUTLASS,gemm,cutlass_tensorop_h1688gemm_128x256_32x2_tn_align1,passed,success,universal,8192,43008,14336,f16:row,f16:column,f16:column,f16:column,1,0,serial,1,1,heuristic,tensorop,f16,128,256,32,1,1,1,2,2,4,1,16,8,8,75,1024,2172649472,10102467723264,4649,68.8704,29.3803,146688
1,CUTLASS,gemm,cutlass_tensorop_h1688gemm_128x128_32x2_tn_align8,passed,success,universal,8192,43008,14336,f16:row,f16:column,f16:column,f16:column,1,0,serial,1,1,heuristic,tensorop,f16,128,128,32,1,1,1,2,2,2,1,16,8,8,75,1024,2172649472,10102467723264,4649,39.7212,50.941,254335
1,CUTLASS,gemm,cutlass_tensorop_h1688gemm_128x128_32x2_tn_align4,passed,success,universal,8192,43008,14336,f16:row,f16:column,f16:column,f16:column,1,0,serial,1,1,heuristic,tensorop,f16,128,128,32,1,1,1,2,2,2,1,16,8,8,75,1024,2172649472,10102467723264,4649,46.0591,43.9313,219337
1,CUTLASS,gemm,cutlass_tensorop_h1688gemm_128x128_32x2_tn_align2,passed,success,universal,8192,43008,14336,f16:row,f16:column,f16:column,f16:column,1,0,serial,1,1,heuristic,tensorop,f16,128,128,32,1,1,1,2,2,2,1,16,8,8,75,1024,2172649472,10102467723264,4649,46.6883,43.3393,216381
1,CUTLASS,gemm,cutlass_tensorop_h1688gemm_128x128_32x2_tn_align1,passed,success,universal,8192,43008,14336,f16:row,f16:column,f16:column,f16:column,1,0,serial,1,1,heuristic,tensorop,f16,128,128,32,1,1,1,2,2,2,1,16,8,8,75,1024,2172649472,10102467723264,4649,69.9259,28.9369,144474
1,CUTLASS,gemm,cutlass_tensorop_h1688gemm_64x256_32x2_tn_align8,passed,success,universal,8192,43008,14336,f16:row,f16:column,f16:column,f16:column,1,0,serial,1,1,heuristic,tensorop,f16,64,256,32,1,1,1,2,1,4,1,16,8,8,75,1024,2172649472,10102467723264,4649,46.2167,43.7815,218589
1,CUTLASS,gemm,cutlass_tensorop_h1688gemm_64x256_32x2_tn_align4,passed,success,universal,8192,43008,14336,f16:row,f16:column,f16:column,f16:column,1,0,serial,1,1,heuristic,tensorop,f16,64,256,32,1,1,1,2,1,4,1,16,8,8,75,1024,2172649472,10102467723264,4649,47.6909,42.4282,211832
1,CUTLASS,gemm,cutlass_tensorop_h1688gemm_64x256_32x2_tn_align2,passed,success,universal,8192,43008,14336,f16:row,f16:column,f16:column,f16:column,1,0,serial,1,1,heuristic,tensorop,f16,64,256,32,1,1,1,2,1,4,1,16,8,8,75,1024,2172649472,10102467723264,4649,54.3314,37.2425,185942
1,CUTLASS,gemm,cutlass_tensorop_h1688gemm_64x256_32x2_tn_align1,passed,success,universal,8192,43008,14336,f16:row,f16:column,f16:column,f16:column,1,0,serial,1,1,heuristic,tensorop,f16,64,256,32,1,1,1,2,1,4,1,16,8,8,75,1024,2172649472,10102467723264,4649,86.2794,23.4522,117090
1,CUTLASS,gemm,cutlass_tensorop_h1688gemm_256x64_32x2_tn_align8,passed,success,universal,8192,43008,14336,f16:row,f16:column,f16:column,f16:column,1,0,serial,1,1,heuristic,tensorop,f16,256,64,32,1,1,1,2,4,1,1,16,8,8,75,1024,2172649472,10102467723264,4649,48.0054,42.1502,210444
1,CUTLASS,gemm,cutlass_tensorop_h1688gemm_256x64_32x2_tn_align4,passed,success,universal,8192,43008,14336,f16:row,f16:column,f16:column,f16:column,1,0,serial,1,1,heuristic,tensorop,f16,256,64,32,1,1,1,2,4,1,1,16,8,8,75,1024,2172649472,10102467723264,4649,53.4493,37.8571,189010
1,CUTLASS,gemm,cutlass_tensorop_h1688gemm_256x64_32x2_tn_align2,passed,success,universal,8192,43008,14336,f16:row,f16:column,f16:column,f16:column,1,0,serial,1,1,heuristic,tensorop,f16,256,64,32,1,1,1,2,4,1,1,16,8,8,75,1024,2172649472,10102467723264,4649,54.5418,37.0988,185224
1,CUTLASS,gemm,cutlass_tensorop_h1688gemm_256x64_32x2_tn_align1,passed,success,universal,8192,43008,14336,f16:row,f16:column,f16:column,f16:column,1,0,serial,1,1,heuristic,tensorop,f16,256,64,32,1,1,1,2,4,1,1,16,8,8,75,1024,2172649472,10102467723264,4649,84.8867,23.8369,119011
1,CUTLASS,gemm,cutlass_tensorop_h1688gemm_64x128_32x2_tn_align8,passed,success,universal,8192,43008,14336,f16:row,f16:column,f16:column,f16:column,1,0,serial,1,1,heuristic,tensorop,f16,64,128,32,1,1,1,2,2,2,1,16,8,8,75,1024,2172649472,10102467723264,4649,51.2931,39.4485,196956
1,CUTLASS,gemm,cutlass_tensorop_h1688gemm_64x128_32x2_tn_align4,passed,success,universal,8192,43008,14336,f16:row,f16:column,f16:column,f16:column,1,0,serial,1,1,heuristic,tensorop,f16,64,128,32,1,1,1,2,2,2,1,16,8,8,75,1024,2172649472,10102467723264,4649,66.1092,30.6075,152815
1,CUTLASS,gemm,cutlass_tensorop_h1688gemm_64x128_32x2_tn_align2,passed,success,universal,8192,43008,14336,f16:row,f16:column,f16:column,f16:column,1,0,serial,1,1,heuristic,tensorop,f16,64,128,32,1,1,1,2,2,2,1,16,8,8,75,1024,2172649472,10102467723264,4649,64.1297,31.5522,157532
1,CUTLASS,gemm,cutlass_tensorop_h1688gemm_64x128_32x2_tn_align1,passed,success,universal,8192,43008,14336,f16:row,f16:column,f16:column,f16:column,1,0,serial,1,1,heuristic,tensorop,f16,64,128,32,1,1,1,2,2,2,1,16,8,8,75,1024,2172649472,10102467723264,4649,100.874,20.0591,100150
1,CUTLASS,gemm,cutlass_tensorop_h1688gemm_128x64_32x2_tn_align8,passed,success,universal,8192,43008,14336,f16:row,f16:column,f16:column,f16:column,1,0,serial,1,1,heuristic,tensorop,f16,128,64,32,1,1,1,2,2,2,1,16,8,8,75,1024,2172649472,10102467723264,4649,52.4252,38.5966,192702
1,CUTLASS,gemm,cutlass_tensorop_h1688gemm_128x64_32x2_tn_align4,passed,success,universal,8192,43008,14336,f16:row,f16:column,f16:column,f16:column,1,0,serial,1,1,heuristic,tensorop,f16,128,64,32,1,1,1,2,2,2,1,16,8,8,75,1024,2172649472,10102467723264,4649,59.1437,34.2122,170812
1,CUTLASS,gemm,cutlass_tensorop_h1688gemm_128x64_32x2_tn_align2,passed,success,universal,8192,43008,14336,f16:row,f16:column,f16:column,f16:column,1,0,serial,1,1,heuristic,tensorop,f16,128,64,32,1,1,1,2,2,2,1,16,8,8,75,1024,2172649472,10102467723264,4649,69.1161,29.2759,146167
1,CUTLASS,gemm,cutlass_tensorop_h1688gemm_128x64_32x2_tn_align1,passed,success,universal,8192,43008,14336,f16:row,f16:column,f16:column,f16:column,1,0,serial,1,1,heuristic,tensorop,f16,128,64,32,1,1,1,2,2,2,1,16,8,8,75,1024,2172649472,10102467723264,4649,101.824,19.8719,99214.9
1,CUTLASS,gemm,cutlass_tensorop_h1688gemm_64x64_32x2_tn_align8,passed,success,universal,8192,43008,14336,f16:row,f16:column,f16:column,f16:column,1,0,serial,1,1,heuristic,tensorop,f16,64,64,32,1,1,1,2,2,2,1,16,8,8,75,1024,2172649472,10102467723264,4649,67.086,30.1618,150590
1,CUTLASS,gemm,cutlass_tensorop_h1688gemm_64x64_32x2_tn_align4,passed,success,universal,8192,43008,14336,f16:row,f16:column,f16:column,f16:column,1,0,serial,1,1,heuristic,tensorop,f16,64,64,32,1,1,1,2,2,2,1,16,8,8,75,1024,2172649472,10102467723264,4649,76.9812,26.2848,131233
1,CUTLASS,gemm,cutlass_tensorop_h1688gemm_64x64_32x2_tn_align2,passed,success,universal,8192,43008,14336,f16:row,f16:column,f16:column,f16:column,1,0,serial,1,1,heuristic,tensorop,f16,64,64,32,1,1,1,2,2,2,1,16,8,8,75,1024,2172649472,10102467723264,4649,87.1203,23.2258,115960
1,CUTLASS,gemm,cutlass_tensorop_h1688gemm_64x64_32x2_tn_align1,passed,success,universal,8192,43008,14336,f16:row,f16:column,f16:column,f16:column,1,0,serial,1,1,heuristic,tensorop,f16,64,64,32,1,1,1,2,2,2,1,16,8,8,75,1024,2172649472,10102467723264,4649,135.866,14.8929,74356
1,CUTLASS,gemm,cutlass_tensorop_h1688gemm_64x128_64x2_tn_align8,passed,success,universal,8192,43008,14336,f16:row,f16:column,f16:column,f16:column,1,0,serial,1,1,heuristic,tensorop,f16,64,128,64,1,1,1,2,1,2,2,16,8,8,75,1024,2172649472,10102467723264,4649,48.0347,42.1245,210316
1,CUTLASS,gemm,cutlass_tensorop_h1688gemm_64x128_64x2_tn_align4,passed,success,universal,8192,43008,14336,f16:row,f16:column,f16:column,f16:column,1,0,serial,1,1,heuristic,tensorop,f16,64,128,64,1,1,1,2,1,2,2,16,8,8,75,1024,2172649472,10102467723264,4649,48.491,41.7281,208337
1,CUTLASS,gemm,cutlass_tensorop_h1688gemm_64x128_64x2_tn_align2,passed,success,universal,8192,43008,14336,f16:row,f16:column,f16:column,f16:column,1,0,serial,1,1,heuristic,tensorop,f16,64,128,64,1,1,1,2,1,2,2,16,8,8,75,1024,2172649472,10102467723264,4649,49.066,41.2391,205896
1,CUTLASS,gemm,cutlass_tensorop_h1688gemm_64x128_64x2_tn_align1,passed,success,universal,8192,43008,14336,f16:row,f16:column,f16:column,f16:column,1,0,serial,1,1,heuristic,tensorop,f16,64,128,64,1,1,1,2,1,2,2,16,8,8,75,1024,2172649472,10102467723264,4649,61.4261,32.941,164465
1,CUTLASS,gemm,cutlass_tensorop_h1688gemm_256x128_32x2_tt_align8,passed,success,universal,8192,43008,14336,f16:row,f16:row,f16:column,f16:column,1,0,serial,1,1,heuristic,tensorop,f16,256,128,32,1,1,1,2,4,2,1,16,8,8,75,1024,2172649472,10102467723264,4649,43.9637,46.0252,229791
1,CUTLASS,gemm,cutlass_tensorop_h1688gemm_256x128_32x2_tt_align4,passed,success,universal,8192,43008,14336,f16:row,f16:row,f16:column,f16:column,1,0,serial,1,1,heuristic,tensorop,f16,256,128,32,1,1,1,2,4,2,1,16,8,8,75,1024,2172649472,10102467723264,4649,49.4627,40.9084,204244
1,CUTLASS,gemm,cutlass_tensorop_h1688gemm_256x128_32x2_tt_align2,passed,success,universal,8192,43008,14336,f16:row,f16:row,f16:column,f16:column,1,0,serial,1,1,heuristic,tensorop,f16,256,128,32,1,1,1,2,4,2,1,16,8,8,75,1024,2172649472,10102467723264,4649,46.4534,43.5585,217476
1,CUTLASS,gemm,cutlass_tensorop_h1688gemm_256x128_32x2_tt_align1,passed,success,universal,8192,43008,14336,f16:row,f16:row,f16:column,f16:column,1,0,serial,1,1,heuristic,tensorop,f16,256,128,32,1,1,1,2,4,2,1,16,8,8,75,1024,2172649472,10102467723264,4649,50.5637,40.0176,199797
1,CUTLASS,gemm,cutlass_tensorop_h1688gemm_128x256_32x2_tt_align8,passed,success,universal,8192,43008,14336,f16:row,f16:row,f16:column,f16:column,1,0,serial,1,1,heuristic,tensorop,f16,128,256,32,1,1,1,2,2,4,1,16,8,8,75,1024,2172649472,10102467723264,4649,42.3615,47.7659,238482
1,CUTLASS,gemm,cutlass_tensorop_h1688gemm_128x256_32x2_tt_align4,passed,success,universal,8192,43008,14336,f16:row,f16:row,f16:column,f16:column,1,0,serial,1,1,heuristic,tensorop,f16,128,256,32,1,1,1,2,2,4,1,16,8,8,75,1024,2172649472,10102467723264,4649,48.365,41.8369,208880
1,CUTLASS,gemm,cutlass_tensorop_h1688gemm_128x256_32x2_tt_align2,passed,success,universal,8192,43008,14336,f16:row,f16:row,f16:column,f16:column,1,0,serial,1,1,heuristic,tensorop,f16,128,256,32,1,1,1,2,2,4,1,16,8,8,75,1024,2172649472,10102467723264,4649,49.3858,40.9721,204562
1,CUTLASS,gemm,cutlass_tensorop_h1688gemm_128x256_32x2_tt_align1,passed,success,universal,8192,43008,14336,f16:row,f16:row,f16:column,f16:column,1,0,serial,1,1,heuristic,tensorop,f16,128,256,32,1,1,1,2,2,4,1,16,8,8,75,1024,2172649472,10102467723264,4649,60.5683,33.4076,166795
1,CUTLASS,gemm,cutlass_tensorop_h1688gemm_128x128_32x2_tt_align8,passed,success,universal,8192,43008,14336,f16:row,f16:row,f16:column,f16:column,1,0,serial,1,1,heuristic,tensorop,f16,128,128,32,1,1,1,2,2,2,1,16,8,8,75,1024,2172649472,10102467723264,4649,37.3619,54.1578,270395
1,CUTLASS,gemm,cutlass_tensorop_h1688gemm_128x128_32x2_tt_align4,passed,success,universal,8192,43008,14336,f16:row,f16:row,f16:column,f16:column,1,0,serial,1,1,heuristic,tensorop,f16,128,128,32,1,1,1,2,2,2,1,16,8,8,75,1024,2172649472,10102467723264,4649,42.5888,47.5111,237210
1,CUTLASS,gemm,cutlass_tensorop_h1688gemm_128x128_32x2_tt_align2,passed,success,universal,8192,43008,14336,f16:row,f16:row,f16:column,f16:column,1,0,serial,1,1,heuristic,tensorop,f16,128,128,32,1,1,1,2,2,2,1,16,8,8,75,1024,2172649472,10102467723264,4649,43.0717,46.9784,234550
1,CUTLASS,gemm,cutlass_tensorop_h1688gemm_128x128_32x2_tt_align1,passed,success,universal,8192,43008,14336,f16:row,f16:row,f16:column,f16:column,1,0,serial,1,1,heuristic,tensorop,f16,128,128,32,1,1,1,2,2,2,1,16,8,8,75,1024,2172649472,10102467723264,4649,56.6831,35.6974,178227
1,CUTLASS,gemm,cutlass_tensorop_h1688gemm_64x256_32x2_tt_align8,passed,success,universal,8192,43008,14336,f16:row,f16:row,f16:column,f16:column,1,0,serial,1,1,heuristic,tensorop,f16,64,256,32,1,1,1,2,1,4,1,16,8,8,75,1024,2172649472,10102467723264,4649,44.7639,45.2024,225683
1,CUTLASS,gemm,cutlass_tensorop_h1688gemm_64x256_32x2_tt_align4,passed,success,universal,8192,43008,14336,f16:row,f16:row,f16:column,f16:column,1,0,serial,1,1,heuristic,tensorop,f16,64,256,32,1,1,1,2,1,4,1,16,8,8,75,1024,2172649472,10102467723264,4649,50.1082,40.3814,201613
1,CUTLASS,gemm,cutlass_tensorop_h1688gemm_64x256_32x2_tt_align2,passed,success,universal,8192,43008,14336,f16:row,f16:row,f16:column,f16:column,1,0,serial,1,1,heuristic,tensorop,f16,64,256,32,1,1,1,2,1,4,1,16,8,8,75,1024,2172649472,10102467723264,4649,53.8217,37.5952,187702
1,CUTLASS,gemm,cutlass_tensorop_h1688gemm_64x256_32x2_tt_align1,passed,success,universal,8192,43008,14336,f16:row,f16:row,f16:column,f16:column,1,0,serial,1,1,heuristic,tensorop,f16,64,256,32,1,1,1,2,1,4,1,16,8,8,75,1024,2172649472,10102467723264,4649,79.7115,25.3845,126738
1,CUTLASS,gemm,cutlass_tensorop_h1688gemm_256x64_32x2_tt_align8,passed,success,universal,8192,43008,14336,f16:row,f16:row,f16:column,f16:column,1,0,serial,1,1,heuristic,tensorop,f16,256,64,32,1,1,1,2,4,1,1,16,8,8,75,1024,2172649472,10102467723264,4649,44.6795,45.2879,226110
1,CUTLASS,gemm,cutlass_tensorop_h1688gemm_256x64_32x2_tt_align4,passed,success,universal,8192,43008,14336,f16:row,f16:row,f16:column,f16:column,1,0,serial,1,1,heuristic,tensorop,f16,256,64,32,1,1,1,2,4,1,1,16,8,8,75,1024,2172649472,10102467723264,4649,48.9313,41.3526,206462
1,CUTLASS,gemm,cutlass_tensorop_h1688gemm_256x64_32x2_tt_align2,passed,success,universal,8192,43008,14336,f16:row,f16:row,f16:column,f16:column,1,0,serial,1,1,heuristic,tensorop,f16,256,64,32,1,1,1,2,4,1,1,16,8,8,75,1024,2172649472,10102467723264,4649,51.2645,39.4705,197066
1,CUTLASS,gemm,cutlass_tensorop_h1688gemm_256x64_32x2_tt_align1,passed,success,universal,8192,43008,14336,f16:row,f16:row,f16:column,f16:column,1,0,serial,1,1,heuristic,tensorop,f16,256,64,32,1,1,1,2,4,1,1,16,8,8,75,1024,2172649472,10102467723264,4649,62.173,32.5453,162490
1,CUTLASS,gemm,cutlass_tensorop_h1688gemm_64x128_32x2_tt_align8,passed,success,universal,8192,43008,14336,f16:row,f16:row,f16:column,f16:column,1,0,serial,1,1,heuristic,tensorop,f16,64,128,32,1,1,1,2,2,2,1,16,8,8,75,1024,2172649472,10102467723264,4649,50.4499,40.1078,200247
1,CUTLASS,gemm,cutlass_tensorop_h1688gemm_64x128_32x2_tt_align4,passed,success,universal,8192,43008,14336,f16:row,f16:row,f16:column,f16:column,1,0,serial,1,1,heuristic,tensorop,f16,64,128,32,1,1,1,2,2,2,1,16,8,8,75,1024,2172649472,10102467723264,4649,64.2968,31.4703,157123
1,CUTLASS,gemm,cutlass_tensorop_h1688gemm_64x128_32x2_tt_align2,passed,success,universal,8192,43008,14336,f16:row,f16:row,f16:column,f16:column,1,0,serial,1,1,heuristic,tensorop,f16,64,128,32,1,1,1,2,2,2,1,16,8,8,75,1024,2172649472,10102467723264,4649,58.4887,34.5954,172725
1,CUTLASS,gemm,cutlass_tensorop_h1688gemm_64x128_32x2_tt_align1,passed,success,universal,8192,43008,14336,f16:row,f16:row,f16:column,f16:column,1,0,serial,1,1,heuristic,tensorop,f16,64,128,32,1,1,1,2,2,2,1,16,8,8,75,1024,2172649472,10102467723264,4649,89.1777,22.6899,113285
1,CUTLASS,gemm,cutlass_tensorop_h1688gemm_128x64_32x2_tt_align8,passed,success,universal,8192,43008,14336,f16:row,f16:row,f16:column,f16:column,1,0,serial,1,1,heuristic,tensorop,f16,128,64,32,1,1,1,2,2,2,1,16,8,8,75,1024,2172649472,10102467723264,4649,50.7607,39.8623,199021
1,CUTLASS,gemm,cutlass_tensorop_h1688gemm_128x64_32x2_tt_align4,passed,success,universal,8192,43008,14336,f16:row,f16:row,f16:column,f16:column,1,0,serial,1,1,heuristic,tensorop,f16,128,64,32,1,1,1,2,2,2,1,16,8,8,75,1024,2172649472,10102467723264,4649,53.4647,37.8462,188956
1,CUTLASS,gemm,cutlass_tensorop_h1688gemm_128x64_32x2_tt_align2,passed,success,universal,8192,43008,14336,f16:row,f16:row,f16:column,f16:column,1,0,serial,1,1,heuristic,tensorop,f16,128,64,32,1,1,1,2,2,2,1,16,8,8,75,1024,2172649472,10102467723264,4649,55.8555,36.2263,180868
1,CUTLASS,gemm,cutlass_tensorop_h1688gemm_128x64_32x2_tt_align1,passed,success,universal,8192,43008,14336,f16:row,f16:row,f16:column,f16:column,1,0,serial,1,1,heuristic,tensorop,f16,128,64,32,1,1,1,2,2,2,1,16,8,8,75,1024,2172649472,10102467723264,4649,79.3911,25.4869,127249
1,CUTLASS,gemm,cutlass_tensorop_h1688gemm_64x64_32x2_tt_align8,passed,success,universal,8192,43008,14336,f16:row,f16:row,f16:column,f16:column,1,0,serial,1,1,heuristic,tensorop,f16,64,64,32,1,1,1,2,2,2,1,16,8,8,75,1024,2172649472,10102467723264,4649,64.8886,31.1832,155689
1,CUTLASS,gemm,cutlass_tensorop_h1688gemm_64x64_32x2_tt_align4,passed,success,universal,8192,43008,14336,f16:row,f16:row,f16:column,f16:column,1,0,serial,1,1,heuristic,tensorop,f16,64,64,32,1,1,1,2,2,2,1,16,8,8,75,1024,2172649472,10102467723264,4649,66.8462,30.27,151130
1,CUTLASS,gemm,cutlass_tensorop_h1688gemm_64x64_32x2_tt_align2,passed,success,universal,8192,43008,14336,f16:row,f16:row,f16:column,f16:column,1,0,serial,1,1,heuristic,tensorop,f16,64,64,32,1,1,1,2,2,2,1,16,8,8,75,1024,2172649472,10102467723264,4649,76.1311,26.5783,132698
1,CUTLASS,gemm,cutlass_tensorop_h1688gemm_64x64_32x2_tt_align1,passed,success,universal,8192,43008,14336,f16:row,f16:row,f16:column,f16:column,1,0,serial,1,1,heuristic,tensorop,f16,64,64,32,1,1,1,2,2,2,1,16,8,8,75,1024,2172649472,10102467723264,4649,110.893,18.2468,91101.2
1,CUTLASS,gemm,cutlass_tensorop_h1688gemm_64x128_64x2_tt_align8,passed,success,universal,8192,43008,14336,f16:row,f16:row,f16:column,f16:column,1,0,serial,1,1,heuristic,tensorop,f16,64,128,64,1,1,1,2,1,2,2,16,8,8,75,1024,2172649472,10102467723264,4649,48.448,41.7651,208522
1,CUTLASS,gemm,cutlass_tensorop_h1688gemm_64x128_64x2_tt_align4,passed,success,universal,8192,43008,14336,f16:row,f16:row,f16:column,f16:column,1,0,serial,1,1,heuristic,tensorop,f16,64,128,64,1,1,1,2,1,2,2,16,8,8,75,1024,2172649472,10102467723264,4649,49.3452,41.0058,204730
1,CUTLASS,gemm,cutlass_tensorop_h1688gemm_64x128_64x2_tt_align2,passed,success,universal,8192,43008,14336,f16:row,f16:row,f16:column,f16:column,1,0,serial,1,1,heuristic,tensorop,f16,64,128,64,1,1,1,2,1,2,2,16,8,8,75,1024,2172649472,10102467723264,4649,50.7597,39.8631,199025
1,CUTLASS,gemm,cutlass_tensorop_h1688gemm_64x128_64x2_tt_align1,passed,success,universal,8192,43008,14336,f16:row,f16:row,f16:column,f16:column,1,0,serial,1,1,heuristic,tensorop,f16,64,128,64,1,1,1,2,1,2,2,16,8,8,75,1024,2172649472,10102467723264,4649,60.7454,33.3101,166308
1,CUTLASS,gemm,cutlass_tensorop_h16816gemm_256x128_32x3_nn_align8,passed,success,universal,8192,43008,14336,f16:column,f16:column,f16:column,f16:column,1,0,serial,1,1,heuristic,tensorop,f16,256,128,32,1,1,1,3,4,2,1,16,8,16,80,1024,2172649472,10102467723264,4649,31.9055,63.4197,316637
1,CUTLASS,gemm,cutlass_tensorop_h16816gemm_256x128_32x3_nn_align4,passed,success,universal,8192,43008,14336,f16:column,f16:column,f16:column,f16:column,1,0,serial,1,1,heuristic,tensorop,f16,256,128,32,1,1,1,3,4,2,1,16,8,16,80,1024,2172649472,10102467723264,4649,32.9346,61.438,306743
1,CUTLASS,gemm,cutlass_tensorop_h16816gemm_256x128_32x3_nn_align2,passed,success,universal,8192,43008,14336,f16:column,f16:column,f16:column,f16:column,1,0,serial,1,1,heuristic,tensorop,f16,256,128,32,1,1,1,3,4,2,1,16,8,16,80,1024,2172649472,10102467723264,4649,35.8695,56.4111,281645
1,CUTLASS,gemm,cutlass_tensorop_h16816gemm_128x256_32x3_nn_align8,passed,success,universal,8192,43008,14336,f16:column,f16:column,f16:column,f16:column,1,0,serial,1,1,heuristic,tensorop,f16,128,256,32,1,1,1,3,2,4,1,16,8,16,80,1024,2172649472,10102467723264,4649,31.2692,64.7103,323081
1,CUTLASS,gemm,cutlass_tensorop_h16816gemm_128x256_32x3_nn_align4,passed,success,universal,8192,43008,14336,f16:column,f16:column,f16:column,f16:column,1,0,serial,1,1,heuristic,tensorop,f16,128,256,32,1,1,1,3,2,4,1,16,8,16,80,1024,2172649472,10102467723264,4649,32.0697,63.0949,315016
1,CUTLASS,gemm,cutlass_tensorop_h16816gemm_128x256_32x3_nn_align2,passed,success,universal,8192,43008,14336,f16:column,f16:column,f16:column,f16:column,1,0,serial,1,1,heuristic,tensorop,f16,128,256,32,1,1,1,3,2,4,1,16,8,16,80,1024,2172649472,10102467723264,4649,33.1569,61.0262,304687
1,CUTLASS,gemm,cutlass_tensorop_h16816gemm_256x64_32x3_nn_align8,passed,success,universal,8192,43008,14336,f16:column,f16:column,f16:column,f16:column,1,0,serial,1,1,heuristic,tensorop,f16,256,64,32,1,1,1,3,4,1,1,16,8,16,80,1024,2172649472,10102467723264,4649,41.8702,48.3264,241280
1,CUTLASS,gemm,cutlass_tensorop_h16816gemm_256x64_32x3_nn_align4,passed,success,universal,8192,43008,14336,f16:column,f16:column,f16:column,f16:column,1,0,serial,1,1,heuristic,tensorop,f16,256,64,32,1,1,1,3,4,1,1,16,8,16,80,1024,2172649472,10102467723264,4649,43.0339,47.0196,234756
1,CUTLASS,gemm,cutlass_tensorop_h16816gemm_256x64_32x3_nn_align2,passed,success,universal,8192,43008,14336,f16:column,f16:column,f16:column,f16:column,1,0,serial,1,1,heuristic,tensorop,f16,256,64,32,1,1,1,3,4,1,1,16,8,16,80,1024,2172649472,10102467723264,4649,86.3017,23.4461,117060
1,CUTLASS,gemm,cutlass_tensorop_h16816gemm_256x64_32x4_nn_align8,passed,success,universal,8192,43008,14336,f16:column,f16:column,f16:column,f16:column,1,0,serial,1,1,heuristic,tensorop,f16,256,64,32,1,1,1,4,4,1,1,16,8,16,80,1024,2172649472,10102467723264,4649,41.5072,48.749,243391
1,CUTLASS,gemm,cutlass_tensorop_h16816gemm_256x64_32x4_nn_align4,passed,success,universal,8192,43008,14336,f16:column,f16:column,f16:column,f16:column,1,0,serial,1,1,heuristic,tensorop,f16,256,64,32,1,1,1,4,4,1,1,16,8,16,80,1024,2172649472,10102467723264,4649,45.6596,44.3157,221256
1,CUTLASS,gemm,cutlass_tensorop_h16816gemm_256x64_32x4_nn_align2,passed,success,universal,8192,43008,14336,f16:column,f16:column,f16:column,f16:column,1,0,serial,1,1,heuristic,tensorop,f16,256,64,32,1,1,1,4,4,1,1,16,8,16,80,1024,2172649472,10102467723264,4649,105.973,19.094,95331
1,CUTLASS,gemm,cutlass_tensorop_h16816gemm_64x256_32x4_nn_align8,passed,success,universal,8192,43008,14336,f16:column,f16:column,f16:column,f16:column,1,0,serial,1,1,heuristic,tensorop,f16,64,256,32,1,1,1,4,1,4,1,16,8,16,80,1024,2172649472,10102467723264,4649,39.9568,50.6406,252835
1,CUTLASS,gemm,cutlass_tensorop_h16816gemm_64x256_32x4_nn_align4,passed,success,universal,8192,43008,14336,f16:column,f16:column,f16:column,f16:column,1,0,serial,1,1,heuristic,tensorop,f16,64,256,32,1,1,1,4,1,4,1,16,8,16,80,1024,2172649472,10102467723264,4649,41.188,49.1268,245277
1,CUTLASS,gemm,cutlass_tensorop_h16816gemm_64x256_32x4_nn_align2,passed,success,universal,8192,43008,14336,f16:column,f16:column,f16:column,f16:column,1,0,serial,1,1,heuristic,tensorop,f16,64,256,32,1,1,1,4,1,4,1,16,8,16,80,1024,2172649472,10102467723264,4649,42.7892,47.2885,236099
1,CUTLASS,gemm,cutlass_tensorop_h16816gemm_128x128_32x3_nn_align8,passed,success,universal,8192,43008,14336,f16:column,f16:column,f16:column,f16:column,1,0,serial,1,1,heuristic,tensorop,f16,128,128,32,1,1,1,3,2,2,1,16,8,16,80,1024,2172649472,10102467723264,4649,34.0972,59.3433,296285
1,CUTLASS,gemm,cutlass_tensorop_h16816gemm_128x128_32x3_nn_align4,passed,success,universal,8192,43008,14336,f16:column,f16:column,f16:column,f16:column,1,0,serial,1,1,heuristic,tensorop,f16,128,128,32,1,1,1,3,2,2,1,16,8,16,80,1024,2172649472,10102467723264,4649,35.4316,57.1082,285126
1,CUTLASS,gemm,cutlass_tensorop_h16816gemm_128x128_32x3_nn_align2,passed,success,universal,8192,43008,14336,f16:column,f16:column,f16:column,f16:column,1,0,serial,1,1,heuristic,tensorop,f16,128,128,32,1,1,1,3,2,2,1,16,8,16,80,1024,2172649472,10102467723264,4649,39.7497,50.9044,254152
1,CUTLASS,gemm,cutlass_tensorop_h16816gemm_128x128_32x4_nn_align8,passed,success,universal,8192,43008,14336,f16:column,f16:column,f16:column,f16:column,1,0,serial,1,1,heuristic,tensorop,f16,128,128,32,1,1,1,4,2,2,1,16,8,16,80,1024,2172649472,10102467723264,4649,34.3078,58.979,294466
1,CUTLASS,gemm,cutlass_tensorop_h16816gemm_128x128_32x4_nn_align4,passed,success,universal,8192,43008,14336,f16:column,f16:column,f16:column,f16:column,1,0,serial,1,1,heuristic,tensorop,f16,128,128,32,1,1,1,4,2,2,1,16,8,16,80,1024,2172649472,10102467723264,4649,35.6068,56.8272,283723
1,CUTLASS,gemm,cutlass_tensorop_h16816gemm_128x128_32x4_nn_align2,passed,success,universal,8192,43008,14336,f16:column,f16:column,f16:column,f16:column,1,0,serial,1,1,heuristic,tensorop,f16,128,128,32,1,1,1,4,2,2,1,16,8,16,80,1024,2172649472,10102467723264,4649,39.9885,50.6004,252634
1,CUTLASS,gemm,cutlass_tensorop_h16816gemm_128x128_32x5_nn_align8,passed,success,universal,8192,43008,14336,f16:column,f16:column,f16:column,f16:column,1,0,serial,1,1,heuristic,tensorop,f16,128,128,32,1,1,1,5,2,2,1,16,8,16,80,1024,2172649472,10102467723264,4649,34.2229,59.1252,295196
1,CUTLASS,gemm,cutlass_tensorop_h16816gemm_128x128_32x5_nn_align4,passed,success,universal,8192,43008,14336,f16:column,f16:column,f16:column,f16:column,1,0,serial,1,1,heuristic,tensorop,f16,128,128,32,1,1,1,5,2,2,1,16,8,16,80,1024,2172649472,10102467723264,4649,35.8576,56.4297,281738
1,CUTLASS,gemm,cutlass_tensorop_h16816gemm_128x128_32x5_nn_align2,passed,success,universal,8192,43008,14336,f16:column,f16:column,f16:column,f16:column,1,0,serial,1,1,heuristic,tensorop,f16,128,128,32,1,1,1,5,2,2,1,16,8,16,80,1024,2172649472,10102467723264,4649,40.0935,50.468,251973
1,CUTLASS,gemm,cutlass_tensorop_h16816gemm_128x64_32x6_nn_align8,passed,success,universal,8192,43008,14336,f16:column,f16:column,f16:column,f16:column,1,0,serial,1,1,heuristic,tensorop,f16,128,64,32,1,1,1,6,2,2,1,16,8,16,80,1024,2172649472,10102467723264,4649,48.5469,41.68,208097
1,CUTLASS,gemm,cutlass_tensorop_h16816gemm_128x64_32x6_nn_align4,passed,success,universal,8192,43008,14336,f16:column,f16:column,f16:column,f16:column,1,0,serial,1,1,heuristic,tensorop,f16,128,64,32,1,1,1,6,2,2,1,16,8,16,80,1024,2172649472,10102467723264,4649,51.0749,39.6171,197797
1,CUTLASS,gemm,cutlass_tensorop_h16816gemm_128x64_32x6_nn_align2,passed,success,universal,8192,43008,14336,f16:column,f16:column,f16:column,f16:column,1,0,serial,1,1,heuristic,tensorop,f16,128,64,32,1,1,1,6,2,2,1,16,8,16,80,1024,2172649472,10102467723264,4649,61.0882,33.1232,165375
1,CUTLASS,gemm,cutlass_tensorop_h16816gemm_64x128_32x6_nn_align8,passed,success,universal,8192,43008,14336,f16:column,f16:column,f16:column,f16:column,1,0,serial,1,1,heuristic,tensorop,f16,64,128,32,1,1,1,6,2,2,1,16,8,16,80,1024,2172649472,10102467723264,4649,47.207,42.8631,214004
1,CUTLASS,gemm,cutlass_tensorop_h16816gemm_64x128_32x6_nn_align4,passed,success,universal,8192,43008,14336,f16:column,f16:column,f16:column,f16:column,1,0,serial,1,1,heuristic,tensorop,f16,64,128,32,1,1,1,6,2,2,1,16,8,16,80,1024,2172649472,10102467723264,4649,48.8339,41.4351,206874
1,CUTLASS,gemm,cutlass_tensorop_h16816gemm_64x128_32x6_nn_align2,passed,success,universal,8192,43008,14336,f16:column,f16:column,f16:column,f16:column,1,0,serial,1,1,heuristic,tensorop,f16,64,128,32,1,1,1,6,2,2,1,16,8,16,80,1024,2172649472,10102467723264,4649,52.533,38.5174,192307
1,CUTLASS,gemm,cutlass_tensorop_h16816gemm_64x64_32x10_nn_align8,passed,success,universal,8192,43008,14336,f16:column,f16:column,f16:column,f16:column,1,0,serial,1,1,heuristic,tensorop,f16,64,64,32,1,1,1,10,2,2,1,16,8,16,80,1024,2172649472,10102467723264,4649,62.3483,32.4538,162033
1,CUTLASS,gemm,cutlass_tensorop_h16816gemm_64x64_32x10_nn_align4,passed,success,universal,8192,43008,14336,f16:column,f16:column,f16:column,f16:column,1,0,serial,1,1,heuristic,tensorop,f16,64,64,32,1,1,1,10,2,2,1,16,8,16,80,1024,2172649472,10102467723264,4649,65.8961,30.7065,153309
1,CUTLASS,gemm,cutlass_tensorop_h16816gemm_64x64_32x10_nn_align2,passed,success,universal,8192,43008,14336,f16:column,f16:column,f16:column,f16:column,1,0,serial,1,1,heuristic,tensorop,f16,64,64,32,1,1,1,10,2,2,1,16,8,16,80,1024,2172649472,10102467723264,4649,76.6423,26.4011,131813
1,CUTLASS,gemm,cutlass_tensorop_h16816gemm_128x128_64x3_nn_align8,passed,success,universal,8192,43008,14336,f16:column,f16:column,f16:column,f16:column,1,0,serial,1,1,heuristic,tensorop,f16,128,128,64,1,1,1,3,2,2,1,16,8,16,80,1024,2172649472,10102467723264,4649,33.4746,60.447,301795
1,CUTLASS,gemm,cutlass_tensorop_h16816gemm_128x128_64x3_nn_align4,passed,success,universal,8192,43008,14336,f16:column,f16:column,f16:column,f16:column,1,0,serial,1,1,heuristic,tensorop,f16,128,128,64,1,1,1,3,2,2,1,16,8,16,80,1024,2172649472,10102467723264,4649,34.6422,58.4096,291623
1,CUTLASS,gemm,cutlass_tensorop_h16816gemm_128x128_64x3_nn_align2,passed,success,universal,8192,43008,14336,f16:column,f16:column,f16:column,f16:column,1,0,serial,1,1,heuristic,tensorop,f16,128,128,64,1,1,1,3,2,2,1,16,8,16,80,1024,2172649472,10102467723264,4649,38.9348,51.9698,259471
1,CUTLASS,gemm,cutlass_tensorop_h16816gemm_128x64_64x3_nn_align8,passed,success,universal,8192,43008,14336,f16:column,f16:column,f16:column,f16:column,1,0,serial,1,1,heuristic,tensorop,f16,128,64,64,1,1,1,3,2,2,1,16,8,16,80,1024,2172649472,10102467723264,4649,47.7202,42.4021,211702
1,CUTLASS,gemm,cutlass_tensorop_h16816gemm_128x64_64x3_nn_align4,passed,success,universal,8192,43008,14336,f16:column,f16:column,f16:column,f16:column,1,0,serial,1,1,heuristic,tensorop,f16,128,64,64,1,1,1,3,2,2,1,16,8,16,80,1024,2172649472,10102467723264,4649,49.4815,40.8928,204166
1,CUTLASS,gemm,cutlass_tensorop_h16816gemm_128x64_64x3_nn_align2,passed,success,universal,8192,43008,14336,f16:column,f16:column,f16:column,f16:column,1,0,serial,1,1,heuristic,tensorop,f16,128,64,64,1,1,1,3,2,2,1,16,8,16,80,1024,2172649472,10102467723264,4649,52.4238,38.5977,192708
1,CUTLASS,gemm,cutlass_tensorop_h16816gemm_64x128_64x3_nn_align8,passed,success,universal,8192,43008,14336,f16:column,f16:column,f16:column,f16:column,1,0,serial,1,1,heuristic,tensorop,f16,64,128,64,1,1,1,3,2,2,1,16,8,16,80,1024,2172649472,10102467723264,4649,46.5944,43.4267,216817
1,CUTLASS,gemm,cutlass_tensorop_h16816gemm_64x128_64x3_nn_align4,passed,success,universal,8192,43008,14336,f16:column,f16:column,f16:column,f16:column,1,0,serial,1,1,heuristic,tensorop,f16,64,128,64,1,1,1,3,2,2,1,16,8,16,80,1024,2172649472,10102467723264,4649,47.8524,42.2849,211117
1,CUTLASS,gemm,cutlass_tensorop_h16816gemm_64x128_64x3_nn_align2,passed,success,universal,8192,43008,14336,f16:column,f16:column,f16:column,f16:column,1,0,serial,1,1,heuristic,tensorop,f16,64,128,64,1,1,1,3,2,2,1,16,8,16,80,1024,2172649472,10102467723264,4649,50.6085,39.9821,199620
1,CUTLASS,gemm,cutlass_tensorop_h16816gemm_64x64_64x5_nn_align8,passed,success,universal,8192,43008,14336,f16:column,f16:column,f16:column,f16:column,1,0,serial,1,1,heuristic,tensorop,f16,64,64,64,1,1,1,5,2,2,1,16,8,16,80,1024,2172649472,10102467723264,4649,61.3379,32.9884,164702
1,CUTLASS,gemm,cutlass_tensorop_h16816gemm_64x64_64x5_nn_align4,passed,success,universal,8192,43008,14336,f16:column,f16:column,f16:column,f16:column,1,0,serial,1,1,heuristic,tensorop,f16,64,64,64,1,1,1,5,2,2,1,16,8,16,80,1024,2172649472,10102467723264,4649,64.2267,31.5046,157294
1,CUTLASS,gemm,cutlass_tensorop_h16816gemm_64x64_64x5_nn_align2,passed,success,universal,8192,43008,14336,f16:column,f16:column,f16:column,f16:column,1,0,serial,1,1,heuristic,tensorop,f16,64,64,64,1,1,1,5,2,2,1,16,8,16,80,1024,2172649472,10102467723264,4649,70.165,28.8383,143982
1,CUTLASS,gemm,cutlass_tensorop_h16816gemm_256x128_32x3_nt_align8,passed,success,universal,8192,43008,14336,f16:column,f16:row,f16:column,f16:column,1,0,serial,1,1,heuristic,tensorop,f16,256,128,32,1,1,1,3,4,2,1,16,8,16,80,1024,2172649472,10102467723264,4649,30.9674,65.3409,326229
1,CUTLASS,gemm,cutlass_tensorop_h16816gemm_256x128_32x3_nt_align4,passed,success,universal,8192,43008,14336,f16:column,f16:row,f16:column,f16:column,1,0,serial,1,1,heuristic,tensorop,f16,256,128,32,1,1,1,3,4,2,1,16,8,16,80,1024,2172649472,10102467723264,4649,31.8774,63.4756,316916
1,CUTLASS,gemm,cutlass_tensorop_h16816gemm_256x128_32x3_nt_align2,passed,success,universal,8192,43008,14336,f16:column,f16:row,f16:column,f16:column,1,0,serial,1,1,heuristic,tensorop,f16,256,128,32,1,1,1,3,4,2,1,16,8,16,80,1024,2172649472,10102467723264,4649,32.9175,61.47,306903
1,CUTLASS,gemm,cutlass_tensorop_h16816gemm_128x256_32x3_nt_align8,passed,success,universal,8192,43008,14336,f16:column,f16:row,f16:column,f16:column,1,0,serial,1,1,heuristic,tensorop,f16,128,256,32,1,1,1,3,2,4,1,16,8,16,80,1024,2172649472,10102467723264,4649,30.6281,66.0646,329843
1,CUTLASS,gemm,cutlass_tensorop_h16816gemm_128x256_32x3_nt_align4,passed,success,universal,8192,43008,14336,f16:column,f16:row,f16:column,f16:column,1,0,serial,1,1,heuristic,tensorop,f16,128,256,32,1,1,1,3,2,4,1,16,8,16,80,1024,2172649472,10102467723264,4649,31.638,63.9559,319314
1,CUTLASS,gemm,cutlass_tensorop_h16816gemm_128x256_32x3_nt_align2,passed,success,universal,8192,43008,14336,f16:column,f16:row,f16:column,f16:column,1,0,serial,1,1,heuristic,tensorop,f16,128,256,32,1,1,1,3,2,4,1,16,8,16,80,1024,2172649472,10102467723264,4649,32.9649,61.3815,306461
1,CUTLASS,gemm,cutlass_tensorop_h16816gemm_256x64_32x3_nt_align8,passed,success,universal,8192,43008,14336,f16:column,f16:row,f16:column,f16:column,1,0,serial,1,1,heuristic,tensorop,f16,256,64,32,1,1,1,3,4,1,1,16,8,16,80,1024,2172649472,10102467723264,4649,40.4231,50.0564,249918
1,CUTLASS,gemm,cutlass_tensorop_h16816gemm_256x64_32x3_nt_align4,passed,success,universal,8192,43008,14336,f16:column,f16:row,f16:column,f16:column,1,0,serial,1,1,heuristic,tensorop,f16,256,64,32,1,1,1,3,4,1,1,16,8,16,80,1024,2172649472,10102467723264,4649,41.544,48.7059,243175
1,CUTLASS,gemm,cutlass_tensorop_h16816gemm_256x64_32x3_nt_align2,passed,success,universal,8192,43008,14336,f16:column,f16:row,f16:column,f16:column,1,0,serial,1,1,heuristic,tensorop,f16,256,64,32,1,1,1,3,4,1,1,16,8,16,80,1024,2172649472,10102467723264,4649,43.5523,46.46,231962
1,CUTLASS,gemm,cutlass_tensorop_h16816gemm_256x64_32x4_nt_align8,passed,success,universal,8192,43008,14336,f16:column,f16:row,f16:column,f16:column,1,0,serial,1,1,heuristic,tensorop,f16,256,64,32,1,1,1,4,4,1,1,16,8,16,80,1024,2172649472,10102467723264,4649,40.1861,50.3517,251392
1,CUTLASS,gemm,cutlass_tensorop_h16816gemm_256x64_32x4_nt_align4,passed,success,universal,8192,43008,14336,f16:column,f16:row,f16:column,f16:column,1,0,serial,1,1,heuristic,tensorop,f16,256,64,32,1,1,1,4,4,1,1,16,8,16,80,1024,2172649472,10102467723264,4649,41.6145,48.6233,242763
1,CUTLASS,gemm,cutlass_tensorop_h16816gemm_256x64_32x4_nt_align2,passed,success,universal,8192,43008,14336,f16:column,f16:row,f16:column,f16:column,1,0,serial,1,1,heuristic,tensorop,f16,256,64,32,1,1,1,4,4,1,1,16,8,16,80,1024,2172649472,10102467723264,4649,44.9928,44.9725,224535
1,CUTLASS,gemm,cutlass_tensorop_h16816gemm_64x256_32x4_nt_align8,passed,success,universal,8192,43008,14336,f16:column,f16:row,f16:column,f16:column,1,0,serial,1,1,heuristic,tensorop,f16,64,256,32,1,1,1,4,1,4,1,16,8,16,80,1024,2172649472,10102467723264,4649,39.9357,50.6674,252968
1,CUTLASS,gemm,cutlass_tensorop_h16816gemm_64x256_32x4_nt_align4,passed,success,universal,8192,43008,14336,f16:column,f16:row,f16:column,f16:column,1,0,serial,1,1,heuristic,tensorop,f16,64,256,32,1,1,1,4,1,4,1,16,8,16,80,1024,2172649472,10102467723264,4649,41.1007,49.2312,245798
1,CUTLASS,gemm,cutlass_tensorop_h16816gemm_64x256_32x4_nt_align2,passed,success,universal,8192,43008,14336,f16:column,f16:row,f16:column,f16:column,1,0,serial,1,1,heuristic,tensorop,f16,64,256,32,1,1,1,4,1,4,1,16,8,16,80,1024,2172649472,10102467723264,4649,42.5685,47.5337,237323
1,CUTLASS,gemm,cutlass_tensorop_h16816gemm_128x128_32x3_nt_align8,passed,success,universal,8192,43008,14336,f16:column,f16:row,f16:column,f16:column,1,0,serial,1,1,heuristic,tensorop,f16,128,128,32,1,1,1,3,2,2,1,16,8,16,80,1024,2172649472,10102467723264,4649,33.3529,60.6675,302896
1,CUTLASS,gemm,cutlass_tensorop_h16816gemm_128x128_32x3_nt_align4,passed,success,universal,8192,43008,14336,f16:column,f16:row,f16:column,f16:column,1,0,serial,1,1,heuristic,tensorop,f16,128,128,32,1,1,1,3,2,2,1,16,8,16,80,1024,2172649472,10102467723264,4649,34.4224,58.7826,293485
1,CUTLASS,gemm,cutlass_tensorop_h16816gemm_128x128_32x3_nt_align2,passed,success,universal,8192,43008,14336,f16:column,f16:row,f16:column,f16:column,1,0,serial,1,1,heuristic,tensorop,f16,128,128,32,1,1,1,3,2,2,1,16,8,16,80,1024,2172649472,10102467723264,4649,35.056,57.7201,288181
1,CUTLASS,gemm,cutlass_tensorop_h16816gemm_128x128_32x4_nt_align8,passed,success,universal,8192,43008,14336,f16:column,f16:row,f16:column,f16:column,1,0,serial,1,1,heuristic,tensorop,f16,128,128,32,1,1,1,4,2,2,1,16,8,16,80,1024,2172649472,10102467723264,4649,33.641,60.148,300303
1,CUTLASS,gemm,cutlass_tensorop_h16816gemm_128x128_32x4_nt_align4,passed,success,universal,8192,43008,14336,f16:column,f16:row,f16:column,f16:column,1,0,serial,1,1,heuristic,tensorop,f16,128,128,32,1,1,1,4,2,2,1,16,8,16,80,1024,2172649472,10102467723264,4649,34.554,58.5588,292368
1,CUTLASS,gemm,cutlass_tensorop_h16816gemm_128x128_32x4_nt_align2,passed,success,universal,8192,43008,14336,f16:column,f16:row,f16:column,f16:column,1,0,serial,1,1,heuristic,tensorop,f16,128,128,32,1,1,1,4,2,2,1,16,8,16,80,1024,2172649472,10102467723264,4649,35.7719,56.565,282413
1,CUTLASS,gemm,cutlass_tensorop_h16816gemm_128x128_32x5_nt_align8,passed,success,universal,8192,43008,14336,f16:column,f16:row,f16:column,f16:column,1,0,serial,1,1,heuristic,tensorop,f16,128,128,32,1,1,1,5,2,2,1,16,8,16,80,1024,2172649472,10102467723264,4649,33.511,60.3813,301467
1,CUTLASS,gemm,cutlass_tensorop_h16816gemm_128x128_32x5_nt_align4,passed,success,universal,8192,43008,14336,f16:column,f16:row,f16:column,f16:column,1,0,serial,1,1,heuristic,tensorop,f16,128,128,32,1,1,1,5,2,2,1,16,8,16,80,1024,2172649472,10102467723264,4649,34.5097,58.6338,292743
1,CUTLASS,gemm,cutlass_tensorop_h16816gemm_128x128_32x5_nt_align2,passed,success,universal,8192,43008,14336,f16:column,f16:row,f16:column,f16:column,1,0,serial,1,1,heuristic,tensorop,f16,128,128,32,1,1,1,5,2,2,1,16,8,16,80,1024,2172649472,10102467723264,4649,35.9338,56.3101,281141
1,CUTLASS,gemm,cutlass_tensorop_h16816gemm_128x64_32x6_nt_align8,passed,success,universal,8192,43008,14336,f16:column,f16:row,f16:column,f16:column,1,0,serial,1,1,heuristic,tensorop,f16,128,64,32,1,1,1,6,2,2,1,16,8,16,80,1024,2172649472,10102467723264,4649,47.7151,42.4067,211725
1,CUTLASS,gemm,cutlass_tensorop_h16816gemm_128x64_32x6_nt_align4,passed,success,universal,8192,43008,14336,f16:column,f16:row,f16:column,f16:column,1,0,serial,1,1,heuristic,tensorop,f16,128,64,32,1,1,1,6,2,2,1,16,8,16,80,1024,2172649472,10102467723264,4649,49.1034,41.2077,205739
1,CUTLASS,gemm,cutlass_tensorop_h16816gemm_128x64_32x6_nt_align2,passed,success,universal,8192,43008,14336,f16:column,f16:row,f16:column,f16:column,1,0,serial,1,1,heuristic,tensorop,f16,128,64,32,1,1,1,6,2,2,1,16,8,16,80,1024,2172649472,10102467723264,4649,51.2767,39.4612,197019
1,CUTLASS,gemm,cutlass_tensorop_h16816gemm_64x128_32x6_nt_align8,passed,success,universal,8192,43008,14336,f16:column,f16:row,f16:column,f16:column,1,0,serial,1,1,heuristic,tensorop,f16,64,128,32,1,1,1,6,2,2,1,16,8,16,80,1024,2172649472,10102467723264,4649,46.8051,43.2311,215841
1,CUTLASS,gemm,cutlass_tensorop_h16816gemm_64x128_32x6_nt_align4,passed,success,universal,8192,43008,14336,f16:column,f16:row,f16:column,f16:column,1,0,serial,1,1,heuristic,tensorop,f16,64,128,32,1,1,1,6,2,2,1,16,8,16,80,1024,2172649472,10102467723264,4649,48.1077,42.0606,209997
1,CUTLASS,gemm,cutlass_tensorop_h16816gemm_64x128_32x6_nt_align2,passed,success,universal,8192,43008,14336,f16:column,f16:row,f16:column,f16:column,1,0,serial,1,1,heuristic,tensorop,f16,64,128,32,1,1,1,6,2,2,1,16,8,16,80,1024,2172649472,10102467723264,4649,50.2153,40.2952,201183
1,CUTLASS,gemm,cutlass_tensorop_h16816gemm_64x64_32x10_nt_align8,passed,success,universal,8192,43008,14336,f16:column,f16:row,f16:column,f16:column,1,0,serial,1,1,heuristic,tensorop,f16,64,64,32,1,1,1,10,2,2,1,16,8,16,80,1024,2172649472,10102467723264,4649,62.191,32.5359,162443
1,CUTLASS,gemm,cutlass_tensorop_h16816gemm_64x64_32x10_nt_align4,passed,success,universal,8192,43008,14336,f16:column,f16:row,f16:column,f16:column,1,0,serial,1,1,heuristic,tensorop,f16,64,64,32,1,1,1,10,2,2,1,16,8,16,80,1024,2172649472,10102467723264,4649,64.3485,31.445,156996
1,CUTLASS,gemm,cutlass_tensorop_h16816gemm_64x64_32x10_nt_align2,passed,success,universal,8192,43008,14336,f16:column,f16:row,f16:column,f16:column,1,0,serial,1,1,heuristic,tensorop,f16,64,64,32,1,1,1,10,2,2,1,16,8,16,80,1024,2172649472,10102467723264,4649,68.1792,29.6782,148175
1,CUTLASS,gemm,cutlass_tensorop_h16816gemm_128x128_64x3_nt_align8,passed,success,universal,8192,43008,14336,f16:column,f16:row,f16:column,f16:column,1,0,serial,1,1,heuristic,tensorop,f16,128,128,64,1,1,1,3,2,2,1,16,8,16,80,1024,2172649472,10102467723264,4649,33.5179,60.3689,301405
1,CUTLASS,gemm,cutlass_tensorop_h16816gemm_128x128_64x3_nt_align4,passed,success,universal,8192,43008,14336,f16:column,f16:row,f16:column,f16:column,1,0,serial,1,1,heuristic,tensorop,f16,128,128,64,1,1,1,3,2,2,1,16,8,16,80,1024,2172649472,10102467723264,4649,34.6375,58.4175,291663
1,CUTLASS,gemm,cutlass_tensorop_h16816gemm_128x128_64x3_nt_align2,passed,success,universal,8192,43008,14336,f16:column,f16:row,f16:column,f16:column,1,0,serial,1,1,heuristic,tensorop,f16,128,128,64,1,1,1,3,2,2,1,16,8,16,80,1024,2172649472,10102467723264,4649,38.5207,52.5285,262261
1,CUTLASS,gemm,cutlass_tensorop_h16816gemm_128x64_64x3_nt_align8,passed,success,universal,8192,43008,14336,f16:column,f16:row,f16:column,f16:column,1,0,serial,1,1,heuristic,tensorop,f16,128,64,64,1,1,1,3,2,2,1,16,8,16,80,1024,2172649472,10102467723264,4649,47.765,42.3624,211504
1,CUTLASS,gemm,cutlass_tensorop_h16816gemm_128x64_64x3_nt_align4,passed,success,universal,8192,43008,14336,f16:column,f16:row,f16:column,f16:column,1,0,serial,1,1,heuristic,tensorop,f16,128,64,64,1,1,1,3,2,2,1,16,8,16,80,1024,2172649472,10102467723264,4649,49.4345,40.9317,204361
