CUTLASS/cutlassgemm-benchmark/csv_logs/cutlass_shape_8192_28672_8192_performance.gemm.csv
Problem,Provider,OperationKind,Operation,Disposition,Status,gemm_kind,m,n,k,A,B,C,D,alpha,beta,split_k_mode,split_k_slices,batch_count,raster_order,op_class,accum,cta_m,cta_n,cta_k,cluster_m,cluster_n,cluster_k,stages,warps_m,warps_n,warps_k,inst_m,inst_n,inst_k,min_cc,max_cc,Bytes,Flops,Flops/Byte,Runtime,GB/s,GFLOPs
1,CUTLASS,gemm,cutlass_tensorop_h1688gemm_256x128_32x2_nn_align8,passed,success,universal,8192,8192,28672,f16:column,f16:column,f16:column,f16:column,1,0,serial,1,1,heuristic,tensorop,f16,256,128,32,1,1,1,2,4,2,1,16,8,8,75,1024,1073741824,3848424914944,3584,18.9436,52.7883,203152
1,CUTLASS,gemm,cutlass_tensorop_h1688gemm_256x128_32x2_nn_align4,passed,success,universal,8192,8192,28672,f16:column,f16:column,f16:column,f16:column,1,0,serial,1,1,heuristic,tensorop,f16,256,128,32,1,1,1,2,4,2,1,16,8,8,75,1024,1073741824,3848424914944,3584,18.2042,54.9325,211404
1,CUTLASS,gemm,cutlass_tensorop_h1688gemm_256x128_32x2_nn_align2,passed,success,universal,8192,8192,28672,f16:column,f16:column,f16:column,f16:column,1,0,serial,1,1,heuristic,tensorop,f16,256,128,32,1,1,1,2,4,2,1,16,8,8,75,1024,1073741824,3848424914944,3584,18.5492,53.9105,207471
1,CUTLASS,gemm,cutlass_tensorop_h1688gemm_256x128_32x2_nn_align1,passed,success,universal,8192,8192,28672,f16:column,f16:column,f16:column,f16:column,1,0,serial,1,1,heuristic,tensorop,f16,256,128,32,1,1,1,2,4,2,1,16,8,8,75,1024,1073741824,3848424914944,3584,23.1184,43.2555,166466
1,CUTLASS,gemm,cutlass_tensorop_h1688gemm_128x256_32x2_nn_align8,passed,success,universal,8192,8192,28672,f16:column,f16:column,f16:column,f16:column,1,0,serial,1,1,heuristic,tensorop,f16,128,256,32,1,1,1,2,2,4,1,16,8,8,75,1024,1073741824,3848424914944,3584,18.0341,55.4506,213397
1,CUTLASS,gemm,cutlass_tensorop_h1688gemm_128x256_32x2_nn_align4,passed,success,universal,8192,8192,28672,f16:column,f16:column,f16:column,f16:column,1,0,serial,1,1,heuristic,tensorop,f16,128,256,32,1,1,1,2,2,4,1,16,8,8,75,1024,1073741824,3848424914944,3584,17.2827,57.8615,222675
1,CUTLASS,gemm,cutlass_tensorop_h1688gemm_128x256_32x2_nn_align2,passed,success,universal,8192,8192,28672,f16:column,f16:column,f16:column,f16:column,1,0,serial,1,1,heuristic,tensorop,f16,128,256,32,1,1,1,2,2,4,1,16,8,8,75,1024,1073741824,3848424914944,3584,17.0406,58.6834,225839
1,CUTLASS,gemm,cutlass_tensorop_h1688gemm_128x256_32x2_nn_align1,passed,success,universal,8192,8192,28672,f16:column,f16:column,f16:column,f16:column,1,0,serial,1,1,heuristic,tensorop,f16,128,256,32,1,1,1,2,2,4,1,16,8,8,75,1024,1073741824,3848424914944,3584,19.0269,52.557,202262
1,CUTLASS,gemm,cutlass_tensorop_h1688gemm_128x128_32x2_nn_align8,passed,success,universal,8192,8192,28672,f16:column,f16:column,f16:column,f16:column,1,0,serial,1,1,heuristic,tensorop,f16,128,128,32,1,1,1,2,2,2,1,16,8,8,75,1024,1073741824,3848424914944,3584,14.6549,68.2364,262603
1,CUTLASS,gemm,cutlass_tensorop_h1688gemm_128x128_32x2_nn_align4,passed,success,universal,8192,8192,28672,f16:column,f16:column,f16:column,f16:column,1,0,serial,1,1,heuristic,tensorop,f16,128,128,32,1,1,1,2,2,2,1,16,8,8,75,1024,1073741824,3848424914944,3584,16.0662,62.2423,239535
1,CUTLASS,gemm,cutlass_tensorop_h1688gemm_128x128_32x2_nn_align2,passed,success,universal,8192,8192,28672,f16:column,f16:column,f16:column,f16:column,1,0,serial,1,1,heuristic,tensorop,f16,128,128,32,1,1,1,2,2,2,1,16,8,8,75,1024,1073741824,3848424914944,3584,16.5401,60.4593,232673
1,CUTLASS,gemm,cutlass_tensorop_h1688gemm_128x128_32x2_nn_align1,passed,success,universal,8192,8192,28672,f16:column,f16:column,f16:column,f16:column,1,0,serial,1,1,heuristic,tensorop,f16,128,128,32,1,1,1,2,2,2,1,16,8,8,75,1024,1073741824,3848424914944,3584,21.5604,46.3813,178495
1,CUTLASS,gemm,cutlass_tensorop_h1688gemm_64x256_32x2_nn_align8,passed,success,universal,8192,8192,28672,f16:column,f16:column,f16:column,f16:column,1,0,serial,1,1,heuristic,tensorop,f16,64,256,32,1,1,1,2,1,4,1,16,8,8,75,1024,1073741824,3848424914944,3584,16.8259,59.4322,228720
1,CUTLASS,gemm,cutlass_tensorop_h1688gemm_64x256_32x2_nn_align4,passed,success,universal,8192,8192,28672,f16:column,f16:column,f16:column,f16:column,1,0,serial,1,1,heuristic,tensorop,f16,64,256,32,1,1,1,2,1,4,1,16,8,8,75,1024,1073741824,3848424914944,3584,17.6394,56.6911,218172
1,CUTLASS,gemm,cutlass_tensorop_h1688gemm_64x256_32x2_nn_align2,passed,success,universal,8192,8192,28672,f16:column,f16:column,f16:column,f16:column,1,0,serial,1,1,heuristic,tensorop,f16,64,256,32,1,1,1,2,1,4,1,16,8,8,75,1024,1073741824,3848424914944,3584,18.2675,54.7419,210670
1,CUTLASS,gemm,cutlass_tensorop_h1688gemm_64x256_32x2_nn_align1,passed,success,universal,8192,8192,28672,f16:column,f16:column,f16:column,f16:column,1,0,serial,1,1,heuristic,tensorop,f16,64,256,32,1,1,1,2,1,4,1,16,8,8,75,1024,1073741824,3848424914944,3584,23.1271,43.2392,166403
1,CUTLASS,gemm,cutlass_tensorop_h1688gemm_256x64_32x2_nn_align8,passed,success,universal,8192,8192,28672,f16:column,f16:column,f16:column,f16:column,1,0,serial,1,1,heuristic,tensorop,f16,256,64,32,1,1,1,2,4,1,1,16,8,8,75,1024,1073741824,3848424914944,3584,19.0314,52.5446,202214
1,CUTLASS,gemm,cutlass_tensorop_h1688gemm_256x64_32x2_nn_align4,passed,success,universal,8192,8192,28672,f16:column,f16:column,f16:column,f16:column,1,0,serial,1,1,heuristic,tensorop,f16,256,64,32,1,1,1,2,4,1,1,16,8,8,75,1024,1073741824,3848424914944,3584,20.8117,48.05,184917
1,CUTLASS,gemm,cutlass_tensorop_h1688gemm_256x64_32x2_nn_align2,passed,success,universal,8192,8192,28672,f16:column,f16:column,f16:column,f16:column,1,0,serial,1,1,heuristic,tensorop,f16,256,64,32,1,1,1,2,4,1,1,16,8,8,75,1024,1073741824,3848424914944,3584,19.3886,51.5767,198489
1,CUTLASS,gemm,cutlass_tensorop_h1688gemm_256x64_32x2_nn_align1,passed,success,universal,8192,8192,28672,f16:column,f16:column,f16:column,f16:column,1,0,serial,1,1,heuristic,tensorop,f16,256,64,32,1,1,1,2,4,1,1,16,8,8,75,1024,1073741824,3848424914944,3584,30.3451,32.9542,126822
1,CUTLASS,gemm,cutlass_tensorop_h1688gemm_64x128_32x2_nn_align8,passed,success,universal,8192,8192,28672,f16:column,f16:column,f16:column,f16:column,1,0,serial,1,1,heuristic,tensorop,f16,64,128,32,1,1,1,2,2,2,1,16,8,8,75,1024,1073741824,3848424914944,3584,19.5281,51.2083,197071
1,CUTLASS,gemm,cutlass_tensorop_h1688gemm_64x128_32x2_nn_align4,passed,success,universal,8192,8192,28672,f16:column,f16:column,f16:column,f16:column,1,0,serial,1,1,heuristic,tensorop,f16,64,128,32,1,1,1,2,2,2,1,16,8,8,75,1024,1073741824,3848424914944,3584,19.9153,50.2127,193240
1,CUTLASS,gemm,cutlass_tensorop_h1688gemm_64x128_32x2_nn_align2,passed,success,universal,8192,8192,28672,f16:column,f16:column,f16:column,f16:column,1,0,serial,1,1,heuristic,tensorop,f16,64,128,32,1,1,1,2,2,2,1,16,8,8,75,1024,1073741824,3848424914944,3584,21.781,45.9116,176687
1,CUTLASS,gemm,cutlass_tensorop_h1688gemm_64x128_32x2_nn_align1,passed,success,universal,8192,8192,28672,f16:column,f16:column,f16:column,f16:column,1,0,serial,1,1,heuristic,tensorop,f16,64,128,32,1,1,1,2,2,2,1,16,8,8,75,1024,1073741824,3848424914944,3584,29.0949,34.3703,132271
1,CUTLASS,gemm,cutlass_tensorop_h1688gemm_128x64_32x2_nn_align8,passed,success,universal,8192,8192,28672,f16:column,f16:column,f16:column,f16:column,1,0,serial,1,1,heuristic,tensorop,f16,128,64,32,1,1,1,2,2,2,1,16,8,8,75,1024,1073741824,3848424914944,3584,20.1396,49.6533,191087
1,CUTLASS,gemm,cutlass_tensorop_h1688gemm_128x64_32x2_nn_align4,passed,success,universal,8192,8192,28672,f16:column,f16:column,f16:column,f16:column,1,0,serial,1,1,heuristic,tensorop,f16,128,64,32,1,1,1,2,2,2,1,16,8,8,75,1024,1073741824,3848424914944,3584,21.9416,45.5756,175394
1,CUTLASS,gemm,cutlass_tensorop_h1688gemm_128x64_32x2_nn_align2,passed,success,universal,8192,8192,28672,f16:column,f16:column,f16:column,f16:column,1,0,serial,1,1,heuristic,tensorop,f16,128,64,32,1,1,1,2,2,2,1,16,8,8,75,1024,1073741824,3848424914944,3584,23.9159,41.8132,160915
1,CUTLASS,gemm,cutlass_tensorop_h1688gemm_128x64_32x2_nn_align1,passed,success,universal,8192,8192,28672,f16:column,f16:column,f16:column,f16:column,1,0,serial,1,1,heuristic,tensorop,f16,128,64,32,1,1,1,2,2,2,1,16,8,8,75,1024,1073741824,3848424914944,3584,33.8259,29.5631,113772
1,CUTLASS,gemm,cutlass_tensorop_h1688gemm_64x64_32x2_nn_align8,passed,success,universal,8192,8192,28672,f16:column,f16:column,f16:column,f16:column,1,0,serial,1,1,heuristic,tensorop,f16,64,64,32,1,1,1,2,2,2,1,16,8,8,75,1024,1073741824,3848424914944,3584,25.1167,39.8142,153222
1,CUTLASS,gemm,cutlass_tensorop_h1688gemm_64x64_32x2_nn_align4,passed,success,universal,8192,8192,28672,f16:column,f16:column,f16:column,f16:column,1,0,serial,1,1,heuristic,tensorop,f16,64,64,32,1,1,1,2,2,2,1,16,8,8,75,1024,1073741824,3848424914944,3584,25.7282,38.8679,149580
1,CUTLASS,gemm,cutlass_tensorop_h1688gemm_64x64_32x2_nn_align2,passed,success,universal,8192,8192,28672,f16:column,f16:column,f16:column,f16:column,1,0,serial,1,1,heuristic,tensorop,f16,64,64,32,1,1,1,2,2,2,1,16,8,8,75,1024,1073741824,3848424914944,3584,28.2677,35.376,136142
1,CUTLASS,gemm,cutlass_tensorop_h1688gemm_64x64_32x2_nn_align1,passed,success,universal,8192,8192,28672,f16:column,f16:column,f16:column,f16:column,1,0,serial,1,1,heuristic,tensorop,f16,64,64,32,1,1,1,2,2,2,1,16,8,8,75,1024,1073741824,3848424914944,3584,41.4775,24.1094,92783.4
1,CUTLASS,gemm,cutlass_tensorop_h1688gemm_64x128_64x2_nn_align8,passed,success,universal,8192,8192,28672,f16:column,f16:column,f16:column,f16:column,1,0,serial,1,1,heuristic,tensorop,f16,64,128,64,1,1,1,2,1,2,2,16,8,8,75,1024,1073741824,3848424914944,3584,19.039,52.5237,202133
1,CUTLASS,gemm,cutlass_tensorop_h1688gemm_64x128_64x2_nn_align4,passed,success,universal,8192,8192,28672,f16:column,f16:column,f16:column,f16:column,1,0,serial,1,1,heuristic,tensorop,f16,64,128,64,1,1,1,2,1,2,2,16,8,8,75,1024,1073741824,3848424914944,3584,18.962,52.737,202954
1,CUTLASS,gemm,cutlass_tensorop_h1688gemm_64x128_64x2_nn_align2,passed,success,universal,8192,8192,28672,f16:column,f16:column,f16:column,f16:column,1,0,serial,1,1,heuristic,tensorop,f16,64,128,64,1,1,1,2,1,2,2,16,8,8,75,1024,1073741824,3848424914944,3584,19.0535,52.4839,201980
1,CUTLASS,gemm,cutlass_tensorop_h1688gemm_64x128_64x2_nn_align1,passed,success,universal,8192,8192,28672,f16:column,f16:column,f16:column,f16:column,1,0,serial,1,1,heuristic,tensorop,f16,64,128,64,1,1,1,2,1,2,2,16,8,8,75,1024,1073741824,3848424914944,3584,25.4177,39.3426,151407
1,CUTLASS,gemm,cutlass_tensorop_h1688gemm_256x128_32x2_nt_align8,passed,success,universal,8192,8192,28672,f16:column,f16:row,f16:column,f16:column,1,0,serial,1,1,heuristic,tensorop,f16,256,128,32,1,1,1,2,4,2,1,16,8,8,75,1024,1073741824,3848424914944,3584,16.3831,61.0386,234902
1,CUTLASS,gemm,cutlass_tensorop_h1688gemm_256x128_32x2_nt_align4,passed,success,universal,8192,8192,28672,f16:column,f16:row,f16:column,f16:column,1,0,serial,1,1,heuristic,tensorop,f16,256,128,32,1,1,1,2,4,2,1,16,8,8,75,1024,1073741824,3848424914944,3584,18.2608,54.7622,210748
1,CUTLASS,gemm,cutlass_tensorop_h1688gemm_256x128_32x2_nt_align2,passed,success,universal,8192,8192,28672,f16:column,f16:row,f16:column,f16:column,1,0,serial,1,1,heuristic,tensorop,f16,256,128,32,1,1,1,2,4,2,1,16,8,8,75,1024,1073741824,3848424914944,3584,16.6635,60.0116,230950
1,CUTLASS,gemm,cutlass_tensorop_h1688gemm_256x128_32x2_nt_align1,passed,success,universal,8192,8192,28672,f16:column,f16:row,f16:column,f16:column,1,0,serial,1,1,heuristic,tensorop,f16,256,128,32,1,1,1,2,4,2,1,16,8,8,75,1024,1073741824,3848424914944,3584,19.4978,51.2879,197378
1,CUTLASS,gemm,cutlass_tensorop_h1688gemm_128x256_32x2_nt_align8,passed,success,universal,8192,8192,28672,f16:column,f16:row,f16:column,f16:column,1,0,serial,1,1,heuristic,tensorop,f16,128,256,32,1,1,1,2,2,4,1,16,8,8,75,1024,1073741824,3848424914944,3584,16.2278,61.6225,237150
1,CUTLASS,gemm,cutlass_tensorop_h1688gemm_128x256_32x2_nt_align4,passed,success,universal,8192,8192,28672,f16:column,f16:row,f16:column,f16:column,1,0,serial,1,1,heuristic,tensorop,f16,128,256,32,1,1,1,2,2,4,1,16,8,8,75,1024,1073741824,3848424914944,3584,16.2611,61.4964,236664
1,CUTLASS,gemm,cutlass_tensorop_h1688gemm_128x256_32x2_nt_align2,passed,success,universal,8192,8192,28672,f16:column,f16:row,f16:column,f16:column,1,0,serial,1,1,heuristic,tensorop,f16,128,256,32,1,1,1,2,2,4,1,16,8,8,75,1024,1073741824,3848424914944,3584,18.7511,53.3303,205238
1,CUTLASS,gemm,cutlass_tensorop_h1688gemm_128x256_32x2_nt_align1,passed,success,universal,8192,8192,28672,f16:column,f16:row,f16:column,f16:column,1,0,serial,1,1,heuristic,tensorop,f16,128,256,32,1,1,1,2,2,4,1,16,8,8,75,1024,1073741824,3848424914944,3584,20.129,49.6796,191188
1,CUTLASS,gemm,cutlass_tensorop_h1688gemm_128x128_32x2_nt_align8,passed,success,universal,8192,8192,28672,f16:column,f16:row,f16:column,f16:column,1,0,serial,1,1,heuristic,tensorop,f16,128,128,32,1,1,1,2,2,2,1,16,8,8,75,1024,1073741824,3848424914944,3584,14.2544,70.1538,269982
1,CUTLASS,gemm,cutlass_tensorop_h1688gemm_128x128_32x2_nt_align4,passed,success,universal,8192,8192,28672,f16:column,f16:row,f16:column,f16:column,1,0,serial,1,1,heuristic,tensorop,f16,128,128,32,1,1,1,2,2,2,1,16,8,8,75,1024,1073741824,3848424914944,3584,16.5822,60.3056,232082
1,CUTLASS,gemm,cutlass_tensorop_h1688gemm_128x128_32x2_nt_align2,passed,success,universal,8192,8192,28672,f16:column,f16:row,f16:column,f16:column,1,0,serial,1,1,heuristic,tensorop,f16,128,128,32,1,1,1,2,2,2,1,16,8,8,75,1024,1073741824,3848424914944,3584,15.4121,64.884,249701
1,CUTLASS,gemm,cutlass_tensorop_h1688gemm_128x128_32x2_nt_align1,passed,success,universal,8192,8192,28672,f16:column,f16:row,f16:column,f16:column,1,0,serial,1,1,heuristic,tensorop,f16,128,128,32,1,1,1,2,2,2,1,16,8,8,75,1024,1073741824,3848424914944,3584,18.9996,52.6327,202553
1,CUTLASS,gemm,cutlass_tensorop_h1688gemm_64x256_32x2_nt_align8,passed,success,universal,8192,8192,28672,f16:column,f16:row,f16:column,f16:column,1,0,serial,1,1,heuristic,tensorop,f16,64,256,32,1,1,1,2,1,4,1,16,8,8,75,1024,1073741824,3848424914944,3584,16.7748,59.6131,229417
1,CUTLASS,gemm,cutlass_tensorop_h1688gemm_64x256_32x2_nt_align4,passed,success,universal,8192,8192,28672,f16:column,f16:row,f16:column,f16:column,1,0,serial,1,1,heuristic,tensorop,f16,64,256,32,1,1,1,2,1,4,1,16,8,8,75,1024,1073741824,3848424914944,3584,17.3445,57.6551,221881
1,CUTLASS,gemm,cutlass_tensorop_h1688gemm_64x256_32x2_nt_align2,passed,success,universal,8192,8192,28672,f16:column,f16:row,f16:column,f16:column,1,0,serial,1,1,heuristic,tensorop,f16,64,256,32,1,1,1,2,1,4,1,16,8,8,75,1024,1073741824,3848424914944,3584,18.6043,53.751,206857
1,CUTLASS,gemm,cutlass_tensorop_h1688gemm_64x256_32x2_nt_align1,passed,success,universal,8192,8192,28672,f16:column,f16:row,f16:column,f16:column,1,0,serial,1,1,heuristic,tensorop,f16,64,256,32,1,1,1,2,1,4,1,16,8,8,75,1024,1073741824,3848424914944,3584,21.6756,46.1348,177546
1,CUTLASS,gemm,cutlass_tensorop_h1688gemm_256x64_32x2_nt_align8,passed,success,universal,8192,8192,28672,f16:column,f16:row,f16:column,f16:column,1,0,serial,1,1,heuristic,tensorop,f16,256,64,32,1,1,1,2,4,1,1,16,8,8,75,1024,1073741824,3848424914944,3584,17.2829,57.8608,222673
1,CUTLASS,gemm,cutlass_tensorop_h1688gemm_256x64_32x2_nt_align4,passed,success,universal,8192,8192,28672,f16:column,f16:row,f16:column,f16:column,1,0,serial,1,1,heuristic,tensorop,f16,256,64,32,1,1,1,2,4,1,1,16,8,8,75,1024,1073741824,3848424914944,3584,18.5539,53.8972,207419
1,CUTLASS,gemm,cutlass_tensorop_h1688gemm_256x64_32x2_nt_align2,passed,success,universal,8192,8192,28672,f16:column,f16:row,f16:column,f16:column,1,0,serial,1,1,heuristic,tensorop,f16,256,64,32,1,1,1,2,4,1,1,16,8,8,75,1024,1073741824,3848424914944,3584,18.8125,53.1561,204567
1,CUTLASS,gemm,cutlass_tensorop_h1688gemm_256x64_32x2_nt_align1,passed,success,universal,8192,8192,28672,f16:column,f16:row,f16:column,f16:column,1,0,serial,1,1,heuristic,tensorop,f16,256,64,32,1,1,1,2,4,1,1,16,8,8,75,1024,1073741824,3848424914944,3584,21.9837,45.4882,175058
1,CUTLASS,gemm,cutlass_tensorop_h1688gemm_64x128_32x2_nt_align8,passed,success,universal,8192,8192,28672,f16:column,f16:row,f16:column,f16:column,1,0,serial,1,1,heuristic,tensorop,f16,64,128,32,1,1,1,2,2,2,1,16,8,8,75,1024,1073741824,3848424914944,3584,19.2482,51.9528,199937
1,CUTLASS,gemm,cutlass_tensorop_h1688gemm_64x128_32x2_nt_align4,passed,success,universal,8192,8192,28672,f16:column,f16:row,f16:column,f16:column,1,0,serial,1,1,heuristic,tensorop,f16,64,128,32,1,1,1,2,2,2,1,16,8,8,75,1024,1073741824,3848424914944,3584,19.5228,51.2223,197125
1,CUTLASS,gemm,cutlass_tensorop_h1688gemm_64x128_32x2_nt_align2,passed,success,universal,8192,8192,28672,f16:column,f16:row,f16:column,f16:column,1,0,serial,1,1,heuristic,tensorop,f16,64,128,32,1,1,1,2,2,2,1,16,8,8,75,1024,1073741824,3848424914944,3584,20.5656,48.6249,187129
1,CUTLASS,gemm,cutlass_tensorop_h1688gemm_64x128_32x2_nt_align1,passed,success,universal,8192,8192,28672,f16:column,f16:row,f16:column,f16:column,1,0,serial,1,1,heuristic,tensorop,f16,64,128,32,1,1,1,2,2,2,1,16,8,8,75,1024,1073741824,3848424914944,3584,24.8213,40.2879,155045
1,CUTLASS,gemm,cutlass_tensorop_h1688gemm_128x64_32x2_nt_align8,passed,success,universal,8192,8192,28672,f16:column,f16:row,f16:column,f16:column,1,0,serial,1,1,heuristic,tensorop,f16,128,64,32,1,1,1,2,2,2,1,16,8,8,75,1024,1073741824,3848424914944,3584,19.5237,51.2198,197116
1,CUTLASS,gemm,cutlass_tensorop_h1688gemm_128x64_32x2_nt_align4,passed,success,universal,8192,8192,28672,f16:column,f16:row,f16:column,f16:column,1,0,serial,1,1,heuristic,tensorop,f16,128,64,32,1,1,1,2,2,2,1,16,8,8,75,1024,1073741824,3848424914944,3584,19.8014,50.5014,194351
1,CUTLASS,gemm,cutlass_tensorop_h1688gemm_128x64_32x2_nt_align2,passed,success,universal,8192,8192,28672,f16:column,f16:row,f16:column,f16:column,1,0,serial,1,1,heuristic,tensorop,f16,128,64,32,1,1,1,2,2,2,1,16,8,8,75,1024,1073741824,3848424914944,3584,20.2248,49.4442,190282
1,CUTLASS,gemm,cutlass_tensorop_h1688gemm_128x64_32x2_nt_align1,passed,success,universal,8192,8192,28672,f16:column,f16:row,f16:column,f16:column,1,0,serial,1,1,heuristic,tensorop,f16,128,64,32,1,1,1,2,2,2,1,16,8,8,75,1024,1073741824,3848424914944,3584,24.9284,40.115,154379
1,CUTLASS,gemm,cutlass_tensorop_h1688gemm_64x64_32x2_nt_align8,passed,success,universal,8192,8192,28672,f16:column,f16:row,f16:column,f16:column,1,0,serial,1,1,heuristic,tensorop,f16,64,64,32,1,1,1,2,2,2,1,16,8,8,75,1024,1073741824,3848424914944,3584,24.2222,41.2845,158880
1,CUTLASS,gemm,cutlass_tensorop_h1688gemm_64x64_32x2_nt_align4,passed,success,universal,8192,8192,28672,f16:column,f16:row,f16:column,f16:column,1,0,serial,1,1,heuristic,tensorop,f16,64,64,32,1,1,1,2,2,2,1,16,8,8,75,1024,1073741824,3848424914944,3584,24.7309,40.4352,155612
1,CUTLASS,gemm,cutlass_tensorop_h1688gemm_64x64_32x2_nt_align2,passed,success,universal,8192,8192,28672,f16:column,f16:row,f16:column,f16:column,1,0,serial,1,1,heuristic,tensorop,f16,64,64,32,1,1,1,2,2,2,1,16,8,8,75,1024,1073741824,3848424914944,3584,25.2746,39.5655,152265
1,CUTLASS,gemm,cutlass_tensorop_h1688gemm_64x64_32x2_nt_align1,passed,success,universal,8192,8192,28672,f16:column,f16:row,f16:column,f16:column,1,0,serial,1,1,heuristic,tensorop,f16,64,64,32,1,1,1,2,2,2,1,16,8,8,75,1024,1073741824,3848424914944,3584,31.8764,31.3712,120730
1,CUTLASS,gemm,cutlass_tensorop_h1688gemm_64x128_64x2_nt_align8,passed,success,universal,8192,8192,28672,f16:column,f16:row,f16:column,f16:column,1,0,serial,1,1,heuristic,tensorop,f16,64,128,64,1,1,1,2,1,2,2,16,8,8,75,1024,1073741824,3848424914944,3584,18.9072,52.8898,203542
1,CUTLASS,gemm,cutlass_tensorop_h1688gemm_64x128_64x2_nt_align4,passed,success,universal,8192,8192,28672,f16:column,f16:row,f16:column,f16:column,1,0,serial,1,1,heuristic,tensorop,f16,64,128,64,1,1,1,2,1,2,2,16,8,8,75,1024,1073741824,3848424914944,3584,18.785,53.234,204867
1,CUTLASS,gemm,cutlass_tensorop_h1688gemm_64x128_64x2_nt_align2,passed,success,universal,8192,8192,28672,f16:column,f16:row,f16:column,f16:column,1,0,serial,1,1,heuristic,tensorop,f16,64,128,64,1,1,1,2,1,2,2,16,8,8,75,1024,1073741824,3848424914944,3584,19.0378,52.5271,202147
1,CUTLASS,gemm,cutlass_tensorop_h1688gemm_64x128_64x2_nt_align1,passed,success,universal,8192,8192,28672,f16:column,f16:row,f16:column,f16:column,1,0,serial,1,1,heuristic,tensorop,f16,64,128,64,1,1,1,2,1,2,2,16,8,8,75,1024,1073741824,3848424914944,3584,27.6012,36.2303,139430
1,CUTLASS,gemm,cutlass_tensorop_h1688gemm_256x128_32x2_tn_align8,passed,success,universal,8192,8192,28672,f16:row,f16:column,f16:column,f16:column,1,0,serial,1,1,heuristic,tensorop,f16,256,128,32,1,1,1,2,4,2,1,16,8,8,75,1024,1073741824,3848424914944,3584,16.8309,59.4146,228653
1,CUTLASS,gemm,cutlass_tensorop_h1688gemm_256x128_32x2_tn_align4,passed,success,universal,8192,8192,28672,f16:row,f16:column,f16:column,f16:column,1,0,serial,1,1,heuristic,tensorop,f16,256,128,32,1,1,1,2,4,2,1,16,8,8,75,1024,1073741824,3848424914944,3584,18.0387,55.4364,213343
1,CUTLASS,gemm,cutlass_tensorop_h1688gemm_256x128_32x2_tn_align2,passed,success,universal,8192,8192,28672,f16:row,f16:column,f16:column,f16:column,1,0,serial,1,1,heuristic,tensorop,f16,256,128,32,1,1,1,2,4,2,1,16,8,8,75,1024,1073741824,3848424914944,3584,21.4138,46.6989,179717
1,CUTLASS,gemm,cutlass_tensorop_h1688gemm_256x128_32x2_tn_align1,passed,success,universal,8192,8192,28672,f16:row,f16:column,f16:column,f16:column,1,0,serial,1,1,heuristic,tensorop,f16,256,128,32,1,1,1,2,4,2,1,16,8,8,75,1024,1073741824,3848424914944,3584,25.7589,38.8215,149402
1,CUTLASS,gemm,cutlass_tensorop_h1688gemm_128x256_32x2_tn_align8,passed,success,universal,8192,8192,28672,f16:row,f16:column,f16:column,f16:column,1,0,serial,1,1,heuristic,tensorop,f16,128,256,32,1,1,1,2,2,4,1,16,8,8,75,1024,1073741824,3848424914944,3584,17.0616,58.6112,225561
1,CUTLASS,gemm,cutlass_tensorop_h1688gemm_128x256_32x2_tn_align4,passed,success,universal,8192,8192,28672,f16:row,f16:column,f16:column,f16:column,1,0,serial,1,1,heuristic,tensorop,f16,128,256,32,1,1,1,2,2,4,1,16,8,8,75,1024,1073741824,3848424914944,3584,16.8237,59.4399,228750
1,CUTLASS,gemm,cutlass_tensorop_h1688gemm_128x256_32x2_tn_align2,passed,success,universal,8192,8192,28672,f16:row,f16:column,f16:column,f16:column,1,0,serial,1,1,heuristic,tensorop,f16,128,256,32,1,1,1,2,2,4,1,16,8,8,75,1024,1073741824,3848424914944,3584,18.5457,53.921,207511
1,CUTLASS,gemm,cutlass_tensorop_h1688gemm_128x256_32x2_tn_align1,passed,success,universal,8192,8192,28672,f16:row,f16:column,f16:column,f16:column,1,0,serial,1,1,heuristic,tensorop,f16,128,256,32,1,1,1,2,2,4,1,16,8,8,75,1024,1073741824,3848424914944,3584,26.1428,38.2515,147208
1,CUTLASS,gemm,cutlass_tensorop_h1688gemm_128x128_32x2_tn_align8,passed,success,universal,8192,8192,28672,f16:row,f16:column,f16:column,f16:column,1,0,serial,1,1,heuristic,tensorop,f16,128,128,32,1,1,1,2,2,2,1,16,8,8,75,1024,1073741824,3848424914944,3584,15.685,63.7551,245357
1,CUTLASS,gemm,cutlass_tensorop_h1688gemm_128x128_32x2_tn_align4,passed,success,universal,8192,8192,28672,f16:row,f16:column,f16:column,f16:column,1,0,serial,1,1,heuristic,tensorop,f16,128,128,32,1,1,1,2,2,2,1,16,8,8,75,1024,1073741824,3848424914944,3584,19.7228,50.7029,195126
1,CUTLASS,gemm,cutlass_tensorop_h1688gemm_128x128_32x2_tn_align2,passed,success,universal,8192,8192,28672,f16:row,f16:column,f16:column,f16:column,1,0,serial,1,1,heuristic,tensorop,f16,128,128,32,1,1,1,2,2,2,1,16,8,8,75,1024,1073741824,3848424914944,3584,18.78,53.2482,204922
1,CUTLASS,gemm,cutlass_tensorop_h1688gemm_128x128_32x2_tn_align1,passed,success,universal,8192,8192,28672,f16:row,f16:column,f16:column,f16:column,1,0,serial,1,1,heuristic,tensorop,f16,128,128,32,1,1,1,2,2,2,1,16,8,8,75,1024,1073741824,3848424914944,3584,26.4577,37.7962,145456
1,CUTLASS,gemm,cutlass_tensorop_h1688gemm_64x256_32x2_tn_align8,passed,success,universal,8192,8192,28672,f16:row,f16:column,f16:column,f16:column,1,0,serial,1,1,heuristic,tensorop,f16,64,256,32,1,1,1,2,1,4,1,16,8,8,75,1024,1073741824,3848424914944,3584,18.3764,54.4176,209422
1,CUTLASS,gemm,cutlass_tensorop_h1688gemm_64x256_32x2_tn_align4,passed,success,universal,8192,8192,28672,f16:row,f16:column,f16:column,f16:column,1,0,serial,1,1,heuristic,tensorop,f16,64,256,32,1,1,1,2,1,4,1,16,8,8,75,1024,1073741824,3848424914944,3584,18.7933,53.2105,204777
1,CUTLASS,gemm,cutlass_tensorop_h1688gemm_64x256_32x2_tn_align2,passed,success,universal,8192,8192,28672,f16:row,f16:column,f16:column,f16:column,1,0,serial,1,1,heuristic,tensorop,f16,64,256,32,1,1,1,2,1,4,1,16,8,8,75,1024,1073741824,3848424914944,3584,22.5656,44.3153,170544
1,CUTLASS,gemm,cutlass_tensorop_h1688gemm_64x256_32x2_tn_align1,passed,success,universal,8192,8192,28672,f16:row,f16:column,f16:column,f16:column,1,0,serial,1,1,heuristic,tensorop,f16,64,256,32,1,1,1,2,1,4,1,16,8,8,75,1024,1073741824,3848424914944,3584,33.1078,30.2044,116239
1,CUTLASS,gemm,cutlass_tensorop_h1688gemm_256x64_32x2_tn_align8,passed,success,universal,8192,8192,28672,f16:row,f16:column,f16:column,f16:column,1,0,serial,1,1,heuristic,tensorop,f16,256,64,32,1,1,1,2,4,1,1,16,8,8,75,1024,1073741824,3848424914944,3584,19.7559,50.6177,194798
1,CUTLASS,gemm,cutlass_tensorop_h1688gemm_256x64_32x2_tn_align4,passed,success,universal,8192,8192,28672,f16:row,f16:column,f16:column,f16:column,1,0,serial,1,1,heuristic,tensorop,f16,256,64,32,1,1,1,2,4,1,1,16,8,8,75,1024,1073741824,3848424914944,3584,21.5674,46.3663,178437
1,CUTLASS,gemm,cutlass_tensorop_h1688gemm_256x64_32x2_tn_align2,passed,success,universal,8192,8192,28672,f16:row,f16:column,f16:column,f16:column,1,0,serial,1,1,heuristic,tensorop,f16,256,64,32,1,1,1,2,4,1,1,16,8,8,75,1024,1073741824,3848424914944,3584,22.0148,45.424,174811
1,CUTLASS,gemm,cutlass_tensorop_h1688gemm_256x64_32x2_tn_align1,passed,success,universal,8192,8192,28672,f16:row,f16:column,f16:column,f16:column,1,0,serial,1,1,heuristic,tensorop,f16,256,64,32,1,1,1,2,4,1,1,16,8,8,75,1024,1073741824,3848424914944,3584,32.1946,31.0611,119536
1,CUTLASS,gemm,cutlass_tensorop_h1688gemm_64x128_32x2_tn_align8,passed,success,universal,8192,8192,28672,f16:row,f16:column,f16:column,f16:column,1,0,serial,1,1,heuristic,tensorop,f16,64,128,32,1,1,1,2,2,2,1,16,8,8,75,1024,1073741824,3848424914944,3584,20.0847,49.7891,191609
1,CUTLASS,gemm,cutlass_tensorop_h1688gemm_64x128_32x2_tn_align4,passed,success,universal,8192,8192,28672,f16:row,f16:column,f16:column,f16:column,1,0,serial,1,1,heuristic,tensorop,f16,64,128,32,1,1,1,2,2,2,1,16,8,8,75,1024,1073741824,3848424914944,3584,26.9007,37.1738,143060
1,CUTLASS,gemm,cutlass_tensorop_h1688gemm_64x128_32x2_tn_align2,passed,success,universal,8192,8192,28672,f16:row,f16:column,f16:column,f16:column,1,0,serial,1,1,heuristic,tensorop,f16,64,128,32,1,1,1,2,2,2,1,16,8,8,75,1024,1073741824,3848424914944,3584,27.4895,36.3775,139996
1,CUTLASS,gemm,cutlass_tensorop_h1688gemm_64x128_32x2_tn_align1,passed,success,universal,8192,8192,28672,f16:row,f16:column,f16:column,f16:column,1,0,serial,1,1,heuristic,tensorop,f16,64,128,32,1,1,1,2,2,2,1,16,8,8,75,1024,1073741824,3848424914944,3584,38.3901,26.0484,100245
1,CUTLASS,gemm,cutlass_tensorop_h1688gemm_128x64_32x2_tn_align8,passed,success,universal,8192,8192,28672,f16:row,f16:column,f16:column,f16:column,1,0,serial,1,1,heuristic,tensorop,f16,128,64,32,1,1,1,2,2,2,1,16,8,8,75,1024,1073741824,3848424914944,3584,20.4433,48.9157,188248
1,CUTLASS,gemm,cutlass_tensorop_h1688gemm_128x64_32x2_tn_align4,passed,success,universal,8192,8192,28672,f16:row,f16:column,f16:column,f16:column,1,0,serial,1,1,heuristic,tensorop,f16,128,64,32,1,1,1,2,2,2,1,16,8,8,75,1024,1073741824,3848424914944,3584,24.4049,40.9754,157691
1,CUTLASS,gemm,cutlass_tensorop_h1688gemm_128x64_32x2_tn_align2,passed,success,universal,8192,8192,28672,f16:row,f16:column,f16:column,f16:column,1,0,serial,1,1,heuristic,tensorop,f16,128,64,32,1,1,1,2,2,2,1,16,8,8,75,1024,1073741824,3848424914944,3584,31.2455,32.0046,123167
1,CUTLASS,gemm,cutlass_tensorop_h1688gemm_128x64_32x2_tn_align1,passed,success,universal,8192,8192,28672,f16:row,f16:column,f16:column,f16:column,1,0,serial,1,1,heuristic,tensorop,f16,128,64,32,1,1,1,2,2,2,1,16,8,8,75,1024,1073741824,3848424914944,3584,38.3859,26.0513,100256
1,CUTLASS,gemm,cutlass_tensorop_h1688gemm_64x64_32x2_tn_align8,passed,success,universal,8192,8192,28672,f16:row,f16:column,f16:column,f16:column,1,0,serial,1,1,heuristic,tensorop,f16,64,64,32,1,1,1,2,2,2,1,16,8,8,75,1024,1073741824,3848424914944,3584,26.179,38.1986,147004
1,CUTLASS,gemm,cutlass_tensorop_h1688gemm_64x64_32x2_tn_align4,passed,success,universal,8192,8192,28672,f16:row,f16:column,f16:column,f16:column,1,0,serial,1,1,heuristic,tensorop,f16,64,64,32,1,1,1,2,2,2,1,16,8,8,75,1024,1073741824,3848424914944,3584,31.4998,31.7463,122173
1,CUTLASS,gemm,cutlass_tensorop_h1688gemm_64x64_32x2_tn_align2,passed,success,universal,8192,8192,28672,f16:row,f16:column,f16:column,f16:column,1,0,serial,1,1,heuristic,tensorop,f16,64,64,32,1,1,1,2,2,2,1,16,8,8,75,1024,1073741824,3848424914944,3584,35.322,28.3109,108953
1,CUTLASS,gemm,cutlass_tensorop_h1688gemm_64x64_32x2_tn_align1,passed,success,universal,8192,8192,28672,f16:row,f16:column,f16:column,f16:column,1,0,serial,1,1,heuristic,tensorop,f16,64,64,32,1,1,1,2,2,2,1,16,8,8,75,1024,1073741824,3848424914944,3584,51.4056,19.4531,74863.9
1,CUTLASS,gemm,cutlass_tensorop_h1688gemm_64x128_64x2_tn_align8,passed,success,universal,8192,8192,28672,f16:row,f16:column,f16:column,f16:column,1,0,serial,1,1,heuristic,tensorop,f16,64,128,64,1,1,1,2,1,2,2,16,8,8,75,1024,1073741824,3848424914944,3584,18.5726,53.8428,207210
1,CUTLASS,gemm,cutlass_tensorop_h1688gemm_64x128_64x2_tn_align4,passed,success,universal,8192,8192,28672,f16:row,f16:column,f16:column,f16:column,1,0,serial,1,1,heuristic,tensorop,f16,64,128,64,1,1,1,2,1,2,2,16,8,8,75,1024,1073741824,3848424914944,3584,18.9,52.9101,203621
1,CUTLASS,gemm,cutlass_tensorop_h1688gemm_64x128_64x2_tn_align2,passed,success,universal,8192,8192,28672,f16:row,f16:column,f16:column,f16:column,1,0,serial,1,1,heuristic,tensorop,f16,64,128,64,1,1,1,2,1,2,2,16,8,8,75,1024,1073741824,3848424914944,3584,18.904,52.899,203578
1,CUTLASS,gemm,cutlass_tensorop_h1688gemm_64x128_64x2_tn_align1,passed,success,universal,8192,8192,28672,f16:row,f16:column,f16:column,f16:column,1,0,serial,1,1,heuristic,tensorop,f16,64,128,64,1,1,1,2,1,2,2,16,8,8,75,1024,1073741824,3848424914944,3584,23.294,42.9296,165211
1,CUTLASS,gemm,cutlass_tensorop_h1688gemm_256x128_32x2_tt_align8,passed,success,universal,8192,8192,28672,f16:row,f16:row,f16:column,f16:column,1,0,serial,1,1,heuristic,tensorop,f16,256,128,32,1,1,1,2,4,2,1,16,8,8,75,1024,1073741824,3848424914944,3584,16.4278,60.8723,234263
1,CUTLASS,gemm,cutlass_tensorop_h1688gemm_256x128_32x2_tt_align4,passed,success,universal,8192,8192,28672,f16:row,f16:row,f16:column,f16:column,1,0,serial,1,1,heuristic,tensorop,f16,256,128,32,1,1,1,2,4,2,1,16,8,8,75,1024,1073741824,3848424914944,3584,18.1067,55.2282,212542
1,CUTLASS,gemm,cutlass_tensorop_h1688gemm_256x128_32x2_tt_align2,passed,success,universal,8192,8192,28672,f16:row,f16:row,f16:column,f16:column,1,0,serial,1,1,heuristic,tensorop,f16,256,128,32,1,1,1,2,4,2,1,16,8,8,75,1024,1073741824,3848424914944,3584,17.4606,57.2717,220406
1,CUTLASS,gemm,cutlass_tensorop_h1688gemm_256x128_32x2_tt_align1,passed,success,universal,8192,8192,28672,f16:row,f16:row,f16:column,f16:column,1,0,serial,1,1,heuristic,tensorop,f16,256,128,32,1,1,1,2,4,2,1,16,8,8,75,1024,1073741824,3848424914944,3584,18.9485,52.7746,203099
1,CUTLASS,gemm,cutlass_tensorop_h1688gemm_128x256_32x2_tt_align8,passed,success,universal,8192,8192,28672,f16:row,f16:row,f16:column,f16:column,1,0,serial,1,1,heuristic,tensorop,f16,128,256,32,1,1,1,2,2,4,1,16,8,8,75,1024,1073741824,3848424914944,3584,15.7651,63.4313,244110
1,CUTLASS,gemm,cutlass_tensorop_h1688gemm_128x256_32x2_tt_align4,passed,success,universal,8192,8192,28672,f16:row,f16:row,f16:column,f16:column,1,0,serial,1,1,heuristic,tensorop,f16,128,256,32,1,1,1,2,2,4,1,16,8,8,75,1024,1073741824,3848424914944,3584,18.2162,54.8961,211263
1,CUTLASS,gemm,cutlass_tensorop_h1688gemm_128x256_32x2_tt_align2,passed,success,universal,8192,8192,28672,f16:row,f16:row,f16:column,f16:column,1,0,serial,1,1,heuristic,tensorop,f16,128,256,32,1,1,1,2,2,4,1,16,8,8,75,1024,1073741824,3848424914944,3584,18.637,53.6568,206494
1,CUTLASS,gemm,cutlass_tensorop_h1688gemm_128x256_32x2_tt_align1,passed,success,universal,8192,8192,28672,f16:row,f16:row,f16:column,f16:column,1,0,serial,1,1,heuristic,tensorop,f16,128,256,32,1,1,1,2,2,4,1,16,8,8,75,1024,1073741824,3848424914944,3584,22.775,43.9078,168976
1,CUTLASS,gemm,cutlass_tensorop_h1688gemm_128x128_32x2_tt_align8,passed,success,universal,8192,8192,28672,f16:row,f16:row,f16:column,f16:column,1,0,serial,1,1,heuristic,tensorop,f16,128,128,32,1,1,1,2,2,2,1,16,8,8,75,1024,1073741824,3848424914944,3584,14.7672,67.7176,260606
1,CUTLASS,gemm,cutlass_tensorop_h1688gemm_128x128_32x2_tt_align4,passed,success,universal,8192,8192,28672,f16:row,f16:row,f16:column,f16:column,1,0,serial,1,1,heuristic,tensorop,f16,128,128,32,1,1,1,2,2,2,1,16,8,8,75,1024,1073741824,3848424914944,3584,16.5601,60.386,232391
1,CUTLASS,gemm,cutlass_tensorop_h1688gemm_128x128_32x2_tt_align2,passed,success,universal,8192,8192,28672,f16:row,f16:row,f16:column,f16:column,1,0,serial,1,1,heuristic,tensorop,f16,128,128,32,1,1,1,2,2,2,1,16,8,8,75,1024,1073741824,3848424914944,3584,16.7064,59.8574,230357
1,CUTLASS,gemm,cutlass_tensorop_h1688gemm_128x128_32x2_tt_align1,passed,success,universal,8192,8192,28672,f16:row,f16:row,f16:column,f16:column,1,0,serial,1,1,heuristic,tensorop,f16,128,128,32,1,1,1,2,2,2,1,16,8,8,75,1024,1073741824,3848424914944,3584,21.7247,46.0306,177145
1,CUTLASS,gemm,cutlass_tensorop_h1688gemm_64x256_32x2_tt_align8,passed,success,universal,8192,8192,28672,f16:row,f16:row,f16:column,f16:column,1,0,serial,1,1,heuristic,tensorop,f16,64,256,32,1,1,1,2,1,4,1,16,8,8,75,1024,1073741824,3848424914944,3584,17.6396,56.6905,218169
1,CUTLASS,gemm,cutlass_tensorop_h1688gemm_64x256_32x2_tt_align4,passed,success,universal,8192,8192,28672,f16:row,f16:row,f16:column,f16:column,1,0,serial,1,1,heuristic,tensorop,f16,64,256,32,1,1,1,2,1,4,1,16,8,8,75,1024,1073741824,3848424914944,3584,19.158,52.1975,200878
1,CUTLASS,gemm,cutlass_tensorop_h1688gemm_64x256_32x2_tt_align2,passed,success,universal,8192,8192,28672,f16:row,f16:row,f16:column,f16:column,1,0,serial,1,1,heuristic,tensorop,f16,64,256,32,1,1,1,2,1,4,1,16,8,8,75,1024,1073741824,3848424914944,3584,21.2874,46.9761,180784
1,CUTLASS,gemm,cutlass_tensorop_h1688gemm_64x256_32x2_tt_align1,passed,success,universal,8192,8192,28672,f16:row,f16:row,f16:column,f16:column,1,0,serial,1,1,heuristic,tensorop,f16,64,256,32,1,1,1,2,1,4,1,16,8,8,75,1024,1073741824,3848424914944,3584,30.2795,33.0256,127097
1,CUTLASS,gemm,cutlass_tensorop_h1688gemm_256x64_32x2_tt_align8,passed,success,universal,8192,8192,28672,f16:row,f16:row,f16:column,f16:column,1,0,serial,1,1,heuristic,tensorop,f16,256,64,32,1,1,1,2,4,1,1,16,8,8,75,1024,1073741824,3848424914944,3584,17.0822,58.5406,225289
1,CUTLASS,gemm,cutlass_tensorop_h1688gemm_256x64_32x2_tt_align4,passed,success,universal,8192,8192,28672,f16:row,f16:row,f16:column,f16:column,1,0,serial,1,1,heuristic,tensorop,f16,256,64,32,1,1,1,2,4,1,1,16,8,8,75,1024,1073741824,3848424914944,3584,18.456,54.183,208519
1,CUTLASS,gemm,cutlass_tensorop_h1688gemm_256x64_32x2_tt_align2,passed,success,universal,8192,8192,28672,f16:row,f16:row,f16:column,f16:column,1,0,serial,1,1,heuristic,tensorop,f16,256,64,32,1,1,1,2,4,1,1,16,8,8,75,1024,1073741824,3848424914944,3584,19.7917,50.5263,194447
1,CUTLASS,gemm,cutlass_tensorop_h1688gemm_256x64_32x2_tt_align1,passed,success,universal,8192,8192,28672,f16:row,f16:row,f16:column,f16:column,1,0,serial,1,1,heuristic,tensorop,f16,256,64,32,1,1,1,2,4,1,1,16,8,8,75,1024,1073741824,3848424914944,3584,23.4584,42.6286,164053
1,CUTLASS,gemm,cutlass_tensorop_h1688gemm_64x128_32x2_tt_align8,passed,success,universal,8192,8192,28672,f16:row,f16:row,f16:column,f16:column,1,0,serial,1,1,heuristic,tensorop,f16,64,128,32,1,1,1,2,2,2,1,16,8,8,75,1024,1073741824,3848424914944,3584,19.6434,50.9077,195914
1,CUTLASS,gemm,cutlass_tensorop_h1688gemm_64x128_32x2_tt_align4,passed,success,universal,8192,8192,28672,f16:row,f16:row,f16:column,f16:column,1,0,serial,1,1,heuristic,tensorop,f16,64,128,32,1,1,1,2,2,2,1,16,8,8,75,1024,1073741824,3848424914944,3584,24.7538,40.3979,155468
1,CUTLASS,gemm,cutlass_tensorop_h1688gemm_64x128_32x2_tt_align2,passed,success,universal,8192,8192,28672,f16:row,f16:row,f16:column,f16:column,1,0,serial,1,1,heuristic,tensorop,f16,64,128,32,1,1,1,2,2,2,1,16,8,8,75,1024,1073741824,3848424914944,3584,22.7513,43.9535,169152
1,CUTLASS,gemm,cutlass_tensorop_h1688gemm_64x128_32x2_tt_align1,passed,success,universal,8192,8192,28672,f16:row,f16:row,f16:column,f16:column,1,0,serial,1,1,heuristic,tensorop,f16,64,128,32,1,1,1,2,2,2,1,16,8,8,75,1024,1073741824,3848424914944,3584,33.545,29.8107,114724
1,CUTLASS,gemm,cutlass_tensorop_h1688gemm_128x64_32x2_tt_align8,passed,success,universal,8192,8192,28672,f16:row,f16:row,f16:column,f16:column,1,0,serial,1,1,heuristic,tensorop,f16,128,64,32,1,1,1,2,2,2,1,16,8,8,75,1024,1073741824,3848424914944,3584,19.708,50.7408,195272
1,CUTLASS,gemm,cutlass_tensorop_h1688gemm_128x64_32x2_tt_align4,passed,success,universal,8192,8192,28672,f16:row,f16:row,f16:column,f16:column,1,0,serial,1,1,heuristic,tensorop,f16,128,64,32,1,1,1,2,2,2,1,16,8,8,75,1024,1073741824,3848424914944,3584,20.5974,48.5499,186841
1,CUTLASS,gemm,cutlass_tensorop_h1688gemm_128x64_32x2_tt_align2,passed,success,universal,8192,8192,28672,f16:row,f16:row,f16:column,f16:column,1,0,serial,1,1,heuristic,tensorop,f16,128,64,32,1,1,1,2,2,2,1,16,8,8,75,1024,1073741824,3848424914944,3584,21.696,46.0914,177379
1,CUTLASS,gemm,cutlass_tensorop_h1688gemm_128x64_32x2_tt_align1,passed,success,universal,8192,8192,28672,f16:row,f16:row,f16:column,f16:column,1,0,serial,1,1,heuristic,tensorop,f16,128,64,32,1,1,1,2,2,2,1,16,8,8,75,1024,1073741824,3848424914944,3584,29.9819,33.3535,128358
1,CUTLASS,gemm,cutlass_tensorop_h1688gemm_64x64_32x2_tt_align8,passed,success,universal,8192,8192,28672,f16:row,f16:row,f16:column,f16:column,1,0,serial,1,1,heuristic,tensorop,f16,64,64,32,1,1,1,2,2,2,1,16,8,8,75,1024,1073741824,3848424914944,3584,25.0942,39.8498,153359
1,CUTLASS,gemm,cutlass_tensorop_h1688gemm_64x64_32x2_tt_align4,passed,success,universal,8192,8192,28672,f16:row,f16:row,f16:column,f16:column,1,0,serial,1,1,heuristic,tensorop,f16,64,64,32,1,1,1,2,2,2,1,16,8,8,75,1024,1073741824,3848424914944,3584,25.4724,39.2582,151082
1,CUTLASS,gemm,cutlass_tensorop_h1688gemm_64x64_32x2_tt_align2,passed,success,universal,8192,8192,28672,f16:row,f16:row,f16:column,f16:column,1,0,serial,1,1,heuristic,tensorop,f16,64,64,32,1,1,1,2,2,2,1,16,8,8,75,1024,1073741824,3848424914944,3584,28.4714,35.123,135168
1,CUTLASS,gemm,cutlass_tensorop_h1688gemm_64x64_32x2_tt_align1,passed,success,universal,8192,8192,28672,f16:row,f16:row,f16:column,f16:column,1,0,serial,1,1,heuristic,tensorop,f16,64,64,32,1,1,1,2,2,2,1,16,8,8,75,1024,1073741824,3848424914944,3584,41.2817,24.2238,93223.5
1,CUTLASS,gemm,cutlass_tensorop_h1688gemm_64x128_64x2_tt_align8,passed,success,universal,8192,8192,28672,f16:row,f16:row,f16:column,f16:column,1,0,serial,1,1,heuristic,tensorop,f16,64,128,64,1,1,1,2,1,2,2,16,8,8,75,1024,1073741824,3848424914944,3584,18.788,53.2256,204835
1,CUTLASS,gemm,cutlass_tensorop_h1688gemm_64x128_64x2_tt_align4,passed,success,universal,8192,8192,28672,f16:row,f16:row,f16:column,f16:column,1,0,serial,1,1,heuristic,tensorop,f16,64,128,64,1,1,1,2,1,2,2,16,8,8,75,1024,1073741824,3848424914944,3584,19.0881,52.3887,201614
1,CUTLASS,gemm,cutlass_tensorop_h1688gemm_64x128_64x2_tt_align2,passed,success,universal,8192,8192,28672,f16:row,f16:row,f16:column,f16:column,1,0,serial,1,1,heuristic,tensorop,f16,64,128,64,1,1,1,2,1,2,2,16,8,8,75,1024,1073741824,3848424914944,3584,19.8113,50.4762,194254
1,CUTLASS,gemm,cutlass_tensorop_h1688gemm_64x128_64x2_tt_align1,passed,success,universal,8192,8192,28672,f16:row,f16:row,f16:column,f16:column,1,0,serial,1,1,heuristic,tensorop,f16,64,128,64,1,1,1,2,1,2,2,16,8,8,75,1024,1073741824,3848424914944,3584,23.1364,43.222,166337
1,CUTLASS,gemm,cutlass_tensorop_h16816gemm_256x128_32x3_nn_align8,passed,success,universal,8192,8192,28672,f16:column,f16:column,f16:column,f16:column,1,0,serial,1,1,heuristic,tensorop,f16,256,128,32,1,1,1,3,4,2,1,16,8,16,80,1024,1073741824,3848424914944,3584,12.1994,81.9711,315460
1,CUTLASS,gemm,cutlass_tensorop_h16816gemm_256x128_32x3_nn_align4,passed,success,universal,8192,8192,28672,f16:column,f16:column,f16:column,f16:column,1,0,serial,1,1,heuristic,tensorop,f16,256,128,32,1,1,1,3,4,2,1,16,8,16,80,1024,1073741824,3848424914944,3584,12.4897,80.0658,308127
1,CUTLASS,gemm,cutlass_tensorop_h16816gemm_256x128_32x3_nn_align2,passed,success,universal,8192,8192,28672,f16:column,f16:column,f16:column,f16:column,1,0,serial,1,1,heuristic,tensorop,f16,256,128,32,1,1,1,3,4,2,1,16,8,16,80,1024,1073741824,3848424914944,3584,13.8333,72.2892,278200
1,CUTLASS,gemm,cutlass_tensorop_h16816gemm_128x256_32x3_nn_align8,passed,success,universal,8192,8192,28672,f16:column,f16:column,f16:column,f16:column,1,0,serial,1,1,heuristic,tensorop,f16,128,256,32,1,1,1,3,2,4,1,16,8,16,80,1024,1073741824,3848424914944,3584,11.7497,85.1087,327534
1,CUTLASS,gemm,cutlass_tensorop_h16816gemm_128x256_32x3_nn_align4,passed,success,universal,8192,8192,28672,f16:column,f16:column,f16:column,f16:column,1,0,serial,1,1,heuristic,tensorop,f16,128,256,32,1,1,1,3,2,4,1,16,8,16,80,1024,1073741824,3848424914944,3584,11.8,84.746,326139
1,CUTLASS,gemm,cutlass_tensorop_h16816gemm_128x256_32x3_nn_align2,passed,success,universal,8192,8192,28672,f16:column,f16:column,f16:column,f16:column,1,0,serial,1,1,heuristic,tensorop,f16,128,256,32,1,1,1,3,2,4,1,16,8,16,80,1024,1073741824,3848424914944,3584,12.8679,77.7128,299072
1,CUTLASS,gemm,cutlass_tensorop_h16816gemm_256x64_32x3_nn_align8,passed,success,universal,8192,8192,28672,f16:column,f16:column,f16:column,f16:column,1,0,serial,1,1,heuristic,tensorop,f16,256,64,32,1,1,1,3,4,1,1,16,8,16,80,1024,1073741824,3848424914944,3584,16.2935,61.3742,236194
1,CUTLASS,gemm,cutlass_tensorop_h16816gemm_256x64_32x3_nn_align4,passed,success,universal,8192,8192,28672,f16:column,f16:column,f16:column,f16:column,1,0,serial,1,1,heuristic,tensorop,f16,256,64,32,1,1,1,3,4,1,1,16,8,16,80,1024,1073741824,3848424914944,3584,16.817,59.4638,228842
1,CUTLASS,gemm,cutlass_tensorop_h16816gemm_256x64_32x3_nn_align2,passed,success,universal,8192,8192,28672,f16:column,f16:column,f16:column,f16:column,1,0,serial,1,1,heuristic,tensorop,f16,256,64,32,1,1,1,3,4,1,1,16,8,16,80,1024,1073741824,3848424914944,3584,33.3373,29.9964,115439
1,CUTLASS,gemm,cutlass_tensorop_h16816gemm_256x64_32x4_nn_align8,passed,success,universal,8192,8192,28672,f16:column,f16:column,f16:column,f16:column,1,0,serial,1,1,heuristic,tensorop,f16,256,64,32,1,1,1,4,4,1,1,16,8,16,80,1024,1073741824,3848424914944,3584,16.1188,62.0393,238754
1,CUTLASS,gemm,cutlass_tensorop_h16816gemm_256x64_32x4_nn_align4,passed,success,universal,8192,8192,28672,f16:column,f16:column,f16:column,f16:column,1,0,serial,1,1,heuristic,tensorop,f16,256,64,32,1,1,1,4,4,1,1,16,8,16,80,1024,1073741824,3848424914944,3584,17.6819,56.5549,217647
1,CUTLASS,gemm,cutlass_tensorop_h16816gemm_256x64_32x4_nn_align2,passed,success,universal,8192,8192,28672,f16:column,f16:column,f16:column,f16:column,1,0,serial,1,1,heuristic,tensorop,f16,256,64,32,1,1,1,4,4,1,1,16,8,16,80,1024,1073741824,3848424914944,3584,40.7047,24.5672,94544.9
1,CUTLASS,gemm,cutlass_tensorop_h16816gemm_64x256_32x4_nn_align8,passed,success,universal,8192,8192,28672,f16:column,f16:column,f16:column,f16:column,1,0,serial,1,1,heuristic,tensorop,f16,64,256,32,1,1,1,4,1,4,1,16,8,16,80,1024,1073741824,3848424914944,3584,15.5946,64.1248,246779
1,CUTLASS,gemm,cutlass_tensorop_h16816gemm_64x256_32x4_nn_align4,passed,success,universal,8192,8192,28672,f16:column,f16:column,f16:column,f16:column,1,0,serial,1,1,heuristic,tensorop,f16,64,256,32,1,1,1,4,1,4,1,16,8,16,80,1024,1073741824,3848424914944,3584,16.1083,62.0796,238909
1,CUTLASS,gemm,cutlass_tensorop_h16816gemm_64x256_32x4_nn_align2,passed,success,universal,8192,8192,28672,f16:column,f16:column,f16:column,f16:column,1,0,serial,1,1,heuristic,tensorop,f16,64,256,32,1,1,1,4,1,4,1,16,8,16,80,1024,1073741824,3848424914944,3584,16.8658,59.2916,228179
1,CUTLASS,gemm,cutlass_tensorop_h16816gemm_128x128_32x3_nn_align8,passed,success,universal,8192,8192,28672,f16:column,f16:column,f16:column,f16:column,1,0,serial,1,1,heuristic,tensorop,f16,128,128,32,1,1,1,3,2,2,1,16,8,16,80,1024,1073741824,3848424914944,3584,13.3561,74.872,288139
1,CUTLASS,gemm,cutlass_tensorop_h16816gemm_128x128_32x3_nn_align4,passed,success,universal,8192,8192,28672,f16:column,f16:column,f16:column,f16:column,1,0,serial,1,1,heuristic,tensorop,f16,128,128,32,1,1,1,3,2,2,1,16,8,16,80,1024,1073741824,3848424914944,3584,13.9353,71.7602,276164
1,CUTLASS,gemm,cutlass_tensorop_h16816gemm_128x128_32x3_nn_align2,passed,success,universal,8192,8192,28672,f16:column,f16:column,f16:column,f16:column,1,0,serial,1,1,heuristic,tensorop,f16,128,128,32,1,1,1,3,2,2,1,16,8,16,80,1024,1073741824,3848424914944,3584,15.3311,65.2268,251020
1,CUTLASS,gemm,cutlass_tensorop_h16816gemm_128x128_32x4_nn_align8,passed,success,universal,8192,8192,28672,f16:column,f16:column,f16:column,f16:column,1,0,serial,1,1,heuristic,tensorop,f16,128,128,32,1,1,1,4,2,2,1,16,8,16,80,1024,1073741824,3848424914944,3584,13.442,74.3935,286298
1,CUTLASS,gemm,cutlass_tensorop_h16816gemm_128x128_32x4_nn_align4,passed,success,universal,8192,8192,28672,f16:column,f16:column,f16:column,f16:column,1,0,serial,1,1,heuristic,tensorop,f16,128,128,32,1,1,1,4,2,2,1,16,8,16,80,1024,1073741824,3848424914944,3584,14.0254,71.2991,274389
1,CUTLASS,gemm,cutlass_tensorop_h16816gemm_128x128_32x4_nn_align2,passed,success,universal,8192,8192,28672,f16:column,f16:column,f16:column,f16:column,1,0,serial,1,1,heuristic,tensorop,f16,128,128,32,1,1,1,4,2,2,1,16,8,16,80,1024,1073741824,3848424914944,3584,15.2188,65.7083,252874
1,CUTLASS,gemm,cutlass_tensorop_h16816gemm_128x128_32x5_nn_align8,passed,success,universal,8192,8192,28672,f16:column,f16:column,f16:column,f16:column,1,0,serial,1,1,heuristic,tensorop,f16,128,128,32,1,1,1,5,2,2,1,16,8,16,80,1024,1073741824,3848424914944,3584,13.229,75.5917,290909
1,CUTLASS,gemm,cutlass_tensorop_h16816gemm_128x128_32x5_nn_align4,passed,success,universal,8192,8192,28672,f16:column,f16:column,f16:column,f16:column,1,0,serial,1,1,heuristic,tensorop,f16,128,128,32,1,1,1,5,2,2,1,16,8,16,80,1024,1073741824,3848424914944,3584,13.9587,71.6397,275700
1,CUTLASS,gemm,cutlass_tensorop_h16816gemm_128x128_32x5_nn_align2,passed,success,universal,8192,8192,28672,f16:column,f16:column,f16:column,f16:column,1,0,serial,1,1,heuristic,tensorop,f16,128,128,32,1,1,1,5,2,2,1,16,8,16,80,1024,1073741824,3848424914944,3584,15.5356,64.3682,247716
1,CUTLASS,gemm,cutlass_tensorop_h16816gemm_128x64_32x6_nn_align8,passed,success,universal,8192,8192,28672,f16:column,f16:column,f16:column,f16:column,1,0,serial,1,1,heuristic,tensorop,f16,128,64,32,1,1,1,6,2,2,1,16,8,16,80,1024,1073741824,3848424914944,3584,18.6464,53.6296,206389
1,CUTLASS,gemm,cutlass_tensorop_h16816gemm_128x64_32x6_nn_align4,passed,success,universal,8192,8192,28672,f16:column,f16:column,f16:column,f16:column,1,0,serial,1,1,heuristic,tensorop,f16,128,64,32,1,1,1,6,2,2,1,16,8,16,80,1024,1073741824,3848424914944,3584,19.6515,50.8867,195834
1,CUTLASS,gemm,cutlass_tensorop_h16816gemm_128x64_32x6_nn_align2,passed,success,universal,8192,8192,28672,f16:column,f16:column,f16:column,f16:column,1,0,serial,1,1,heuristic,tensorop,f16,128,64,32,1,1,1,6,2,2,1,16,8,16,80,1024,1073741824,3848424914944,3584,23.128,43.2377,166397
1,CUTLASS,gemm,cutlass_tensorop_h16816gemm_64x128_32x6_nn_align8,passed,success,universal,8192,8192,28672,f16:column,f16:column,f16:column,f16:column,1,0,serial,1,1,heuristic,tensorop,f16,64,128,32,1,1,1,6,2,2,1,16,8,16,80,1024,1073741824,3848424914944,3584,18.2577,54.7714,210784
1,CUTLASS,gemm,cutlass_tensorop_h16816gemm_64x128_32x6_nn_align4,passed,success,universal,8192,8192,28672,f16:column,f16:column,f16:column,f16:column,1,0,serial,1,1,heuristic,tensorop,f16,64,128,32,1,1,1,6,2,2,1,16,8,16,80,1024,1073741824,3848424914944,3584,19.0824,52.4042,201674
1,CUTLASS,gemm,cutlass_tensorop_h16816gemm_64x128_32x6_nn_align2,passed,success,universal,8192,8192,28672,f16:column,f16:column,f16:column,f16:column,1,0,serial,1,1,heuristic,tensorop,f16,64,128,32,1,1,1,6,2,2,1,16,8,16,80,1024,1073741824,3848424914944,3584,20.3128,49.2301,189458
1,CUTLASS,gemm,cutlass_tensorop_h16816gemm_64x64_32x10_nn_align8,passed,success,universal,8192,8192,28672,f16:column,f16:column,f16:column,f16:column,1,0,serial,1,1,heuristic,tensorop,f16,64,64,32,1,1,1,10,2,2,1,16,8,16,80,1024,1073741824,3848424914944,3584,23.5857,42.3986,163168
1,CUTLASS,gemm,cutlass_tensorop_h16816gemm_64x64_32x10_nn_align4,passed,success,universal,8192,8192,28672,f16:column,f16:column,f16:column,f16:column,1,0,serial,1,1,heuristic,tensorop,f16,64,64,32,1,1,1,10,2,2,1,16,8,16,80,1024,1073741824,3848424914944,3584,24.7161,40.4595,155705
1,CUTLASS,gemm,cutlass_tensorop_h16816gemm_64x64_32x10_nn_align2,passed,success,universal,8192,8192,28672,f16:column,f16:column,f16:column,f16:column,1,0,serial,1,1,heuristic,tensorop,f16,64,64,32,1,1,1,10,2,2,1,16,8,16,80,1024,1073741824,3848424914944,3584,28.7099,34.8312,134045
1,CUTLASS,gemm,cutlass_tensorop_h16816gemm_128x128_64x3_nn_align8,passed,success,universal,8192,8192,28672,f16:column,f16:column,f16:column,f16:column,1,0,serial,1,1,heuristic,tensorop,f16,128,128,64,1,1,1,3,2,2,1,16,8,16,80,1024,1073741824,3848424914944,3584,13.1787,75.8802,292019
1,CUTLASS,gemm,cutlass_tensorop_h16816gemm_128x128_64x3_nn_align4,passed,success,universal,8192,8192,28672,f16:column,f16:column,f16:column,f16:column,1,0,serial,1,1,heuristic,tensorop,f16,128,128,64,1,1,1,3,2,2,1,16,8,16,80,1024,1073741824,3848424914944,3584,13.6209,73.4164,282537
1,CUTLASS,gemm,cutlass_tensorop_h16816gemm_128x128_64x3_nn_align2,passed,success,universal,8192,8192,28672,f16:column,f16:column,f16:column,f16:column,1,0,serial,1,1,heuristic,tensorop,f16,128,128,64,1,1,1,3,2,2,1,16,8,16,80,1024,1073741824,3848424914944,3584,14.9379,66.9438,257628
1,CUTLASS,gemm,cutlass_tensorop_h16816gemm_128x64_64x3_nn_align8,passed,success,universal,8192,8192,28672,f16:column,f16:column,f16:column,f16:column,1,0,serial,1,1,heuristic,tensorop,f16,128,64,64,1,1,1,3,2,2,1,16,8,16,80,1024,1073741824,3848424914944,3584,18.1951,54.9597,211508
1,CUTLASS,gemm,cutlass_tensorop_h16816gemm_128x64_64x3_nn_align4,passed,success,universal,8192,8192,28672,f16:column,f16:column,f16:column,f16:column,1,0,serial,1,1,heuristic,tensorop,f16,128,64,64,1,1,1,3,2,2,1,16,8,16,80,1024,1073741824,3848424914944,3584,19.0163,52.5865,202375
1,CUTLASS,gemm,cutlass_tensorop_h16816gemm_128x64_64x3_nn_align2,passed,success,universal,8192,8192,28672,f16:column,f16:column,f16:column,f16:column,1,0,serial,1,1,heuristic,tensorop,f16,128,64,64,1,1,1,3,2,2,1,16,8,16,80,1024,1073741824,3848424914944,3584,20.0401,49.9,192036
1,CUTLASS,gemm,cutlass_tensorop_h16816gemm_64x128_64x3_nn_align8,passed,success,universal,8192,8192,28672,f16:column,f16:column,f16:column,f16:column,1,0,serial,1,1,heuristic,tensorop,f16,64,128,64,1,1,1,3,2,2,1,16,8,16,80,1024,1073741824,3848424914944,3584,18.1288,55.1609,212282
1,CUTLASS,gemm,cutlass_tensorop_h16816gemm_64x128_64x3_nn_align4,passed,success,universal,8192,8192,28672,f16:column,f16:column,f16:column,f16:column,1,0,serial,1,1,heuristic,tensorop,f16,64,128,64,1,1,1,3,2,2,1,16,8,16,80,1024,1073741824,3848424914944,3584,18.8564,53.0323,204091
1,CUTLASS,gemm,cutlass_tensorop_h16816gemm_64x128_64x3_nn_align2,passed,success,universal,8192,8192,28672,f16:column,f16:column,f16:column,f16:column,1,0,serial,1,1,heuristic,tensorop,f16,64,128,64,1,1,1,3,2,2,1,16,8,16,80,1024,1073741824,3848424914944,3584,19.7679,50.587,194680
1,CUTLASS,gemm,cutlass_tensorop_h16816gemm_64x64_64x5_nn_align8,passed,success,universal,8192,8192,28672,f16:column,f16:column,f16:column,f16:column,1,0,serial,1,1,heuristic,tensorop,f16,64,64,64,1,1,1,5,2,2,1,16,8,16,80,1024,1073741824,3848424914944,3584,23.3551,42.8172,164779
1,CUTLASS,gemm,cutlass_tensorop_h16816gemm_64x64_64x5_nn_align4,passed,success,universal,8192,8192,28672,f16:column,f16:column,f16:column,f16:column,1,0,serial,1,1,heuristic,tensorop,f16,64,64,64,1,1,1,5,2,2,1,16,8,16,80,1024,1073741824,3848424914944,3584,24.0882,41.514,159764
1,CUTLASS,gemm,cutlass_tensorop_h16816gemm_64x64_64x5_nn_align2,passed,success,universal,8192,8192,28672,f16:column,f16:column,f16:column,f16:column,1,0,serial,1,1,heuristic,tensorop,f16,64,64,64,1,1,1,5,2,2,1,16,8,16,80,1024,1073741824,3848424914944,3584,26.3426,37.9613,146091
1,CUTLASS,gemm,cutlass_tensorop_h16816gemm_256x128_32x3_nt_align8,passed,success,universal,8192,8192,28672,f16:column,f16:row,f16:column,f16:column,1,0,serial,1,1,heuristic,tensorop,f16,256,128,32,1,1,1,3,4,2,1,16,8,16,80,1024,1073741824,3848424914944,3584,11.8149,84.6388,325726
1,CUTLASS,gemm,cutlass_tensorop_h16816gemm_256x128_32x3_nt_align4,passed,success,universal,8192,8192,28672,f16:column,f16:row,f16:column,f16:column,1,0,serial,1,1,heuristic,tensorop,f16,256,128,32,1,1,1,3,4,2,1,16,8,16,80,1024,1073741824,3848424914944,3584,11.7646,85.0005,327118
1,CUTLASS,gemm,cutlass_tensorop_h16816gemm_256x128_32x3_nt_align2,passed,success,universal,8192,8192,28672,f16:column,f16:row,f16:column,f16:column,1,0,serial,1,1,heuristic,tensorop,f16,256,128,32,1,1,1,3,4,2,1,16,8,16,80,1024,1073741824,3848424914944,3584,12.8489,77.8274,299513
1,CUTLASS,gemm,cutlass_tensorop_h16816gemm_128x256_32x3_nt_align8,passed,success,universal,8192,8192,28672,f16:column,f16:row,f16:column,f16:column,1,0,serial,1,1,heuristic,tensorop,f16,128,256,32,1,1,1,3,2,4,1,16,8,16,80,1024,1073741824,3848424914944,3584,11.8699,84.2465,324216
1,CUTLASS,gemm,cutlass_tensorop_h16816gemm_128x256_32x3_nt_align4,passed,success,universal,8192,8192,28672,f16:column,f16:row,f16:column,f16:column,1,0,serial,1,1,heuristic,tensorop,f16,128,256,32,1,1,1,3,2,4,1,16,8,16,80,1024,1073741824,3848424914944,3584,12.2872,81.3856,313206
1,CUTLASS,gemm,cutlass_tensorop_h16816gemm_128x256_32x3_nt_align2,passed,success,universal,8192,8192,28672,f16:column,f16:row,f16:column,f16:column,1,0,serial,1,1,heuristic,tensorop,f16,128,256,32,1,1,1,3,2,4,1,16,8,16,80,1024,1073741824,3848424914944,3584,12.7195,78.6194,302561
1,CUTLASS,gemm,cutlass_tensorop_h16816gemm_256x64_32x3_nt_align8,passed,success,universal,8192,8192,28672,f16:column,f16:row,f16:column,f16:column,1,0,serial,1,1,heuristic,tensorop,f16,256,64,32,1,1,1,3,4,1,1,16,8,16,80,1024,1073741824,3848424914944,3584,15.5401,64.3496,247645
1,CUTLASS,gemm,cutlass_tensorop_h16816gemm_256x64_32x3_nt_align4,passed,success,universal,8192,8192,28672,f16:column,f16:row,f16:column,f16:column,1,0,serial,1,1,heuristic,tensorop,f16,256,64,32,1,1,1,3,4,1,1,16,8,16,80,1024,1073741824,3848424914944,3584,16.1142,62.0572,238822
1,CUTLASS,gemm,cutlass_tensorop_h16816gemm_256x64_32x3_nt_align2,passed,success,universal,8192,8192,28672,f16:column,f16:row,f16:column,f16:column,1,0,serial,1,1,heuristic,tensorop,f16,256,64,32,1,1,1,3,4,1,1,16,8,16,80,1024,1073741824,3848424914944,3584,16.7874,59.5687,229245
1,CUTLASS,gemm,cutlass_tensorop_h16816gemm_256x64_32x4_nt_align8,passed,success,universal,8192,8192,28672,f16:column,f16:row,f16:column,f16:column,1,0,serial,1,1,heuristic,tensorop,f16,256,64,32,1,1,1,4,4,1,1,16,8,16,80,1024,1073741824,3848424914944,3584,15.536,64.3665,247710
1,CUTLASS,gemm,cutlass_tensorop_h16816gemm_256x64_32x4_nt_align4,passed,success,universal,8192,8192,28672,f16:column,f16:row,f16:column,f16:column,1,0,serial,1,1,heuristic,tensorop,f16,256,64,32,1,1,1,4,4,1,1,16,8,16,80,1024,1073741824,3848424914944,3584,16.1127,62.0628,238844
1,CUTLASS,gemm,cutlass_tensorop_h16816gemm_256x64_32x4_nt_align2,passed,success,universal,8192,8192,28672,f16:column,f16:row,f16:column,f16:column,1,0,serial,1,1,heuristic,tensorop,f16,256,64,32,1,1,1,4,4,1,1,16,8,16,80,1024,1073741824,3848424914944,3584,17.3486,57.6415,221829
1,CUTLASS,gemm,cutlass_tensorop_h16816gemm_64x256_32x4_nt_align8,passed,success,universal,8192,8192,28672,f16:column,f16:row,f16:column,f16:column,1,0,serial,1,1,heuristic,tensorop,f16,64,256,32,1,1,1,4,1,4,1,16,8,16,80,1024,1073741824,3848424914944,3584,15.9627,62.6459,241088
1,CUTLASS,gemm,cutlass_tensorop_h16816gemm_64x256_32x4_nt_align4,passed,success,universal,8192,8192,28672,f16:column,f16:row,f16:column,f16:column,1,0,serial,1,1,heuristic,tensorop,f16,64,256,32,1,1,1,4,1,4,1,16,8,16,80,1024,1073741824,3848424914944,3584,16.2125,61.6809,237374
1,CUTLASS,gemm,cutlass_tensorop_h16816gemm_64x256_32x4_nt_align2,passed,success,universal,8192,8192,28672,f16:column,f16:row,f16:column,f16:column,1,0,serial,1,1,heuristic,tensorop,f16,64,256,32,1,1,1,4,1,4,1,16,8,16,80,1024,1073741824,3848424914944,3584,16.7672,59.6403,229521
1,CUTLASS,gemm,cutlass_tensorop_h16816gemm_128x128_32x3_nt_align8,passed,success,universal,8192,8192,28672,f16:column,f16:row,f16:column,f16:column,1,0,serial,1,1,heuristic,tensorop,f16,128,128,32,1,1,1,3,2,2,1,16,8,16,80,1024,1073741824,3848424914944,3584,13.1241,76.1955,293233
1,CUTLASS,gemm,cutlass_tensorop_h16816gemm_128x128_32x3_nt_align4,passed,success,universal,8192,8192,28672,f16:column,f16:row,f16:column,f16:column,1,0,serial,1,1,heuristic,tensorop,f16,128,128,32,1,1,1,3,2,2,1,16,8,16,80,1024,1073741824,3848424914944,3584,13.5133,74.0011,284788
1,CUTLASS,gemm,cutlass_tensorop_h16816gemm_128x128_32x3_nt_align2,passed,success,universal,8192,8192,28672,f16:column,f16:row,f16:column,f16:column,1,0,serial,1,1,heuristic,tensorop,f16,128,128,32,1,1,1,3,2,2,1,16,8,16,80,1024,1073741824,3848424914944,3584,13.8163,72.3782,278542
1,CUTLASS,gemm,cutlass_tensorop_h16816gemm_128x128_32x4_nt_align8,passed,success,universal,8192,8192,28672,f16:column,f16:row,f16:column,f16:column,1,0,serial,1,1,heuristic,tensorop,f16,128,128,32,1,1,1,4,2,2,1,16,8,16,80,1024,1073741824,3848424914944,3584,13.2327,75.5702,290826
1,CUTLASS,gemm,cutlass_tensorop_h16816gemm_128x128_32x4_nt_align4,passed,success,universal,8192,8192,28672,f16:column,f16:row,f16:column,f16:column,1,0,serial,1,1,heuristic,tensorop,f16,128,128,32,1,1,1,4,2,2,1,16,8,16,80,1024,1073741824,3848424914944,3584,13.4165,74.5348,286842
1,CUTLASS,gemm,cutlass_tensorop_h16816gemm_128x128_32x4_nt_align2,passed,success,universal,8192,8192,28672,f16:column,f16:row,f16:column,f16:column,1,0,serial,1,1,heuristic,tensorop,f16,128,128,32,1,1,1,4,2,2,1,16,8,16,80,1024,1073741824,3848424914944,3584,14.129,70.7762,272377
1,CUTLASS,gemm,cutlass_tensorop_h16816gemm_128x128_32x5_nt_align8,passed,success,universal,8192,8192,28672,f16:column,f16:row,f16:column,f16:column,1,0,serial,1,1,heuristic,tensorop,f16,128,128,32,1,1,1,5,2,2,1,16,8,16,80,1024,1073741824,3848424914944,3584,13.048,76.64,294943
1,CUTLASS,gemm,cutlass_tensorop_h16816gemm_128x128_32x5_nt_align4,passed,success,universal,8192,8192,28672,f16:column,f16:row,f16:column,f16:column,1,0,serial,1,1,heuristic,tensorop,f16,128,128,32,1,1,1,5,2,2,1,16,8,16,80,1024,1073741824,3848424914944,3584,13.5754,73.6628,283486
1,CUTLASS,gemm,cutlass_tensorop_h16816gemm_128x128_32x5_nt_align2,passed,success,universal,8192,8192,28672,f16:column,f16:row,f16:column,f16:column,1,0,serial,1,1,heuristic,tensorop,f16,128,128,32,1,1,1,5,2,2,1,16,8,16,80,1024,1073741824,3848424914944,3584,14.3731,69.5746,267752
1,CUTLASS,gemm,cutlass_tensorop_h16816gemm_128x64_32x6_nt_align8,passed,success,universal,8192,8192,28672,f16:column,f16:row,f16:column,f16:column,1,0,serial,1,1,heuristic,tensorop,f16,128,64,32,1,1,1,6,2,2,1,16,8,16,80,1024,1073741824,3848424914944,3584,18.0895,55.2808,212744
1,CUTLASS,gemm,cutlass_tensorop_h16816gemm_128x64_32x6_nt_align4,passed,success,universal,8192,8192,28672,f16:column,f16:row,f16:column,f16:column,1,0,serial,1,1,heuristic,tensorop,f16,128,64,32,1,1,1,6,2,2,1,16,8,16,80,1024,1073741824,3848424914944,3584,18.6739,53.5508,206086
1,CUTLASS,gemm,cutlass_tensorop_h16816gemm_128x64_32x6_nt_align2,passed,success,universal,8192,8192,28672,f16:column,f16:row,f16:column,f16:column,1,0,serial,1,1,heuristic,tensorop,f16,128,64,32,1,1,1,6,2,2,1,16,8,16,80,1024,1073741824,3848424914944,3584,19.6592,50.8669,195757
1,CUTLASS,gemm,cutlass_tensorop_h16816gemm_64x128_32x6_nt_align8,passed,success,universal,8192,8192,28672,f16:column,f16:row,f16:column,f16:column,1,0,serial,1,1,heuristic,tensorop,f16,64,128,32,1,1,1,6,2,2,1,16,8,16,80,1024,1073741824,3848424914944,3584,18.1604,55.0648,211913
1,CUTLASS,gemm,cutlass_tensorop_h16816gemm_64x128_32x6_nt_align4,passed,success,universal,8192,8192,28672,f16:column,f16:row,f16:column,f16:column,1,0,serial,1,1,heuristic,tensorop,f16,64,128,32,1,1,1,6,2,2,1,16,8,16,80,1024,1073741824,3848424914944,3584,18.8143,53.1512,204548
1,CUTLASS,gemm,cutlass_tensorop_h16816gemm_64x128_32x6_nt_align2,passed,success,universal,8192,8192,28672,f16:column,f16:row,f16:column,f16:column,1,0,serial,1,1,heuristic,tensorop,f16,64,128,32,1,1,1,6,2,2,1,16,8,16,80,1024,1073741824,3848424914944,3584,20.1708,49.5767,190792
1,CUTLASS,gemm,cutlass_tensorop_h16816gemm_64x64_32x10_nt_align8,passed,success,universal,8192,8192,28672,f16:column,f16:row,f16:column,f16:column,1,0,serial,1,1,heuristic,tensorop,f16,64,64,32,1,1,1,10,2,2,1,16,8,16,80,1024,1073741824,3848424914944,3584,23.3214,42.8791,165017
1,CUTLASS,gemm,cutlass_tensorop_h16816gemm_64x64_32x10_nt_align4,passed,success,universal,8192,8192,28672,f16:column,f16:row,f16:column,f16:column,1,0,serial,1,1,heuristic,tensorop,f16,64,64,32,1,1,1,10,2,2,1,16,8,16,80,1024,1073741824,3848424914944,3584,23.9661,41.7256,160578
1,CUTLASS,gemm,cutlass_tensorop_h16816gemm_64x64_32x10_nt_align2,passed,success,universal,8192,8192,28672,f16:column,f16:row,f16:column,f16:column,1,0,serial,1,1,heuristic,tensorop,f16,64,64,32,1,1,1,10,2,2,1,16,8,16,80,1024,1073741824,3848424914944,3584,26.1594,38.2272,147114
1,CUTLASS,gemm,cutlass_tensorop_h16816gemm_128x128_64x3_nt_align8,passed,success,universal,8192,8192,28672,f16:column,f16:row,f16:column,f16:column,1,0,serial,1,1,heuristic,tensorop,f16,128,128,64,1,1,1,3,2,2,1,16,8,16,80,1024,1073741824,3848424914944,3584,13.2229,75.6262,291042
1,CUTLASS,gemm,cutlass_tensorop_h16816gemm_128x128_64x3_nt_align4,passed,success,universal,8192,8192,28672,f16:column,f16:row,f16:column,f16:column,1,0,serial,1,1,heuristic,tensorop,f16,128,128,64,1,1,1,3,2,2,1,16,8,16,80,1024,1073741824,3848424914944,3584,13.4919,74.1184,285239
1,CUTLASS,gemm,cutlass_tensorop_h16816gemm_128x128_64x3_nt_align2,passed,success,universal,8192,8192,28672,f16:column,f16:row,f16:column,f16:column,1,0,serial,1,1,heuristic,tensorop,f16,128,128,64,1,1,1,3,2,2,1,16,8,16,80,1024,1073741824,3848424914944,3584,15.3307,65.2285,251027
1,CUTLASS,gemm,cutlass_tensorop_h16816gemm_128x64_64x3_nt_align8,passed,success,universal,8192,8192,28672,f16:column,f16:row,f16:column,f16:column,1,0,serial,1,1,heuristic,tensorop,f16,128,64,64,1,1,1,3,2,2,1,16,8,16,80,1024,1073741824,3848424914944,3584,18.0135,55.5139,213641
1,CUTLASS,gemm,cutlass_tensorop_h16816gemm_128x64_64x3_nt_align4,passed,success,universal,8192,8192,28672,f16:column,f16:row,f16:column,f16:column,1,0,serial,1,1,heuristic,tensorop,f16,128,64,64,1,1,1,3,2,2,1,16,8,16,80,1024,1073741824,3848424914944,3584,18.8572,53.0302,204083
1,CUTLASS,gemm,cutlass_tensorop_h16816gemm_128x64_64x3_nt_align2,passed,success,universal,8192,8192,28672,f16:column,f16:row,f16:column,f16:column,1,0,serial,1,1,heuristic,tensorop,f16,128,64,64,1,1,1,3,2,2,1,16,8,16,80,1024,1073741824,3848424914944,3584,20.8647,47.9278,184447
1,CUTLASS,gemm,cutlass_tensorop_h16816gemm_64x128_64x3_nt_align8,passed,success,universal,8192,8192,28672,f16:column,f16:row,f16:column,f16:column,1,0,serial,1,1,heuristic,tensorop,f16,64,128,64,1,1,1,3,2,2,1,16,8,16,80,1024,1073741824,3848424914944,3584,18.0984,55.2536,212639
