CUTLASS/cutlassgemm-benchmark/csv_logs/cutlass_shape_8192_28672_8192_performance.gemm.csv
Problem,Provider,OperationKind,Operation,Disposition,Status,gemm_kind,split_k_mode,m,n,k,A,B,C,alpha,beta,split_k_slices,batch_count,op_class,accum,cta_m,cta_n,cta_k,stages,warps_m,warps_n,warps_k,inst_m,inst_n,inst_k,min_cc,max_cc,Bytes,Flops,Flops/Byte,Runtime,GB/s,GFLOPs
1,CUTLASS,gemm,cutlass_tensorop_h1688gemm_256x128_32x2_nn_align8,incorrect,success,universal,serial,8192,8192,28672,f16:column,f16:column,f16:column,1,0,1,1,tensorop,f16,256,128,32,2,4,2,1,16,8,8,75,1024,1073741824,3848424914944,3584,33.9466,29.458,113367
1,CUTLASS,gemm,cutlass_tensorop_h1688gemm_256x128_32x2_nn_align4,incorrect,success,universal,serial,8192,8192,28672,f16:column,f16:column,f16:column,1,0,1,1,tensorop,f16,256,128,32,2,4,2,1,16,8,8,75,1024,1073741824,3848424914944,3584,43.4883,22.9947,88493.4
1,CUTLASS,gemm,cutlass_tensorop_h1688gemm_256x128_32x2_nn_align2,incorrect,success,universal,serial,8192,8192,28672,f16:column,f16:column,f16:column,1,0,1,1,tensorop,f16,256,128,32,2,4,2,1,16,8,8,75,1024,1073741824,3848424914944,3584,50.1466,19.9415,76743.5
1,CUTLASS,gemm,cutlass_tensorop_h1688gemm_256x128_32x2_nn_align1,incorrect,success,universal,serial,8192,8192,28672,f16:column,f16:column,f16:column,1,0,1,1,tensorop,f16,256,128,32,2,4,2,1,16,8,8,75,1024,1073741824,3848424914944,3584,72.1748,13.8553,53320.9
1,CUTLASS,gemm,cutlass_tensorop_h1688gemm_128x256_32x2_nn_align8,incorrect,success,universal,serial,8192,8192,28672,f16:column,f16:column,f16:column,1,0,1,1,tensorop,f16,128,256,32,2,2,4,1,16,8,8,75,1024,1073741824,3848424914944,3584,33.284,30.0445,115624
1,CUTLASS,gemm,cutlass_tensorop_h1688gemm_128x256_32x2_nn_align4,incorrect,success,universal,serial,8192,8192,28672,f16:column,f16:column,f16:column,1,0,1,1,tensorop,f16,128,256,32,2,2,4,1,16,8,8,75,1024,1073741824,3848424914944,3584,37.0926,26.9596,103752
1,CUTLASS,gemm,cutlass_tensorop_h1688gemm_128x256_32x2_nn_align2,incorrect,success,universal,serial,8192,8192,28672,f16:column,f16:column,f16:column,1,0,1,1,tensorop,f16,128,256,32,2,2,4,1,16,8,8,75,1024,1073741824,3848424914944,3584,41.6258,24.0236,92452.9
1,CUTLASS,gemm,cutlass_tensorop_h1688gemm_128x256_32x2_nn_align1,incorrect,success,universal,serial,8192,8192,28672,f16:column,f16:column,f16:column,1,0,1,1,tensorop,f16,128,256,32,2,2,4,1,16,8,8,75,1024,1073741824,3848424914944,3584,64.9942,15.386,59211.8
1,CUTLASS,gemm,cutlass_tensorop_h1688gemm_128x128_32x2_nn_align8,incorrect,success,universal,serial,8192,8192,28672,f16:column,f16:column,f16:column,1,0,1,1,tensorop,f16,128,128,32,2,2,2,1,16,8,8,75,1024,1073741824,3848424914944,3584,56.6588,17.6495,67922.8
1,CUTLASS,gemm,cutlass_tensorop_h1688gemm_128x128_32x2_nn_align4,incorrect,success,universal,serial,8192,8192,28672,f16:column,f16:column,f16:column,1,0,1,1,tensorop,f16,128,128,32,2,2,2,1,16,8,8,75,1024,1073741824,3848424914944,3584,43.5202,22.9778,88428.5
1,CUTLASS,gemm,cutlass_tensorop_h1688gemm_128x128_32x2_nn_align2,incorrect,success,universal,serial,8192,8192,28672,f16:column,f16:column,f16:column,1,0,1,1,tensorop,f16,128,128,32,2,2,2,1,16,8,8,75,1024,1073741824,3848424914944,3584,47.2823,21.1496,81392.5
1,CUTLASS,gemm,cutlass_tensorop_h1688gemm_128x128_32x2_nn_align1,incorrect,success,universal,serial,8192,8192,28672,f16:column,f16:column,f16:column,1,0,1,1,tensorop,f16,128,128,32,2,2,2,1,16,8,8,75,1024,1073741824,3848424914944,3584,63.9036,15.6486,60222.3
1,CUTLASS,gemm,cutlass_tensorop_h1688gemm_64x256_32x2_nn_align8,incorrect,success,universal,serial,8192,8192,28672,f16:column,f16:column,f16:column,1,0,1,1,tensorop,f16,64,256,32,2,1,4,1,16,8,8,75,1024,1073741824,3848424914944,3584,60.3323,16.5749,63787.2
1,CUTLASS,gemm,cutlass_tensorop_h1688gemm_64x256_32x2_nn_align4,incorrect,success,universal,serial,8192,8192,28672,f16:column,f16:column,f16:column,1,0,1,1,tensorop,f16,64,256,32,2,1,4,1,16,8,8,75,1024,1073741824,3848424914944,3584,71.4454,13.9967,53865.3
1,CUTLASS,gemm,cutlass_tensorop_h1688gemm_64x256_32x2_nn_align2,incorrect,success,universal,serial,8192,8192,28672,f16:column,f16:column,f16:column,1,0,1,1,tensorop,f16,64,256,32,2,1,4,1,16,8,8,75,1024,1073741824,3848424914944,3584,59.1058,16.9188,65110.8
1,CUTLASS,gemm,cutlass_tensorop_h1688gemm_64x256_32x2_nn_align1,incorrect,success,universal,serial,8192,8192,28672,f16:column,f16:column,f16:column,1,0,1,1,tensorop,f16,64,256,32,2,1,4,1,16,8,8,75,1024,1073741824,3848424914944,3584,78.3855,12.7575,49096.2
1,CUTLASS,gemm,cutlass_tensorop_h1688gemm_256x64_32x2_nn_align8,incorrect,success,universal,serial,8192,8192,28672,f16:column,f16:column,f16:column,1,0,1,1,tensorop,f16,256,64,32,2,4,1,1,16,8,8,75,1024,1073741824,3848424914944,3584,56.2762,17.7695,68384.6
1,CUTLASS,gemm,cutlass_tensorop_h1688gemm_256x64_32x2_nn_align4,incorrect,success,universal,serial,8192,8192,28672,f16:column,f16:column,f16:column,1,0,1,1,tensorop,f16,256,64,32,2,4,1,1,16,8,8,75,1024,1073741824,3848424914944,3584,60.3903,16.559,63725.9
1,CUTLASS,gemm,cutlass_tensorop_h1688gemm_256x64_32x2_nn_align2,incorrect,success,universal,serial,8192,8192,28672,f16:column,f16:column,f16:column,1,0,1,1,tensorop,f16,256,64,32,2,4,1,1,16,8,8,75,1024,1073741824,3848424914944,3584,61.5937,16.2354,62480.8
1,CUTLASS,gemm,cutlass_tensorop_h1688gemm_256x64_32x2_nn_align1,incorrect,success,universal,serial,8192,8192,28672,f16:column,f16:column,f16:column,1,0,1,1,tensorop,f16,256,64,32,2,4,1,1,16,8,8,75,1024,1073741824,3848424914944,3584,95.3748,10.4849,40350.5
1,CUTLASS,gemm,cutlass_tensorop_h1688gemm_64x128_32x2_nn_align8,incorrect,success,universal,serial,8192,8192,28672,f16:column,f16:column,f16:column,1,0,1,1,tensorop,f16,64,128,32,2,2,2,1,16,8,8,75,1024,1073741824,3848424914944,3584,87.8693,11.3805,43797.1
1,CUTLASS,gemm,cutlass_tensorop_h1688gemm_64x128_32x2_nn_align4,incorrect,success,universal,serial,8192,8192,28672,f16:column,f16:column,f16:column,1,0,1,1,tensorop,f16,64,128,32,2,2,2,1,16,8,8,75,1024,1073741824,3848424914944,3584,88.6968,11.2744,43388.5
1,CUTLASS,gemm,cutlass_tensorop_h1688gemm_64x128_32x2_nn_align2,incorrect,success,universal,serial,8192,8192,28672,f16:column,f16:column,f16:column,1,0,1,1,tensorop,f16,64,128,32,2,2,2,1,16,8,8,75,1024,1073741824,3848424914944,3584,72.1535,13.8593,53336.6
1,CUTLASS,gemm,cutlass_tensorop_h1688gemm_64x128_32x2_nn_align1,incorrect,success,universal,serial,8192,8192,28672,f16:column,f16:column,f16:column,1,0,1,1,tensorop,f16,64,128,32,2,2,2,1,16,8,8,75,1024,1073741824,3848424914944,3584,86.2768,11.5906,44605.6
1,CUTLASS,gemm,cutlass_tensorop_h1688gemm_128x64_32x2_nn_align8,incorrect,success,universal,serial,8192,8192,28672,f16:column,f16:column,f16:column,1,0,1,1,tensorop,f16,128,64,32,2,2,2,1,16,8,8,75,1024,1073741824,3848424914944,3584,67.4512,14.8255,57055
1,CUTLASS,gemm,cutlass_tensorop_h1688gemm_128x64_32x2_nn_align4,incorrect,success,universal,serial,8192,8192,28672,f16:column,f16:column,f16:column,1,0,1,1,tensorop,f16,128,64,32,2,2,2,1,16,8,8,75,1024,1073741824,3848424914944,3584,72.7899,13.7382,52870.3
1,CUTLASS,gemm,cutlass_tensorop_h1688gemm_128x64_32x2_nn_align2,incorrect,success,universal,serial,8192,8192,28672,f16:column,f16:column,f16:column,1,0,1,1,tensorop,f16,128,64,32,2,2,2,1,16,8,8,75,1024,1073741824,3848424914944,3584,81.3209,12.297,47324
1,CUTLASS,gemm,cutlass_tensorop_h1688gemm_128x64_32x2_nn_align1,incorrect,success,universal,serial,8192,8192,28672,f16:column,f16:column,f16:column,1,0,1,1,tensorop,f16,128,64,32,2,2,2,1,16,8,8,75,1024,1073741824,3848424914944,3584,103.239,9.68628,37276.9
1,CUTLASS,gemm,cutlass_tensorop_h1688gemm_64x64_32x2_nn_align8,incorrect,success,universal,serial,8192,8192,28672,f16:column,f16:column,f16:column,1,0,1,1,tensorop,f16,64,64,32,2,2,2,1,16,8,8,75,1024,1073741824,3848424914944,3584,103.975,9.61769,37012.9
1,CUTLASS,gemm,cutlass_tensorop_h1688gemm_64x64_32x2_nn_align4,incorrect,success,universal,serial,8192,8192,28672,f16:column,f16:column,f16:column,1,0,1,1,tensorop,f16,64,64,32,2,2,2,1,16,8,8,75,1024,1073741824,3848424914944,3584,100.52,9.94824,38285.1
1,CUTLASS,gemm,cutlass_tensorop_h1688gemm_64x64_32x2_nn_align2,incorrect,success,universal,serial,8192,8192,28672,f16:column,f16:column,f16:column,1,0,1,1,tensorop,f16,64,64,32,2,2,2,1,16,8,8,75,1024,1073741824,3848424914944,3584,88.5366,11.2948,43467.1
1,CUTLASS,gemm,cutlass_tensorop_h1688gemm_64x64_32x2_nn_align1,incorrect,success,universal,serial,8192,8192,28672,f16:column,f16:column,f16:column,1,0,1,1,tensorop,f16,64,64,32,2,2,2,1,16,8,8,75,1024,1073741824,3848424914944,3584,126.586,7.89976,30401.6
1,CUTLASS,gemm,cutlass_tensorop_h1688gemm_64x128_64x2_nn_align8,incorrect,success,universal,serial,8192,8192,28672,f16:column,f16:column,f16:column,1,0,1,1,tensorop,f16,64,128,64,2,1,2,2,16,8,8,75,1024,1073741824,3848424914944,3584,58.6056,17.0632,65666.5
1,CUTLASS,gemm,cutlass_tensorop_h1688gemm_64x128_64x2_nn_align4,incorrect,success,universal,serial,8192,8192,28672,f16:column,f16:column,f16:column,1,0,1,1,tensorop,f16,64,128,64,2,1,2,2,16,8,8,75,1024,1073741824,3848424914944,3584,60.5456,16.5165,63562.4
1,CUTLASS,gemm,cutlass_tensorop_h1688gemm_64x128_64x2_nn_align2,incorrect,success,universal,serial,8192,8192,28672,f16:column,f16:column,f16:column,1,0,1,1,tensorop,f16,64,128,64,2,1,2,2,16,8,8,75,1024,1073741824,3848424914944,3584,56.8855,17.5792,67652.2
1,CUTLASS,gemm,cutlass_tensorop_h1688gemm_64x128_64x2_nn_align1,incorrect,success,universal,serial,8192,8192,28672,f16:column,f16:column,f16:column,1,0,1,1,tensorop,f16,64,128,64,2,1,2,2,16,8,8,75,1024,1073741824,3848424914944,3584,68.6714,14.5621,56041.2
1,CUTLASS,gemm,cutlass_tensorop_h1688gemm_256x128_32x2_nt_align8,incorrect,success,universal,serial,8192,8192,28672,f16:column,f16:row,f16:column,1,0,1,1,tensorop,f16,256,128,32,2,4,2,1,16,8,8,75,1024,1073741824,3848424914944,3584,33.1265,30.1873,116174
1,CUTLASS,gemm,cutlass_tensorop_h1688gemm_256x128_32x2_nt_align4,incorrect,success,universal,serial,8192,8192,28672,f16:column,f16:row,f16:column,1,0,1,1,tensorop,f16,256,128,32,2,4,2,1,16,8,8,75,1024,1073741824,3848424914944,3584,36.3053,27.5442,106002
1,CUTLASS,gemm,cutlass_tensorop_h1688gemm_256x128_32x2_nt_align2,incorrect,success,universal,serial,8192,8192,28672,f16:column,f16:row,f16:column,1,0,1,1,tensorop,f16,256,128,32,2,4,2,1,16,8,8,75,1024,1073741824,3848424914944,3584,43.9571,22.7494,87549.5
1,CUTLASS,gemm,cutlass_tensorop_h1688gemm_256x128_32x2_nt_align1,incorrect,success,universal,serial,8192,8192,28672,f16:column,f16:row,f16:column,1,0,1,1,tensorop,f16,256,128,32,2,4,2,1,16,8,8,75,1024,1073741824,3848424914944,3584,51.5754,19.3891,74617.5
1,CUTLASS,gemm,cutlass_tensorop_h1688gemm_128x256_32x2_nt_align8,incorrect,success,universal,serial,8192,8192,28672,f16:column,f16:row,f16:column,1,0,1,1,tensorop,f16,128,256,32,2,2,4,1,16,8,8,75,1024,1073741824,3848424914944,3584,33.1646,30.1526,116040
1,CUTLASS,gemm,cutlass_tensorop_h1688gemm_128x256_32x2_nt_align4,incorrect,success,universal,serial,8192,8192,28672,f16:column,f16:row,f16:column,1,0,1,1,tensorop,f16,128,256,32,2,2,4,1,16,8,8,75,1024,1073741824,3848424914944,3584,35.9718,27.7996,106985
1,CUTLASS,gemm,cutlass_tensorop_h1688gemm_128x256_32x2_nt_align2,incorrect,success,universal,serial,8192,8192,28672,f16:column,f16:row,f16:column,1,0,1,1,tensorop,f16,128,256,32,2,2,4,1,16,8,8,75,1024,1073741824,3848424914944,3584,44.749,22.3469,86000.2
1,CUTLASS,gemm,cutlass_tensorop_h1688gemm_128x256_32x2_nt_align1,incorrect,success,universal,serial,8192,8192,28672,f16:column,f16:row,f16:column,1,0,1,1,tensorop,f16,128,256,32,2,2,4,1,16,8,8,75,1024,1073741824,3848424914944,3584,49.7746,20.0906,77317.1
1,CUTLASS,gemm,cutlass_tensorop_h1688gemm_128x128_32x2_nt_align8,incorrect,success,universal,serial,8192,8192,28672,f16:column,f16:row,f16:column,1,0,1,1,tensorop,f16,128,128,32,2,2,2,1,16,8,8,75,1024,1073741824,3848424914944,3584,34.2407,29.205,112393
1,CUTLASS,gemm,cutlass_tensorop_h1688gemm_128x128_32x2_nt_align4,incorrect,success,universal,serial,8192,8192,28672,f16:column,f16:row,f16:column,1,0,1,1,tensorop,f16,128,128,32,2,2,2,1,16,8,8,75,1024,1073741824,3848424914944,3584,45.6887,21.8872,84231.4
1,CUTLASS,gemm,cutlass_tensorop_h1688gemm_128x128_32x2_nt_align2,incorrect,success,universal,serial,8192,8192,28672,f16:column,f16:row,f16:column,1,0,1,1,tensorop,f16,128,128,32,2,2,2,1,16,8,8,75,1024,1073741824,3848424914944,3584,46.5194,21.4964,82727.3
1,CUTLASS,gemm,cutlass_tensorop_h1688gemm_128x128_32x2_nt_align1,incorrect,success,universal,serial,8192,8192,28672,f16:column,f16:row,f16:column,1,0,1,1,tensorop,f16,128,128,32,2,2,2,1,16,8,8,75,1024,1073741824,3848424914944,3584,50.1632,19.9349,76718.1
1,CUTLASS,gemm,cutlass_tensorop_h1688gemm_64x256_32x2_nt_align8,incorrect,success,universal,serial,8192,8192,28672,f16:column,f16:row,f16:column,1,0,1,1,tensorop,f16,64,256,32,2,1,4,1,16,8,8,75,1024,1073741824,3848424914944,3584,60.667,16.4834,63435.2
1,CUTLASS,gemm,cutlass_tensorop_h1688gemm_64x256_32x2_nt_align4,incorrect,success,universal,serial,8192,8192,28672,f16:column,f16:row,f16:column,1,0,1,1,tensorop,f16,64,256,32,2,1,4,1,16,8,8,75,1024,1073741824,3848424914944,3584,70.1444,14.2563,54864.3
1,CUTLASS,gemm,cutlass_tensorop_h1688gemm_64x256_32x2_nt_align2,incorrect,success,universal,serial,8192,8192,28672,f16:column,f16:row,f16:column,1,0,1,1,tensorop,f16,64,256,32,2,1,4,1,16,8,8,75,1024,1073741824,3848424914944,3584,54.3915,18.3852,70754.2
1,CUTLASS,gemm,cutlass_tensorop_h1688gemm_64x256_32x2_nt_align1,incorrect,success,universal,serial,8192,8192,28672,f16:column,f16:row,f16:column,1,0,1,1,tensorop,f16,64,256,32,2,1,4,1,16,8,8,75,1024,1073741824,3848424914944,3584,62.755,15.935,61324.6
1,CUTLASS,gemm,cutlass_tensorop_h1688gemm_256x64_32x2_nt_align8,incorrect,success,universal,serial,8192,8192,28672,f16:column,f16:row,f16:column,1,0,1,1,tensorop,f16,256,64,32,2,4,1,1,16,8,8,75,1024,1073741824,3848424914944,3584,46.1127,21.686,83457
1,CUTLASS,gemm,cutlass_tensorop_h1688gemm_256x64_32x2_nt_align4,incorrect,success,universal,serial,8192,8192,28672,f16:column,f16:row,f16:column,1,0,1,1,tensorop,f16,256,64,32,2,4,1,1,16,8,8,75,1024,1073741824,3848424914944,3584,45.9285,21.7729,83791.6
1,CUTLASS,gemm,cutlass_tensorop_h1688gemm_256x64_32x2_nt_align2,incorrect,success,universal,serial,8192,8192,28672,f16:column,f16:row,f16:column,1,0,1,1,tensorop,f16,256,64,32,2,4,1,1,16,8,8,75,1024,1073741824,3848424914944,3584,48.6073,20.573,79173.8
1,CUTLASS,gemm,cutlass_tensorop_h1688gemm_256x64_32x2_nt_align1,incorrect,success,universal,serial,8192,8192,28672,f16:column,f16:row,f16:column,1,0,1,1,tensorop,f16,256,64,32,2,4,1,1,16,8,8,75,1024,1073741824,3848424914944,3584,65.1227,15.3556,59095
1,CUTLASS,gemm,cutlass_tensorop_h1688gemm_64x128_32x2_nt_align8,incorrect,success,universal,serial,8192,8192,28672,f16:column,f16:row,f16:column,1,0,1,1,tensorop,f16,64,128,32,2,2,2,1,16,8,8,75,1024,1073741824,3848424914944,3584,61.8663,16.1639,62205.5
1,CUTLASS,gemm,cutlass_tensorop_h1688gemm_64x128_32x2_nt_align4,incorrect,success,universal,serial,8192,8192,28672,f16:column,f16:row,f16:column,1,0,1,1,tensorop,f16,64,128,32,2,2,2,1,16,8,8,75,1024,1073741824,3848424914944,3584,72.4086,13.8105,53148.7
1,CUTLASS,gemm,cutlass_tensorop_h1688gemm_64x128_32x2_nt_align2,incorrect,success,universal,serial,8192,8192,28672,f16:column,f16:row,f16:column,1,0,1,1,tensorop,f16,64,128,32,2,2,2,1,16,8,8,75,1024,1073741824,3848424914944,3584,52.8206,18.932,72858.5
1,CUTLASS,gemm,cutlass_tensorop_h1688gemm_64x128_32x2_nt_align1,incorrect,success,universal,serial,8192,8192,28672,f16:column,f16:row,f16:column,1,0,1,1,tensorop,f16,64,128,32,2,2,2,1,16,8,8,75,1024,1073741824,3848424914944,3584,78.2397,12.7812,49187.6
1,CUTLASS,gemm,cutlass_tensorop_h1688gemm_128x64_32x2_nt_align8,incorrect,success,universal,serial,8192,8192,28672,f16:column,f16:row,f16:column,1,0,1,1,tensorop,f16,128,64,32,2,2,2,1,16,8,8,75,1024,1073741824,3848424914944,3584,48.357,20.6795,79583.7
1,CUTLASS,gemm,cutlass_tensorop_h1688gemm_128x64_32x2_nt_align4,incorrect,success,universal,serial,8192,8192,28672,f16:column,f16:row,f16:column,1,0,1,1,tensorop,f16,128,64,32,2,2,2,1,16,8,8,75,1024,1073741824,3848424914944,3584,52.7674,18.9511,72931.8
1,CUTLASS,gemm,cutlass_tensorop_h1688gemm_128x64_32x2_nt_align2,incorrect,success,universal,serial,8192,8192,28672,f16:column,f16:row,f16:column,1,0,1,1,tensorop,f16,128,64,32,2,2,2,1,16,8,8,75,1024,1073741824,3848424914944,3584,53.1671,18.8086,72383.6
1,CUTLASS,gemm,cutlass_tensorop_h1688gemm_128x64_32x2_nt_align1,incorrect,success,universal,serial,8192,8192,28672,f16:column,f16:row,f16:column,1,0,1,1,tensorop,f16,128,64,32,2,2,2,1,16,8,8,75,1024,1073741824,3848424914944,3584,69.7086,14.3454,55207.3
1,CUTLASS,gemm,cutlass_tensorop_h1688gemm_64x64_32x2_nt_align8,incorrect,success,universal,serial,8192,8192,28672,f16:column,f16:row,f16:column,1,0,1,1,tensorop,f16,64,64,32,2,2,2,1,16,8,8,75,1024,1073741824,3848424914944,3584,60.8185,16.4424,63277.2
1,CUTLASS,gemm,cutlass_tensorop_h1688gemm_64x64_32x2_nt_align4,incorrect,success,universal,serial,8192,8192,28672,f16:column,f16:row,f16:column,1,0,1,1,tensorop,f16,64,64,32,2,2,2,1,16,8,8,75,1024,1073741824,3848424914944,3584,61.1934,16.3416,62889.5
1,CUTLASS,gemm,cutlass_tensorop_h1688gemm_64x64_32x2_nt_align2,incorrect,success,universal,serial,8192,8192,28672,f16:column,f16:row,f16:column,1,0,1,1,tensorop,f16,64,64,32,2,2,2,1,16,8,8,75,1024,1073741824,3848424914944,3584,62.4945,16.0014,61580.2
1,CUTLASS,gemm,cutlass_tensorop_h1688gemm_64x64_32x2_nt_align1,incorrect,success,universal,serial,8192,8192,28672,f16:column,f16:row,f16:column,1,0,1,1,tensorop,f16,64,64,32,2,2,2,1,16,8,8,75,1024,1073741824,3848424914944,3584,94.1536,10.6209,40873.9
1,CUTLASS,gemm,cutlass_tensorop_h1688gemm_64x128_64x2_nt_align8,incorrect,success,universal,serial,8192,8192,28672,f16:column,f16:row,f16:column,1,0,1,1,tensorop,f16,64,128,64,2,1,2,2,16,8,8,75,1024,1073741824,3848424914944,3584,67.6001,14.7929,56929.3
1,CUTLASS,gemm,cutlass_tensorop_h1688gemm_64x128_64x2_nt_align4,incorrect,success,universal,serial,8192,8192,28672,f16:column,f16:row,f16:column,1,0,1,1,tensorop,f16,64,128,64,2,1,2,2,16,8,8,75,1024,1073741824,3848424914944,3584,70.3952,14.2055,54668.9
1,CUTLASS,gemm,cutlass_tensorop_h1688gemm_64x128_64x2_nt_align2,incorrect,success,universal,serial,8192,8192,28672,f16:column,f16:row,f16:column,1,0,1,1,tensorop,f16,64,128,64,2,1,2,2,16,8,8,75,1024,1073741824,3848424914944,3584,57.028,17.5352,67483.1
1,CUTLASS,gemm,cutlass_tensorop_h1688gemm_64x128_64x2_nt_align1,incorrect,success,universal,serial,8192,8192,28672,f16:column,f16:row,f16:column,1,0,1,1,tensorop,f16,64,128,64,2,1,2,2,16,8,8,75,1024,1073741824,3848424914944,3584,72.5814,13.7776,53022.2
1,CUTLASS,gemm,cutlass_tensorop_h1688gemm_256x128_32x2_tn_align8,incorrect,success,universal,serial,8192,8192,28672,f16:row,f16:column,f16:column,1,0,1,1,tensorop,f16,256,128,32,2,4,2,1,16,8,8,75,1024,1073741824,3848424914944,3584,44.8007,22.3211,85901
1,CUTLASS,gemm,cutlass_tensorop_h1688gemm_256x128_32x2_tn_align4,incorrect,success,universal,serial,8192,8192,28672,f16:row,f16:column,f16:column,1,0,1,1,tensorop,f16,256,128,32,2,4,2,1,16,8,8,75,1024,1073741824,3848424914944,3584,46.014,21.7325,83636
1,CUTLASS,gemm,cutlass_tensorop_h1688gemm_256x128_32x2_tn_align2,incorrect,success,universal,serial,8192,8192,28672,f16:row,f16:column,f16:column,1,0,1,1,tensorop,f16,256,128,32,2,4,2,1,16,8,8,75,1024,1073741824,3848424914944,3584,49.1759,20.3352,78258.4
1,CUTLASS,gemm,cutlass_tensorop_h1688gemm_256x128_32x2_tn_align1,incorrect,success,universal,serial,8192,8192,28672,f16:row,f16:column,f16:column,1,0,1,1,tensorop,f16,256,128,32,2,4,2,1,16,8,8,75,1024,1073741824,3848424914944,3584,79.4071,12.5933,48464.5
1,CUTLASS,gemm,cutlass_tensorop_h1688gemm_128x256_32x2_tn_align8,incorrect,success,universal,serial,8192,8192,28672,f16:row,f16:column,f16:column,1,0,1,1,tensorop,f16,128,256,32,2,2,4,1,16,8,8,75,1024,1073741824,3848424914944,3584,47.6421,20.9898,80777.8
1,CUTLASS,gemm,cutlass_tensorop_h1688gemm_128x256_32x2_tn_align4,incorrect,success,universal,serial,8192,8192,28672,f16:row,f16:column,f16:column,1,0,1,1,tensorop,f16,128,256,32,2,2,4,1,16,8,8,75,1024,1073741824,3848424914944,3584,53.1577,18.812,72396.4
1,CUTLASS,gemm,cutlass_tensorop_h1688gemm_128x256_32x2_tn_align2,incorrect,success,universal,serial,8192,8192,28672,f16:row,f16:column,f16:column,1,0,1,1,tensorop,f16,128,256,32,2,2,4,1,16,8,8,75,1024,1073741824,3848424914944,3584,51.2626,19.5074,75072.8
1,CUTLASS,gemm,cutlass_tensorop_h1688gemm_128x256_32x2_tn_align1,incorrect,success,universal,serial,8192,8192,28672,f16:row,f16:column,f16:column,1,0,1,1,tensorop,f16,128,256,32,2,2,4,1,16,8,8,75,1024,1073741824,3848424914944,3584,78.2776,12.775,49163.8
1,CUTLASS,gemm,cutlass_tensorop_h1688gemm_128x128_32x2_tn_align8,incorrect,success,universal,serial,8192,8192,28672,f16:row,f16:column,f16:column,1,0,1,1,tensorop,f16,128,128,32,2,2,2,1,16,8,8,75,1024,1073741824,3848424914944,3584,102.683,9.73875,37478.8
1,CUTLASS,gemm,cutlass_tensorop_h1688gemm_128x128_32x2_tn_align4,incorrect,success,universal,serial,8192,8192,28672,f16:row,f16:column,f16:column,1,0,1,1,tensorop,f16,128,128,32,2,2,2,1,16,8,8,75,1024,1073741824,3848424914944,3584,101.748,9.82823,37823.2
1,CUTLASS,gemm,cutlass_tensorop_h1688gemm_128x128_32x2_tn_align2,incorrect,success,universal,serial,8192,8192,28672,f16:row,f16:column,f16:column,1,0,1,1,tensorop,f16,128,128,32,2,2,2,1,16,8,8,75,1024,1073741824,3848424914944,3584,99.0553,10.0954,38851.3
1,CUTLASS,gemm,cutlass_tensorop_h1688gemm_128x128_32x2_tn_align1,incorrect,success,universal,serial,8192,8192,28672,f16:row,f16:column,f16:column,1,0,1,1,tensorop,f16,128,128,32,2,2,2,1,16,8,8,75,1024,1073741824,3848424914944,3584,85.2902,11.7247,45121.5
1,CUTLASS,gemm,cutlass_tensorop_h1688gemm_64x256_32x2_tn_align8,incorrect,success,universal,serial,8192,8192,28672,f16:row,f16:column,f16:column,1,0,1,1,tensorop,f16,64,256,32,2,1,4,1,16,8,8,75,1024,1073741824,3848424914944,3584,115.462,8.66089,33330.8
1,CUTLASS,gemm,cutlass_tensorop_h1688gemm_64x256_32x2_tn_align4,incorrect,success,universal,serial,8192,8192,28672,f16:row,f16:column,f16:column,1,0,1,1,tensorop,f16,64,256,32,2,1,4,1,16,8,8,75,1024,1073741824,3848424914944,3584,116.915,8.55321,32916.4
1,CUTLASS,gemm,cutlass_tensorop_h1688gemm_64x256_32x2_tn_align2,incorrect,success,universal,serial,8192,8192,28672,f16:row,f16:column,f16:column,1,0,1,1,tensorop,f16,64,256,32,2,1,4,1,16,8,8,75,1024,1073741824,3848424914944,3584,120.606,8.29148,31909.1
1,CUTLASS,gemm,cutlass_tensorop_h1688gemm_64x256_32x2_tn_align1,incorrect,success,universal,serial,8192,8192,28672,f16:row,f16:column,f16:column,1,0,1,1,tensorop,f16,64,256,32,2,1,4,1,16,8,8,75,1024,1073741824,3848424914944,3584,118.572,8.4337,32456.5
1,CUTLASS,gemm,cutlass_tensorop_h1688gemm_256x64_32x2_tn_align8,incorrect,success,universal,serial,8192,8192,28672,f16:row,f16:column,f16:column,1,0,1,1,tensorop,f16,256,64,32,2,4,1,1,16,8,8,75,1024,1073741824,3848424914944,3584,97.1646,10.2918,39607.3
1,CUTLASS,gemm,cutlass_tensorop_h1688gemm_256x64_32x2_tn_align4,incorrect,success,universal,serial,8192,8192,28672,f16:row,f16:column,f16:column,1,0,1,1,tensorop,f16,256,64,32,2,4,1,1,16,8,8,75,1024,1073741824,3848424914944,3584,70.1956,14.2459,54824.3
1,CUTLASS,gemm,cutlass_tensorop_h1688gemm_256x64_32x2_tn_align2,incorrect,success,universal,serial,8192,8192,28672,f16:row,f16:column,f16:column,1,0,1,1,tensorop,f16,256,64,32,2,4,1,1,16,8,8,75,1024,1073741824,3848424914944,3584,83.0906,12.0351,46316
1,CUTLASS,gemm,cutlass_tensorop_h1688gemm_256x64_32x2_tn_align1,incorrect,success,universal,serial,8192,8192,28672,f16:row,f16:column,f16:column,1,0,1,1,tensorop,f16,256,64,32,2,4,1,1,16,8,8,75,1024,1073741824,3848424914944,3584,99.4348,10.0568,38703
1,CUTLASS,gemm,cutlass_tensorop_h1688gemm_64x128_32x2_tn_align8,incorrect,success,universal,serial,8192,8192,28672,f16:row,f16:column,f16:column,1,0,1,1,tensorop,f16,64,128,32,2,2,2,1,16,8,8,75,1024,1073741824,3848424914944,3584,157.366,6.35461,24455.3
1,CUTLASS,gemm,cutlass_tensorop_h1688gemm_64x128_32x2_tn_align4,incorrect,success,universal,serial,8192,8192,28672,f16:row,f16:column,f16:column,1,0,1,1,tensorop,f16,64,128,32,2,2,2,1,16,8,8,75,1024,1073741824,3848424914944,3584,155.232,6.44195,24791.4
1,CUTLASS,gemm,cutlass_tensorop_h1688gemm_64x128_32x2_tn_align2,incorrect,success,universal,serial,8192,8192,28672,f16:row,f16:column,f16:column,1,0,1,1,tensorop,f16,64,128,32,2,2,2,1,16,8,8,75,1024,1073741824,3848424914944,3584,152.534,6.55593,25230
1,CUTLASS,gemm,cutlass_tensorop_h1688gemm_64x128_32x2_tn_align1,incorrect,success,universal,serial,8192,8192,28672,f16:row,f16:column,f16:column,1,0,1,1,tensorop,f16,64,128,32,2,2,2,1,16,8,8,75,1024,1073741824,3848424914944,3584,135.872,7.35987,28323.9
1,CUTLASS,gemm,cutlass_tensorop_h1688gemm_128x64_32x2_tn_align8,incorrect,success,universal,serial,8192,8192,28672,f16:row,f16:column,f16:column,1,0,1,1,tensorop,f16,128,64,32,2,2,2,1,16,8,8,75,1024,1073741824,3848424914944,3584,145.211,6.88654,26502.3
1,CUTLASS,gemm,cutlass_tensorop_h1688gemm_128x64_32x2_tn_align4,incorrect,success,universal,serial,8192,8192,28672,f16:row,f16:column,f16:column,1,0,1,1,tensorop,f16,128,64,32,2,2,2,1,16,8,8,75,1024,1073741824,3848424914944,3584,142.431,7.02095,27019.6
1,CUTLASS,gemm,cutlass_tensorop_h1688gemm_128x64_32x2_tn_align2,incorrect,success,universal,serial,8192,8192,28672,f16:row,f16:column,f16:column,1,0,1,1,tensorop,f16,128,64,32,2,2,2,1,16,8,8,75,1024,1073741824,3848424914944,3584,135.706,7.36886,28358.5
1,CUTLASS,gemm,cutlass_tensorop_h1688gemm_128x64_32x2_tn_align1,incorrect,success,universal,serial,8192,8192,28672,f16:row,f16:column,f16:column,1,0,1,1,tensorop,f16,128,64,32,2,2,2,1,16,8,8,75,1024,1073741824,3848424914944,3584,119.466,8.37059,32213.6
1,CUTLASS,gemm,cutlass_tensorop_h1688gemm_64x64_32x2_tn_align8,incorrect,success,universal,serial,8192,8192,28672,f16:row,f16:column,f16:column,1,0,1,1,tensorop,f16,64,64,32,2,2,2,1,16,8,8,75,1024,1073741824,3848424914944,3584,171.474,5.83178,22443.2
1,CUTLASS,gemm,cutlass_tensorop_h1688gemm_64x64_32x2_tn_align4,incorrect,success,universal,serial,8192,8192,28672,f16:row,f16:column,f16:column,1,0,1,1,tensorop,f16,64,64,32,2,2,2,1,16,8,8,75,1024,1073741824,3848424914944,3584,171.113,5.84411,22490.6
1,CUTLASS,gemm,cutlass_tensorop_h1688gemm_64x64_32x2_tn_align2,incorrect,success,universal,serial,8192,8192,28672,f16:row,f16:column,f16:column,1,0,1,1,tensorop,f16,64,64,32,2,2,2,1,16,8,8,75,1024,1073741824,3848424914944,3584,167.137,5.98311,23025.5
1,CUTLASS,gemm,cutlass_tensorop_h1688gemm_64x64_32x2_tn_align1,incorrect,success,universal,serial,8192,8192,28672,f16:row,f16:column,f16:column,1,0,1,1,tensorop,f16,64,64,32,2,2,2,1,16,8,8,75,1024,1073741824,3848424914944,3584,183.876,5.43844,20929.4
1,CUTLASS,gemm,cutlass_tensorop_h1688gemm_64x128_64x2_tn_align8,incorrect,success,universal,serial,8192,8192,28672,f16:row,f16:column,f16:column,1,0,1,1,tensorop,f16,64,128,64,2,1,2,2,16,8,8,75,1024,1073741824,3848424914944,3584,81.9358,12.2047,46968.8
1,CUTLASS,gemm,cutlass_tensorop_h1688gemm_64x128_64x2_tn_align4,incorrect,success,universal,serial,8192,8192,28672,f16:row,f16:column,f16:column,1,0,1,1,tensorop,f16,64,128,64,2,1,2,2,16,8,8,75,1024,1073741824,3848424914944,3584,79.194,12.6272,48594.9
1,CUTLASS,gemm,cutlass_tensorop_h1688gemm_64x128_64x2_tn_align2,incorrect,success,universal,serial,8192,8192,28672,f16:row,f16:column,f16:column,1,0,1,1,tensorop,f16,64,128,64,2,1,2,2,16,8,8,75,1024,1073741824,3848424914944,3584,78.3268,12.767,49132.9
1,CUTLASS,gemm,cutlass_tensorop_h1688gemm_64x128_64x2_tn_align1,incorrect,success,universal,serial,8192,8192,28672,f16:row,f16:column,f16:column,1,0,1,1,tensorop,f16,64,128,64,2,1,2,2,16,8,8,75,1024,1073741824,3848424914944,3584,65.5965,15.2447,58668.1
1,CUTLASS,gemm,cutlass_tensorop_h1688gemm_256x128_32x2_tt_align8,incorrect,success,universal,serial,8192,8192,28672,f16:row,f16:row,f16:column,1,0,1,1,tensorop,f16,256,128,32,2,4,2,1,16,8,8,75,1024,1073741824,3848424914944,3584,34.587,28.9126,111268
1,CUTLASS,gemm,cutlass_tensorop_h1688gemm_256x128_32x2_tt_align4,incorrect,success,universal,serial,8192,8192,28672,f16:row,f16:row,f16:column,1,0,1,1,tensorop,f16,256,128,32,2,4,2,1,16,8,8,75,1024,1073741824,3848424914944,3584,36.5599,27.3524,105264
1,CUTLASS,gemm,cutlass_tensorop_h1688gemm_256x128_32x2_tt_align2,incorrect,success,universal,serial,8192,8192,28672,f16:row,f16:row,f16:column,1,0,1,1,tensorop,f16,256,128,32,2,4,2,1,16,8,8,75,1024,1073741824,3848424914944,3584,45.4259,22.0139,84718.8
1,CUTLASS,gemm,cutlass_tensorop_h1688gemm_256x128_32x2_tt_align1,incorrect,success,universal,serial,8192,8192,28672,f16:row,f16:row,f16:column,1,0,1,1,tensorop,f16,256,128,32,2,4,2,1,16,8,8,75,1024,1073741824,3848424914944,3584,63.3154,15.794,60781.9
1,CUTLASS,gemm,cutlass_tensorop_h1688gemm_128x256_32x2_tt_align8,incorrect,success,universal,serial,8192,8192,28672,f16:row,f16:row,f16:column,1,0,1,1,tensorop,f16,128,256,32,2,2,4,1,16,8,8,75,1024,1073741824,3848424914944,3584,43.8623,22.7986,87738.7
1,CUTLASS,gemm,cutlass_tensorop_h1688gemm_128x256_32x2_tt_align4,incorrect,success,universal,serial,8192,8192,28672,f16:row,f16:row,f16:column,1,0,1,1,tensorop,f16,128,256,32,2,2,4,1,16,8,8,75,1024,1073741824,3848424914944,3584,46.5228,21.4948,82721.3
1,CUTLASS,gemm,cutlass_tensorop_h1688gemm_128x256_32x2_tt_align2,incorrect,success,universal,serial,8192,8192,28672,f16:row,f16:row,f16:column,1,0,1,1,tensorop,f16,128,256,32,2,2,4,1,16,8,8,75,1024,1073741824,3848424914944,3584,52.0297,19.2198,73965.9
1,CUTLASS,gemm,cutlass_tensorop_h1688gemm_128x256_32x2_tt_align1,incorrect,success,universal,serial,8192,8192,28672,f16:row,f16:row,f16:column,1,0,1,1,tensorop,f16,128,256,32,2,2,4,1,16,8,8,75,1024,1073741824,3848424914944,3584,70.5693,14.1705,54534
1,CUTLASS,gemm,cutlass_tensorop_h1688gemm_128x128_32x2_tt_align8,incorrect,success,universal,serial,8192,8192,28672,f16:row,f16:row,f16:column,1,0,1,1,tensorop,f16,128,128,32,2,2,2,1,16,8,8,75,1024,1073741824,3848424914944,3584,58.8519,16.9918,65391.6
1,CUTLASS,gemm,cutlass_tensorop_h1688gemm_128x128_32x2_tt_align4,incorrect,success,universal,serial,8192,8192,28672,f16:row,f16:row,f16:column,1,0,1,1,tensorop,f16,128,128,32,2,2,2,1,16,8,8,75,1024,1073741824,3848424914944,3584,62.7626,15.9331,61317.2
1,CUTLASS,gemm,cutlass_tensorop_h1688gemm_128x128_32x2_tt_align2,incorrect,success,universal,serial,8192,8192,28672,f16:row,f16:row,f16:column,1,0,1,1,tensorop,f16,128,128,32,2,2,2,1,16,8,8,75,1024,1073741824,3848424914944,3584,58.27,17.1615,66044.7
1,CUTLASS,gemm,cutlass_tensorop_h1688gemm_128x128_32x2_tt_align1,incorrect,success,universal,serial,8192,8192,28672,f16:row,f16:row,f16:column,1,0,1,1,tensorop,f16,128,128,32,2,2,2,1,16,8,8,75,1024,1073741824,3848424914944,3584,67.3496,14.8479,57141
1,CUTLASS,gemm,cutlass_tensorop_h1688gemm_64x256_32x2_tt_align8,incorrect,success,universal,serial,8192,8192,28672,f16:row,f16:row,f16:column,1,0,1,1,tensorop,f16,64,256,32,2,1,4,1,16,8,8,75,1024,1073741824,3848424914944,3584,100.875,9.91329,38150.6
1,CUTLASS,gemm,cutlass_tensorop_h1688gemm_64x256_32x2_tt_align4,incorrect,success,universal,serial,8192,8192,28672,f16:row,f16:row,f16:column,1,0,1,1,tensorop,f16,64,256,32,2,1,4,1,16,8,8,75,1024,1073741824,3848424914944,3584,105.349,9.49226,36530.2
1,CUTLASS,gemm,cutlass_tensorop_h1688gemm_64x256_32x2_tt_align2,incorrect,success,universal,serial,8192,8192,28672,f16:row,f16:row,f16:column,1,0,1,1,tensorop,f16,64,256,32,2,1,4,1,16,8,8,75,1024,1073741824,3848424914944,3584,104.304,9.58732,36896.1
1,CUTLASS,gemm,cutlass_tensorop_h1688gemm_64x256_32x2_tt_align1,incorrect,success,universal,serial,8192,8192,28672,f16:row,f16:row,f16:column,1,0,1,1,tensorop,f16,64,256,32,2,1,4,1,16,8,8,75,1024,1073741824,3848424914944,3584,89.6055,11.16,42948.5
1,CUTLASS,gemm,cutlass_tensorop_h1688gemm_256x64_32x2_tt_align8,incorrect,success,universal,serial,8192,8192,28672,f16:row,f16:row,f16:column,1,0,1,1,tensorop,f16,256,64,32,2,4,1,1,16,8,8,75,1024,1073741824,3848424914944,3584,42.762,23.3852,89996.3
1,CUTLASS,gemm,cutlass_tensorop_h1688gemm_256x64_32x2_tt_align4,incorrect,success,universal,serial,8192,8192,28672,f16:row,f16:row,f16:column,1,0,1,1,tensorop,f16,256,64,32,2,4,1,1,16,8,8,75,1024,1073741824,3848424914944,3584,46.5447,21.4847,82682.4
1,CUTLASS,gemm,cutlass_tensorop_h1688gemm_256x64_32x2_tt_align2,incorrect,success,universal,serial,8192,8192,28672,f16:row,f16:row,f16:column,1,0,1,1,tensorop,f16,256,64,32,2,4,1,1,16,8,8,75,1024,1073741824,3848424914944,3584,49.5448,20.1838,77675.6
1,CUTLASS,gemm,cutlass_tensorop_h1688gemm_256x64_32x2_tt_align1,incorrect,success,universal,serial,8192,8192,28672,f16:row,f16:row,f16:column,1,0,1,1,tensorop,f16,256,64,32,2,4,1,1,16,8,8,75,1024,1073741824,3848424914944,3584,71.5599,13.9743,53779.1
1,CUTLASS,gemm,cutlass_tensorop_h1688gemm_64x128_32x2_tt_align8,incorrect,success,universal,serial,8192,8192,28672,f16:row,f16:row,f16:column,1,0,1,1,tensorop,f16,64,128,32,2,2,2,1,16,8,8,75,1024,1073741824,3848424914944,3584,121.038,8.26185,31795.1
1,CUTLASS,gemm,cutlass_tensorop_h1688gemm_64x128_32x2_tt_align4,incorrect,success,universal,serial,8192,8192,28672,f16:row,f16:row,f16:column,1,0,1,1,tensorop,f16,64,128,32,2,2,2,1,16,8,8,75,1024,1073741824,3848424914944,3584,119.576,8.36289,32184
1,CUTLASS,gemm,cutlass_tensorop_h1688gemm_64x128_32x2_tt_align2,incorrect,success,universal,serial,8192,8192,28672,f16:row,f16:row,f16:column,1,0,1,1,tensorop,f16,64,128,32,2,2,2,1,16,8,8,75,1024,1073741824,3848424914944,3584,116.352,8.59459,33075.6
1,CUTLASS,gemm,cutlass_tensorop_h1688gemm_64x128_32x2_tt_align1,incorrect,success,universal,serial,8192,8192,28672,f16:row,f16:row,f16:column,1,0,1,1,tensorop,f16,64,128,32,2,2,2,1,16,8,8,75,1024,1073741824,3848424914944,3584,103.761,9.63749,37089.2
1,CUTLASS,gemm,cutlass_tensorop_h1688gemm_128x64_32x2_tt_align8,incorrect,success,universal,serial,8192,8192,28672,f16:row,f16:row,f16:column,1,0,1,1,tensorop,f16,128,64,32,2,2,2,1,16,8,8,75,1024,1073741824,3848424914944,3584,57.3814,17.4273,67067.5
1,CUTLASS,gemm,cutlass_tensorop_h1688gemm_128x64_32x2_tt_align4,incorrect,success,universal,serial,8192,8192,28672,f16:row,f16:row,f16:column,1,0,1,1,tensorop,f16,128,64,32,2,2,2,1,16,8,8,75,1024,1073741824,3848424914944,3584,56.0478,17.8419,68663.2
1,CUTLASS,gemm,cutlass_tensorop_h1688gemm_128x64_32x2_tt_align2,incorrect,success,universal,serial,8192,8192,28672,f16:row,f16:row,f16:column,1,0,1,1,tensorop,f16,128,64,32,2,2,2,1,16,8,8,75,1024,1073741824,3848424914944,3584,57.6971,17.3319,66700.5
1,CUTLASS,gemm,cutlass_tensorop_h1688gemm_128x64_32x2_tt_align1,incorrect,success,universal,serial,8192,8192,28672,f16:row,f16:row,f16:column,1,0,1,1,tensorop,f16,128,64,32,2,2,2,1,16,8,8,75,1024,1073741824,3848424914944,3584,86.2713,11.5913,44608.4
1,CUTLASS,gemm,cutlass_tensorop_h1688gemm_64x64_32x2_tt_align8,incorrect,success,universal,serial,8192,8192,28672,f16:row,f16:row,f16:column,1,0,1,1,tensorop,f16,64,64,32,2,2,2,1,16,8,8,75,1024,1073741824,3848424914944,3584,107.613,9.29253,35761.6
1,CUTLASS,gemm,cutlass_tensorop_h1688gemm_64x64_32x2_tt_align4,incorrect,success,universal,serial,8192,8192,28672,f16:row,f16:row,f16:column,1,0,1,1,tensorop,f16,64,64,32,2,2,2,1,16,8,8,75,1024,1073741824,3848424914944,3584,119.597,8.3614,32178.2
1,CUTLASS,gemm,cutlass_tensorop_h1688gemm_64x64_32x2_tt_align2,incorrect,success,universal,serial,8192,8192,28672,f16:row,f16:row,f16:column,1,0,1,1,tensorop,f16,64,64,32,2,2,2,1,16,8,8,75,1024,1073741824,3848424914944,3584,94.9018,10.5372,40551.7
1,CUTLASS,gemm,cutlass_tensorop_h1688gemm_64x64_32x2_tt_align1,incorrect,success,universal,serial,8192,8192,28672,f16:row,f16:row,f16:column,1,0,1,1,tensorop,f16,64,64,32,2,2,2,1,16,8,8,75,1024,1073741824,3848424914944,3584,126.457,7.90784,30432.7
1,CUTLASS,gemm,cutlass_tensorop_h1688gemm_64x128_64x2_tt_align8,incorrect,success,universal,serial,8192,8192,28672,f16:row,f16:row,f16:column,1,0,1,1,tensorop,f16,64,128,64,2,1,2,2,16,8,8,75,1024,1073741824,3848424914944,3584,77.7458,12.8624,49500.1
1,CUTLASS,gemm,cutlass_tensorop_h1688gemm_64x128_64x2_tt_align4,incorrect,success,universal,serial,8192,8192,28672,f16:row,f16:row,f16:column,1,0,1,1,tensorop,f16,64,128,64,2,1,2,2,16,8,8,75,1024,1073741824,3848424914944,3584,77.8701,12.8419,49421.1
1,CUTLASS,gemm,cutlass_tensorop_h1688gemm_64x128_64x2_tt_align2,incorrect,success,universal,serial,8192,8192,28672,f16:row,f16:row,f16:column,1,0,1,1,tensorop,f16,64,128,64,2,1,2,2,16,8,8,75,1024,1073741824,3848424914944,3584,77.4643,12.9092,49680
1,CUTLASS,gemm,cutlass_tensorop_h1688gemm_64x128_64x2_tt_align1,incorrect,success,universal,serial,8192,8192,28672,f16:row,f16:row,f16:column,1,0,1,1,tensorop,f16,64,128,64,2,1,2,2,16,8,8,75,1024,1073741824,3848424914944,3584,65.4172,15.2865,58828.9
1,CUTLASS,gemm,cutlass_tensorop_h16816gemm_256x128_32x3_nn_align8,incorrect,success,universal,serial,8192,8192,28672,f16:column,f16:column,f16:column,1,0,1,1,tensorop,f16,256,128,32,3,4,2,1,16,8,16,80,1024,1073741824,3848424914944,3584,33.1845,30.1346,115971
1,CUTLASS,gemm,cutlass_tensorop_h16816gemm_256x128_32x3_nn_align4,incorrect,success,universal,serial,8192,8192,28672,f16:column,f16:column,f16:column,1,0,1,1,tensorop,f16,256,128,32,3,4,2,1,16,8,16,80,1024,1073741824,3848424914944,3584,33.3466,29.9881,115407
1,CUTLASS,gemm,cutlass_tensorop_h16816gemm_256x128_32x3_nn_align2,incorrect,success,universal,serial,8192,8192,28672,f16:column,f16:column,f16:column,1,0,1,1,tensorop,f16,256,128,32,3,4,2,1,16,8,16,80,1024,1073741824,3848424914944,3584,36.2763,27.5662,106086
1,CUTLASS,gemm,cutlass_tensorop_h16816gemm_128x256_32x3_nn_align8,incorrect,success,universal,serial,8192,8192,28672,f16:column,f16:column,f16:column,1,0,1,1,tensorop,f16,128,256,32,3,2,4,1,16,8,16,80,1024,1073741824,3848424914944,3584,33.1973,30.123,115926
1,CUTLASS,gemm,cutlass_tensorop_h16816gemm_128x256_32x3_nn_align4,incorrect,success,universal,serial,8192,8192,28672,f16:column,f16:column,f16:column,1,0,1,1,tensorop,f16,128,256,32,3,2,4,1,16,8,16,80,1024,1073741824,3848424914944,3584,33.2962,30.0335,115582
1,CUTLASS,gemm,cutlass_tensorop_h16816gemm_128x256_32x3_nn_align2,incorrect,success,universal,serial,8192,8192,28672,f16:column,f16:column,f16:column,1,0,1,1,tensorop,f16,128,256,32,3,2,4,1,16,8,16,80,1024,1073741824,3848424914944,3584,33.8826,29.5137,113581
1,CUTLASS,gemm,cutlass_tensorop_h16816gemm_256x64_32x3_nn_align8,incorrect,success,universal,serial,8192,8192,28672,f16:column,f16:column,f16:column,1,0,1,1,tensorop,f16,256,64,32,3,4,1,1,16,8,16,80,1024,1073741824,3848424914944,3584,39.9009,25.0621,96449.6
1,CUTLASS,gemm,cutlass_tensorop_h16816gemm_256x64_32x3_nn_align4,incorrect,success,universal,serial,8192,8192,28672,f16:column,f16:column,f16:column,1,0,1,1,tensorop,f16,256,64,32,3,4,1,1,16,8,16,80,1024,1073741824,3848424914944,3584,42.5517,23.5008,90441.1
1,CUTLASS,gemm,cutlass_tensorop_h16816gemm_256x64_32x3_nn_align2,incorrect,success,universal,serial,8192,8192,28672,f16:column,f16:column,f16:column,1,0,1,1,tensorop,f16,256,64,32,3,4,1,1,16,8,16,80,1024,1073741824,3848424914944,3584,102.604,9.74619,37507.5
1,CUTLASS,gemm,cutlass_tensorop_h16816gemm_256x64_32x4_nn_align8,incorrect,success,universal,serial,8192,8192,28672,f16:column,f16:column,f16:column,1,0,1,1,tensorop,f16,256,64,32,4,4,1,1,16,8,16,80,1024,1073741824,3848424914944,3584,40.2269,24.859,95667.9
1,CUTLASS,gemm,cutlass_tensorop_h16816gemm_256x64_32x4_nn_align4,incorrect,success,universal,serial,8192,8192,28672,f16:column,f16:column,f16:column,1,0,1,1,tensorop,f16,256,64,32,4,4,1,1,16,8,16,80,1024,1073741824,3848424914944,3584,48.4023,20.6602,79509.1
1,CUTLASS,gemm,cutlass_tensorop_h16816gemm_256x64_32x4_nn_align2,incorrect,success,universal,serial,8192,8192,28672,f16:column,f16:column,f16:column,1,0,1,1,tensorop,f16,256,64,32,4,4,1,1,16,8,16,80,1024,1073741824,3848424914944,3584,87.2844,11.4568,44090.6
1,CUTLASS,gemm,cutlass_tensorop_h16816gemm_64x256_32x4_nn_align8,incorrect,success,universal,serial,8192,8192,28672,f16:column,f16:column,f16:column,1,0,1,1,tensorop,f16,64,256,32,4,1,4,1,16,8,16,80,1024,1073741824,3848424914944,3584,60.4115,16.5531,63703.5
1,CUTLASS,gemm,cutlass_tensorop_h16816gemm_64x256_32x4_nn_align4,incorrect,success,universal,serial,8192,8192,28672,f16:column,f16:column,f16:column,1,0,1,1,tensorop,f16,64,256,32,4,1,4,1,16,8,16,80,1024,1073741824,3848424914944,3584,40.1206,24.9248,95921.4
1,CUTLASS,gemm,cutlass_tensorop_h16816gemm_64x256_32x4_nn_align2,incorrect,success,universal,serial,8192,8192,28672,f16:column,f16:column,f16:column,1,0,1,1,tensorop,f16,64,256,32,4,1,4,1,16,8,16,80,1024,1073741824,3848424914944,3584,64.3909,15.5302,59766.6
1,CUTLASS,gemm,cutlass_tensorop_h16816gemm_128x128_32x3_nn_align8,incorrect,success,universal,serial,8192,8192,28672,f16:column,f16:column,f16:column,1,0,1,1,tensorop,f16,128,128,32,3,2,2,1,16,8,16,80,1024,1073741824,3848424914944,3584,33.1843,30.1348,115971
1,CUTLASS,gemm,cutlass_tensorop_h16816gemm_128x128_32x3_nn_align4,incorrect,success,universal,serial,8192,8192,28672,f16:column,f16:column,f16:column,1,0,1,1,tensorop,f16,128,128,32,3,2,2,1,16,8,16,80,1024,1073741824,3848424914944,3584,49.4831,20.2089,77772.6
1,CUTLASS,gemm,cutlass_tensorop_h16816gemm_128x128_32x3_nn_align2,incorrect,success,universal,serial,8192,8192,28672,f16:column,f16:column,f16:column,1,0,1,1,tensorop,f16,128,128,32,3,2,2,1,16,8,16,80,1024,1073741824,3848424914944,3584,42.3995,23.5852,90765.7
1,CUTLASS,gemm,cutlass_tensorop_h16816gemm_128x128_32x4_nn_align8,incorrect,success,universal,serial,8192,8192,28672,f16:column,f16:column,f16:column,1,0,1,1,tensorop,f16,128,128,32,4,2,2,1,16,8,16,80,1024,1073741824,3848424914944,3584,33.3209,30.0112,115496
1,CUTLASS,gemm,cutlass_tensorop_h16816gemm_128x128_32x4_nn_align4,incorrect,success,universal,serial,8192,8192,28672,f16:column,f16:column,f16:column,1,0,1,1,tensorop,f16,128,128,32,4,2,2,1,16,8,16,80,1024,1073741824,3848424914944,3584,36.7946,27.1779,104592
1,CUTLASS,gemm,cutlass_tensorop_h16816gemm_128x128_32x4_nn_align2,incorrect,success,universal,serial,8192,8192,28672,f16:column,f16:column,f16:column,1,0,1,1,tensorop,f16,128,128,32,4,2,2,1,16,8,16,80,1024,1073741824,3848424914944,3584,42.3907,23.5901,90784.6
1,CUTLASS,gemm,cutlass_tensorop_h16816gemm_128x128_32x5_nn_align8,incorrect,success,universal,serial,8192,8192,28672,f16:column,f16:column,f16:column,1,0,1,1,tensorop,f16,128,128,32,5,2,2,1,16,8,16,80,1024,1073741824,3848424914944,3584,33.3246,30.0078,115483
1,CUTLASS,gemm,cutlass_tensorop_h16816gemm_128x128_32x5_nn_align4,incorrect,success,universal,serial,8192,8192,28672,f16:column,f16:column,f16:column,1,0,1,1,tensorop,f16,128,128,32,5,2,2,1,16,8,16,80,1024,1073741824,3848424914944,3584,37.3168,26.7976,103128
1,CUTLASS,gemm,cutlass_tensorop_h16816gemm_128x128_32x5_nn_align2,incorrect,success,universal,serial,8192,8192,28672,f16:column,f16:column,f16:column,1,0,1,1,tensorop,f16,128,128,32,5,2,2,1,16,8,16,80,1024,1073741824,3848424914944,3584,43.2676,23.112,88944.8
1,CUTLASS,gemm,cutlass_tensorop_h16816gemm_128x64_32x6_nn_align8,incorrect,success,universal,serial,8192,8192,28672,f16:column,f16:column,f16:column,1,0,1,1,tensorop,f16,128,64,32,6,2,2,1,16,8,16,80,1024,1073741824,3848424914944,3584,63.2989,15.7981,60797.7
1,CUTLASS,gemm,cutlass_tensorop_h16816gemm_128x64_32x6_nn_align4,incorrect,success,universal,serial,8192,8192,28672,f16:column,f16:column,f16:column,1,0,1,1,tensorop,f16,128,64,32,6,2,2,1,16,8,16,80,1024,1073741824,3848424914944,3584,48.7687,20.5049,78911.8
1,CUTLASS,gemm,cutlass_tensorop_h16816gemm_128x64_32x6_nn_align2,incorrect,success,universal,serial,8192,8192,28672,f16:column,f16:column,f16:column,1,0,1,1,tensorop,f16,128,64,32,6,2,2,1,16,8,16,80,1024,1073741824,3848424914944,3584,67.943,14.7182,56642
1,CUTLASS,gemm,cutlass_tensorop_h16816gemm_64x128_32x6_nn_align8,incorrect,success,universal,serial,8192,8192,28672,f16:column,f16:column,f16:column,1,0,1,1,tensorop,f16,64,128,32,6,2,2,1,16,8,16,80,1024,1073741824,3848424914944,3584,83.0187,12.0455,46356.1
1,CUTLASS,gemm,cutlass_tensorop_h16816gemm_64x128_32x6_nn_align4,incorrect,success,universal,serial,8192,8192,28672,f16:column,f16:column,f16:column,1,0,1,1,tensorop,f16,64,128,32,6,2,2,1,16,8,16,80,1024,1073741824,3848424914944,3584,49.0337,20.3941,78485.3
1,CUTLASS,gemm,cutlass_tensorop_h16816gemm_64x128_32x6_nn_align2,incorrect,success,universal,serial,8192,8192,28672,f16:column,f16:column,f16:column,1,0,1,1,tensorop,f16,64,128,32,6,2,2,1,16,8,16,80,1024,1073741824,3848424914944,3584,59.1538,16.9051,65057.9
1,CUTLASS,gemm,cutlass_tensorop_h16816gemm_64x64_32x10_nn_align8,incorrect,success,universal,serial,8192,8192,28672,f16:column,f16:column,f16:column,1,0,1,1,tensorop,f16,64,64,32,10,2,2,1,16,8,16,80,1024,1073741824,3848424914944,3584,95.6203,10.458,40246.9
1,CUTLASS,gemm,cutlass_tensorop_h16816gemm_64x64_32x10_nn_align4,incorrect,success,universal,serial,8192,8192,28672,f16:column,f16:column,f16:column,1,0,1,1,tensorop,f16,64,64,32,10,2,2,1,16,8,16,80,1024,1073741824,3848424914944,3584,64.383,15.5321,59774
1,CUTLASS,gemm,cutlass_tensorop_h16816gemm_64x64_32x10_nn_align2,incorrect,success,universal,serial,8192,8192,28672,f16:column,f16:column,f16:column,1,0,1,1,tensorop,f16,64,64,32,10,2,2,1,16,8,16,80,1024,1073741824,3848424914944,3584,86.8157,11.5186,44328.7
1,CUTLASS,gemm,cutlass_tensorop_h16816gemm_128x64_64x3_nn_align8,incorrect,success,universal,serial,8192,8192,28672,f16:column,f16:column,f16:column,1,0,1,1,tensorop,f16,128,64,64,3,2,2,1,16,8,16,80,1024,1073741824,3848424914944,3584,48.9477,20.43,78623.2
1,CUTLASS,gemm,cutlass_tensorop_h16816gemm_128x64_64x3_nn_align4,incorrect,success,universal,serial,8192,8192,28672,f16:column,f16:column,f16:column,1,0,1,1,tensorop,f16,128,64,64,3,2,2,1,16,8,16,80,1024,1073741824,3848424914944,3584,48.6587,20.5513,79090.1
1,CUTLASS,gemm,cutlass_tensorop_h16816gemm_128x64_64x3_nn_align2,incorrect,success,universal,serial,8192,8192,28672,f16:column,f16:column,f16:column,1,0,1,1,tensorop,f16,128,64,64,3,2,2,1,16,8,16,80,1024,1073741824,3848424914944,3584,68.801,14.5347,55935.6
1,CUTLASS,gemm,cutlass_tensorop_h16816gemm_64x128_64x3_nn_align8,incorrect,success,universal,serial,8192,8192,28672,f16:column,f16:column,f16:column,1,0,1,1,tensorop,f16,64,128,64,3,2,2,1,16,8,16,80,1024,1073741824,3848424914944,3584,49.3727,20.2541,77946.5
1,CUTLASS,gemm,cutlass_tensorop_h16816gemm_64x128_64x3_nn_align4,incorrect,success,universal,serial,8192,8192,28672,f16:column,f16:column,f16:column,1,0,1,1,tensorop,f16,64,128,64,3,2,2,1,16,8,16,80,1024,1073741824,3848424914944,3584,48.9972,20.4093,78543.8
1,CUTLASS,gemm,cutlass_tensorop_h16816gemm_64x128_64x3_nn_align2,incorrect,success,universal,serial,8192,8192,28672,f16:column,f16:column,f16:column,1,0,1,1,tensorop,f16,64,128,64,3,2,2,1,16,8,16,80,1024,1073741824,3848424914944,3584,63.4375,15.7635,60664.8
1,CUTLASS,gemm,cutlass_tensorop_h16816gemm_64x64_64x5_nn_align8,incorrect,success,universal,serial,8192,8192,28672,f16:column,f16:column,f16:column,1,0,1,1,tensorop,f16,64,64,64,5,2,2,1,16,8,16,80,1024,1073741824,3848424914944,3584,96.7579,10.3351,39773.8
1,CUTLASS,gemm,cutlass_tensorop_h16816gemm_64x64_64x5_nn_align4,incorrect,success,universal,serial,8192,8192,28672,f16:column,f16:column,f16:column,1,0,1,1,tensorop,f16,64,64,64,5,2,2,1,16,8,16,80,1024,1073741824,3848424914944,3584,64.4231,15.5224,59736.7
1,CUTLASS,gemm,cutlass_tensorop_h16816gemm_64x64_64x5_nn_align2,incorrect,success,universal,serial,8192,8192,28672,f16:column,f16:column,f16:column,1,0,1,1,tensorop,f16,64,64,64,5,2,2,1,16,8,16,80,1024,1073741824,3848424914944,3584,74.2024,13.4766,51863.9
1,CUTLASS,gemm,cutlass_tensorop_h16816gemm_256x128_32x3_nt_align8,incorrect,success,universal,serial,8192,8192,28672,f16:column,f16:row,f16:column,1,0,1,1,tensorop,f16,256,128,32,3,4,2,1,16,8,16,80,1024,1073741824,3848424914944,3584,33.1835,30.1354,115974
1,CUTLASS,gemm,cutlass_tensorop_h16816gemm_256x128_32x3_nt_align4,incorrect,success,universal,serial,8192,8192,28672,f16:column,f16:row,f16:column,1,0,1,1,tensorop,f16,256,128,32,3,4,2,1,16,8,16,80,1024,1073741824,3848424914944,3584,33.4928,29.8572,114903
1,CUTLASS,gemm,cutlass_tensorop_h16816gemm_256x128_32x3_nt_align2,incorrect,success,universal,serial,8192,8192,28672,f16:column,f16:row,f16:column,1,0,1,1,tensorop,f16,256,128,32,3,4,2,1,16,8,16,80,1024,1073741824,3848424914944,3584,34.8466,28.6972,110439
1,CUTLASS,gemm,cutlass_tensorop_h16816gemm_128x256_32x3_nt_align8,incorrect,success,universal,serial,8192,8192,28672,f16:column,f16:row,f16:column,1,0,1,1,tensorop,f16,128,256,32,3,2,4,1,16,8,16,80,1024,1073741824,3848424914944,3584,33.2931,30.0362,115592
1,CUTLASS,gemm,cutlass_tensorop_h16816gemm_128x256_32x3_nt_align4,incorrect,success,universal,serial,8192,8192,28672,f16:column,f16:row,f16:column,1,0,1,1,tensorop,f16,128,256,32,3,2,4,1,16,8,16,80,1024,1073741824,3848424914944,3584,33.3543,29.9811,115380
1,CUTLASS,gemm,cutlass_tensorop_h16816gemm_128x256_32x3_nt_align2,incorrect,success,universal,serial,8192,8192,28672,f16:column,f16:row,f16:column,1,0,1,1,tensorop,f16,128,256,32,3,2,4,1,16,8,16,80,1024,1073741824,3848424914944,3584,34.9464,28.6153,110124
1,CUTLASS,gemm,cutlass_tensorop_h16816gemm_256x64_32x3_nt_align8,incorrect,success,universal,serial,8192,8192,28672,f16:column,f16:row,f16:column,1,0,1,1,tensorop,f16,256,64,32,3,4,1,1,16,8,16,80,1024,1073741824,3848424914944,3584,41.1181,24.3202,93594.4
1,CUTLASS,gemm,cutlass_tensorop_h16816gemm_256x64_32x3_nt_align4,incorrect,success,universal,serial,8192,8192,28672,f16:column,f16:row,f16:column,1,0,1,1,tensorop,f16,256,64,32,3,4,1,1,16,8,16,80,1024,1073741824,3848424914944,3584,40.9774,24.4037,93915.8
1,CUTLASS,gemm,cutlass_tensorop_h16816gemm_256x64_32x3_nt_align2,incorrect,success,universal,serial,8192,8192,28672,f16:column,f16:row,f16:column,1,0,1,1,tensorop,f16,256,64,32,3,4,1,1,16,8,16,80,1024,1073741824,3848424914944,3584,50.0799,19.9681,76845.6
1,CUTLASS,gemm,cutlass_tensorop_h16816gemm_256x64_32x4_nt_align8,incorrect,success,universal,serial,8192,8192,28672,f16:column,f16:row,f16:column,1,0,1,1,tensorop,f16,256,64,32,4,4,1,1,16,8,16,80,1024,1073741824,3848424914944,3584,40.0625,24.961,96060.6
1,CUTLASS,gemm,cutlass_tensorop_h16816gemm_256x64_32x4_nt_align4,incorrect,success,universal,serial,8192,8192,28672,f16:column,f16:row,f16:column,1,0,1,1,tensorop,f16,256,64,32,4,4,1,1,16,8,16,80,1024,1073741824,3848424914944,3584,39.8489,25.0948,96575.5
1,CUTLASS,gemm,cutlass_tensorop_h16816gemm_256x64_32x4_nt_align2,incorrect,success,universal,serial,8192,8192,28672,f16:column,f16:row,f16:column,1,0,1,1,tensorop,f16,256,64,32,4,4,1,1,16,8,16,80,1024,1073741824,3848424914944,3584,53.6925,18.6246,71675.3
1,CUTLASS,gemm,cutlass_tensorop_h16816gemm_64x256_32x4_nt_align8,incorrect,success,universal,serial,8192,8192,28672,f16:column,f16:row,f16:column,1,0,1,1,tensorop,f16,64,256,32,4,1,4,1,16,8,16,80,1024,1073741824,3848424914944,3584,45.7045,21.8797,84202.3
1,CUTLASS,gemm,cutlass_tensorop_h16816gemm_64x256_32x4_nt_align4,incorrect,success,universal,serial,8192,8192,28672,f16:column,f16:row,f16:column,1,0,1,1,tensorop,f16,64,256,32,4,1,4,1,16,8,16,80,1024,1073741824,3848424914944,3584,39.8848,25.0722,96488.5
1,CUTLASS,gemm,cutlass_tensorop_h16816gemm_64x256_32x4_nt_align2,incorrect,success,universal,serial,8192,8192,28672,f16:column,f16:row,f16:column,1,0,1,1,tensorop,f16,64,256,32,4,1,4,1,16,8,16,80,1024,1073741824,3848424914944,3584,55.0053,18.1801,69964.6
1,CUTLASS,gemm,cutlass_tensorop_h16816gemm_128x128_32x3_nt_align8,incorrect,success,universal,serial,8192,8192,28672,f16:column,f16:row,f16:column,1,0,1,1,tensorop,f16,128,128,32,3,2,2,1,16,8,16,80,1024,1073741824,3848424914944,3584,48.6772,20.5435,79060.2
1,CUTLASS,gemm,cutlass_tensorop_h16816gemm_128x128_32x3_nt_align4,incorrect,success,universal,serial,8192,8192,28672,f16:column,f16:row,f16:column,1,0,1,1,tensorop,f16,128,128,32,3,2,2,1,16,8,16,80,1024,1073741824,3848424914944,3584,33.6434,29.7235,114389
1,CUTLASS,gemm,cutlass_tensorop_h16816gemm_128x128_32x3_nt_align2,incorrect,success,universal,serial,8192,8192,28672,f16:column,f16:row,f16:column,1,0,1,1,tensorop,f16,128,128,32,3,2,2,1,16,8,16,80,1024,1073741824,3848424914944,3584,36.6675,27.2721,104955
1,CUTLASS,gemm,cutlass_tensorop_h16816gemm_128x128_32x4_nt_align8,incorrect,success,universal,serial,8192,8192,28672,f16:column,f16:row,f16:column,1,0,1,1,tensorop,f16,128,128,32,4,2,2,1,16,8,16,80,1024,1073741824,3848424914944,3584,33.3071,30.0236,115544
1,CUTLASS,gemm,cutlass_tensorop_h16816gemm_128x128_32x4_nt_align4,incorrect,success,universal,serial,8192,8192,28672,f16:column,f16:row,f16:column,1,0,1,1,tensorop,f16,128,128,32,4,2,2,1,16,8,16,80,1024,1073741824,3848424914944,3584,33.7132,29.662,114152
1,CUTLASS,gemm,cutlass_tensorop_h16816gemm_128x128_32x4_nt_align2,incorrect,success,universal,serial,8192,8192,28672,f16:column,f16:row,f16:column,1,0,1,1,tensorop,f16,128,128,32,4,2,2,1,16,8,16,80,1024,1073741824,3848424914944,3584,39.828,25.108,96626.2
1,CUTLASS,gemm,cutlass_tensorop_h16816gemm_128x128_32x5_nt_align8,incorrect,success,universal,serial,8192,8192,28672,f16:column,f16:row,f16:column,1,0,1,1,tensorop,f16,128,128,32,5,2,2,1,16,8,16,80,1024,1073741824,3848424914944,3584,33.3592,29.9768,115363
1,CUTLASS,gemm,cutlass_tensorop_h16816gemm_128x128_32x5_nt_align4,incorrect,success,universal,serial,8192,8192,28672,f16:column,f16:row,f16:column,1,0,1,1,tensorop,f16,128,128,32,5,2,2,1,16,8,16,80,1024,1073741824,3848424914944,3584,33.7609,29.6201,113991
1,CUTLASS,gemm,cutlass_tensorop_h16816gemm_128x128_32x5_nt_align2,incorrect,success,universal,serial,8192,8192,28672,f16:column,f16:row,f16:column,1,0,1,1,tensorop,f16,128,128,32,5,2,2,1,16,8,16,80,1024,1073741824,3848424914944,3584,40.1128,24.9297,95940
1,CUTLASS,gemm,cutlass_tensorop_h16816gemm_128x64_32x6_nt_align8,incorrect,success,universal,serial,8192,8192,28672,f16:column,f16:row,f16:column,1,0,1,1,tensorop,f16,128,64,32,6,2,2,1,16,8,16,80,1024,1073741824,3848424914944,3584,63.9811,15.6296,60149.4
1,CUTLASS,gemm,cutlass_tensorop_h16816gemm_128x64_32x6_nt_align4,incorrect,success,universal,serial,8192,8192,28672,f16:column,f16:row,f16:column,1,0,1,1,tensorop,f16,128,64,32,6,2,2,1,16,8,16,80,1024,1073741824,3848424914944,3584,47.2348,21.1708,81474.4
1,CUTLASS,gemm,cutlass_tensorop_h16816gemm_128x64_32x6_nt_align2,incorrect,success,universal,serial,8192,8192,28672,f16:column,f16:row,f16:column,1,0,1,1,tensorop,f16,128,64,32,6,2,2,1,16,8,16,80,1024,1073741824,3848424914944,3584,56.8379,17.5939,67708.7
1,CUTLASS,gemm,cutlass_tensorop_h16816gemm_64x128_32x6_nt_align8,incorrect,success,universal,serial,8192,8192,28672,f16:column,f16:row,f16:column,1,0,1,1,tensorop,f16,64,128,32,6,2,2,1,16,8,16,80,1024,1073741824,3848424914944,3584,80.1549,12.4758,48012.3
1,CUTLASS,gemm,cutlass_tensorop_h16816gemm_64x128_32x6_nt_align4,incorrect,success,universal,serial,8192,8192,28672,f16:column,f16:row,f16:column,1,0,1,1,tensorop,f16,64,128,32,6,2,2,1,16,8,16,80,1024,1073741824,3848424914944,3584,47.3392,21.1241,81294.7
1,CUTLASS,gemm,cutlass_tensorop_h16816gemm_64x128_32x6_nt_align2,incorrect,success,universal,serial,8192,8192,28672,f16:column,f16:row,f16:column,1,0,1,1,tensorop,f16,64,128,32,6,2,2,1,16,8,16,80,1024,1073741824,3848424914944,3584,57.4713,17.4,66962.6
1,CUTLASS,gemm,cutlass_tensorop_h16816gemm_64x64_32x10_nt_align8,incorrect,success,universal,serial,8192,8192,28672,f16:column,f16:row,f16:column,1,0,1,1,tensorop,f16,64,64,32,10,2,2,1,16,8,16,80,1024,1073741824,3848424914944,3584,93.0194,10.7504,41372.3
1,CUTLASS,gemm,cutlass_tensorop_h16816gemm_64x64_32x10_nt_align4,incorrect,success,universal,serial,8192,8192,28672,f16:column,f16:row,f16:column,1,0,1,1,tensorop,f16,64,64,32,10,2,2,1,16,8,16,80,1024,1073741824,3848424914944,3584,62.2275,16.0701,61844.5
1,CUTLASS,gemm,cutlass_tensorop_h16816gemm_64x64_32x10_nt_align2,incorrect,success,universal,serial,8192,8192,28672,f16:column,f16:row,f16:column,1,0,1,1,tensorop,f16,64,64,32,10,2,2,1,16,8,16,80,1024,1073741824,3848424914944,3584,78.0896,12.8058,49282.2
1,CUTLASS,gemm,cutlass_tensorop_h16816gemm_128x64_64x3_nt_align8,incorrect,success,universal,serial,8192,8192,28672,f16:column,f16:row,f16:column,1,0,1,1,tensorop,f16,128,64,64,3,2,2,1,16,8,16,80,1024,1073741824,3848424914944,3584,48.1633,20.7627,79903.6
1,CUTLASS,gemm,cutlass_tensorop_h16816gemm_128x64_64x3_nt_align4,incorrect,success,universal,serial,8192,8192,28672,f16:column,f16:row,f16:column,1,0,1,1,tensorop,f16,128,64,64,3,2,2,1,16,8,16,80,1024,1073741824,3848424914944,3584,47.9573,20.8519,80246.9
1,CUTLASS,gemm,cutlass_tensorop_h16816gemm_128x64_64x3_nt_align2,incorrect,success,universal,serial,8192,8192,28672,f16:column,f16:row,f16:column,1,0,1,1,tensorop,f16,128,64,64,3,2,2,1,16,8,16,80,1024,1073741824,3848424914944,3584,73.4927,13.6068,52364.7
1,CUTLASS,gemm,cutlass_tensorop_h16816gemm_64x128_64x3_nt_align8,incorrect,success,universal,serial,8192,8192,28672,f16:column,f16:row,f16:column,1,0,1,1,tensorop,f16,64,128,64,3,2,2,1,16,8,16,80,1024,1073741824,3848424914944,3584,48.6893,20.5384,79040.5
1,CUTLASS,gemm,cutlass_tensorop_h16816gemm_64x128_64x3_nt_align4,incorrect,success,universal,serial,8192,8192,28672,f16:column,f16:row,f16:column,1,0,1,1,tensorop,f16,64,128,64,3,2,2,1,16,8,16,80,1024,1073741824,3848424914944,3584,48.2606,20.7208,79742.6
1,CUTLASS,gemm,cutlass_tensorop_h16816gemm_64x128_64x3_nt_align2,incorrect,success,universal,serial,8192,8192,28672,f16:column,f16:row,f16:column,1,0,1,1,tensorop,f16,64,128,64,3,2,2,1,16,8,16,80,1024,1073741824,3848424914944,3584,76.3596,13.0959,50398.7
1,CUTLASS,gemm,cutlass_tensorop_h16816gemm_64x64_64x5_nt_align8,incorrect,success,universal,serial,8192,8192,28672,f16:column,f16:row,f16:column,1,0,1,1,tensorop,f16,64,64,64,5,2,2,1,16,8,16,80,1024,1073741824,3848424914944,3584,92.993,10.7535,41384
1,CUTLASS,gemm,cutlass_tensorop_h16816gemm_64x64_64x5_nt_align4,incorrect,success,universal,serial,8192,8192,28672,f16:column,f16:row,f16:column,1,0,1,1,tensorop,f16,64,64,64,5,2,2,1,16,8,16,80,1024,1073741824,3848424914944,3584,62.119,16.0981,61952.4
1,CUTLASS,gemm,cutlass_tensorop_h16816gemm_64x64_64x5_nt_align2,incorrect,success,universal,serial,8192,8192,28672,f16:column,f16:row,f16:column,1,0,1,1,tensorop,f16,64,64,64,5,2,2,1,16,8,16,80,1024,1073741824,3848424914944,3584,74.0927,13.4966,51940.6
1,CUTLASS,gemm,cutlass_tensorop_h16816gemm_256x128_32x3_tn_align8,incorrect,success,universal,serial,8192,8192,28672,f16:row,f16:column,f16:column,1,0,1,1,tensorop,f16,256,128,32,3,4,2,1,16,8,16,80,1024,1073741824,3848424914944,3584,33.3828,29.9555,115282
1,CUTLASS,gemm,cutlass_tensorop_h16816gemm_256x128_32x3_tn_align4,incorrect,success,universal,serial,8192,8192,28672,f16:row,f16:column,f16:column,1,0,1,1,tensorop,f16,256,128,32,3,4,2,1,16,8,16,80,1024,1073741824,3848424914944,3584,33.6217,29.7427,114462
1,CUTLASS,gemm,cutlass_tensorop_h16816gemm_256x128_32x3_tn_align2,incorrect,success,universal,serial,8192,8192,28672,f16:row,f16:column,f16:column,1,0,1,1,tensorop,f16,256,128,32,3,4,2,1,16,8,16,80,1024,1073741824,3848424914944,3584,42.1469,23.7265,91309.8
1,CUTLASS,gemm,cutlass_tensorop_h16816gemm_128x256_32x3_tn_align8,incorrect,success,universal,serial,8192,8192,28672,f16:row,f16:column,f16:column,1,0,1,1,tensorop,f16,128,256,32,3,2,4,1,16,8,16,80,1024,1073741824,3848424914944,3584,33.2675,30.0594,115681
1,CUTLASS,gemm,cutlass_tensorop_h16816gemm_128x256_32x3_tn_align4,incorrect,success,universal,serial,8192,8192,28672,f16:row,f16:column,f16:column,1,0,1,1,tensorop,f16,128,256,32,3,2,4,1,16,8,16,80,1024,1073741824,3848424914944,3584,34.7009,28.8177,110903
1,CUTLASS,gemm,cutlass_tensorop_h16816gemm_128x256_32x3_tn_align2,incorrect,success,universal,serial,8192,8192,28672,f16:row,f16:column,f16:column,1,0,1,1,tensorop,f16,128,256,32,3,2,4,1,16,8,16,80,1024,1073741824,3848424914944,3584,44.3862,22.5295,86703.2
1,CUTLASS,gemm,cutlass_tensorop_h16816gemm_256x64_32x3_tn_align8,incorrect,success,universal,serial,8192,8192,28672,f16:row,f16:column,f16:column,1,0,1,1,tensorop,f16,256,64,32,3,4,1,1,16,8,16,80,1024,1073741824,3848424914944,3584,43.2542,23.1192,88972.3
1,CUTLASS,gemm,cutlass_tensorop_h16816gemm_256x64_32x3_tn_align4,incorrect,success,universal,serial,8192,8192,28672,f16:row,f16:column,f16:column,1,0,1,1,tensorop,f16,256,64,32,3,4,1,1,16,8,16,80,1024,1073741824,3848424914944,3584,54.2187,18.4438,70979.7
1,CUTLASS,gemm,cutlass_tensorop_h16816gemm_256x64_32x3_tn_align2,incorrect,success,universal,serial,8192,8192,28672,f16:row,f16:column,f16:column,1,0,1,1,tensorop,f16,256,64,32,3,4,1,1,16,8,16,80,1024,1073741824,3848424914944,3584,95.8031,10.4381,40170.2
1,CUTLASS,gemm,cutlass_tensorop_h16816gemm_256x64_32x4_tn_align8,incorrect,success,universal,serial,8192,8192,28672,f16:row,f16:column,f16:column,1,0,1,1,tensorop,f16,256,64,32,4,4,1,1,16,8,16,80,1024,1073741824,3848424914944,3584,42.2422,23.673,91103.9
1,CUTLASS,gemm,cutlass_tensorop_h16816gemm_256x64_32x4_tn_align4,incorrect,success,universal,serial,8192,8192,28672,f16:row,f16:column,f16:column,1,0,1,1,tensorop,f16,256,64,32,4,4,1,1,16,8,16,80,1024,1073741824,3848424914944,3584,55.2278,18.1068,69682.7
1,CUTLASS,gemm,cutlass_tensorop_h16816gemm_256x64_32x4_tn_align2,incorrect,success,universal,serial,8192,8192,28672,f16:row,f16:column,f16:column,1,0,1,1,tensorop,f16,256,64,32,4,4,1,1,16,8,16,80,1024,1073741824,3848424914944,3584,103.039,9.70506,37349.2
1,CUTLASS,gemm,cutlass_tensorop_h16816gemm_64x256_32x4_tn_align8,incorrect,success,universal,serial,8192,8192,28672,f16:row,f16:column,f16:column,1,0,1,1,tensorop,f16,64,256,32,4,1,4,1,16,8,16,80,1024,1073741824,3848424914944,3584,83.0427,12.042,46342.7
1,CUTLASS,gemm,cutlass_tensorop_h16816gemm_64x256_32x4_tn_align4,incorrect,success,universal,serial,8192,8192,28672,f16:row,f16:column,f16:column,1,0,1,1,tensorop,f16,64,256,32,4,1,4,1,16,8,16,80,1024,1073741824,3848424914944,3584,79.9418,12.5091,48140.3
1,CUTLASS,gemm,cutlass_tensorop_h16816gemm_64x256_32x4_tn_align2,incorrect,success,universal,serial,8192,8192,28672,f16:row,f16:column,f16:column,1,0,1,1,tensorop,f16,64,256,32,4,1,4,1,16,8,16,80,1024,1073741824,3848424914944,3584,92.5757,10.802,41570.6
1,CUTLASS,gemm,cutlass_tensorop_h16816gemm_128x128_32x3_tn_align8,incorrect,success,universal,serial,8192,8192,28672,f16:row,f16:column,f16:column,1,0,1,1,tensorop,f16,128,128,32,3,2,2,1,16,8,16,80,1024,1073741824,3848424914944,3584,49.7175,20.1137,77405.9
1,CUTLASS,gemm,cutlass_tensorop_h16816gemm_128x128_32x3_tn_align4,incorrect,success,universal,serial,8192,8192,28672,f16:row,f16:column,f16:column,1,0,1,1,tensorop,f16,128,128,32,3,2,2,1,16,8,16,80,1024,1073741824,3848424914944,3584,66.9476,14.9371,57484.2
1,CUTLASS,gemm,cutlass_tensorop_h16816gemm_128x128_32x3_tn_align2,incorrect,success,universal,serial,8192,8192,28672,f16:row,f16:column,f16:column,1,0,1,1,tensorop,f16,128,128,32,3,2,2,1,16,8,16,80,1024,1073741824,3848424914944,3584,61.4978,16.2608,62578.3
1,CUTLASS,gemm,cutlass_tensorop_h16816gemm_128x128_32x4_tn_align8,incorrect,success,universal,serial,8192,8192,28672,f16:row,f16:column,f16:column,1,0,1,1,tensorop,f16,128,128,32,4,2,2,1,16,8,16,80,1024,1073741824,3848424914944,3584,33.5025,29.8485,114870
1,CUTLASS,gemm,cutlass_tensorop_h16816gemm_128x128_32x4_tn_align4,incorrect,success,universal,serial,8192,8192,28672,f16:row,f16:column,f16:column,1,0,1,1,tensorop,f16,128,128,32,4,2,2,1,16,8,16,80,1024,1073741824,3848424914944,3584,47.9166,20.8696,80315
1,CUTLASS,gemm,cutlass_tensorop_h16816gemm_128x128_32x4_tn_align2,incorrect,success,universal,serial,8192,8192,28672,f16:row,f16:column,f16:column,1,0,1,1,tensorop,f16,128,128,32,4,2,2,1,16,8,16,80,1024,1073741824,3848424914944,3584,51.2975,19.4941,75021.7
1,CUTLASS,gemm,cutlass_tensorop_h16816gemm_128x128_32x5_tn_align8,incorrect,success,universal,serial,8192,8192,28672,f16:row,f16:column,f16:column,1,0,1,1,tensorop,f16,128,128,32,5,2,2,1,16,8,16,80,1024,1073741824,3848424914944,3584,33.5037,29.8474,114866
