CUTLASS/cutlassgemm-benchmark/csv_logs/cutlass_shape_8192_8192_22016_performance.gemm.csv
Problem,Provider,OperationKind,Operation,Disposition,Status,gemm_kind,m,n,k,A,B,C,D,alpha,beta,split_k_mode,split_k_slices,batch_count,raster_order,op_class,accum,cta_m,cta_n,cta_k,cluster_m,cluster_n,cluster_k,stages,warps_m,warps_n,warps_k,inst_m,inst_n,inst_k,min_cc,max_cc,Bytes,Flops,Flops/Byte,Runtime,GB/s,GFLOPs
1,CUTLASS,gemm,cutlass_tensorop_h1688gemm_256x128_32x2_nn_align8,passed,success,universal,8192,22016,8192,f16:column,f16:column,f16:column,f16:column,1,0,serial,1,1,heuristic,tensorop,f16,256,128,32,1,1,1,2,4,2,1,16,8,8,75,1024,855638016,2955298209792,3453,14.6105,54.5411,202272
1,CUTLASS,gemm,cutlass_tensorop_h1688gemm_256x128_32x2_nn_align4,passed,success,universal,8192,22016,8192,f16:column,f16:column,f16:column,f16:column,1,0,serial,1,1,heuristic,tensorop,f16,256,128,32,1,1,1,2,4,2,1,16,8,8,75,1024,855638016,2955298209792,3453,14.0091,56.8825,210955
1,CUTLASS,gemm,cutlass_tensorop_h1688gemm_256x128_32x2_nn_align2,passed,success,universal,8192,22016,8192,f16:column,f16:column,f16:column,f16:column,1,0,serial,1,1,heuristic,tensorop,f16,256,128,32,1,1,1,2,4,2,1,16,8,8,75,1024,855638016,2955298209792,3453,14.2606,55.8794,207235
1,CUTLASS,gemm,cutlass_tensorop_h1688gemm_256x128_32x2_nn_align1,passed,success,universal,8192,22016,8192,f16:column,f16:column,f16:column,f16:column,1,0,serial,1,1,heuristic,tensorop,f16,256,128,32,1,1,1,2,4,2,1,16,8,8,75,1024,855638016,2955298209792,3453,18.093,44.0432,163339
1,CUTLASS,gemm,cutlass_tensorop_h1688gemm_128x256_32x2_nn_align8,passed,success,universal,8192,22016,8192,f16:column,f16:column,f16:column,f16:column,1,0,serial,1,1,heuristic,tensorop,f16,128,256,32,1,1,1,2,2,4,1,16,8,8,75,1024,855638016,2955298209792,3453,13.5917,58.6294,217434
1,CUTLASS,gemm,cutlass_tensorop_h1688gemm_128x256_32x2_nn_align4,passed,success,universal,8192,22016,8192,f16:column,f16:column,f16:column,f16:column,1,0,serial,1,1,heuristic,tensorop,f16,128,256,32,1,1,1,2,2,4,1,16,8,8,75,1024,855638016,2955298209792,3453,12.9749,61.4166,227770
1,CUTLASS,gemm,cutlass_tensorop_h1688gemm_128x256_32x2_nn_align2,passed,success,universal,8192,22016,8192,f16:column,f16:column,f16:column,f16:column,1,0,serial,1,1,heuristic,tensorop,f16,128,256,32,1,1,1,2,2,4,1,16,8,8,75,1024,855638016,2955298209792,3453,13.0294,61.16,226818
1,CUTLASS,gemm,cutlass_tensorop_h1688gemm_128x256_32x2_nn_align1,passed,success,universal,8192,22016,8192,f16:column,f16:column,f16:column,f16:column,1,0,serial,1,1,heuristic,tensorop,f16,128,256,32,1,1,1,2,2,4,1,16,8,8,75,1024,855638016,2955298209792,3453,14.827,53.7449,199319
1,CUTLASS,gemm,cutlass_tensorop_h1688gemm_128x128_32x2_nn_align8,passed,success,universal,8192,22016,8192,f16:column,f16:column,f16:column,f16:column,1,0,serial,1,1,heuristic,tensorop,f16,128,128,32,1,1,1,2,2,2,1,16,8,8,75,1024,855638016,2955298209792,3453,11.047,72.1349,267520
1,CUTLASS,gemm,cutlass_tensorop_h1688gemm_128x128_32x2_nn_align4,passed,success,universal,8192,22016,8192,f16:column,f16:column,f16:column,f16:column,1,0,serial,1,1,heuristic,tensorop,f16,128,128,32,1,1,1,2,2,2,1,16,8,8,75,1024,855638016,2955298209792,3453,11.6815,68.2169,252990
1,CUTLASS,gemm,cutlass_tensorop_h1688gemm_128x128_32x2_nn_align2,passed,success,universal,8192,22016,8192,f16:column,f16:column,f16:column,f16:column,1,0,serial,1,1,heuristic,tensorop,f16,128,128,32,1,1,1,2,2,2,1,16,8,8,75,1024,855638016,2955298209792,3453,12.4579,63.9655,237223
1,CUTLASS,gemm,cutlass_tensorop_h1688gemm_128x128_32x2_nn_align1,passed,success,universal,8192,22016,8192,f16:column,f16:column,f16:column,f16:column,1,0,serial,1,1,heuristic,tensorop,f16,128,128,32,1,1,1,2,2,2,1,16,8,8,75,1024,855638016,2955298209792,3453,16.5055,48.2792,179049
1,CUTLASS,gemm,cutlass_tensorop_h1688gemm_64x256_32x2_nn_align8,passed,success,universal,8192,22016,8192,f16:column,f16:column,f16:column,f16:column,1,0,serial,1,1,heuristic,tensorop,f16,64,256,32,1,1,1,2,1,4,1,16,8,8,75,1024,855638016,2955298209792,3453,12.5093,63.7027,236248
1,CUTLASS,gemm,cutlass_tensorop_h1688gemm_64x256_32x2_nn_align4,passed,success,universal,8192,22016,8192,f16:column,f16:column,f16:column,f16:column,1,0,serial,1,1,heuristic,tensorop,f16,64,256,32,1,1,1,2,1,4,1,16,8,8,75,1024,855638016,2955298209792,3453,13.2736,60.0345,222645
1,CUTLASS,gemm,cutlass_tensorop_h1688gemm_64x256_32x2_nn_align2,passed,success,universal,8192,22016,8192,f16:column,f16:column,f16:column,f16:column,1,0,serial,1,1,heuristic,tensorop,f16,64,256,32,1,1,1,2,1,4,1,16,8,8,75,1024,855638016,2955298209792,3453,13.9164,57.2617,212361
1,CUTLASS,gemm,cutlass_tensorop_h1688gemm_64x256_32x2_nn_align1,passed,success,universal,8192,22016,8192,f16:column,f16:column,f16:column,f16:column,1,0,serial,1,1,heuristic,tensorop,f16,64,256,32,1,1,1,2,1,4,1,16,8,8,75,1024,855638016,2955298209792,3453,17.2986,46.0658,170840
1,CUTLASS,gemm,cutlass_tensorop_h1688gemm_256x64_32x2_nn_align8,passed,success,universal,8192,22016,8192,f16:column,f16:column,f16:column,f16:column,1,0,serial,1,1,heuristic,tensorop,f16,256,64,32,1,1,1,2,4,1,1,16,8,8,75,1024,855638016,2955298209792,3453,14.1687,56.242,208580
1,CUTLASS,gemm,cutlass_tensorop_h1688gemm_256x64_32x2_nn_align4,passed,success,universal,8192,22016,8192,f16:column,f16:column,f16:column,f16:column,1,0,serial,1,1,heuristic,tensorop,f16,256,64,32,1,1,1,2,4,1,1,16,8,8,75,1024,855638016,2955298209792,3453,15.4515,51.5725,191262
1,CUTLASS,gemm,cutlass_tensorop_h1688gemm_256x64_32x2_nn_align2,passed,success,universal,8192,22016,8192,f16:column,f16:column,f16:column,f16:column,1,0,serial,1,1,heuristic,tensorop,f16,256,64,32,1,1,1,2,4,1,1,16,8,8,75,1024,855638016,2955298209792,3453,15.0629,52.903,196197
1,CUTLASS,gemm,cutlass_tensorop_h1688gemm_256x64_32x2_nn_align1,passed,success,universal,8192,22016,8192,f16:column,f16:column,f16:column,f16:column,1,0,serial,1,1,heuristic,tensorop,f16,256,64,32,1,1,1,2,4,1,1,16,8,8,75,1024,855638016,2955298209792,3453,23.036,34.5926,128290
1,CUTLASS,gemm,cutlass_tensorop_h1688gemm_64x128_32x2_nn_align8,passed,success,universal,8192,22016,8192,f16:column,f16:column,f16:column,f16:column,1,0,serial,1,1,heuristic,tensorop,f16,64,128,32,1,1,1,2,2,2,1,16,8,8,75,1024,855638016,2955298209792,3453,14.8469,53.6729,199052
1,CUTLASS,gemm,cutlass_tensorop_h1688gemm_64x128_32x2_nn_align4,passed,success,universal,8192,22016,8192,f16:column,f16:column,f16:column,f16:column,1,0,serial,1,1,heuristic,tensorop,f16,64,128,32,1,1,1,2,2,2,1,16,8,8,75,1024,855638016,2955298209792,3453,15.1028,52.7635,195679
1,CUTLASS,gemm,cutlass_tensorop_h1688gemm_64x128_32x2_nn_align2,passed,success,universal,8192,22016,8192,f16:column,f16:column,f16:column,f16:column,1,0,serial,1,1,heuristic,tensorop,f16,64,128,32,1,1,1,2,2,2,1,16,8,8,75,1024,855638016,2955298209792,3453,16.4951,48.3098,179162
1,CUTLASS,gemm,cutlass_tensorop_h1688gemm_64x128_32x2_nn_align1,passed,success,universal,8192,22016,8192,f16:column,f16:column,f16:column,f16:column,1,0,serial,1,1,heuristic,tensorop,f16,64,128,32,1,1,1,2,2,2,1,16,8,8,75,1024,855638016,2955298209792,3453,22.1057,36.0484,133689
1,CUTLASS,gemm,cutlass_tensorop_h1688gemm_128x64_32x2_nn_align8,passed,success,universal,8192,22016,8192,f16:column,f16:column,f16:column,f16:column,1,0,serial,1,1,heuristic,tensorop,f16,128,64,32,1,1,1,2,2,2,1,16,8,8,75,1024,855638016,2955298209792,3453,15.2423,52.2803,193887
1,CUTLASS,gemm,cutlass_tensorop_h1688gemm_128x64_32x2_nn_align4,passed,success,universal,8192,22016,8192,f16:column,f16:column,f16:column,f16:column,1,0,serial,1,1,heuristic,tensorop,f16,128,64,32,1,1,1,2,2,2,1,16,8,8,75,1024,855638016,2955298209792,3453,16.4903,48.3239,179214
1,CUTLASS,gemm,cutlass_tensorop_h1688gemm_128x64_32x2_nn_align2,passed,success,universal,8192,22016,8192,f16:column,f16:column,f16:column,f16:column,1,0,serial,1,1,heuristic,tensorop,f16,128,64,32,1,1,1,2,2,2,1,16,8,8,75,1024,855638016,2955298209792,3453,17.5543,45.3948,168352
1,CUTLASS,gemm,cutlass_tensorop_h1688gemm_128x64_32x2_nn_align1,passed,success,universal,8192,22016,8192,f16:column,f16:column,f16:column,f16:column,1,0,serial,1,1,heuristic,tensorop,f16,128,64,32,1,1,1,2,2,2,1,16,8,8,75,1024,855638016,2955298209792,3453,25.5979,31.1305,115451
1,CUTLASS,gemm,cutlass_tensorop_h1688gemm_64x64_32x2_nn_align8,passed,success,universal,8192,22016,8192,f16:column,f16:column,f16:column,f16:column,1,0,serial,1,1,heuristic,tensorop,f16,64,64,32,1,1,1,2,2,2,1,16,8,8,75,1024,855638016,2955298209792,3453,19.2741,41.3442,153330
1,CUTLASS,gemm,cutlass_tensorop_h1688gemm_64x64_32x2_nn_align4,passed,success,universal,8192,22016,8192,f16:column,f16:column,f16:column,f16:column,1,0,serial,1,1,heuristic,tensorop,f16,64,64,32,1,1,1,2,2,2,1,16,8,8,75,1024,855638016,2955298209792,3453,19.832,40.1812,149017
1,CUTLASS,gemm,cutlass_tensorop_h1688gemm_64x64_32x2_nn_align2,passed,success,universal,8192,22016,8192,f16:column,f16:column,f16:column,f16:column,1,0,serial,1,1,heuristic,tensorop,f16,64,64,32,1,1,1,2,2,2,1,16,8,8,75,1024,855638016,2955298209792,3453,21.3018,37.4089,138735
1,CUTLASS,gemm,cutlass_tensorop_h1688gemm_64x64_32x2_nn_align1,passed,success,universal,8192,22016,8192,f16:column,f16:column,f16:column,f16:column,1,0,serial,1,1,heuristic,tensorop,f16,64,64,32,1,1,1,2,2,2,1,16,8,8,75,1024,855638016,2955298209792,3453,31.6019,25.2161,93516.6
1,CUTLASS,gemm,cutlass_tensorop_h1688gemm_64x128_64x2_nn_align8,passed,success,universal,8192,22016,8192,f16:column,f16:column,f16:column,f16:column,1,0,serial,1,1,heuristic,tensorop,f16,64,128,64,1,1,1,2,1,2,2,16,8,8,75,1024,855638016,2955298209792,3453,14.4678,55.0793,204267
1,CUTLASS,gemm,cutlass_tensorop_h1688gemm_64x128_64x2_nn_align4,passed,success,universal,8192,22016,8192,f16:column,f16:column,f16:column,f16:column,1,0,serial,1,1,heuristic,tensorop,f16,64,128,64,1,1,1,2,1,2,2,16,8,8,75,1024,855638016,2955298209792,3453,14.4983,54.9633,203838
1,CUTLASS,gemm,cutlass_tensorop_h1688gemm_64x128_64x2_nn_align2,passed,success,universal,8192,22016,8192,f16:column,f16:column,f16:column,f16:column,1,0,serial,1,1,heuristic,tensorop,f16,64,128,64,1,1,1,2,1,2,2,16,8,8,75,1024,855638016,2955298209792,3453,14.5206,54.8788,203524
1,CUTLASS,gemm,cutlass_tensorop_h1688gemm_64x128_64x2_nn_align1,passed,success,universal,8192,22016,8192,f16:column,f16:column,f16:column,f16:column,1,0,serial,1,1,heuristic,tensorop,f16,64,128,64,1,1,1,2,1,2,2,16,8,8,75,1024,855638016,2955298209792,3453,19.5024,40.8604,151535
1,CUTLASS,gemm,cutlass_tensorop_h1688gemm_256x128_32x2_nt_align8,passed,success,universal,8192,22016,8192,f16:column,f16:row,f16:column,f16:column,1,0,serial,1,1,heuristic,tensorop,f16,256,128,32,1,1,1,2,4,2,1,16,8,8,75,1024,855638016,2955298209792,3453,12.8551,61.9891,229893
1,CUTLASS,gemm,cutlass_tensorop_h1688gemm_256x128_32x2_nt_align4,passed,success,universal,8192,22016,8192,f16:column,f16:row,f16:column,f16:column,1,0,serial,1,1,heuristic,tensorop,f16,256,128,32,1,1,1,2,4,2,1,16,8,8,75,1024,855638016,2955298209792,3453,14.4995,54.9587,203820
1,CUTLASS,gemm,cutlass_tensorop_h1688gemm_256x128_32x2_nt_align2,passed,success,universal,8192,22016,8192,f16:column,f16:row,f16:column,f16:column,1,0,serial,1,1,heuristic,tensorop,f16,256,128,32,1,1,1,2,4,2,1,16,8,8,75,1024,855638016,2955298209792,3453,12.9485,61.5421,228236
1,CUTLASS,gemm,cutlass_tensorop_h1688gemm_256x128_32x2_nt_align1,passed,success,universal,8192,22016,8192,f16:column,f16:row,f16:column,f16:column,1,0,serial,1,1,heuristic,tensorop,f16,256,128,32,1,1,1,2,4,2,1,16,8,8,75,1024,855638016,2955298209792,3453,15.2704,52.1843,193531
1,CUTLASS,gemm,cutlass_tensorop_h1688gemm_128x256_32x2_nt_align8,passed,success,universal,8192,22016,8192,f16:column,f16:row,f16:column,f16:column,1,0,serial,1,1,heuristic,tensorop,f16,128,256,32,1,1,1,2,2,4,1,16,8,8,75,1024,855638016,2955298209792,3453,12.5752,63.3686,235009
1,CUTLASS,gemm,cutlass_tensorop_h1688gemm_128x256_32x2_nt_align4,passed,success,universal,8192,22016,8192,f16:column,f16:row,f16:column,f16:column,1,0,serial,1,1,heuristic,tensorop,f16,128,256,32,1,1,1,2,2,4,1,16,8,8,75,1024,855638016,2955298209792,3453,12.7303,62.5969,232147
1,CUTLASS,gemm,cutlass_tensorop_h1688gemm_128x256_32x2_nt_align2,passed,success,universal,8192,22016,8192,f16:column,f16:row,f16:column,f16:column,1,0,serial,1,1,heuristic,tensorop,f16,128,256,32,1,1,1,2,2,4,1,16,8,8,75,1024,855638016,2955298209792,3453,14.2993,55.7281,206674
1,CUTLASS,gemm,cutlass_tensorop_h1688gemm_128x256_32x2_nt_align1,passed,success,universal,8192,22016,8192,f16:column,f16:row,f16:column,f16:column,1,0,serial,1,1,heuristic,tensorop,f16,128,256,32,1,1,1,2,2,4,1,16,8,8,75,1024,855638016,2955298209792,3453,15.4393,51.6136,191415
1,CUTLASS,gemm,cutlass_tensorop_h1688gemm_128x128_32x2_nt_align8,passed,success,universal,8192,22016,8192,f16:column,f16:row,f16:column,f16:column,1,0,serial,1,1,heuristic,tensorop,f16,128,128,32,1,1,1,2,2,2,1,16,8,8,75,1024,855638016,2955298209792,3453,10.7699,73.9908,274403
1,CUTLASS,gemm,cutlass_tensorop_h1688gemm_128x128_32x2_nt_align4,passed,success,universal,8192,22016,8192,f16:column,f16:row,f16:column,f16:column,1,0,serial,1,1,heuristic,tensorop,f16,128,128,32,1,1,1,2,2,2,1,16,8,8,75,1024,855638016,2955298209792,3453,12.6424,63.0319,233761
1,CUTLASS,gemm,cutlass_tensorop_h1688gemm_128x128_32x2_nt_align2,passed,success,universal,8192,22016,8192,f16:column,f16:row,f16:column,f16:column,1,0,serial,1,1,heuristic,tensorop,f16,128,128,32,1,1,1,2,2,2,1,16,8,8,75,1024,855638016,2955298209792,3453,11.3362,70.2948,260696
1,CUTLASS,gemm,cutlass_tensorop_h1688gemm_128x128_32x2_nt_align1,passed,success,universal,8192,22016,8192,f16:column,f16:row,f16:column,f16:column,1,0,serial,1,1,heuristic,tensorop,f16,128,128,32,1,1,1,2,2,2,1,16,8,8,75,1024,855638016,2955298209792,3453,14.799,53.8467,199696
1,CUTLASS,gemm,cutlass_tensorop_h1688gemm_64x256_32x2_nt_align8,passed,success,universal,8192,22016,8192,f16:column,f16:row,f16:column,f16:column,1,0,serial,1,1,heuristic,tensorop,f16,64,256,32,1,1,1,2,1,4,1,16,8,8,75,1024,855638016,2955298209792,3453,12.4487,64.0129,237399
1,CUTLASS,gemm,cutlass_tensorop_h1688gemm_64x256_32x2_nt_align4,passed,success,universal,8192,22016,8192,f16:column,f16:row,f16:column,f16:column,1,0,serial,1,1,heuristic,tensorop,f16,64,256,32,1,1,1,2,1,4,1,16,8,8,75,1024,855638016,2955298209792,3453,13.0381,61.119,226667
1,CUTLASS,gemm,cutlass_tensorop_h1688gemm_64x256_32x2_nt_align2,passed,success,universal,8192,22016,8192,f16:column,f16:row,f16:column,f16:column,1,0,serial,1,1,heuristic,tensorop,f16,64,256,32,1,1,1,2,1,4,1,16,8,8,75,1024,855638016,2955298209792,3453,13.5843,58.6615,217553
1,CUTLASS,gemm,cutlass_tensorop_h1688gemm_64x256_32x2_nt_align1,passed,success,universal,8192,22016,8192,f16:column,f16:row,f16:column,f16:column,1,0,serial,1,1,heuristic,tensorop,f16,64,256,32,1,1,1,2,1,4,1,16,8,8,75,1024,855638016,2955298209792,3453,16.4481,48.4478,179674
1,CUTLASS,gemm,cutlass_tensorop_h1688gemm_256x64_32x2_nt_align8,passed,success,universal,8192,22016,8192,f16:column,f16:row,f16:column,f16:column,1,0,serial,1,1,heuristic,tensorop,f16,256,64,32,1,1,1,2,4,1,1,16,8,8,75,1024,855638016,2955298209792,3453,13.5084,58.9911,218775
1,CUTLASS,gemm,cutlass_tensorop_h1688gemm_256x64_32x2_nt_align4,passed,success,universal,8192,22016,8192,f16:column,f16:row,f16:column,f16:column,1,0,serial,1,1,heuristic,tensorop,f16,256,64,32,1,1,1,2,4,1,1,16,8,8,75,1024,855638016,2955298209792,3453,14.4067,55.313,205134
1,CUTLASS,gemm,cutlass_tensorop_h1688gemm_256x64_32x2_nt_align2,passed,success,universal,8192,22016,8192,f16:column,f16:row,f16:column,f16:column,1,0,serial,1,1,heuristic,tensorop,f16,256,64,32,1,1,1,2,4,1,1,16,8,8,75,1024,855638016,2955298209792,3453,14.4828,55.022,204055
1,CUTLASS,gemm,cutlass_tensorop_h1688gemm_256x64_32x2_nt_align1,passed,success,universal,8192,22016,8192,f16:column,f16:row,f16:column,f16:column,1,0,serial,1,1,heuristic,tensorop,f16,256,64,32,1,1,1,2,4,1,1,16,8,8,75,1024,855638016,2955298209792,3453,17.2202,46.2756,171618
1,CUTLASS,gemm,cutlass_tensorop_h1688gemm_64x128_32x2_nt_align8,passed,success,universal,8192,22016,8192,f16:column,f16:row,f16:column,f16:column,1,0,serial,1,1,heuristic,tensorop,f16,64,128,32,1,1,1,2,2,2,1,16,8,8,75,1024,855638016,2955298209792,3453,14.8429,53.6874,199105
1,CUTLASS,gemm,cutlass_tensorop_h1688gemm_64x128_32x2_nt_align4,passed,success,universal,8192,22016,8192,f16:column,f16:row,f16:column,f16:column,1,0,serial,1,1,heuristic,tensorop,f16,64,128,32,1,1,1,2,2,2,1,16,8,8,75,1024,855638016,2955298209792,3453,14.9966,53.1371,197065
1,CUTLASS,gemm,cutlass_tensorop_h1688gemm_64x128_32x2_nt_align2,passed,success,universal,8192,22016,8192,f16:column,f16:row,f16:column,f16:column,1,0,serial,1,1,heuristic,tensorop,f16,64,128,32,1,1,1,2,2,2,1,16,8,8,75,1024,855638016,2955298209792,3453,15.7421,50.6208,187733
1,CUTLASS,gemm,cutlass_tensorop_h1688gemm_64x128_32x2_nt_align1,passed,success,universal,8192,22016,8192,f16:column,f16:row,f16:column,f16:column,1,0,serial,1,1,heuristic,tensorop,f16,64,128,32,1,1,1,2,2,2,1,16,8,8,75,1024,855638016,2955298209792,3453,19.1332,41.6487,154459
1,CUTLASS,gemm,cutlass_tensorop_h1688gemm_128x64_32x2_nt_align8,passed,success,universal,8192,22016,8192,f16:column,f16:row,f16:column,f16:column,1,0,serial,1,1,heuristic,tensorop,f16,128,64,32,1,1,1,2,2,2,1,16,8,8,75,1024,855638016,2955298209792,3453,15.0397,52.9848,196500
1,CUTLASS,gemm,cutlass_tensorop_h1688gemm_128x64_32x2_nt_align4,passed,success,universal,8192,22016,8192,f16:column,f16:row,f16:column,f16:column,1,0,serial,1,1,heuristic,tensorop,f16,128,64,32,1,1,1,2,2,2,1,16,8,8,75,1024,855638016,2955298209792,3453,15.3878,51.7863,192055
1,CUTLASS,gemm,cutlass_tensorop_h1688gemm_128x64_32x2_nt_align2,passed,success,universal,8192,22016,8192,f16:column,f16:row,f16:column,f16:column,1,0,serial,1,1,heuristic,tensorop,f16,128,64,32,1,1,1,2,2,2,1,16,8,8,75,1024,855638016,2955298209792,3453,15.8375,50.3157,186601
1,CUTLASS,gemm,cutlass_tensorop_h1688gemm_128x64_32x2_nt_align1,passed,success,universal,8192,22016,8192,f16:column,f16:row,f16:column,f16:column,1,0,serial,1,1,heuristic,tensorop,f16,128,64,32,1,1,1,2,2,2,1,16,8,8,75,1024,855638016,2955298209792,3453,19.2052,41.4926,153880
1,CUTLASS,gemm,cutlass_tensorop_h1688gemm_64x64_32x2_nt_align8,passed,success,universal,8192,22016,8192,f16:column,f16:row,f16:column,f16:column,1,0,serial,1,1,heuristic,tensorop,f16,64,64,32,1,1,1,2,2,2,1,16,8,8,75,1024,855638016,2955298209792,3453,18.6639,42.696,158343
1,CUTLASS,gemm,cutlass_tensorop_h1688gemm_64x64_32x2_nt_align4,passed,success,universal,8192,22016,8192,f16:column,f16:row,f16:column,f16:column,1,0,serial,1,1,heuristic,tensorop,f16,64,64,32,1,1,1,2,2,2,1,16,8,8,75,1024,855638016,2955298209792,3453,19.3725,41.1344,152551
1,CUTLASS,gemm,cutlass_tensorop_h1688gemm_64x64_32x2_nt_align2,passed,success,universal,8192,22016,8192,f16:column,f16:row,f16:column,f16:column,1,0,serial,1,1,heuristic,tensorop,f16,64,64,32,1,1,1,2,2,2,1,16,8,8,75,1024,855638016,2955298209792,3453,19.8206,40.2043,149102
1,CUTLASS,gemm,cutlass_tensorop_h1688gemm_64x64_32x2_nt_align1,passed,success,universal,8192,22016,8192,f16:column,f16:row,f16:column,f16:column,1,0,serial,1,1,heuristic,tensorop,f16,64,64,32,1,1,1,2,2,2,1,16,8,8,75,1024,855638016,2955298209792,3453,24.7396,32.2106,119456
1,CUTLASS,gemm,cutlass_tensorop_h1688gemm_64x128_64x2_nt_align8,passed,success,universal,8192,22016,8192,f16:column,f16:row,f16:column,f16:column,1,0,serial,1,1,heuristic,tensorop,f16,64,128,64,1,1,1,2,1,2,2,16,8,8,75,1024,855638016,2955298209792,3453,14.4966,54.9699,203862
1,CUTLASS,gemm,cutlass_tensorop_h1688gemm_64x128_64x2_nt_align4,passed,success,universal,8192,22016,8192,f16:column,f16:row,f16:column,f16:column,1,0,serial,1,1,heuristic,tensorop,f16,64,128,64,1,1,1,2,1,2,2,16,8,8,75,1024,855638016,2955298209792,3453,14.5815,54.6499,202675
1,CUTLASS,gemm,cutlass_tensorop_h1688gemm_64x128_64x2_nt_align2,passed,success,universal,8192,22016,8192,f16:column,f16:row,f16:column,f16:column,1,0,serial,1,1,heuristic,tensorop,f16,64,128,64,1,1,1,2,1,2,2,16,8,8,75,1024,855638016,2955298209792,3453,14.783,53.9048,199912
1,CUTLASS,gemm,cutlass_tensorop_h1688gemm_64x128_64x2_nt_align1,passed,success,universal,8192,22016,8192,f16:column,f16:row,f16:column,f16:column,1,0,serial,1,1,heuristic,tensorop,f16,64,128,64,1,1,1,2,1,2,2,16,8,8,75,1024,855638016,2955298209792,3453,20.2162,39.4176,146185
1,CUTLASS,gemm,cutlass_tensorop_h1688gemm_256x128_32x2_tn_align8,passed,success,universal,8192,22016,8192,f16:row,f16:column,f16:column,f16:column,1,0,serial,1,1,heuristic,tensorop,f16,256,128,32,1,1,1,2,4,2,1,16,8,8,75,1024,855638016,2955298209792,3453,12.5636,63.4275,235228
1,CUTLASS,gemm,cutlass_tensorop_h1688gemm_256x128_32x2_tn_align4,passed,success,universal,8192,22016,8192,f16:row,f16:column,f16:column,f16:column,1,0,serial,1,1,heuristic,tensorop,f16,256,128,32,1,1,1,2,4,2,1,16,8,8,75,1024,855638016,2955298209792,3453,13.8337,57.6038,213630
1,CUTLASS,gemm,cutlass_tensorop_h1688gemm_256x128_32x2_tn_align2,passed,success,universal,8192,22016,8192,f16:row,f16:column,f16:column,f16:column,1,0,serial,1,1,heuristic,tensorop,f16,256,128,32,1,1,1,2,4,2,1,16,8,8,75,1024,855638016,2955298209792,3453,15.9813,49.8631,184923
1,CUTLASS,gemm,cutlass_tensorop_h1688gemm_256x128_32x2_tn_align1,passed,success,universal,8192,22016,8192,f16:row,f16:column,f16:column,f16:column,1,0,serial,1,1,heuristic,tensorop,f16,256,128,32,1,1,1,2,4,2,1,16,8,8,75,1024,855638016,2955298209792,3453,19.8981,40.0479,148522
1,CUTLASS,gemm,cutlass_tensorop_h1688gemm_128x256_32x2_tn_align8,passed,success,universal,8192,22016,8192,f16:row,f16:column,f16:column,f16:column,1,0,serial,1,1,heuristic,tensorop,f16,128,256,32,1,1,1,2,2,4,1,16,8,8,75,1024,855638016,2955298209792,3453,12.8271,62.1242,230394
1,CUTLASS,gemm,cutlass_tensorop_h1688gemm_128x256_32x2_tn_align4,passed,success,universal,8192,22016,8192,f16:row,f16:column,f16:column,f16:column,1,0,serial,1,1,heuristic,tensorop,f16,128,256,32,1,1,1,2,2,4,1,16,8,8,75,1024,855638016,2955298209792,3453,12.7639,62.4322,231537
1,CUTLASS,gemm,cutlass_tensorop_h1688gemm_128x256_32x2_tn_align2,passed,success,universal,8192,22016,8192,f16:row,f16:column,f16:column,f16:column,1,0,serial,1,1,heuristic,tensorop,f16,128,256,32,1,1,1,2,2,4,1,16,8,8,75,1024,855638016,2955298209792,3453,14.2568,55.8943,207290
1,CUTLASS,gemm,cutlass_tensorop_h1688gemm_128x256_32x2_tn_align1,passed,success,universal,8192,22016,8192,f16:row,f16:column,f16:column,f16:column,1,0,serial,1,1,heuristic,tensorop,f16,128,256,32,1,1,1,2,2,4,1,16,8,8,75,1024,855638016,2955298209792,3453,20.0965,39.6524,147055
1,CUTLASS,gemm,cutlass_tensorop_h1688gemm_128x128_32x2_tn_align8,passed,success,universal,8192,22016,8192,f16:row,f16:column,f16:column,f16:column,1,0,serial,1,1,heuristic,tensorop,f16,128,128,32,1,1,1,2,2,2,1,16,8,8,75,1024,855638016,2955298209792,3453,11.605,68.6666,254657
1,CUTLASS,gemm,cutlass_tensorop_h1688gemm_128x128_32x2_tn_align4,passed,success,universal,8192,22016,8192,f16:row,f16:column,f16:column,f16:column,1,0,serial,1,1,heuristic,tensorop,f16,128,128,32,1,1,1,2,2,2,1,16,8,8,75,1024,855638016,2955298209792,3453,13.4485,59.2538,219749
1,CUTLASS,gemm,cutlass_tensorop_h1688gemm_128x128_32x2_tn_align2,passed,success,universal,8192,22016,8192,f16:row,f16:column,f16:column,f16:column,1,0,serial,1,1,heuristic,tensorop,f16,128,128,32,1,1,1,2,2,2,1,16,8,8,75,1024,855638016,2955298209792,3453,13.6839,58.2344,215969
1,CUTLASS,gemm,cutlass_tensorop_h1688gemm_128x128_32x2_tn_align1,passed,success,universal,8192,22016,8192,f16:row,f16:column,f16:column,f16:column,1,0,serial,1,1,heuristic,tensorop,f16,128,128,32,1,1,1,2,2,2,1,16,8,8,75,1024,855638016,2955298209792,3453,20.0661,39.7125,147278
1,CUTLASS,gemm,cutlass_tensorop_h1688gemm_64x256_32x2_tn_align8,passed,success,universal,8192,22016,8192,f16:row,f16:column,f16:column,f16:column,1,0,serial,1,1,heuristic,tensorop,f16,64,256,32,1,1,1,2,1,4,1,16,8,8,75,1024,855638016,2955298209792,3453,12.5078,63.7105,236277
1,CUTLASS,gemm,cutlass_tensorop_h1688gemm_64x256_32x2_tn_align4,passed,success,universal,8192,22016,8192,f16:row,f16:column,f16:column,f16:column,1,0,serial,1,1,heuristic,tensorop,f16,64,256,32,1,1,1,2,1,4,1,16,8,8,75,1024,855638016,2955298209792,3453,13.5627,58.755,217899
1,CUTLASS,gemm,cutlass_tensorop_h1688gemm_64x256_32x2_tn_align2,passed,success,universal,8192,22016,8192,f16:row,f16:column,f16:column,f16:column,1,0,serial,1,1,heuristic,tensorop,f16,64,256,32,1,1,1,2,1,4,1,16,8,8,75,1024,855638016,2955298209792,3453,15.7377,50.6349,187785
1,CUTLASS,gemm,cutlass_tensorop_h1688gemm_64x256_32x2_tn_align1,passed,success,universal,8192,22016,8192,f16:row,f16:column,f16:column,f16:column,1,0,serial,1,1,heuristic,tensorop,f16,64,256,32,1,1,1,2,1,4,1,16,8,8,75,1024,855638016,2955298209792,3453,24.8563,32.0593,118895
1,CUTLASS,gemm,cutlass_tensorop_h1688gemm_256x64_32x2_tn_align8,passed,success,universal,8192,22016,8192,f16:row,f16:column,f16:column,f16:column,1,0,serial,1,1,heuristic,tensorop,f16,256,64,32,1,1,1,2,4,1,1,16,8,8,75,1024,855638016,2955298209792,3453,13.8336,57.6042,213631
1,CUTLASS,gemm,cutlass_tensorop_h1688gemm_256x64_32x2_tn_align4,passed,success,universal,8192,22016,8192,f16:row,f16:column,f16:column,f16:column,1,0,serial,1,1,heuristic,tensorop,f16,256,64,32,1,1,1,2,4,1,1,16,8,8,75,1024,855638016,2955298209792,3453,15.6077,51.0565,189349
1,CUTLASS,gemm,cutlass_tensorop_h1688gemm_256x64_32x2_tn_align2,passed,success,universal,8192,22016,8192,f16:row,f16:column,f16:column,f16:column,1,0,serial,1,1,heuristic,tensorop,f16,256,64,32,1,1,1,2,4,1,1,16,8,8,75,1024,855638016,2955298209792,3453,15.9606,49.9277,185162
1,CUTLASS,gemm,cutlass_tensorop_h1688gemm_256x64_32x2_tn_align1,passed,success,universal,8192,22016,8192,f16:row,f16:column,f16:column,f16:column,1,0,serial,1,1,heuristic,tensorop,f16,256,64,32,1,1,1,2,4,1,1,16,8,8,75,1024,855638016,2955298209792,3453,24.1782,32.9584,122230
1,CUTLASS,gemm,cutlass_tensorop_h1688gemm_64x128_32x2_tn_align8,passed,success,universal,8192,22016,8192,f16:row,f16:column,f16:column,f16:column,1,0,serial,1,1,heuristic,tensorop,f16,64,128,32,1,1,1,2,2,2,1,16,8,8,75,1024,855638016,2955298209792,3453,15.2892,52.12,193293
1,CUTLASS,gemm,cutlass_tensorop_h1688gemm_64x128_32x2_tn_align4,passed,success,universal,8192,22016,8192,f16:row,f16:column,f16:column,f16:column,1,0,serial,1,1,heuristic,tensorop,f16,64,128,32,1,1,1,2,2,2,1,16,8,8,75,1024,855638016,2955298209792,3453,19.1775,41.5525,154102
1,CUTLASS,gemm,cutlass_tensorop_h1688gemm_64x128_32x2_tn_align2,passed,success,universal,8192,22016,8192,f16:row,f16:column,f16:column,f16:column,1,0,serial,1,1,heuristic,tensorop,f16,64,128,32,1,1,1,2,2,2,1,16,8,8,75,1024,855638016,2955298209792,3453,18.646,42.737,158495
1,CUTLASS,gemm,cutlass_tensorop_h1688gemm_64x128_32x2_tn_align1,passed,success,universal,8192,22016,8192,f16:row,f16:column,f16:column,f16:column,1,0,serial,1,1,heuristic,tensorop,f16,64,128,32,1,1,1,2,2,2,1,16,8,8,75,1024,855638016,2955298209792,3453,29.4121,27.0934,100479
1,CUTLASS,gemm,cutlass_tensorop_h1688gemm_128x64_32x2_tn_align8,passed,success,universal,8192,22016,8192,f16:row,f16:column,f16:column,f16:column,1,0,serial,1,1,heuristic,tensorop,f16,128,64,32,1,1,1,2,2,2,1,16,8,8,75,1024,855638016,2955298209792,3453,16.024,49.7302,184430
1,CUTLASS,gemm,cutlass_tensorop_h1688gemm_128x64_32x2_tn_align4,passed,success,universal,8192,22016,8192,f16:row,f16:column,f16:column,f16:column,1,0,serial,1,1,heuristic,tensorop,f16,128,64,32,1,1,1,2,2,2,1,16,8,8,75,1024,855638016,2955298209792,3453,17.2257,46.2607,171563
1,CUTLASS,gemm,cutlass_tensorop_h1688gemm_128x64_32x2_tn_align2,passed,success,universal,8192,22016,8192,f16:row,f16:column,f16:column,f16:column,1,0,serial,1,1,heuristic,tensorop,f16,128,64,32,1,1,1,2,2,2,1,16,8,8,75,1024,855638016,2955298209792,3453,19.0326,41.869,155276
1,CUTLASS,gemm,cutlass_tensorop_h1688gemm_128x64_32x2_tn_align1,passed,success,universal,8192,22016,8192,f16:row,f16:column,f16:column,f16:column,1,0,serial,1,1,heuristic,tensorop,f16,128,64,32,1,1,1,2,2,2,1,16,8,8,75,1024,855638016,2955298209792,3453,29.3985,27.106,100525
1,CUTLASS,gemm,cutlass_tensorop_h1688gemm_64x64_32x2_tn_align8,passed,success,universal,8192,22016,8192,f16:row,f16:column,f16:column,f16:column,1,0,serial,1,1,heuristic,tensorop,f16,64,64,32,1,1,1,2,2,2,1,16,8,8,75,1024,855638016,2955298209792,3453,19.606,40.6444,150734
1,CUTLASS,gemm,cutlass_tensorop_h1688gemm_64x64_32x2_tn_align4,passed,success,universal,8192,22016,8192,f16:row,f16:column,f16:column,f16:column,1,0,serial,1,1,heuristic,tensorop,f16,64,64,32,1,1,1,2,2,2,1,16,8,8,75,1024,855638016,2955298209792,3453,21.8585,36.456,135201
1,CUTLASS,gemm,cutlass_tensorop_h1688gemm_64x64_32x2_tn_align2,passed,success,universal,8192,22016,8192,f16:row,f16:column,f16:column,f16:column,1,0,serial,1,1,heuristic,tensorop,f16,64,64,32,1,1,1,2,2,2,1,16,8,8,75,1024,855638016,2955298209792,3453,24.5532,32.4551,120363
1,CUTLASS,gemm,cutlass_tensorop_h1688gemm_64x64_32x2_tn_align1,passed,success,universal,8192,22016,8192,f16:row,f16:column,f16:column,f16:column,1,0,serial,1,1,heuristic,tensorop,f16,64,64,32,1,1,1,2,2,2,1,16,8,8,75,1024,855638016,2955298209792,3453,39.332,20.2602,75137.2
1,CUTLASS,gemm,cutlass_tensorop_h1688gemm_64x128_64x2_tn_align8,passed,success,universal,8192,22016,8192,f16:row,f16:column,f16:column,f16:column,1,0,serial,1,1,heuristic,tensorop,f16,64,128,64,1,1,1,2,1,2,2,16,8,8,75,1024,855638016,2955298209792,3453,14.123,56.4239,209254
1,CUTLASS,gemm,cutlass_tensorop_h1688gemm_64x128_64x2_tn_align4,passed,success,universal,8192,22016,8192,f16:row,f16:column,f16:column,f16:column,1,0,serial,1,1,heuristic,tensorop,f16,64,128,64,1,1,1,2,1,2,2,16,8,8,75,1024,855638016,2955298209792,3453,14.3427,55.5598,206049
1,CUTLASS,gemm,cutlass_tensorop_h1688gemm_64x128_64x2_tn_align2,passed,success,universal,8192,22016,8192,f16:row,f16:column,f16:column,f16:column,1,0,serial,1,1,heuristic,tensorop,f16,64,128,64,1,1,1,2,1,2,2,16,8,8,75,1024,855638016,2955298209792,3453,14.4543,55.1308,204458
1,CUTLASS,gemm,cutlass_tensorop_h1688gemm_64x128_64x2_tn_align1,passed,success,universal,8192,22016,8192,f16:row,f16:column,f16:column,f16:column,1,0,serial,1,1,heuristic,tensorop,f16,64,128,64,1,1,1,2,1,2,2,16,8,8,75,1024,855638016,2955298209792,3453,17.7956,44.7794,166069
1,CUTLASS,gemm,cutlass_tensorop_h1688gemm_256x128_32x2_tt_align8,passed,success,universal,8192,22016,8192,f16:row,f16:row,f16:column,f16:column,1,0,serial,1,1,heuristic,tensorop,f16,256,128,32,1,1,1,2,4,2,1,16,8,8,75,1024,855638016,2955298209792,3453,12.8742,61.8969,229551
1,CUTLASS,gemm,cutlass_tensorop_h1688gemm_256x128_32x2_tt_align4,passed,success,universal,8192,22016,8192,f16:row,f16:row,f16:column,f16:column,1,0,serial,1,1,heuristic,tensorop,f16,256,128,32,1,1,1,2,4,2,1,16,8,8,75,1024,855638016,2955298209792,3453,14.3879,55.385,205401
1,CUTLASS,gemm,cutlass_tensorop_h1688gemm_256x128_32x2_tt_align2,passed,success,universal,8192,22016,8192,f16:row,f16:row,f16:column,f16:column,1,0,serial,1,1,heuristic,tensorop,f16,256,128,32,1,1,1,2,4,2,1,16,8,8,75,1024,855638016,2955298209792,3453,13.5809,58.6761,217607
1,CUTLASS,gemm,cutlass_tensorop_h1688gemm_256x128_32x2_tt_align1,passed,success,universal,8192,22016,8192,f16:row,f16:row,f16:column,f16:column,1,0,serial,1,1,heuristic,tensorop,f16,256,128,32,1,1,1,2,4,2,1,16,8,8,75,1024,855638016,2955298209792,3453,14.9096,53.4469,198214
1,CUTLASS,gemm,cutlass_tensorop_h1688gemm_128x256_32x2_tt_align8,passed,success,universal,8192,22016,8192,f16:row,f16:row,f16:column,f16:column,1,0,serial,1,1,heuristic,tensorop,f16,128,256,32,1,1,1,2,2,4,1,16,8,8,75,1024,855638016,2955298209792,3453,12.0262,66.2618,245739
1,CUTLASS,gemm,cutlass_tensorop_h1688gemm_128x256_32x2_tt_align4,passed,success,universal,8192,22016,8192,f16:row,f16:row,f16:column,f16:column,1,0,serial,1,1,heuristic,tensorop,f16,128,256,32,1,1,1,2,2,4,1,16,8,8,75,1024,855638016,2955298209792,3453,13.7549,57.934,214855
1,CUTLASS,gemm,cutlass_tensorop_h1688gemm_128x256_32x2_tt_align2,passed,success,universal,8192,22016,8192,f16:row,f16:row,f16:column,f16:column,1,0,serial,1,1,heuristic,tensorop,f16,128,256,32,1,1,1,2,2,4,1,16,8,8,75,1024,855638016,2955298209792,3453,14.044,56.7411,210431
1,CUTLASS,gemm,cutlass_tensorop_h1688gemm_128x256_32x2_tt_align1,passed,success,universal,8192,22016,8192,f16:row,f16:row,f16:column,f16:column,1,0,serial,1,1,heuristic,tensorop,f16,128,256,32,1,1,1,2,2,4,1,16,8,8,75,1024,855638016,2955298209792,3453,17.5417,45.4274,168472
1,CUTLASS,gemm,cutlass_tensorop_h1688gemm_128x128_32x2_tt_align8,passed,success,universal,8192,22016,8192,f16:row,f16:row,f16:column,f16:column,1,0,serial,1,1,heuristic,tensorop,f16,128,128,32,1,1,1,2,2,2,1,16,8,8,75,1024,855638016,2955298209792,3453,11.174,71.3152,264480
1,CUTLASS,gemm,cutlass_tensorop_h1688gemm_128x128_32x2_tt_align4,passed,success,universal,8192,22016,8192,f16:row,f16:row,f16:column,f16:column,1,0,serial,1,1,heuristic,tensorop,f16,128,128,32,1,1,1,2,2,2,1,16,8,8,75,1024,855638016,2955298209792,3453,12.158,65.5435,243075
1,CUTLASS,gemm,cutlass_tensorop_h1688gemm_128x128_32x2_tt_align2,passed,success,universal,8192,22016,8192,f16:row,f16:row,f16:column,f16:column,1,0,serial,1,1,heuristic,tensorop,f16,128,128,32,1,1,1,2,2,2,1,16,8,8,75,1024,855638016,2955298209792,3453,12.9762,61.4104,227747
1,CUTLASS,gemm,cutlass_tensorop_h1688gemm_128x128_32x2_tt_align1,passed,success,universal,8192,22016,8192,f16:row,f16:row,f16:column,f16:column,1,0,serial,1,1,heuristic,tensorop,f16,128,128,32,1,1,1,2,2,2,1,16,8,8,75,1024,855638016,2955298209792,3453,16.5994,48.0064,178037
1,CUTLASS,gemm,cutlass_tensorop_h1688gemm_64x256_32x2_tt_align8,passed,success,universal,8192,22016,8192,f16:row,f16:row,f16:column,f16:column,1,0,serial,1,1,heuristic,tensorop,f16,64,256,32,1,1,1,2,1,4,1,16,8,8,75,1024,855638016,2955298209792,3453,13.021,61.1993,226964
1,CUTLASS,gemm,cutlass_tensorop_h1688gemm_64x256_32x2_tt_align4,passed,success,universal,8192,22016,8192,f16:row,f16:row,f16:column,f16:column,1,0,serial,1,1,heuristic,tensorop,f16,64,256,32,1,1,1,2,1,4,1,16,8,8,75,1024,855638016,2955298209792,3453,13.9306,57.2032,212144
1,CUTLASS,gemm,cutlass_tensorop_h1688gemm_64x256_32x2_tt_align2,passed,success,universal,8192,22016,8192,f16:row,f16:row,f16:column,f16:column,1,0,serial,1,1,heuristic,tensorop,f16,64,256,32,1,1,1,2,1,4,1,16,8,8,75,1024,855638016,2955298209792,3453,15.3127,52.0402,192997
1,CUTLASS,gemm,cutlass_tensorop_h1688gemm_64x256_32x2_tt_align1,passed,success,universal,8192,22016,8192,f16:row,f16:row,f16:column,f16:column,1,0,serial,1,1,heuristic,tensorop,f16,64,256,32,1,1,1,2,1,4,1,16,8,8,75,1024,855638016,2955298209792,3453,23.2626,34.2556,127041
1,CUTLASS,gemm,cutlass_tensorop_h1688gemm_256x64_32x2_tt_align8,passed,success,universal,8192,22016,8192,f16:row,f16:row,f16:column,f16:column,1,0,serial,1,1,heuristic,tensorop,f16,256,64,32,1,1,1,2,4,1,1,16,8,8,75,1024,855638016,2955298209792,3453,13.2138,60.3063,223652
1,CUTLASS,gemm,cutlass_tensorop_h1688gemm_256x64_32x2_tt_align4,passed,success,universal,8192,22016,8192,f16:row,f16:row,f16:column,f16:column,1,0,serial,1,1,heuristic,tensorop,f16,256,64,32,1,1,1,2,4,1,1,16,8,8,75,1024,855638016,2955298209792,3453,14.2481,55.9283,207416
1,CUTLASS,gemm,cutlass_tensorop_h1688gemm_256x64_32x2_tt_align2,passed,success,universal,8192,22016,8192,f16:row,f16:row,f16:column,f16:column,1,0,serial,1,1,heuristic,tensorop,f16,256,64,32,1,1,1,2,4,1,1,16,8,8,75,1024,855638016,2955298209792,3453,15.102,52.7663,195690
1,CUTLASS,gemm,cutlass_tensorop_h1688gemm_256x64_32x2_tt_align1,passed,success,universal,8192,22016,8192,f16:row,f16:row,f16:column,f16:column,1,0,serial,1,1,heuristic,tensorop,f16,256,64,32,1,1,1,2,4,1,1,16,8,8,75,1024,855638016,2955298209792,3453,18.2984,43.549,161506
1,CUTLASS,gemm,cutlass_tensorop_h1688gemm_64x128_32x2_tt_align8,passed,success,universal,8192,22016,8192,f16:row,f16:row,f16:column,f16:column,1,0,serial,1,1,heuristic,tensorop,f16,64,128,32,1,1,1,2,2,2,1,16,8,8,75,1024,855638016,2955298209792,3453,14.9857,53.1756,197208
1,CUTLASS,gemm,cutlass_tensorop_h1688gemm_64x128_32x2_tt_align4,passed,success,universal,8192,22016,8192,f16:row,f16:row,f16:column,f16:column,1,0,serial,1,1,heuristic,tensorop,f16,64,128,32,1,1,1,2,2,2,1,16,8,8,75,1024,855638016,2955298209792,3453,18.794,42.4005,157247
1,CUTLASS,gemm,cutlass_tensorop_h1688gemm_64x128_32x2_tt_align2,passed,success,universal,8192,22016,8192,f16:row,f16:row,f16:column,f16:column,1,0,serial,1,1,heuristic,tensorop,f16,64,128,32,1,1,1,2,2,2,1,16,8,8,75,1024,855638016,2955298209792,3453,17.3302,45.9819,170529
1,CUTLASS,gemm,cutlass_tensorop_h1688gemm_64x128_32x2_tt_align1,passed,success,universal,8192,22016,8192,f16:row,f16:row,f16:column,f16:column,1,0,serial,1,1,heuristic,tensorop,f16,64,128,32,1,1,1,2,2,2,1,16,8,8,75,1024,855638016,2955298209792,3453,25.6206,31.1029,115349
1,CUTLASS,gemm,cutlass_tensorop_h1688gemm_128x64_32x2_tt_align8,passed,success,universal,8192,22016,8192,f16:row,f16:row,f16:column,f16:column,1,0,serial,1,1,heuristic,tensorop,f16,128,64,32,1,1,1,2,2,2,1,16,8,8,75,1024,855638016,2955298209792,3453,15.4371,51.6207,191441
1,CUTLASS,gemm,cutlass_tensorop_h1688gemm_128x64_32x2_tt_align4,passed,success,universal,8192,22016,8192,f16:row,f16:row,f16:column,f16:column,1,0,serial,1,1,heuristic,tensorop,f16,128,64,32,1,1,1,2,2,2,1,16,8,8,75,1024,855638016,2955298209792,3453,15.9774,49.8752,184968
1,CUTLASS,gemm,cutlass_tensorop_h1688gemm_128x64_32x2_tt_align2,passed,success,universal,8192,22016,8192,f16:row,f16:row,f16:column,f16:column,1,0,serial,1,1,heuristic,tensorop,f16,128,64,32,1,1,1,2,2,2,1,16,8,8,75,1024,855638016,2955298209792,3453,16.3976,48.597,180227
1,CUTLASS,gemm,cutlass_tensorop_h1688gemm_128x64_32x2_tt_align1,passed,success,universal,8192,22016,8192,f16:row,f16:row,f16:column,f16:column,1,0,serial,1,1,heuristic,tensorop,f16,128,64,32,1,1,1,2,2,2,1,16,8,8,75,1024,855638016,2955298209792,3453,23.0075,34.6354,128449
1,CUTLASS,gemm,cutlass_tensorop_h1688gemm_64x64_32x2_tt_align8,passed,success,universal,8192,22016,8192,f16:row,f16:row,f16:column,f16:column,1,0,serial,1,1,heuristic,tensorop,f16,64,64,32,1,1,1,2,2,2,1,16,8,8,75,1024,855638016,2955298209792,3453,19.1331,41.649,154460
1,CUTLASS,gemm,cutlass_tensorop_h1688gemm_64x64_32x2_tt_align4,passed,success,universal,8192,22016,8192,f16:row,f16:row,f16:column,f16:column,1,0,serial,1,1,heuristic,tensorop,f16,64,64,32,1,1,1,2,2,2,1,16,8,8,75,1024,855638016,2955298209792,3453,19.6253,40.6044,150586
1,CUTLASS,gemm,cutlass_tensorop_h1688gemm_64x64_32x2_tt_align2,passed,success,universal,8192,22016,8192,f16:row,f16:row,f16:column,f16:column,1,0,serial,1,1,heuristic,tensorop,f16,64,64,32,1,1,1,2,2,2,1,16,8,8,75,1024,855638016,2955298209792,3453,21.8752,36.4282,135098
1,CUTLASS,gemm,cutlass_tensorop_h1688gemm_64x64_32x2_tt_align1,passed,success,universal,8192,22016,8192,f16:row,f16:row,f16:column,f16:column,1,0,serial,1,1,heuristic,tensorop,f16,64,64,32,1,1,1,2,2,2,1,16,8,8,75,1024,855638016,2955298209792,3453,31.5709,25.2408,93608.2
1,CUTLASS,gemm,cutlass_tensorop_h1688gemm_64x128_64x2_tt_align8,passed,success,universal,8192,22016,8192,f16:row,f16:row,f16:column,f16:column,1,0,serial,1,1,heuristic,tensorop,f16,64,128,64,1,1,1,2,1,2,2,16,8,8,75,1024,855638016,2955298209792,3453,14.2374,55.9706,207573
1,CUTLASS,gemm,cutlass_tensorop_h1688gemm_64x128_64x2_tt_align4,passed,success,universal,8192,22016,8192,f16:row,f16:row,f16:column,f16:column,1,0,serial,1,1,heuristic,tensorop,f16,64,128,64,1,1,1,2,1,2,2,16,8,8,75,1024,855638016,2955298209792,3453,14.5982,54.5873,202443
1,CUTLASS,gemm,cutlass_tensorop_h1688gemm_64x128_64x2_tt_align2,passed,success,universal,8192,22016,8192,f16:row,f16:row,f16:column,f16:column,1,0,serial,1,1,heuristic,tensorop,f16,64,128,64,1,1,1,2,1,2,2,16,8,8,75,1024,855638016,2955298209792,3453,15.1314,52.6636,195309
1,CUTLASS,gemm,cutlass_tensorop_h1688gemm_64x128_64x2_tt_align1,passed,success,universal,8192,22016,8192,f16:row,f16:row,f16:column,f16:column,1,0,serial,1,1,heuristic,tensorop,f16,64,128,64,1,1,1,2,1,2,2,16,8,8,75,1024,855638016,2955298209792,3453,17.7664,44.8529,166342
1,CUTLASS,gemm,cutlass_tensorop_h16816gemm_256x128_32x3_nn_align8,passed,success,universal,8192,22016,8192,f16:column,f16:column,f16:column,f16:column,1,0,serial,1,1,heuristic,tensorop,f16,256,128,32,1,1,1,3,4,2,1,16,8,16,80,1024,855638016,2955298209792,3453,9.54993,83.443,309458
1,CUTLASS,gemm,cutlass_tensorop_h16816gemm_256x128_32x3_nn_align4,passed,success,universal,8192,22016,8192,f16:column,f16:column,f16:column,f16:column,1,0,serial,1,1,heuristic,tensorop,f16,256,128,32,1,1,1,3,4,2,1,16,8,16,80,1024,855638016,2955298209792,3453,9.68967,82.2396,304995
1,CUTLASS,gemm,cutlass_tensorop_h16816gemm_256x128_32x3_nn_align2,passed,success,universal,8192,22016,8192,f16:column,f16:column,f16:column,f16:column,1,0,serial,1,1,heuristic,tensorop,f16,256,128,32,1,1,1,3,4,2,1,16,8,16,80,1024,855638016,2955298209792,3453,10.3843,76.7386,284593
1,CUTLASS,gemm,cutlass_tensorop_h16816gemm_128x256_32x3_nn_align8,passed,success,universal,8192,22016,8192,f16:column,f16:column,f16:column,f16:column,1,0,serial,1,1,heuristic,tensorop,f16,128,256,32,1,1,1,3,2,4,1,16,8,16,80,1024,855638016,2955298209792,3453,9.19521,86.6619,321395
1,CUTLASS,gemm,cutlass_tensorop_h16816gemm_128x256_32x3_nn_align4,passed,success,universal,8192,22016,8192,f16:column,f16:column,f16:column,f16:column,1,0,serial,1,1,heuristic,tensorop,f16,128,256,32,1,1,1,3,2,4,1,16,8,16,80,1024,855638016,2955298209792,3453,8.73933,91.1826,338161
1,CUTLASS,gemm,cutlass_tensorop_h16816gemm_128x256_32x3_nn_align2,passed,success,universal,8192,22016,8192,f16:column,f16:column,f16:column,f16:column,1,0,serial,1,1,heuristic,tensorop,f16,128,256,32,1,1,1,3,2,4,1,16,8,16,80,1024,855638016,2955298209792,3453,9.85935,80.8243,299746
1,CUTLASS,gemm,cutlass_tensorop_h16816gemm_256x64_32x3_nn_align8,passed,success,universal,8192,22016,8192,f16:column,f16:column,f16:column,f16:column,1,0,serial,1,1,heuristic,tensorop,f16,256,64,32,1,1,1,3,4,1,1,16,8,16,80,1024,855638016,2955298209792,3453,12.3112,64.7274,240049
1,CUTLASS,gemm,cutlass_tensorop_h16816gemm_256x64_32x3_nn_align4,passed,success,universal,8192,22016,8192,f16:column,f16:column,f16:column,f16:column,1,0,serial,1,1,heuristic,tensorop,f16,256,64,32,1,1,1,3,4,1,1,16,8,16,80,1024,855638016,2955298209792,3453,12.8,62.2559,230883
1,CUTLASS,gemm,cutlass_tensorop_h16816gemm_256x64_32x3_nn_align2,passed,success,universal,8192,22016,8192,f16:column,f16:column,f16:column,f16:column,1,0,serial,1,1,heuristic,tensorop,f16,256,64,32,1,1,1,3,4,1,1,16,8,16,80,1024,855638016,2955298209792,3453,24.8962,32.0079,118705
1,CUTLASS,gemm,cutlass_tensorop_h16816gemm_256x64_32x4_nn_align8,passed,success,universal,8192,22016,8192,f16:column,f16:column,f16:column,f16:column,1,0,serial,1,1,heuristic,tensorop,f16,256,64,32,1,1,1,4,4,1,1,16,8,16,80,1024,855638016,2955298209792,3453,12.2558,65.02,241134
1,CUTLASS,gemm,cutlass_tensorop_h16816gemm_256x64_32x4_nn_align4,passed,success,universal,8192,22016,8192,f16:column,f16:column,f16:column,f16:column,1,0,serial,1,1,heuristic,tensorop,f16,256,64,32,1,1,1,4,4,1,1,16,8,16,80,1024,855638016,2955298209792,3453,13.2546,60.1208,222965
1,CUTLASS,gemm,cutlass_tensorop_h16816gemm_256x64_32x4_nn_align2,passed,success,universal,8192,22016,8192,f16:column,f16:column,f16:column,f16:column,1,0,serial,1,1,heuristic,tensorop,f16,256,64,32,1,1,1,4,4,1,1,16,8,16,80,1024,855638016,2955298209792,3453,29.9789,26.5812,98579.2
1,CUTLASS,gemm,cutlass_tensorop_h16816gemm_64x256_32x4_nn_align8,passed,success,universal,8192,22016,8192,f16:column,f16:column,f16:column,f16:column,1,0,serial,1,1,heuristic,tensorop,f16,64,256,32,1,1,1,4,1,4,1,16,8,16,80,1024,855638016,2955298209792,3453,11.6053,68.6648,254651
1,CUTLASS,gemm,cutlass_tensorop_h16816gemm_64x256_32x4_nn_align4,passed,success,universal,8192,22016,8192,f16:column,f16:column,f16:column,f16:column,1,0,serial,1,1,heuristic,tensorop,f16,64,256,32,1,1,1,4,1,4,1,16,8,16,80,1024,855638016,2955298209792,3453,11.7791,67.6518,250894
1,CUTLASS,gemm,cutlass_tensorop_h16816gemm_64x256_32x4_nn_align2,passed,success,universal,8192,22016,8192,f16:column,f16:column,f16:column,f16:column,1,0,serial,1,1,heuristic,tensorop,f16,64,256,32,1,1,1,4,1,4,1,16,8,16,80,1024,855638016,2955298209792,3453,12.5523,63.4843,235438
1,CUTLASS,gemm,cutlass_tensorop_h16816gemm_128x128_32x3_nn_align8,passed,success,universal,8192,22016,8192,f16:column,f16:column,f16:column,f16:column,1,0,serial,1,1,heuristic,tensorop,f16,128,128,32,1,1,1,3,2,2,1,16,8,16,80,1024,855638016,2955298209792,3453,9.91898,80.3384,297944
1,CUTLASS,gemm,cutlass_tensorop_h16816gemm_128x128_32x3_nn_align4,passed,success,universal,8192,22016,8192,f16:column,f16:column,f16:column,f16:column,1,0,serial,1,1,heuristic,tensorop,f16,128,128,32,1,1,1,3,2,2,1,16,8,16,80,1024,855638016,2955298209792,3453,10.4328,76.3816,283269
1,CUTLASS,gemm,cutlass_tensorop_h16816gemm_128x128_32x3_nn_align2,passed,success,universal,8192,22016,8192,f16:column,f16:column,f16:column,f16:column,1,0,serial,1,1,heuristic,tensorop,f16,128,128,32,1,1,1,3,2,2,1,16,8,16,80,1024,855638016,2955298209792,3453,11.476,69.4385,257520
1,CUTLASS,gemm,cutlass_tensorop_h16816gemm_128x128_32x4_nn_align8,passed,success,universal,8192,22016,8192,f16:column,f16:column,f16:column,f16:column,1,0,serial,1,1,heuristic,tensorop,f16,128,128,32,1,1,1,4,2,2,1,16,8,16,80,1024,855638016,2955298209792,3453,10.1333,78.6395,291643
1,CUTLASS,gemm,cutlass_tensorop_h16816gemm_128x128_32x4_nn_align4,passed,success,universal,8192,22016,8192,f16:column,f16:column,f16:column,f16:column,1,0,serial,1,1,heuristic,tensorop,f16,128,128,32,1,1,1,4,2,2,1,16,8,16,80,1024,855638016,2955298209792,3453,10.3954,76.6562,284288
1,CUTLASS,gemm,cutlass_tensorop_h16816gemm_128x128_32x4_nn_align2,passed,success,universal,8192,22016,8192,f16:column,f16:column,f16:column,f16:column,1,0,serial,1,1,heuristic,tensorop,f16,128,128,32,1,1,1,4,2,2,1,16,8,16,80,1024,855638016,2955298209792,3453,11.7051,68.0791,252479
1,CUTLASS,gemm,cutlass_tensorop_h16816gemm_128x128_32x5_nn_align8,passed,success,universal,8192,22016,8192,f16:column,f16:column,f16:column,f16:column,1,0,serial,1,1,heuristic,tensorop,f16,128,128,32,1,1,1,5,2,2,1,16,8,16,80,1024,855638016,2955298209792,3453,10.0264,79.4777,294752
1,CUTLASS,gemm,cutlass_tensorop_h16816gemm_128x128_32x5_nn_align4,passed,success,universal,8192,22016,8192,f16:column,f16:column,f16:column,f16:column,1,0,serial,1,1,heuristic,tensorop,f16,128,128,32,1,1,1,5,2,2,1,16,8,16,80,1024,855638016,2955298209792,3453,10.6709,74.6774,276949
1,CUTLASS,gemm,cutlass_tensorop_h16816gemm_128x128_32x5_nn_align2,passed,success,universal,8192,22016,8192,f16:column,f16:column,f16:column,f16:column,1,0,serial,1,1,heuristic,tensorop,f16,128,128,32,1,1,1,5,2,2,1,16,8,16,80,1024,855638016,2955298209792,3453,11.7137,68.0291,252293
1,CUTLASS,gemm,cutlass_tensorop_h16816gemm_128x64_32x6_nn_align8,passed,success,universal,8192,22016,8192,f16:column,f16:column,f16:column,f16:column,1,0,serial,1,1,heuristic,tensorop,f16,128,64,32,1,1,1,6,2,2,1,16,8,16,80,1024,855638016,2955298209792,3453,14.3342,55.5927,206172
1,CUTLASS,gemm,cutlass_tensorop_h16816gemm_128x64_32x6_nn_align4,passed,success,universal,8192,22016,8192,f16:column,f16:column,f16:column,f16:column,1,0,serial,1,1,heuristic,tensorop,f16,128,64,32,1,1,1,6,2,2,1,16,8,16,80,1024,855638016,2955298209792,3453,15.0405,52.982,196490
1,CUTLASS,gemm,cutlass_tensorop_h16816gemm_128x64_32x6_nn_align2,passed,success,universal,8192,22016,8192,f16:column,f16:column,f16:column,f16:column,1,0,serial,1,1,heuristic,tensorop,f16,128,64,32,1,1,1,6,2,2,1,16,8,16,80,1024,855638016,2955298209792,3453,16.8156,47.3889,175747
1,CUTLASS,gemm,cutlass_tensorop_h16816gemm_64x128_32x6_nn_align8,passed,success,universal,8192,22016,8192,f16:column,f16:column,f16:column,f16:column,1,0,serial,1,1,heuristic,tensorop,f16,64,128,32,1,1,1,6,2,2,1,16,8,16,80,1024,855638016,2955298209792,3453,13.9772,57.0124,211437
1,CUTLASS,gemm,cutlass_tensorop_h16816gemm_64x128_32x6_nn_align4,passed,success,universal,8192,22016,8192,f16:column,f16:column,f16:column,f16:column,1,0,serial,1,1,heuristic,tensorop,f16,64,128,32,1,1,1,6,2,2,1,16,8,16,80,1024,855638016,2955298209792,3453,14.4217,55.2552,204920
1,CUTLASS,gemm,cutlass_tensorop_h16816gemm_64x128_32x6_nn_align2,passed,success,universal,8192,22016,8192,f16:column,f16:column,f16:column,f16:column,1,0,serial,1,1,heuristic,tensorop,f16,64,128,32,1,1,1,6,2,2,1,16,8,16,80,1024,855638016,2955298209792,3453,15.5846,51.1323,189630
1,CUTLASS,gemm,cutlass_tensorop_h16816gemm_64x64_32x10_nn_align8,passed,success,universal,8192,22016,8192,f16:column,f16:column,f16:column,f16:column,1,0,serial,1,1,heuristic,tensorop,f16,64,64,32,1,1,1,10,2,2,1,16,8,16,80,1024,855638016,2955298209792,3453,18.3691,43.3812,160884
1,CUTLASS,gemm,cutlass_tensorop_h16816gemm_64x64_32x10_nn_align4,passed,success,universal,8192,22016,8192,f16:column,f16:column,f16:column,f16:column,1,0,serial,1,1,heuristic,tensorop,f16,64,64,32,1,1,1,10,2,2,1,16,8,16,80,1024,855638016,2955298209792,3453,18.9729,42.0007,155764
1,CUTLASS,gemm,cutlass_tensorop_h16816gemm_64x64_32x10_nn_align2,passed,success,universal,8192,22016,8192,f16:column,f16:column,f16:column,f16:column,1,0,serial,1,1,heuristic,tensorop,f16,64,64,32,1,1,1,10,2,2,1,16,8,16,80,1024,855638016,2955298209792,3453,21.3916,37.2518,138153
1,CUTLASS,gemm,cutlass_tensorop_h16816gemm_128x128_64x3_nn_align8,passed,success,universal,8192,22016,8192,f16:column,f16:column,f16:column,f16:column,1,0,serial,1,1,heuristic,tensorop,f16,128,128,64,1,1,1,3,2,2,1,16,8,16,80,1024,855638016,2955298209792,3453,9.78614,81.4289,301988
1,CUTLASS,gemm,cutlass_tensorop_h16816gemm_128x128_64x3_nn_align4,passed,success,universal,8192,22016,8192,f16:column,f16:column,f16:column,f16:column,1,0,serial,1,1,heuristic,tensorop,f16,128,128,64,1,1,1,3,2,2,1,16,8,16,80,1024,855638016,2955298209792,3453,10.3335,77.116,285993
1,CUTLASS,gemm,cutlass_tensorop_h16816gemm_128x128_64x3_nn_align2,passed,success,universal,8192,22016,8192,f16:column,f16:column,f16:column,f16:column,1,0,serial,1,1,heuristic,tensorop,f16,128,128,64,1,1,1,3,2,2,1,16,8,16,80,1024,855638016,2955298209792,3453,11.7069,68.0689,252441
1,CUTLASS,gemm,cutlass_tensorop_h16816gemm_128x64_64x3_nn_align8,passed,success,universal,8192,22016,8192,f16:column,f16:column,f16:column,f16:column,1,0,serial,1,1,heuristic,tensorop,f16,128,64,64,1,1,1,3,2,2,1,16,8,16,80,1024,855638016,2955298209792,3453,13.9213,57.2414,212286
1,CUTLASS,gemm,cutlass_tensorop_h16816gemm_128x64_64x3_nn_align4,passed,success,universal,8192,22016,8192,f16:column,f16:column,f16:column,f16:column,1,0,serial,1,1,heuristic,tensorop,f16,128,64,64,1,1,1,3,2,2,1,16,8,16,80,1024,855638016,2955298209792,3453,14.6331,54.4572,201960
1,CUTLASS,gemm,cutlass_tensorop_h16816gemm_128x64_64x3_nn_align2,passed,success,universal,8192,22016,8192,f16:column,f16:column,f16:column,f16:column,1,0,serial,1,1,heuristic,tensorop,f16,128,64,64,1,1,1,3,2,2,1,16,8,16,80,1024,855638016,2955298209792,3453,15.4671,51.5206,191070
1,CUTLASS,gemm,cutlass_tensorop_h16816gemm_64x128_64x3_nn_align8,passed,success,universal,8192,22016,8192,f16:column,f16:column,f16:column,f16:column,1,0,serial,1,1,heuristic,tensorop,f16,64,128,64,1,1,1,3,2,2,1,16,8,16,80,1024,855638016,2955298209792,3453,13.7272,58.0507,215287
1,CUTLASS,gemm,cutlass_tensorop_h16816gemm_64x128_64x3_nn_align4,passed,success,universal,8192,22016,8192,f16:column,f16:column,f16:column,f16:column,1,0,serial,1,1,heuristic,tensorop,f16,64,128,64,1,1,1,3,2,2,1,16,8,16,80,1024,855638016,2955298209792,3453,14.1916,56.1512,208243
1,CUTLASS,gemm,cutlass_tensorop_h16816gemm_64x128_64x3_nn_align2,passed,success,universal,8192,22016,8192,f16:column,f16:column,f16:column,f16:column,1,0,serial,1,1,heuristic,tensorop,f16,64,128,64,1,1,1,3,2,2,1,16,8,16,80,1024,855638016,2955298209792,3453,15.1655,52.5451,194869
1,CUTLASS,gemm,cutlass_tensorop_h16816gemm_64x64_64x5_nn_align8,passed,success,universal,8192,22016,8192,f16:column,f16:column,f16:column,f16:column,1,0,serial,1,1,heuristic,tensorop,f16,64,64,64,1,1,1,5,2,2,1,16,8,16,80,1024,855638016,2955298209792,3453,18.1621,43.8758,162718
1,CUTLASS,gemm,cutlass_tensorop_h16816gemm_64x64_64x5_nn_align4,passed,success,universal,8192,22016,8192,f16:column,f16:column,f16:column,f16:column,1,0,serial,1,1,heuristic,tensorop,f16,64,64,64,1,1,1,5,2,2,1,16,8,16,80,1024,855638016,2955298209792,3453,18.6942,42.6268,158086
1,CUTLASS,gemm,cutlass_tensorop_h16816gemm_64x64_64x5_nn_align2,passed,success,universal,8192,22016,8192,f16:column,f16:column,f16:column,f16:column,1,0,serial,1,1,heuristic,tensorop,f16,64,64,64,1,1,1,5,2,2,1,16,8,16,80,1024,855638016,2955298209792,3453,20.748,38.4074,142438
1,CUTLASS,gemm,cutlass_tensorop_h16816gemm_256x128_32x3_nt_align8,passed,success,universal,8192,22016,8192,f16:column,f16:row,f16:column,f16:column,1,0,serial,1,1,heuristic,tensorop,f16,256,128,32,1,1,1,3,4,2,1,16,8,16,80,1024,855638016,2955298209792,3453,9.09251,87.6409,325026
1,CUTLASS,gemm,cutlass_tensorop_h16816gemm_256x128_32x3_nt_align4,passed,success,universal,8192,22016,8192,f16:column,f16:row,f16:column,f16:column,1,0,serial,1,1,heuristic,tensorop,f16,256,128,32,1,1,1,3,4,2,1,16,8,16,80,1024,855638016,2955298209792,3453,8.97033,88.8345,329453
1,CUTLASS,gemm,cutlass_tensorop_h16816gemm_256x128_32x3_nt_align2,passed,success,universal,8192,22016,8192,f16:column,f16:row,f16:column,f16:column,1,0,serial,1,1,heuristic,tensorop,f16,256,128,32,1,1,1,3,4,2,1,16,8,16,80,1024,855638016,2955298209792,3453,9.64485,82.6218,306412
1,CUTLASS,gemm,cutlass_tensorop_h16816gemm_128x256_32x3_nt_align8,passed,success,universal,8192,22016,8192,f16:column,f16:row,f16:column,f16:column,1,0,serial,1,1,heuristic,tensorop,f16,128,256,32,1,1,1,3,2,4,1,16,8,16,80,1024,855638016,2955298209792,3453,9.47446,84.1077,311923
1,CUTLASS,gemm,cutlass_tensorop_h16816gemm_128x256_32x3_nt_align4,passed,success,universal,8192,22016,8192,f16:column,f16:row,f16:column,f16:column,1,0,serial,1,1,heuristic,tensorop,f16,128,256,32,1,1,1,3,2,4,1,16,8,16,80,1024,855638016,2955298209792,3453,8.79268,90.6293,336109
1,CUTLASS,gemm,cutlass_tensorop_h16816gemm_128x256_32x3_nt_align2,passed,success,universal,8192,22016,8192,f16:column,f16:row,f16:column,f16:column,1,0,serial,1,1,heuristic,tensorop,f16,128,256,32,1,1,1,3,2,4,1,16,8,16,80,1024,855638016,2955298209792,3453,9.44691,84.353,312832
1,CUTLASS,gemm,cutlass_tensorop_h16816gemm_256x64_32x3_nt_align8,passed,success,universal,8192,22016,8192,f16:column,f16:row,f16:column,f16:column,1,0,serial,1,1,heuristic,tensorop,f16,256,64,32,1,1,1,3,4,1,1,16,8,16,80,1024,855638016,2955298209792,3453,11.8293,67.3648,249830
1,CUTLASS,gemm,cutlass_tensorop_h16816gemm_256x64_32x3_nt_align4,passed,success,universal,8192,22016,8192,f16:column,f16:row,f16:column,f16:column,1,0,serial,1,1,heuristic,tensorop,f16,256,64,32,1,1,1,3,4,1,1,16,8,16,80,1024,855638016,2955298209792,3453,12.219,65.216,241861
1,CUTLASS,gemm,cutlass_tensorop_h16816gemm_256x64_32x3_nt_align2,passed,success,universal,8192,22016,8192,f16:column,f16:row,f16:column,f16:column,1,0,serial,1,1,heuristic,tensorop,f16,256,64,32,1,1,1,3,4,1,1,16,8,16,80,1024,855638016,2955298209792,3453,12.9992,61.3019,227345
1,CUTLASS,gemm,cutlass_tensorop_h16816gemm_256x64_32x4_nt_align8,passed,success,universal,8192,22016,8192,f16:column,f16:row,f16:column,f16:column,1,0,serial,1,1,heuristic,tensorop,f16,256,64,32,1,1,1,4,4,1,1,16,8,16,80,1024,855638016,2955298209792,3453,11.7625,67.7472,251248
1,CUTLASS,gemm,cutlass_tensorop_h16816gemm_256x64_32x4_nt_align4,passed,success,universal,8192,22016,8192,f16:column,f16:row,f16:column,f16:column,1,0,serial,1,1,heuristic,tensorop,f16,256,64,32,1,1,1,4,4,1,1,16,8,16,80,1024,855638016,2955298209792,3453,12.3147,64.7092,239981
1,CUTLASS,gemm,cutlass_tensorop_h16816gemm_256x64_32x4_nt_align2,passed,success,universal,8192,22016,8192,f16:column,f16:row,f16:column,f16:column,1,0,serial,1,1,heuristic,tensorop,f16,256,64,32,1,1,1,4,4,1,1,16,8,16,80,1024,855638016,2955298209792,3453,13.1871,60.4285,224106
1,CUTLASS,gemm,cutlass_tensorop_h16816gemm_64x256_32x4_nt_align8,passed,success,universal,8192,22016,8192,f16:column,f16:row,f16:column,f16:column,1,0,serial,1,1,heuristic,tensorop,f16,64,256,32,1,1,1,4,1,4,1,16,8,16,80,1024,855638016,2955298209792,3453,11.5374,69.0688,256149
1,CUTLASS,gemm,cutlass_tensorop_h16816gemm_64x256_32x4_nt_align4,passed,success,universal,8192,22016,8192,f16:column,f16:row,f16:column,f16:column,1,0,serial,1,1,heuristic,tensorop,f16,64,256,32,1,1,1,4,1,4,1,16,8,16,80,1024,855638016,2955298209792,3453,11.8417,67.2937,249566
1,CUTLASS,gemm,cutlass_tensorop_h16816gemm_64x256_32x4_nt_align2,passed,success,universal,8192,22016,8192,f16:column,f16:row,f16:column,f16:column,1,0,serial,1,1,heuristic,tensorop,f16,64,256,32,1,1,1,4,1,4,1,16,8,16,80,1024,855638016,2955298209792,3453,12.5664,63.413,235174
1,CUTLASS,gemm,cutlass_tensorop_h16816gemm_128x128_32x3_nt_align8,passed,success,universal,8192,22016,8192,f16:column,f16:row,f16:column,f16:column,1,0,serial,1,1,heuristic,tensorop,f16,128,128,32,1,1,1,3,2,2,1,16,8,16,80,1024,855638016,2955298209792,3453,9.76989,81.5643,302490
1,CUTLASS,gemm,cutlass_tensorop_h16816gemm_128x128_32x3_nt_align4,passed,success,universal,8192,22016,8192,f16:column,f16:row,f16:column,f16:column,1,0,serial,1,1,heuristic,tensorop,f16,128,128,32,1,1,1,3,2,2,1,16,8,16,80,1024,855638016,2955298209792,3453,10.3518,76.9792,285486
1,CUTLASS,gemm,cutlass_tensorop_h16816gemm_128x128_32x3_nt_align2,passed,success,universal,8192,22016,8192,f16:column,f16:row,f16:column,f16:column,1,0,serial,1,1,heuristic,tensorop,f16,128,128,32,1,1,1,3,2,2,1,16,8,16,80,1024,855638016,2955298209792,3453,10.2368,77.844,288693
1,CUTLASS,gemm,cutlass_tensorop_h16816gemm_128x128_32x4_nt_align8,passed,success,universal,8192,22016,8192,f16:column,f16:row,f16:column,f16:column,1,0,serial,1,1,heuristic,tensorop,f16,128,128,32,1,1,1,4,2,2,1,16,8,16,80,1024,855638016,2955298209792,3453,9.9372,80.1911,297397
1,CUTLASS,gemm,cutlass_tensorop_h16816gemm_128x128_32x4_nt_align4,passed,success,universal,8192,22016,8192,f16:column,f16:row,f16:column,f16:column,1,0,serial,1,1,heuristic,tensorop,f16,128,128,32,1,1,1,4,2,2,1,16,8,16,80,1024,855638016,2955298209792,3453,10.2223,77.9542,289102
1,CUTLASS,gemm,cutlass_tensorop_h16816gemm_128x128_32x4_nt_align2,passed,success,universal,8192,22016,8192,f16:column,f16:row,f16:column,f16:column,1,0,serial,1,1,heuristic,tensorop,f16,128,128,32,1,1,1,4,2,2,1,16,8,16,80,1024,855638016,2955298209792,3453,10.582,75.3046,279275
1,CUTLASS,gemm,cutlass_tensorop_h16816gemm_128x128_32x5_nt_align8,passed,success,universal,8192,22016,8192,f16:column,f16:row,f16:column,f16:column,1,0,serial,1,1,heuristic,tensorop,f16,128,128,32,1,1,1,5,2,2,1,16,8,16,80,1024,855638016,2955298209792,3453,9.87965,80.6582,299130
1,CUTLASS,gemm,cutlass_tensorop_h16816gemm_128x128_32x5_nt_align4,passed,success,universal,8192,22016,8192,f16:column,f16:row,f16:column,f16:column,1,0,serial,1,1,heuristic,tensorop,f16,128,128,32,1,1,1,5,2,2,1,16,8,16,80,1024,855638016,2955298209792,3453,9.95338,80.0607,296914
1,CUTLASS,gemm,cutlass_tensorop_h16816gemm_128x128_32x5_nt_align2,passed,success,universal,8192,22016,8192,f16:column,f16:row,f16:column,f16:column,1,0,serial,1,1,heuristic,tensorop,f16,128,128,32,1,1,1,5,2,2,1,16,8,16,80,1024,855638016,2955298209792,3453,10.6901,74.5436,276453
1,CUTLASS,gemm,cutlass_tensorop_h16816gemm_128x64_32x6_nt_align8,passed,success,universal,8192,22016,8192,f16:column,f16:row,f16:column,f16:column,1,0,serial,1,1,heuristic,tensorop,f16,128,64,32,1,1,1,6,2,2,1,16,8,16,80,1024,855638016,2955298209792,3453,13.8579,57.5033,213257
1,CUTLASS,gemm,cutlass_tensorop_h16816gemm_128x64_32x6_nt_align4,passed,success,universal,8192,22016,8192,f16:column,f16:row,f16:column,f16:column,1,0,serial,1,1,heuristic,tensorop,f16,128,64,32,1,1,1,6,2,2,1,16,8,16,80,1024,855638016,2955298209792,3453,14.4549,55.1284,204450
1,CUTLASS,gemm,cutlass_tensorop_h16816gemm_128x64_32x6_nt_align2,passed,success,universal,8192,22016,8192,f16:column,f16:row,f16:column,f16:column,1,0,serial,1,1,heuristic,tensorop,f16,128,64,32,1,1,1,6,2,2,1,16,8,16,80,1024,855638016,2955298209792,3453,14.9902,53.1596,197148
1,CUTLASS,gemm,cutlass_tensorop_h16816gemm_64x128_32x6_nt_align8,passed,success,universal,8192,22016,8192,f16:column,f16:row,f16:column,f16:column,1,0,serial,1,1,heuristic,tensorop,f16,64,128,32,1,1,1,6,2,2,1,16,8,16,80,1024,855638016,2955298209792,3453,13.7788,57.8332,214481
1,CUTLASS,gemm,cutlass_tensorop_h16816gemm_64x128_32x6_nt_align4,passed,success,universal,8192,22016,8192,f16:column,f16:row,f16:column,f16:column,1,0,serial,1,1,heuristic,tensorop,f16,64,128,32,1,1,1,6,2,2,1,16,8,16,80,1024,855638016,2955298209792,3453,14.1707,56.2339,208550
1,CUTLASS,gemm,cutlass_tensorop_h16816gemm_64x128_32x6_nt_align2,passed,success,universal,8192,22016,8192,f16:column,f16:row,f16:column,f16:column,1,0,serial,1,1,heuristic,tensorop,f16,64,128,32,1,1,1,6,2,2,1,16,8,16,80,1024,855638016,2955298209792,3453,14.8106,53.8044,199540
1,CUTLASS,gemm,cutlass_tensorop_h16816gemm_64x64_32x10_nt_align8,passed,success,universal,8192,22016,8192,f16:column,f16:row,f16:column,f16:column,1,0,serial,1,1,heuristic,tensorop,f16,64,64,32,1,1,1,10,2,2,1,16,8,16,80,1024,855638016,2955298209792,3453,18.1432,43.9213,162887
1,CUTLASS,gemm,cutlass_tensorop_h16816gemm_64x64_32x10_nt_align4,passed,success,universal,8192,22016,8192,f16:column,f16:row,f16:column,f16:column,1,0,serial,1,1,heuristic,tensorop,f16,64,64,32,1,1,1,10,2,2,1,16,8,16,80,1024,855638016,2955298209792,3453,18.6394,42.7523,158551
1,CUTLASS,gemm,cutlass_tensorop_h16816gemm_64x64_32x10_nt_align2,passed,success,universal,8192,22016,8192,f16:column,f16:row,f16:column,f16:column,1,0,serial,1,1,heuristic,tensorop,f16,64,64,32,1,1,1,10,2,2,1,16,8,16,80,1024,855638016,2955298209792,3453,19.7692,40.3088,149490
1,CUTLASS,gemm,cutlass_tensorop_h16816gemm_128x128_64x3_nt_align8,passed,success,universal,8192,22016,8192,f16:column,f16:row,f16:column,f16:column,1,0,serial,1,1,heuristic,tensorop,f16,128,128,64,1,1,1,3,2,2,1,16,8,16,80,1024,855638016,2955298209792,3453,9.83695,81.0083,300428
1,CUTLASS,gemm,cutlass_tensorop_h16816gemm_128x128_64x3_nt_align4,passed,success,universal,8192,22016,8192,f16:column,f16:row,f16:column,f16:column,1,0,serial,1,1,heuristic,tensorop,f16,128,128,64,1,1,1,3,2,2,1,16,8,16,80,1024,855638016,2955298209792,3453,10.2466,77.77,288419
1,CUTLASS,gemm,cutlass_tensorop_h16816gemm_128x128_64x3_nt_align2,passed,success,universal,8192,22016,8192,f16:column,f16:row,f16:column,f16:column,1,0,serial,1,1,heuristic,tensorop,f16,128,128,64,1,1,1,3,2,2,1,16,8,16,80,1024,855638016,2955298209792,3453,11.5787,68.8226,255236
1,CUTLASS,gemm,cutlass_tensorop_h16816gemm_128x64_64x3_nt_align8,passed,success,universal,8192,22016,8192,f16:column,f16:row,f16:column,f16:column,1,0,serial,1,1,heuristic,tensorop,f16,128,64,64,1,1,1,3,2,2,1,16,8,16,80,1024,855638016,2955298209792,3453,13.8745,57.4346,213002
1,CUTLASS,gemm,cutlass_tensorop_h16816gemm_128x64_64x3_nt_align4,passed,success,universal,8192,22016,8192,f16:column,f16:row,f16:column,f16:column,1,0,serial,1,1,heuristic,tensorop,f16,128,64,64,1,1,1,3,2,2,1,16,8,16,80,1024,855638016,2955298209792,3453,14.4689,55.075,204252
1,CUTLASS,gemm,cutlass_tensorop_h16816gemm_128x64_64x3_nt_align2,passed,success,universal,8192,22016,8192,f16:column,f16:row,f16:column,f16:column,1,0,serial,1,1,heuristic,tensorop,f16,128,64,64,1,1,1,3,2,2,1,16,8,16,80,1024,855638016,2955298209792,3453,15.8314,50.3352,186674
1,CUTLASS,gemm,cutlass_tensorop_h16816gemm_64x128_64x3_nt_align8,passed,success,universal,8192,22016,8192,f16:column,f16:row,f16:column,f16:column,1,0,serial,1,1,heuristic,tensorop,f16,64,128,64,1,1,1,3,2,2,1,16,8,16,80,1024,855638016,2955298209792,3453,13.7562,57.9284,214834
1,CUTLASS,gemm,cutlass_tensorop_h16816gemm_64x128_64x3_nt_align4,passed,success,universal,8192,22016,8192,f16:column,f16:row,f16:column,f16:column,1,0,serial,1,1,heuristic,tensorop,f16,64,128,64,1,1,1,3,2,2,1,16,8,16,80,1024,855638016,2955298209792,3453,14.1706,56.2343,208551
