CUTLASS/cutlassgemm-benchmark/csv_logs/cutlass_shape_8192_9216_36864_performance.gemm.csv
Problem,Provider,OperationKind,Operation,Disposition,Status,gemm_kind,m,n,k,A,B,C,D,alpha,beta,split_k_mode,split_k_slices,batch_count,raster_order,op_class,accum,cta_m,cta_n,cta_k,cluster_m,cluster_n,cluster_k,stages,warps_m,warps_n,warps_k,inst_m,inst_n,inst_k,min_cc,max_cc,Bytes,Flops,Flops/Byte,Runtime,GB/s,GFLOPs
1,CUTLASS,gemm,cutlass_tensorop_h1688gemm_256x128_32x2_nn_align8,passed,success,universal,8192,36864,9216,f16:column,f16:column,f16:column,f16:column,1,0,serial,1,1,heuristic,tensorop,f16,256,128,32,1,1,1,2,4,2,1,16,8,8,75,1024,1434451968,5566881595392,3880,27.9523,47.7934,199156
1,CUTLASS,gemm,cutlass_tensorop_h1688gemm_256x128_32x2_nn_align4,passed,success,universal,8192,36864,9216,f16:column,f16:column,f16:column,f16:column,1,0,serial,1,1,heuristic,tensorop,f16,256,128,32,1,1,1,2,4,2,1,16,8,8,75,1024,1434451968,5566881595392,3880,26.5476,50.3223,209694
1,CUTLASS,gemm,cutlass_tensorop_h1688gemm_256x128_32x2_nn_align2,passed,success,universal,8192,36864,9216,f16:column,f16:column,f16:column,f16:column,1,0,serial,1,1,heuristic,tensorop,f16,256,128,32,1,1,1,2,4,2,1,16,8,8,75,1024,1434451968,5566881595392,3880,27.1449,49.215,205080
1,CUTLASS,gemm,cutlass_tensorop_h1688gemm_256x128_32x2_nn_align1,passed,success,universal,8192,36864,9216,f16:column,f16:column,f16:column,f16:column,1,0,serial,1,1,heuristic,tensorop,f16,256,128,32,1,1,1,2,4,2,1,16,8,8,75,1024,1434451968,5566881595392,3880,33.9362,39.3662,164040
1,CUTLASS,gemm,cutlass_tensorop_h1688gemm_128x256_32x2_nn_align8,passed,success,universal,8192,36864,9216,f16:column,f16:column,f16:column,f16:column,1,0,serial,1,1,heuristic,tensorop,f16,128,256,32,1,1,1,2,2,4,1,16,8,8,75,1024,1434451968,5566881595392,3880,26.0441,51.2952,213748
1,CUTLASS,gemm,cutlass_tensorop_h1688gemm_128x256_32x2_nn_align4,passed,success,universal,8192,36864,9216,f16:column,f16:column,f16:column,f16:column,1,0,serial,1,1,heuristic,tensorop,f16,128,256,32,1,1,1,2,2,4,1,16,8,8,75,1024,1434451968,5566881595392,3880,24.9259,53.5964,223337
1,CUTLASS,gemm,cutlass_tensorop_h1688gemm_128x256_32x2_nn_align2,passed,success,universal,8192,36864,9216,f16:column,f16:column,f16:column,f16:column,1,0,serial,1,1,heuristic,tensorop,f16,128,256,32,1,1,1,2,2,4,1,16,8,8,75,1024,1434451968,5566881595392,3880,24.6012,54.3038,226285
1,CUTLASS,gemm,cutlass_tensorop_h1688gemm_128x256_32x2_nn_align1,passed,success,universal,8192,36864,9216,f16:column,f16:column,f16:column,f16:column,1,0,serial,1,1,heuristic,tensorop,f16,128,256,32,1,1,1,2,2,4,1,16,8,8,75,1024,1434451968,5566881595392,3880,27.6402,48.3331,201405
1,CUTLASS,gemm,cutlass_tensorop_h1688gemm_128x128_32x2_nn_align8,passed,success,universal,8192,36864,9216,f16:column,f16:column,f16:column,f16:column,1,0,serial,1,1,heuristic,tensorop,f16,128,128,32,1,1,1,2,2,2,1,16,8,8,75,1024,1434451968,5566881595392,3880,20.6221,64.7817,269947
1,CUTLASS,gemm,cutlass_tensorop_h1688gemm_128x128_32x2_nn_align4,passed,success,universal,8192,36864,9216,f16:column,f16:column,f16:column,f16:column,1,0,serial,1,1,heuristic,tensorop,f16,128,128,32,1,1,1,2,2,2,1,16,8,8,75,1024,1434451968,5566881595392,3880,22.7164,58.8094,245060
1,CUTLASS,gemm,cutlass_tensorop_h1688gemm_128x128_32x2_nn_align2,passed,success,universal,8192,36864,9216,f16:column,f16:column,f16:column,f16:column,1,0,serial,1,1,heuristic,tensorop,f16,128,128,32,1,1,1,2,2,2,1,16,8,8,75,1024,1434451968,5566881595392,3880,23.368,57.1696,238227
1,CUTLASS,gemm,cutlass_tensorop_h1688gemm_128x128_32x2_nn_align1,passed,success,universal,8192,36864,9216,f16:column,f16:column,f16:column,f16:column,1,0,serial,1,1,heuristic,tensorop,f16,128,128,32,1,1,1,2,2,2,1,16,8,8,75,1024,1434451968,5566881595392,3880,31.1721,42.8568,178585
1,CUTLASS,gemm,cutlass_tensorop_h1688gemm_64x256_32x2_nn_align8,passed,success,universal,8192,36864,9216,f16:column,f16:column,f16:column,f16:column,1,0,serial,1,1,heuristic,tensorop,f16,64,256,32,1,1,1,2,1,4,1,16,8,8,75,1024,1434451968,5566881595392,3880,23.3867,57.1237,238036
1,CUTLASS,gemm,cutlass_tensorop_h1688gemm_64x256_32x2_nn_align4,passed,success,universal,8192,36864,9216,f16:column,f16:column,f16:column,f16:column,1,0,serial,1,1,heuristic,tensorop,f16,64,256,32,1,1,1,2,1,4,1,16,8,8,75,1024,1434451968,5566881595392,3880,24.5749,54.3619,226527
1,CUTLASS,gemm,cutlass_tensorop_h1688gemm_64x256_32x2_nn_align2,passed,success,universal,8192,36864,9216,f16:column,f16:column,f16:column,f16:column,1,0,serial,1,1,heuristic,tensorop,f16,64,256,32,1,1,1,2,1,4,1,16,8,8,75,1024,1434451968,5566881595392,3880,25.8769,51.6266,215129
1,CUTLASS,gemm,cutlass_tensorop_h1688gemm_64x256_32x2_nn_align1,passed,success,universal,8192,36864,9216,f16:column,f16:column,f16:column,f16:column,1,0,serial,1,1,heuristic,tensorop,f16,64,256,32,1,1,1,2,1,4,1,16,8,8,75,1024,1434451968,5566881595392,3880,32.5492,41.0437,171030
1,CUTLASS,gemm,cutlass_tensorop_h1688gemm_256x64_32x2_nn_align8,passed,success,universal,8192,36864,9216,f16:column,f16:column,f16:column,f16:column,1,0,serial,1,1,heuristic,tensorop,f16,256,64,32,1,1,1,2,4,1,1,16,8,8,75,1024,1434451968,5566881595392,3880,27.0413,49.4036,205866
1,CUTLASS,gemm,cutlass_tensorop_h1688gemm_256x64_32x2_nn_align4,passed,success,universal,8192,36864,9216,f16:column,f16:column,f16:column,f16:column,1,0,serial,1,1,heuristic,tensorop,f16,256,64,32,1,1,1,2,4,1,1,16,8,8,75,1024,1434451968,5566881595392,3880,29.2834,45.6209,190103
1,CUTLASS,gemm,cutlass_tensorop_h1688gemm_256x64_32x2_nn_align2,passed,success,universal,8192,36864,9216,f16:column,f16:column,f16:column,f16:column,1,0,serial,1,1,heuristic,tensorop,f16,256,64,32,1,1,1,2,4,1,1,16,8,8,75,1024,1434451968,5566881595392,3880,28.2612,47.2711,196980
1,CUTLASS,gemm,cutlass_tensorop_h1688gemm_256x64_32x2_nn_align1,passed,success,universal,8192,36864,9216,f16:column,f16:column,f16:column,f16:column,1,0,serial,1,1,heuristic,tensorop,f16,256,64,32,1,1,1,2,4,1,1,16,8,8,75,1024,1434451968,5566881595392,3880,43.7239,30.5539,127319
1,CUTLASS,gemm,cutlass_tensorop_h1688gemm_64x128_32x2_nn_align8,passed,success,universal,8192,36864,9216,f16:column,f16:column,f16:column,f16:column,1,0,serial,1,1,heuristic,tensorop,f16,64,128,32,1,1,1,2,2,2,1,16,8,8,75,1024,1434451968,5566881595392,3880,27.9474,47.8018,199191
1,CUTLASS,gemm,cutlass_tensorop_h1688gemm_64x128_32x2_nn_align4,passed,success,universal,8192,36864,9216,f16:column,f16:column,f16:column,f16:column,1,0,serial,1,1,heuristic,tensorop,f16,64,128,32,1,1,1,2,2,2,1,16,8,8,75,1024,1434451968,5566881595392,3880,28.5108,46.8572,195255
1,CUTLASS,gemm,cutlass_tensorop_h1688gemm_64x128_32x2_nn_align2,passed,success,universal,8192,36864,9216,f16:column,f16:column,f16:column,f16:column,1,0,serial,1,1,heuristic,tensorop,f16,64,128,32,1,1,1,2,2,2,1,16,8,8,75,1024,1434451968,5566881595392,3880,30.8718,43.2738,180323
1,CUTLASS,gemm,cutlass_tensorop_h1688gemm_64x128_32x2_nn_align1,passed,success,universal,8192,36864,9216,f16:column,f16:column,f16:column,f16:column,1,0,serial,1,1,heuristic,tensorop,f16,64,128,32,1,1,1,2,2,2,1,16,8,8,75,1024,1434451968,5566881595392,3880,42.1277,31.7116,132143
1,CUTLASS,gemm,cutlass_tensorop_h1688gemm_128x64_32x2_nn_align8,passed,success,universal,8192,36864,9216,f16:column,f16:column,f16:column,f16:column,1,0,serial,1,1,heuristic,tensorop,f16,128,64,32,1,1,1,2,2,2,1,16,8,8,75,1024,1434451968,5566881595392,3880,28.814,46.3641,193200
1,CUTLASS,gemm,cutlass_tensorop_h1688gemm_128x64_32x2_nn_align4,passed,success,universal,8192,36864,9216,f16:column,f16:column,f16:column,f16:column,1,0,serial,1,1,heuristic,tensorop,f16,128,64,32,1,1,1,2,2,2,1,16,8,8,75,1024,1434451968,5566881595392,3880,31.6578,42.1993,175846
1,CUTLASS,gemm,cutlass_tensorop_h1688gemm_128x64_32x2_nn_align2,passed,success,universal,8192,36864,9216,f16:column,f16:column,f16:column,f16:column,1,0,serial,1,1,heuristic,tensorop,f16,128,64,32,1,1,1,2,2,2,1,16,8,8,75,1024,1434451968,5566881595392,3880,33.6743,39.6723,165315
1,CUTLASS,gemm,cutlass_tensorop_h1688gemm_128x64_32x2_nn_align1,passed,success,universal,8192,36864,9216,f16:column,f16:column,f16:column,f16:column,1,0,serial,1,1,heuristic,tensorop,f16,128,64,32,1,1,1,2,2,2,1,16,8,8,75,1024,1434451968,5566881595392,3880,48.7729,27.391,114139
1,CUTLASS,gemm,cutlass_tensorop_h1688gemm_64x64_32x2_nn_align8,passed,success,universal,8192,36864,9216,f16:column,f16:column,f16:column,f16:column,1,0,serial,1,1,heuristic,tensorop,f16,64,64,32,1,1,1,2,2,2,1,16,8,8,75,1024,1434451968,5566881595392,3880,36.4124,36.6891,152884
1,CUTLASS,gemm,cutlass_tensorop_h1688gemm_64x64_32x2_nn_align4,passed,success,universal,8192,36864,9216,f16:column,f16:column,f16:column,f16:column,1,0,serial,1,1,heuristic,tensorop,f16,64,64,32,1,1,1,2,2,2,1,16,8,8,75,1024,1434451968,5566881595392,3880,37.5253,35.601,148350
1,CUTLASS,gemm,cutlass_tensorop_h1688gemm_64x64_32x2_nn_align2,passed,success,universal,8192,36864,9216,f16:column,f16:column,f16:column,f16:column,1,0,serial,1,1,heuristic,tensorop,f16,64,64,32,1,1,1,2,2,2,1,16,8,8,75,1024,1434451968,5566881595392,3880,41.1347,32.4772,135333
1,CUTLASS,gemm,cutlass_tensorop_h1688gemm_64x64_32x2_nn_align1,passed,success,universal,8192,36864,9216,f16:column,f16:column,f16:column,f16:column,1,0,serial,1,1,heuristic,tensorop,f16,64,64,32,1,1,1,2,2,2,1,16,8,8,75,1024,1434451968,5566881595392,3880,60.8204,21.9653,91529.9
1,CUTLASS,gemm,cutlass_tensorop_h1688gemm_64x128_64x2_nn_align8,passed,success,universal,8192,36864,9216,f16:column,f16:column,f16:column,f16:column,1,0,serial,1,1,heuristic,tensorop,f16,64,128,64,1,1,1,2,1,2,2,16,8,8,75,1024,1434451968,5566881595392,3880,27.1099,49.2786,205345
1,CUTLASS,gemm,cutlass_tensorop_h1688gemm_64x128_64x2_nn_align4,passed,success,universal,8192,36864,9216,f16:column,f16:column,f16:column,f16:column,1,0,serial,1,1,heuristic,tensorop,f16,64,128,64,1,1,1,2,1,2,2,16,8,8,75,1024,1434451968,5566881595392,3880,27.2419,49.0399,204350
1,CUTLASS,gemm,cutlass_tensorop_h1688gemm_64x128_64x2_nn_align2,passed,success,universal,8192,36864,9216,f16:column,f16:column,f16:column,f16:column,1,0,serial,1,1,heuristic,tensorop,f16,64,128,64,1,1,1,2,1,2,2,16,8,8,75,1024,1434451968,5566881595392,3880,27.6317,48.348,201467
1,CUTLASS,gemm,cutlass_tensorop_h1688gemm_64x128_64x2_nn_align1,passed,success,universal,8192,36864,9216,f16:column,f16:column,f16:column,f16:column,1,0,serial,1,1,heuristic,tensorop,f16,64,128,64,1,1,1,2,1,2,2,16,8,8,75,1024,1434451968,5566881595392,3880,36.7269,36.3749,151575
1,CUTLASS,gemm,cutlass_tensorop_h1688gemm_256x128_32x2_nt_align8,passed,success,universal,8192,36864,9216,f16:column,f16:row,f16:column,f16:column,1,0,serial,1,1,heuristic,tensorop,f16,256,128,32,1,1,1,2,4,2,1,16,8,8,75,1024,1434451968,5566881595392,3880,24.7525,53.9717,224901
1,CUTLASS,gemm,cutlass_tensorop_h1688gemm_256x128_32x2_nt_align4,passed,success,universal,8192,36864,9216,f16:column,f16:row,f16:column,f16:column,1,0,serial,1,1,heuristic,tensorop,f16,256,128,32,1,1,1,2,4,2,1,16,8,8,75,1024,1434451968,5566881595392,3880,27.437,48.691,202897
1,CUTLASS,gemm,cutlass_tensorop_h1688gemm_256x128_32x2_nt_align2,passed,success,universal,8192,36864,9216,f16:column,f16:row,f16:column,f16:column,1,0,serial,1,1,heuristic,tensorop,f16,256,128,32,1,1,1,2,4,2,1,16,8,8,75,1024,1434451968,5566881595392,3880,24.5551,54.4057,226710
1,CUTLASS,gemm,cutlass_tensorop_h1688gemm_256x128_32x2_nt_align1,passed,success,universal,8192,36864,9216,f16:column,f16:row,f16:column,f16:column,1,0,serial,1,1,heuristic,tensorop,f16,256,128,32,1,1,1,2,4,2,1,16,8,8,75,1024,1434451968,5566881595392,3880,29.2152,45.7275,190547
1,CUTLASS,gemm,cutlass_tensorop_h1688gemm_128x256_32x2_nt_align8,passed,success,universal,8192,36864,9216,f16:column,f16:row,f16:column,f16:column,1,0,serial,1,1,heuristic,tensorop,f16,128,256,32,1,1,1,2,2,4,1,16,8,8,75,1024,1434451968,5566881595392,3880,24.0926,55.4501,231062
1,CUTLASS,gemm,cutlass_tensorop_h1688gemm_128x256_32x2_nt_align4,passed,success,universal,8192,36864,9216,f16:column,f16:row,f16:column,f16:column,1,0,serial,1,1,heuristic,tensorop,f16,128,256,32,1,1,1,2,2,4,1,16,8,8,75,1024,1434451968,5566881595392,3880,24.2887,55.0025,229197
1,CUTLASS,gemm,cutlass_tensorop_h1688gemm_128x256_32x2_nt_align2,passed,success,universal,8192,36864,9216,f16:column,f16:row,f16:column,f16:column,1,0,serial,1,1,heuristic,tensorop,f16,128,256,32,1,1,1,2,2,4,1,16,8,8,75,1024,1434451968,5566881595392,3880,27.1821,49.1477,204800
1,CUTLASS,gemm,cutlass_tensorop_h1688gemm_128x256_32x2_nt_align1,passed,success,universal,8192,36864,9216,f16:column,f16:row,f16:column,f16:column,1,0,serial,1,1,heuristic,tensorop,f16,128,256,32,1,1,1,2,2,4,1,16,8,8,75,1024,1434451968,5566881595392,3880,29.7084,44.9684,187384
1,CUTLASS,gemm,cutlass_tensorop_h1688gemm_128x128_32x2_nt_align8,passed,success,universal,8192,36864,9216,f16:column,f16:row,f16:column,f16:column,1,0,serial,1,1,heuristic,tensorop,f16,128,128,32,1,1,1,2,2,2,1,16,8,8,75,1024,1434451968,5566881595392,3880,21.5112,62.1044,258790
1,CUTLASS,gemm,cutlass_tensorop_h1688gemm_128x128_32x2_nt_align4,passed,success,universal,8192,36864,9216,f16:column,f16:row,f16:column,f16:column,1,0,serial,1,1,heuristic,tensorop,f16,128,128,32,1,1,1,2,2,2,1,16,8,8,75,1024,1434451968,5566881595392,3880,25.1191,53.1841,221619
1,CUTLASS,gemm,cutlass_tensorop_h1688gemm_128x128_32x2_nt_align2,passed,success,universal,8192,36864,9216,f16:column,f16:row,f16:column,f16:column,1,0,serial,1,1,heuristic,tensorop,f16,128,128,32,1,1,1,2,2,2,1,16,8,8,75,1024,1434451968,5566881595392,3880,22.352,59.7682,249055
1,CUTLASS,gemm,cutlass_tensorop_h1688gemm_128x128_32x2_nt_align1,passed,success,universal,8192,36864,9216,f16:column,f16:row,f16:column,f16:column,1,0,serial,1,1,heuristic,tensorop,f16,128,128,32,1,1,1,2,2,2,1,16,8,8,75,1024,1434451968,5566881595392,3880,27.7382,48.1623,200694
1,CUTLASS,gemm,cutlass_tensorop_h1688gemm_64x256_32x2_nt_align8,passed,success,universal,8192,36864,9216,f16:column,f16:row,f16:column,f16:column,1,0,serial,1,1,heuristic,tensorop,f16,64,256,32,1,1,1,2,1,4,1,16,8,8,75,1024,1434451968,5566881595392,3880,24.0971,55.4398,231019
1,CUTLASS,gemm,cutlass_tensorop_h1688gemm_64x256_32x2_nt_align4,passed,success,universal,8192,36864,9216,f16:column,f16:row,f16:column,f16:column,1,0,serial,1,1,heuristic,tensorop,f16,64,256,32,1,1,1,2,1,4,1,16,8,8,75,1024,1434451968,5566881595392,3880,24.8931,53.6669,223631
1,CUTLASS,gemm,cutlass_tensorop_h1688gemm_64x256_32x2_nt_align2,passed,success,universal,8192,36864,9216,f16:column,f16:row,f16:column,f16:column,1,0,serial,1,1,heuristic,tensorop,f16,64,256,32,1,1,1,2,1,4,1,16,8,8,75,1024,1434451968,5566881595392,3880,25.8302,51.72,215518
1,CUTLASS,gemm,cutlass_tensorop_h1688gemm_64x256_32x2_nt_align1,passed,success,universal,8192,36864,9216,f16:column,f16:row,f16:column,f16:column,1,0,serial,1,1,heuristic,tensorop,f16,64,256,32,1,1,1,2,1,4,1,16,8,8,75,1024,1434451968,5566881595392,3880,30.6703,43.558,181507
1,CUTLASS,gemm,cutlass_tensorop_h1688gemm_256x64_32x2_nt_align8,passed,success,universal,8192,36864,9216,f16:column,f16:row,f16:column,f16:column,1,0,serial,1,1,heuristic,tensorop,f16,256,64,32,1,1,1,2,4,1,1,16,8,8,75,1024,1434451968,5566881595392,3880,26.6772,50.0778,208676
1,CUTLASS,gemm,cutlass_tensorop_h1688gemm_256x64_32x2_nt_align4,passed,success,universal,8192,36864,9216,f16:column,f16:row,f16:column,f16:column,1,0,serial,1,1,heuristic,tensorop,f16,256,64,32,1,1,1,2,4,1,1,16,8,8,75,1024,1434451968,5566881595392,3880,29.6031,45.1283,188051
1,CUTLASS,gemm,cutlass_tensorop_h1688gemm_256x64_32x2_nt_align2,passed,success,universal,8192,36864,9216,f16:column,f16:row,f16:column,f16:column,1,0,serial,1,1,heuristic,tensorop,f16,256,64,32,1,1,1,2,4,1,1,16,8,8,75,1024,1434451968,5566881595392,3880,27.9059,47.8729,199487
1,CUTLASS,gemm,cutlass_tensorop_h1688gemm_256x64_32x2_nt_align1,passed,success,universal,8192,36864,9216,f16:column,f16:row,f16:column,f16:column,1,0,serial,1,1,heuristic,tensorop,f16,256,64,32,1,1,1,2,4,1,1,16,8,8,75,1024,1434451968,5566881595392,3880,32.2806,41.3852,172453
1,CUTLASS,gemm,cutlass_tensorop_h1688gemm_64x128_32x2_nt_align8,passed,success,universal,8192,36864,9216,f16:column,f16:row,f16:column,f16:column,1,0,serial,1,1,heuristic,tensorop,f16,64,128,32,1,1,1,2,2,2,1,16,8,8,75,1024,1434451968,5566881595392,3880,29.1241,45.8706,191144
1,CUTLASS,gemm,cutlass_tensorop_h1688gemm_64x128_32x2_nt_align4,passed,success,universal,8192,36864,9216,f16:column,f16:row,f16:column,f16:column,1,0,serial,1,1,heuristic,tensorop,f16,64,128,32,1,1,1,2,2,2,1,16,8,8,75,1024,1434451968,5566881595392,3880,29.5835,45.1583,188175
1,CUTLASS,gemm,cutlass_tensorop_h1688gemm_64x128_32x2_nt_align2,passed,success,universal,8192,36864,9216,f16:column,f16:row,f16:column,f16:column,1,0,serial,1,1,heuristic,tensorop,f16,64,128,32,1,1,1,2,2,2,1,16,8,8,75,1024,1434451968,5566881595392,3880,30.8506,43.3034,180446
1,CUTLASS,gemm,cutlass_tensorop_h1688gemm_64x128_32x2_nt_align1,passed,success,universal,8192,36864,9216,f16:column,f16:row,f16:column,f16:column,1,0,serial,1,1,heuristic,tensorop,f16,64,128,32,1,1,1,2,2,2,1,16,8,8,75,1024,1434451968,5566881595392,3880,35.6717,37.451,156059
1,CUTLASS,gemm,cutlass_tensorop_h1688gemm_128x64_32x2_nt_align8,passed,success,universal,8192,36864,9216,f16:column,f16:row,f16:column,f16:column,1,0,serial,1,1,heuristic,tensorop,f16,128,64,32,1,1,1,2,2,2,1,16,8,8,75,1024,1434451968,5566881595392,3880,30.4788,43.8316,182647
1,CUTLASS,gemm,cutlass_tensorop_h1688gemm_128x64_32x2_nt_align4,passed,success,universal,8192,36864,9216,f16:column,f16:row,f16:column,f16:column,1,0,serial,1,1,heuristic,tensorop,f16,128,64,32,1,1,1,2,2,2,1,16,8,8,75,1024,1434451968,5566881595392,3880,30.9813,43.1207,179685
1,CUTLASS,gemm,cutlass_tensorop_h1688gemm_128x64_32x2_nt_align2,passed,success,universal,8192,36864,9216,f16:column,f16:row,f16:column,f16:column,1,0,serial,1,1,heuristic,tensorop,f16,128,64,32,1,1,1,2,2,2,1,16,8,8,75,1024,1434451968,5566881595392,3880,31.7929,42.0199,175098
1,CUTLASS,gemm,cutlass_tensorop_h1688gemm_128x64_32x2_nt_align1,passed,success,universal,8192,36864,9216,f16:column,f16:row,f16:column,f16:column,1,0,serial,1,1,heuristic,tensorop,f16,128,64,32,1,1,1,2,2,2,1,16,8,8,75,1024,1434451968,5566881595392,3880,35.8784,37.2351,155160
1,CUTLASS,gemm,cutlass_tensorop_h1688gemm_64x64_32x2_nt_align8,passed,success,universal,8192,36864,9216,f16:column,f16:row,f16:column,f16:column,1,0,serial,1,1,heuristic,tensorop,f16,64,64,32,1,1,1,2,2,2,1,16,8,8,75,1024,1434451968,5566881595392,3880,38.3045,34.8768,145332
1,CUTLASS,gemm,cutlass_tensorop_h1688gemm_64x64_32x2_nt_align4,passed,success,universal,8192,36864,9216,f16:column,f16:row,f16:column,f16:column,1,0,serial,1,1,heuristic,tensorop,f16,64,64,32,1,1,1,2,2,2,1,16,8,8,75,1024,1434451968,5566881595392,3880,39.1146,34.1544,142322
1,CUTLASS,gemm,cutlass_tensorop_h1688gemm_64x64_32x2_nt_align2,passed,success,universal,8192,36864,9216,f16:column,f16:row,f16:column,f16:column,1,0,serial,1,1,heuristic,tensorop,f16,64,64,32,1,1,1,2,2,2,1,16,8,8,75,1024,1434451968,5566881595392,3880,40.4412,33.034,137654
1,CUTLASS,gemm,cutlass_tensorop_h1688gemm_64x64_32x2_nt_align1,passed,success,universal,8192,36864,9216,f16:column,f16:row,f16:column,f16:column,1,0,serial,1,1,heuristic,tensorop,f16,64,64,32,1,1,1,2,2,2,1,16,8,8,75,1024,1434451968,5566881595392,3880,46.6193,28.6563,119411
1,CUTLASS,gemm,cutlass_tensorop_h1688gemm_64x128_64x2_nt_align8,passed,success,universal,8192,36864,9216,f16:column,f16:row,f16:column,f16:column,1,0,serial,1,1,heuristic,tensorop,f16,64,128,64,1,1,1,2,1,2,2,16,8,8,75,1024,1434451968,5566881595392,3880,28.892,46.2391,192679
1,CUTLASS,gemm,cutlass_tensorop_h1688gemm_64x128_64x2_nt_align4,passed,success,universal,8192,36864,9216,f16:column,f16:row,f16:column,f16:column,1,0,serial,1,1,heuristic,tensorop,f16,64,128,64,1,1,1,2,1,2,2,16,8,8,75,1024,1434451968,5566881595392,3880,28.9407,46.1612,192355
1,CUTLASS,gemm,cutlass_tensorop_h1688gemm_64x128_64x2_nt_align2,passed,success,universal,8192,36864,9216,f16:column,f16:row,f16:column,f16:column,1,0,serial,1,1,heuristic,tensorop,f16,64,128,64,1,1,1,2,1,2,2,16,8,8,75,1024,1434451968,5566881595392,3880,29.5984,45.1354,188080
1,CUTLASS,gemm,cutlass_tensorop_h1688gemm_64x128_64x2_nt_align1,passed,success,universal,8192,36864,9216,f16:column,f16:row,f16:column,f16:column,1,0,serial,1,1,heuristic,tensorop,f16,64,128,64,1,1,1,2,1,2,2,16,8,8,75,1024,1434451968,5566881595392,3880,38.2577,34.9194,145510
1,CUTLASS,gemm,cutlass_tensorop_h1688gemm_256x128_32x2_tn_align8,passed,success,universal,8192,36864,9216,f16:row,f16:column,f16:column,f16:column,1,0,serial,1,1,heuristic,tensorop,f16,256,128,32,1,1,1,2,4,2,1,16,8,8,75,1024,1434451968,5566881595392,3880,23.9599,55.7573,232342
1,CUTLASS,gemm,cutlass_tensorop_h1688gemm_256x128_32x2_tn_align4,passed,success,universal,8192,36864,9216,f16:row,f16:column,f16:column,f16:column,1,0,serial,1,1,heuristic,tensorop,f16,256,128,32,1,1,1,2,4,2,1,16,8,8,75,1024,1434451968,5566881595392,3880,26.1996,50.9909,212480
1,CUTLASS,gemm,cutlass_tensorop_h1688gemm_256x128_32x2_tn_align2,passed,success,universal,8192,36864,9216,f16:row,f16:column,f16:column,f16:column,1,0,serial,1,1,heuristic,tensorop,f16,256,128,32,1,1,1,2,4,2,1,16,8,8,75,1024,1434451968,5566881595392,3880,31.0501,43.0252,179287
1,CUTLASS,gemm,cutlass_tensorop_h1688gemm_256x128_32x2_tn_align1,passed,success,universal,8192,36864,9216,f16:row,f16:column,f16:column,f16:column,1,0,serial,1,1,heuristic,tensorop,f16,256,128,32,1,1,1,2,4,2,1,16,8,8,75,1024,1434451968,5566881595392,3880,37.4817,35.6424,148523
1,CUTLASS,gemm,cutlass_tensorop_h1688gemm_128x256_32x2_tn_align8,passed,success,universal,8192,36864,9216,f16:row,f16:column,f16:column,f16:column,1,0,serial,1,1,heuristic,tensorop,f16,128,256,32,1,1,1,2,2,4,1,16,8,8,75,1024,1434451968,5566881595392,3880,24.5379,54.4438,226869
1,CUTLASS,gemm,cutlass_tensorop_h1688gemm_128x256_32x2_tn_align4,passed,success,universal,8192,36864,9216,f16:row,f16:column,f16:column,f16:column,1,0,serial,1,1,heuristic,tensorop,f16,128,256,32,1,1,1,2,2,4,1,16,8,8,75,1024,1434451968,5566881595392,3880,24.2311,55.1331,229741
1,CUTLASS,gemm,cutlass_tensorop_h1688gemm_128x256_32x2_tn_align2,passed,success,universal,8192,36864,9216,f16:row,f16:column,f16:column,f16:column,1,0,serial,1,1,heuristic,tensorop,f16,128,256,32,1,1,1,2,2,4,1,16,8,8,75,1024,1434451968,5566881595392,3880,26.9054,49.6531,206906
1,CUTLASS,gemm,cutlass_tensorop_h1688gemm_128x256_32x2_tn_align1,passed,success,universal,8192,36864,9216,f16:row,f16:column,f16:column,f16:column,1,0,serial,1,1,heuristic,tensorop,f16,128,256,32,1,1,1,2,2,4,1,16,8,8,75,1024,1434451968,5566881595392,3880,37.9304,35.2208,146766
1,CUTLASS,gemm,cutlass_tensorop_h1688gemm_128x128_32x2_tn_align8,passed,success,universal,8192,36864,9216,f16:row,f16:column,f16:column,f16:column,1,0,serial,1,1,heuristic,tensorop,f16,128,128,32,1,1,1,2,2,2,1,16,8,8,75,1024,1434451968,5566881595392,3880,21.5214,62.0748,258667
1,CUTLASS,gemm,cutlass_tensorop_h1688gemm_128x128_32x2_tn_align4,passed,success,universal,8192,36864,9216,f16:row,f16:column,f16:column,f16:column,1,0,serial,1,1,heuristic,tensorop,f16,128,128,32,1,1,1,2,2,2,1,16,8,8,75,1024,1434451968,5566881595392,3880,25.6397,52.1042,217119
1,CUTLASS,gemm,cutlass_tensorop_h1688gemm_128x128_32x2_tn_align2,passed,success,universal,8192,36864,9216,f16:row,f16:column,f16:column,f16:column,1,0,serial,1,1,heuristic,tensorop,f16,128,128,32,1,1,1,2,2,2,1,16,8,8,75,1024,1434451968,5566881595392,3880,25.6063,52.1721,217402
1,CUTLASS,gemm,cutlass_tensorop_h1688gemm_128x128_32x2_tn_align1,passed,success,universal,8192,36864,9216,f16:row,f16:column,f16:column,f16:column,1,0,serial,1,1,heuristic,tensorop,f16,128,128,32,1,1,1,2,2,2,1,16,8,8,75,1024,1434451968,5566881595392,3880,38.0964,35.0673,146126
1,CUTLASS,gemm,cutlass_tensorop_h1688gemm_64x256_32x2_tn_align8,passed,success,universal,8192,36864,9216,f16:row,f16:column,f16:column,f16:column,1,0,serial,1,1,heuristic,tensorop,f16,64,256,32,1,1,1,2,1,4,1,16,8,8,75,1024,1434451968,5566881595392,3880,24.3384,54.89,228728
1,CUTLASS,gemm,cutlass_tensorop_h1688gemm_64x256_32x2_tn_align4,passed,success,universal,8192,36864,9216,f16:row,f16:column,f16:column,f16:column,1,0,serial,1,1,heuristic,tensorop,f16,64,256,32,1,1,1,2,1,4,1,16,8,8,75,1024,1434451968,5566881595392,3880,25.7861,51.8085,215887
1,CUTLASS,gemm,cutlass_tensorop_h1688gemm_64x256_32x2_tn_align2,passed,success,universal,8192,36864,9216,f16:row,f16:column,f16:column,f16:column,1,0,serial,1,1,heuristic,tensorop,f16,64,256,32,1,1,1,2,1,4,1,16,8,8,75,1024,1434451968,5566881595392,3880,29.519,45.2569,188587
1,CUTLASS,gemm,cutlass_tensorop_h1688gemm_64x256_32x2_tn_align1,passed,success,universal,8192,36864,9216,f16:row,f16:column,f16:column,f16:column,1,0,serial,1,1,heuristic,tensorop,f16,64,256,32,1,1,1,2,1,4,1,16,8,8,75,1024,1434451968,5566881595392,3880,47.34,28.22,117594
1,CUTLASS,gemm,cutlass_tensorop_h1688gemm_256x64_32x2_tn_align8,passed,success,universal,8192,36864,9216,f16:row,f16:column,f16:column,f16:column,1,0,serial,1,1,heuristic,tensorop,f16,256,64,32,1,1,1,2,4,1,1,16,8,8,75,1024,1434451968,5566881595392,3880,26.7168,50.0037,208367
1,CUTLASS,gemm,cutlass_tensorop_h1688gemm_256x64_32x2_tn_align4,passed,success,universal,8192,36864,9216,f16:row,f16:column,f16:column,f16:column,1,0,serial,1,1,heuristic,tensorop,f16,256,64,32,1,1,1,2,4,1,1,16,8,8,75,1024,1434451968,5566881595392,3880,29.591,45.1467,188127
1,CUTLASS,gemm,cutlass_tensorop_h1688gemm_256x64_32x2_tn_align2,passed,success,universal,8192,36864,9216,f16:row,f16:column,f16:column,f16:column,1,0,serial,1,1,heuristic,tensorop,f16,256,64,32,1,1,1,2,4,1,1,16,8,8,75,1024,1434451968,5566881595392,3880,30.2267,44.1973,184171
1,CUTLASS,gemm,cutlass_tensorop_h1688gemm_256x64_32x2_tn_align1,passed,success,universal,8192,36864,9216,f16:row,f16:column,f16:column,f16:column,1,0,serial,1,1,heuristic,tensorop,f16,256,64,32,1,1,1,2,4,1,1,16,8,8,75,1024,1434451968,5566881595392,3880,46.6803,28.6189,119256
1,CUTLASS,gemm,cutlass_tensorop_h1688gemm_64x128_32x2_tn_align8,passed,success,universal,8192,36864,9216,f16:row,f16:column,f16:column,f16:column,1,0,serial,1,1,heuristic,tensorop,f16,64,128,32,1,1,1,2,2,2,1,16,8,8,75,1024,1434451968,5566881595392,3880,28.5197,46.8426,195194
1,CUTLASS,gemm,cutlass_tensorop_h1688gemm_64x128_32x2_tn_align4,passed,success,universal,8192,36864,9216,f16:row,f16:column,f16:column,f16:column,1,0,serial,1,1,heuristic,tensorop,f16,64,128,32,1,1,1,2,2,2,1,16,8,8,75,1024,1434451968,5566881595392,3880,36.486,36.615,152576
1,CUTLASS,gemm,cutlass_tensorop_h1688gemm_64x128_32x2_tn_align2,passed,success,universal,8192,36864,9216,f16:row,f16:column,f16:column,f16:column,1,0,serial,1,1,heuristic,tensorop,f16,64,128,32,1,1,1,2,2,2,1,16,8,8,75,1024,1434451968,5566881595392,3880,35.2732,37.874,157822
1,CUTLASS,gemm,cutlass_tensorop_h1688gemm_64x128_32x2_tn_align1,passed,success,universal,8192,36864,9216,f16:row,f16:column,f16:column,f16:column,1,0,serial,1,1,heuristic,tensorop,f16,64,128,32,1,1,1,2,2,2,1,16,8,8,75,1024,1434451968,5566881595392,3880,55.7586,23.9593,99838.9
1,CUTLASS,gemm,cutlass_tensorop_h1688gemm_128x64_32x2_tn_align8,passed,success,universal,8192,36864,9216,f16:row,f16:column,f16:column,f16:column,1,0,serial,1,1,heuristic,tensorop,f16,128,64,32,1,1,1,2,2,2,1,16,8,8,75,1024,1434451968,5566881595392,3880,29.0487,45.9895,191639
1,CUTLASS,gemm,cutlass_tensorop_h1688gemm_128x64_32x2_tn_align4,passed,success,universal,8192,36864,9216,f16:row,f16:column,f16:column,f16:column,1,0,serial,1,1,heuristic,tensorop,f16,128,64,32,1,1,1,2,2,2,1,16,8,8,75,1024,1434451968,5566881595392,3880,33.0818,40.3829,168276
1,CUTLASS,gemm,cutlass_tensorop_h1688gemm_128x64_32x2_tn_align2,passed,success,universal,8192,36864,9216,f16:row,f16:column,f16:column,f16:column,1,0,serial,1,1,heuristic,tensorop,f16,128,64,32,1,1,1,2,2,2,1,16,8,8,75,1024,1434451968,5566881595392,3880,37.3431,35.7747,149074
1,CUTLASS,gemm,cutlass_tensorop_h1688gemm_128x64_32x2_tn_align1,passed,success,universal,8192,36864,9216,f16:row,f16:column,f16:column,f16:column,1,0,serial,1,1,heuristic,tensorop,f16,128,64,32,1,1,1,2,2,2,1,16,8,8,75,1024,1434451968,5566881595392,3880,55.7175,23.977,99912.7
1,CUTLASS,gemm,cutlass_tensorop_h1688gemm_64x64_32x2_tn_align8,passed,success,universal,8192,36864,9216,f16:row,f16:column,f16:column,f16:column,1,0,serial,1,1,heuristic,tensorop,f16,64,64,32,1,1,1,2,2,2,1,16,8,8,75,1024,1434451968,5566881595392,3880,36.9372,36.1678,150712
1,CUTLASS,gemm,cutlass_tensorop_h1688gemm_64x64_32x2_tn_align4,passed,success,universal,8192,36864,9216,f16:row,f16:column,f16:column,f16:column,1,0,serial,1,1,heuristic,tensorop,f16,64,64,32,1,1,1,2,2,2,1,16,8,8,75,1024,1434451968,5566881595392,3880,42.6714,31.3076,130459
1,CUTLASS,gemm,cutlass_tensorop_h1688gemm_64x64_32x2_tn_align2,passed,success,universal,8192,36864,9216,f16:row,f16:column,f16:column,f16:column,1,0,serial,1,1,heuristic,tensorop,f16,64,64,32,1,1,1,2,2,2,1,16,8,8,75,1024,1434451968,5566881595392,3880,47.5219,28.1121,117144
1,CUTLASS,gemm,cutlass_tensorop_h1688gemm_64x64_32x2_tn_align1,passed,success,universal,8192,36864,9216,f16:row,f16:column,f16:column,f16:column,1,0,serial,1,1,heuristic,tensorop,f16,64,64,32,1,1,1,2,2,2,1,16,8,8,75,1024,1434451968,5566881595392,3880,74.9176,17.8321,74306.7
1,CUTLASS,gemm,cutlass_tensorop_h1688gemm_64x128_64x2_tn_align8,passed,success,universal,8192,36864,9216,f16:row,f16:column,f16:column,f16:column,1,0,serial,1,1,heuristic,tensorop,f16,64,128,64,1,1,1,2,1,2,2,16,8,8,75,1024,1434451968,5566881595392,3880,26.5322,50.3516,209816
1,CUTLASS,gemm,cutlass_tensorop_h1688gemm_64x128_64x2_tn_align4,passed,success,universal,8192,36864,9216,f16:row,f16:column,f16:column,f16:column,1,0,serial,1,1,heuristic,tensorop,f16,64,128,64,1,1,1,2,1,2,2,16,8,8,75,1024,1434451968,5566881595392,3880,26.9543,49.563,206530
1,CUTLASS,gemm,cutlass_tensorop_h1688gemm_64x128_64x2_tn_align2,passed,success,universal,8192,36864,9216,f16:row,f16:column,f16:column,f16:column,1,0,serial,1,1,heuristic,tensorop,f16,64,128,64,1,1,1,2,1,2,2,16,8,8,75,1024,1434451968,5566881595392,3880,27.4718,48.6295,202640
1,CUTLASS,gemm,cutlass_tensorop_h1688gemm_64x128_64x2_tn_align1,passed,success,universal,8192,36864,9216,f16:row,f16:column,f16:column,f16:column,1,0,serial,1,1,heuristic,tensorop,f16,64,128,64,1,1,1,2,1,2,2,16,8,8,75,1024,1434451968,5566881595392,3880,33.5182,39.8571,166085
1,CUTLASS,gemm,cutlass_tensorop_h1688gemm_256x128_32x2_tt_align8,passed,success,universal,8192,36864,9216,f16:row,f16:row,f16:column,f16:column,1,0,serial,1,1,heuristic,tensorop,f16,256,128,32,1,1,1,2,4,2,1,16,8,8,75,1024,1434451968,5566881595392,3880,24.479,54.5748,227414
1,CUTLASS,gemm,cutlass_tensorop_h1688gemm_256x128_32x2_tt_align4,passed,success,universal,8192,36864,9216,f16:row,f16:row,f16:column,f16:column,1,0,serial,1,1,heuristic,tensorop,f16,256,128,32,1,1,1,2,4,2,1,16,8,8,75,1024,1434451968,5566881595392,3880,27.2929,48.9482,203968
1,CUTLASS,gemm,cutlass_tensorop_h1688gemm_256x128_32x2_tt_align2,passed,success,universal,8192,36864,9216,f16:row,f16:row,f16:column,f16:column,1,0,serial,1,1,heuristic,tensorop,f16,256,128,32,1,1,1,2,4,2,1,16,8,8,75,1024,1434451968,5566881595392,3880,25.6081,52.1686,217388
1,CUTLASS,gemm,cutlass_tensorop_h1688gemm_256x128_32x2_tt_align1,passed,success,universal,8192,36864,9216,f16:row,f16:row,f16:column,f16:column,1,0,serial,1,1,heuristic,tensorop,f16,256,128,32,1,1,1,2,4,2,1,16,8,8,75,1024,1434451968,5566881595392,3880,27.9825,47.7418,198941
1,CUTLASS,gemm,cutlass_tensorop_h1688gemm_128x256_32x2_tt_align8,passed,success,universal,8192,36864,9216,f16:row,f16:row,f16:column,f16:column,1,0,serial,1,1,heuristic,tensorop,f16,128,256,32,1,1,1,2,2,4,1,16,8,8,75,1024,1434451968,5566881595392,3880,23.0602,57.9327,241407
1,CUTLASS,gemm,cutlass_tensorop_h1688gemm_128x256_32x2_tt_align4,passed,success,universal,8192,36864,9216,f16:row,f16:row,f16:column,f16:column,1,0,serial,1,1,heuristic,tensorop,f16,128,256,32,1,1,1,2,2,4,1,16,8,8,75,1024,1434451968,5566881595392,3880,26.1514,51.0847,212871
1,CUTLASS,gemm,cutlass_tensorop_h1688gemm_128x256_32x2_tt_align2,passed,success,universal,8192,36864,9216,f16:row,f16:row,f16:column,f16:column,1,0,serial,1,1,heuristic,tensorop,f16,128,256,32,1,1,1,2,2,4,1,16,8,8,75,1024,1434451968,5566881595392,3880,26.591,50.2402,209352
1,CUTLASS,gemm,cutlass_tensorop_h1688gemm_128x256_32x2_tt_align1,passed,success,universal,8192,36864,9216,f16:row,f16:row,f16:column,f16:column,1,0,serial,1,1,heuristic,tensorop,f16,128,256,32,1,1,1,2,2,4,1,16,8,8,75,1024,1434451968,5566881595392,3880,33.453,39.9347,166409
1,CUTLASS,gemm,cutlass_tensorop_h1688gemm_128x128_32x2_tt_align8,passed,success,universal,8192,36864,9216,f16:row,f16:row,f16:column,f16:column,1,0,serial,1,1,heuristic,tensorop,f16,128,128,32,1,1,1,2,2,2,1,16,8,8,75,1024,1434451968,5566881595392,3880,21.9237,60.9357,253920
1,CUTLASS,gemm,cutlass_tensorop_h1688gemm_128x128_32x2_tt_align4,passed,success,universal,8192,36864,9216,f16:row,f16:row,f16:column,f16:column,1,0,serial,1,1,heuristic,tensorop,f16,128,128,32,1,1,1,2,2,2,1,16,8,8,75,1024,1434451968,5566881595392,3880,25.2749,52.8563,220254
1,CUTLASS,gemm,cutlass_tensorop_h1688gemm_128x128_32x2_tt_align2,passed,success,universal,8192,36864,9216,f16:row,f16:row,f16:column,f16:column,1,0,serial,1,1,heuristic,tensorop,f16,128,128,32,1,1,1,2,2,2,1,16,8,8,75,1024,1434451968,5566881595392,3880,23.9266,55.8349,232665
1,CUTLASS,gemm,cutlass_tensorop_h1688gemm_128x128_32x2_tt_align1,passed,success,universal,8192,36864,9216,f16:row,f16:row,f16:column,f16:column,1,0,serial,1,1,heuristic,tensorop,f16,128,128,32,1,1,1,2,2,2,1,16,8,8,75,1024,1434451968,5566881595392,3880,31.1119,42.9398,178931
1,CUTLASS,gemm,cutlass_tensorop_h1688gemm_64x256_32x2_tt_align8,passed,success,universal,8192,36864,9216,f16:row,f16:row,f16:column,f16:column,1,0,serial,1,1,heuristic,tensorop,f16,64,256,32,1,1,1,2,1,4,1,16,8,8,75,1024,1434451968,5566881595392,3880,24.6956,54.0962,225420
1,CUTLASS,gemm,cutlass_tensorop_h1688gemm_64x256_32x2_tt_align4,passed,success,universal,8192,36864,9216,f16:row,f16:row,f16:column,f16:column,1,0,serial,1,1,heuristic,tensorop,f16,64,256,32,1,1,1,2,1,4,1,16,8,8,75,1024,1434451968,5566881595392,3880,26.5511,50.3157,209667
1,CUTLASS,gemm,cutlass_tensorop_h1688gemm_64x256_32x2_tt_align2,passed,success,universal,8192,36864,9216,f16:row,f16:row,f16:column,f16:column,1,0,serial,1,1,heuristic,tensorop,f16,64,256,32,1,1,1,2,1,4,1,16,8,8,75,1024,1434451968,5566881595392,3880,29.0059,46.0574,191922
1,CUTLASS,gemm,cutlass_tensorop_h1688gemm_64x256_32x2_tt_align1,passed,success,universal,8192,36864,9216,f16:row,f16:row,f16:column,f16:column,1,0,serial,1,1,heuristic,tensorop,f16,64,256,32,1,1,1,2,1,4,1,16,8,8,75,1024,1434451968,5566881595392,3880,43.5468,30.6782,127837
1,CUTLASS,gemm,cutlass_tensorop_h1688gemm_256x64_32x2_tt_align8,passed,success,universal,8192,36864,9216,f16:row,f16:row,f16:column,f16:column,1,0,serial,1,1,heuristic,tensorop,f16,256,64,32,1,1,1,2,4,1,1,16,8,8,75,1024,1434451968,5566881595392,3880,26.6885,50.0567,208587
1,CUTLASS,gemm,cutlass_tensorop_h1688gemm_256x64_32x2_tt_align4,passed,success,universal,8192,36864,9216,f16:row,f16:row,f16:column,f16:column,1,0,serial,1,1,heuristic,tensorop,f16,256,64,32,1,1,1,2,4,1,1,16,8,8,75,1024,1434451968,5566881595392,3880,29.3843,45.4643,189451
1,CUTLASS,gemm,cutlass_tensorop_h1688gemm_256x64_32x2_tt_align2,passed,success,universal,8192,36864,9216,f16:row,f16:row,f16:column,f16:column,1,0,serial,1,1,heuristic,tensorop,f16,256,64,32,1,1,1,2,4,1,1,16,8,8,75,1024,1434451968,5566881595392,3880,28.6559,46.62,194266
1,CUTLASS,gemm,cutlass_tensorop_h1688gemm_256x64_32x2_tt_align1,passed,success,universal,8192,36864,9216,f16:row,f16:row,f16:column,f16:column,1,0,serial,1,1,heuristic,tensorop,f16,256,64,32,1,1,1,2,4,1,1,16,8,8,75,1024,1434451968,5566881595392,3880,34.4044,38.8305,161807
1,CUTLASS,gemm,cutlass_tensorop_h1688gemm_64x128_32x2_tt_align8,passed,success,universal,8192,36864,9216,f16:row,f16:row,f16:column,f16:column,1,0,serial,1,1,heuristic,tensorop,f16,64,128,32,1,1,1,2,2,2,1,16,8,8,75,1024,1434451968,5566881595392,3880,29.6104,45.1172,188004
1,CUTLASS,gemm,cutlass_tensorop_h1688gemm_64x128_32x2_tt_align4,passed,success,universal,8192,36864,9216,f16:row,f16:row,f16:column,f16:column,1,0,serial,1,1,heuristic,tensorop,f16,64,128,32,1,1,1,2,2,2,1,16,8,8,75,1024,1434451968,5566881595392,3880,37.1555,35.9553,149826
1,CUTLASS,gemm,cutlass_tensorop_h1688gemm_64x128_32x2_tt_align2,passed,success,universal,8192,36864,9216,f16:row,f16:row,f16:column,f16:column,1,0,serial,1,1,heuristic,tensorop,f16,64,128,32,1,1,1,2,2,2,1,16,8,8,75,1024,1434451968,5566881595392,3880,33.7369,39.5987,165009
1,CUTLASS,gemm,cutlass_tensorop_h1688gemm_64x128_32x2_tt_align1,passed,success,universal,8192,36864,9216,f16:row,f16:row,f16:column,f16:column,1,0,serial,1,1,heuristic,tensorop,f16,64,128,32,1,1,1,2,2,2,1,16,8,8,75,1024,1434451968,5566881595392,3880,48.4344,27.5824,114936
1,CUTLASS,gemm,cutlass_tensorop_h1688gemm_128x64_32x2_tt_align8,passed,success,universal,8192,36864,9216,f16:row,f16:row,f16:column,f16:column,1,0,serial,1,1,heuristic,tensorop,f16,128,64,32,1,1,1,2,2,2,1,16,8,8,75,1024,1434451968,5566881595392,3880,30.8375,43.3219,180523
1,CUTLASS,gemm,cutlass_tensorop_h1688gemm_128x64_32x2_tt_align4,passed,success,universal,8192,36864,9216,f16:row,f16:row,f16:column,f16:column,1,0,serial,1,1,heuristic,tensorop,f16,128,64,32,1,1,1,2,2,2,1,16,8,8,75,1024,1434451968,5566881595392,3880,32.139,41.5675,173213
1,CUTLASS,gemm,cutlass_tensorop_h1688gemm_128x64_32x2_tt_align2,passed,success,universal,8192,36864,9216,f16:row,f16:row,f16:column,f16:column,1,0,serial,1,1,heuristic,tensorop,f16,128,64,32,1,1,1,2,2,2,1,16,8,8,75,1024,1434451968,5566881595392,3880,33.3997,39.9985,166675
1,CUTLASS,gemm,cutlass_tensorop_h1688gemm_128x64_32x2_tt_align1,passed,success,universal,8192,36864,9216,f16:row,f16:row,f16:column,f16:column,1,0,serial,1,1,heuristic,tensorop,f16,128,64,32,1,1,1,2,2,2,1,16,8,8,75,1024,1434451968,5566881595392,3880,42.9314,31.118,129669
1,CUTLASS,gemm,cutlass_tensorop_h1688gemm_64x64_32x2_tt_align8,passed,success,universal,8192,36864,9216,f16:row,f16:row,f16:column,f16:column,1,0,serial,1,1,heuristic,tensorop,f16,64,64,32,1,1,1,2,2,2,1,16,8,8,75,1024,1434451968,5566881595392,3880,39.5053,33.8167,140915
1,CUTLASS,gemm,cutlass_tensorop_h1688gemm_64x64_32x2_tt_align4,passed,success,universal,8192,36864,9216,f16:row,f16:row,f16:column,f16:column,1,0,serial,1,1,heuristic,tensorop,f16,64,64,32,1,1,1,2,2,2,1,16,8,8,75,1024,1434451968,5566881595392,3880,40.3275,33.1272,138042
1,CUTLASS,gemm,cutlass_tensorop_h1688gemm_64x64_32x2_tt_align2,passed,success,universal,8192,36864,9216,f16:row,f16:row,f16:column,f16:column,1,0,serial,1,1,heuristic,tensorop,f16,64,64,32,1,1,1,2,2,2,1,16,8,8,75,1024,1434451968,5566881595392,3880,44.4129,30.0799,125344
1,CUTLASS,gemm,cutlass_tensorop_h1688gemm_64x64_32x2_tt_align1,passed,success,universal,8192,36864,9216,f16:row,f16:row,f16:column,f16:column,1,0,serial,1,1,heuristic,tensorop,f16,64,64,32,1,1,1,2,2,2,1,16,8,8,75,1024,1434451968,5566881595392,3880,60.2758,22.1637,92356.8
1,CUTLASS,gemm,cutlass_tensorop_h1688gemm_64x128_64x2_tt_align8,passed,success,universal,8192,36864,9216,f16:row,f16:row,f16:column,f16:column,1,0,serial,1,1,heuristic,tensorop,f16,64,128,64,1,1,1,2,1,2,2,16,8,8,75,1024,1434451968,5566881595392,3880,28.4782,46.911,195479
1,CUTLASS,gemm,cutlass_tensorop_h1688gemm_64x128_64x2_tt_align4,passed,success,universal,8192,36864,9216,f16:row,f16:row,f16:column,f16:column,1,0,serial,1,1,heuristic,tensorop,f16,64,128,64,1,1,1,2,1,2,2,16,8,8,75,1024,1434451968,5566881595392,3880,29.0173,46.0394,191847
1,CUTLASS,gemm,cutlass_tensorop_h1688gemm_64x128_64x2_tt_align2,passed,success,universal,8192,36864,9216,f16:row,f16:row,f16:column,f16:column,1,0,serial,1,1,heuristic,tensorop,f16,64,128,64,1,1,1,2,1,2,2,16,8,8,75,1024,1434451968,5566881595392,3880,29.7659,44.8814,187022
1,CUTLASS,gemm,cutlass_tensorop_h1688gemm_64x128_64x2_tt_align1,passed,success,universal,8192,36864,9216,f16:row,f16:row,f16:column,f16:column,1,0,serial,1,1,heuristic,tensorop,f16,64,128,64,1,1,1,2,1,2,2,16,8,8,75,1024,1434451968,5566881595392,3880,33.4358,39.9554,166495
1,CUTLASS,gemm,cutlass_tensorop_h16816gemm_256x128_32x3_nn_align8,passed,success,universal,8192,36864,9216,f16:column,f16:column,f16:column,f16:column,1,0,serial,1,1,heuristic,tensorop,f16,256,128,32,1,1,1,3,4,2,1,16,8,16,80,1024,1434451968,5566881595392,3880,18.0044,74.2007,309196
1,CUTLASS,gemm,cutlass_tensorop_h16816gemm_256x128_32x3_nn_align4,passed,success,universal,8192,36864,9216,f16:column,f16:column,f16:column,f16:column,1,0,serial,1,1,heuristic,tensorop,f16,256,128,32,1,1,1,3,4,2,1,16,8,16,80,1024,1434451968,5566881595392,3880,18.5107,72.1709,300738
1,CUTLASS,gemm,cutlass_tensorop_h16816gemm_256x128_32x3_nn_align2,passed,success,universal,8192,36864,9216,f16:column,f16:column,f16:column,f16:column,1,0,serial,1,1,heuristic,tensorop,f16,256,128,32,1,1,1,3,4,2,1,16,8,16,80,1024,1434451968,5566881595392,3880,20.2107,66.1005,275442
1,CUTLASS,gemm,cutlass_tensorop_h16816gemm_128x256_32x3_nn_align8,passed,success,universal,8192,36864,9216,f16:column,f16:column,f16:column,f16:column,1,0,serial,1,1,heuristic,tensorop,f16,128,256,32,1,1,1,3,2,4,1,16,8,16,80,1024,1434451968,5566881595392,3880,17.4067,76.7486,319813
1,CUTLASS,gemm,cutlass_tensorop_h16816gemm_128x256_32x3_nn_align4,passed,success,universal,8192,36864,9216,f16:column,f16:column,f16:column,f16:column,1,0,serial,1,1,heuristic,tensorop,f16,128,256,32,1,1,1,3,2,4,1,16,8,16,80,1024,1434451968,5566881595392,3880,17.9049,74.6129,310914
1,CUTLASS,gemm,cutlass_tensorop_h16816gemm_128x256_32x3_nn_align2,passed,success,universal,8192,36864,9216,f16:column,f16:column,f16:column,f16:column,1,0,serial,1,1,heuristic,tensorop,f16,128,256,32,1,1,1,3,2,4,1,16,8,16,80,1024,1434451968,5566881595392,3880,18.6289,71.7131,298830
1,CUTLASS,gemm,cutlass_tensorop_h16816gemm_256x64_32x3_nn_align8,passed,success,universal,8192,36864,9216,f16:column,f16:column,f16:column,f16:column,1,0,serial,1,1,heuristic,tensorop,f16,256,64,32,1,1,1,3,4,1,1,16,8,16,80,1024,1434451968,5566881595392,3880,23.2083,57.563,239866
1,CUTLASS,gemm,cutlass_tensorop_h16816gemm_256x64_32x3_nn_align4,passed,success,universal,8192,36864,9216,f16:column,f16:column,f16:column,f16:column,1,0,serial,1,1,heuristic,tensorop,f16,256,64,32,1,1,1,3,4,1,1,16,8,16,80,1024,1434451968,5566881595392,3880,23.9575,55.7629,232365
1,CUTLASS,gemm,cutlass_tensorop_h16816gemm_256x64_32x3_nn_align2,passed,success,universal,8192,36864,9216,f16:column,f16:column,f16:column,f16:column,1,0,serial,1,1,heuristic,tensorop,f16,256,64,32,1,1,1,3,4,1,1,16,8,16,80,1024,1434451968,5566881595392,3880,48.333,27.6403,115178
1,CUTLASS,gemm,cutlass_tensorop_h16816gemm_256x64_32x4_nn_align8,passed,success,universal,8192,36864,9216,f16:column,f16:column,f16:column,f16:column,1,0,serial,1,1,heuristic,tensorop,f16,256,64,32,1,1,1,4,4,1,1,16,8,16,80,1024,1434451968,5566881595392,3880,22.9513,58.2074,242552
1,CUTLASS,gemm,cutlass_tensorop_h16816gemm_256x64_32x4_nn_align4,passed,success,universal,8192,36864,9216,f16:column,f16:column,f16:column,f16:column,1,0,serial,1,1,heuristic,tensorop,f16,256,64,32,1,1,1,4,4,1,1,16,8,16,80,1024,1434451968,5566881595392,3880,25.7764,51.828,215968
1,CUTLASS,gemm,cutlass_tensorop_h16816gemm_256x64_32x4_nn_align2,passed,success,universal,8192,36864,9216,f16:column,f16:column,f16:column,f16:column,1,0,serial,1,1,heuristic,tensorop,f16,256,64,32,1,1,1,4,4,1,1,16,8,16,80,1024,1434451968,5566881595392,3880,60.7423,21.9935,91647.5
1,CUTLASS,gemm,cutlass_tensorop_h16816gemm_64x256_32x4_nn_align8,passed,success,universal,8192,36864,9216,f16:column,f16:column,f16:column,f16:column,1,0,serial,1,1,heuristic,tensorop,f16,64,256,32,1,1,1,4,1,4,1,16,8,16,80,1024,1434451968,5566881595392,3880,21.7984,61.286,255380
1,CUTLASS,gemm,cutlass_tensorop_h16816gemm_64x256_32x4_nn_align4,passed,success,universal,8192,36864,9216,f16:column,f16:column,f16:column,f16:column,1,0,serial,1,1,heuristic,tensorop,f16,64,256,32,1,1,1,4,1,4,1,16,8,16,80,1024,1434451968,5566881595392,3880,22.5201,59.322,247196
1,CUTLASS,gemm,cutlass_tensorop_h16816gemm_64x256_32x4_nn_align2,passed,success,universal,8192,36864,9216,f16:column,f16:column,f16:column,f16:column,1,0,serial,1,1,heuristic,tensorop,f16,64,256,32,1,1,1,4,1,4,1,16,8,16,80,1024,1434451968,5566881595392,3880,23.5906,56.6301,235979
1,CUTLASS,gemm,cutlass_tensorop_h16816gemm_128x128_32x3_nn_align8,passed,success,universal,8192,36864,9216,f16:column,f16:column,f16:column,f16:column,1,0,serial,1,1,heuristic,tensorop,f16,128,128,32,1,1,1,3,2,2,1,16,8,16,80,1024,1434451968,5566881595392,3880,19.07,70.0546,291919
1,CUTLASS,gemm,cutlass_tensorop_h16816gemm_128x128_32x3_nn_align4,passed,success,universal,8192,36864,9216,f16:column,f16:column,f16:column,f16:column,1,0,serial,1,1,heuristic,tensorop,f16,128,128,32,1,1,1,3,2,2,1,16,8,16,80,1024,1434451968,5566881595392,3880,19.9242,67.0511,279403
1,CUTLASS,gemm,cutlass_tensorop_h16816gemm_128x128_32x3_nn_align2,passed,success,universal,8192,36864,9216,f16:column,f16:column,f16:column,f16:column,1,0,serial,1,1,heuristic,tensorop,f16,128,128,32,1,1,1,3,2,2,1,16,8,16,80,1024,1434451968,5566881595392,3880,22.0895,60.4784,252015
1,CUTLASS,gemm,cutlass_tensorop_h16816gemm_128x128_32x4_nn_align8,passed,success,universal,8192,36864,9216,f16:column,f16:column,f16:column,f16:column,1,0,serial,1,1,heuristic,tensorop,f16,128,128,32,1,1,1,4,2,2,1,16,8,16,80,1024,1434451968,5566881595392,3880,19.0839,70.0034,291706
1,CUTLASS,gemm,cutlass_tensorop_h16816gemm_128x128_32x4_nn_align4,passed,success,universal,8192,36864,9216,f16:column,f16:column,f16:column,f16:column,1,0,serial,1,1,heuristic,tensorop,f16,128,128,32,1,1,1,4,2,2,1,16,8,16,80,1024,1434451968,5566881595392,3880,20.5875,64.8906,270400
1,CUTLASS,gemm,cutlass_tensorop_h16816gemm_128x128_32x4_nn_align2,passed,success,universal,8192,36864,9216,f16:column,f16:column,f16:column,f16:column,1,0,serial,1,1,heuristic,tensorop,f16,128,128,32,1,1,1,4,2,2,1,16,8,16,80,1024,1434451968,5566881595392,3880,22.6779,58.9092,245476
1,CUTLASS,gemm,cutlass_tensorop_h16816gemm_128x128_32x5_nn_align8,passed,success,universal,8192,36864,9216,f16:column,f16:column,f16:column,f16:column,1,0,serial,1,1,heuristic,tensorop,f16,128,128,32,1,1,1,5,2,2,1,16,8,16,80,1024,1434451968,5566881595392,3880,19.0551,70.1092,292146
1,CUTLASS,gemm,cutlass_tensorop_h16816gemm_128x128_32x5_nn_align4,passed,success,universal,8192,36864,9216,f16:column,f16:column,f16:column,f16:column,1,0,serial,1,1,heuristic,tensorop,f16,128,128,32,1,1,1,5,2,2,1,16,8,16,80,1024,1434451968,5566881595392,3880,20.5758,64.9278,270555
1,CUTLASS,gemm,cutlass_tensorop_h16816gemm_128x128_32x5_nn_align2,passed,success,universal,8192,36864,9216,f16:column,f16:column,f16:column,f16:column,1,0,serial,1,1,heuristic,tensorop,f16,128,128,32,1,1,1,5,2,2,1,16,8,16,80,1024,1434451968,5566881595392,3880,23.0263,58.018,241762
1,CUTLASS,gemm,cutlass_tensorop_h16816gemm_128x64_32x6_nn_align8,passed,success,universal,8192,36864,9216,f16:column,f16:column,f16:column,f16:column,1,0,serial,1,1,heuristic,tensorop,f16,128,64,32,1,1,1,6,2,2,1,16,8,16,80,1024,1434451968,5566881595392,3880,26.7706,49.9031,207947
1,CUTLASS,gemm,cutlass_tensorop_h16816gemm_128x64_32x6_nn_align4,passed,success,universal,8192,36864,9216,f16:column,f16:column,f16:column,f16:column,1,0,serial,1,1,heuristic,tensorop,f16,128,64,32,1,1,1,6,2,2,1,16,8,16,80,1024,1434451968,5566881595392,3880,29.0398,46.0037,191698
1,CUTLASS,gemm,cutlass_tensorop_h16816gemm_128x64_32x6_nn_align2,passed,success,universal,8192,36864,9216,f16:column,f16:column,f16:column,f16:column,1,0,serial,1,1,heuristic,tensorop,f16,128,64,32,1,1,1,6,2,2,1,16,8,16,80,1024,1434451968,5566881595392,3880,34.5671,38.6477,161046
1,CUTLASS,gemm,cutlass_tensorop_h16816gemm_64x128_32x6_nn_align8,passed,success,universal,8192,36864,9216,f16:column,f16:column,f16:column,f16:column,1,0,serial,1,1,heuristic,tensorop,f16,64,128,32,1,1,1,6,2,2,1,16,8,16,80,1024,1434451968,5566881595392,3880,26.2386,50.915,212164
1,CUTLASS,gemm,cutlass_tensorop_h16816gemm_64x128_32x6_nn_align4,passed,success,universal,8192,36864,9216,f16:column,f16:column,f16:column,f16:column,1,0,serial,1,1,heuristic,tensorop,f16,64,128,32,1,1,1,6,2,2,1,16,8,16,80,1024,1434451968,5566881595392,3880,27.1982,49.1187,204679
1,CUTLASS,gemm,cutlass_tensorop_h16816gemm_64x128_32x6_nn_align2,passed,success,universal,8192,36864,9216,f16:column,f16:column,f16:column,f16:column,1,0,serial,1,1,heuristic,tensorop,f16,64,128,32,1,1,1,6,2,2,1,16,8,16,80,1024,1434451968,5566881595392,3880,29.0028,46.0624,191943
1,CUTLASS,gemm,cutlass_tensorop_h16816gemm_64x64_32x10_nn_align8,passed,success,universal,8192,36864,9216,f16:column,f16:column,f16:column,f16:column,1,0,serial,1,1,heuristic,tensorop,f16,64,64,32,1,1,1,10,2,2,1,16,8,16,80,1024,1434451968,5566881595392,3880,34.6615,38.5424,160607
1,CUTLASS,gemm,cutlass_tensorop_h16816gemm_64x64_32x10_nn_align4,passed,success,universal,8192,36864,9216,f16:column,f16:column,f16:column,f16:column,1,0,serial,1,1,heuristic,tensorop,f16,64,64,32,1,1,1,10,2,2,1,16,8,16,80,1024,1434451968,5566881595392,3880,35.6792,37.443,156026
1,CUTLASS,gemm,cutlass_tensorop_h16816gemm_64x64_32x10_nn_align2,passed,success,universal,8192,36864,9216,f16:column,f16:column,f16:column,f16:column,1,0,serial,1,1,heuristic,tensorop,f16,64,64,32,1,1,1,10,2,2,1,16,8,16,80,1024,1434451968,5566881595392,3880,42.66,31.3159,130494
1,CUTLASS,gemm,cutlass_tensorop_h16816gemm_128x128_64x3_nn_align8,passed,success,universal,8192,36864,9216,f16:column,f16:column,f16:column,f16:column,1,0,serial,1,1,heuristic,tensorop,f16,128,128,64,1,1,1,3,2,2,1,16,8,16,80,1024,1434451968,5566881595392,3880,18.6795,71.519,298021
1,CUTLASS,gemm,cutlass_tensorop_h16816gemm_128x128_64x3_nn_align4,passed,success,universal,8192,36864,9216,f16:column,f16:column,f16:column,f16:column,1,0,serial,1,1,heuristic,tensorop,f16,128,128,64,1,1,1,3,2,2,1,16,8,16,80,1024,1434451968,5566881595392,3880,19.3643,68.9899,287482
1,CUTLASS,gemm,cutlass_tensorop_h16816gemm_128x128_64x3_nn_align2,passed,success,universal,8192,36864,9216,f16:column,f16:column,f16:column,f16:column,1,0,serial,1,1,heuristic,tensorop,f16,128,128,64,1,1,1,3,2,2,1,16,8,16,80,1024,1434451968,5566881595392,3880,21.6386,61.7387,257267
1,CUTLASS,gemm,cutlass_tensorop_h16816gemm_128x64_64x3_nn_align8,passed,success,universal,8192,36864,9216,f16:column,f16:column,f16:column,f16:column,1,0,serial,1,1,heuristic,tensorop,f16,128,64,64,1,1,1,3,2,2,1,16,8,16,80,1024,1434451968,5566881595392,3880,26.1278,51.1309,213064
1,CUTLASS,gemm,cutlass_tensorop_h16816gemm_128x64_64x3_nn_align4,passed,success,universal,8192,36864,9216,f16:column,f16:column,f16:column,f16:column,1,0,serial,1,1,heuristic,tensorop,f16,128,64,64,1,1,1,3,2,2,1,16,8,16,80,1024,1434451968,5566881595392,3880,27.3421,48.86,203601
1,CUTLASS,gemm,cutlass_tensorop_h16816gemm_128x64_64x3_nn_align2,passed,success,universal,8192,36864,9216,f16:column,f16:column,f16:column,f16:column,1,0,serial,1,1,heuristic,tensorop,f16,128,64,64,1,1,1,3,2,2,1,16,8,16,80,1024,1434451968,5566881595392,3880,28.7303,46.4993,193764
1,CUTLASS,gemm,cutlass_tensorop_h16816gemm_64x128_64x3_nn_align8,passed,success,universal,8192,36864,9216,f16:column,f16:column,f16:column,f16:column,1,0,serial,1,1,heuristic,tensorop,f16,64,128,64,1,1,1,3,2,2,1,16,8,16,80,1024,1434451968,5566881595392,3880,25.8522,51.676,215335
1,CUTLASS,gemm,cutlass_tensorop_h16816gemm_64x128_64x3_nn_align4,passed,success,universal,8192,36864,9216,f16:column,f16:column,f16:column,f16:column,1,0,serial,1,1,heuristic,tensorop,f16,64,128,64,1,1,1,3,2,2,1,16,8,16,80,1024,1434451968,5566881595392,3880,26.5223,50.3703,209894
1,CUTLASS,gemm,cutlass_tensorop_h16816gemm_64x128_64x3_nn_align2,passed,success,universal,8192,36864,9216,f16:column,f16:column,f16:column,f16:column,1,0,serial,1,1,heuristic,tensorop,f16,64,128,64,1,1,1,3,2,2,1,16,8,16,80,1024,1434451968,5566881595392,3880,27.9902,47.7287,198887
1,CUTLASS,gemm,cutlass_tensorop_h16816gemm_64x64_64x5_nn_align8,passed,success,universal,8192,36864,9216,f16:column,f16:column,f16:column,f16:column,1,0,serial,1,1,heuristic,tensorop,f16,64,64,64,1,1,1,5,2,2,1,16,8,16,80,1024,1434451968,5566881595392,3880,34.1486,39.1213,163019
1,CUTLASS,gemm,cutlass_tensorop_h16816gemm_64x64_64x5_nn_align4,passed,success,universal,8192,36864,9216,f16:column,f16:column,f16:column,f16:column,1,0,serial,1,1,heuristic,tensorop,f16,64,64,64,1,1,1,5,2,2,1,16,8,16,80,1024,1434451968,5566881595392,3880,35.1494,38.0074,158378
1,CUTLASS,gemm,cutlass_tensorop_h16816gemm_64x64_64x5_nn_align2,passed,success,universal,8192,36864,9216,f16:column,f16:column,f16:column,f16:column,1,0,serial,1,1,heuristic,tensorop,f16,64,64,64,1,1,1,5,2,2,1,16,8,16,80,1024,1434451968,5566881595392,3880,38.3266,34.8567,145249
1,CUTLASS,gemm,cutlass_tensorop_h16816gemm_256x128_32x3_nt_align8,passed,success,universal,8192,36864,9216,f16:column,f16:row,f16:column,f16:column,1,0,serial,1,1,heuristic,tensorop,f16,256,128,32,1,1,1,3,4,2,1,16,8,16,80,1024,1434451968,5566881595392,3880,17.4734,76.4553,318591
1,CUTLASS,gemm,cutlass_tensorop_h16816gemm_256x128_32x3_nt_align4,passed,success,universal,8192,36864,9216,f16:column,f16:row,f16:column,f16:column,1,0,serial,1,1,heuristic,tensorop,f16,256,128,32,1,1,1,3,4,2,1,16,8,16,80,1024,1434451968,5566881595392,3880,17.8995,74.6354,311007
1,CUTLASS,gemm,cutlass_tensorop_h16816gemm_256x128_32x3_nt_align2,passed,success,universal,8192,36864,9216,f16:column,f16:row,f16:column,f16:column,1,0,serial,1,1,heuristic,tensorop,f16,256,128,32,1,1,1,3,4,2,1,16,8,16,80,1024,1434451968,5566881595392,3880,18.5016,72.2066,300886
1,CUTLASS,gemm,cutlass_tensorop_h16816gemm_128x256_32x3_nt_align8,passed,success,universal,8192,36864,9216,f16:column,f16:row,f16:column,f16:column,1,0,serial,1,1,heuristic,tensorop,f16,128,256,32,1,1,1,3,2,4,1,16,8,16,80,1024,1434451968,5566881595392,3880,16.9753,78.6989,327940
1,CUTLASS,gemm,cutlass_tensorop_h16816gemm_128x256_32x3_nt_align4,passed,success,universal,8192,36864,9216,f16:column,f16:row,f16:column,f16:column,1,0,serial,1,1,heuristic,tensorop,f16,128,256,32,1,1,1,3,2,4,1,16,8,16,80,1024,1434451968,5566881595392,3880,17.8055,75.0294,312649
1,CUTLASS,gemm,cutlass_tensorop_h16816gemm_128x256_32x3_nt_align2,passed,success,universal,8192,36864,9216,f16:column,f16:row,f16:column,f16:column,1,0,serial,1,1,heuristic,tensorop,f16,128,256,32,1,1,1,3,2,4,1,16,8,16,80,1024,1434451968,5566881595392,3880,18.3708,72.7208,303029
1,CUTLASS,gemm,cutlass_tensorop_h16816gemm_256x64_32x3_nt_align8,passed,success,universal,8192,36864,9216,f16:column,f16:row,f16:column,f16:column,1,0,serial,1,1,heuristic,tensorop,f16,256,64,32,1,1,1,3,4,1,1,16,8,16,80,1024,1434451968,5566881595392,3880,26.7339,49.9717,208233
1,CUTLASS,gemm,cutlass_tensorop_h16816gemm_256x64_32x3_nt_align4,passed,success,universal,8192,36864,9216,f16:column,f16:row,f16:column,f16:column,1,0,serial,1,1,heuristic,tensorop,f16,256,64,32,1,1,1,3,4,1,1,16,8,16,80,1024,1434451968,5566881595392,3880,26.9452,49.5797,206600
1,CUTLASS,gemm,cutlass_tensorop_h16816gemm_256x64_32x3_nt_align2,passed,success,universal,8192,36864,9216,f16:column,f16:row,f16:column,f16:column,1,0,serial,1,1,heuristic,tensorop,f16,256,64,32,1,1,1,3,4,1,1,16,8,16,80,1024,1434451968,5566881595392,3880,27.8744,47.927,199713
1,CUTLASS,gemm,cutlass_tensorop_h16816gemm_256x64_32x4_nt_align8,passed,success,universal,8192,36864,9216,f16:column,f16:row,f16:column,f16:column,1,0,serial,1,1,heuristic,tensorop,f16,256,64,32,1,1,1,4,4,1,1,16,8,16,80,1024,1434451968,5566881595392,3880,26.7398,49.9606,208187
1,CUTLASS,gemm,cutlass_tensorop_h16816gemm_256x64_32x4_nt_align4,passed,success,universal,8192,36864,9216,f16:column,f16:row,f16:column,f16:column,1,0,serial,1,1,heuristic,tensorop,f16,256,64,32,1,1,1,4,4,1,1,16,8,16,80,1024,1434451968,5566881595392,3880,26.8305,49.7917,207483
1,CUTLASS,gemm,cutlass_tensorop_h16816gemm_256x64_32x4_nt_align2,passed,success,universal,8192,36864,9216,f16:column,f16:row,f16:column,f16:column,1,0,serial,1,1,heuristic,tensorop,f16,256,64,32,1,1,1,4,4,1,1,16,8,16,80,1024,1434451968,5566881595392,3880,27.9692,47.7646,199036
1,CUTLASS,gemm,cutlass_tensorop_h16816gemm_64x256_32x4_nt_align8,passed,success,universal,8192,36864,9216,f16:column,f16:row,f16:column,f16:column,1,0,serial,1,1,heuristic,tensorop,f16,64,256,32,1,1,1,4,1,4,1,16,8,16,80,1024,1434451968,5566881595392,3880,22.753,58.7149,244666
1,CUTLASS,gemm,cutlass_tensorop_h16816gemm_64x256_32x4_nt_align4,passed,success,universal,8192,36864,9216,f16:column,f16:row,f16:column,f16:column,1,0,serial,1,1,heuristic,tensorop,f16,64,256,32,1,1,1,4,1,4,1,16,8,16,80,1024,1434451968,5566881595392,3880,23.3089,57.3145,238831
1,CUTLASS,gemm,cutlass_tensorop_h16816gemm_64x256_32x4_nt_align2,passed,success,universal,8192,36864,9216,f16:column,f16:row,f16:column,f16:column,1,0,serial,1,1,heuristic,tensorop,f16,64,256,32,1,1,1,4,1,4,1,16,8,16,80,1024,1434451968,5566881595392,3880,24.1645,55.2852,230375
1,CUTLASS,gemm,cutlass_tensorop_h16816gemm_128x128_32x3_nt_align8,passed,success,universal,8192,36864,9216,f16:column,f16:row,f16:column,f16:column,1,0,serial,1,1,heuristic,tensorop,f16,128,128,32,1,1,1,3,2,2,1,16,8,16,80,1024,1434451968,5566881595392,3880,20.2591,65.9425,274784
1,CUTLASS,gemm,cutlass_tensorop_h16816gemm_128x128_32x3_nt_align4,passed,success,universal,8192,36864,9216,f16:column,f16:row,f16:column,f16:column,1,0,serial,1,1,heuristic,tensorop,f16,128,128,32,1,1,1,3,2,2,1,16,8,16,80,1024,1434451968,5566881595392,3880,20.7816,64.2847,267876
1,CUTLASS,gemm,cutlass_tensorop_h16816gemm_128x128_32x3_nt_align2,passed,success,universal,8192,36864,9216,f16:column,f16:row,f16:column,f16:column,1,0,serial,1,1,heuristic,tensorop,f16,128,128,32,1,1,1,3,2,2,1,16,8,16,80,1024,1434451968,5566881595392,3880,21.2813,62.7752,261586
1,CUTLASS,gemm,cutlass_tensorop_h16816gemm_128x128_32x4_nt_align8,passed,success,universal,8192,36864,9216,f16:column,f16:row,f16:column,f16:column,1,0,serial,1,1,heuristic,tensorop,f16,128,128,32,1,1,1,4,2,2,1,16,8,16,80,1024,1434451968,5566881595392,3880,20.4645,65.2806,272026
1,CUTLASS,gemm,cutlass_tensorop_h16816gemm_128x128_32x4_nt_align4,passed,success,universal,8192,36864,9216,f16:column,f16:row,f16:column,f16:column,1,0,serial,1,1,heuristic,tensorop,f16,128,128,32,1,1,1,4,2,2,1,16,8,16,80,1024,1434451968,5566881595392,3880,20.953,63.7588,265685
1,CUTLASS,gemm,cutlass_tensorop_h16816gemm_128x128_32x4_nt_align2,passed,success,universal,8192,36864,9216,f16:column,f16:row,f16:column,f16:column,1,0,serial,1,1,heuristic,tensorop,f16,128,128,32,1,1,1,4,2,2,1,16,8,16,80,1024,1434451968,5566881595392,3880,21.4532,62.2721,259489
1,CUTLASS,gemm,cutlass_tensorop_h16816gemm_128x128_32x5_nt_align8,passed,success,universal,8192,36864,9216,f16:column,f16:row,f16:column,f16:column,1,0,serial,1,1,heuristic,tensorop,f16,128,128,32,1,1,1,5,2,2,1,16,8,16,80,1024,1434451968,5566881595392,3880,20.4169,65.4329,272660
1,CUTLASS,gemm,cutlass_tensorop_h16816gemm_128x128_32x5_nt_align4,passed,success,universal,8192,36864,9216,f16:column,f16:row,f16:column,f16:column,1,0,serial,1,1,heuristic,tensorop,f16,128,128,32,1,1,1,5,2,2,1,16,8,16,80,1024,1434451968,5566881595392,3880,21.0588,63.4386,264350
1,CUTLASS,gemm,cutlass_tensorop_h16816gemm_128x128_32x5_nt_align2,passed,success,universal,8192,36864,9216,f16:column,f16:row,f16:column,f16:column,1,0,serial,1,1,heuristic,tensorop,f16,128,128,32,1,1,1,5,2,2,1,16,8,16,80,1024,1434451968,5566881595392,3880,21.4481,62.287,259551
1,CUTLASS,gemm,cutlass_tensorop_h16816gemm_128x64_32x6_nt_align8,passed,success,universal,8192,36864,9216,f16:column,f16:row,f16:column,f16:column,1,0,serial,1,1,heuristic,tensorop,f16,128,64,32,1,1,1,6,2,2,1,16,8,16,80,1024,1434451968,5566881595392,3880,31.4608,42.4636,176947
1,CUTLASS,gemm,cutlass_tensorop_h16816gemm_128x64_32x6_nt_align4,passed,success,universal,8192,36864,9216,f16:column,f16:row,f16:column,f16:column,1,0,serial,1,1,heuristic,tensorop,f16,128,64,32,1,1,1,6,2,2,1,16,8,16,80,1024,1434451968,5566881595392,3880,31.6068,42.2674,176129
1,CUTLASS,gemm,cutlass_tensorop_h16816gemm_128x64_32x6_nt_align2,passed,success,universal,8192,36864,9216,f16:column,f16:row,f16:column,f16:column,1,0,serial,1,1,heuristic,tensorop,f16,128,64,32,1,1,1,6,2,2,1,16,8,16,80,1024,1434451968,5566881595392,3880,32.3718,41.2685,171967
1,CUTLASS,gemm,cutlass_tensorop_h16816gemm_64x128_32x6_nt_align8,passed,success,universal,8192,36864,9216,f16:column,f16:row,f16:column,f16:column,1,0,serial,1,1,heuristic,tensorop,f16,64,128,32,1,1,1,6,2,2,1,16,8,16,80,1024,1434451968,5566881595392,3880,28.4309,46.9889,195804
1,CUTLASS,gemm,cutlass_tensorop_h16816gemm_64x128_32x6_nt_align4,passed,success,universal,8192,36864,9216,f16:column,f16:row,f16:column,f16:column,1,0,serial,1,1,heuristic,tensorop,f16,64,128,32,1,1,1,6,2,2,1,16,8,16,80,1024,1434451968,5566881595392,3880,28.7677,46.4387,193511
1,CUTLASS,gemm,cutlass_tensorop_h16816gemm_64x128_32x6_nt_align2,passed,success,universal,8192,36864,9216,f16:column,f16:row,f16:column,f16:column,1,0,serial,1,1,heuristic,tensorop,f16,64,128,32,1,1,1,6,2,2,1,16,8,16,80,1024,1434451968,5566881595392,3880,29.6164,45.108,187966
1,CUTLASS,gemm,cutlass_tensorop_h16816gemm_64x64_32x10_nt_align8,passed,success,universal,8192,36864,9216,f16:column,f16:row,f16:column,f16:column,1,0,serial,1,1,heuristic,tensorop,f16,64,64,32,1,1,1,10,2,2,1,16,8,16,80,1024,1434451968,5566881595392,3880,40.15,33.2736,138652
1,CUTLASS,gemm,cutlass_tensorop_h16816gemm_64x64_32x10_nt_align4,passed,success,universal,8192,36864,9216,f16:column,f16:row,f16:column,f16:column,1,0,serial,1,1,heuristic,tensorop,f16,64,64,32,1,1,1,10,2,2,1,16,8,16,80,1024,1434451968,5566881595392,3880,40.3838,33.081,137849
1,CUTLASS,gemm,cutlass_tensorop_h16816gemm_64x64_32x10_nt_align2,passed,success,universal,8192,36864,9216,f16:column,f16:row,f16:column,f16:column,1,0,serial,1,1,heuristic,tensorop,f16,64,64,32,1,1,1,10,2,2,1,16,8,16,80,1024,1434451968,5566881595392,3880,41.0857,32.5158,135494
1,CUTLASS,gemm,cutlass_tensorop_h16816gemm_128x128_64x3_nt_align8,passed,success,universal,8192,36864,9216,f16:column,f16:row,f16:column,f16:column,1,0,serial,1,1,heuristic,tensorop,f16,128,128,64,1,1,1,3,2,2,1,16,8,16,80,1024,1434451968,5566881595392,3880,20.4858,65.2127,271743
1,CUTLASS,gemm,cutlass_tensorop_h16816gemm_128x128_64x3_nt_align4,passed,success,universal,8192,36864,9216,f16:column,f16:row,f16:column,f16:column,1,0,serial,1,1,heuristic,tensorop,f16,128,128,64,1,1,1,3,2,2,1,16,8,16,80,1024,1434451968,5566881595392,3880,21.1023,63.3077,263805
1,CUTLASS,gemm,cutlass_tensorop_h16816gemm_128x128_64x3_nt_align2,passed,success,universal,8192,36864,9216,f16:column,f16:row,f16:column,f16:column,1,0,serial,1,1,heuristic,tensorop,f16,128,128,64,1,1,1,3,2,2,1,16,8,16,80,1024,1434451968,5566881595392,3880,21.8907,61.0277,254304
1,CUTLASS,gemm,cutlass_tensorop_h16816gemm_128x64_64x3_nt_align8,passed,success,universal,8192,36864,9216,f16:column,f16:row,f16:column,f16:column,1,0,serial,1,1,heuristic,tensorop,f16,128,64,64,1,1,1,3,2,2,1,16,8,16,80,1024,1434451968,5566881595392,3880,31.5741,42.3111,176311
1,CUTLASS,gemm,cutlass_tensorop_h16816gemm_128x64_64x3_nt_align4,passed,success,universal,8192,36864,9216,f16:column,f16:row,f16:column,f16:column,1,0,serial,1,1,heuristic,tensorop,f16,128,64,64,1,1,1,3,2,2,1,16,8,16,80,1024,1434451968,5566881595392,3880,31.7227,42.113,175486
1,CUTLASS,gemm,cutlass_tensorop_h16816gemm_128x64_64x3_nt_align2,passed,success,universal,8192,36864,9216,f16:column,f16:row,f16:column,f16:column,1,0,serial,1,1,heuristic,tensorop,f16,128,64,64,1,1,1,3,2,2,1,16,8,16,80,1024,1434451968,5566881595392,3880,32.8192,40.706,169623
1,CUTLASS,gemm,cutlass_tensorop_h16816gemm_64x128_64x3_nt_align8,passed,success,universal,8192,36864,9216,f16:column,f16:row,f16:column,f16:column,1,0,serial,1,1,heuristic,tensorop,f16,64,128,64,1,1,1,3,2,2,1,16,8,16,80,1024,1434451968,5566881595392,3880,28.4707,46.9233,195530
